title,link,content,summary_lexrank,summary_luhn,summary_lsa,summary_textrank
QSR stocks: Devyani up 9% despite wider Q3 loss; Westlife Foodworld jumps 11% post-Dec quarter results; here's why,https://www.moneycontrol.com/news/business/markets/qsr-stocks-devyani-up-9-despite-wider-q3-loss-westlife-foodworld-jumps-11-post-dec-quarter-results-here-s-why-13812394.html,"The shares of quick service restaurants (QSR) companies Devyani International and Westlife FoodWorld rallied in trade on February 5 after the companies announced their earnings for the October-December quarter of the ongoing financial year 2026. Devyani International, which operates KFC and Pizza Hut outlets in India, saw its shares rally around 9 percent to a three-week high of Rs 133.84 apiece on Thursday. The shares of Westlife FoodWorld, which operates McDonald's franchisees in India, rallied nearly 11 percent to Rs 528.90 apiece. Devyani International Q3 Results: Devyani International on February 4 reported a consolidated net loss of Rs 10.39 crore for Q3 FY26, as compared to a net loss of Rs 49.20 lakh in the same quarter of the previous financial year. The firm’s net loss however narrowed sequentially from the Rs 21.9 crore reported in Q2 FY26. The company’s revenue from operations rose more than 11 percent to Rs 1,440.9 crore during the quarter under review. Devyani International reported 95 net new store additions in the quarter, with 54 net additions to KFC India and 18 net additions to Pizza Hut. “We have also started the process of turnaround of the Pizza Hut business by rationalizing loss-making stores. Our idea is to bring a sharper focus to this exercise and therefore we will open new stores only to compensate for the closure of loss-making stores. This will also help us to utilize the existing assets and equipment in our new stores and bring down the capex for the new openings as well,” said Devyani International Non-Executive Chairman Ravi Jaipuria. “DIL is at a critical inflection point in its growth journey, as we prepare to scale into a larger, more diversified and more complex organization. The Board believes that this next phase requires a bold strategic vision, backed by strong execution capability. Accordingly, Manish Dawar shall get elevated as President and CEO for DIL with effect from April 1, 2026,” he added. The company had announced the results in the market hours of Wednesday. The stock had jumped more than 6 percent yesterday, and is extending gains today. JPMorgan remained ‘overweight’ on the stock, with a target price of Rs 155 apiece. It said that the firm’s EBITDA beat estimates on better margins. It added that same-store sales trends improved sequentially, turning positive in January for most formats. Goldman Sachs kept a ‘Buy’ call on the stock, with a target price of Rs 160 apiece. The international brokerage flagged positive January same-store sales but said it is ""too early"" to call it a sustained recovery. UBS kept a ‘Buy’ call on the stock, with a target price of Rs 170 apiece. The international brokerage sees an ""emerging turnaround"" for the company, helped by pricing, promotions and product interventions. It added that improving profitability in KFC and a rationalised Pizza Hut network could aid growth. Westlife FoodWorld Q3 Results: Westlife FoodWorld on February 5 reported a consolidated net profit of Rs 1.02 crore for the October-December quarter of the ongoing financial year 2026. This marks an 85 percent YoY fall from the Rs 7.01 crore net profit reported in the same period of the previous financial year. The earnings were however impacted by a one-time exceptional cost of Rs 9.69 crore arising out of the new labour codes which took effect last year. “Amidst an ongoing challenging operating environment, the company prioritized driving affordability through its value platform while maintaining strict execution discipline. Westlife reported revenue of ₹6.71 billion for Q3 FY26, at the back of recovering guest counts. Same Store Sales Growth (SSSG) was at -3.2% for the quarter. However, positive momentum carried into January, with positive SSSG driven by a mid-single digit increase in guest counts,” the firm said. Brokerage BOB Capital Markets says WEST is at early stages of a guest-count-led recovery, driven by sharper everyday value proposition and improved dine-in execution. Macquarie said that the company saw positive same-store-sales growth on a mild single-digit drop in guest counts in January as it focused on affordability and product innovations. JPMorgan meanwhile noted that McDelivery platform has seen strong growth supported by customer acquisition and growth investments, seeing significant traction in December and January. Follow all LIVE updates from Q3 Results here.",Macquarie said that the company saw positive same-store-sales growth on a mild single-digit drop in guest counts in January as it focused on affordability and product innovations.,"Devyani International Q3 Results: Devyani International on February 4 reported a consolidated net loss of Rs 10.39 crore for Q3 FY26, as compared to a net loss of Rs 49.20 lakh in the same quarter of the previous financial year.","Devyani International, which operates KFC and Pizza Hut outlets in India, saw its shares rally around 9 percent to a three-week high of Rs 133.84 apiece on Thursday.","Devyani International Q3 Results: Devyani International on February 4 reported a consolidated net loss of Rs 10.39 crore for Q3 FY26, as compared to a net loss of Rs 49.20 lakh in the same quarter of the previous financial year."
"Trent shares up 2% on rise in Q3 net profit; brokerages remain mixed, say 'SSSG growth pressure may persist'",https://www.moneycontrol.com/news/business/markets/trent-shares-up-2-on-rise-in-q3-net-profit-brokerages-remain-mixed-say-sssg-growth-pressure-may-persist-13812262.html,"Trent shares traded higher on Thursday after the Tata Group retail firm reported a rise in consolidated net profit for the December quarter of FY26, even as brokerages remained mixed on the outlook, flagging pressure on same-store sales (SSSG) growth. The company posted a 2.73 percent increase in consolidated net profit at Rs 510.11 crore for the October-December quarter, compared with Rs 496.54 crore in the year-ago period. The modest growth came amid improved demand following tax cuts, partly offset by a one-time labour-related charge. Trent reported an exceptional item (net loss) of Rs 26.11 crore during the quarter due to the implementation of new Labour Codes. Shares of Trent were trading at Rs 4,099.10 pe share on the NSE, up 2.16 percent, around 11:20 am. Revenue from operations rose 14.78 percent to Rs 5,345.06 crore in the December quarter, from Rs 4,656.56 crore a year earlier, the company said. ""The gross margin profile of Westside and Zudio remains stable. Operating EBIT margin for Q3FY26 was 13.8 percent, compared with 13.2 percent in Q3FY25,"" Trent said. During the quarter, the company opened 17 Westside and 48 Zudio stores, taking the total store count to 278 Westside and 854 Zudio outlets as of December 31, 2025. This includes four Zudio stores in the UAE. Trent also operates 32 stores across other lifestyle concepts. As of December 31, the company had a presence across 274 cities, with a footprint of over 15 million square feet and a portfolio of more than 1,100 large-format fashion stores. Brokerages maintained a mixed stance on the stock. Bernstein, which has an ‘Outperform’ rating with a price target of Rs 5,000, said Trent’s growth rebound is still unfolding, with store additions, rather than like-for-like sales, expected to drive performance in the coming quarters. HSBC retained a ‘Buy’ rating with a target price of Rs 5,300, citing expected margin gains by FY27 led by sourcing efficiencies and cost optimisation. Kotak, however, maintained a ‘Reduce’ rating with a fair value of Rs 3,850, warning that pressure on same-store sales growth may persist through FY26 due to soft demand and higher costs. It expects only moderate revenue growth into FY27. Commenting on the results, Chairman Noel N Tata said the fashion business registered category-leading growth during the quarter. ""Customer sentiment is gradually improving and our business outlook for the medium term continues to remain positive. Our focus remains on portfolio growth, improving products and enhancing store experience,"" he said. He added that the company remains committed to strengthening its direct-to-customer business across segments, supported by its focus on relevance and resilience in its business model. Disclaimer: The views and investment tips expressed by investment experts on Moneycontrol.com are their own and not those of the website or its management. Moneycontrol.com advises users to check with certified experts before taking any investment decisions.","Trent shares traded higher on Thursday after the Tata Group retail firm reported a rise in consolidated net profit for the December quarter of FY26, even as brokerages remained mixed on the outlook, flagging pressure on same-store sales (SSSG) growth.","Trent shares traded higher on Thursday after the Tata Group retail firm reported a rise in consolidated net profit for the December quarter of FY26, even as brokerages remained mixed on the outlook, flagging pressure on same-store sales (SSSG) growth.","The modest growth came amid improved demand following tax cuts, partly offset by a one-time labour-related charge.","Trent shares traded higher on Thursday after the Tata Group retail firm reported a rise in consolidated net profit for the December quarter of FY26, even as brokerages remained mixed on the outlook, flagging pressure on same-store sales (SSSG) growth."
"Hindustan Zinc, Vedanta, NALCO, other metal stocks tumble up to 7%: Here are 3 reasons",https://www.moneycontrol.com/news/business/markets/hindustan-zinc-vedanta-nalco-other-metal-stocks-tumble-up-to-7-here-are-3-reasons-13812241.html,"The shares of metal companies sharply dropped in trade on February 5, emerging as the top losers on the market today. Profit booking and fall in precious metals were among the key reasons behind the downturn. The Nifty Metal index fell nearly 3 percent to 11,726 in the early trading hours of Thursday, snapping a three-day gaining streak. Metal stocks plunge: Hindustan Zinc shares dropped around 7 percent to Rs 593.25 apiece, falling below of Rs 600-mark after two days. The shares of the largest producer of silver in India snapped a three-session gaining streak. Vedanta shares fell nearly 5 percent, while National Aluminium Company (NALCO) shares fell around 4 percent, as seen at 9.45 am. Hindustan Copper and Hindalco Industries shares dropped nearly 3 percent each, while NMDC and Lloyds Metals And Energy shares fell around 2 percent each. Steel Authority of India (SAIL) and Tata Steel shares fell more than 1 percent each, while JSW Steel and Adani Enterprises shares fell around 1 percent each. Jindal Steel, APL Apollo Tubes and Jindal Stainless Steel shares were down in the red with marginal losses, while Welspun Corp shares bucked the trend to trade in the green with marginal gains. Here are key factors behind the downturn in metal stocks today: Profit-booking: The sharp fall in metal stocks comes as investors may have resorted to profit booking at elevated levels. The Nifty Metal index gained more than 6 percent in the past three sessions to close at 12,044.25 yesterday. Stronger dollar: The US dollar remained steady ahead of interest rate decisions from the European Central Bank and the Bank of England. The U.S. dollar index, which measures the greenback's strength against a basket of six currencies, was up 0.2% at 96.671, having traded near a two-week high earlier. The dollar has gained some strength this week as financial markets assess U.S. corporate earnings season, now halfway complete, and stocks turn risk-off. A stronger dollar makes commodities like metals, which are priced in dollars, more expensive. As a result, the metal companies see some pressure on demand, and thereby on prices. Fall in precious metals: Gold futures with April expiry fell around 3 percent to Rs 1,48,455 per 10 grams on Thursday. The contracts with June expiry also fell around 3 percent. Silver futures with March expiry dropped 6 percent to Rs 2,52,719 per kilogram. The contracts with May expiry also fell 6 percent. Several of the metal companies like Hindustan Zinc and others are producers of these commodities. Hence, the fall in the prices of these precious metals will likely impact the stocks. Follow all LIVE updates from the stock markets here.","Fall in precious metals: Gold futures with April expiry fell around 3 percent to Rs 1,48,455 per 10 grams on Thursday.",Here are key factors behind the downturn in metal stocks today: Profit-booking: The sharp fall in metal stocks comes as investors may have resorted to profit booking at elevated levels.,"The dollar has gained some strength this week as financial markets assess U.S. corporate earnings season, now halfway complete, and stocks turn risk-off.","Jindal Steel, APL Apollo Tubes and Jindal Stainless Steel shares were down in the red with marginal losses, while Welspun Corp shares bucked the trend to trade in the green with marginal gains."
Silver ETFs drop up to 18% as white metal's futures drop 11% on MCX; gold ETFs down 5%,https://www.moneycontrol.com/news/business/markets/silver-etfs-drop-up-to-16-as-white-metal-s-futures-drop-6-on-mcx-gold-etfs-down-5-13812159.html,"Gold and silver exchange traded funds (ETF) dropped in trade on February 5 as precious metals lost steam. This came after gold and silver prices were rebounding for the last two sessions following a sharp slump earlier. Silver saw a sharper fall today, with its ETFs crashing up to 16 percent in the early trading hours of Thursday. Gold and silver prices drop: Gold futures with April expiry fell around 3 percent to Rs 1,48,455 per 10 grams on Thursday. The contracts with June expiry also fell around 3 percent. Silver futures with March expiry dropped 11 percent to Rs 2,39,000 per kilogram. The contracts with May expiry also fell 11 percent. Gold and silver ETFs crash: Mirroring the sharp fall in precious metals, gold and silver ETFs dropped in trade. Kotak Silver ETF crashed around 18 percent to Rs 228.56 apiece, while Edelweiss Silver ETF fell more than 15 percent. 360 One Silver ETF, Mirae Asset Silver ETF, UTI Silver ETF, Axis Silver ETF, ICICI Prudential Silver ETF, HDFC Silver ETF and others fell around 12-14 percent each. Among the gold ETFs, Motilal Oswal Gold ETF declined around 5.5 percent. Edelweiss Gold ETF, Choice Gold ETF, Axis MF Gold ETF, DSP Gold ETF, ICICI Prudential Gold ETF, 360 One Gold ETF, SBI Gold ETF and few others fell around 5 percent each. What lies ahead? Today's fall may have been driven by profit booking after two days of gains. Markets are now focused on US ADP non-farm payrolls data and final services PMI readings from major global economies, said Kaynat Chainwala, AVP Commodity Research, Kotak Securities. However, the analyst added that the primary focus remains on Friday’s official US jobs report for signals on the timing of the next Federal Reserve rate cut. “CME FedWatch currently shows no easing priced in until May, with June reflecting just a 44.1% probability of a 25bp cut versus a 44.9% chance of rates being held unchanged,” Chairwala said. The ""flash crash"" in gold and silver, triggered by a hawkish US Fed nominee and increased margin requirements, is viewed by many as a necessary cooling of ""overbought"" markets rather than a trend reversal, said Abhinav Tiwari, Research Analyst at Bonanza. He however noted that the long-term outlook remains structurally bullish, despite the volatility. “Record central bank buying, silver’s persistent supply deficit, and geopolitical tensions provide a solid floor,” he said. “We have maintained a cautious stance on silver following its parabolic move and have suggested trimming overallocation to precious metals to realign portfolios with long-term strategic allocation levels. While it is prudent to wait for further information and trend confirmation, we currently prefer gold from a relative risk-reward perspective,” said Siddharth Srivastava, Head - ETF Product & Fund Manager, Mirae Asset Investment Mangers (India). Follow all LIVE updates from the stock markets here.","Gold and silver prices drop: Gold futures with April expiry fell around 3 percent to Rs 1,48,455 per 10 grams on Thursday.","360 One Silver ETF, Mirae Asset Silver ETF, UTI Silver ETF, Axis Silver ETF, ICICI Prudential Silver ETF, HDFC Silver ETF and others fell around 12-14 percent each.","While it is prudent to wait for further information and trend confirmation, we currently prefer gold from a relative risk-reward perspective,” said Siddharth Srivastava, Head - ETF Product & Fund Manager, Mirae Asset Investment Mangers (India).","Edelweiss Gold ETF, Choice Gold ETF, Axis MF Gold ETF, DSP Gold ETF, ICICI Prudential Gold ETF, 360 One Gold ETF, SBI Gold ETF and few others fell around 5 percent each."
"Trade Spotlight: How should you trade Hero MotoCorp, Sarda Energy, Max Financial Services, Hindalco, Larsen & Toubro, and others on February 5?",https://www.moneycontrol.com/news/business/markets/trade-spotlight-how-should-you-trade-hero-motocorp-sarda-energy-max-financial-services-hindalco-larsen-toubro-and-others-on-february-5-13811703.html,"Equity benchmarks extended their uptrend for the third consecutive session, with the Nifty 50 rising 0.2 percent amid healthy market breadth on February 5. A total of 2,012 shares saw buying interest compared to 911 shares that were backed by bears. Consolidation with range-bound trading may continue over the next couple of sessions. Below are some short-term trading ideas to consider: Nilesh Jain, VP- Equity Technical & Derivative Research at Centrum Broking Hero MotoCorp | CMP: Rs 5,851.5 Hero MotoCorp has broken out of a falling channel on the daily chart and has also decisively moved above its 50-DMA at Rs 5,836. With this breakout, it is now trading well above both its short-term and long-term moving averages, indicating sustained strength. From a derivatives perspective, the addition of fresh long positions, with open interest rising by around 6 percent, further reinforces the positive bias. Considering the overall technical setup, a conservative upside target is placed near the Rs 6,300 level in the near term, while crucial support is seen at Rs 5,670. Strategy: Buy Target: Rs 6,300 Stop-Loss: Rs 5,670 Sarda Energy & Minerals | CMP: Rs 521.35 Sarda Energy has registered a fresh breakout from a descending triangle pattern on the daily chart. The sharp price up-move is accompanied by a notable surge in volumes, which validates the bullish breakout. Earlier, the stock had formed a double-bottom pattern near the Rs 455 level and witnessed a strong rebound from that base. Momentum indicators are also aligned with the positive bias, as the RSI has moved above the 60 mark and the MACD has generated a bullish crossover, signalling improving upside momentum. Overall, the technical structure indicates that the stock is well positioned to move toward the Rs 555 level in the near term, while immediate support at the 200-DMA is placed near Rs 499. Strategy: Buy Target: Rs 555 Stop-Loss: Rs 499 CCL Products | CMP: Rs 1,002.85 CCL Products (India) has witnessed a strong breakout from an inverted head-and-shoulders pattern on the daily chart. The move is backed by higher-than-average volumes, lending credibility to the breakout and highlighting strong buying interest. Additionally, the stock is trading firmly above all its short-term moving averages, which reinforces the bullish momentum. Based on the pattern projection, the potential upside target is placed around the Rs 1,075 level, while the neckline near Rs 961 is likely to act as an important support zone on any pullback. Strategy: Buy Target: Rs 1,075 Stop-Loss: Rs 961 Sudeep Shah, Head - Technical and Derivatives Research at SBI Securities Steel Authority of India | CMP: Rs 157.29 SAIL has staged a strong rebound from its 50-day EMA, reinforcing the prevailing uptrend. On the daily chart, the stock continues to form a higher top–higher bottom structure, signalling sustained bullishness. The RSI has bounced from 53 to 62, reflecting improving momentum. The DI+ crossover above DI- on the ADX indicator highlights strengthening trend support. With prices holding near the upper Bollinger Band, the stock appears well positioned to extend its upward move in the near term. Hence, we recommend accumulating the stock in the zone of Rs 158–156 with a stop-loss at Rs 152. On the upside, it is likely to test the Rs 168 level in the short term. Strategy: Buy Target: Rs 168 Stop-Loss: Rs 152 Max Financial Services | CMP: Rs 1,708.2 Max Financial Services has rebounded sharply from its key upward-sloping trendline support, drawn by connecting the lows of Rs 1,451 and Rs 1,502 formed on August 4 and October 27, 2025, respectively. The stock now trades above its key short- and long-term moving averages. The RSI has surged from 31 to 60 in just seven sessions, signalling strong bullish momentum. The DI+ crossover above DI- on the ADX indicates bulls gaining control, while the MACD has crossed above its signal line, supporting further upside potential. Hence, we recommend accumulating the stock in the zone of Rs 1,715–1,705 with a stop-loss at Rs 1,660. On the upside, it is likely to test the Rs 1,830 level in the short term. Strategy: Buy Target: Rs 1,830 Stop-Loss: Rs 1,660 Larsen & Toubro | CMP: Rs 4,087.1 Larsen & Toubro has staged a strong rebound from its 200-day EMA on the daily chart, signalling a shift in trend. The RSI has recovered sharply from an oversold level of 24 to 61, indicating strengthening bullish momentum. Rising MACD histogram bars further support the positive bias. The Infra index has moved from the lagging to the improving quadrant on the Relative Rotation Graph (RRG), highlighting improving sector-wide momentum, with L&T leading the move. Strong price action and sectoral momentum suggest the stock is well placed to extend its uptrend. Hence, we recommend accumulating the stock in the zone of Rs 4,090–4,050 with a stop-loss at Rs 3,920. On the upside, it is likely to test the Rs 4,400 level in the short term. Strategy: Buy Target: Rs 4,400 Stop-Loss: Rs 3,920 Rupak De, Senior Technical Analyst at LKP Securities Hindalco Industries | CMP: Rs 965 Hindalco Industries has been sustaining above the 20 EMA after a brief corrective move. On the hourly chart, it has witnessed a consolidation breakout, indicating improving optimism. The hourly RSI is in a bullish crossover, pointing to positive momentum. On the upside, the stock may move towards Rs 1,020. On the downside, immediate support is placed at Rs 939; a breach below this level could weaken the trend. Strategy: Buy Target: Rs 1,020 Stop-Loss: Rs 939 Mahindra and Mahindra Financial Services | CMP: Rs 370 Mahindra & Mahindra Financial Services has formed a piercing line pattern on the daily chart, indicating the possibility of a bullish reversal. It continues to sustain above the 50 EMA on the daily timeframe. The RSI is in a bullish crossover and is trending higher, reflecting strengthening momentum. On the upside, the stock may move towards the Rs 385–400 zone. On the downside, support is placed at Rs 358; a break below this level could weaken the trend. Strategy: Buy Target: Rs 385, Rs 400 Stop-Loss: Rs 358 Caplin Point Laboratories | CMP: Rs 1,909.5 Caplin Point Laboratories has undergone a healthy consolidation on the daily chart, suggesting rising optimism. Additionally, it has been sustaining above the 20 EMA. The RSI is in a bullish crossover and continues to rise, indicating positive momentum. On the upside, the stock may head towards the Rs 1,970–2,000 zone. On the downside, support is placed at Rs 1,875; a break below this level could weaken the trend. Strategy: Buy Target: Rs 1,970, Rs 2,000 Stop-Loss: Rs 1,875","Overall, the technical structure indicates that the stock is well positioned to move toward the Rs 555 level in the near term, while immediate support at the 200-DMA is placed near Rs 499.","Strategy: Buy Target: Rs 1,020 Stop-Loss: Rs 939 Mahindra and Mahindra Financial Services | CMP: Rs 370 Mahindra & Mahindra Financial Services has formed a piercing line pattern on the daily chart, indicating the possibility of a bullish reversal.","With this breakout, it is now trading well above both its short-term and long-term moving averages, indicating sustained strength.","Overall, the technical structure indicates that the stock is well positioned to move toward the Rs 555 level in the near term, while immediate support at the 200-DMA is placed near Rs 499."
