title,link,content
Interglobe Aviation shares fall 2.02% in today's trading,https://www.moneycontrol.com/news/business/stocks/interglobe-aviation-shares-fall-2-02-in-today-s-trading-alpha-article-13583292.html,"Shares of Interglobe Aviation declined by 2.02% to Rs 5,560.00 in Friday afternoon trade. The stock is a constituent of the Nifty Next 50 index. Financial Highlights: Interglobe Aviation's financial performance shows the following trends based on consolidated results: Quarterly Results:HeadingJun 2025Mar 2025Dec 2024Sep 2024Jun 2024RevenueRs 20,496.30 CroreRs 22,151.90 CroreRs 22,110.70 CroreRs 16,969.60 CroreRs 19,570.70 CroreNet ProfitRs 2,176.30 CroreRs 3,067.50 CroreRs 2,448.80 Crore-Rs 986.70 CroreRs 2,728.80 CroreEPS56.3179.3863.38-25.5570.70The company's revenue for the quarter-ending June 2025 was Rs 20,496.30 Crore, compared to Rs 22,151.90 Crore for the quarter-ending March 2025. Net profit for the quarter-ending June 2025 was Rs 2,176.30 Crore, while in the quarter-ending March 2025, it was Rs 3,067.50 Crore. Annual Results:HeadingMar 2025Mar 2024Mar 2023Mar 2022Mar 2021RevenueRs 80,802.90 CroreRs 68,904.34 CroreRs 54,446.45 CroreRs 25,930.93 CroreRs 14,640.63 CroreNet ProfitRs 7,258.40 CroreRs 8,172.47 Crore-Rs 305.79 Crore-Rs 6,161.85 Crore-Rs 5,806.43 CroreEPS187.93211.84-7.93-160.01-150.89BVPS242.4551.72-162.17-155.582.73ROE77.47409.350.000.00-5,530.98Debt to Equity0.190.95-0.36-0.6523.87The annual revenue for the year-ending March 2025 increased to Rs 80,802.90 Crore from Rs 68,904.34 Crore in the year-ending March 2024. The net profit decreased to Rs 7,258.40 Crore for the year-ending March 2025, compared to Rs 8,172.47 Crore for the year-ending March 2024. Annual Income Statement:Mar 2025Mar 2024Mar 2023Mar 2022Mar 2021SalesRs 80,802 CroreRs 68,904 CroreRs 54,446 CroreRs 25,930 CroreRs 14,640 CroreOther IncomeRs 3,295 CroreRs 2,326 CroreRs 1,434 CroreRs 725 CroreRs 1,036 CroreTotal IncomeRs 84,098 CroreRs 71,231 CroreRs 55,881 CroreRs 26,656 CroreRs 15,677 CroreTotal ExpenditureRs 71,424 CroreRs 59,012 CroreRs 53,054 CroreRs 30,452 CroreRs 19,353 CroreEBITRs 12,673 CroreRs 12,218 CroreRs 2,827 Crore-Rs 3,795 Crore-Rs 3,676 CroreInterestRs 5,080 CroreRs 4,169 CroreRs 3,131 CroreRs 2,358 CroreRs 2,141 CroreTaxRs 335 Crore-Rs 123 CroreRs 1 CroreRs 8 Crore-Rs 11 CroreNet ProfitRs 7,258 CroreRs 8,172 Crore-Rs 305 Crore-Rs 6,161 Crore-Rs 5,806 CroreCash Flow:Mar 2025Mar 2024Mar 2023Mar 2022Mar 2021Operating ActivitiesRs 24,151 CroreRs 21,217 CroreRs 12,727 CroreRs 2,090 Crore-Rs 1,614 CroreInvesting Activities-Rs 12,759 Crore-Rs 11,808 Crore-Rs 4,059 CroreRs 1,502 CroreRs 3,197 CroreFinancing Activities-Rs 11,015 Crore-Rs 9,978 Crore-Rs 8,432 Crore-Rs 3,087 Crore-Rs 1,775 CroreOthersRs 1 Crore-Rs 2 CroreRs 16 CroreRs 1 Crore-Rs 17 CroreNet Cash FlowRs 377 Crore-Rs 572 CroreRs 252 CroreRs 506 Crore-Rs 210 CroreBalance Sheet:Mar 2025Mar 2024Mar 2023Mar 2022Mar 2021Share CapitalRs 386 CroreRs 385 CroreRs 385 CroreRs 385 CroreRs 384 CroreReserves & SurplusRs 8,981 CroreRs 1,610 Crore-Rs 6,686 Crore-Rs 6,427 Crore-Rs 314 CroreCurrent LiabilitiesRs 34,217 CroreRs 30,798 CroreRs 23,851 CroreRs 22,417 CroreRs 18,923 CroreOther LiabilitiesRs 72,257 CroreRs 49,429 CroreRs 41,619 CroreRs 29,587 CroreRs 24,057 CroreTotal LiabilitiesRs 115,843 CroreRs 82,224 CroreRs 59,169 CroreRs 45,962 CroreRs 43,051 CroreFixed AssetsRs 51,784 CroreRs 36,155 CroreRs 27,679 CroreRs 21,409 CroreRs 18,888 CroreCurrent AssetsRs 50,703 CroreRs 35,853 CroreRs 26,148 CroreRs 20,228 CroreRs 20,813 CroreOther AssetsRs 13,355 CroreRs 10,216 CroreRs 5,341 CroreRs 4,324 CroreRs 3,348 CroreTotal AssetsRs 115,843 CroreRs 82,224 CroreRs 59,169 CroreRs 45,962 CroreRs 43,051 CroreContingent LiabilitiesRs 645,685 CroreRs 615,201 CroreRs 309,451 CroreRs 296,714 CroreRs 293,933 CroreKey Financial Ratios:RatioMar 2025Mar 2024Mar 2023Mar 2022Mar 2021Basic EPS (Rs.)187.93211.84-7.93-160.01-150.89Diluted EPS (Rs.)187.67211.61-7.93-160.01-150.89Book Value /Share (Rs.)242.4551.72-162.17-155.582.73Dividend/Share (Rs.)10.000.000.000.000.00Face Value1010101010Gross Profit Margin (%)26.4227.0514.564.906.98Operating Margin (%)15.6817.735.19-14.63-25.10Net Profit Margin (%)8.9811.86-0.56-23.76-39.65Return on Networth / Equity (%)77.47409.350.000.00-5,530.98ROCE (%)15.5223.758.00-16.12-15.23Return On Assets (%)6.269.93-0.51-13.40-13.48Current Ratio (X)1.481.161.100.901.10Quick Ratio (X)1.461.141.070.881.08Debt to Equity (x)0.190.95-0.36-0.6523.87Interest Coverage Ratios (X)4.204.472.530.54-1.72Asset Turnover Ratio (%)0.820.971.040.5834.00Inventory Turnover Ratio (X)111.830.000.000.0046.273 Yr CAGR Sales (%)76.52116.9423.40-4.61-20.253 Yr CAGR Net Profit (%)8.5318.6414.39525.9860.92P/E (x)27.2216.75-240.94-12.59-10.82P/B (x)21.0968.53-11.79-12.94599.54EV/EBITDA (x)8.456.548.0956.0552.97P/S (x)2.451.991.352.994.30Interglobe Aviation announced the appointment of Mr. Amitabh Kant as Non-Executive Director of the company with effect from September 15, 2025. The company announced a final dividend of Rs 10 per share (100%) with effective date August 13, 2025. Moneycontrol analysis indicated a bearish sentiment on the stock as of September 19, 2025. With the stock's last traded price at Rs 5,560.00, Interglobe Aviation has seen a decline of 2.02%."
SJVN share price falls 2.04%; stock among top losers on Nifty Midcap 150,https://www.moneycontrol.com/news/business/stocks/sjvn-share-price-falls-2-04-stock-among-top-losers-on-nifty-midcap-150-alpha-article-13583234.html,"Shares of SJVN declined by 2.04% to Rs 90.12 in Friday's session, and was among the top losers on Nifty Midcap 150. SJVN is included as one of the stocks in the benchmark Nifty Midcap 150 index. Financial Snapshot: SJVN’s financial performance highlights a mix of quarterly and annual results. The consolidated revenue for the quarter-ending June 2025 stood at Rs 917.45 Crore, up from Rs 504.40 Crore in March 2025. The net profit for the same quarter was Rs 236.89 Crore compared to a loss of Rs -130.36 Crore in the previous quarter. Quarterly Financials (Consolidated):HeadingJun 2024Sep 2024Dec 2024Mar 2025Jun 2025RevenueRs 870.37 CroreRs 1,026.25 CroreRs 670.99 CroreRs 504.40 CroreRs 917.45 CroreNet ProfitRs 356.19 CroreRs 438.88 CroreRs 147.61 Crore-Rs 130.36 CroreRs 236.89 CroreEPS0.911.120.38-0.320.58Annual Financials (Consolidated): The company's annual revenue has shown an increase, reaching Rs 3,072.01 Crore for the year-ending March 2025, compared to Rs 2,579.37 Crore in the previous year. However, the net profit decreased to Rs 812.32 Crore from Rs 907.25 Crore during the same period. The basic EPS also saw a decrease from Rs 2.32 to Rs 2.08.Heading20212022202320242025RevenueRs 2,485.39 CroreRs 2,417.00 CroreRs 2,938.35 CroreRs 2,579.37 CroreRs 3,072.01 CroreNet ProfitRs 1,641.78 CroreRs 985.31 CroreRs 1,355.05 CroreRs 907.25 CroreRs 812.32 CroreEPS4.192.633.462.322.08BVPS32.5533.5135.2735.8136.08ROE12.867.519.806.475.78Debt to Equity0.150.521.011.441.90Income Statement (Annual Consolidated):Mar 2025Mar 2024Mar 2023Mar 2022Mar 2021SalesRs 3,072 CroreRs 2,579 CroreRs 2,938 CroreRs 2,417 CroreRs 2,485 CroreOther IncomeRs 304 CroreRs 297 CroreRs 344 CroreRs 217 CroreRs 737 CroreTotal IncomeRs 3,376 CroreRs 2,876 CroreRs 3,282 CroreRs 2,634 CroreRs 3,222 CroreTotal ExpenditureRs 1,539 CroreRs 1,250 CroreRs 1,144 CroreRs 1,161 CroreRs 1,044 CroreEBITRs 1,836 CroreRs 1,626 CroreRs 2,137 CroreRs 1,472 CroreRs 2,178 CroreInterestRs 743 CroreRs 457 CroreRs 414 CroreRs 161 CroreRs -2 CroreTaxRs 280 CroreRs 262 CroreRs 368 CroreRs 326 CroreRs 539 CroreNet ProfitRs 812 CroreRs 907 CroreRs 1,355 CroreRs 985 CroreRs 1,641 CroreIncome Statement (Quarterly Consolidated):Jun 2025Mar 2025Dec 2024Sep 2024Jun 2024SalesRs 917 CroreRs 504 CroreRs 670 CroreRs 1,026 CroreRs 870 CroreOther IncomeRs 54 CroreRs 44 CroreRs 89 CroreRs 82 CroreRs 88 CroreTotal IncomeRs 971 CroreRs 548 CroreRs 760 CroreRs 1,108 CroreRs 958 CroreTotal ExpenditureRs 361 CroreRs 533 CroreRs 351 CroreRs 321 CroreRs 354 CroreEBITRs 609 CroreRs 15 CroreRs 409 CroreRs 786 CroreRs 603 CroreInterestRs 215 CroreRs 159 CroreRs 221 CroreRs 198 CroreRs 142 CroreTaxRs 156 CroreRs -13 CroreRs 40 CroreRs 149 CroreRs 104 CroreNet ProfitRs 236 CroreRs -130 CroreRs 147 CroreRs 438 CroreRs 356 CroreCash Flow: The cash flow statement shows that net cash flow decreased to Rs -7 Crore for the year-ending March 2025, compared to Rs 309 Crore in the previous year. Cash flow from operating activities was Rs 2,482 Crore, while cash flow from investing activities was Rs -6,429 Crore.Mar 2025Mar 2024Mar 2023Mar 2022Mar 2021Operating ActivitiesRs 2,482 CroreRs 1,309 CroreRs 1,631 CroreRs 2,137 CroreRs 1,982 CroreInvesting ActivitiesRs -6,429 CroreRs -5,501 CroreRs -6,876 CroreRs -6,131 CroreRs -1,144 CroreFinancing ActivitiesRs 3,939 CroreRs 4,501 CroreRs 5,559 CroreRs 3,669 CroreRs -1,104 CroreOthersRs 0 CroreRs 0 CroreRs 0 CroreRs 0 CroreRs 0 CroreNet Cash FlowRs -7 CroreRs 309 CroreRs 314 CroreRs -324 CroreRs -266 CroreBalance Sheet: The balance sheet for the year-ending March 2025 shows total liabilities of Rs 46,063 Crore and total assets of the same value. The company's reserves and surplus amounted to Rs 10,248 Crore.Mar 2025Mar 2024Mar 2023Mar 2022Mar 2021Share CapitalRs 3,929 CroreRs 3,929 CroreRs 3,929 CroreRs 3,929 CroreRs 3,929 CroreReserves & SurplusRs 10,248 CroreRs 10,141 CroreRs 9,929 CroreRs 9,240 CroreRs 8,861 CroreCurrent LiabilitiesRs 4,535 CroreRs 4,102 CroreRs 4,268 CroreRs 2,624 CroreRs 1,804 CroreOther LiabilitiesRs 27,348 CroreRs 21,017 CroreRs 14,182 CroreRs 7,453 CroreRs 2,877 CroreTotal LiabilitiesRs 46,063 CroreRs 39,191 CroreRs 32,311 CroreRs 23,248 CroreRs 17,473 CroreMar 2025Mar 2024Mar 2023Mar 2022Mar 2021Fixed AssetsRs 38,024 CroreRs 30,939 CroreRs 24,163 CroreRs 16,234 CroreRs 12,305 CroreCurrent AssetsRs 5,235 CroreRs 5,680 CroreRs 5,630 CroreRs 4,933 CroreRs 3,660 CroreOther AssetsRs 2,803 CroreRs 2,570 CroreRs 2,517 CroreRs 2,079 CroreRs 1,507 CroreTotal AssetsRs 46,063 CroreRs 39,191 CroreRs 32,311 CroreRs 23,248 CroreRs 17,473 CroreRatios: Key financial ratios for SJVN show a basic EPS of Rs 2.08 and a diluted EPS of Rs 2.08 as of March 2025. The book value per share was Rs 36.08. The company reported a debt-to-equity ratio of 1.90 as of March 2025. Corporate Actions: SJVN announced a final dividend of Rs 0.31 per share (3.1%) on May 29, 2025, with an effective date of September 18, 2025. Earlier, an interim dividend of Rs 1.15 per share (11.5%) was announced on February 13, 2025, and was effective from February 21, 2025. The company’s 37th Annual General Meeting (AGM) was held on September 25, 2025. Moneycontrol analysis indicated a bearish sentiment on the stock as of September 19, 2025. With the stock's last traded price at Rs 90.12, SJVN has seen a decline of 2.04% in Friday's session."
Page Industries shares fall 2.63% amid volume surge; stock among top losers on Nifty Midcap 150,https://www.moneycontrol.com/news/business/stocks/page-industries-shares-fall-2-63-amid-volume-surge-stock-among-top-losers-on-nifty-midcap-150-alpha-article-13583237.html,"Shares of Page Industries experienced heavy trading and a volume surge, declining by 2.63% to Rs 41,505. The stock is among the top losers on the Nifty Midcap 150. On the financial front, Page Industries has demonstrated consistent performance. The standalone annual revenue for the year-ending March 2025 stood at Rs 4,934 Crore, compared to Rs 4,581 Crore in the year-ending March 2024, marking a 7.7% increase. The total income for the year-ending March 2025 was Rs 4,996 Crore, up from Rs 4,601 Crore in the previous year. Net profit for the year-ending March 2025 was Rs 729 Crore, compared to Rs 569 Crore in the year-ending March 2024. The company’s quarterly results also reflect growth. Sales for the quarter-ending June 2025 reached Rs 1,316 Crore, while net profit stood at Rs 200 Crore. This compares to sales of Rs 1,098 Crore and a net profit of Rs 164 Crore for the quarter-ending March 2025. Key financial ratios for Page Industries include a basic EPS of Rs 653.71 and a diluted EPS of Rs 653.71 as of March 2025. The book value per share was Rs 1,261.61. The company's dividend per share stood at Rs 900.00 as of March 2025. The P/E ratio for Page Industries as of March 2025 is 65.31, and the P/B ratio is 33.90. Page Industries' cash flow from operating activities was Rs 1,203 Crore for the year-ending March 2025. The company's total assets amounted to Rs 2,643 Crore as of March 2025. Page Industries has announced several corporate actions, including an investor meet scheduled for September 26, 2025. The company also appointed a Chief People Officer. The company announced an interim dividend of Rs 150 per share on July 14, 2025, with an effective date of August 13, 2025. Earlier, an interim dividend of Rs 200 per share was announced on April 21, 2025, with an effective date of May 21, 2025. Investor sentiment for Page Industries is very bearish, according to a Moneycontrol analysis as of September 26, 2025. With the stock's last traded price at Rs 41,505, Page Industries experienced a notable downturn amid high trading volume."
HCL Technologies shares fall 2.01%; among top losers on Nifty 50,https://www.moneycontrol.com/news/business/stocks/hcl-technologies-shares-fall-2-01-among-top-losers-on-nifty-50-alpha-article-13583243.html,"HCL Technologies shares experienced a decline of 2.01% to Rs 1,395.20 in Friday's trading session, positioning the stock among the top losers on the Nifty 50. HCL Technologies is included as one of the stocks in the benchmark Nifty 50 index. Financial Overview HCL Technologies' financial performance reveals the following trends based on consolidated figures: Quarterly Performance For the quarter-ending June 2025, HCL Technologies reported a revenue of Rs 30,349 Crore and a net profit of Rs 3,844 Crore. The revenue for the quarter-ending March 2025 was Rs 30,246 Crore, and the net profit was Rs 4,309 Crore. In the quarter-ending December 2024, the company's revenue stood at Rs 29,890 Crore, with a net profit of Rs 4,594 Crore.QuarterRevenue (Rs Crore)Net Profit (Rs Crore)EPSJun 202530,3493,84414.18Mar 202530,2464,30915.90Dec 202429,8904,59416.94Sep 202428,8624,23715.62Jun 202428,0574,25915.70Annual Performance The annual revenue for the year-ending March 2025 reached Rs 117,055 Crore, with a net profit of Rs 17,399 Crore. The revenue increased by 6.5% in 2025 compared to the previous year. Earnings per share (EPS) for the year stood at Rs 64.16. The company’s book value per share (BVPS) was Rs 256.56, and the return on equity (ROE) was 24.96%.YearRevenue (Rs Crore)Net Profit (Rs Crore)EPSBVPSROEDebt to Equity2025117,05517,39964.16256.5624.960.032024109,91315,71057.99251.4623.000.032023101,45614,84554.85240.8822.700.03202285,65113,52449.77228.3821.800.06202175,37911,16941.07221.3018.600.06The company’s debt-to-equity ratio remained stable at 0.03 for the year-ending March 2025. Income Statement (Yearly - Consolidated) The following table summarizes the consolidated yearly income statement:ParticularsMar 2025 (Rs Crore)Mar 2024 (Rs Crore)Mar 2023 (Rs Crore)Mar 2022 (Rs Crore)Mar 2021 (Rs Crore)Sales117,055109,913101,45685,65175,379Other Income2,4851,4951,3581,067927Total Income119,540111,408102,81486,71876,306Total Expenditure95,63589,88882,97369,44759,942EBIT23,90521,52019,84117,27116,364Interest644553353319511Tax5,8625,2574,6433,4284,684Net Profit17,39915,71014,84513,52411,169Corporate Actions HCL Technologies has announced several corporate actions, including releases on being included in Microsoft's 2025/26 AI Business Solutions Inner Circle and being selected by one of the world's largest commercial vehicle manufacturers for AI-powered digital foundation services. The company has also declared multiple interim dividends. On July 14, 2025, an interim dividend of Rs 12.00 per share (600%) was announced, effective July 18, 2025. Further, the company announced closure of trading window on September 23, 2025. HCL Technologies has a history of bonus issues, with the most recent one on October 23, 2019, in the ratio of 1:1. A stock split was announced on October 24, 2000, with the face value changing from Rs 4 to Rs 2. HCL Technologies shares experienced a downturn amid a very bearish sentiment, according to Moneycontrol analysis as of September 22, 2025."
Siemens share price falls 2.01% in today's trading,https://www.moneycontrol.com/news/business/stocks/siemens-share-price-falls-2-01-in-today-s-trading-alpha-article-13583256.html,"Shares of Siemens declined by 2.01% to Rs 3,093.00 in Friday's session. Siemens is a constituent of the NIFTY NEXT 50 index. Financial Highlights Consolidated Quarterly Performance: Here is a summary of Siemens' consolidated quarterly financial performance:ParticularsJun 2024Sep 2024Dec 2024Mar 2025Jun 2025RevenueRs 5,203.50 CroreRs 6,461.10 CroreRs 3,587.20 CroreRs 4,259.00 CroreRs 4,346.80 CroreNet ProfitRs 578.10 CroreRs 831.20 CroreRs 614.60 CroreRs 582.50 CroreRs 423.40 CroreEPS16.2423.3517.2616.3611.89The revenue for the quarter ending June 2025 was Rs 4,346.80 Crore, compared to Rs 5,203.50 Crore in June 2024. The net profit for the quarter ending June 2025 stood at Rs 423.40 Crore, down from Rs 578.10 Crore in June 2024. The EPS decreased from 16.24 in June 2024 to 11.89 in June 2025. Consolidated Yearly Performance: The consolidated yearly financial performance is as follows:Particulars20202021202220232024RevenueRs 9,946.50 CroreRs 13,639.20 CroreRs 16,137.80 CroreRs 19,553.80 CroreRs 22,239.70 CroreNet ProfitRs 769.50 CroreRs 1,050.10 CroreRs 1,261.90 CroreRs 1,962.00 CroreRs 2,718.10 CroreEPS21.5930.6243.3355.0976.33BVPS266.63290.93326.34367.86431.37ROE8.0910.5313.2814.9817.68Debt to Equity0.000.000.000.000.00The revenue increased from Rs 19,553.80 Crore in 2023 to Rs 22,239.70 Crore in 2024. The net profit also rose from Rs 1,962.00 Crore in 2023 to Rs 2,718.10 Crore in 2024. Similarly, the EPS increased from 55.09 in 2023 to 76.33 in 2024. Income Statement (Annual): The annual income statement is detailed below:ParticularsSep 2024Sep 2023Sep 2022Sep 2021Sep 2020SalesRs 22,239 CroreRs 19,553 CroreRs 16,137 CroreRs 13,639 CroreRs 9,946 CroreOther IncomeRs 925 CroreRs 496 CroreRs 307 CroreRs 226 CroreRs 314 CroreTotal IncomeRs 23,165 CroreRs 20,050 CroreRs 16,445 CroreRs 13,865 CroreRs 10,261 CroreTotal ExpenditureRs 19,465 CroreRs 17,387 CroreRs 14,697 CroreRs 12,421 CroreRs 9,195 CroreEBITRs 3,699 CroreRs 2,662 CroreRs 1,748 CroreRs 1,444 CroreRs 1,066 CroreInterestRs 60 CroreRs 22 CroreRs 36 CroreRs 24 CroreRs 29 CroreTaxRs 921 CroreRs 677 CroreRs 449 CroreRs 369 CroreRs 267 CroreNet ProfitRs 2,718 CroreRs 1,962 CroreRs 1,261 CroreRs 1,050 CroreRs 769 CroreIncome Statement (Quarterly): Here is the quarterly income statement:ParticularsJun 2025Mar 2025Dec 2024Sep 2024Jun 2024SalesRs 4,346 CroreRs 4,259 CroreRs 3,587 CroreRs 6,461 CroreRs 5,203 CroreOther IncomeRs 124 CroreRs 151 CroreRs 172 CroreRs 283 CroreRs 156 CroreTotal IncomeRs 4,470 CroreRs 4,410 CroreRs 3,759 CroreRs 6,744 CroreRs 5,360 CroreTotal ExpenditureRs 3,896 CroreRs 3,860 CroreRs 3,255 CroreRs 5,608 CroreRs 4,597 CroreEBITRs 574 CroreRs 725 CroreRs 746 CroreRs 1,135 CroreRs 762 CroreInterestRs 4 CroreRs 2 CroreRs 3 CroreRs 20 CroreRs 5 CroreTaxRs 146 CroreRs 140 CroreRs 128 CroreRs 284 CroreRs 179 CroreNet ProfitRs 423 CroreRs 582 CroreRs 614 CroreRs 831 CroreRs 578 CroreCash Flow: The cash flow details are as follows:ParticularsSep 2024Sep 2023Sep 2022Sep 2021Sep 2020Operating ActivitiesRs 1,669 CroreRs 1,400 CroreRs 978 CroreRs 1,422 CroreRs 719 CroreInvesting ActivitiesRs -505 CroreRs -758 CroreRs -35 CroreRs -2,389 CroreRs 870 CroreFinancing ActivitiesRs -523 CroreRs -449 CroreRs -392 CroreRs -501 CroreRs -386 CroreOthersRs 3 CroreRs 0 CroreRs 1 CroreRs 0 CroreRs 0 CroreNet Cash FlowRs 644 CroreRs 191 CroreRs 552 CroreRs -1,469 CroreRs 1,204 CroreBalance Sheet: The balance sheet details are as follows:ParticularsSep 2024Sep 2023Sep 2022Sep 2021Sep 2020Share CapitalRs 71 CroreRs 71 CroreRs 71 CroreRs 71 CroreRs 71 CroreReserves & SurplusRs 15,285 CroreRs 13,015 CroreRs 11,539 CroreRs 10,277 CroreRs 9,420 CroreCurrent LiabilitiesRs 8,912 CroreRs 8,546 CroreRs 7,989 CroreRs 6,784 CroreRs 5,858 CroreOther LiabilitiesRs 1,139 CroreRs 631 CroreRs 508 CroreRs 824 CroreRs 509 CroreTotal LiabilitiesRs 25,408 CroreRs 22,265 CroreRs 20,109 CroreRs 17,957 CroreRs 15,860 CroreFixed AssetsRs 1,958 CroreRs 1,820 CroreRs 1,923 CroreRs 2,066 CroreRs 1,255 CroreCurrent AssetsRs 20,157 CroreRs 17,606 CroreRs 15,285 CroreRs 13,152 CroreRs 12,716 CroreOther AssetsRs 3,292 CroreRs 2,838 CroreRs 2,900 CroreRs 2,738 CroreRs 1,888 CroreTotal AssetsRs 25,408 CroreRs 22,265 CroreRs 20,109 CroreRs 17,957 CroreRs 15,860 CroreContingent LiabilitiesRs 1,547 CroreRs 1,474 CroreRs 1,555 CroreRs 1,601 CroreRs 1,338 CroreFinancial Ratios: Key financial ratios for Siemens are:RatioSep 2024Sep 2023Sep 2022Sep 2021Sep 2020Basic EPS (Rs.)76.3355.0943.3330.6221.59Diluted EPS (Rs.)76.3355.0943.3330.6221.59Book Value / Share (Rs.)431.37367.86326.34290.93266.63Dividend / Share (Rs.)12.0010.0010.008.007.00Face Value22222Gross Profit Margin (%)18.1115.2512.7912.7913.25Operating Margin (%)16.6313.6110.8310.5910.72Net Profit Margin (%)12.2210.039.567.997.72Return on Equity (%)17.6814.9813.2810.538.09ROCE (%)22.4219.4014.4212.9210.66Return On Assets (%)10.698.807.676.074.84Current Ratio (X)2.262.061.911.942.17Quick Ratio (X)1.971.771.641.671.98Debt to Equity (x)0.000.000.000.000.00Interest Coverage Ratios (X)66.60130.8556.8970.9344.69Asset Turnover Ratio (%)0.930.920.7975.9562.71Inventory Turnover Ratio (X)1.961.891.547.598.923 Yr CAGR Sales (%)27.6940.218.273.25-5.193 Yr CAGR Net Profit (%)60.8959.687.147.95-17.72P/E (x)0.000.000.000.000.00P/B (x)16.809.998.497.324.74EV/EBITDA (x)61.6441.2844.5740.4529.82P/S (x)11.606.696.115.554.53Corporate Actions Bonus History:On 22 Nov, 2007, the bonus ratio was 1:1, with an ex-bonus date of 29 Feb, 2008 and record date of 2008-03-03.On 22 Aug, 1987, the bonus ratio was 1:4.On 22 Aug, 1982, the bonus ratio was 1:2.On 22 Aug, 1977, the bonus ratio was 1:2.On 22 Aug, 1975, the bonus ratio was 1:1.Dividend History:On 2024-11-26, a Final dividend of Rs.12.00 per share (600%) was announced, with effective date of 30 Jan, 2025.On 2023-11-28, a Final dividend of Rs.10.00 per share (500%) was announced, with effective date of 30 Jan, 2024.On 2022-11-22, a Final dividend of Rs.10.00 per share (500%) was announced, with effective date of 31 Jan, 2023.On 2021-11-24, a Final dividend of Rs.8.00 per share (400%) was announced, with effective date of 20 Jan, 2022.On 2020-11-25, a Final dividend of Rs.7.00 per share (350%) was announced, with effective date of 27 Jan, 2021.Rights Issues:Announced on 1999-08-03, existing ratio of 4:1, offered ratio of 1:4, premium of Rs 190, record date of 1999-09-02, ex-rights date of 18 Aug, 1999.Announced on 1993-09-30, existing ratio of 3:1, offered ratio of 1:3, premium of Rs 125, record date of 1993-04-23, ex-rights date of 29 Mar, 1993.Stock Splits:Announced on 2006-01-27, old face value of 10, new face value of 2, ex-split date of 13 Jun, 2006, and record date of 2006-06-20.The stock's last traded price was Rs 3,093.00, with a recent Moneycontrol analysis indicating bullish sentiment."
