title,link,content,summary_lexrank,summary_luhn,summary_lsa,summary_textrank
Buy City Union Bank; target of Rs 310: Prabhudas Lilladher,https://www.moneycontrol.com/news/business/stocks/buy-city-union-bank-target-of-rs-310-prabhudas-lilladher-13810212.html,"Prabhudas Lilladher's research report on City Union Bank CUB saw yet another strong quarter with a 15.2% beat on core PAT owing to better core revenue i.e. NII/NIM and fees. Credit growth at 21.5% YoY and 5.9% QoQ was also higher suggesting there was no compromise on NIM to achieve growth. Reported NIM increased by 29bps QoQ to 3.9% due to (1) better loan yields (led by robust growth in higher yielding gold loans, which are fixed rate) and (2) 16bps fall in deposit cost due to repricing. Bank expects NIM to remain stable as negative impact of Dec’25 repo cut would be offset by further deposit repricing while fixed rate loan exposure is at ~30%. Asset quality continues to remain benign as recoveries have surpassed slippages since past 10 quarters. Outlook Due to better NIM/growth, we upgrade core PAT for FY27/28E by avg. 7.3%. With core RoA for FY28E like to be 1.5%, we increase multiple to 1.7x from 1.6x and raise TP to Rs310 from Rs265 as we roll over to Mar’28 ABV. Retain ‘BUY. For all recommendations report, click here Disclaimer: The views and investment tips expressed by investment experts/broking houses/rating agencies on moneycontrol.com are their own, and not that of the website or its management. Moneycontrol.com advises users to check with certified experts before taking any investment decisions. City Union Bank - 0402026 - prabhu","Reported NIM increased by 29bps QoQ to 3.9% due to (1) better loan yields (led by robust growth in higher yielding gold loans, which are fixed rate) and (2) 16bps fall in deposit cost due to repricing.","Reported NIM increased by 29bps QoQ to 3.9% due to (1) better loan yields (led by robust growth in higher yielding gold loans, which are fixed rate) and (2) 16bps fall in deposit cost due to repricing.",Bank expects NIM to remain stable as negative impact of Dec’25 repo cut would be offset by further deposit repricing while fixed rate loan exposure is at ~30%.,"Reported NIM increased by 29bps QoQ to 3.9% due to (1) better loan yields (led by robust growth in higher yielding gold loans, which are fixed rate) and (2) 16bps fall in deposit cost due to repricing."
Buy Jupiter Life Line Hospitals; target of Rs 1600: Prabhudas Lilladher,https://www.moneycontrol.com/news/business/stocks/buy-jupiter-life-line-hospitals-target-of-rs-1600-prabhudas-lilladher-13810211.html,"Prabhudas Lilladher's research report on Jupiter Life Line Hospitals JLHL’s Q3 consolidated EBITDA adjusted for one offs grew by 12% YoY to Rs 850mn; in line with our estimates. Its operational efficiency has been strong in the competitive markets of MMR. The company reported revenue/EBITDA CAGR of 20%/25% over FY22-25. Given its expansion plans, scale-up in occupancy and improving margins, growth momentum is expected to sustain over the medium term. We believe strategic greenfield expansions in densely populated micro-markets of western regions will drive sustainable growth. Outlook Our FY27E and FY28E EBITDA stands reduced by 9-10% as we factor in lower occupancy across existing units. Overall, we see 15%/15% CAGR in EBITDA/PAT over FY26-28E with healthy return ratios of ~15%. Maintain ‘BUY’ rating with a TP of Rs1,600/share, valuing at 23x EV/EBITDA based on FY28E EBITDA. For all recommendations report, click here Disclaimer: The views and investment tips expressed by investment experts/broking houses/rating agencies on moneycontrol.com are their own, and not that of the website or its management. Moneycontrol.com advises users to check with certified experts before taking any investment decisions. Jupiter Life Line Hospitals - 0402026 - prabhu",Prabhudas Lilladher's research report on Jupiter Life Line Hospitals JLHL’s Q3 consolidated EBITDA adjusted for one offs grew by 12% YoY to Rs 850mn; in line with our estimates.,Prabhudas Lilladher's research report on Jupiter Life Line Hospitals JLHL’s Q3 consolidated EBITDA adjusted for one offs grew by 12% YoY to Rs 850mn; in line with our estimates.,"Given its expansion plans, scale-up in occupancy and improving margins, growth momentum is expected to sustain over the medium term.","For all recommendations report, click here Disclaimer: The views and investment tips expressed by investment experts/broking houses/rating agencies on moneycontrol.com are their own, and not that of the website or its management."
Buy DOMS Industries; target of Rs 3084: Prabhudas Lilladher,https://www.moneycontrol.com/news/business/stocks/buy-doms-industries-target-of-rs-3084-prabhudas-lilladher-13810210.html,"Prabhudas Lilladher's research report on DOMS Industries We cut our EPS estimates by 6%/3% for FY27E/FY28E amid delays in commercialization of the new plant at Umbergaon. DOMS IN reported an inline performance with revenues of Rs5,922mn (PLe Rs5,918mn) and EBITDA margin of 17.5% (PLe 17.4%) aided by strong performance in the hygiene business. While stationary business also reported a decent performance, additional growth fillip is expected to materialize after the new plant at Umbergaon commences operations from 2QFY27E. Aided by capacity expansion in core stationery business, widening product basket (SKU count is up by ~250 in last 1 year), and strengthening distribution network we expect sales/PAT CAGR of 22%/23% over FY25-FY28E. Outlook We maintain BUY on the stock with a TP of Rs3,084 (50x FY28E EPS). We cut our target multiple to 50x (earlier 60x) as growth moderation is evident amid delays in expansion plan. For all recommendations report, click here Disclaimer: The views and investment tips expressed by investment experts/broking houses/rating agencies on moneycontrol.com are their own, and not that of the website or its management. Moneycontrol.com advises users to check with certified experts before taking any investment decisions. DOMS Industries - 0402026 - prabhu",Prabhudas Lilladher's research report on DOMS Industries We cut our EPS estimates by 6%/3% for FY27E/FY28E amid delays in commercialization of the new plant at Umbergaon.,Prabhudas Lilladher's research report on DOMS Industries We cut our EPS estimates by 6%/3% for FY27E/FY28E amid delays in commercialization of the new plant at Umbergaon.,Prabhudas Lilladher's research report on DOMS Industries We cut our EPS estimates by 6%/3% for FY27E/FY28E amid delays in commercialization of the new plant at Umbergaon.,"DOMS IN reported an inline performance with revenues of Rs5,922mn (PLe Rs5,918mn) and EBITDA margin of 17.5% (PLe 17.4%) aided by strong performance in the hygiene business."
Buy Power Grid Corporation of India; target of Rs 324: Prabhudas Lilladher,https://www.moneycontrol.com/news/business/stocks/buy-power-grid-corporation-of-india-target-of-rs-324-prabhudas-lilladher-13810207.html,"Prabhudas Lilladher's research report on Power Grid Corporation of India Power Grid’s (PWGR) capitalization in Q3FY26 significantly exceeded Street expectations, coming in 80-90% higher than anticipated. The strong outperformance was driven by concerted ministry-level interventions to address the right of way (RoW) challenges, alongside the adoption of insulated cross arm (ICA) technology, which helps reduce RoW requirements by 30–40%. Post Q3FY26, PWGR has raised its FY26E/FY27E capitalization guidance by 10– 15%. On the growth front, the transmission bidding pipeline remains strong. Out of the ~Rs6.6trn ISTS opportunity, projects worth ~Rs2.4trn have already been bided and ~Rs700bn are at various stages of bidding and approvals. This implies an annual bidding opportunity of ~Rs900bn over the medium term. PWGR has orders worth Rs1.45trn in hand, and to execute these, it has outlined a robust multi-year capex plan of Rs320bn in FY26E, Rs370bn in FY27, and Rs450bn in FY28. Capitalization is expected to ramp up with a 2-year lag, rising from ~Rs220bn in FY26 to ~Rs350bn by FY28. Outlook Given its dominant market position, regulated return profile, strong capex visibility, and healthy dividend yield of 3–3.5%, PWGR remains the best proxy to play India’s transmission capex upcycle. We value it at 2.6x FY28E P/B, implying TP of Rs324 with ‘BUY’ recommendation. For all recommendations report, click here Disclaimer: The views and investment tips expressed by investment experts/broking houses/rating agencies on moneycontrol.com are their own, and not that of the website or its management. Moneycontrol.com advises users to check with certified experts before taking any investment decisions. Power Grid Corporation of India - 0402026 - prabhu","PWGR has orders worth Rs1.45trn in hand, and to execute these, it has outlined a robust multi-year capex plan of Rs320bn in FY26E, Rs370bn in FY27, and Rs450bn in FY28.","Prabhudas Lilladher's research report on Power Grid Corporation of India Power Grid’s (PWGR) capitalization in Q3FY26 significantly exceeded Street expectations, coming in 80-90% higher than anticipated.","For all recommendations report, click here Disclaimer: The views and investment tips expressed by investment experts/broking houses/rating agencies on moneycontrol.com are their own, and not that of the website or its management.","The strong outperformance was driven by concerted ministry-level interventions to address the right of way (RoW) challenges, alongside the adoption of insulated cross arm (ICA) technology, which helps reduce RoW requirements by 30–40%."
"India-US trade deal: Gokaldas Exports, Avanti Feeds, Kitex Garments, other export-oriented shares extend gains, rise up to 18%",https://www.moneycontrol.com/news/business/markets/india-us-trade-deal-gokaldas-exports-avanti-feeds-kitex-garments-other-export-oriented-shares-extend-gains-rise-up-to-18-13810138.html,"Export-oriented stocks such as Gokaldas Exports, Avanti Feeds and Kitex Garments extended their gains in Wednesday’s trade, rising as much as 20 percent, amid positive sentiment following the India-US trade deal. These stocks added to the sharp rally seen in the previous session. The companies derive a significant portion of their revenues from exports to the United States. The shares had earlier come under pressure after the US raised tariffs on Indian exports. Shares of Gokaldas Exports surged 20 percent to hit an intraday high of Rs 832.85 on the NSE. The stock opened with a gap-up gain of 12.15 percent and has risen over 41 percent in the past two sessions. Among other textile stocks, K P R Mill gained 2.62 percent to Rs 1,014.90 per share. Indo Count Industries jumped around 11 percent, while Arvind advanced over 2 percent. Kitex Garments was up about 12 percent. According to ICICI Securities, a reduction in reciprocal tariffs from 50 percent to 18 percent, along with recent trade deals with the UK and the European Union, is expected to provide a multi-year advantage to the textile sector by boosting earnings and cash flows through an expanded export base and capacity additions. The cut in US tariffs to 18 percent from 50 percent earlier gives India a competitive edge over other Asian exporters, where tariff rates range between 19 percent and 30 percent, ICICI Securities said. Shrimp exporters also witnessed strong buying interest. Avanti Feeds rose 12 percent and Apex Frozen Foods climbed 10 percent, while Coastal Corporation hit the 5 percent upper circuit. The US accounted for 53 percent of Apex Frozen’s export sales in FY25. North America contributed 65.4 percent of Avanti Feeds’ total sales in the first quarter of FY25. Disclaimer: The views and investment tips expressed by investment experts on Moneycontrol.com are their own and not those of the website or its management. Moneycontrol.com advises users to check with certified experts before taking any investment decisions.",The shares had earlier come under pressure after the US raised tariffs on Indian exports.,"Export-oriented stocks such as Gokaldas Exports, Avanti Feeds and Kitex Garments extended their gains in Wednesday’s trade, rising as much as 20 percent, amid positive sentiment following the India-US trade deal.","Among other textile stocks, K P R Mill gained 2.62 percent to Rs 1,014.90 per share.","According to ICICI Securities, a reduction in reciprocal tariffs from 50 percent to 18 percent, along with recent trade deals with the UK and the European Union, is expected to provide a multi-year advantage to the textile sector by boosting earnings and cash flows through an expanded export base and capacity additions."
Buy Latent View Analytics; target of Rs 630: Prabhudas Lilladher,https://www.moneycontrol.com/news/business/stocks/buy-latent-view-analytics-target-of-rs-630-prabhudas-lilladher-13810213.html,"Prabhudas Lilladher's research report on Latent View Analytics The revenue performance (+5.7% USD QoQ) was broadly in line with our estimates (+6.1% QoQ), attributed to continued momentum within Fin. Services with slight uptick in Technology. The growth within Consumer/Retail was muted sequentially in Q3 on account of unanticipated deferral of follow-on work. However, the impact is temporary in nature and should resume as it progresses through early FY27, the deal pipeline remains strong within Consumer/Retail space. The program renewals were encouraging in Q3 that has further supported by incremental focus on mining and hunting the strategic potential accounts. Databricks partnership is progressing well, and it is expected to mark USD16-17m revenue run-rate by FY26E, while it re-iterated its aspiration to achieve USD50m by FY28. The engagement is supportive in terms of funding POCs, which translated into 30+ joint wins and improved conversion rate (~25-30%) from pilots to production. Margin execution remains strong in Q3, although Forex contributed 230bp QoQ improvement, one-off charges of 70bps (severance pay) would be a tailwind in Q4. We are revising our USD revenue growth to 20.6%/21.4% (earlier 21.1%/21.6%) due to revenue miss, keeping our margin estimates unchanged for FY27E/FY28E. Outlook The stock is currently trading at 37x/29x FY27E/FY28E EPS. We assign 40x multiple to FY28E EPS, arriving at a target price of Rs. 630. Retain BUY. For all recommendations report, click here Disclaimer: The views and investment tips expressed by investment experts/broking houses/rating agencies on moneycontrol.com are their own, and not that of the website or its management. Moneycontrol.com advises users to check with certified experts before taking any investment decisions. Latent View Analytics - 0402026 - prabhu","Prabhudas Lilladher's research report on Latent View Analytics The revenue performance (+5.7% USD QoQ) was broadly in line with our estimates (+6.1% QoQ), attributed to continued momentum within Fin.","Prabhudas Lilladher's research report on Latent View Analytics The revenue performance (+5.7% USD QoQ) was broadly in line with our estimates (+6.1% QoQ), attributed to continued momentum within Fin.","The engagement is supportive in terms of funding POCs, which translated into 30+ joint wins and improved conversion rate (~25-30%) from pilots to production.","Prabhudas Lilladher's research report on Latent View Analytics The revenue performance (+5.7% USD QoQ) was broadly in line with our estimates (+6.1% QoQ), attributed to continued momentum within Fin."
"Info Edge, eClerx, other BPO stocks plunge up to 10% after Anthropic's new AI tool launch",https://www.moneycontrol.com/news/business/markets/info-edge-eclerx-other-bpo-stocks-plunge-up-to-10-after-anthropic-s-new-ai-tool-launch-13810223.html,"The shares of BPO (Business Process Outsourcing) companies plunged in trade on February 4, amid a broader tech selloff triggered by Anthropic’s launch of a new legal AI tool. The shares of eClerx Services crashed nearly 10 percent to trade at Rs 4,459 apiece. Naukri.com-parent Info Edge shares plunged nearly 7 percent to Rs 1,166 apiece. The company provides BPO-related services primarily through its recruitment-focused divisions and subsidiaries like Quadrangle. Firstsource Solutions and Hinduja Global Solutions shares dropped around 2 percent each. What triggered the tech selloff today? Wall Street ended yesterday's session sharply lower as investors remained concerned that AI was creating more competition for software makers, after Anthropic’s launch of a legal tool for its Claude AI chatbot. AI developer Anthropic launched plug-ins for its Claude Cowork agent last week that can automate tasks across legal, sales, marketing and data analysis. The move has triggered worries of an impending AI-fueled disruption of the data and professional services industry, which were once seen as major beneficiaries of the AI era, according to traders and analysts. Why are BPO stocks falling today? BPO (Business Process Outsourcing) companies are specialized firms that handle non-core operational tasks for other businesses, such as customer support, finance, IT services, and human resources. The improving AI technologies hold the possibility of replacing several human jobs, directly threatening BPO companies. “Anthropic launched new capabilities for its Cowork to the legal space, heightening competition,” Morgan Stanley analysts including Toni Kaplan wrote in a note on Thomson Reuters, as reported by Bloomberg. “We view this as a sign of intensifying competition, and thus a potential negative,"" they said. “The significance of platforms now deploying AI-driven systems capable of executing complex SAP migrations and enterprise transformations in weeks—work that previously required years of human-led effort—cannot be overstated. This is not incremental automation; it represents a fundamental compression of time, cost, and manpower across core enterprise processes,” said Bhavik Joshi, Business Head, INVasset PMS. Follow all LIVE updates from the stock markets here.","The shares of BPO (Business Process Outsourcing) companies plunged in trade on February 4, amid a broader tech selloff triggered by Anthropic’s launch of a new legal AI tool.","The shares of BPO (Business Process Outsourcing) companies plunged in trade on February 4, amid a broader tech selloff triggered by Anthropic’s launch of a new legal AI tool.","“Anthropic launched new capabilities for its Cowork to the legal space, heightening competition,” Morgan Stanley analysts including Toni Kaplan wrote in a note on Thomson Reuters, as reported by Bloomberg.","The move has triggered worries of an impending AI-fueled disruption of the data and professional services industry, which were once seen as major beneficiaries of the AI era, according to traders and analysts."
Buy Bajaj Finance; target of Rs 1125: Prabhudas Lilladher,https://www.moneycontrol.com/news/business/stocks/buy-bajaj-finance-target-of-rs-1125-prabhudas-lilladher-13810163.html,"Prabhudas Lilladher's research report on Bajaj Finance AUM grew steady at 22% YoY to Rs4,844.8bn led by strong growth in mortgages, sales finance and consumer B2C. Company is seeing strong traction in new verticals (Cars, Gold, MFI) and new customer addition (~17-18 mn in FY26) and we build an AUM growth of 23%/24% in FY26/FY27E. Expect FY26 NIM to remain stable aided by a lower cost of borrowing. Asset quality ratios stood flat as stress persists in the captive auto/ MSME portfolio. Credit cost remained elevated in the quarter (3.1%) due to accelerated provisions; however commentary indicated a healthy trend in early-stage delinquencies and expects a moderation in FY27E. Outlook We slightly tweak our estimates to account for higher credit cost and roll-forward to Mar-28E with a multiple of 4.2x and an unchanged TP of Rs 1,125. Maintain BUY on recovery in growth and credit cost outlook in FY27E. For all recommendations report, click here Disclaimer: The views and investment tips expressed by investment experts/broking houses/rating agencies on moneycontrol.com are their own, and not that of the website or its management. Moneycontrol.com advises users to check with certified experts before taking any investment decisions. Bajaj Finance - 0402026 - prabhu",Maintain BUY on recovery in growth and credit cost outlook in FY27E.,"Outlook We slightly tweak our estimates to account for higher credit cost and roll-forward to Mar-28E with a multiple of 4.2x and an unchanged TP of Rs 1,125.",Asset quality ratios stood flat as stress persists in the captive auto/ MSME portfolio.,Credit cost remained elevated in the quarter (3.1%) due to accelerated provisions; however commentary indicated a healthy trend in early-stage delinquencies and expects a moderation in FY27E.
Buy TCI Express; target of Rs 694: Prabhudas Lilladher,https://www.moneycontrol.com/news/business/stocks/buy-tci-express-target-of-rs-694-prabhudas-lilladher-13810154.html,"Prabhudas Lilladher's research report on TCI Express TCIEXP IN reported a weak performance in 3QFY26, with EBITDA margin at 10.3% (PLe 11.3%). However, volumes grew 5.4% YoY to 255,000 MT, registering a growth after 8 quarters, indicating early signs of a turnaround. This growth was driven by recovery in surface express, strong customer additions, higher wallet share from existing enterprise accounts, and improved freight movement led by domestic consumption and festive demand. Incremental traction from rail express, air express, C2C and e-commerce services, alongside growth in automotive, pharma, EV, solar and electronics segments, also supported the volume uptick. Given these early signs of a demand-led recovery and improving business mix, we expect volumes to grow at a 6% CAGR over FY25–FY28E, while realization is likely to remain flat over the same period. Outlook We broadly retain our estimates and expect sales/PAT CAGR of 7%/18%, respectively over FY25–FY28E. We maintain BUY with a TP of Rs694 (19x FY28 EPS; multiple has been realigned as we roll forward). For all recommendations report, click here Disclaimer: The views and investment tips expressed by investment experts/broking houses/rating agencies on moneycontrol.com are their own, and not that of the website or its management. Moneycontrol.com advises users to check with certified experts before taking any investment decisions. TCI Express - 0402026 - prabhu","Given these early signs of a demand-led recovery and improving business mix, we expect volumes to grow at a 6% CAGR over FY25–FY28E, while realization is likely to remain flat over the same period.","Given these early signs of a demand-led recovery and improving business mix, we expect volumes to grow at a 6% CAGR over FY25–FY28E, while realization is likely to remain flat over the same period.","Given these early signs of a demand-led recovery and improving business mix, we expect volumes to grow at a 6% CAGR over FY25–FY28E, while realization is likely to remain flat over the same period.","Given these early signs of a demand-led recovery and improving business mix, we expect volumes to grow at a 6% CAGR over FY25–FY28E, while realization is likely to remain flat over the same period."
Buy Ashoka Buildcon; target of Rs 183: Prabhudas Lilladher,https://www.moneycontrol.com/news/business/stocks/buy-ashoka-buildcon-target-of-rs-183-prabhudas-lilladher-13810133.html,"Prabhudas Lilladher's research report on Ashoka Buildcon Ashoka Buildcon (ASBL) delivered weak performance in Q3FY26/9MFY26, with standalone revenue declining 18% YoY / 21% YoY. However, a healthy order book of Rs159bn (2.7x TTM revenue) provides medium-term revenue visibility, with the management guiding for a return to revenue growth in FY27E. The order book is well diversified, led by roads and railways, which account for ~65%, while power T&D contributes a meaningful ~32%. Order inflows during 9MFY26 stood at Rs50bn, and the management expects further Rs30–35bn of inflows in Q4FY26. Crucially, the balance sheet has turned materially leaner following the monetization of 5 BOT assets, reducing consolidated debt from ~Rs49bn in Sep’25 to ~Rs27bn by Dec’25. Further, another tranche of HAM asset monetization is expected to lower net debt to Rs2–3bn by Mar/Apr’26. Outlook The stock is currently trading below its book value, offering valuation comfort with limited downside. We have ‘BUY’ rating with SoTP-based TP of Rs183. For all recommendations report, click here Disclaimer: The views and investment tips expressed by investment experts/broking houses/rating agencies on moneycontrol.com are their own, and not that of the website or its management. Moneycontrol.com advises users to check with certified experts before taking any investment decisions. Ashoka Buildcon - 0402026 - prabhu","Prabhudas Lilladher's research report on Ashoka Buildcon Ashoka Buildcon (ASBL) delivered weak performance in Q3FY26/9MFY26, with standalone revenue declining 18% YoY / 21% YoY.","However, a healthy order book of Rs159bn (2.7x TTM revenue) provides medium-term revenue visibility, with the management guiding for a return to revenue growth in FY27E.","The order book is well diversified, led by roads and railways, which account for ~65%, while power T&D contributes a meaningful ~32%.","However, a healthy order book of Rs159bn (2.7x TTM revenue) provides medium-term revenue visibility, with the management guiding for a return to revenue growth in FY27E."
