title,link,content
Zydus Lifesciences shares fall 2.97% amid volume surge; stock among top losers on Nifty Next 50,https://www.moneycontrol.com/news/business/stocks/zydus-lifesciences-shares-fall-2-97-amid-volume-surge-stock-among-top-losers-on-nifty-next-50-alpha-article-13582389.html,"Shares of Zydus Lifesciences were trading lower on Friday, with the stock priced at Rs 989, a decline of 2.97% at 11:58 am. The stock is among the top losers on the Nifty Next 50 index amid high trading volume. Financial Performance: The following table presents the consolidated quarterly financial performance of Zydus Lifesciences:HeadingJun 2024Sep 2024Dec 2024Mar 2025Jun 2025RevenueRs 6,207.50 CroreRs 5,237.00 CroreRs 5,269.10 CroreRs 6,527.90 CroreRs 6,573.70 CroreNet ProfitRs 1,463.60 CroreRs 898.10 CroreRs 1,004.30 CroreRs 1,248.80 CroreRs 1,486.60 CroreEPS14.119.0610.1711.6414.58The revenue for the quarter-ending June 2025 stood at Rs 6,573.70 Crore, compared to Rs 6,207.50 Crore in June 2024. Net profit for the same period was Rs 1,486.60 Crore, up from Rs 1,463.60 Crore in the corresponding quarter of the previous year. The company's EPS stood at 14.58 in June 2025, up from 14.11 in June 2024. The following table presents the consolidated yearly financial performance:Heading20212022202320242025RevenueRs 14,403.50 CroreRs 15,265.20 CroreRs 17,237.40 CroreRs 19,547.40 CroreRs 23,241.50 CroreNet ProfitRs 2,205.60 CroreRs 2,326.40 CroreRs 2,001.90 CroreRs 3,831.40 CroreRs 4,614.80 CroreEPS20.8443.8319.3038.1444.97BVPS145.80186.07194.55219.70238.10ROE16.4226.3911.1919.4618.89Debt to Equity0.350.250.070.040.13The revenue for the year-ending March 2025 was Rs 23,241.50 Crore, an increase compared to Rs 19,547.40 Crore in 2024. The net profit for the year-ending March 2025 was Rs 4,614.80 Crore, up from Rs 3,831.40 Crore in the previous year. The company's EPS stood at 44.97 in March 2025, up from 38.14 in March 2024. Income Statement:Mar 2025Mar 2024Mar 2023Mar 2022Mar 2021SalesRs 23,241 CroreRs 19,547 CroreRs 17,237 CroreRs 15,265 CroreRs 14,403 CroreOther IncomeRs 269 CroreRs 284 CroreRs 186 CroreRs 224 CroreRs 45 CroreTotal IncomeRs 23,511 CroreRs 19,831 CroreRs 17,424 CroreRs 15,489 CroreRs 14,449 CroreTotal ExpenditureRs 17,318 CroreRs 14,941 CroreRs 14,704 CroreRs 12,524 CroreRs 11,891 CroreEBITRs 6,192 CroreRs 4,890 CroreRs 2,719 CroreRs 2,965 CroreRs 2,558 CroreInterestRs 165 CroreRs 81 CroreRs 129 CroreRs 127 CroreRs 158 CroreTaxRs 1,411 CroreRs 977 CroreRs 587 CroreRs 511 CroreRs 193 CroreNet ProfitRs 4,614 CroreRs 3,831 CroreRs 2,001 CroreRs 2,326 CroreRs 2,205 CroreThe company's sales increased from Rs 19,547 Crore in March 2024 to Rs 23,241 Crore in March 2025. The net profit also increased from Rs 3,831 Crore in March 2024 to Rs 4,614 Crore in March 2025. Cash Flow:Mar 2025Mar 2024Mar 2023Mar 2022Mar 2021Operating ActivitiesRs 6,776 CroreRs 3,227 CroreRs 2,688 CroreRs 2,104 CroreRs 3,293 CroreInvesting ActivitiesRs -8,372 CroreRs -1,475 CroreRs 1,171 CroreRs 1,154 CroreRs -724 CroreFinancing ActivitiesRs 2,014 CroreRs -1,810 CroreRs -4,400 CroreRs -868 CroreRs -2,547 CroreOthersRs -4 CroreRs -17 CroreRs 6 CroreRs -17 CroreRs -112 CroreNet Cash FlowRs 413 CroreRs -74 CroreRs -533 CroreRs 2,372 CroreRs -90 CroreBalance Sheet:Mar 2025Mar 2024Mar 2023Mar 2022Mar 2021Share CapitalRs 100 CroreRs 100 CroreRs 101 CroreRs 102 CroreRs 102 CroreReserves & SurplusRs 23,852 CroreRs 19,728 CroreRs 17,414 CroreRs 16,897 CroreRs 12,889 CroreCurrent LiabilitiesRs 9,041 CroreRs 5,341 CroreRs 5,530 CroreRs 7,839 CroreRs 7,861 CroreOther LiabilitiesRs 4,206 CroreRs 4,109 CroreRs 2,709 CroreRs 2,956 CroreRs 3,031 CroreTotal LiabilitiesRs 37,201 CroreRs 29,280 CroreRs 25,756 CroreRs 27,795 CroreRs 23,884 CroreFixed AssetsRs 10,583 CroreRs 9,525 CroreRs 7,917 CroreRs 7,549 CroreRs 7,569 CroreCurrent AssetsRs 17,046 CroreRs 11,501 CroreRs 10,016 CroreRs 12,261 CroreRs 8,716 CroreOther AssetsRs 9,572 CroreRs 8,253 CroreRs 7,822 CroreRs 7,984 CroreRs 7,599 CroreTotal AssetsRs 37,201 CroreRs 29,280 CroreRs 25,756 CroreRs 27,795 CroreRs 23,884 CroreContingent LiabilitiesRs 1,428 CroreRs 1,277 CroreRs 1,315 CroreRs 1,210 CroreRs 1,295 CroreFinancial Ratios:Mar 2025Mar 2024Mar 2023Mar 2022Mar 2021Basic EPS (Rs.)44.9738.1419.3043.8320.84Diluted Eps (Rs.)44.9738.1419.3043.8320.84Book Value [Excl. Reval Reserve]/Share (Rs.)238.10219.70194.55186.07145.80Dividend/Share (Rs.)11.003.006.002.503.50Face Value11111Gross Profit Margin (%)31.5228.9923.4723.3523.83Operating Margin (%)27.5825.0819.2818.6819.18Net Profit Margin (%)19.8519.7111.5829.9514.84Return on Networth / Equity (%)18.8919.4611.1926.3916.42ROCE (%)22.7720.4816.4314.2917.24Return On Assets (%)12.1613.187.6116.148.93Current Ratio (X)1.892.151.811.561.11Quick Ratio (X)1.451.511.191.090.70Debt to Equity (x)0.130.040.070.250.35Interest Coverage Ratios (X)44.1769.8131.1528.0721.62Asset Turnover Ratio (%)0.700.710.640.380.37Inventory Turnover Ratio (X)6.291.341.161.021.033 Yr CAGR Sales (%)23.3916.509.977.689.993 Yr CAGR Net Profit (%)40.8431.8030.4912.0811.74P/E (x)19.7126.4125.477.9521.16P/B (x)3.725.102.842.103.47EV/EBITDA (x)12.5218.1812.9711.4614.79P/S (x)3.835.172.892.343.13Corporate Actions: Zydus Lifesciences announced a final dividend of Rs 11.00 per share, with effective date as July 25, 2025. Earlier dividends include Rs 3.00 per share on July 26, 2024, Rs 6.00 per share on July 28, 2023, Rs 2.50 per share on July 28, 2022, and Rs 3.50 per share on July 28, 2021. The company had a stock split on October 6, 2015, with old FV of 5 and new FV of 1. Zydus Lifesciences had bonus issues with ex-bonus dates on April 5, 2010 and August 30, 2006. Moneycontrol analysis indicates a bullish sentiment on Zydus Lifesciences as of September 25, 2025. With the stock currently trading at Rs 989, Zydus Lifesciences experiences a notable downturn amid high trading volume, with the stock among the top losers on the Nifty Next 50 index."
Tata Motors shares rise 2% after 2-day fall as JLR restores some systems hit by cyber attack,https://www.moneycontrol.com/news/business/markets/tata-motors-shares-rise-after-2-day-fall-as-jlr-restores-some-systems-hit-by-cyber-attack-13582256.html,"Tata Motors shares rose over 2 percent on Friday, snapping a two-day losing streak, after Jaguar Land Rover (JLR) said it had restored part of its digital systems that were disrupted by a cyber attack. The UK-based luxury carmaker said on Thursday that some of its systems were back online as part of a phased recovery process, reported Reuters. ""As part of the controlled, phased restart of our operations, today we have informed colleagues, suppliers and retail partners that sections of our digital estate are now up and running,"" a JLR spokesperson said. ""The foundational work of our recovery programme is firmly underway,"" the spokesperson added. During FY25, JLR accounted for 72 percent of Tata Motors' total automotive revenue, higher than its contribution in FY24, led by strong performance in the North American market. Employee costs at JLR rose 15.6 per cent to Rs 36,887 crore (£3,417 million) in FY25 due to an increase in headcount and annual pay revisions. Shares of Tata Motors were trading at Rs 678.45 on the NSE, up 2.13 percent. Disclaimer: The views and investment tips expressed by experts on Moneycontrol are their own and not those of the website or its management. Moneycontrol advises users to check with certified experts before taking any investment decisions."
Buy Grasim Industries; target of Rs 3550: Motilal Oswal,https://www.moneycontrol.com/news/business/stocks/buy-grasim-industries-target-of-rs-3550-motilal-oswal-13582287.html,"Motilal Oswal's research report on Grasim Industries Grasim Industries (GRASIM) organized an interaction with senior management, who shared their perspectives on the Paints business and highlighted new initiatives being implemented in this segment. Management emphasized that gaining market share is a near-term priority, supported by unique industry offerings in product warranties and financing schemes. It believes that offering financing schemes and digital certificates will attract more customers. Further, it remains committed to achieving INR100b in revenue by FY28E (third year of full-scale operations), along with profitability at the operating level. Outlook We reiterate our BUY rating on the stock with a TP of INR3,550, as we value its: 1) holdings in listed subsidiary companies by assigning a discount of 35%, 2) standalone business at 6x Sep’27E EV/EBITDA, 3) paints business at 2.0x of investments, 4) renewables business at 10x EV/EBITDA, and 5) B2B e-commerce at 1.5x of Sep’27E revenue. For all recommendations report, click here Disclaimer: The views and investment tips expressed by investment experts/broking houses/rating agencies on moneycontrol.com are their own, and not that of the website or its management. Moneycontrol.com advises users to check with certified experts before taking any investment decisions. Grasim Industries - 26 - 09 - 2025 -moti"
Buy Hindustan Aeronautics; target of Rs 5800: Motilal Oswal,https://www.moneycontrol.com/news/business/stocks/buy-hindustan-aeronautics-target-of-rs-5800-motilal-oswal-13582262.html,"Motilal Oswal's research report on Hindustan Aeronautics Hindustan Aeronautics (HAL) has received the follow-on order of 97 light combat aircraft (LCA) Mk1A worth INR624b from the Ministry of Defence (MoD). This is in addition to the previous order of 83 Tejas LCA Mk1A received in Jan’21. GE has now overcome the supply chain issues it was facing previously and resumed normal deliveries of the F404 engines, and we expect aircraft deliveries to accelerate in the coming quarters. With the contract for 97 additional jets now signed, we expect the related order of USD1b for 113 new F404 engines with GE to be finalized too in a few weeks. Outlook Our estimates build in execution scale-up of the manufacturing order book as HAL begins deliveries of the Tejas aircraft from 3QFY26 onward. We retain our positive stance on the sector and maintain our BUY rating on the stock with an unchanged TP of INR5,800, based on the average DCF and 32x Sep’27E earnings. For all recommendations report, click here Disclaimer: The views and investment tips expressed by investment experts/broking houses/rating agencies on moneycontrol.com are their own, and not that of the website or its management. Moneycontrol.com advises users to check with certified experts before taking any investment decisions. Hindustan Aeronautics - 26 - 09 - 2025 -moti"
Subscribe for Jinkushal Industries Ltd IPO; Ajcon Global,https://www.moneycontrol.com/news/business/stocks/subscribe-for-jinkushal-industries-ltd-ipo-ajcon-global-13582027.html,"Ajcon Global, Jinkushal Industries Ltd Jinkushal Industries Ltd is engaged in export trading of new/customized and used/refurbished construction machines in global markets. JKIPL is the largest Non-OEM construction machines exporter with a 6.9% market share. JKIPL is recognized as Three-Star Export house by Directorate General of Foreign Trade (“DGFT”), Government of India. Company have exported construction machines to over thirty (30) countries, including UAE, Mexico, Netherlands, Belgium, South Africa, Australia, and UK. Company primarily operate across three primary business verticals; (i) export trading of customized, modified and accessorized new construction machines; (ii) export trading of used/refurbished construction machines; and (iii) export trading of their own brand ‘HexL’ construction machines (presently in category of backhoe loaders) to cater a diverse international customer base. Company believe that each of these verticals is structured to improve operational efficiency and reach a wide customer base, ensuring that their exported machines align with the required performance standards, durability expectations, and specific application needs. In addition to aforementioned primary business verticals, they also derive a small portion of revenue from (i) their logistics warehouses leasing; (ii) renting of construction machines. Valuation and Outlook At the upper price band company is valuing at P/E of 30.1x to its FY25 earnings, with EV/EBITDA of 22.0x and market cap of ₹ 4,644 million post issue of equity shares. We believe that the IPO is fully priced and recommend a “SubscribeLong Term” rating to the IPO. For all IPO report, click here Disclaimer: The views and investment tips expressed by investment experts/broking houses/rating agencies on moneycontrol.com are their own, and not that of the website or its management. Moneycontrol.com advises users to check with certified experts before taking any investment decisions. Jinkushal Industries - 260925 - aj"
Tube Investments of India shares decline 2.01% in Friday's trading,https://www.moneycontrol.com/news/business/stocks/tube-investments-of-india-shares-decline-2-01-in-friday-s-trading-alpha-article-13582066.html,"Shares of Tube Investments of India Ltd fell by 2.01% to Rs 3,148.10 in Friday's trading session, according to the last traded price. The stock is a constituent of the Nifty Midcap 150 index. At 11:08 am, the stock traded lower compared to its previous close. Financial Performance: Tube Investments of India's consolidated financial performance showcases consistent growth in revenue over the past few years. The company's revenue for the year ending March 2025 stood at Rs 19,464.65 Crore, marking a significant increase of 15.22% compared to Rs 16,890.33 Crore in March 2024. However, the net profit for the same period was Rs 1,054.67 Crore, a decrease from Rs 1,187.51 Crore in the previous year. The Earnings per share (EPS) stood at Rs 34.83 for March 2025, down from Rs 62.12 in March 2024. The following table presents key consolidated annual financial figures:HeadingMar 2021Mar 2022Mar 2023Mar 2024Mar 2025RevenueRs 6,083.29 CroreRs 12,525.30 CroreRs 14,964.73 CroreRs 16,890.33 CroreRs 19,464.65 CroreNet ProfitRs 304.69 CroreRs 994.31 CroreRs 1,177.98 CroreRs 1,187.51 CroreRs 1,054.67 CroreEPSRs 15.13Rs 39.89Rs 49.50Rs 62.12Rs 34.83The company's quarterly performance also reflects growth in revenue. For the quarter-ending June 2025, revenue reached Rs 5,309.06 Crore, an increase of 15.97% compared to Rs 4,577.92 Crore in June 2024. The net profit for the same period was Rs 303.28 Crore, slightly lower than Rs 313.80 Crore in the previous year. EPS stood at Rs 10.28 for June 2025, compared to Rs 11.64 in June 2024. The following table presents key consolidated quarterly financial figures:HeadingJun 2024Sep 2024Dec 2024Mar 2025Jun 2025RevenueRs 4,577.92 CroreRs 4,924.55 CroreRs 4,812.22 CroreRs 5,149.96 CroreRs 5,309.06 CroreNet ProfitRs 313.80 CroreRs 299.30 CroreRs 280.22 CroreRs 158.22 CroreRs 303.28 CroreEPSRs 11.64Rs 10.69Rs 10.01Rs 2.41Rs 10.28Corporate Actions: Tube Investments of India has announced dividends in the past. A final dividend of Rs 1.50 per share (150%) was announced on May 15, 2025. Since there is no record date available, today's date, September 26, 2025, is considered the ex-date. Prior to that, an interim dividend of Rs 2.00 per share (200%) was announced on February 3, 2025, with an effective date of February 7, 2025. In conclusion, Tube Investments of India Ltd's stock saw a decline of 2.01% in today's trading. The company has shown consistent growth in revenue while net profit saw a dip as per annual financial data. Tube Investments of India Ltd's stock saw a decline of 2.01% in today's trading."
Tata Steel share price falls 2.01% in Friday's trading session,https://www.moneycontrol.com/news/business/stocks/tata-steel-share-price-falls-2-01-in-friday-s-trading-session-alpha-article-13582055.html,"Shares of Tata Steel declined by 2.01% to Rs 168.91 in Friday's trading session amid a weak broader market. On the financial front, Tata Steel's consolidated revenue for the quarter-ending June 2025 stood at Rs 53,178.12 Crore, compared to Rs 54,771.39 Crore in June 2024. The net profit for the same period was Rs 1,927.64 Crore, significantly higher than the Rs 826.06 Crore reported in June 2024. The company’s earnings per share (EPS) stood at Rs 1.67 in June 2025, up from Rs 0.77 in June 2024. The annual consolidated revenue for Tata Steel in 2025 was Rs 218,542.51 Crore, a decrease from Rs 229,170.78 Crore in 2024. The net profit for 2025 was Rs 2,982.97 Crore, compared to a loss of Rs -4,851.63 Crore in 2024. The company's EPS for 2025 was Rs 2.74, compared to Rs -3.62 in 2024. Key financial ratios for Tata Steel show a P/E ratio of 56.29 and a P/B ratio of 2.11. The company reported a debt-to-equity ratio of 0.98 as of the year-ending March 2025. Tata Steel's board has announced several corporate actions, including the acquisition of equity stake in T Steel Holdings Pte. Ltd. The company announced a final dividend of Rs 3.60 per share (360%) on May 12, 2025, with an effective date of June 6, 2025. Historically, the company has issued bonus shares, with the most recent bonus issue on June 7, 2004, in the ratio of 1:2. Tata Steel had a stock split on July 28, 2022, with the old face value of Rs 10 split to a new face value of Rs 1. The cash flow statement for Tata Steel reveals that cash flow from operating activities was Rs 23,511 Crore in March 2025, compared to Rs 20,300 Crore in March 2024. Cash flow from investing activities was Rs -14,172 Crore in March 2025, and cash flow from financing activities was Rs -7,002 Crore. The balance sheet shows that Tata Steel's share capital was Rs 1,247 Crore in March 2025, with reserves and surplus at Rs 89,922 Crore. Total assets were valued at Rs 279,394 Crore in March 2025. Tata Steel is a constituent of the Nifty 50 index. With the stock's last traded price at Rs 168.91, Tata Steel witnessed a decline of 2.01% in Friday's trading session."
Endurance Technologies shares rise 2.08%; stock among top gainers on Nifty Midcap 150,https://www.moneycontrol.com/news/business/stocks/endurance-technologies-shares-rise-2-08-stock-among-top-gainers-on-nifty-midcap-150-alpha-article-13582041.html,"Shares of Endurance Technologies gained 2.08% to trade at Rs 2,771.40 on Friday. The stock was among the top gainers on the Nifty Midcap 150 index at 11:03 am. Financial Snapshot: Endurance Technologies has demonstrated consistent financial performance. The consolidated revenue for the year-ending March 2025 stood at Rs 11,560.81 Crore, compared to Rs 10,240.87 Crore in the previous year. Net profit for the same period increased to Rs 836.35 Crore from Rs 680.49 Crore. The company's earnings per share (EPS) also saw growth, rising to Rs 59.46 in March 2025 from Rs 48.38 in March 2024. The company has shown steady quarterly performance. The consolidated revenue for the quarter-ending June 2025 stood at Rs 3,318.89 Crore, up from Rs 2,825.50 Crore in the quarter-ending June 2024. Net profit for the quarter-ending June 2025 was Rs 226.35 Crore, compared to Rs 203.86 Crore for the quarter-ending June 2024. The EPS also increased to Rs 16.09 for the quarter-ending June 2025, compared to Rs 14.49 for the quarter-ending June 2024. Income Statement (Consolidated): Yearly:Mar 2025Mar 2024Mar 2023Mar 2022Mar 2021SalesRs 11,560 CroreRs 10,240 CroreRs 8,804 CroreRs 7,549 CroreRs 6,547 CroreOther IncomeRs 116 CroreRs 85 CroreRs 45 CroreRs 41 CroreRs 30 CroreTotal IncomeRs 11,677 CroreRs 10,326 CroreRs 8,849 CroreRs 7,590 CroreRs 6,577 CroreTotal ExpenditureRs 10,536 CroreRs 9,386 CroreRs 8,199 CroreRs 6,997 CroreRs 5,917 CroreEBITRs 1,141 CroreRs 939 CroreRs 649 CroreRs 592 CroreRs 660 CroreInterestRs 46 CroreRs 42 CroreRs 20 CroreRs 6 CroreRs 13 CroreTaxRs 258 CroreRs 216 CroreRs 149 CroreRs 125 CroreRs 127 CroreNet ProfitRs 836 CroreRs 680 CroreRs 479 CroreRs 460 CroreRs 519 CroreQuarterly:Jun 2025Mar 2025Dec 2024Sep 2024Jun 2024SalesRs 3,318 CroreRs 2,963 CroreRs 2,859 CroreRs 2,912 CroreRs 2,825 CroreOther IncomeRs 35 CroreRs 34 CroreRs 21 CroreRs 26 CroreRs 33 CroreTotal IncomeRs 3,354 CroreRs 2,998 CroreRs 2,881 CroreRs 2,939 CroreRs 2,859 CroreTotal ExpenditureRs 3,039 CroreRs 2,671 CroreRs 2,623 CroreRs 2,661 CroreRs 2,580 CroreEBITRs 315 CroreRs 326 CroreRs 258 CroreRs 277 CroreRs 279 CroreInterestRs 13 CroreRs 12 CroreRs 11 CroreRs 11 CroreRs 11 CroreTaxRs 75 CroreRs 69 CroreRs 62 CroreRs 62 CroreRs 64 CroreNet ProfitRs 226 CroreRs 245 CroreRs 184 CroreRs 202 CroreRs 203 CroreCash Flow:Mar 2025Mar 2024Mar 2023Mar 2022Mar 2021Operating ActivitiesRs 1,531 CroreRs 1,057 CroreRs 861 CroreRs 741 CroreRs 621 CroreInvesting ActivitiesRs -1,012 CroreRs -945 CroreRs -914 CroreRs -551 CroreRs -590 CroreFinancing ActivitiesRs -29 CroreRs 105 CroreRs -71 CroreRs -302 CroreRs -143 CroreOthersRs 24 CroreRs 0 CroreRs 9 CroreRs 1 CroreRs 0 CroreNet Cash FlowRs 514 CroreRs 216 CroreRs -114 CroreRs -110 CroreRs -112 CroreBalance Sheet:Mar 2025Mar 2024Mar 2023Mar 2022Mar 2021Share CapitalRs 140 CroreRs 140 CroreRs 140 CroreRs 140 CroreRs 140 CroreReserves & SurplusRs 5,576 CroreRs 4,836 CroreRs 4,271 CroreRs 3,779 CroreRs 3,421 CroreCurrent LiabilitiesRs 2,691 CroreRs 2,237 CroreRs 1,930 CroreRs 1,657 CroreRs 1,723 CroreOther LiabilitiesRs 730 CroreRs 670 CroreRs 459 CroreRs 280 CroreRs 462 CroreTotal LiabilitiesRs 9,139 CroreRs 7,885 CroreRs 6,802 CroreRs 5,857 CroreRs 5,747 CroreFixed AssetsRs 4,010 CroreRs 3,397 CroreRs 2,923 CroreRs 2,658 CroreRs 2,524 CroreCurrent AssetsRs 4,593 CroreRs 3,789 CroreRs 3,191 CroreRs 2,849 CroreRs 2,904 CroreOther AssetsRs 534 CroreRs 698 CroreRs 686 CroreRs 349 CroreRs 318 CroreTotal AssetsRs 9,139 CroreRs 7,885 CroreRs 6,802 CroreRs 5,857 CroreRs 5,747 CroreContingent LiabilitiesRs 401 CroreRs 331 CroreRs 837 CroreRs 830 CroreRs 480 CroreKey Financial Ratios: As of March 2025, the basic EPS and diluted EPS both stood at Rs 59.46. The book value per share was Rs 406.46, and the dividend per share was Rs 10.00. The face value was Rs 10. The debt to equity ratio was 0.16, and the interest coverage ratio was 35.63. Corporate Actions: The company announced a final dividend of Rs 10 per share (100%) on May 15, 2025, with an effective date of August 1, 2025. The company had announced a final dividend of Rs 8.50 per share on May 16, 2024, with an effective date of August 9, 2024. The trading window of the Company will be closed from 1st October, 2025 up to 48 hours from declaration of financial results for the quarter and half year ending 30th September, 2025. Endurance Technologies is included as one of the stocks in the benchmark Nifty Midcap 150 index."
