title,link,content,summary_lexrank,summary_luhn,summary_lsa,summary_textrank
"India-US trade deal impact: Nifty 50 to hit 30,000 by 2026-end as sentiment improves, say analysts",https://www.moneycontrol.com/news/business/markets/india-us-trade-deal-impact-nifty-50-to-hit-30-000-by-2026-end-as-sentiment-improves-say-analysts-13807624.html,"Indian stock markets recorded a sharp rally on February 3 after India and US concluded their much-awaited trade deal. Analysts have suggested what target investors should expect for Nifty 50 as sentiment has improved after the deal. The bilateral trade deal effectively reduces US tariffs on Indian exports to 18 percent from 50 percent. At around 12 pm, Sensex was up around 3 percent (2,444 points) at 84,110.14, while Nifty 50 was up 3 percent (740 points) at 25,828.85. India-US trade deal: ""Out of friendship and respect for Prime Minister Modi and, as per his request, effective immediately, we agreed to a Trade Deal between the United States and India, whereby the United States will charge a reduced Reciprocal Tariff, lowering it from 25 percent to 18 percent,"" Trump wrote in a post on Truth Social after a telephonic conversation with Prime Minister Narendra Modi. Trump described Modi as “one of my greatest friends” and a “powerful and respected leader of his country,” adding that the two leaders discussed trade, global security and efforts to end the Russia Ukraine war. Why are markets rallying today? With the US trade deal now concluded, a prolonged source of uncertainty for markets is finally behind us, said N. Arunagiri, CEO, TrustLine Holdings. “That overhang had weighed on sentiment and risk appetite for an extended period, and its resolution provides an important near-term relief. However, what matters more for markets from here is what comes after the deal,” the analyst said. Rupee's long-overdue retracement and expected meaningful earnings recovery in FY27, along with structural reforms create a strong and supportive backdrop for markets, said Arunagiri. “From this perspective, the medium-term setup looks increasingly constructive, and we believe these are very positive times for the markets especially for broader small and midcaps,” the analyst added. JP Morgan sees Nifty 50 at 30,000 by 2026-end: JP Morgan reiterated its 2026-end target of 30,000 for Indian benchmark index Nifty 50 after India-US trade deal. This marks a rise of nearly 20 percent (4,922 points) from the previous closing level of 25,088.40. ""A comprehensive bilateral agreement may lead to increased foreign investment, a stronger rupee, and improved earnings visibility for export-oriented sectors,"" JP Morgan said. Indian markets significantly declined earlier amid persistent delays in the conclusion of the deal and limited exposure to artificial intelligence theme, which in turn triggered persistent foreign fund outflows since 2025, leading to underperformance against emerging market peers. “India's valuation premium to EM has compressed significantly, and it now trades at a discount to S&P 500,” JP Morgan said. It added that textiles and apparels, gems and jewellery, engineering goods, chemicals, leather and footwear companies will potentially benefit from the trade deal. “The agreement may also improve earnings visibility for export-oriented sectors such as agriculture and manufacturing, and support a near-term rebound in IT and pharma, led by a reduction in risk premium,” it further said. 'More ambitious year-end trajectory for Nifty 50 after trade deal': Market commentary has started factoring in a more ambitious year-end trajectory for the Nifty 50, with several participants now suggesting that the index could gravitate towards the 30,000 zone if current macro tailwinds sustain, said Harshal Dasani, Business Head, INVasset PMS. ""This optimism is not anchored to a single trigger, but to a convergence of positives that are steadily improving earnings visibility. The India–US trade deal adds to a series of trade agreements signed over the past year, strengthening India’s export outlook and reinforcing its role as a preferred global manufacturing and services hub at a time when supply chains are being rebalanced,"" he said. Domestically, the growth impulse remains consumption-led. Rate cuts over the past year have lowered financing costs, while tax relief measures have increased disposable income for the middle class, translating into stronger discretionary spending, the analyst explained. With inflation largely under control and liquidity conditions supportive, corporate earnings expectations for the coming quarters remain resilient, he added. ""In this environment, the market’s base case is not aggressive valuation expansion, but steady earnings compounding. If growth momentum holds and global conditions remain benign, the 30,000 mark is increasingly being viewed as an achievable milestone rather than an outlier outcome,"" according to Dasani. 'Trade deal instilled confidence in India's earnings trajectory': The trade agreement between India and the US has also instilled a degree of confidence in the earnings trajectory of India, particularly in export-driven segments, and this is why Nifty targets for the year-end are being revised higher, said Siddharth Maurya, Founder & Managing Director, Vibhavangal Anukulakara. “Essentially, what this does is that it removes policy-related uncertainties and enhances visibility on demand and investment flows,” he explained. According to Maurya, Nifty can easily target the 28,000 level by the year-end if the global environment remains stable and the earnings trajectory of India remains strong. “However, this is not likely to be a straight-line journey,” he added. Some consolidation ahead? Jigar S. Patel, Senior Manager of Equity Technical Research at Anand Rathi Share and Stock Brokers, however said that he expects Nifty to remain in a consolidation phase between 25,500 – 26,300 for the next few weeks. “A decisive and sustained close above 26,400 will be a major breakout trigger, opening the path towards 28,500 in the medium term. On the downside, 24,500 remains a crucial support for the year, while 26,400 stands as a key resistance zone,” he said. Overall structure remains constructive, but near-term price action suggests range-bound movement before the next directional expansion, the analyst explained. Follow all LIVE updates from the stock markets here.","According to Maurya, Nifty can easily target the 28,000 level by the year-end if the global environment remains stable and the earnings trajectory of India remains strong.","'Trade deal instilled confidence in India's earnings trajectory': The trade agreement between India and the US has also instilled a degree of confidence in the earnings trajectory of India, particularly in export-driven segments, and this is why Nifty targets for the year-end are being revised higher, said Siddharth Maurya, Founder & Managing Director, Vibhavangal Anukulakara.","Jigar S. Patel, Senior Manager of Equity Technical Research at Anand Rathi Share and Stock Brokers, however said that he expects Nifty to remain in a consolidation phase between 25,500 – 26,300 for the next few weeks.","'Trade deal instilled confidence in India's earnings trajectory': The trade agreement between India and the US has also instilled a degree of confidence in the earnings trajectory of India, particularly in export-driven segments, and this is why Nifty targets for the year-end are being revised higher, said Siddharth Maurya, Founder & Managing Director, Vibhavangal Anukulakara."
Buy Awfis Space Solutions; target of Rs 590: Choice Institutional Equities,https://www.moneycontrol.com/news/business/stocks/buy-awfis-space-solutions-target-of-rs-590-choice-institutional-equities-13807485.html,"Choice Institutional Equities's report on Awfis Space Solutions AWFIS delivered a strong operational performance with a higher blended occupancy of 75%, increasing by 100 bps and 200 bps, QoQ and YoY, respectively. Higher occupancy level was supported by a favourable seat cohort mix, with over 500-seat cohort representing 36% of the total portfolio. EBITDA margin reached an all time high at 36.5% in Q3FY26 vs 36.1% in Q2FY26 and 33.8% in Q3FY25. AWFIS added 7,000 seats in this quarter. Outlook We have revised our target price for AWFIS to INR 590/share (INR 760/share earlier), implying an upside potential of 51.7%. Our revision reflects a combination of higher projected capex and lower PAT for FY26–28E. Additionally, we have applied a lower sectoral EV/Adjusted EBITDA multiple of 15x (16x earlier) to account for muted investor sentiment and subdued relative price performance of the office space sector. For all recommendations report, click here Disclaimer: The views and investment tips expressed by investment experts/broking houses/rating agencies on moneycontrol.com are their own, and not that of the website or its management. Moneycontrol.com advises users to check with certified experts before taking any investment decisions. Awfis Space Solutions - 0302026 -choice","Choice Institutional Equities's report on Awfis Space Solutions AWFIS delivered a strong operational performance with a higher blended occupancy of 75%, increasing by 100 bps and 200 bps, QoQ and YoY, respectively.","Choice Institutional Equities's report on Awfis Space Solutions AWFIS delivered a strong operational performance with a higher blended occupancy of 75%, increasing by 100 bps and 200 bps, QoQ and YoY, respectively.",Our revision reflects a combination of higher projected capex and lower PAT for FY26–28E.,"Choice Institutional Equities's report on Awfis Space Solutions AWFIS delivered a strong operational performance with a higher blended occupancy of 75%, increasing by 100 bps and 200 bps, QoQ and YoY, respectively."
"Aditya Birla Capital shares jump 8% as Advent set to buy 14% stake in subsidiary for Rs 2,750 crore",https://www.moneycontrol.com/news/business/markets/aditya-birla-capital-shares-jump-8-as-advent-set-to-buy-14-stake-in-subsidiary-for-rs-2-750-crore-13807537.html,"The shares of Aditya Birla Capital jumped in trade on February 3 as Advent International L.P is set to invest Rs 2,750 crores in Aditya Birla Housing Finance. The shares of Aditya Birla Capital jumped more than 8 percent to trade at Rs 360.85 apiece in the morning, extending gains for the second consecutive session. Advent to invest in Aditya Birla Housing Finance: Aditya Birla Capital in an exchange filing announced that its board has considered and approved a proposal for a primary capital investment of Rs 2,750 crore by Indriya Limited, one of the entities of Advent International L.P, into its wholly owned subsidiary Aditya Birla Housing Finance. After the completion of the investment, Advent International will hold 14.286 percent of the paid-up equity share capital of Aditya Birla Housing Finance on a fully diluted basis. The investment is however subject to the approval of the Competition Commission of India and other regulatory bodies. “The transaction values Aditya Birla Housing Finance at Rs.19,250 crore. After the completion of the transaction, Aditya Birla Capital will hold about 85.7 percent stake in its subsidiary. “ABHFL is one of the fastest growing housing finance companies in India and is among the top 3 players in terms of incremental loan book growth. The AUM of ABHFL grew by a CAGR of 48% over the last three years to Rs. 42,204 crore as of December 31, 2025. It has maintained best-inclass asset quality with gross stage 3 ratio of 0.54% and net stage 3 ratio of 0.23%. ABHFL plans to utilize the capital to sustain the current growth momentum and increase market share,” the company said. What management says: Aditya Birla Group Chairman Kumar Mangalam Birla said that the proposed capital infusion will strengthen Aditya Birla Housing Finance’s financial foundation, enable deeper market penetration, and enhance its ability to shape India’s inclusive and sustainable housing finance ecosystem. “India’s housing sector is at a defining inflection point, driven by progressive policy initiatives such as the Pradhan Mantri Awas Yojana, a sustained thrust on affordable urban housing, and the expanding reach of urban and rural infrastructure. These reforms have broadened housing demand across diverse income segments and geographies. Structured, transparent, and accessible housing finance will play a pivotal role in unlocking the next phase of large-scale growth,” he said. Aditya Birla Capita MD and CEO Vishakha Mulye meanwhile said that the group has significantly scaled its business over the last few years. “Today, ABHFL has a pan-India distribution footprint with a robust omnichannel sourcing network. This growth has been anchored in large market opportunities and sustained investments in technology, digital platforms, distribution, and talent enabling a scalable and resilient operating model. With this proposed capital raise, we enter the next phase of expansion for our housing finance business with a clear focus on sustaining growth momentum and increasing market share,” he said. Advent International Managing Partner Shweta Jalan meanwhile said that the firm is excited to partner once again with the Aditya Birla Group through its investment in Aditya Birla Housing. ""India's mortgage market is benefiting from strong structural tailwinds, led by supportive government initiatives and a constructive regulatory framework. Against this backdrop, Aditya Birla Housing has built a high-quality, trusted franchise with strong risk practices and governance standards that are synonymous with Aditya Birla Group companies. We have strong conviction in the leadership team and are delighted to support them as the Company enters its next phase of growth,"" she added. Follow all LIVE updates from the stock markets here.","The shares of Aditya Birla Capital jumped in trade on February 3 as Advent International L.P is set to invest Rs 2,750 crores in Aditya Birla Housing Finance.","After the completion of the investment, Advent International will hold 14.286 percent of the paid-up equity share capital of Aditya Birla Housing Finance on a fully diluted basis.","Structured, transparent, and accessible housing finance will play a pivotal role in unlocking the next phase of large-scale growth,” he said.","Advent to invest in Aditya Birla Housing Finance: Aditya Birla Capital in an exchange filing announced that its board has considered and approved a proposal for a primary capital investment of Rs 2,750 crore by Indriya Limited, one of the entities of Advent International L.P, into its wholly owned subsidiary Aditya Birla Housing Finance."
"Adani Enterprises, other Adani Group shares rise up to 12% on India-US trade deal",https://www.moneycontrol.com/news/business/markets/adani-enterprises-other-adani-group-shares-rise-up-to-12-on-india-us-trade-deal-13807377.html,"Adani Group shares rallied sharply on Tuesday, rising up to 12 percent, amid broad-based buying in the equity market after India and the US reached a trade agreement under which Washington will lower reciprocal tariffs on Indian goods to 18 percent. Adani Enterprises emerged as the top gainer in the benchmark Nifty50 pack, climbing 11.93 percent to an intraday high of Rs 2,233.40. The stock opened gap-up, gaining 7.75 percent. It has risen for the second straight session and is up about 14 percent over the past two days. Shares of Adani Ports and Special Economic Zone rose 8.33 percent to Rs 1,520 on the NSE. The stock opened 5.28 percent higher and has gained around 12 percent over the last two sessions. It was also among the top gainers on the benchmark index. Other Adani Group companies, including Adani Power and Adani Energy Solutions, also saw buying interest, amid expectations that certain group entities could benefit from stronger energy trade linkages and infrastructure-related opportunities stemming from deeper bilateral economic ties. Global brokerage firm Jefferies has listed Adani Group companies among the key beneficiaries of the trade deal. Domestic brokerage Antique also named Adani Power and Adani Ports as potential beneficiaries, according to an ET report. The rally in Adani stocks came alongside a sharp surge in the broader market. In early trade, the Sensex jumped 4,205.27 points, or 5.14 percent, to an intraday high of 85,871.73, while the Nifty surged 1,252.8 points, or 5 percent, to 26,341.20. US President Donald Trump on Monday said the United States has reached a trade agreement with India under which tariffs on Indian exports to the US will be reduced to 18 percent from 50 percent. He announced the decision on social media following a phone call with Prime Minister Narendra Modi. The development comes days after billionaire Gautam Adani and his nephew Sagar Adani have agreed to receive a legal notice from the US Securities and Exchange Commission in a civil fraud lawsuit alleging that investors were misled in connection with a bribery scheme, according to a court filing. The stipulation is subject to court approval. In a filing in a federal court in Brooklyn, New York, seen by PTI, the SEC and US-based lawyers representing Gautam and Sagar Adani said the lawyers had agreed to accept service of the regulator’s legal papers, removing the need for a judicial ruling on the mode of service. The joint stipulation has been submitted for approval to the concerned court, a standard procedural step in US legal proceedings. Disclaimer: The views and investment tips expressed by investment experts on Moneycontrol.com are their own and not those of the website or its management. Moneycontrol.com advises users to check with certified experts before taking any investment decisions.","Adani Enterprises emerged as the top gainer in the benchmark Nifty50 pack, climbing 11.93 percent to an intraday high of Rs 2,233.40.","Adani Group shares rallied sharply on Tuesday, rising up to 12 percent, amid broad-based buying in the equity market after India and the US reached a trade agreement under which Washington will lower reciprocal tariffs on Indian goods to 18 percent.","Adani Group shares rallied sharply on Tuesday, rising up to 12 percent, amid broad-based buying in the equity market after India and the US reached a trade agreement under which Washington will lower reciprocal tariffs on Indian goods to 18 percent.","In a filing in a federal court in Brooklyn, New York, seen by PTI, the SEC and US-based lawyers representing Gautam and Sagar Adani said the lawyers had agreed to accept service of the regulator’s legal papers, removing the need for a judicial ruling on the mode of service."
Buy Mahindra Lifespace Developers; target of Rs 500: Choice Institutional Equities,https://www.moneycontrol.com/news/business/stocks/buy-mahindra-lifespace-developers-target-of-rs-500-choice-institutional-equities-13807441.html,"Choice Institutional Equities's report on Mahindra Lifespace Developers MAHLIFE recorded healthy growth on a YOY basis; pre-sales and collections increased by 71.3% and 5.5%, respectively. While Average Selling Price also grew significantly by 28.4% YoY. Mahindra Blossom (Hopefarm, Bengaluru) witnessed exceptional traction with INR 10 Bn sales in a single weekend (to be recognised in Q4FY26). While Bhandup and Mahalaxmi projects are nearing final approval, new launches are expected in Q4FY26. Outlook We maintain our BUY rating on MAHLIFE with a TP of INR 500, factoring in the Residential Business, Integrated Cities & Industrial Clusters (IC&IC), Operations & Maintenance (O&M) segments, as well as the company’s historical land bank. For all recommendations report, click here Disclaimer: The views and investment tips expressed by investment experts/broking houses/rating agencies on moneycontrol.com are their own, and not that of the website or its management. Moneycontrol.com advises users to check with certified experts before taking any investment decisions. MAHLIFE - 0302026 -choice","Choice Institutional Equities's report on Mahindra Lifespace Developers MAHLIFE recorded healthy growth on a YOY basis; pre-sales and collections increased by 71.3% and 5.5%, respectively.","Outlook We maintain our BUY rating on MAHLIFE with a TP of INR 500, factoring in the Residential Business, Integrated Cities & Industrial Clusters (IC&IC), Operations & Maintenance (O&M) segments, as well as the company’s historical land bank.","Outlook We maintain our BUY rating on MAHLIFE with a TP of INR 500, factoring in the Residential Business, Integrated Cities & Industrial Clusters (IC&IC), Operations & Maintenance (O&M) segments, as well as the company’s historical land bank.","Outlook We maintain our BUY rating on MAHLIFE with a TP of INR 500, factoring in the Residential Business, Integrated Cities & Industrial Clusters (IC&IC), Operations & Maintenance (O&M) segments, as well as the company’s historical land bank."
"India-US trade deal impact: IT, auto stocks jump up to 10%, indices surge 6%; here's why",https://www.moneycontrol.com/news/business/markets/india-us-trade-deal-impact-it-auto-stocks-jump-up-to-10-indices-surge-6-here-s-why-13807419.html,"The shares of Indian IT and auto companies jumped in trade on February 3 after India and US concluded their much-awaited trade deal, boosting stock markets. The sharp rise in the share prices pushed the Nifty IT index up nearly 6 percent to 40,301.4 in the early trading hours of Tuesday. Nifty Auto index meanwhile surged more than 5 percent to 28,095.85. India-US trade deal: ""Out of friendship and respect for Prime Minister Modi and, as per his request, effective immediately, we agreed to a Trade Deal between the United States and India, whereby the United States will charge a reduced Reciprocal Tariff, lowering it from 25 percent to 18 percent,"" Trump wrote in a post on Truth Social after a telephonic conversation with Prime Minister Narendra Modi. Trump described Modi as “one of my greatest friends” and a “powerful and respected leader of his country,” adding that the two leaders discussed trade, global security and efforts to end the Russia Ukraine war. ""Key sectors that can benefit include textiles and apparel, auto ancillaries and engineering, specialty chemicals, agro and seafood exports, and select electronics and consumer manufacturers with US exposure,"" said Divam Sharma, Co-Founder and Fund Manager at Green Portfolio PMS. Why are IT stocks rising today? While the Trump tariffs did not directly impact the IT companies, the souring relations between the two countries bore an impact on the firms. The trade deal, implying better relations between India and US, may have boosted the shares of the IT companies, who derive a major portion of their revenue from the American market. IT sector was considered one of the beneficiaries of the India-U.S. trade agreement. Persistent Systems and Mphasis shares jumped nearly 8 percent, while heavyweight Infosys, HCL Technologies and Tata Consultancy Services (TCS) shares surged more than 6 percent each. Wipro and Tech Mahindra shares rallied over 7 percent each, while Coforge and LTIMindtree shares gained more than 5 percent each. Why are auto and auto ancillary stocks rising today? Jefferies said that the key beneficiaries of the India-US trade deal includes auto ancillaries with meaningful exposure to the U.S. such as Sona BLW Precision Forgings. The shares of the company jumped 10 percent to trade at Rs 549.45 apiece. Bharat Forge and Samvardhana Motherson shares gained nearly 10 percent each, while Tube Investments of India shares gained around 8 percent. UNO Minda shares rose around 6 percent. The shares of automakers like Mahindra & Mahindra, Tata Motors PV, Bajaj Auto, Eicher Motors, TVS Motors, Maruti Suzuki and others gained up to 3 percent. Follow all LIVE updates from the stock markets here.","The shares of Indian IT and auto companies jumped in trade on February 3 after India and US concluded their much-awaited trade deal, boosting stock markets.","The shares of Indian IT and auto companies jumped in trade on February 3 after India and US concluded their much-awaited trade deal, boosting stock markets.","India-US trade deal: ""Out of friendship and respect for Prime Minister Modi and, as per his request, effective immediately, we agreed to a Trade Deal between the United States and India, whereby the United States will charge a reduced Reciprocal Tariff, lowering it from 25 percent to 18 percent,"" Trump wrote in a post on Truth Social after a telephonic conversation with Prime Minister Narendra Modi.","India-US trade deal: ""Out of friendship and respect for Prime Minister Modi and, as per his request, effective immediately, we agreed to a Trade Deal between the United States and India, whereby the United States will charge a reduced Reciprocal Tariff, lowering it from 25 percent to 18 percent,"" Trump wrote in a post on Truth Social after a telephonic conversation with Prime Minister Narendra Modi."
