title,link,content
"Jindal Stainless shares fall 3.77%, among top losers on Nifty Midcap 150",https://www.moneycontrol.com/news/business/stocks/jindal-stainless-shares-fall-3-77-among-top-losers-on-nifty-midcap-150-alpha-article-13587098.html,"Shares of Jindal Stainless were trading down 3.77% at Rs 759.40, making it one of the top losers on the Nifty Midcap 150 index. Berger Paints, Ola Electric, Ipca Labs and Balkrishna Ind were also among the top losers. Jindal Stainless Financials Jindal Stainless' revenue for the quarter-ending June 2025 stood at Rs 10,207.14 Crore, compared to Rs 9,429.76 Crore in June 2024. Net profit for the same period was Rs 728.32 Crore, up from Rs 647.50 Crore in the previous year. The company's EPS for June 2025 was Rs 8.67, compared to Rs 7.87 in June 2024. All the values are consolidated. The annual revenue for Jindal Stainless in March 2025 was Rs 39,312.21 Crore, an increase from Rs 38,562.47 Crore in March 2024. The net profit for the same period was Rs 2,543.42 Crore, compared to Rs 2,640.35 Crore in the previous year. The company's EPS for March 2025 was Rs 30.42, while the BVPS was Rs 202.61. The debt-to-equity ratio was 0.38 as of March 2025. All the values are consolidated.Financial YearRevenue (Rs Crore)Net Profit (Rs Crore)EPS (Rs)BVPS (Rs)ROE (%)Debt to EquityMar 20215,783.191,177.5360.91310.3919.620.17Mar 20228,295.121,435.3874.25358.6720.700.36Mar 20239,759.531,057.4054.70390.9413.990.44Mar 20249,368.871,471.4976.12458.0416.610.35Mar 202510,446.951,654.9685.61537.3815.930.31Jindal Stainless reported annual sales of Rs 10,446 Crore for March 2025 compared to sales of Rs 9,368 Crore in March 2024. Berger Paints Financials Berger Paints' revenue for the quarter-ending June 2025 was Rs 3,200.76 Crore, up from Rs 3,091.01 Crore in June 2024. Net profit for the same period was Rs 303.87 Crore, down from Rs 344.41 Crore in the previous year. The company's EPS for June 2025 was Rs 2.70, compared to Rs 3.03 in June 2024. All values are consolidated. The annual revenue for Berger Paints in March 2025 was Rs 11,544.71 Crore, an increase from Rs 11,198.92 Crore in March 2024. The net profit for the same period was Rs 1,147.75 Crore, compared to Rs 1,128.80 Crore in the previous year. The company's EPS for March 2025 was Rs 10.13, while the BVPS was Rs 52.78. The debt-to-equity ratio was 0.02 as of March 2025. All values are consolidated.Financial YearRevenue (Rs Crore)Net Profit (Rs Crore)EPS (Rs)BVPS (Rs)ROE (%)Debt to EquityMar 20216,817.59725.337.4134.8421.310.11Mar 20228,761.78829.098.5840.5021.200.17Mar 202310,567.84873.578.8646.3519.120.17Mar 202411,198.921,128.8010.0246.2321.700.04Mar 202511,544.711,147.7510.1352.7819.180.02Berger Paints reported annual sales of Rs 11,544 Crore for March 2025 compared to sales of Rs 11,198 Crore in March 2024. Ola Electric Financials Ola Electric's revenue for the quarter-ending June 2025 was Rs 828.00 Crore, compared to Rs 1,644.00 Crore in June 2024. Net profit for the same period was Rs -428.00 Crore, up from Rs -347.00 Crore in the previous year. The company's EPS for June 2025 was Rs -0.97, compared to Rs -0.95 in June 2024. All values are consolidated. The annual revenue for Ola Electric in March 2025 was Rs 4,514.00 Crore, a decrease from Rs 5,009.83 Crore in March 2024. The net profit for the same period was Rs -2,276.00 Crore, compared to Rs -1,584.40 Crore in the previous year. The company's EPS for March 2025 was Rs -5.48, while the BVPS was Rs 11.66. The debt-to-equity ratio was 0.59 as of March 2025. All values are consolidated.Financial YearRevenue (Rs Crore)Net Profit (Rs Crore)EPS (Rs)BVPS (Rs)ROE (%)Debt to EquityMar 2022373.42-784.15-2.239.50-42.210.40Mar 20232,630.93-1,472.08-3.912.80-269.243.01Mar 20245,009.83-1,584.40-4.35-4.880.00-2.50Mar 20254,514.00-2,276.00-5.4811.66-44.250.59Ola Electric reported annual sales of Rs 4,514 Crore for March 2025 compared to sales of Rs 5,009 Crore in March 2024. Ipca Labs Financials Ipca Labs' revenue for the quarter-ending June 2025 stood at Rs 2,308.85 Crore, compared to Rs 2,092.63 Crore in June 2024. Net profit for the same period was Rs 234.42 Crore, down from Rs 198.98 Crore in the previous year. The company's EPS for June 2025 was Rs 9.19, compared to Rs 7.58 in June 2024. All values are consolidated. The annual revenue for Ipca Labs in March 2025 was Rs 8,939.59 Crore, an increase from Rs 7,705.04 Crore in March 2024. The net profit for the same period was Rs 787.53 Crore, compared to Rs 529.21 Crore in the previous year. The company's EPS for March 2025 was Rs 35.14, while the BVPS was Rs 273.88. The debt-to-equity ratio was 0.19 as of March 2025. All values are consolidated.Financial YearRevenue (Rs Crore)Net Profit (Rs Crore)EPS (Rs)BVPS (Rs)ROE (%)Debt to EquityMar 20215,419.991,148.8445.01371.7924.240.05Mar 20225,829.79910.9534.85219.5116.090.14Mar 20236,244.32491.9318.58233.168.060.25Mar 20247,705.04529.2125.82304.578.640.22Mar 20258,939.59787.5335.14273.8810.610.19Ipca Labs reported annual sales of Rs 8,939 Crore for March 2025 compared to sales of Rs 7,705 Crore in March 2024. Balkrishna Ind Financials Balkrishna Ind's revenue for the quarter-ending June 2025 was Rs 2,760.02 Crore, compared to Rs 2,714.50 Crore in June 2024. Net profit for the same period was Rs 288.30 Crore, down from Rs 489.99 Crore in the previous year. The company's EPS for June 2025 was Rs 14.91, compared to Rs 25.35 in June 2024. All values are consolidated. The annual revenue for Balkrishna Ind in March 2025 was Rs 10,446.95 Crore, an increase from Rs 9,368.87 Crore in March 2024. The net profit for the same period was Rs 1,654.96 Crore, compared to Rs 1,471.49 Crore in the previous year. The company's EPS for March 2025 was Rs 85.61, while the BVPS was Rs 537.38. The debt-to-equity ratio was 0.31 as of March 2025. All values are consolidated.Financial YearRevenue (Rs Crore)Net Profit (Rs Crore)EPS (Rs)BVPS (Rs)ROE (%)Debt to EquityMar 20215,783.191,177.5360.91310.3919.620.17Mar 20228,295.121,435.3874.25358.6720.700.36Mar 20239,759.531,057.4054.70390.9413.990.44Mar 20249,368.871,471.4976.12458.0416.610.35Mar 202510,446.951,654.9685.61537.3815.930.31Balkrishna Ind reported annual sales of Rs 10,446 Crore for March 2025 compared to sales of Rs 9,368 Crore in March 2024. Corporate Actions Jindal Stainless Jindal Stainless announced closure of trading window on September 26, 2025. The company also announced intimation under Regulation 57 of SEBI Listing Regulations on payment of interest in respect of Non-Convertible Debentures on September 26, 2025. The company has announced Final dividend of Rs.2.0000 per share(100%)Final Dividend, with effective date August 22, 2025. The company had a stock split, with ex-split date on March 01, 2004. Berger Paints Berger Paints announced closure of trading window on September 25, 2025. The company also announced credit rating on September 20, 2025. The company has announced Final dividend of Rs.3.8000 per share(380%)Dividend, with effective date August 05, 2025. The company has announced bonus issue with ex-bonus date on September 22, 2023. The bonus ratio is 1:5. The company had a stock split, with ex-split date on January 08, 2015. Ipca Labs Ipca Labs announced press release on September 24, 2025 and closure of trading window on September 22, 2025. The company has announced Final dividend of Rs.2.0000 per share(200%)Final Dividend, with effective date August 05, 2025. The company has announced bonus issue with ex-bonus date on January 28, 2005. The bonus ratio is 1:1. The company had a stock split, with ex-split date on January 10, 2022. With the stock's last traded price at Rs 759.40, Jindal Stainless was among the top losers on Nifty Midcap 150."
"Cipla, Titan Company, Tata Steel, Hindalco stocks among top gainers on Nifty 50 in today's session",https://www.moneycontrol.com/news/business/stocks/cipla-titan-company-tata-steel-hindalco-stocks-among-top-gainers-on-nifty-50-in-today-s-session-alpha-article-13587101.html,"At 10:00 am on Monday, several stocks were trading positively on the Nifty 50. Among the top gainers were Cipla, Titan Company, Tata Steel, Hindalco, and Trent. Cipla led the gains, trading at Rs 1,524.70, up 1.69%. Titan Company followed, with its shares trading at Rs 3,378.90, a rise of 1.55%. Tata Steel's shares were up 1.27% at Rs 169.53, while Hindalco traded at Rs 751.15, gaining 0.98%. Trent's shares also saw a positive movement, trading at Rs 4,722.00, up 0.92%. Cipla Financial Highlights: Cipla's financial performance shows consistent growth in revenue and net profit over the past few years. The consolidated revenue for the year-ending March 2025 stood at Rs 27,547.62 Crore, a notable increase compared to Rs 25,774.09 Crore in the previous year and Rs 22,753.12 Crore in 2023. The net profit also saw a substantial rise, reaching Rs 5,291.05 Crore for the year-ending March 2025, up from Rs 4,155.31 Crore in 2024.The company’s earnings per share (EPS) increased from Rs 51.05 in March 2024 to Rs 65.29 in March 2025. Cipla - Key Financial Metrics (Consolidated):HeadingMar 2021Mar 2022Mar 2023Mar 2024Mar 2025RevenueRs 19,159.59 CroreRs 21,763.34 CroreRs 22,753.12 CroreRs 25,774.09 CroreRs 27,547.62 CroreNet ProfitRs 2,401.30 CroreRs 2,559.47 CroreRs 2,835.49 CroreRs 4,155.31 CroreRs 5,291.05 CroreEPS29.8231.2034.7251.0565.29BVPS230.46261.74293.79331.98386.25ROE13.1212.0711.9615.4316.90Debt to Equity0.080.040.020.010.00Titan Company Financial Highlights: Titan Company's financial data shows significant revenue growth, with the year-ending March 2025 revenue at Rs 60,456 Crore, compared to Rs 51,084 Crore in the previous year. However, net profit decreased to Rs 3,336 Crore in March 2025 from Rs 3,495 Crore in March 2024. The company’s earnings per share (EPS) also saw a slight decrease, from Rs 39.40 in March 2024 to Rs 37.62 in March 2025. Titan Company - Key Financial Metrics (Consolidated):HeadingMar 2021Mar 2022Mar 2023Mar 2024Mar 2025RevenueRs 21,644.00 CroreRs 28,799.00 CroreRs 40,575.00 CroreRs 51,084.00 CroreRs 60,456.00 CroreNet ProfitRs 979.00 CroreRs 2,198.00 CroreRs 3,273.00 CroreRs 3,495.00 CroreRs 3,336.00 CroreEPS10.9624.4936.6139.4037.62BVPS84.29104.87133.75105.54130.61ROE12.9723.3527.4237.2128.70Debt to Equity0.580.060.631.401.56Tata Steel Financial Highlights: Tata Steel's financial results reveal a fluctuating performance. Revenue for the year-ending March 2025 stood at Rs 218,542 Crore, slightly lower than the Rs 229,170 Crore in the previous year. The net profit, however, showed a recovery, reaching Rs 2,982 Crore in March 2025 compared to a loss of Rs -4,851 Crore in March 2024. The company’s earnings per share (EPS) also reflected this turnaround, increasing from Rs -3.62 in March 2024 to Rs 2.74 in March 2025. Tata Steel - Key Financial Metrics (Consolidated):HeadingMar 2021Mar 2022Mar 2023Mar 2024Mar 2025RevenueRs 156,477.40 CroreRs 243,959.17 CroreRs 243,352.69 CroreRs 229,170.78 CroreRs 218,542.51 CroreNet ProfitRs 7,862.45 CroreRs 41,100.16 CroreRs 7,657.23 CroreRs -4,851.63 CroreRs 2,982.97 CroreEPS63.78332.357.17-3.622.74BVPS640.69958.8786.1274.1073.09ROE10.1935.088.49-4.823.75Debt to Equity1.100.600.760.890.98Hindalco Financial Highlights: Hindalco's financial performance indicates a strong upward trend. Revenue for the year-ending March 2025 reached Rs 238,496 Crore, a significant increase from Rs 215,962 Crore in the previous year. Net profit also saw substantial growth, rising to Rs 15,999 Crore in March 2025 from Rs 10,153 Crore in March 2024. Accordingly, the company’s earnings per share (EPS) improved from Rs 45.71 to Rs 72.05 over the same period. Hindalco - Key Financial Metrics (Consolidated):HeadingMar 2021Mar 2022Mar 2023Mar 2024Mar 2025RevenueRs 131,985.00 CroreRs 195,059.00 CroreRs 223,202.00 CroreRs 215,962.00 CroreRs 238,496.00 CroreNet ProfitRs 5,177.00 CroreRs 14,195.00 CroreRs 10,088.00 CroreRs 10,153.00 CroreRs 15,999.00 CroreEPS15.6661.7345.4245.7172.05BVPS299.73352.24427.09478.17557.25ROE5.2317.5610.659.5612.93Debt to Equity0.980.810.620.510.50Trent Financial Highlights: Trent's financial data reveals consistent revenue and net profit growth. The consolidated revenue for the year-ending March 2025 was Rs 17,134.61 Crore, a significant increase from Rs 12,375.11 Crore in the previous year. The net profit also rose substantially, reaching Rs 1,447.91 Crore for the year-ending March 2025, up from Rs 1,353.89 Crore in 2024. Accordingly, the company’s earnings per share (EPS) increased from Rs 41.82 to Rs 43.51 over the same period. Trent - Key Financial Metrics (Consolidated):HeadingMar 2021Mar 2022Mar 2023Mar 2024Mar 2025RevenueRs 2,592.96 CroreRs 4,498.02 CroreRs 8,242.02 CroreRs 12,375.11 CroreRs 17,134.61 CroreNet ProfitRs -109.77 CroreRs 29.46 CroreRs 310.22 CroreRs 1,353.89 CroreRs 1,447.91 CroreEPS-4.112.9812.5141.8243.51BVPS66.3267.7974.91115.40153.64ROE-6.314.4717.1336.5528.31Debt to Equity0.000.210.190.120.09Cipla Ltd has announced that the meeting of the Board of Directors of the Company is scheduled on 30/10/2025, inter alia, to consider and approve the unaudited standalone and consolidated financial results for the quarter and half year ending September 30, 2025. In compliance with Regulation 30 of SEBI (Listing Obligations and Disclosure Requirements) Regulations, 2015, the Operations and Administrative Committee of the Company on September 12, 2025, has allotted 11,621 fully paid up equity shares of INR 2 each pursuant to exercise of employee stock options/stock appreciation rights under the Employee Stock Option Scheme 2013-A and Cipla Employee Stock Appreciation Rights Scheme 2021. The company announced a final dividend of Rs 13.00 per share and a special dividend of Rs 3 per share, with an effective date of June 27, 2025. The company has a history of bonus issues, including a 3:2 bonus ratio in 2006, and has also undergone stock splits, with the face value split from Rs 10 to Rs 2 in 2004. Titan Company announced a final dividend of Rs 11.00 per share with an effective date of July 8, 2025. The company had a bonus issue with a 1:1 ratio in 2011 and a stock split where the face value split from Rs 10 to Rs 1 on June 23, 2011. Tata Steel announced acquisition of equity stake in T Steel Holdings Pte. Ltd. The company announced a final dividend of Rs 3.60 per share with an effective date of June 6, 2025. The company had a bonus issue with a 1:2 bonus ratio in 2004 and a stock split where the face value split from Rs 10 to Rs 1 on July 28, 2022. Hindalco Industries Ltd has announced that the meeting of the Board of Directors of the Company is scheduled on 07/11/2025, inter alia, to consider and approve the unaudited standalone and consolidated financial results for the quarter and half year ending September 30, 2025. The company announced a final dividend of Rs 5.00 per share with an effective date of August 8, 2025. The company had a bonus issue with a 1:2 bonus ratio in 1996 and a stock split where the face value split from Rs 10 to Rs 1 on August 30, 2005. Trent announced a final dividend of Rs 5.00 per share with an effective date of June 12, 2025. The company had a bonus issue with a 1:1 bonus ratio in 1996 and a stock split where the face value split from Rs 10 to Rs 1 on September 12, 2016. These financial metrics and corporate actions provide a comprehensive overview of the financial health and strategic decisions of these Nifty 50 companies."
Maruti Suzuki India shares fall 1.2% in today's trading session,https://www.moneycontrol.com/news/business/stocks/maruti-suzuki-india-shares-fall-1-2-in-today-s-trading-session-alpha-article-13587067.html,"Shares of Maruti Suzuki India fell as much as 1.2% on Monday morning to a low of Rs 16,086 on NSE. Maruti Suzuki stock is a constituent of the benchmark index, NSE Nifty 50. Financial Highlights Maruti Suzuki India's financial performance showcases consistent growth in revenue and net profit over the past few years. An overview of the company's consolidated financial results is as follows:ParticularsMar 2021Mar 2022Mar 2023Mar 2024Mar 2025RevenueRs 70,372 CroreRs 88,329.80 CroreRs 117,571.30 CroreRs 141,858.20 CroreRs 152,913.00 CroreNet ProfitRs 4,220.10 CroreRs 3,717.60 CroreRs 8,033.60 CroreRs 13,234.10 CroreRs 14,256.30 CroreEPSRs 145.30Rs 128.43Rs 271.82Rs 429.01Rs 461.20BVPSRs 1,738.43Rs 1,832.24Rs 2,046.07Rs 2,723.79Rs 3,061.07ROE8.367.0113.2815.7515.06Debt to Equity0.010.010.020.000.00The company has demonstrated substantial growth, with revenue increasing from Rs 70,372 Crore in March 2021 to Rs 152,913 Crore in March 2025. Net profit also saw a significant rise, from Rs 4,220.10 Crore to Rs 14,256.30 Crore over the same period. The debt-to-equity ratio has remained low, indicating a strong financial position. Annual Income Statement (Consolidated)ParticularsMar 2021Mar 2022Mar 2023Mar 2024Mar 2025SalesRs 70,372 CroreRs 88,329 CroreRs 117,571 CroreRs 141,858 CroreRs 152,913 CroreOther IncomeRs 2,936 CroreRs 1,744 CroreRs 2,140 CroreRs 4,093 CroreRs 5,022 CroreTotal IncomeRs 73,308 CroreRs 90,074 CroreRs 119,712 CroreRs 145,951 CroreRs 157,935 CroreTotal ExpenditureRs 68,054 CroreRs 85,412 CroreRs 109,379 CroreRs 128,587 CroreRs 138,364 CroreEBITRs 5,253 CroreRs 4,661 CroreRs 10,332 CroreRs 17,364 CroreRs 19,570 CroreInterestRs 101 CroreRs 126 CroreRs 187 CroreRs 193 CroreRs 194 CroreTaxRs 931 CroreRs 817 CroreRs 2,112 CroreRs 3,936 CroreRs 5,119 CroreNet ProfitRs 4,220 CroreRs 3,717 CroreRs 8,033 CroreRs 13,234 CroreRs 14,256 CroreThe annual income statement shows consistent growth in sales and other income, leading to increased total income. Total expenditure has also risen, but the company has managed to maintain a healthy EBIT. Net profit has seen substantial growth, particularly in recent years. Quarterly Financials The consolidated quarterly results provide a detailed view of Maruti Suzuki India's recent financial performance:ParticularsJun 2024Sep 2024Dec 2024Mar 2025Jun 2025SalesRs 35,779 CroreRs 37,449 CroreRs 38,764 CroreRs 40,920 CroreRs 38,605 CroreOther IncomeRs 1,060 CroreRs 1,523 CroreRs 1,057 CroreRs 1,511 CroreRs 1,888 CroreTotal IncomeRs 36,839 CroreRs 38,972 CroreRs 39,822 CroreRs 42,431 CroreRs 40,493 CroreTotal ExpenditureRs 32,004 CroreRs 33,836 CroreRs 35,116 CroreRs 37,537 CroreRs 35,538 CroreEBITRs 4,835 CroreRs 5,136 CroreRs 4,705 CroreRs 4,893 CroreRs 4,954 CroreInterestRs 57 CroreRs 43 CroreRs 46 CroreRs 47 CroreRs 46 CroreTaxRs 1,076 CroreRs 2,038 CroreRs 999 CroreRs 1,006 CroreRs 1,151 CroreNet ProfitRs 3,702 CroreRs 3,055 CroreRs 3,659 CroreRs 3,839 CroreRs 3,756 CroreThe quarterly sales have generally increased over the observed period, with a slight dip in June 2025. Other income has fluctuated, contributing to variations in total income. Despite rising expenditures, Maruti Suzuki India has maintained a steady EBIT. Net profit has remained relatively consistent, showcasing the company's ability to manage its financials effectively. Cash Flow Statement Maruti Suzuki India's cash flow statement provides insights into the company's cash inflows and outflows from operating, investing, and financing activities:ParticularsMar 2021Mar 2022Mar 2023Mar 2024Mar 2025Operating ActivitiesRs 8,856 CroreRs 1,840 CroreRs 9,251 CroreRs 16,801 CroreRs 16,136 CroreInvesting Activities-Rs 7,291 Crore-Rs 239 Crore-Rs 8,036 Crore-Rs 11,864 Crore-Rs 14,456 CroreFinancing Activities-Rs 1,544 Crore-Rs 1,607 Crore-Rs 1,213 Crore-Rs 4,062 Crore-Rs 4,155 CroreOthersRs 0 CroreRs 0 CroreRs 0 CroreRs 0 CroreRs 0 CroreNet Cash FlowRs 20 Crore-Rs 5 CroreRs 2 CroreRs 874 Crore-Rs 2,475 CroreMaruti Suzuki India has consistently generated positive cash flow from operating activities. Investing activities have generally resulted in cash outflows, reflecting investments in fixed assets and other areas. Financing activities have also typically led to cash outflows. The net cash flow has varied over the years, with a notable increase in March 2024 followed by a decrease in March 2025. Balance Sheet The consolidated balance sheet shows the company's assets, liabilities, and equity:ParticularsMar 2021Mar 2022Mar 2023Mar 2024Mar 2025Share CapitalRs 151 CroreRs 151 CroreRs 151 CroreRs 157 CroreRs 157 CroreReserves & SurplusRs 52,349 CroreRs 55,182 CroreRs 61,640 CroreRs 85,478 CroreRs 96,082 CroreCurrent LiabilitiesRs 16,120 CroreRs 17,023 CroreRs 20,107 CroreRs 25,951 CroreRs 30,570 CroreOther LiabilitiesRs 2,661 CroreRs 2,298 CroreRs 2,698 CroreRs 3,762 CroreRs 5,161 CroreTotal LiabilitiesRs 71,282 CroreRs 74,655 CroreRs 84,596 CroreRs 115,350 CroreRs 131,971 CroreFixed AssetsRs 16,485 CroreRs 16,683 CroreRs 20,734 CroreRs 35,599 CroreRs 40,911 CroreCurrent AssetsRs 18,544 CroreRs 16,793 CroreRs 11,615 CroreRs 22,633 CroreRs 29,524 CroreOther AssetsRs 36,252 CroreRs 41,178 CroreRs 52,246 CroreRs 57,117 CroreRs 61,535 CroreTotal AssetsRs 71,282 CroreRs 74,655 CroreRs 84,596 CroreRs 115,350 CroreRs 131,971 CroreContingent LiabilitiesRs 15,704 CroreRs 21,354 CroreRs 34,446 CroreRs 30,579 CroreRs 33,587 CroreThe balance sheet shows a steady increase in total assets and total liabilities over the years. Reserves and surplus have also grown, reflecting the company's profitability. Fixed assets and current assets have generally increased, supporting the company's operations and growth. Financial Ratios Key financial ratios for Maruti Suzuki India provide insights into the company's profitability, efficiency, and financial health:RatioMar 2021Mar 2022Mar 2023Mar 2024Mar 2025Basic EPS (Rs.)Rs 145.30Rs 128.43Rs 271.82Rs 429.01Rs 461.20Diluted EPS (Rs.)Rs 145.30Rs 128.43Rs 271.82Rs 429.01Rs 461.20Book Value / Share (Rs.)Rs 1,738.43Rs 1,832.24Rs 2,046.07Rs 2,723.79Rs 3,061.07Dividend/Share (Rs.)Rs 45.00Rs 60.00Rs 90.00Rs 125.00Rs 135.00Face Value55555Gross Profit Margin (%)11.778.4311.1915.9416.46Operating Margin (%)7.465.278.7812.2412.79Net Profit Margin (%)5.994.206.839.329.32Return on Equity (%)8.367.0113.2815.7515.06ROCE (%)9.528.0816.0219.4219.29Return On Assets (%)6.155.199.7011.6910.98Current Ratio (X)1.150.990.580.870.97Quick Ratio (X)0.960.780.360.670.74Debt to Equity (x)0.010.010.020.000.00Interest Coverage Ratios (X)51.6158.8570.37116.84129.65Asset Turnover Ratio (%)98.721.221.481.421.24Inventory Turnover Ratio (X)23.0812.0711.9416.4425.003 Yr CAGR Sales (%)-6.101.3124.6641.9831.573 Yr CAGR Net Profit (%)-26.05-29.5720.2177.0995.83P/E (x)47.2158.8730.5129.3724.98P/B (x)3.954.134.054.633.76EV/EBITDA (x)24.6930.2819.1217.4114.36P/S (x)2.942.582.132.802.37Maruti Suzuki India’s ratios reflect strong financial performance. EPS has increased steadily, indicating improved profitability per share. The company has also consistently increased its dividend per share, rewarding investors. Profitability margins (gross, operating, and net) have shown positive trends, reflecting efficient operations. Corporate Actions Maruti Suzuki India has announced several corporate actions, including dividend declarations and other key updates.Final Dividend: The company announced a final dividend of Rs 135 per share (2700%) on April 25, 2025, effective August 1, 2025.Final Dividend: A final dividend of Rs 125 per share (2500%) was declared on April 26, 2024, effective August 2, 2024.Additionally, the company has communicated various updates to the exchanges, including:Closure of Trading WindowIntimation under Regulation 30 of the Securities and Exchange Board of India (Listing Obligations and Disclosure Requirements) Regulations, 2015.Moneycontrol's analysis indicates a very bullish sentiment for Maruti Suzuki India as of September 29, 2025."
