title,link,content
Netflix Bulls vs. Bears: Who Wins This Pullback?,https://www.marketbeat.com/originals/netflix-bulls-vs-bears-who-wins-this-pullback/,"Shares of streaming giant Netflix Inc NASDAQ: NFLX closed Wednesday just below the $1,180 mark, leaving the stock roughly 15% off its early-July peak. That stumble starkly contrasts with the S&P 500’s nearly 3% gain over the same stretch. The divergence is striking, puzzling, and potentially worrying - all at the same time. It will also be a bitter pill for investors enjoying one of the cleanest multi-year rallies among the big tech names. Still, there are reasons to think we’re looking at a golden entry opportunity. Let’s look at two of the top reasons to be brave and one that says to still be wary. Starting with the fundamentals, last month’s report smashed expectations. Revenue was up nearly 16% yearly, and earnings per share surpassed the consensus. Going further, Netflix’s management shared fresh revenue and EPS guidance that also came in hot - a move that Wall Street usually loves to see. Behind those headline beats were a couple of standout drivers. For example, Netflix’s fledgling advertising segment is scaling faster than many expected, and already appears robust even if it’s still small in the grand scheme of things. The company’s growth across regions was fairly broad, and its dabbling into live streaming appears to be paying off already. These all helped to send the company’s operating margin to a record high of 34%, helped along by solid content cost leverage. It remains one of the world’s most recognizable brands, has proven capable of innovating and pivoting successfully, and is adding subscribers at a considerable clip. For investors who’ve been watching the stock rally for a while and were too cautious to chase an entry, this 15% haircut could be the perfect entry point. Backing up the theory that we could be looking at a golden opportunity is the fact that analyst sentiment remains overwhelmingly bullish. As Bank of America said after the report, “Netflix remains among the best-positioned companies in media and entertainment with sustainable growth drivers that should prove predictable and defensive amid a wide range of macroeconomic scenarios”. And they’re not the only ones. Multiple analysts reiterated positive views after the print, many nudging targets higher to reflect stronger optimism and belief in Netflix’s potential. Robert Baird, for example, reiterated its Outperform rating while upping its price target to $1,500, matching the update from both Needham and Jefferies. Meanwhile, the team at Wells Fargo moved their price target on Netflix up to $1,560—close to a street high. From where the stock closed on Wednesday, that’s not only pointing to a targeted upside of more than 30%, but suggesting Netflix shares could be back cruising through all-time highs very soon. However, it has to be noted that not everyone is convinced that this is a no-brainer. Amidst the gushing analyst support following last month’s report, there was at least one team that raised a big, bright red flag. Phillip Securities downgraded its rating to Strong Sell, arguing that the report wasn’t good enough to justify the rally, and that valuation was becoming a genuine concern. With a pre-earnings report price-to-earnings (P/E) ratio of almost 60, compared to the 40 it was around 12 months previously, it’s hard to argue with them. Phillip Securities analyst Helena Wang remains cautious on the company’s long-term growth potential, but feels there’s a much bigger correction needed to get the stock back to a healthy level from which to build again. Her $950 price target is a testament to this, which, even with the 15% drop over the past few weeks, suggests Netflix could easily fall another 20% or so. Wednesday’s 2.7% rise in the stock shows there’s still strong demand, with buyers already stepping in. It looks like an early rejection of the bears’ attempt to push the stock below Tuesday’s low. If Netflix can hold above the $1,150 level through week’s end, expect bearish momentum to fade fast. Before you consider Netflix, you'll want to hear this."
"How major US stock indexes fared Friday, 8/8/2025",https://www.marketbeat.com/articles/how-major-us-stock-indexes-fared-friday-882025-2025-08-08/,"Stocks rose on Wall Street, marking their third winning week in the last four. The S&P 500 rose 0.8% Friday, leaving the index just shy of the record it set last week. The Dow Jones Industrial Average climbed 0.5%, and the Nasdaq added 1% to the record it set a day earlier. Expedia and Gilead Sciences rose sharply after reporting results that easily beat analysts’ forecasts. Both companies also raised their outlooks. Asian markets closed mostly lower except in Tokyo, where the Nikkei rose 1.9%. European markets were mixed. Treasury yields rose in the bond market. On Friday: The S&P 500 rose 49.45 points, or 0.8%, to 6,389.45. The Dow Jones Industrial Average rose 206.97 points, or 0.5%, to 44,175.61. The Nasdaq composite rose 207.32 points, or 1%, to 21,450.02. The Russell 2000 index of smaller companies rose 3.70 points, or 0.2%, to 2,218.42. For the week: The S&P 500 is up 151.44 points, or 2.4%. The Dow is up 587.03 points, or 1.3%. The Nasdaq is up 799.89 points, or 3.9%. The Russell 2000 is up 51.64 points, or 2.4%. For the year: The S&P 500 is up 507.82 points, or 8.6%. The Dow is up 1,631.39 points, or 3.8%. The Nasdaq is up 2,139.23 points, or 11.1%. The Russell 2000 is down 11.74 points, or 0.5%. Before you consider Gilead Sciences, you'll want to hear this."
"Trump removes Billy Long as IRS commissioner, giving him the shortest-ever tenure in the role",https://www.marketbeat.com/articles/trump-removes-billy-long-as-irs-commisioner-less-than-2-months-after-his-confirmation-2025-08-08/,"WASHINGTON (AP) — President Donald Trump has removed former U.S. Rep. Billy Long as IRS commissioner less than two months after his confirmation, a White House official said Friday. It was not immediately clear why Long was dismissed. His quick exit makes him the shortest-tenured IRS commissioner confirmed by the Senate since the position was created in 1862. Long said in a social media post that Trump had nominated him for an ambassadorship. “It is a honor to serve my friend President Trump and I am excited to take on my new role as the ambassador to Iceland. I am thrilled to answer his call to service and deeply committed to advancing his bold agenda. Exciting times ahead!” the former Missouri congressman wrote on X. Treasury Secretary Scott Bessent will serve as acting IRS commissioner, according to the White House official, who was not authorized to speak publicly and spoke on condition of anonymity. Long’s ouster only compounds the turmoil at the nation’s tax collector, which has been beset by turnover since the beginning of Trump’s second term. The IRS shuffled through four acting leaders before Long was confirmed in June and has lost a quarter of its staff since the Department of Government Efficiency burrowed in in a self-stated mission to reduce waste, fraud and abuse. In a message to IRS employees after he was confirmed, Long talked about his plans for his first few months in office, a milestone he did not reach. ""In my first 90 days I plan to ask you, my employee partners, to help me develop a new culture here,” Long wrote. “I’m big on culture, and I’m anxious to develop one that makes your lives and the taxpayers’ lives better.” In many ways, he was an unusual pick for the role. While in Congress, where he served from 2011 to 2023, Long sponsored legislation to get rid of the IRS. A former auctioneer, Long had no background in tax administration. The Senate confirmed Long on a 53-44 vote despite Democrats’ concerns about the Republican’s past work for a firm that pitched a fraud-ridden coronavirus pandemic-era tax break and about campaign contributions he received after Trump nominated him. After leaving Congress to mount an unsuccessful 2022 bid for the U.S. Senate, Long worked with a firm that distributed the pandemic-era employee retention tax credit. That tax credit program was eventually shut down after then-IRS Commissioner Daniel Werfel determined that it was fraudulent. Democrats called for a criminal investigation into Long’s connections to other alleged tax credit loopholes. The lawmakers allege that firms connected to Long duped investors into spending millions of dollars to purchase fake tax credits. The acting Ieaders who preceded Long in the role included one who resigned over a deal between the IRS and the Department of Homeland Security to share immigrants’ tax data with Immigration and Customs Enforcement and another whose appointment led to a fight between former Trump adviser Elon Musk and Bessent. Long's departure comes after the agency underwent a series of DOGE-related job cuts this year. The Treasury Inspector General for Tax Administration reports that the agency has been cut down from 103,000 workers in January to 77,000 workers in May 2025. Most of the reductions came from DOGE's deferred resignation program. The workforce reductions were part of the Trump administration’s efforts to shrink the size of the federal bureaucracy."
"Trump removes Billy Long as IRS commissioner less than 2 months after he was confirmed, AP source says",https://www.marketbeat.com/articles/trump-removes-billy-long-as-irs-commissioner-less-than-2-months-after-he-was-confirmed-ap-source-says-2025-08-08/,"WASHINGTON (AP) — Trump removes Billy Long as IRS commissioner less than 2 months after he was confirmed, AP source says."
FAFSA application is open for early testing. Here's what to know.,https://www.marketbeat.com/articles/fafsa-application-is-open-for-early-testing-heres-what-to-know-2025-08-08/,"NEW YORK (AP) — The Free Application for Federal Student Aid for the 2026-27 school year has opened for a limited number of students as part of a beta test, the Department of Education says. The department is rolling out two beta testing phases before the application is fully available to everyone in October. At first, the FAFSA form will be available for a small number of students and families, chosen via existing partnerships with community organizations and schools. “We're using this time to monitor a limited number of FAFSA submissions to ensure our systems are performing as expected,” the department said on Monday. In September, students will be able to request participation in the second phase of beta testing. Participation will be limited, so not everyone will be accepted, said the Education Department. Here's what you need to know. The FAFSA is a free government application that uses students’ and their families’ financial information to determine whether they can get financial aid from the federal government to pay for college. The application will send a student’s financial information to the schools they are interested in attending. The amount of financial aid a student receives depends on each institution. The application is also used to determine eligibility for other federal student aid programs, like work-study and loans, as well as state and school aid. Sometimes, private, merit-based scholarships also require FAFSA information to determine if a student qualifies. The 2026–27 FAFSA form will be available to everyone by Oct. 1. The deadline to submit the FAFSA form is June 30, 2026. Students can start preparing to fill out the FAFSA now so they can complete it as soon as it’s available. The first step in the process is to create a studentaid.gov account and gather the following documents. —Social Security number —Driver’s license number —Alien registration number, if you are not a U.S. citizen —Federal income tax returns, W-2s and other records of money earned —Bank statements and records of investments —Records of untaxed income Anyone planning to attend college next year should fill out the form. Both first-time college students and returning students can apply for the FAFSA. Students and parents can use the federal student aid estimator to get an early approximation of their financial package. ___ The Associated Press receives support from Charles Schwab Foundation for educational and explanatory reporting to improve financial literacy. The independent foundation is separate from Charles Schwab and Co. Inc. The AP is solely responsible for its journalism."
Viasat: Why a Wall of Cash Has Shorts Running for Cover,https://www.marketbeat.com/originals/viasat-why-a-wall-of-cash-has-shorts-running-for-cover/,"For months, satellite communications company Viasat NASDAQ: VSAT was a classic battleground stock, attracting a significant number of investors betting against it. A long-standing narrative focused on the company’s heavy debt load and the rising threat of competition. But in a stunning two-day surge, Viasat’s stock price soared over 22% on explosive trading volume, signaling that the tide may be turning. The catalyst was a first-quarter earnings report that not only beat expectations but also challenged the very foundation of the current bearish sentiment. This set off a frantic rally as short-sellers, who had borrowed shares to bet on a price drop, were forced to buy them back. The key question for investors now is whether this was a momentary, technically driven short squeeze or the beginning of a meaningful and sustainable re-rating of a global communications sector powerhouse. The spark that ignited Viasat’s rally was its first-quarter fiscal year 2026 financial report. The company posted a non-GAAP earnings per share (EPS) of $0.17, decisively crushing the Viasat analyst community’s estimates of a $0.15 loss. Revenue also came in strong at $1.17 billion, sailing past forecasts. But the most important number in the report was not about earnings; it was about cash. Viasat generated $60 million in positive free cash flow, a remarkable $210 million improvement year-over-year. Free cash flow, the cash a company produces after accounting for capital expenditures, is a critical indicator of financial health. For a company like Viasat, which operates in a capital-intensive industry and carries substantial debt, this shift is a game-changer. It signals that the period of heavy investment may be cresting, allowing the company to begin harvesting returns, paying down debt, and funding its growth without relying on external financing. This performance was supported by clear evidence of improved capital discipline: This potent combination of growing cash flow and reduced spending directly addresses the primary concern that has weighed on the stock: its $6.7 billion debt load. By demonstrating an ability to generate its funding, Viasat has presented a credible path to deleveraging its balance sheet and achieving greater financial stability. While the market was focused on debt, Viasat’s core business segments were building significant momentum. The recent earnings report has forced investors to recognize the powerful growth engines that form the foundation of the company’s value proposition. The standout performer is Viasat's Defense and Advanced Technologies (DAT) segment. Often described as the company's crown jewel, this division provides secure, high-tech communications for government and military clients. Its latest performance was exceptional: This high-margin defense business offers a stable, expanding revenue base built on long-term government contracts. Its strength is a key reason why activist investors have argued the segment’s actual value is obscured within the larger company. At the same time, Viasat’s commercial aviation business is capitalizing on the global recovery of the travel sector. The in-flight connectivity division saw service revenue grow 14% as more aircraft were equipped with its systems. A new partnership with LATAM Group NYSE: LTM underscores its continued success in securing major, long-term airline contracts, locking in future revenue. With a strong quarter in the books, several key catalysts are on the horizon that could sustain the stock's upward momentum. First is the imminent expansion of its global satellite network. Viasat has confirmed that its ViaSat-3 F2 satellite is expected to ship to the launch site by September 2025. This satellite, covering Europe, the Middle East, and Africa, along with the subsequent Asia-Pacific satellite, will dramatically increase Viasat's available bandwidth. This new capacity will enable it to offer higher speeds and connect more devices simultaneously, opening up new revenue opportunities in its lucrative aviation, maritime, and government markets. Second, the company is nearing the finalization of a settlement with Ligado Networks. Pending court approval, this agreement is expected to provide Viasat with a new, high-margin revenue stream starting with quarterly payments of approximately $16 million. This potential income has not yet been factored into the company's financial guidance, representing a source of future upside. Finally, Viasat has a clear plan to use its financial strength to create a virtuous cycle. Management has stated that its priority is to use its growing free cash flow to pay down debt. This will not only strengthen the balance sheet but also reduce interest expenses, which in turn will free up even more cash for growth and further deleveraging. Viasat's recent rally appears to be more than a temporary, squeeze-driven event. It is rooted in a fundamental improvement in the company's financial trajectory, marked by a decisive turn toward generating, not consuming, cash. Investors are now recognizing the true value of its resilient defense and growing aviation businesses. With major operational catalysts on the horizon and a clear strategy to fortify its balance sheet, the evidence suggests this is the beginning of a durable and positive shift in the Viasat story. Before you consider Viasat, you'll want to hear this."
BC-OILS,https://www.marketbeat.com/articles/bc-oils-2025-08-04/,Get stock market news alerts:Sign Up
BC-Gold-Silver,https://www.marketbeat.com/articles/bc-gold-silver-2025-08-04/,Get investing news alerts:Sign Up
"A Florida woman posed as a nurse and treated thousands of unsuspecting patients, officials say",https://www.marketbeat.com/articles/a-florida-woman-posed-as-a-nurse-and-treated-thousands-of-unsuspecting-patients-officials-say-2025-08-08/,"PALM COAST, Fla. (AP) — A Florida woman is accused of posing as a licensed nurse and giving medical care to thousands of patients, authorities said. Autumn Marie Bardisa, 29, of Palm Coast, participated in medical services involving 4,486 people from June 2024 until January 2025, the Flagler County Sheriff's Office said. “This is one of the most disturbing cases of medical fraud we’ve ever investigated,” Flagler County Sheriff Rick Staly said in announcing the arrest. Bardisa was apprehended in the driveway of her home Tuesday and is jailed on multiple charges that include practicing health care without a license, sheriff's officials said. She's being held on $70,000 bond and is due in court for a Sept. 2 arraignment. No lawyer who could speak on behalf of Bardisa was listed in local court records. The sheriff’s office said Bardisa used another health care worker's license number and submitted false documentation in order to be employed as an advanced nurse technician at AdventHealth Palm Coast Parkway in Palm Coast. “This woman potentially put thousands of lives at risk by pretending to be someone she was not and violating the trust of patients, their families, AdventHealth and an entire medical community,"" Staly said. Officials say they've set up a special email, fakenursecase@flaglersheriff.com, and are asking anyone who thinks they might have been a victim in the case to email the sheriff's office. Palm Coast is about 60 miles (97 kilometers) south of Jacksonville, Florida."
Mexican authorities accuse Adidas of cultural appropriation in their sandal design,https://www.marketbeat.com/articles/mexican-authorities-accuse-adidas-of-cultural-appropriation-over-new-sandal-design-2025-08-08/,"MEXICO CITY (AP) — Mexican authorities are accusing sportswear company Adidas of plagiarizing artisans in southern Mexico, alleging that a new sandal design is strikingly similar to the traditional Indigenous footwear known as huaraches. The controversy has fueled accusations of cultural appropriation by the footwear brand, with authorities saying this is not the first time traditional Mexican handicrafts have been copied. Citing these concerns, local authorities have asked Adidas to withdraw the shoe model. Mexican President Claudia Sheinbaum said on Friday that Adidas was already in talks with authorities in the southern Mexican state of Oaxaca to provide “compensation for the people who were plagiarized,"" and that her government was preparing legal reforms to prevent the copying of Mexican handicrafts. The design at the center of the controversy is the “Oaxaca Slip-On,"" a sandal created by U.S. designer Willy Chavarría for Adidas Originals. The sandals feature thin leather straps braided in a style that is unmistakably similar to the traditional Mexican huaraches. Instead of flat leather soles, the Adidas shoes tout a more chunky, sports shoe sole. According to Mexican authorities, Adidas' design contains elements that are part of the cultural heritage of the Zapotec Indigenous communities in Oaxaca, particularly in the town of Villa Hidalgo de Yalálag. Handicrafts are a crucial economic lifeline in Mexico, providing jobs for around half a million people across the country. The industry accounts for around 10% of the gross domestic product of states like Oaxaca, Jalisco, Michoacán and Guerrero. For Viridiana Jarquín García, a huaraches creator and vendor in Oaxaca's capital, the Adidas shoes were a “cheap copy” of the kind of work that Mexican artists take time and care to craft. “The artistry is being lost. We're losing our tradition,"" she said in front of her small booth of leather shoes. Authorities in Oaxaca have called for the “Oaxaca Slip-On” to be withdrawn and demanded a public apology from Adidas, with officials describing the design as “cultural appropriation"" that may violate Mexican law. In a public letter to Adidas leadership, Oaxaca state Gov. Salomón Jara Cruz criticized the company’s design, saying that “creative inspiration” is not a valid justification for using cultural expressions that “provide identity to communities.” “Culture isn't sold, it's respected,” he added. Adidas responded in a letter Friday afternoon, saying that the company “deeply values the cultural wealth of Mexico’s Indigenous people and recognizes the relevance” of the criticisms. It requested to sit down with local officials and to discuss how it can “repair the damage” to Indigenous populations. The controversy follows years of efforts by Mexico's government and artisans to push back on major global clothing brands who they say copy traditional designs. In 2021, the federal government asked manufacturers including Zara, Anthropologie and Patowl to provide a public explanation for why they copied clothing designs from Oaxaca's Indigenous communities to sell in their stores. Now, Mexican authorities say they're trying to work out stricter regulations in an effort to protect artists. But Marina Núñez, Mexico's undersecretary of cultural development, noted that they also want to establish guidelines to not deprive artists of “the opportunity to trade or collaborate with several of these companies that have very broad commercial reach."" ____ Follow AP’s coverage of Latin America and the Caribbean at https://apnews.com/hub/latin-america"
