title,link,content
JSW Energy shares rise 2.07% in Monday's trading session,https://www.moneycontrol.com/news/business/stocks/jsw-energy-shares-rise-2-07-in-monday-s-trading-session-alpha-article-13587346.html,"Shares of JSW Energy were trading at Rs 530.85, up 2.07% in Monday's session. The stock is a constituent of the Nifty Next 50 index. On the financial front, JSW Energy has demonstrated substantial growth in both quarterly and annual results. The consolidated revenue for the quarter-ending June 2025 stood at Rs 5,143.37 Crore, compared to Rs 2,879.46 Crore in June 2024. The net profit for the same period was Rs 832.87 Crore, up from Rs 530.37 Crore. The EPS increased from Rs 3.00 to Rs 4.26. Here's a detailed look at the quarterly financial performance:HeadingJun 2024Sep 2024Dec 2024Mar 2025Jun 2025RevenueRs 2,879.46 CroreRs 3,237.66 CroreRs 2,438.88 CroreRs 3,189.39 CroreRs 5,143.37 CroreNet ProfitRs 530.37 CroreRs 868.34 CroreRs 152.28 CroreRs 409.14 CroreRs 832.87 CroreEPS3.004.900.962.344.26The company's annual performance also shows positive trends. Revenue for the year-ending March 2025 reached Rs 11,745.39 Crore, an increase from Rs 11,485.91 Crore in the previous year. Net profit rose to Rs 1,960.13 Crore from Rs 1,708.14 Crore, and EPS improved from Rs 10.50 to Rs 11.19. Below is a summary of the yearly financials:Heading20212022202320242025RevenueRs 6,922.20 CroreRs 8,167.15 CroreRs 10,331.81 CroreRs 11,485.91 CroreRs 11,745.39 CroreNet ProfitRs 805.53 CroreRs 1,734.94 CroreRs 1,460.83 CroreRs 1,708.14 CroreRs 1,960.13 CroreEPS4.8410.529.0110.5011.19BVPS88.28106.22114.20128.04156.78ROE5.489.927.938.267.13Debt to Equity0.500.511.331.501.81JSW Energy's financial ratios present a mixed view. The P/E ratio as of March 2025 is 48.07, and the P/B ratio is 3.43. The debt-to-equity ratio for the year-ending March 2025 is 1.81. JSW Energy announced a final dividend of Rs 2 per share (20%) on May 15, 2025, with an effective date of June 06, 2025. Moneycontrol's sentiment analysis, conducted on September 25, 2025, indicates a neutral outlook for the stock."
Indraprastha Gas shares rise 2.08% in Monday's trading,https://www.moneycontrol.com/news/business/stocks/indraprastha-gas-shares-rise-2-08-in-monday-s-trading-alpha-article-13587342.html,"Indraprastha Gas shares saw a 2.08% increase, trading at Rs 206.46 on Monday. The stock is a constituent of the Nifty Midcap 150 index. Financial Snapshot: Here's a look at the recent financial performance of Indraprastha Gas: Consolidated Quarterly Results:HeadingJun 2024Sep 2024Dec 2024Mar 2025Jun 2025RevenueRs 3,520.60 CroreRs 3,697.60 CroreRs 3,758.76 CroreRs 3,950.84 CroreRs 3,914.00 CroreNet ProfitRs 399.45 CroreRs 363.65 CroreRs 243.51 CroreRs 345.11 CroreRs 353.04 CroreEPS6.876.504.663.253.06The revenue for Indraprastha Gas has shown a steady increase over the past five quarters, with a slight dip in the most recent quarter. Net profit has fluctuated, while earnings per share (EPS) have generally decreased. Consolidated Yearly Results:Heading20212022202320242025RevenueRs 4,940.80 CroreRs 7,709.96 CroreRs 14,145.85 CroreRs 14,000.02 CroreRs 14,927.80 CroreNet ProfitRs 1,046.74 CroreRs 1,276.55 CroreRs 1,386.02 CroreRs 1,642.38 CroreRs 1,351.72 CroreEPS16.7521.4623.4228.3612.27BVPS90.49108.37113.30137.6275.83ROE18.5119.8020.6720.6016.18Debt to Equity0.000.000.000.000.00The company's annual revenue increased from Rs 4,940.80 Crore in 2021 to Rs 14,927.80 Crore in 2025. However, the net profit saw a decrease from Rs 1,642.38 Crore in 2024 to Rs 1,351.72 Crore in 2025. Similarly, the EPS decreased from 28.36 in 2024 to 12.27 in 2025. The book value per share (BVPS) also decreased in 2025, while the debt to equity ratio remained at zero. Income Statement (Annual):Mar 2025Mar 2024Mar 2023Mar 2022Mar 2021SalesRs 14,927 CroreRs 14,000 CroreRs 14,145 CroreRs 7,709 CroreRs 4,940 CroreOther IncomeRs 334 CroreRs 260 CroreRs 202 CroreRs 176 CroreRs 114 CroreTotal IncomeRs 15,261 CroreRs 14,260 CroreRs 14,348 CroreRs 7,886 CroreRs 5,055 CroreTotal ExpenditureRs 13,430 CroreRs 12,050 CroreRs 12,469 CroreRs 6,145 CroreRs 3,748 CroreEBITRs 1,831 CroreRs 2,210 CroreRs 1,879 CroreRs 1,740 CroreRs 1,307 CroreInterestRs 10 CroreRs 9 CroreRs 10 CroreRs 13 CroreRs 11 CroreTaxRs 469 CroreRs 559 CroreRs 482 CroreRs 450 CroreRs 249 CroreNet ProfitRs 1,351 CroreRs 1,642 CroreRs 1,386 CroreRs 1,276 CroreRs 1,046 CroreIncome Statement (Quarterly):Jun 2025Mar 2025Dec 2024Sep 2024Jun 2024SalesRs 3,914 CroreRs 3,950 CroreRs 3,758 CroreRs 3,697 CroreRs 3,520 CroreOther IncomeRs 89 CroreRs 90 CroreRs 88 CroreRs 83 CroreRs 72 CroreTotal IncomeRs 4,003 CroreRs 4,041 CroreRs 3,847 CroreRs 3,780 CroreRs 3,592 CroreTotal ExpenditureRs 3,527 CroreRs 3,575 CroreRs 3,518 CroreRs 3,281 CroreRs 3,054 CroreEBITRs 475 CroreRs 465 CroreRs 328 CroreRs 499 CroreRs 538 CroreInterestRs 2 CroreRs 3 CroreRs 2 CroreRs 2 CroreRs 2 CroreTaxRs 119 CroreRs 116 CroreRs 83 CroreRs 133 CroreRs 136 CroreNet ProfitRs 353 CroreRs 345 CroreRs 243 CroreRs 363 CroreRs 399 CroreCash Flow:Mar 2025Mar 2024Mar 2023Mar 2022Mar 2021Operating ActivitiesRs 2,198 CroreRs 1,531 CroreRs 2,230 CroreRs 1,897 CroreRs 1,545 CroreInvesting ActivitiesRs -1,519 CroreRs -1,102 CroreRs -841 CroreRs -1,584 CroreRs -1,826 CroreFinancing ActivitiesRs -754 CroreRs -315 CroreRs -1,358 CroreRs -328 CroreRs -296 CroreOthersRs 0 CroreRs 0 CroreRs 0 CroreRs 0 CroreRs 0 CroreNet Cash FlowRs -74 CroreRs 113 CroreRs 30 CroreRs -15 CroreRs -577 CroreBalance Sheet:Mar 2025Mar 2024Mar 2023Mar 2022Mar 2021Share CapitalRs 280 CroreRs 140 CroreRs 140 CroreRs 140 CroreRs 140 CroreReserves & SurplusRs 10,335 CroreRs 9,493 CroreRs 7,791 CroreRs 7,446 CroreRs 6,194 CroreCurrent LiabilitiesRs 4,314 CroreRs 4,080 CroreRs 4,231 CroreRs 3,121 CroreRs 2,352 CroreOther LiabilitiesRs 651 CroreRs 506 CroreRs 457 CroreRs 395 CroreRs 363 CroreTotal LiabilitiesRs 15,581 CroreRs 14,219 CroreRs 12,620 CroreRs 11,102 CroreRs 9,049 CroreFixed AssetsRs 8,734 CroreRs 7,999 CroreRs 7,167 CroreRs 6,380 CroreRs 5,167 CroreCurrent AssetsRs 4,643 CroreRs 4,363 CroreRs 4,227 CroreRs 3,762 CroreRs 3,095 CroreOther AssetsRs 2,203 CroreRs 1,856 CroreRs 1,225 CroreRs 959 CroreRs 786 CroreTotal AssetsRs 15,581 CroreRs 14,219 CroreRs 12,620 CroreRs 11,102 CroreRs 9,049 CroreContingent LiabilitiesRs 0 CroreRs 5,655 CroreRs 6,768 CroreRs 5,281 CroreRs 4,352 CroreFinancial Ratios:Mar 2025Mar 2024Mar 2023Mar 2022Mar 2021Basic EPS (Rs.)12.2728.3623.4221.4616.75Diluted Eps (Rs.)12.2728.3623.4221.4616.75Book Value /Share (Rs.)75.83137.62113.30108.3790.49Dividend/Share (Rs.)7.009.0013.005.503.60Face Value22222Gross Profit Margin (%)15.4518.7415.8526.6832.33Operating Margin (%)12.2615.7913.2822.5726.46Net Profit Margin (%)9.0511.739.7916.5521.18Return on Equity (%)16.1820.6020.6719.8018.51ROCE (%)16.2521.8022.4021.8119.52Return On Assets (%)11.0213.9512.9913.5312.95Current Ratio (X)1.081.071.001.211.32Quick Ratio (X)1.071.060.991.191.30Debt to Equity (x)0.000.000.000.000.00Interest Coverage Ratios (X)224.02286.22211.77155.77115.29Asset Turnover Ratio (%)1.001.041.240.7954.59Inventory Turnover Ratio (X)0.000.000.000.00108.473 Yr CAGR Sales (%)39.1568.3347.6915.654.373 Yr CAGR Net Profit (%)2.9025.2612.5130.0226.92P/E (x)16.557.609.158.6915.29P/B (x)2.673.133.783.445.64EV/EBITDA (x)11.3310.6812.2012.0221.67P/S (x)1.902.152.123.387.24Corporate Actions:Change in Senior Management was announced on September 26, 2025.Closure of Trading Window was announced on September 26, 2025.Outcome of AGM was announced on September 26, 2025.Dividends: The company announced a final dividend of Rs 1.50 per share (75%) with an effective date of September 15, 2025. Bonus: A bonus issue with a ratio of 1:1 was announced on December 10, 2024, with an ex-bonus date of January 31, 2025. Split: The company had a stock split on November 9, 2017, where the face value changed from Rs 10 to Rs 2. In summary, Indraprastha Gas is trading higher at Rs 206.46, reflecting a positive movement in today's session."
Hold PI Industries; target of Rs 3618: Prabhudas Lilladher,https://www.moneycontrol.com/news/business/stocks/hold-pi-industries-target-of-rs-3618-prabhudas-lilladher-13587226.html,"Prabhudas Lilladher's research report on PI Industries In CY11, PI Industries (PI) launched pyroxasulfone (pyroxa) – an event that sparked the interests of investors and offered them a journey of 28% CAGR in market cap based on 19%/23%/26% CAGR in sales/EBITDA/PAT until FY25. However, 7% decline in Kumiai’s (innovator) guidance on sales of pyroxa for Nov’24-Oct’25, is likely to affect PI’s CSM segment with revenue clocking 6% CAGR in FY25–28E compared with 21% CAGR in the past 5 years. The pharma business, still in ramp-up, is projected to grow ~70% in FY26 and break even by FY28 at ~Rs5bn revenue. The domestic business is expected to deliver ~6% CAGR, led by biologicals, while core formulations remain subdued. We estimate consolidated revenue/EBITDA/PAT CAGR at ~7%/8%/7% over FY25–28E, supported by new CSM launches, biologicals and pharma scale-up. Outlook At 28x FY27E EPS, the stock is trading slightly above its sector average. While R&D spending (3% of sales) remains strong, we await the next spark that could once again spur investors’ interests. We initiate coverage on PI with ‘HOLD’ recommendation and TP of Rs3,618 (28x Sep’27 EPS). For all recommendations report, click here Disclaimer: The views and investment tips expressed by investment experts/broking houses/rating agencies on moneycontrol.com are their own, and not that of the website or its management. Moneycontrol.com advises users to check with certified experts before taking any investment decisions. PI Industries - 29 - 09 - 2025 - prabhu"
Hindustan Unilever shares decline 0.98% in morning trade,https://www.moneycontrol.com/news/business/stocks/hindustan-unilever-shares-decline-0-98-in-morning-trade-alpha-article-13587325.html,"Shares of Hindustan Unilever were trading lower in Monday's session, with the stock priced at Rs 2,487.20 at 11:00 am on the NSE, a decline of 0.98% from the previous close. The stock is a constituent of the Nifty 50 index. The company announced several key decisions and corporate developments, which were published on September 26, 2025. Financial Performance: The following tables summarize the consolidated financial performance of Hindustan Unilever. Income Statement - Quarterly (Consolidated)Jun 2025Mar 2025Dec 2024Sep 2024Jun 2024SalesRs 16,514 CroreRs 15,670 CroreRs 15,818 CroreRs 15,926 CroreRs 15,707 CroreOther IncomeRs 201 CroreRs 309 CroreRs 232 CroreRs 219 CroreRs 257 CroreTotal IncomeRs 16,715 CroreRs 15,979 CroreRs 16,050 CroreRs 16,145 CroreRs 15,964 CroreTotal ExpenditureRs 13,284 CroreRs 12,536 CroreRs 11,957 CroreRs 12,487 CroreRs 12,340 CroreEBITRs 3,431 CroreRs 3,443 CroreRs 4,093 CroreRs 3,658 CroreRs 3,624 CroreInterestRs 127 CroreRs 80 CroreRs 112 CroreRs 110 CroreRs 93 CroreTaxRs 535 CroreRs 887 CroreRs 993 CroreRs 947 CroreRs 917 CroreNet ProfitRs 2,769 CroreRs 2,476 CroreRs 2,988 CroreRs 2,601 CroreRs 2,614 CroreThe revenue for the quarter-ending June 2025 increased to Rs 16,514 crore compared to Rs 15,707 crore for the quarter-ending June 2024. Income Statement - Yearly (Consolidated)Mar 2025Mar 2024Mar 2023Mar 2022Mar 2021SalesRs 63,121 CroreRs 61,896 CroreRs 60,580 CroreRs 52,446 CroreRs 47,028 CroreOther IncomeRs 1,017 CroreRs 811 CroreRs 512 CroreRs 258 CroreRs 410 CroreTotal IncomeRs 64,138 CroreRs 62,707 CroreRs 61,092 CroreRs 52,704 CroreRs 47,438 CroreTotal ExpenditureRs 49,320 CroreRs 48,443 CroreRs 47,632 CroreRs 40,724 CroreRs 36,715 CroreEBITRs 14,818 CroreRs 14,264 CroreRs 13,460 CroreRs 11,980 CroreRs 10,723 CroreInterestRs 395 CroreRs 334 CroreRs 114 CroreRs 106 CroreRs 117 CroreTaxRs 3,744 CroreRs 3,644 CroreRs 3,201 CroreRs 2,987 CroreRs 2,606 CroreNet ProfitRs 10,679 CroreRs 10,286 CroreRs 10,145 CroreRs 8,887 CroreRs 8,000 CroreThe revenue for the year-ending March 2025 increased to Rs 63,121 crore compared to Rs 61,896 crore for the year-ending March 2024. Cash Flow (Consolidated)Mar 2025Mar 2024Mar 2023Mar 2022Mar 2021Operating ActivitiesRs 11,886 CroreRs 15,469 CroreRs 9,991 CroreRs 9,048 CroreRs 9,163 CroreInvesting ActivitiesRs 6,473 CroreRs -5,324 CroreRs -1,494 CroreRs -1,728 CroreRs -1,528 CroreFinancing ActivitiesRs -13,101 CroreRs -10,034 CroreRs -8,953 CroreRs -8,015 CroreRs -9,309 CroreOthersRs 0 CroreRs 0 CroreRs 10 CroreRs 0 CroreRs 0 CroreNet Cash FlowRs 5,258 CroreRs 111 CroreRs -446 CroreRs -695 CroreRs -1,674 CroreBalance Sheet (Consolidated)Mar 2025Mar 2024Mar 2023Mar 2022Mar 2021Share CapitalRs 235 CroreRs 235 CroreRs 235 CroreRs 235 CroreRs 235 CroreReserves & SurplusRs 49,167 CroreRs 50,983 CroreRs 50,069 CroreRs 48,826 CroreRs 47,439 CroreCurrent LiabilitiesRs 16,537 CroreRs 12,876 CroreRs 12,028 CroreRs 11,280 CroreRs 11,103 CroreOther LiabilitiesRs 13,941 CroreRs 14,405 CroreRs 10,755 CroreRs 10,176 CroreRs 9,980 CroreTotal LiabilitiesRs 79,880 CroreRs 78,499 CroreRs 73,087 CroreRs 70,517 CroreRs 68,757 CroreFixed AssetsRs 37,878 CroreRs 37,303 CroreRs 36,344 CroreRs 35,389 CroreRs 34,791 CroreCurrent AssetsRs 22,051 CroreRs 21,324 CroreRs 16,998 CroreRs 15,522 CroreRs 14,217 CroreOther AssetsRs 19,951 CroreRs 19,872 CroreRs 19,745 CroreRs 19,606 CroreRs 19,749 CroreTotal AssetsRs 79,880 CroreRs 78,499 CroreRs 73,087 CroreRs 70,517 CroreRs 68,757 CroreContingent LiabilitiesRs 3,447 CroreRs 3,314 CroreRs 3,574 CroreRs 3,230 CroreRs 2,985 CroreKey Financial RatiosMar 2025Mar 2024Mar 2023Mar 2022Mar 2021Basic EPS (Rs.)45.3243.7443.0737.7934.03Diluted Eps (Rs.)45.3243.7443.0737.7934.03Book Value /Share (Rs.)210.22217.95214.99208.88202.95Dividend/Share (Rs.)53.0042.0039.0034.0031.00Face Value11111Gross Profit Margin (%)25.1325.0024.2025.0025.59Operating Margin (%)22.9923.0322.3222.9223.30Net Profit Margin (%)16.9116.6116.7416.9517.00Return on Networth / Equity (%)21.5520.0620.1118.0916.77ROCE (%)22.9121.7222.1420.2919.01Return On Assets (%)13.3313.0913.8412.5911.62Current Ratio (X)1.331.661.411.381.28Quick Ratio (X)1.071.341.061.010.96Debt to Equity (x)0.000.000.000.000.00Interest Coverage Ratios (X)40.1746.33128.61123.7393.69Asset Turnover Ratio (%)0.800.820.830.7468.39Inventory Turnover Ratio (X)4.614.664.734.2513.143 Yr CAGR Sales (%)9.7114.7223.4015.5115.023 Yr CAGR Net Profit (%)9.6213.3922.4721.1023.74P/E (x)49.8451.7759.4554.2171.45P/B (x)10.7510.4111.959.8111.98EV/EBITDA (x)33.0033.9740.7236.4247.09P/S (x)8.418.619.939.1812.15Hindustan Unilever announced a final dividend of Rs 24 per share with an effective date of June 23, 2025. Earlier bonus issues were announced on September 30, 1991. The ex-bonus date for the bonus ratio 1:2 was July 19, 1991. Moneycontrol analysis on September 23, 2025, indicated a bearish sentiment for the stock. With the stock's last traded price at Rs 2,487.20, Hindustan Unilever is currently trading lower in today's session."
Bharat Forge shares jump 2.40% amid high volume trading in today's session,https://www.moneycontrol.com/news/business/stocks/bharat-forge-shares-jump-2-40-amid-high-volume-trading-in-today-s-session-alpha-article-13587319.html,"Bharat Forge shares surged 2.40% to Rs 1,209.50 in Monday's trading session, witnessing high volume. The stock is a constituent of the Nifty Midcap 150 index. On September 26, 2025, Bharat Forge Limited informed the exchange regarding the trading window closure pursuant to SEBI (Prohibition of Insider Trading) Regulations, 2015. The company also announced the signing of a Tripartite Memorandum of Understanding.Bharat Forge Consolidated Quarterly Financials (Rs Crore)HeadingJun 2024Sep 2024Dec 2024Mar 2025Jun 2025Revenue4,106.153,688.513,475.553,852.603,908.75Net Profit173.89243.88214.32284.90287.14EPS4.365.234.545.925.93The revenue for the quarter ending June 2025 stood at Rs 3,908.75 Crore, slightly down compared to Rs 4,106.15 Crore in June 2024. The net profit for the same period was Rs 287.14 Crore, compared to Rs 173.89 Crore in June 2024.Bharat Forge Consolidated Yearly Financials (Rs Crore)Heading20212022202320242025Revenue6,336.2610,461.0812,910.2615,682.0715,122.80Net Profit-96.991,110.08541.83904.84916.98EPS-2.7123.2311.3520.4320.05BVPS116.98142.32144.78153.88193.53ROE-2.3316.467.8713.2610.17Debt to Equity0.850.861.021.050.68The revenue for the year ending March 2025 was Rs 15,122.80 Crore, slightly lower than the Rs 15,682.07 Crore in the previous year. Net profit saw a marginal increase from Rs 904.84 Crore in 2024 to Rs 916.98 Crore in 2025. The company’s debt-to-equity ratio decreased from 1.05 in March 2024 to 0.68 in March 2025. Bharat Forge announced a final dividend of Rs 6 per share on May 8, 2025, with an effective date of July 4, 2025. Earlier, an interim dividend of Rs 2.50 per share was announced on February 12, 2025, and paid out on February 18, 2025. Moneycontrol analysis on September 24, 2025, indicated a bullish sentiment for the stock. Bharat Forge shares witnessed a surge in volume, trading at Rs 1,209.50, a 2.40% increase."
Indian Railway Finance Corporation shares rise 2.08%,https://www.moneycontrol.com/news/business/stocks/indian-railway-finance-corporation-shares-rise-2-08-alpha-article-13587267.html,"Shares of Indian Railway Finance Corporation were trading at Rs 124.45, up 2.08% in Monday's session. The stock is a constituent of the NIFTY NEXT 50 index. Financial Snapshot: Income Statement: The standalone annual income statement shows consistent growth. Sales for the year-ending March 2025 stood at Rs 27,152 Crore, compared to Rs 26,645 Crore in March 2024. Total income increased to Rs 27,156 Crore for the year-ending March 2025 from Rs 26,655 Crore in the previous year. The net profit for the year-ending March 2025 was Rs 6,502 Crore, up from Rs 6,412 Crore in the year-ending March 2024. The standalone quarterly income statement presents the following data:June 2025: Sales were Rs 6,915 Crore and Net Profit was Rs 1,745 Crore.March 2025: Sales were Rs 6,723 Crore and Net Profit was Rs 1,681 Crore.December 2024: Sales were Rs 6,763 Crore and Net Profit was Rs 1,630 Crore.September 2024: Sales were Rs 6,899 Crore and Net Profit was Rs 1,612 Crore.June 2024: Sales were Rs 6,765 Crore and Net Profit was Rs 1,576 Crore.Balance Sheet: The company's balance sheet highlights include:Share capital remained stable at Rs 13,068 Crore.Reserves & Surplus increased to Rs 39,599 Crore in March 2025 from Rs 36,110 Crore in March 2024.Total Liabilities increased to Rs 488,834 Crore in March 2025 from Rs 485,082 Crore in March 2024.Total Assets increased to Rs 488,834 Crore in March 2025 from Rs 485,082 Crore in March 2024.Cash Flow: Key cash flow figures include:Cash Flow from Operating Activities: Rs 8,229 Crore in March 2025 compared to Rs 7,914 Crore in March 2024.Cash Flow from Financing Activities: Rs -2,571 Crore in March 2025 compared to Rs -8,046 Crore in March 2024.Net Cash Flow: Rs 5,657 Crore in March 2025 compared to Rs -139 Crore in March 2024.Financial Ratios: Key financial ratios for Indian Railway Finance Corporation are:Basic EPS and Diluted EPS: Both stand at Rs 4.98 for March 2025.Book Value per Share: Rs 40.30 as of March 2025.Debt to Equity Ratio: 7.83 for March 2025.Interest Coverage Ratio: 1.32 for March 2025.The company has shown consistent performance in key financial metrics. Corporate Actions: Indian Railway Finance Corporation announced an interim dividend of Rs 0.80 per share (8%) on March 10, 2025, with an effective date of March 21, 2025. Press releases from September 26, 2025, include announcements regarding a Rupee Term Loan of INR 12,640 Crore sanctioned to CSPGCL, Raipur, and the closure of the Trading Window. With the stock's last traded price at Rs 124.45, Indian Railway Finance Corporation shows a positive movement in today's session."
Dixon Technologies shares fall 2.92% in Monday's trade,https://www.moneycontrol.com/news/business/stocks/dixon-technologies-shares-fall-2-92-in-monday-s-trade-alpha-article-13587262.html,"Dixon Technologies shares experienced a decline of 2.92% to Rs 17,000 in Monday's trading session. The stock is a constituent of the Nifty Midcap 150 index. Financial Highlights: Dixon Technologies' financial performance reveals the following: Consolidated Financials: The consolidated revenue and net profit trends are as follows:YearRevenue (Rs Crore)Net Profit (Rs Crore)EPSBVPSROEDebt to Equity20216,448.17159.7927.49125.8921.670.21202210,697.08190.3932.31168.0419.070.46202312,192.01253.4642.92215.7219.880.14202417,690.90364.6862.84283.4221.690.09202538,860.101,215.20205.70499.6236.390.06The company's revenue increased significantly from Rs 17,690.90 Crore in 2024 to Rs 38,860.10 Crore in 2025. Similarly, net profit saw a substantial rise from Rs 364.68 Crore in 2024 to Rs 1,215.20 Crore in 2025.QuarterRevenue (Rs Crore)Net Profit (Rs Crore)EPSJun 20246,579.80132.2623.35Sep 202411,534.08409.1068.82Dec 202410,453.68212.6536.12Mar 202510,292.54461.1977.59Jun 202512,835.66273.2646.47The revenue for the quarter-ending June 2025 stood at Rs 12,835.66 Crore, compared to Rs 6,579.80 Crore for the quarter-ending June 2024. The net profit for the quarter-ending June 2025 was Rs 273.26 Crore, versus Rs 132.26 Crore for the quarter-ending June 2024. Income Statement (Annual):Mar 2025Mar 2024Mar 2023Mar 2022Mar 2021Sales38,86017,69012,19210,6976,448Other Income2022531Total Income38,88017,71312,19710,7006,449Total Expenditure37,17317,15511,79310,4016,205EBIT1,706558403298244Interest15474604427Tax337118896457Net Profit1,215364253190159Income Statement (Quarterly):Jun 2025Mar 2025Dec 2024Sep 2024Jun 2024Sales12,83510,29210,45311,5346,579Other Income1116-58Total Income12,83710,30310,46011,5286,587Total Expenditure12,4459,68510,13710,9646,386EBIT391618322564201Interest3246403729Tax851116811740Net Profit273461212409132Cash Flow:Mar 2025Mar 2024Mar 2023Mar 2022Mar 2021Operating Activities1,149584725272170Investing Activities-1,228-530-355-464-265Financing Activities-26-69-32930463Others1360000Net Cash Flow30-1640112-31Balance Sheet:Mar 2025Mar 2024Mar 2023Mar 2022Mar 2021Share Capital2017201111Reserves & Surplus2,9981,6641,273984725Current Liabilities12,5954,7312,9402,7351,870Other Liabilities1,152577444544237Total Liabilities16,7666,9914,6794,2772,845Fixed Assets2,9732,0341,333995614Current Assets13,0944,8363,1393,1472,191Other Assets69812020713440Total Assets16,7666,9914,6794,2772,845Contingent Liabilities1,4831,0008303,2511,649Key Financial Ratios:RatioMar 2025Mar 2024Mar 2023Mar 2022Mar 2021Basic EPS (Rs.)205.7062.8442.9232.3127.49Diluted Eps (Rs.)202.5862.4642.9232.0026.87Book Value /Share (Rs.)499.62283.42215.72168.04125.89Dividend/Share (Rs.)8.005.003.002.001.00Face Value22222Gross Profit Margin (%)3.934.074.253.574.46Operating Margin (%)3.203.153.312.793.79Net Profit Margin (%)3.122.062.071.772.47Return on Networth / Equity (%)36.3921.6919.8819.0721.67ROCE (%)29.8824.7023.2219.3925.07Return On Assets (%)6.535.255.464.445.61Current Ratio (X)1.041.021.071.151.17Quick Ratio (X)0.720.660.740.730.77Debt to Equity (x)0.060.090.140.460.21Interest Coverage Ratios (X)9.909.648.568.668.91Asset Turnover Ratio (%)3.273.032.722.69226.59Inventory Turnover Ratio (X)13.6713.3410.429.718.683 Yr CAGR Sales (%)90.6065.6466.4689.3250.643 Yr CAGR Net Profit (%)152.6451.0745.0373.3561.98P/E (x)64.07119.0266.67133.36133.58P/B (x)26.3826.4013.2625.6729.15EV/EBITDA (x)52.2362.0932.7867.5474.88P/S (x)2.042.531.402.393.33Corporate Actions: Dixon Technologies announced under Regulation 30 (LODR)-Memorandum of Understanding /Agreements on September 26, 2025, regarding Execution of Shareholders'' Agreement. On September 25, 2025, Dixon Technologies informed the exchange about a change in auditors. Dixon Technologies submitted a copy of the scrutinizer's report from the Annual General Meeting held on September 23, 2025, and the voting results to the exchange on September 25, 2025. The company announced a final dividend of Rs 8 per share (400%) with an effective date of September 16, 2025. It also announced dividends of Rs 5 per share, Rs 3 per share, Rs 2 per share and Rs 1 per share in the years 2024, 2023, 2022 and 2021 respectively. A stock split was announced on February 2, 2021, with an ex-split date of March 18, 2021, and a record date of March 19, 2021. With the stock's last traded price at Rs 17,000, Dixon Technologies has seen a downward move in today's session."
Hold SRF; target of Rs 2947: Prabhudas Lilladher,https://www.moneycontrol.com/news/business/stocks/hold-srf-target-of-rs-2947-prabhudas-lilladher-13587238.html,"Prabhudas Lilladher's research report on SRF Based on investigation of Apr’23-Mar’24 data, Indian government has applied anti-dumping duty (ADD) of ~USD4,500/mt on import of R134a from China. SRF is the only manufacturer of R134a in India. However, currently, the difference between import-export realizations has already narrowed down, which would limit the benefit of ADD. Our estimate suggests that for every USD1/kg benefit in domestic realization, impact on FY27 EBITDA would be ~2%. For every 1,000mt additional sales, the impact would also be limited to ~2% of EBITDA. Outlook The stock is trading at 43x FY27 EPS. Based on SOTP, valuing the chemicals segment at 27x FY27 EV/EBITDA and packaging and technical textiles at 11x, we arrive at a target of Rs2,947 (earlier Rs3,071). In our earlier note, we had highlighted how R32 prices are likely to come down. Bearing the same in mind, we re-iterate our Hold rating on the stock. For all recommendations report, click here Disclaimer: The views and investment tips expressed by investment experts/broking houses/rating agencies on moneycontrol.com are their own, and not that of the website or its management. Moneycontrol.com advises users to check with certified experts before taking any investment decisions. SRF - 29 - 09 - 2025 - prabhu"
