title,link,content,summary_lexrank,summary_luhn,summary_lsa,summary_textrank
Buy KEC International; target of Rs 890: Motilal Oswal,https://www.moneycontrol.com/news/business/buy-kec-international-target-of-rs-890-motilal-oswal-13806243.html,"Motilal Oswal's research report on KEC International KEC posted in-line results in 3QFY26. The performance could have been better, but it was impacted by labor constraints and lower margins in select segments. Order inflow for 9MFY26 remained strong at INR193b, resulting in OB of INR367b. Going ahead, we expect KEC to continue to benefit from strong addressable market across segments. We expect T&D and cable to continue to lead the growth vs. other segments. Margin performance, however, could be impacted by delays in claim settlements. We thus reduce our margin estimates and cut our estimates by 15%/8%/8% for FY26/27/28. The stock is currently trading at attractive valuations of 18x/14.3x P/E on FY27/28 estimates. We maintain BUY with a revised TP of INR890, based on 20x P/E Dec’27E earnings. Outlook KEC is currently trading at 25.2x/18x/14.3x on FY26E/27E/28E EPS. Our estimates bake in a revenue CAGR of ~17% and an EBITDA margin of 7.2% for FY26E and 7.6% for FY27E/28E. We maintain BUY with a revised TP of INR890 (from INR920 earlier) based on 20x Dec’27E EPS. For all recommendations report, click here Disclaimer: The views and investment tips expressed by investment experts/broking houses/rating agencies on moneycontrol.com are their own, and not that of the website or its management. Moneycontrol.com advises users to check with certified experts before taking any investment decisions. KEC International_01022026_Motilal Oswal",Our estimates bake in a revenue CAGR of ~17% and an EBITDA margin of 7.2% for FY26E and 7.6% for FY27E/28E.,We maintain BUY with a revised TP of INR890 (from INR920 earlier) based on 20x Dec’27E EPS.,"The performance could have been better, but it was impacted by labor constraints and lower margins in select segments.","For all recommendations report, click here Disclaimer: The views and investment tips expressed by investment experts/broking houses/rating agencies on moneycontrol.com are their own, and not that of the website or its management."
Buy Kajaria Ceramics; target of Rs 1057: Motilal Oswal,https://www.moneycontrol.com/news/business/buy-kajaria-ceramics-target-of-rs-1057-motilal-oswal-13806242.html,"Motilal Oswal's research report on Kajaria Ceramics Kajaria Ceramics (KJC) reported another soft quarter, with flat tile volume and revenue owing to weak demand conditions and intense competition. Bathware and Adhesives revenue grew 9% and 72% YoY, respectively. EBITDA margin slid 78bp QoQ to 17.2% (up 395bp YoY) on low volumes and liquidation of slow-moving SKUs in ceramic tiles. Reported PAT (up 13% YoY) was impacted by INR396m of extra-ordinary items on account of provision for the new labour code (~INR200m) and the financial fraud (~INR200m). Outlook While we expect a gradual recovery in volume, KJC’s stock price looks attractive at ~24x/20x FY27E/28E P/E after over 30% correction in the last six months. We retain a BUY rating on KJC with a TP of INR1,057, based on 26x Sep’27E EPS (~20% discount to 10-year mean on low volume growth). For all recommendations report, click here Disclaimer: The views and investment tips expressed by investment experts/broking houses/rating agencies on moneycontrol.com are their own, and not that of the website or its management. Moneycontrol.com advises users to check with certified experts before taking any investment decisions. Kajaria Ceramics_01022026_Motilal Oswal","Motilal Oswal's research report on Kajaria Ceramics Kajaria Ceramics (KJC) reported another soft quarter, with flat tile volume and revenue owing to weak demand conditions and intense competition.","Motilal Oswal's research report on Kajaria Ceramics Kajaria Ceramics (KJC) reported another soft quarter, with flat tile volume and revenue owing to weak demand conditions and intense competition.",EBITDA margin slid 78bp QoQ to 17.2% (up 395bp YoY) on low volumes and liquidation of slow-moving SKUs in ceramic tiles.,"Motilal Oswal's research report on Kajaria Ceramics Kajaria Ceramics (KJC) reported another soft quarter, with flat tile volume and revenue owing to weak demand conditions and intense competition."
Buy Jindal Steel; target of Rs 1290: Motilal Oswal,https://www.moneycontrol.com/news/business/buy-jindal-steel-target-of-rs-1290-motilal-oswal-13806240.html,"Motilal Oswal's research report on Jindal Steel Jindal Steel’s (JINDALST) revenue stood at INR130b (+11% YoY/+12% QoQ), largely in line with our estimate of INR135b in 3QFY26. The growth was primarily attributed to strong volumes offset by muted NSR in 3Q. Production stood at 2.51mt (+26% YoY/QoQ), mainly led by the newly added Angul capacity. The sales volume was 2.28MT (+20% YoY/+22% QoQ). The share of exports declined to 6% in 3QFY26 from 10% in 2QFY26. Outlook At CMP, the stock trades at 8.3x EV/EBITDA on FY27E. We reiterate our BUY rating with a TP of INR1,290, based on 8.5x EV/EBITDA on the Sep’27 estimate. For all recommendations report, click here Disclaimer: The views and investment tips expressed by investment experts/broking houses/rating agencies on moneycontrol.com are their own, and not that of the website or its management. Moneycontrol.com advises users to check with certified experts before taking any investment decisions. Jindal Steel_01022026_Motilal Oswal","Motilal Oswal's research report on Jindal Steel Jindal Steel’s (JINDALST) revenue stood at INR130b (+11% YoY/+12% QoQ), largely in line with our estimate of INR135b in 3QFY26.","Motilal Oswal's research report on Jindal Steel Jindal Steel’s (JINDALST) revenue stood at INR130b (+11% YoY/+12% QoQ), largely in line with our estimate of INR135b in 3QFY26.",The growth was primarily attributed to strong volumes offset by muted NSR in 3Q.,"Motilal Oswal's research report on Jindal Steel Jindal Steel’s (JINDALST) revenue stood at INR130b (+11% YoY/+12% QoQ), largely in line with our estimate of INR135b in 3QFY26."
Buy Go Fashion India; target of Rs 465: Motilal Oswal,https://www.moneycontrol.com/news/business/buy-go-fashion-india-target-of-rs-465-motilal-oswal-13806241.html,"Motilal Oswal's research report on Go Fashion India Go Fashion reported another weak quarter as 3QFY26 revenue declined 9% YoY, largely due to operational disruption at a key LFS partner. LFS revenue plunged 36% YoY, while EBO revenue declined ~2% amid persistent footfall pressure and a 4.5% fall in same-store sales. Operating deleverage materially impacted profitability, with pre-Ind AS EBITDA/PAT declining 57%/71% YoY, owing to limited cost absorption. Outlook Valuations at ~30x TTM earnings appear reasonable, but a durable SSSG recovery remains the key catalyst for earnings visibility. We maintain our BUY rating with a TP of INR465, based on 23x 1-yr fwd earnings. For all recommendations report, click here Disclaimer: The views and investment tips expressed by investment experts/broking houses/rating agencies on moneycontrol.com are their own, and not that of the website or its management. Moneycontrol.com advises users to check with certified experts before taking any investment decisions. Go Fashion India_01022026_Motilal Oswal","Motilal Oswal's research report on Go Fashion India Go Fashion reported another weak quarter as 3QFY26 revenue declined 9% YoY, largely due to operational disruption at a key LFS partner.","Motilal Oswal's research report on Go Fashion India Go Fashion reported another weak quarter as 3QFY26 revenue declined 9% YoY, largely due to operational disruption at a key LFS partner.","Operating deleverage materially impacted profitability, with pre-Ind AS EBITDA/PAT declining 57%/71% YoY, owing to limited cost absorption.","Motilal Oswal's research report on Go Fashion India Go Fashion reported another weak quarter as 3QFY26 revenue declined 9% YoY, largely due to operational disruption at a key LFS partner."
Buy Five Star Business Finance; target of Rs 590: Motilal Oswal,https://www.moneycontrol.com/news/business/buy-five-star-business-finance-target-of-rs-590-motilal-oswal-13806239.html,"Motilal Oswal's research report on Five Star Business Finance Five Star Business Finance’s (FIVESTAR) 3QFY26 PAT grew ~1% YoY to INR2.8b (in line). NII grew ~12% YoY to INR6.1b (in line). Other income rose 33% YoY to INR264m (vs. MOFSLe of INR370m). The quarterly dip in the other income was primarily due to the dip in the treasury income. Opex grew 21% YoY to INR2.1b (in line). It made provisions of ~INR21m towards employee benefits on account of the new labor codes. PPoP rose ~10% YoY to INR4.3b (in line). Credit costs were INR571m (in line). Annualized credit costs stood at ~1.5% (PQ: ~1.35% and PY: ~0.7%). Outlook The stock currently trades at 1.5x FY27E P/BV. We estimate FIVESTAR to post a CAGR of ~21%/~15% in AUM/PAT over FY26-28E with an RoA/ RoE of 6.9/16% in FY28E. Reiterate BUY with a revised TP of INR590 (based on 1.8x Dec’27E BV). For all recommendations report, click here Disclaimer: The views and investment tips expressed by investment experts/broking houses/rating agencies on moneycontrol.com are their own, and not that of the website or its management. Moneycontrol.com advises users to check with certified experts before taking any investment decisions. Five Star Business Finance_01022026_Motilal Oswal",The quarterly dip in the other income was primarily due to the dip in the treasury income.,Motilal Oswal's research report on Five Star Business Finance Five Star Business Finance’s (FIVESTAR) 3QFY26 PAT grew ~1% YoY to INR2.8b (in line).,"For all recommendations report, click here Disclaimer: The views and investment tips expressed by investment experts/broking houses/rating agencies on moneycontrol.com are their own, and not that of the website or its management.",The quarterly dip in the other income was primarily due to the dip in the treasury income.
Buy Equitas Small Finance Bank; target of Rs 80: Motilal Oswal,https://www.moneycontrol.com/news/business/buy-equitas-small-finance-bank-target-of-rs-80-motilal-oswal-2-13806238.html,"Motilal Oswal's research report on Equitas Small Finance Bank Equitas SFB (EQUITASB) reported a 3QFY26 PAT of ~INR900m (36% YoY, 27% beat) amid healthy NII and higher other income. During 3QFY26, the bank sold its NPA assets amounting to INR548.5mn to an ARC. NII grew 4.1% YoY/10.1% QoQ to INR8.5b (4% beat). NIM expanded 43bp QoQ to 6.72% in 3QFY26. Cost of funds declined from 7.35% in 2QFY26 to 7.13% in 3QFY26. Outlook We fine-tune our earnings and estimate an RoA/RoE of 1.0%/10.5% by FY27E. Reiterate BUY with a TP of INR80 (1.4x Sep’27E ABV). For all recommendations report, click here Disclaimer: The views and investment tips expressed by investment experts/broking houses/rating agencies on moneycontrol.com are their own, and not that of the website or its management. Moneycontrol.com advises users to check with certified experts before taking any investment decisions. Equitas Small Finance Bank_01022026_Motilal Oswal","Motilal Oswal's research report on Equitas Small Finance Bank Equitas SFB (EQUITASB) reported a 3QFY26 PAT of ~INR900m (36% YoY, 27% beat) amid healthy NII and higher other income.","Motilal Oswal's research report on Equitas Small Finance Bank Equitas SFB (EQUITASB) reported a 3QFY26 PAT of ~INR900m (36% YoY, 27% beat) amid healthy NII and higher other income.","For all recommendations report, click here Disclaimer: The views and investment tips expressed by investment experts/broking houses/rating agencies on moneycontrol.com are their own, and not that of the website or its management.","Motilal Oswal's research report on Equitas Small Finance Bank Equitas SFB (EQUITASB) reported a 3QFY26 PAT of ~INR900m (36% YoY, 27% beat) amid healthy NII and higher other income."
Buy Dixon Technologies; target of Rs 16700: Motilal Oswal,https://www.moneycontrol.com/news/business/buy-dixon-technologies-target-of-rs-16700-motilal-oswal-13806237.html,"Motilal Oswal's research report on Dixon Technologies Dixon’s 3QFY26 revenue/EBITDA came in line with our estimates, though the quarter’s performance was impacted by weak demand in the smartphone industry due to challenges related to higher memory prices and channel inventory. Issues related to higher memory prices are likely to persist for another few quarters, which could weigh on mobile volumes in the upcoming quarters. The company’s efforts on backward integration are progressing in line with schedule and it has also received ECMS approval for camera module and electro transceivers. Approval for Vivo JV has seen delays and the company is hopeful of getting these approvals during this quarter. Considering the current weakness in smartphone volumes and expectations of lower margins in FY27, we cut our estimates by 23%/9% for FY27/FY28 and arrive at a revised TP of INR16,700, based on 2-year forward DCF, implying a target P/E multiple of 55x. Retain BUY as the stock price correction of nearly 46% from the high bakes in these uncertainties. Outlook We reiterate our BUY rating on the stock with a revised DCF-based TP of INR16,700, implying a target P/E multiple of 55x. Retain BUY as the stock price correction of nearly 46% from the high bakes in these uncertainties. For all recommendations report, click here Disclaimer: The views and investment tips expressed by investment experts/broking houses/rating agencies on moneycontrol.com are their own, and not that of the website or its management. Moneycontrol.com advises users to check with certified experts before taking any investment decisions. Dixon Technologies_01022026_Motilal Oswal","Motilal Oswal's research report on Dixon Technologies Dixon’s 3QFY26 revenue/EBITDA came in line with our estimates, though the quarter’s performance was impacted by weak demand in the smartphone industry due to challenges related to higher memory prices and channel inventory.","Motilal Oswal's research report on Dixon Technologies Dixon’s 3QFY26 revenue/EBITDA came in line with our estimates, though the quarter’s performance was impacted by weak demand in the smartphone industry due to challenges related to higher memory prices and channel inventory.",Approval for Vivo JV has seen delays and the company is hopeful of getting these approvals during this quarter.,"Motilal Oswal's research report on Dixon Technologies Dixon’s 3QFY26 revenue/EBITDA came in line with our estimates, though the quarter’s performance was impacted by weak demand in the smartphone industry due to challenges related to higher memory prices and channel inventory."
Buy Delhivery; target of Rs 580: Motilal Oswal,https://www.moneycontrol.com/news/business/buy-delhivery-target-of-rs-580-motilal-oswal-13806236.html,"Motilal Oswal's research report on Delhivery Delhivery posted revenue growth of 18% YoY to INR28b in 3QFY26 (in line). Reported EBITDA doubled YoY to ~INR2.1b (est. INR1.6b). EBITDA margins stood at 7.4% (+310bp YoY and +470bp QoQ) against our estimate of 5.8%. APAT stood at INR670m (9% above estimates). After adjusting costs related to E-com Express integration, APAT stood at INR1.1b Outlook We expect Delhivery to deliver a CAGR of 14%/44%/54% in revenue/EBITDA/ APAT over FY25-28. We reiterate our BUY rating with a revised DCF-based TP of INR580. For all recommendations report, click here Disclaimer: The views and investment tips expressed by investment experts/broking houses/rating agencies on moneycontrol.com are their own, and not that of the website or its management. Moneycontrol.com advises users to check with certified experts before taking any investment decisions. Delhivery_01022026_Motilal Oswal",EBITDA margins stood at 7.4% (+310bp YoY and +470bp QoQ) against our estimate of 5.8%.,Motilal Oswal's research report on Delhivery Delhivery posted revenue growth of 18% YoY to INR28b in 3QFY26 (in line).,"For all recommendations report, click here Disclaimer: The views and investment tips expressed by investment experts/broking houses/rating agencies on moneycontrol.com are their own, and not that of the website or its management.","After adjusting costs related to E-com Express integration, APAT stood at INR1.1b Outlook We expect Delhivery to deliver a CAGR of 14%/44%/54% in revenue/EBITDA/ APAT over FY25-28."
Buy Container Corporation; target of Rs 580: Motilal Oswal,https://www.moneycontrol.com/news/business/buy-container-corporation-target-of-rs-580-motilal-oswal-13806235.html,"Motilal Oswal's research report on Container Corporation Container Corporation (CCRI)’s revenue grew 4.5% YoY to INR23b in 3QFY26 (in line). Total volumes grew 11% YoY to 1.4m TEUs with EXIM/domestic volumes at 0.107m/0.35m TEUs (+10%/+13% YoY). Blended realization dipped 6% YoY to INR16,172/TEU. EXIM/domestic realization stood at INR14,300/INR21,888 per TEU (flat/-17% YoY). Outlook We expect its revenue/ EBITDA to clock a CAGR of 11%/14% over FY25-FY28. We reiterate our BUY rating with a revised TP of INR580 (based on 14x EV/EBITDA on FY28E). For all recommendations report, click here Disclaimer: The views and investment tips expressed by investment experts/broking houses/rating agencies on moneycontrol.com are their own, and not that of the website or its management. Moneycontrol.com advises users to check with certified experts before taking any investment decisions. Container Corporation_01022026_Motilal Oswal","EXIM/domestic realization stood at INR14,300/INR21,888 per TEU (flat/-17% YoY).",Total volumes grew 11% YoY to 1.4m TEUs with EXIM/domestic volumes at 0.107m/0.35m TEUs (+10%/+13% YoY).,"For all recommendations report, click here Disclaimer: The views and investment tips expressed by investment experts/broking houses/rating agencies on moneycontrol.com are their own, and not that of the website or its management.",Motilal Oswal's research report on Container Corporation Container Corporation (CCRI)’s revenue grew 4.5% YoY to INR23b in 3QFY26 (in line).
Buy Colgate; target of Rs 2450: Motilal Oswal,https://www.moneycontrol.com/news/business/buy-colgate-target-of-rs-2450-motilal-oswal-13806234.html,"Motilal Oswal's research report on Colgate Colgate’s (CLGT) delivered 2% YoY revenue growth to INR14.9b (est. INR14.9b) in 3QFY26, clocking positive growth after three consecutive quarters of decline. Toothpaste volume remained soft and contracted by ~2% (est. +1%, around -5% in 2QFY26). The price hike taken earlier helped Colgate deliver good revenue growth, but it was much lower than Dabur’s toothpaste growth of 10% YoY. Outlook The stock has been corrected by ~25% over the past 12 months. The stock is trading at a comfortable valuation of 38x and 35x P/E for FY27 and FY28. We reiterate our BUY rating with a TP of INR2,450 (based on 40x Dec’27). For all recommendations report, click here Disclaimer: The views and investment tips expressed by investment experts/broking houses/rating agencies on moneycontrol.com are their own, and not that of the website or its management. Moneycontrol.com advises users to check with certified experts before taking any investment decisions. Colgate_01022026_Motilal Oswal",Motilal Oswal's research report on Colgate Colgate’s (CLGT) delivered 2% YoY revenue growth to INR14.9b (est.,Motilal Oswal's research report on Colgate Colgate’s (CLGT) delivered 2% YoY revenue growth to INR14.9b (est.,"For all recommendations report, click here Disclaimer: The views and investment tips expressed by investment experts/broking houses/rating agencies on moneycontrol.com are their own, and not that of the website or its management.","For all recommendations report, click here Disclaimer: The views and investment tips expressed by investment experts/broking houses/rating agencies on moneycontrol.com are their own, and not that of the website or its management."
Buy Canara Bank; target of Rs 175: Motilal Oswal,https://www.moneycontrol.com/news/business/buy-canara-bank-target-of-rs-175-motilal-oswal-13806233.html,"Motilal Oswal's research report on Canara Bank Canara Bank (CBK) reported 3QFY26 standalone PAT at INR51.6b (26% YoY/ 8% QoQ, 15% higher than MOFSLe) amid stake sale gains, which resulted in pre-tax profit of INR19.3b. NII stood flat at 1% YoY/ 1% QoQ, reaching INR92.5b (largely in line). Margins moderated 5bp QoQ to 2.45% vs our est. of 2.48%. Loan book grew 15% YoY/ 4% QoQ to INR11.7t, while deposits grew 12.9% YoY/1.4% QoQ to INR15.2t. CASA deposits grew 9.3% YoY/declined 3.7% QoQ. As a result, CASA ratio moderated 117bp QoQ to 29.5%. Outlook We fine-tune our earnings estimates and project CBK to deliver FY27E RoA/ RoE of 1.03%/17.8%. Reiterate BUY with a revised TP of INR175 (based on 1.2x Sep’27E ABV+ INR12 for subs). For all recommendations report, click here Disclaimer: The views and investment tips expressed by investment experts/broking houses/rating agencies on moneycontrol.com are their own, and not that of the website or its management. Moneycontrol.com advises users to check with certified experts before taking any investment decisions. Canara Bank_01022026_Motilal Oswal",of 2.48%.,"Motilal Oswal's research report on Canara Bank Canara Bank (CBK) reported 3QFY26 standalone PAT at INR51.6b (26% YoY/ 8% QoQ, 15% higher than MOFSLe) amid stake sale gains, which resulted in pre-tax profit of INR19.3b.",Outlook We fine-tune our earnings estimates and project CBK to deliver FY27E RoA/ RoE of 1.03%/17.8%.,"Motilal Oswal's research report on Canara Bank Canara Bank (CBK) reported 3QFY26 standalone PAT at INR51.6b (26% YoY/ 8% QoQ, 15% higher than MOFSLe) amid stake sale gains, which resulted in pre-tax profit of INR19.3b."
"Budget boosts long-term outlook for Dixon, Kaynes Tech, other EMS stocks, say brokerages",https://www.moneycontrol.com/news/business/markets/budget-boosts-long-term-outlook-for-dixon-kaynes-tech-other-ems-stocks-say-brokerages-13806099.html,"Finance Minister Nirmala Sitharaman presented Union Budget 2026 on February 1. Brokerages see India’s electronics manufacturing services sector benefitting from the Budget’s pivot toward higher value addition and backward integration. Dixon Technologies shares rose around 2 percent to close at Rs 10,354 apiece on February 2. Syrma SGS Technology shares meanwhile gained more than 1 percent. Kaynes Tech shares however closed in the red today. Budget reforms for EMS sector: While presenting Union Budget 2026, Finance Minister Nirmala Sitharaman announced a sharp increase in the allocation for the Electronics Component Manufacturing Scheme (ECMS) to Rs 40,000 crore. The ECMS, notified by the Ministry of Electronics and Information Technology on April 8, 2025, was originally launched with an outlay of Rs 22,919 crore over six years. The scheme aims to develop a robust domestic electronics component base by offering targeted incentives across 11 key segments, including printed circuit boards, capacitors, resistors, display modules and other critical components. The enhanced outlay is expected to boost domestic value addition, curb import dependence on critical components, and strengthen the integration of Indian manufacturers into global supply chains. Brokerages on EMS: CLSA said that the budget marks a ""pivot point"" for electronics manufacturing. It added that the government allocation supports domestic component manufacturing and integration. However, it flagged near-term risks from lower smartphone assembly incentives. Jefferies meanwhile said that higher allocation supports the medium-term outlook for electronic companies, but flagged execution timelines and the expiry of assembly-linked incentives as near-term risks for some players. Nomura flagged continued policy support for electronics and semiconductors in the Budget as a key positive within a fiscally restrained framework. ""A boost to the semi-conductor sector and electronics manufacturing along with strategies to establish dedicated Rare Earth Corridors, clearly establishes the intention towards not only making the Indian economy self-reliant, but also ring fence the economy from global unrests that tend to disturb the supply chain ecosystem,"" said Prashant Kumar, Managing Director & CEO of Yes Bank. ""Budget 2026 marks a structural shift in India’s semiconductor strategy by recognising that scale without sustainability is not globally competitive. With India Semiconductor Mission 2.0 and a proposed Rs 40,000 crore outlay for electronics manufacturing, the focus now moves beyond capacity creation to process excellence,"" said Deepak Pahwa - Chairman, Pahwa Group. Follow all updates about the stock markets here.","The enhanced outlay is expected to boost domestic value addition, curb import dependence on critical components, and strengthen the integration of Indian manufacturers into global supply chains.","Budget reforms for EMS sector: While presenting Union Budget 2026, Finance Minister Nirmala Sitharaman announced a sharp increase in the allocation for the Electronics Component Manufacturing Scheme (ECMS) to Rs 40,000 crore.","The scheme aims to develop a robust domestic electronics component base by offering targeted incentives across 11 key segments, including printed circuit boards, capacitors, resistors, display modules and other critical components.","""A boost to the semi-conductor sector and electronics manufacturing along with strategies to establish dedicated Rare Earth Corridors, clearly establishes the intention towards not only making the Indian economy self-reliant, but also ring fence the economy from global unrests that tend to disturb the supply chain ecosystem,"" said Prashant Kumar, Managing Director & CEO of Yes Bank."
