title,link,content,summary_lexrank,summary_luhn,summary_lsa,summary_textrank
BEL shares decline up to 3% amid rich valuations despite strong Q3; profit booking pulls defence index 2% lower,https://www.moneycontrol.com/news/business/markets/bel-shares-decline-up-to-3-amid-rich-valuations-despite-strong-q3-profit-booking-pulls-defence-index-2-lower-13796838.html,"Bharat Electronics Ltd (BEL) shares fell over 3 percent on Thursday amid profit booking, despite the company reporting strong December quarter results. The stock touched an intraday low of Rs 438.25. The defence PSU on Wednesday reported a 20.4 percent rise in consolidated net profit for the December quarter, while revenue from operations grew nearly 24 percent year-on-year. BEL shares have gained 36.3 per cent so far in 2025 and are up about 13 per cent in January. Brokerage firm CLSA maintained an ‘outperform’ rating on the stock with a target price of Rs 453, noting that third-quarter execution was better than expected. However, it said much of the optimism is already priced in, adding that near-term stock movement will depend on execution of the company’s large order backlog amid lumpy order inflows. Kotak Institutional Equities reiterated its ‘sell’ rating with a target price of Rs 390, citing limited upside after the recent rally and an unfavourable risk-reward profile at current levels. JP Morgan, which has an ‘overweight’ rating on BEL with a target price of Rs 556, said the company’s earnings beat estimates but cautioned that margins may normalise. It added that growth will hinge on operating leverage and timely execution of orders. BEL is a constituent of the benchmark Nifty 50 index. The sharp decline in the stock also weighed on other defence stocks. The Nifty Defence index, which had risen for two consecutive sessions, snapped its rally and fell up to 2 percent on Thursday amid profit booking. Defence stocks had rallied over the past two sessions after India and the European Union concluded a defence and security agreement aimed at enhancing cooperation in areas such as counter-terrorism, the Indo-Pacific and joint development of military hardware. The pact was finalised at the India-EU summit between Prime Minister Narendra Modi and European Commission President Ursula von der Leyen, along with European Council President Antonio Costa. Officials said the agreement is expected to improve interoperability in the defence sector and create opportunities for Indian companies under the EU’s Security Action for Europe programme. Disclaimer: The views and investment tips expressed by investment experts on Moneycontrol.com are their own and not those of the website or its management. Moneycontrol.com advises users to check with certified experts before taking any investment decisions.","The Nifty Defence index, which had risen for two consecutive sessions, snapped its rally and fell up to 2 percent on Thursday amid profit booking.","The Nifty Defence index, which had risen for two consecutive sessions, snapped its rally and fell up to 2 percent on Thursday amid profit booking.","JP Morgan, which has an ‘overweight’ rating on BEL with a target price of Rs 556, said the company’s earnings beat estimates but cautioned that margins may normalise.","Defence stocks had rallied over the past two sessions after India and the European Union concluded a defence and security agreement aimed at enhancing cooperation in areas such as counter-terrorism, the Indo-Pacific and joint development of military hardware."
"Bank Nifty crosses 60,000 amid sharp intraday recovery as Axis Bank, AU SFB shares rise up to 3%: Check key trading levels",https://www.moneycontrol.com/news/business/markets/bank-nifty-nears-60-000-amid-sharp-intraday-recovery-as-axis-bank-au-sfb-shares-rise-check-key-trading-levels-13797014.html,"The Nifty Bank index crossed the key psychological mark and an important resistance level of 60,000 after six sessions on January 29 as sustained buying interest in public and private ban stocks pushed the index higher. The index gained around 0.8 percent (461.9 points) to 60,060.70. This marks a recovery of over 1.2 percent (722 points) from its day’s low of 59,339. Nifty Bank is now on track to record its third consecutive session of gains. Axis Bank shares were the top gainers on the index, rising more than 3 percent to trade at Rs 1,363.30 apiece. AU Small Finance Bank shares meanwhile gained around 3 percent. ICICI Bank, Federal Bank and Punjab National Bank (PNB) shares rose around 1 percent, while State Bank of India (SBI), HDFC Bank, IDFC First Bank and Kotak Mahindra Bank shares were trading in the green with marginal gains. IndusInd Bank, Yes Bank, Bank of Baroda, Union Bank of India and Canara Bank shares bucked the trend to trade in the red. Technical view on Bank Nifty: Immediate resistance is placed at 59,900–60,000, while strong support is seen in the 59,300–59,400 zone, said Hitesh Tailor, Research Analyst at Choice Broking. Immediate resistance is placed at 59,700; a decisive move above this level could further improve sentiment in the banking space, said Rupak De, Senior Technical Analyst at LKP Securities. The analyst sees the index finding support at 59,400 and 59,000. ""Volatility is likely to stay elevated in the coming sessions due to the Union Budget on February 1, 2026, and uncertain global cues. Index in the short term is likely to consolidate in the range of 60,400-58,500. Only a move above the recent high of 60,400 will open further upside towards the 61,500 levels. Key support...is placed at 58,000-57,500 levels, being the confluence of the 100-day EMA and the major breakout area. The daily stochastic has generated a buy signal moving above its nine-period average, thus validating positive bias,"" said Bajaj Broking. Follow all LIVE updates from the stock markets here.","The index gained around 0.8 percent (461.9 points) to 60,060.70.","Technical view on Bank Nifty: Immediate resistance is placed at 59,900–60,000, while strong support is seen in the 59,300–59,400 zone, said Hitesh Tailor, Research Analyst at Choice Broking.","The daily stochastic has generated a buy signal moving above its nine-period average, thus validating positive bias,"" said Bajaj Broking.","ICICI Bank, Federal Bank and Punjab National Bank (PNB) shares rose around 1 percent, while State Bank of India (SBI), HDFC Bank, IDFC First Bank and Kotak Mahindra Bank shares were trading in the green with marginal gains."
Buy Sunteck Realty; target of Rs 550: Prabhudas Lilladher,https://www.moneycontrol.com/news/business/stocks/buy-sunteck-realty-target-of-rs-550-prabhudas-lilladher-13796854.html,"Prabhudas Lilladher's research report on Sunteck Realty Sunteck Reality (SRIN) reported healthy pre-sales (16% YoY). While collections were subdued; (down 5% YoY) in Q3 and should pick up as RERA for Nepean Sea project gets received. SRIN’s proven ability to market ultra-luxury projects, aggressive and multi-pronged land acquisition capabilities in various micro markets across Mumbai Metropolitan Region (MMR) is an interesting play on Mumbai’s high value real estate market. We expect the company’s pre-sales to grow to 25% CAGR over FY25-28E, aided by ongoing projects and strong new launches pipeline including the Dubai JV project. Outlook Further given likely strong cash flow generation, we see SRIN to step up new project additions which will be a key catalyst for stock performance. Maintain ‘Buy’ rating with revised TP of Rs550share. For all recommendations report, click here Disclaimer: The views and investment tips expressed by investment experts/broking houses/rating agencies on moneycontrol.com are their own, and not that of the website or its management. Moneycontrol.com advises users to check with certified experts before taking any investment decisions. Sunteck Realty - 2901026 - prabhu","We expect the company’s pre-sales to grow to 25% CAGR over FY25-28E, aided by ongoing projects and strong new launches pipeline including the Dubai JV project.","We expect the company’s pre-sales to grow to 25% CAGR over FY25-28E, aided by ongoing projects and strong new launches pipeline including the Dubai JV project.","Outlook Further given likely strong cash flow generation, we see SRIN to step up new project additions which will be a key catalyst for stock performance.","For all recommendations report, click here Disclaimer: The views and investment tips expressed by investment experts/broking houses/rating agencies on moneycontrol.com are their own, and not that of the website or its management."
Eternal shares rise 2.01% in Thursday's trade,https://www.moneycontrol.com/news/business/stocks/eternal-shares-rise-2-01-in-thursday-s-trade-alpha-article-13796940.html,"Eternal shares were trading at Rs 271.65 at around 1.10 pm, up 2.01% from the previous close. The stock is a constituent of the Nifty 50 index. Financial Snapshot: The following table presents a summary of Eternal's key financial data: Financial YearRevenue (Rs Crore)Net Profit (Rs Crore)EPSBVPSROEDebt to Equity20211,993.79-816.43-1.51246,389.58-10.630.0020224,192.40-1,222.80-1.6721.59-7.320.0020237,079.40-970.70-1.2023.26-4.990.00202412,114.00351.000.4123.511.710.00202520,243.00527.000.6033.431.730.00 The revenue for Eternal has increased significantly over the past five years. In 2025, the revenue was Rs 20,243.00 Crore compared to Rs 12,114.00 Crore in 2024. Income Statement (Annual): Mar 2025Mar 2024Mar 2023Mar 2022Mar 2021Sales20,24312,1147,0794,1921,993Other Income1,077847681494124Total Income21,32012,9617,7604,6872,118Total Expenditure20,46912,5988,7265,8962,923EBIT851363-965-1,208-805Interest15472481210Tax170-60-4321Net Profit527351-970-1,222-816 The sales for the year ending March 2025 were Rs 20,243 Crore compared to Rs 12,114 Crore for the year ending March 2024. Income Statement (Quarterly): The sales for the quarter-ending December 2025 were Rs 16,315 Crore compared to Rs 5,405 Crore for the quarter-ending December 2024. Cash Flow: Mar 2025Mar 2024Mar 2023Mar 2022Mar 2021Operating Activities308646-844-693-1,017Investing Activities-7,993-347457-7,937-5,243Financing Activities8,042-207-1278,7496,401Others0-1339-33-1Net Cash Flow35791-17485139 Net cash flow for the year ending March 2025 was Rs 357 Crore compared to Rs 91 Crore for the year ending March 2024. Balance Sheet: Total liabilities for the year ending March 2025 were Rs 35,623 Crore compared to Rs 23,356 Crore for the year ending March 2024. Financial Ratios: RatioMar 2025Mar 2024Mar 2023Mar 2022Mar 2021Basic EPS (Rs.)0.600.41-1.20-1.67-1.51Diluted EPS (Rs.)0.580.40-1.20-1.67-1.51Book Value [Excl. Reval Reserve]/Share (Rs.)33.4323.5123.2621.59246,389.58Dividend/Share (Rs.)0.000.000.000.000.00Face Value11111Gross Profit Margin (%)8.467.33-7.46-32.34-17.17Operating Margin (%)4.202.99-13.64-35.92-24.08Net Profit Margin (%)2.602.89-13.71-29.16-40.94Return on Networth / Equity (%)1.731.71-4.99-7.32-10.63ROCE (%)2.631.70-4.79-9.06-5.86Return On Assets (%)1.471.50-4.49-6.97-9.33Current Ratio (X)3.522.627.5210.608.02Quick Ratio (X)3.472.587.4610.557.99Debt to Equity (x)0.000.000.000.000.00Interest Coverage Ratios (X)11.1312.35-10.86-112.99-47.64Asset Turnover Ratio (%)0.690.540.360.3222.90Inventory Turnover Ratio (X)153.360.000.000.00134.743 Yr CAGR Sales (%)119.74146.4964.8678.72106.773 Yr CAGR Net Profit (%)-34.35-34.43-36.2110.52177.12P/E (x)336.17444.15-42.50-49.280.00P/B (x)6.037.752.193.810.00EV/EBITDA (x)104.52177.21-78.74-45.220.00P/S (x)9.0313.076.0215.000.00 Corporate Actions: Eternal Limited has been actively involved in corporate actions. On January 27, 2026, the company filed the transcript of the earnings conference call conducted on January 21, 2026, with the exchange. Additionally, on January 22, 2026, Eternal responded to a clarification sought by the exchange regarding a news article. With the stock currently trading at Rs 271.65, Eternal has seen a gain of 2.01% from its previous close.","In 2025, the revenue was Rs 20,243.00 Crore compared to Rs 12,114.00 Crore in 2024.",)0.000.000.000.000.00Face Value11111Gross Profit Margin (%)8.467.33-7.46-32.34-17.17Operating Margin (%)4.202.99-13.64-35.92-24.08Net Profit Margin (%)2.602.89-13.71-29.16-40.94Return on Networth / Equity (%)1.731.71-4.99-7.32-10.63ROCE (%)2.631.70-4.79-9.06-5.86Return On Assets (%)1.471.50-4.49-6.97-9.33Current Ratio (X)3.522.627.5210.608.02Quick Ratio (X)3.472.587.4610.557.99Debt to Equity (x)0.000.000.000.000.00Interest Coverage Ratios (X)11.1312.35-10.86-112.99-47.64Asset Turnover Ratio (%)0.690.540.360.3222.90Inventory Turnover Ratio (X)153.360.000.000.00134.743 Yr CAGR Sales (%)119.74146.4964.8678.72106.773 Yr CAGR Net Profit (%)-34.35-34.43-36.2110.52177.12P/E (x)336.17444.15-42.50-49.280.00P/B (x)6.037.752.193.810.00EV/EBITDA (x)104.52177.21-78.74-45.220.00P/S (x)9.0313.076.0215.000.00 Corporate Actions: Eternal Limited has been actively involved in corporate actions.,"With the stock currently trading at Rs 271.65, Eternal has seen a gain of 2.01% from its previous close.","Income Statement (Annual): Mar 2025Mar 2024Mar 2023Mar 2022Mar 2021Sales20,24312,1147,0794,1921,993Other Income1,077847681494124Total Income21,32012,9617,7604,6872,118Total Expenditure20,46912,5988,7265,8962,923EBIT851363-965-1,208-805Interest15472481210Tax170-60-4321Net Profit527351-970-1,222-816 The sales for the year ending March 2025 were Rs 20,243 Crore compared to Rs 12,114 Crore for the year ending March 2024."
Jindal Steel shares surge 3.84% amid high volume in today's session,https://www.moneycontrol.com/news/business/stocks/jindal-steel-shares-surge-3-84-amid-high-volume-in-today-s-session-alpha-article-13796938.html,"Jindal Steel shares gained 3.84% to trade at Rs 1,162.40 in Thursday's session, driven by high volume trading. The stock is a constituent of the NIFTY NEXT 50 index. On the financial front, Jindal Steel's consolidated financial performance reveals the following trends: HeadingSep 2024Dec 2024Mar 2025Jun 2025Sep 2025RevenueRs 11,213.31 CroreRs 11,750.67 CroreRs 13,183.13 CroreRs 12,294.48 CroreRs 11,685.88 CroreNet ProfitRs 860.47 CroreRs 950.80 Crore-Rs 294.44 CroreRs 1,496.00 CroreRs 635.10 CroreEPS8.499.39-3.3514.736.28 The company's quarterly revenue saw fluctuations, with a high of Rs 13,183.13 Crore in March 2025 and a recent value of Rs 11,685.88 Crore in September 2025. The net profit also varied significantly, with a loss of Rs 294.44 Crore in March 2025 but a profit of Rs 1,496.00 Crore in June 2025. The annual revenue for Jindal Steel has seen a slight decrease from Rs 52,711.18 Crore in 2023 to Rs 49,764.97 Crore in 2025. Similarly, the net profit decreased from Rs 5,943.42 Crore in 2024 to Rs 2,854.75 Crore in 2025. The company’s debt to equity ratio has remained relatively stable, standing at 0.38 in 2025. The sales figures show some volatility, with a peak of Rs 52,711 Crore in March 2023. Total expenditure has generally increased over the years. The company's net profit decreased to Rs 2,854 Crore in March 2025, compared to Rs 5,943 Crore in March 2024. Mar 2025Mar 2024Mar 2023Mar 2022Mar 2021Operating ActivitiesRs 10,823 CroreRs 6,008 CroreRs 7,275 CroreRs 16,047 CroreRs 11,960 CroreInvesting Activities-Rs 12,322 Crore-Rs 8,344 Crore-Rs 4,018 Crore-Rs 2,331 Crore-Rs 1,884 CroreFinancing ActivitiesRs 809 CroreRs 1,381 Crore-Rs 2,500 Crore-Rs 15,119 Crore-Rs 4,611 CroreOthersRs 0 CroreRs 0 CroreRs 0 CroreRs 0 CroreRs 0 CroreNet Cash Flow-Rs 689 Crore-Rs 954 CroreRs 756 Crore-Rs 1,403 CroreRs 5,464 Crore Jindal Steel announced an Intimation of Schedule of Analyst / Institutional Investor Meeting under the Securities and Exchange Board of India (Listing Obligations and Disclosure Requirements) Regulations, 2015, on January 28, 2026. A board meeting is scheduled on January 30, 2026, to consider and approve the unaudited financial results for the quarter and nine months ended December 31, 2025. The company has consistently declared final dividends. The most recent was announced on April 30, 2025, for Rs 2.00 per share (200%) with an effective date of August 22, 2025. On July 29, 2009, Jindal Steel announced a bonus issue with a ratio of 5:1, with the ex-bonus date being September 14, 2009. Jindal Steel had a stock split on January 21, 2008, where the old face value of Rs 5 was split to a new face value of Rs 1. Another split occurred on December 22, 2003, from Rs 10 to Rs 5. A recent Moneycontrol analysis suggests a very bullish sentiment for the stock.","Another split occurred on December 22, 2003, from Rs 10 to Rs 5.","On the financial front, Jindal Steel's consolidated financial performance reveals the following trends: HeadingSep 2024Dec 2024Mar 2025Jun 2025Sep 2025RevenueRs 11,213.31 CroreRs 11,750.67 CroreRs 13,183.13 CroreRs 12,294.48 CroreRs 11,685.88 CroreNet ProfitRs 860.47 CroreRs 950.80 Crore-Rs 294.44 CroreRs 1,496.00 CroreRs 635.10 CroreEPS8.499.39-3.3514.736.28 The company's quarterly revenue saw fluctuations, with a high of Rs 13,183.13 Crore in March 2025 and a recent value of Rs 11,685.88 Crore in September 2025.","The most recent was announced on April 30, 2025, for Rs 2.00 per share (200%) with an effective date of August 22, 2025.","On the financial front, Jindal Steel's consolidated financial performance reveals the following trends: HeadingSep 2024Dec 2024Mar 2025Jun 2025Sep 2025RevenueRs 11,213.31 CroreRs 11,750.67 CroreRs 13,183.13 CroreRs 12,294.48 CroreRs 11,685.88 CroreNet ProfitRs 860.47 CroreRs 950.80 Crore-Rs 294.44 CroreRs 1,496.00 CroreRs 635.10 CroreEPS8.499.39-3.3514.736.28 The company's quarterly revenue saw fluctuations, with a high of Rs 13,183.13 Crore in March 2025 and a recent value of Rs 11,685.88 Crore in September 2025."
Bharti Hexacom shares rise 2.06%; stock among top gainers on Nifty Midcap 150,https://www.moneycontrol.com/news/business/stocks/bharti-hexacom-shares-rise-2-06-stock-among-top-gainers-on-nifty-midcap-150-alpha-article-13796937.html,"Bharti Hexacom shares were trading higher in Thursday's session, with the stock last traded at Rs 1,566.90 on the NSE, a gain of 2.06% from the previous close. The stock is among the top gainers on the Nifty Midcap 150 index. Bharti Hexacom is included as one of the stocks in the Nifty Midcap 150 index. The company's announcements included updates under Regulation 30 (LODR) regarding analyst/investor meetings, and intimations under Regulation 30(5) of the SEBI (Listing Obligations and Disclosure Requirements) Regulations, 2015. The trading window for dealing in the company's securities was closed from January 1, 2026, as per the company's code on Prohibition of Insider Trading. The company announced a final dividend of Rs 10 per share (200%) with an effective date of July 25, 2025. Prior to this, a final dividend of Rs 4 per share (80%) was announced with an effective date of August 16, 2024. Moneycontrol's analysis, as of January 29, 2026, suggests a very bearish sentiment surrounding the stock. With the stock's last traded price at Rs 1,566.90, Bharti Hexacom has seen a gain of 2.06% from the previous close.","Bharti Hexacom shares were trading higher in Thursday's session, with the stock last traded at Rs 1,566.90 on the NSE, a gain of 2.06% from the previous close.","Bharti Hexacom shares were trading higher in Thursday's session, with the stock last traded at Rs 1,566.90 on the NSE, a gain of 2.06% from the previous close.","Moneycontrol's analysis, as of January 29, 2026, suggests a very bearish sentiment surrounding the stock.","Bharti Hexacom shares were trading higher in Thursday's session, with the stock last traded at Rs 1,566.90 on the NSE, a gain of 2.06% from the previous close."
Vishal Mega Mart shares rise 2.24% in today's trading session,https://www.moneycontrol.com/news/business/stocks/vishal-mega-mart-shares-rise-2-24-in-today-s-trading-session-alpha-article-13796931.html,"Vishal Mega Mart's stock was trading at Rs 122.55 at around 1.10 pm, a 2.24% increase from its previous close. The stock is part of the Nifty Midcap 150 index. Vishal Mega Mart's financial performance shows consistent growth in revenue and net profit over the past few years. Consolidated yearly revenue increased from Rs 5,588.52 Crore in 2022 to Rs 10,716.35 Crore in 2025. The net profit also rose from Rs 202.77 Crore in 2022 to Rs 631.97 Crore in 2025. Here's a summary of Vishal Mega Mart's key financial data: The company's quarterly performance also shows an upward trend. The revenue for the quarter-ending December 2025 was Rs 3,670.41 Crore, compared to Rs 3,135.94 Crore in December 2024. The net profit for the same period increased from Rs 262.72 Crore to Rs 312.92 Crore. Here is a summary of the company's income statement (Consolidated) over the years: According to announcements, the audio recording of the Earnings Conference Call on results for the quarter and nine months ended December 31, 2025, is available. The company also published its financial results in the newspaper for the same period.",Here's a summary of Vishal Mega Mart's key financial data: The company's quarterly performance also shows an upward trend.,The net profit for the same period increased from Rs 262.72 Crore to Rs 312.92 Crore.,Here's a summary of Vishal Mega Mart's key financial data: The company's quarterly performance also shows an upward trend.,"Here is a summary of the company's income statement (Consolidated) over the years: According to announcements, the audio recording of the Earnings Conference Call on results for the quarter and nine months ended December 31, 2025, is available."
Bharat Electronics shares decline 2.54% amid volume surge in today's trading session,https://www.moneycontrol.com/news/business/stocks/bharat-electronics-shares-decline-2-54-amid-volume-surge-in-today-s-trading-session-alpha-article-13796927.html,"Shares of Bharat Electronics experienced a decline of 2.54%, with the stock price falling to Rs 441.50 in Thursday's session. The stock witnessed a surge in volume. Bharat Electronics is included as one of the stocks in the benchmark NIFTY 50 index. Financial Snapshot: The following table summarizes the consolidated financial performance of Bharat Electronics: The company has shown consistent growth in financials. The revenue increased from Rs 14,108.69 Crore in 2021 to Rs 23,768.75 Crore in 2025. The net profit also increased from Rs 2,069.34 Crore in 2021 to Rs 5,287.15 Crore in 2025. Income Statement - Annual (Consolidated): Income Statement - Quarterly (Consolidated): Cash Flow (Consolidated): Balance Sheet (Consolidated): Key Financial Ratios (Consolidated): Corporate Actions: Bharat Electronics announced the following corporate actions: The company announced a split on January 27, 2017, with an old face value of 10 and a new face value of 1. The ex-split date was March 16, 2017, and the record date was March 17, 2017. The company has announced several dividends. The most recent was on May 19, 2025, for a final dividend of Rs 0.90 per share (90%), effective August 14, 2025. Moneycontrol's sentiment analysis, conducted on January 22, 2026, indicates a very bullish outlook for the stock. With the stock's last traded price at Rs 441.50, Bharat Electronics experienced a decline of 2.54% in today's session amid high volume.","The most recent was on May 19, 2025, for a final dividend of Rs 0.90 per share (90%), effective August 14, 2025.","Income Statement - Annual (Consolidated): Income Statement - Quarterly (Consolidated): Cash Flow (Consolidated): Balance Sheet (Consolidated): Key Financial Ratios (Consolidated): Corporate Actions: Bharat Electronics announced the following corporate actions: The company announced a split on January 27, 2017, with an old face value of 10 and a new face value of 1.","With the stock's last traded price at Rs 441.50, Bharat Electronics experienced a decline of 2.54% in today's session amid high volume.","Income Statement - Annual (Consolidated): Income Statement - Quarterly (Consolidated): Cash Flow (Consolidated): Balance Sheet (Consolidated): Key Financial Ratios (Consolidated): Corporate Actions: Bharat Electronics announced the following corporate actions: The company announced a split on January 27, 2017, with an old face value of 10 and a new face value of 1."
