title,link,content,summary_lexrank,summary_luhn,summary_lsa,summary_textrank
Buy Aditya Birla Sun Life AMC; target of Rs 1020: Motilal Oswal,https://www.moneycontrol.com/news/business/buy-aditya-birla-sun-life-amc-target-of-rs-1020-motilal-oswal-13794489.html,"Motilal Oswal's research report on Aditya Birla Sun Life AMC Aditya Birla Sun Life AMC (ABSLAMC)’s operating revenue grew 7% YoY to ~INR4.8b (in line). The yields on management fees for 3Q stood at 43.1bp vs. 46.4bp in 3QFY25. For 9MFY26, revenue rose 10% YoY to INR13.9b. Total opex grew 10% YoY to INR1.9b (in line), reflecting a cost-to-income ratio of 39.4% compared to 38.4% in 3QFY25 (vs. our est. of 39.6%). EBITDA grew 6% YoY to INR2.9b, reflecting an EBITDA margin of 60.6% (vs. 61.6% in 3QFY25 and MOFSLe of 60.4%). Outlook We cut our EPS estimates by 3% each for FY26E/27E, considering the impact of the new ESOP scheme launched in Jan’26, while other estimates remain largely unchanged. We reiterate our BUY rating with a revised TP of INR1,020, based on 22x FY28E P/E. For all recommendations report, click here Disclaimer: The views and investment tips expressed by investment experts/broking houses/rating agencies on moneycontrol.com are their own, and not that of the website or its management. Moneycontrol.com advises users to check with certified experts before taking any investment decisions. Aditya Birla Sun Life AMC_23012026_Motilal Oswal","Total opex grew 10% YoY to INR1.9b (in line), reflecting a cost-to-income ratio of 39.4% compared to 38.4% in 3QFY25 (vs. our est.",Motilal Oswal's research report on Aditya Birla Sun Life AMC Aditya Birla Sun Life AMC (ABSLAMC)’s operating revenue grew 7% YoY to ~INR4.8b (in line).,"For all recommendations report, click here Disclaimer: The views and investment tips expressed by investment experts/broking houses/rating agencies on moneycontrol.com are their own, and not that of the website or its management.",Motilal Oswal's research report on Aditya Birla Sun Life AMC Aditya Birla Sun Life AMC (ABSLAMC)’s operating revenue grew 7% YoY to ~INR4.8b (in line).
"Q3 results impact: Vodafone Idea shares rise up to 2% as net loss narrows, Mahindra Logistics up 15% on profit turnaround",https://www.moneycontrol.com/news/business/markets/q3-results-impact-vodafone-idea-shares-rise-up-to-2-as-net-loss-narrows-mahindra-logistics-up-15-on-profit-turnaround-13794380.html,"Vodafone Idea shares rose up to 2 percent on Wednesday after the telecom operator reported a narrower consolidated net loss for the December quarter. Shares of Vodafone Idea climbed more than 2 percent to Rs 10.05 apiece on the NSE, snapping a two-day losing streak. Despite the rebound, the stock is down about 7.4 percent so far in January. For the third quarter, the company reported a consolidated net loss of Rs 5,286 crore, compared with a loss of Rs 6,609 crore in the year-ago period. Revenue from operations increased 1.86 percent year-on-year to Rs 11,323 crore. Meanwhile, shares of Mahindra Logistics surged 15.76 percent to an intraday high of Rs 341.95 on the NSE. The stock opened with a gap-up gain of 7.82 percent and extended its rally for the second consecutive session. The company swung to a consolidated net profit in the December quarter, marking its first quarterly profit since the quarter ended December 2022, aided by higher shipping demand. Consolidated net profit stood at Rs 3.25 crore, against a loss of Rs 9.03 crore in the corresponding quarter last year. According to Motilal Oswal, which has a ‘buy’ rating on the stock with a target price of Rs 330, Mahindra Logistics’ revenue rose around 19 percent year-on-year to Rs 1,898 crore, about 9 percent above the brokerage’s estimate. Disclaimer: The views and investment tips expressed by investment experts on Moneycontrol.com are their own and not those of the website or its management. Moneycontrol.com advises users to check with certified experts before taking any investment decisions.",Disclaimer: The views and investment tips expressed by investment experts on Moneycontrol.com are their own and not those of the website or its management.,"For the third quarter, the company reported a consolidated net loss of Rs 5,286 crore, compared with a loss of Rs 6,609 crore in the year-ago period.","Shares of Vodafone Idea climbed more than 2 percent to Rs 10.05 apiece on the NSE, snapping a two-day losing streak.","For the third quarter, the company reported a consolidated net loss of Rs 5,286 crore, compared with a loss of Rs 6,609 crore in the year-ago period."
Accumulate Marico; target of Rs 801: Prabhudas Lilladher,https://www.moneycontrol.com/news/business/stocks/accumulate-marico-target-of-rs-801-prabhudas-lilladher-13794413.html,"Prabhudas Lilladher's research report on Marico MRCO remains confident of sustaining high single digit volume growth driven by 1) healthy near-term demand outlook and GST led gains. 2) sustained market share gains across the core portfolio. 3) increasing focus on urban-centric and premium offerings and 4) strong innovation pipeline with portfolio diversification and scale-up in Foods, D2C and B2C acquisitions (incl. 4700BC) further expanding TAM in premium segment. MRCO is looking at expanding its digital first portfolio sales from Rs9bn to Rs20-25bn in three years with improved profitability. Beardo delivers double-digit EBITDA margins, while Plix maintains strong momentum. Management plans to replicate this playbook across digital-first brands, targeting double-digit margins by FY27. Outlook We factor in ~310bps margin expansion over FY26–FY28 and estimate a CAGR of 15.6% in EPS over FY26-28. We value MRCO at 48x Dec27 EPS and assign a target price of Rs 801 (no change). Retain Accumulate. For all recommendations report, click here Disclaimer: The views and investment tips expressed by investment experts/broking houses/rating agencies on moneycontrol.com are their own, and not that of the website or its management. Moneycontrol.com advises users to check with certified experts before taking any investment decisions. Marico - 2801026 - prabhu",4700BC) further expanding TAM in premium segment.,Outlook We factor in ~310bps margin expansion over FY26–FY28 and estimate a CAGR of 15.6% in EPS over FY26-28.,Prabhudas Lilladher's research report on Marico MRCO remains confident of sustaining high single digit volume growth driven by 1) healthy near-term demand outlook and GST led gains.,"3) increasing focus on urban-centric and premium offerings and 4) strong innovation pipeline with portfolio diversification and scale-up in Foods, D2C and B2C acquisitions (incl."
"Hindustan Unilever shares fall 1.64%, among top losers on Nifty 50 today",https://www.moneycontrol.com/news/business/stocks/hindustan-unilever-shares-fall-1-64-among-top-losers-on-nifty-50-today-alpha-article-13794423.html,"Shares of Hindustan Unilever were trading lower, down 1.64% at Rs 2,361.60, making it among the top losers on the Nifty 50 at 12:10 pm on Wednesday. The decline reflects a shift in hourly trading sentiment for the stock. Financial Snapshot: The financial performance of Hindustan Unilever reveals the following trends based on consolidated figures: Income Statement (Quarterly): Income Statement (Yearly): The annual revenue for March 2025 stood at Rs 63,121 Crore, showing an increase compared to the previous years. Net profit for the same period was Rs 10,679 Crore. The quarterly data shows fluctuations in sales and net profit across the quarters. Cash Flow: Balance Sheet: Financial Ratios: Hindustan Unilever announced dividend details. Interim dividend was announced on October 23, 2025, of Rs 19 per share with effective date November 07, 2025. The final dividend was announced on April 24, 2025, of Rs 24 per share with effective date June 23, 2025. Hindustan Unilever announced a bonus issue on September 30, 1991, with a bonus ratio of 1:2, ex-bonus date was July 19, 1991. The company had split its shares on July 05, 2000, with an ex-split date of July 03, 2000. The old face value of Rs 10 was split into a new face value of Rs 1. Hindustan Unilever is a constituent of the Nifty 50 index. With the stock currently trading at Rs 2,361.60, Hindustan Unilever is experiencing a downturn in Wednesday's session.","Hindustan Unilever announced a bonus issue on September 30, 1991, with a bonus ratio of 1:2, ex-bonus date was July 19, 1991.","Financial Snapshot: The financial performance of Hindustan Unilever reveals the following trends based on consolidated figures: Income Statement (Quarterly): Income Statement (Yearly): The annual revenue for March 2025 stood at Rs 63,121 Crore, showing an increase compared to the previous years.","With the stock currently trading at Rs 2,361.60, Hindustan Unilever is experiencing a downturn in Wednesday's session.","Financial Snapshot: The financial performance of Hindustan Unilever reveals the following trends based on consolidated figures: Income Statement (Quarterly): Income Statement (Yearly): The annual revenue for March 2025 stood at Rs 63,121 Crore, showing an increase compared to the previous years."
Infosys shares fall 1.23%; stock among top losers on Nifty 50 today,https://www.moneycontrol.com/news/business/stocks/infosys-shares-fall-1-23-stock-among-top-losers-on-nifty-50-today-alpha-article-13794414.html,"Infosys shares were trading lower at Rs 1,662, a 1.23% fall, making it among the top losers on the Nifty 50 at 12:10 pm on Wednesday. This decline reflects a negative movement in the stock's price compared to its previous close. Infosys is included as one of the stocks in the benchmark Nifty 50 index. The following table summarizes the consolidated quarterly financial performance of Infosys: The revenue for Infosys increased from Rs 41,764.00 Crore in December 2024 to Rs 45,479.00 Crore in December 2025. During the same period, the net profit decreased from Rs 6,822.00 Crore to Rs 6,666.00 Crore. The following table summarizes the consolidated yearly financial performance of Infosys: The annual revenue has steadily increased from Rs 100,472.00 Crore in 2021 to Rs 162,990.00 Crore in 2025. Similarly, the net profit has risen from Rs 19,423.00 Crore in 2021 to Rs 26,750.00 Crore in 2025. The debt to equity ratio has remained at 0.00 consistently over the past five years. The following table presents key figures from the consolidated income statement: Sales increased from Rs 146,767 Crore in March 2023 to Rs 162,990 Crore in March 2025. The net profit also increased from Rs 24,108 Crore to Rs 26,750 Crore during the same period. The table below shows the quarterly income statement figures: Sales increased from Rs 41,764 Crore in December 2024 to Rs 45,479 Crore in December 2025. However, net profit decreased from Rs 6,822 Crore to Rs 6,666 Crore during the same period. The table below shows the cash flow statement: Net cash flow has increased from Rs 6,065 Crore in March 2021 to Rs 9,669 Crore in March 2025. The table below represents the balance sheet: Total assets have increased from Rs 108,386 Crore in March 2021 to Rs 148,903 Crore in March 2025. Key financial ratios for Infosys are provided in the table below: Infosys announced a strategic collaboration with Cursor to accelerate software engineering for global enterprises on January 27, 2026. Additionally, Infosys expanded its footprint in Switzerland with a new Zurich office to accelerate enterprise AI journeys on January 23, 2026. Infosys was also recognized as the fastest-growing IT services brand globally, with a CAGR of 15% in brand value, on January 20, 2026. Infosys' board has declared multiple dividends. Most recently, an interim dividend of Rs 23 per share (460%) was announced on October 16, 2025, with an effective date of October 27, 2025. Prior to that, a final dividend of Rs 22 per share (440%) was announced on April 17, 2025, effective from May 30, 2025. The company has issued bonus shares on several occasions, with the most recent being on July 13, 2018, in a 1:1 ratio. Other bonus issues were announced on April 24, 2015 (1:1), October 10, 2014 (1:1), April 14, 2006 (1:1), and April 13, 2004 (3:1). Infosys underwent a stock split on November 30, 1999, where the face value changed from Rs 10 to Rs 5, effective January 24, 2000. Moneycontrol analysis indicates very bullish sentiment on Infosys as of January 28, 2026. With the stock's last traded price at Rs 1,662, Infosys is currently among the top losers on the Nifty 50.","With the stock's last traded price at Rs 1,662, Infosys is currently among the top losers on the Nifty 50.","The following table summarizes the consolidated quarterly financial performance of Infosys: The revenue for Infosys increased from Rs 41,764.00 Crore in December 2024 to Rs 45,479.00 Crore in December 2025.","Additionally, Infosys expanded its footprint in Switzerland with a new Zurich office to accelerate enterprise AI journeys on January 23, 2026.","The following table summarizes the consolidated quarterly financial performance of Infosys: The revenue for Infosys increased from Rs 41,764.00 Crore in December 2024 to Rs 45,479.00 Crore in December 2025."
Maruti Suzuki India shares fall 1.93%; among top losers on Nifty 50 today,https://www.moneycontrol.com/news/business/stocks/maruti-suzuki-india-shares-fall-1-93-among-top-losers-on-nifty-50-today-alpha-article-13794417.html,"Maruti Suzuki India shares declined 1.93% to trade at Rs 14,951 at 12:10 pm on Wednesday. The stock was among the top losers on the Nifty 50. Financial Performance: The following table presents Maruti Suzuki India's consolidated quarterly financial performance: The company's revenue for the quarter-ending September 2025 stood at Rs 42,344.20 crore, up from Rs 37,449.20 crore in September 2024. The net profit for the quarter-ending September 2025 was Rs 3,281.70 crore, compared to Rs 3,055.20 crore in September 2024. The Earnings Per Share (EPS) stood at 106.52 in September 2025, compared to 98.68 in September 2024. The following table presents Maruti Suzuki India's consolidated yearly financial performance: The company's revenue for the year-ending March 2025 stood at Rs 152,913.00 crore, up from Rs 70,372.00 crore in March 2021. The net profit for the year-ending March 2025 was Rs 14,256.30 crore, compared to Rs 4,220.10 crore in March 2021. The Earnings Per Share (EPS) stood at 461.20 in March 2025, compared to 145.30 in March 2021. Income Statement Yearly: The following table shows the income statement for Maruti Suzuki India on a consolidated yearly basis (in Crore): The sales increased from Rs 70,372 Crore in March 2021 to Rs 152,913 Crore in March 2025. The net profit also increased from Rs 4,220 Crore in March 2021 to Rs 14,256 Crore in March 2025. Income Statement Quarterly: The following table shows the income statement for Maruti Suzuki India on a consolidated quarterly basis (in Crore): The sales increased from Rs 37,449 Crore in September 2024 to Rs 42,344 Crore in September 2025. The net profit also increased from Rs 3,055 Crore in September 2024 to Rs 3,281 Crore in September 2025. Cash Flow: The following table shows the cash flow from operating, investing, and financing activities for Maruti Suzuki India: Balance Sheet: The following table shows the balance sheet for Maruti Suzuki India: Key Financial Ratios: Key financial ratios for Maruti Suzuki India are as follows: Corporate Actions: Maruti Suzuki India announced a final dividend of Rs 135 per share on April 25, 2025, with the ex-date as January 28, 2026. Moneycontrol analysis indicates bearish sentiment on the stock as of January 28, 2026. With the stock's last traded price at Rs 14,951, Maruti Suzuki India saw a decline in Wednesday's trading session, marking it among the top losers on Nifty 50 this hour.","The net profit for the quarter-ending September 2025 was Rs 3,281.70 crore, compared to Rs 3,055.20 crore in September 2024.","Income Statement Yearly: The following table shows the income statement for Maruti Suzuki India on a consolidated yearly basis (in Crore): The sales increased from Rs 70,372 Crore in March 2021 to Rs 152,913 Crore in March 2025.","With the stock's last traded price at Rs 14,951, Maruti Suzuki India saw a decline in Wednesday's trading session, marking it among the top losers on Nifty 50 this hour.","Cash Flow: The following table shows the cash flow from operating, investing, and financing activities for Maruti Suzuki India: Balance Sheet: The following table shows the balance sheet for Maruti Suzuki India: Key Financial Ratios: Key financial ratios for Maruti Suzuki India are as follows: Corporate Actions: Maruti Suzuki India announced a final dividend of Rs 135 per share on April 25, 2025, with the ex-date as January 28, 2026."
KPR Mill shares surge 2.45% amid high volume,https://www.moneycontrol.com/news/business/stocks/kpr-mill-shares-surge-2-45-amid-high-volume-alpha-article-13794415.html,"KPR Mill shares experienced a surge, climbing 2.45% to reach Rs 922.50 on Wednesday. Trading activity was notably high, accompanied by a surge in volume. Financial Overview: Consolidated Quarterly Performance: The following table summarizes the consolidated quarterly financial performance of KPR Mill: The revenue for KPR Mill has shown an increase over the quarters, with a slight dip in September 2025. Net profit has remained relatively stable, showing a slight increase in the quarter ending September 2025. Earnings per share (EPS) have also seen a marginal increase over the same period. Consolidated Yearly Performance: The following table summarizes the consolidated yearly financial performance of KPR Mill: The annual financial data indicates a consistent increase in revenue from 2021 to 2025, with a slight decrease in 2024. Net profit also showed an increase, but with some fluctuation over the years. The company has also reduced its debt to equity ratio significantly, showcasing its growth. KPR Mill is a constituent of the Nifty Midcap 150 index. Corporate Actions KPR Mill announced a final dividend of Rs 2.50 per share (250%) with the effective date being July 23, 2025. The company also announced an interim dividend of Rs 2.50 per share (250%) with the effective date being February 7, 2025. Additionally, the company had a stock split on September 24, 2021, where the old face value of Rs 5 was split into a new face value of Rs 1. The current price of the stock is Rs 922.50, which moved by 2.45%.","The company also announced an interim dividend of Rs 2.50 per share (250%) with the effective date being February 7, 2025.","Financial Overview: Consolidated Quarterly Performance: The following table summarizes the consolidated quarterly financial performance of KPR Mill: The revenue for KPR Mill has shown an increase over the quarters, with a slight dip in September 2025.","Corporate Actions KPR Mill announced a final dividend of Rs 2.50 per share (250%) with the effective date being July 23, 2025.","Financial Overview: Consolidated Quarterly Performance: The following table summarizes the consolidated quarterly financial performance of KPR Mill: The revenue for KPR Mill has shown an increase over the quarters, with a slight dip in September 2025."
Emami shares fall 2.06%; among top losers on Nifty Midcap 150 today,https://www.moneycontrol.com/news/business/stocks/emami-shares-fall-2-06-among-top-losers-on-nifty-midcap-150-today-alpha-article-13794409.html,"Shares of Emami declined 2.06% to Rs 485.75 in Wednesday's trading session. The stock is listed on the Nifty Midcap 150 index. At 12:11 pm, the stock was trading lower compared to its previous close. Financial Snapshot: Emami's financial performance shows consistent growth in revenue and net profit over the past five years. The company's consolidated revenue for the year ending March 2025 stood at Rs 3,809.19 Crore, a notable increase from Rs 2,880.53 Crore in 2021. Net profit also saw a significant rise, reaching Rs 814.55 Crore in 2025 compared to Rs 458.89 Crore in 2021. Consolidated Annual Financials: The revenue for the year 2025 increased by 6.46% compared to 2024, and the net profit increased by 11.91% during the same period. The company’s Debt to Equity ratio has remained low at 0.02 in March 2025. Consolidated Quarterly Financials: The company's revenue for the quarter ending September 2025 was Rs 798.51 Crore, a decrease compared to Rs 890.59 Crore in September 2024. The net profit for the same period stood at Rs 150.17 Crore, down from Rs 215.61 Crore in the previous year. Corporate Actions: The board is scheduled to convene on February 4, 2026, to consider and approve the declaration of the second interim dividend for FY 2025-26. In November 2025, Emami announced an interim dividend of Rs 4.00 per share (400%), with an effective date of November 14, 2025. Emami also has a history of bonus issues, including a 1:1 bonus in May 2018 and a 1:2 bonus in May 2013. Moneycontrol analysis has indicated a very bearish sentiment on the stock.","The company's consolidated revenue for the year ending March 2025 stood at Rs 3,809.19 Crore, a notable increase from Rs 2,880.53 Crore in 2021.","Consolidated Annual Financials: The revenue for the year 2025 increased by 6.46% compared to 2024, and the net profit increased by 11.91% during the same period.",The company’s Debt to Equity ratio has remained low at 0.02 in March 2025.,"The net profit for the same period stood at Rs 150.17 Crore, down from Rs 215.61 Crore in the previous year."
Accumulate ABB India; target of Rs 5540: Prabhudas Lilladher,https://www.moneycontrol.com/news/business/stocks/accumulate-abb-india-target-of-rs-5540-prabhudas-lilladher-2-13794377.html,"Prabhudas Lilladher's research report on ABB India ABB IN has announced its intention to divest its Robotics business, in line with the global parent’s divestment of ABB Robotics Schweiz AG (“ARSAG”) to SoftBank Group. As part of the divestment, ABB IN incorporated ABB Robotics India Private Limited (“INRBT”) as a wholly owned subsidiary and proposes to transfer its Robotics business to INRBT on a slump-sale basis for a consideration of Rs15.7bn. ABB IN then will sell its entire stake in INRBT to ARSAG. The transaction is expected to be completed by 27 February 2026. In our view, the deal is value-accretive for ABB IN, implied at ~2.2x EV/TTM sales and ~24.4x EV/TTM EBIT (inc. other income). The divestment is likely to sharpen the company’s focus on its core portfolio and support at least 10-15bps improvement in EBIT margins in CY26E and CY27E. Additionally, the exit should marginally enhance return ratios, driven by the elimination of negative net capital employed in the Robotics business. Outlook The stock is currently trading at a PE of 53.3x/45.9x on CY26/27E. We have a ‘Accumulate’ rating on the stock valuing it at a multiple of 56x Sep’27E (same as earlier) arriving at a TP of Rs5,540 (same as earlier). For all recommendations report, click here Disclaimer: The views and investment tips expressed by investment experts/broking houses/rating agencies on moneycontrol.com are their own, and not that of the website or its management. Moneycontrol.com advises users to check with certified experts before taking any investment decisions. ABB India - 2801026 - prabhu","As part of the divestment, ABB IN incorporated ABB Robotics India Private Limited (“INRBT”) as a wholly owned subsidiary and proposes to transfer its Robotics business to INRBT on a slump-sale basis for a consideration of Rs15.7bn.","As part of the divestment, ABB IN incorporated ABB Robotics India Private Limited (“INRBT”) as a wholly owned subsidiary and proposes to transfer its Robotics business to INRBT on a slump-sale basis for a consideration of Rs15.7bn.","For all recommendations report, click here Disclaimer: The views and investment tips expressed by investment experts/broking houses/rating agencies on moneycontrol.com are their own, and not that of the website or its management.","As part of the divestment, ABB IN incorporated ABB Robotics India Private Limited (“INRBT”) as a wholly owned subsidiary and proposes to transfer its Robotics business to INRBT on a slump-sale basis for a consideration of Rs15.7bn."
