title,link,content
"As electric bills rise, evidence mounts that data centers share blame. States feel pressure to act",https://www.marketbeat.com/articles/as-electric-bills-rise-evidence-mounts-that-data-centers-share-blame-states-feel-pressure-to-act-2025-08-08/,"HARRISBURG, Pa. (AP) — Amid rising electric bills, states are under pressure to insulate regular household and business ratepayers from the costs of feeding Big Tech's energy-hungry data centers. It's not clear that any state has a solution and the actual effect of data centers on electricity bills is difficult to pin down. Some critics question whether states have the spine to take a hard line against tech behemoths like Microsoft, Google, Amazon and Meta. But more than a dozen states have begun taking steps as data centers drive a rapid build-out of power plants and transmission lines. That has meant pressuring the nation's biggest power grid operator to clamp down on price increases, studying the effect of data centers on electricity bills or pushing data center owners to pay a larger share of local transmission costs. Rising power bills are “something legislators have been hearing a lot about. It’s something we’ve been hearing a lot about. More people are speaking out at the public utility commission in the past year than I’ve ever seen before,” said Charlotte Shuff of the Oregon Citizens’ Utility Board, a consumer advocacy group. “There’s a massive outcry.” Some data centers could require more electricity than cities the size of Pittsburgh, Cleveland or New Orleans, and make huge factories look tiny by comparison. That's pushing policymakers to rethink a system that, historically, has spread transmission costs among classes of consumers that are proportional to electricity use. “A lot of this infrastructure, billions of dollars of it, is being built just for a few customers and a few facilities and these happen to be the wealthiest companies in the world,” said Ari Peskoe, who directs the Electricity Law Initiative at Harvard University. “I think some of the fundamental assumptions behind all this just kind of breaks down.” A fix, Peskoe said, is a “can of worms"" that pits ratepayer classes against one another. Some officials downplay the role of data centers in pushing up electric bills. Tricia Pridemore, who sits on Georgia’s Public Service Commission and is president of the National Association of Regulatory Utility Commissioners, pointed to an already tightened electricity supply and increasing costs for power lines, utility poles, transformers and generators as utilities replace aging equipment or harden it against extreme weather. The data centers needed to accommodate the artificial intelligence boom are still in the regulatory planning stages, Pridemore said, and the Data Center Coalition, which represents Big Tech firms and data center developers, has said its members are committed to paying their fair share. But growing evidence suggests that the electricity bills of some Americans are rising to subsidize the massive energy needs of Big Tech as the U.S. competes in a race against China for artificial intelligence superiority. Data and analytics firm Wood Mackenzie published a report in recent weeks that suggested 20 proposed or effective specialized rates for data centers in 16 states it studied aren’t nearly enough to cover the cost of a new natural gas power plant. In other words, unless utilities negotiate higher specialized rates, other ratepayer classes — residential, commercial and industrial — are likely paying for data center power needs. Meanwhile, Monitoring Analytics, the independent market watchdog for the mid-Atlantic grid, produced research in June showing that 70% — or $9.3 billion — of last year's increased electricity cost was the result of data center demand. Last year, five governors led by Pennsylvania's Josh Shapiro began pushing back against power prices set by the mid-Atlantic grid operator, PJM Interconnection, after that amount spiked nearly sevenfold. They warned of customers “paying billions more than is necessary.” PJM has yet to propose ways to guarantee that data centers pay their freight, but Monitoring Analytics is floating the idea that data centers should be required to procure their own power. In a filing last month, it said that would avoid a ""massive wealth transfer” from average people to tech companies. At least a dozen states are eyeing ways to make data centers pay higher local transmission costs. In Oregon, a data center hot spot, lawmakers passed legislation in June ordering state utility regulators to develop new — presumably higher — power rates for data centers. The Oregon Citizens’ Utility Board says there is clear evidence that costs to serve data centers are being spread across all customers — at a time when some electric bills there are up 50% over the past four years and utilities are disconnecting more people than ever. New Jersey’s governor signed legislation last month commissioning state utility regulators to study whether ratepayers are being hit with “unreasonable rate increases” to connect data centers and to develop a specialized rate to charge data centers. In some other states, like Texas and Utah, governors and lawmakers are trying to avoid a supply-and-demand crisis that leaves ratepayers on the hook — or in the dark. In Indiana, state utility regulators approved a settlement between Indiana Michigan Power Co., Amazon, Google, Microsoft and consumer advocates that set parameters for data center payments for service. Kerwin Olsen, of the Citizens Action Council of Indiana, a consumer advocacy group, signed the settlement and called it a “pretty good deal” that contained more consumer protections than what state lawmakers passed. But, he said, state law doesn't force large power users like data centers to publicly reveal their electric usage, so pinning down whether they're paying their fair share of transmission costs ""will be a challenge.” In a March report, the Environmental and Energy Law Program at Harvard University questioned the motivation of utilities and regulators to shield ratepayers from footing the cost of electricity for data centers. Both utilities and states have incentives to attract big customers like data centers, it said. To do it, utilities — which must get their rates approved by regulators — can offer “special deals to favored customers” like a data center and effectively shift the costs of those discounts to regular ratepayers, the authors wrote. Many state laws can shield disclosure of those rates, they said. In Pennsylvania, an emerging data center hot spot, the state utility commission is drafting a model rate structure for utilities to consider adopting. An overarching goal is to get data center developers to put their money where their mouth is. “We’re talking about real transmission upgrades, potentially hundreds of millions of dollars,” commission chairman Stephen DeFrank said. “And that’s what you don’t want the ratepayer to get stuck paying for."" ___ Follow Marc Levy on X at https://x.com/timelywriter. Before you consider Microsoft, you'll want to hear this."
Retiring and relocating? Take a holistic approach,https://www.marketbeat.com/articles/retiring-and-relocating-take-a-holistic-approach-2025-08-08/,"NEW YORK (AP) — Debra Taylor has had a busy year or so: She's going through a divorce while in the process of retiring — and she's moving to Portugal from Southern California with one of her daughters. After deciding her next home would be outside the U.S., she narrowed down her choices based on tax burdens (Spain was out with its wealth taxes), climate (no Costa Rica, too hot) and ease of travel within Europe, one of her favorite parts of the world. She then toured Portugal with a relocation company, Expatsi, and found her new home, Aveiro. It's a striking city on the country's west coast with lovely canals that earned it the nickname the Venice of Portugal. It's all logistics from there. Taylor signed a year lease on an apartment (a requirement for moving forward), hired the company Viv Europe to navigate bureaucracies and paperwork, signed up for the necessary FBI background check and has an appointment in late September to move ahead with visas. Her youngest child gave her the idea to leave the country. “After our current president was elected, my 18-year-old transgender daughter came to me and said, ‘I want to get out of this country ASAP,’” Taylor recalled. “That was just fine with me.” Her oldest daughter, who's 20, will stay in the U.S. to complete college. “None of this means I have to live there forever,” Taylor said. “I’ll use this as my jumping-off point to do more deeper dives, explore the rest of the region. I want to buy a place, but I’m not going to do that until I’m living there and spend more time in different communities.” According to aging and relocation experts, Taylor has made the right decisions. The number of people who relocate upon retirement fluctuates, based on such factors as politics, home affordability and cost-of-living rates. While older adults are less likely to move than younger populations, more than 3 million people age 65 and older relocated within the U.S. in the five years before the coronavirus pandemic, according to the U.S. Census Bureau. As for moving abroad, U.S. politics is now the No. 1 reason cited by people who use Expatsi, the company's co-founder Jen Barnett said. “The one downside is that a lot of countries retirees are interested in don’t want retirees, and that is to say wealthy, English-speaking countries, because they want laborers,” Barnett said. While most U.S. retirees stay put in existing homes and locales, those who want to age in place face mounting challenges, said AARP Vice President Rodney Harrell, who focuses on housing and livable communities. Challenges include rising rents or mortgages, costs for home modifications, and a lack of community support services like adequate health care, reliable utilities and safe environments. “One of the biggest challenges that we have is making sure that we take the future us into account, and not just look at our needs today,"" Harrell said. “Are we driving today? Is our income where it is? Is our spouse and myself healthy right now? How able are we to walk around and use steps, etc.? Things can change.” All of the above is crucial as the U.S. heads into a gray bubble. “We’re going to have more people over 65 than under 18 by 2034. For the first time in U.S. history, we have more older adults than children,” Harrell said. Do you want mountains, an ocean, to be closer to grandkids? Would you like a university town or city, a particular religious institution? Harrell suggests setting clear priorities when planning a relocation. And they should go well beyond those specifications. Taking housing costs into consideration is generally universal, he said, but he urged a more subtle consideration. “What are the neighbors like? Is it an active community, if that’s what you want. Do people keep to themselves more? That social connection is really important, too,” Harrell said. The AARP's livability index scores neighborhoods and communities across the U.S. for the services and amenities that impact older people. It's easily searchable by address, city, state or ZIP code. “Think about all of the things that you might want collectively, and know that there’s no perfect place,” Harrell said. “Once you have those things in mind, you’ll get to the best possible outcome. Every place has trade-offs."" If being close to children and grandchildren is high on the list, set clear expectations about how involved you want to be in such things as child care, said retirement transition planner Elizabeth Zelinka Parsons. Also, chat with adult children before making a move to determine how settled they are themselves. Casey Bowers and her husband, Dave Bowers, recently relocated to Ericeira, northwest of Lisbon on Portugal's beachy Silver Coast. They love it, but it's not all ocean and sun. “We have three adult children and their partners, and one grandbaby with another on the way,” Casey said. “We're very close to our children. Learning the grocery store, getting new cellphones, those are just procedural things, but being away from family — that’s the hardest part.” Sarah Friedell O’Connell, a retirement coach in Boston, looks at relocation this way: “You’re going to get a lot of hours back when you stop your full-time job. What are you going to do with that time?"" As a wealth manager, Chad Harmer has helped dozens of retirees relocate, from Ontario, Canada, to Arizona’s High Desert, from the Boston suburbs to the Carolinas. And he's dealt with some “boomerang” moves back home after grandchildren arrived. “Start with a 'lifestyle audit,' not a tax table,"" he said. “I ask clients to write a perfect Thursday five years from now. Where are they walking? Who are they meeting for coffee? How long is the drive to the grandkids? That exercise surfaces climate preferences, social networks, volunteer hobbies and healthcare priorities long before we argue over property tax millage rates.” He also recommended budgeting for hidden inflators — such as higher insurance premiums in disaster-prone areas and frequent flights to see family — and considering less obvious weather complications, like pollen levels. Parsons, who wrote “Encore: A High Achiever's Guide to Thriving in Retirement,” is a staunch supporter of taking a short-term rental before deciding on a permanent move. “It's tempting to retire where you vacation, but that may not be the greatest idea,” she said. Harmer's rule of thumb: When 80 % of your desired daily routine is achievable in a new location for at least 80 % of the year, you’re in the right ZIP code. “Anything less and you’re probably chasing an Instagram fantasy rather than a retirement reality,” he said."
Why Trump's tariffs could be a disaster for Brazil's acai industry and American consumers,https://www.marketbeat.com/articles/why-trumps-tariffs-could-be-a-disaster-for-brazils-acai-industry-and-american-consumers-2025-08-08/,"BELEM, Brazil (AP) — When U.S. President Donald Trump imposed tariffs of 50% on Brazilian exports in July, acai producer Ailson Ferreira Moreira felt immediately concerned. After all, who was going to eat all of that Amazon berry, globally famous as a delicious, refreshing and nutritious superfood, if American consumers suddenly could no longer afford it? As the main importer of the Brazilian berry, prices of acai smoothies and bowls look certain to go up in the United States. “The acai that’s all produced here ... If only people here eat it, it’s going to be a lot of acai, right?” Moreira told The Associated Press outside of Belem, an Amazon city of 1.4 million residents that will host this year's U.N. climate summit COP30 climate summi t in November. “If there’s too much acai here, people won’t be able to eat it all and the price will drop.” A single full crate of acai sells for around $50 at local markets in Brazil, a price that is now expected to plummet. The U.S. is by far the largest acai importer of a total Brazilian output currently estimated at about 70,000 tons per year. The most vulnerable acai producers in the northern state of Para say they have already been hit by tariffs imposed by the U.S. government, as a surplus of the berry without a clear destination starts to mount only days after the new economic scenario unfolded. More powerful exporters, such as Sao Paulo-state based company Acai Tropicalia Mix, are also feeling the impact. One of its owners, Rogério de Carvalho, told the AP that last year he exported to the U.S. about 270 tons of acai cream — an industrialized version of the berry — ready for consumption. As tariffs started to loom, he said, American importers steered away and clients suspended negotiations. Until the end of July, de Carvalho estimates that his company sold 27 tons to the U.S. “That's 1.5 million Brazilian reais ($280,000) that we lost,” the businessman said. “We are confident there will be a deal between the two countries to allow not only our clients to return, but also getting some new ones.” Trump has linked the higher tariffs on Brazil to the trial of former President Jair Bolsonaro, who is now under house arrest for his alleged role in leading an alleged coup plot to remain in office, despite his election loss to current leftist President Luiz Inácio Lula da Silva. And despite several Brazilian exports being exempted from the tariffs, acai berries aren't among them. Brazil's industry ministry didn't reply to a request for comment on whether acai berries are among the items that remain on the negotiating table with U.S. trade representatives. Nearly all of the acai consumed in the U.S. originates from Brazil, with the state of Para alone accounting for 90% of the country’s total production. Several communities in the Amazon depend on its harvest. The harvesting of acai is a physically demanding job that requires workers to climb tall trees with minimal safety equipment, and then sliding down branches full of berries to fill baskets and then place them carefully in crates. Analysts say its producers also help protect the rainforest from illegal loggers, miners and cattle ranchers. The night markets of Belem, such as the Ver-o-Peso acai market, are a hub of activity where the freshly harvested berries are brought in by boat and prepared for sale. The Brazilian Association of Fruit and Derivative Producers and Exporters estimates there was an explosive growth of acai exports from Para state, from less than one ton in 1999 to more than 61,000 tons in 2023. Another explosive rise was expected for this year, before the tariffs. On Thursday, Brazil requested consultations at the World Trade Organization over tariffs imposed by the Trump administration against the South American nation that went into effect on Wednesday. That could be took little too late for acai harvester Mikael Silva Trindade, who agrees that the future of the trade is at risk as higher U.S. tariffs can disrupt the delicate balance of supply and demand that holds the industry. “There will be nowhere to market (the excess of acai),” Trindade told the AP as he picked berries in Para state. “The more you export, the more valuable it becomes. But if there’s too much to sell, it will stay here and become cheap.” ___ Mauricio Savarese reported from Sao Paulo. ___ Follow AP’s coverage of Latin America and the Caribbean at https://apnews.com/hub/latin-america Before you consider Amazon.com, you'll want to hear this."
BC-Nikkei 225 Futures,https://www.marketbeat.com/articles/bc-nikkei-225-futures-2025-08-04/,"NEW YORK (AP) — Prices as of 5:30:00 PM Friday, August 08. Nikkei 225 (Yen) (CME) 500 yen x Nikkei 225 YEN futures price. Estimated volume: 43,669 Thursday's volume: 36,908 Open Interest: 93,150 Open Interest Change: -61638"
"Airbnb Beats Earnings, But the Growth Story Is Losing Altitude",https://www.marketbeat.com/originals/airbnb-beats-earnings-but-the-growth-story-is-losing-altitude/,"Airbnb Inc. NASDAQ: ABNB stock is down 9.1% the day after the company’s second-quarter earnings report. The company beat on the top and bottom lines with earnings per share (EPS) of $1.03 and revenue of $3.10 billion. Those numbers were year-over-year (YOY) gains of 19% and 12% respectively. But headline numbers show where a company has been, not where it’s going. In the case of Airbnb, the company delivered tepid guidance for the coming quarter. Management’s Q3 revenue guidance of $4.02 to $4.1 billion represents about 8% year-over-year growth, a deceleration from the 12% the company just reported in Q2. It also seems to confirm that the economy may not be as strong as expected and suggests that investors may not want to buy this dip. The July Jobs report released on Aug. 1 challenged the assumption that the U.S. consumer was holding up well. But the performance of consumer discretionary stocks in 2025 has made some investors skeptical of that outlook. A research report from Bank of America (BofA) hints that this may be a time for investors to trust their intuition. In its July Consumer Checkpoint, BofA presented data showing consumer spending on services (including hotels, airfares, and dining) has declined for three straight months. One part of the report noted, “Discretionary services spending, particularly in travel, appears to be contributing negatively to services growth.” Airbnb's chief executive officer (CEO), Brian Chesky, was quick to tell analysts that the company was not satisfied with slow growth, saying, “We want the company to accelerate.” However, it’s fair to say that the call didn’t point to specific initiatives that would make this happen. For example, in discussing the company’s artificial intelligence (AI) investments, Chesky remarked that Airbnb continues “to explore how we can use AI to improve the guest and host experience, but we’re still early in identifying the most impactful use cases.” In discussing the potential opportunity in business travel, the CEO told analysts the company was “looking at ways to make Airbnb more compelling.” There were other examples, but a common theme on the earnings call was one that was non-committal without a product roadmap or a specific strategy outlined. It’s also a reminder that the reason to stay at an Airbnb property is not the same as the decision to buy ABNB stock. Many consumers swear by the home rental model and will never return to a hotel. The model works for many individuals, groups, and families, particularly those for whom the “where” is a key part of their vacation plans. But does that mean ABNB stock is a good investment? Right now, slowing growth shows a mature company finding it tough to innovate. For example, the company announced a new share repurchase program of up to $6 billion, which is generally positive for shareholders. However, at 30x forward earnings, ABNB is valued as a growth stock forecasting high single-digit growth, which makes it appear the company’s best days are behind it. The post-earnings sell-off has given investors the potential for more upside in ABNB stock. The consensus price target of $143.07 provides about 20% upside. However, several analysts have lowered their price targets since earnings. Investors looking to buy the dip may look at a $115 price target, but stronger support is more likely to be around $110 or even $100. But before taking action, investors will want to wait for other signals to confirm. For example, the sharp drop in the stock price pushed the MACD line below the signal line, and the chart shows that momentum is becoming increasingly bearish. The daily volume is more than double the average daily volume, showing that investors are selling first and asking questions later. This means that patience will be required before timing an entry. The 50-day SMA is flattening and starting to curl lower, putting the stock close to a bearish death cross formation that occurs when the 50-day SMA crosses below its 200-day SMA. Before you consider Airbnb, you'll want to hear this."
