title,link,content
MNDY Stock Has a Case of the Mondays—Buy Before the Rebound,https://www.marketbeat.com/originals/mndy-stock-has-a-case-of-the-mondaysbuy-before-the-rebound/,"Monday.com’s NASDAQ: MNDY August price plunge is not easy for its stockholders to watch, but there is good news. The drop is a knee-jerk reaction to tepid news compounded by relatively high short interest that discounts the company’s long-term outlook. It will likely not last long. Trading at roughly 7x the long-term earnings forecast ahead of the release, the nearly 20% price plunge deepened the value in this well-positioned cash-generating machine. Monday.com is a leader in workflow management and AI-empowered automation. Its technology and services enable organizations to automate workflows, manage projects more efficiently, and streamline operations, and are gaining traction with businesses and industries worldwide. Monday.com reported a solid quarter with only two things marring the results. The first point is that growth is slowing sequentially, and compared to last year, the second is that the Q3 guidance was only as expected. The takeaway for investors is that growth was expected to slow, results were better-than-forecast, and Q3 guidance had been sufficient to sustain the higher share price ahead of the release; there is no reason why it shouldn’t be afterward. The more critical detail is that the Q2 strengths are expected to linger, and the full-year guide was improved. As of early to mid-August, the company's forecast indicates revenue growth of roughly 26%, which is 200 basis points hotter than MarketBeat’s reported consensus. Due to the business trends, this may be considered cautious guidance. The Q2 results are solid. The company outperformed MarketBeat’s reported consensus by more than 100 basis points, growing revenue by nearly 27% compared to last year. The gains were driven by an 8% increase in clients and an 11% increase in existing business, driven by the company’s largest client groups. They grew by 36% and 46% respectively. The margin news is also healthy. The company increased its R&D and faced expense hurdles, but managed to outperform the market’s expectations. The net result is a 100-basis-point contraction in the adjusted operating margin and $1.09 in adjusted EPS, up only 16% year-over-year (YOY) compared to the 26.6% top-line advance, but more than 2500 basis points better than expected and sufficient to produce a significant gain in shareholder value. Monday.com’s balance sheet health and growth are tied to dilutive share sales, but the company deploys capital efficiently and produces value for investors. The 2% YOY increase in share count and increased liability are offset by increased cash, current and total assets, which lifted equity by 18% year-to-date. Equity is expected to continue rising as the year progresses and drive robust support from the sell-side. Institutions, which own about 75% of the stock, provide a solid support base in 2025, and they are buying on balance as of mid-Q3 2025. The analysts, the vocal portion of the group, also provide solid support with their coverage increasing, sentiment firming, and price targets rising ahead of the release, indicating a deep value. Already trading below the low-end of the analysts' range ahead of the release, the post-release price plunge puts the stock well below, suggesting a minimum of 50% upside with the potential for a 75% gain at the consensus. Monday.com’s price decline may extend to even deeper levels, but there are signs that support is strong near $200. Numerous price upswings, including two in 2024 and two in early 2025, not only show support at the $200 level but also rising support aligning with an uptrend. The likely outcome is that, based on the results, valuation, and trends of institutions and analysts, this level will continue to serve as support. The market may consolidate near $200 before rebounding, but a rebound and fresh long-term highs are likely within a few quarters.  Before you consider monday.com, you'll want to hear this. MarketBeat keeps track of Wall Street's top-rated and best performing research analysts and the stocks they recommend to their clients on a daily basis. MarketBeat has identified the five stocks that top analysts are quietly whispering to their clients to buy now before the broader market catches on... and monday.com wasn't on the list. While monday.com currently has a Moderate Buy rating among analysts, top-rated analysts believe these five stocks are better buys. View The Five Stocks Here Discover the next wave of investment opportunities with our report, 7 Stocks That Will Be Magnificent in 2025. Explore companies poised to replicate the growth, innovation, and value creation of the tech giants dominating today's markets."
Increasing the danger: Journalist killing in Gaza sends a chilling message,https://www.marketbeat.com/articles/increasing-the-danger-journalist-killing-in-gaza-sends-a-chilling-message-2025-08-11/,"Israel's targeted killing of an Al Jazeera correspondent in Gaza over the weekend was noteworthy even for a conflict remarkably blood-soaked for journalists, leaving some experts to marvel that any news at all emerges from the territory. An Al Jazeera executive said Monday that it won't back down from covering what is going on there and called for news organizations to step up and recruit more journalists. A total of 184 Palestinian journalists and media workers have been killed by Israel in the Gaza war since its start in October 2023, according to the Committee to Protect Journalists. That compares to the 18 journalists and media workers killed so far in the Russia-Ukraine war, CPJ said. Aside from rare guided tours, Israel has barred international media from covering the 22-month war in Gaza. News organizations instead rely largely on Palestinian Gaza residents and ingenuity to show the world what is happening there. Israel often questions the affiliations and biases of Palestinian journalists but doesn't permit others in. “You simply are in awe when stories show up,” said Jane Ferguson, a veteran war correspondent and founder of Noosphere, an independent platform for journalists. She can't recall a conflict that has been more difficult for reporters to cover, and she's reported from South Sudan, Syria and Afghanistan. Correspondent Anas al-Sharif knew he was a target, and left behind a message to be delivered upon his death. He and seven other people — six of them journalists — were killed in an air strike outside of Gaza City’s largest hospital complex on Sunday. Israel swiftly claimed responsibility, saying without producing evidence that al-Sharif had led a Hamas cell. It was a claim the news organization and al-Sharif had denied. Agence France-Presse, The Associated Press, BBC News and Reuters are among the organizations regularly reporting from Gaza. An Aug. 7 AP dispatch vividly described the hunger faced by many in Gaza: “A single bowl of eggplant stewed in watery tomato juice must sustain Sally Muzhed's family of six for the day. She calls it moussaka, but it's a pale echo of the fragrant, lawyered, meat-and-vegetable dish that once filled Gaza's kitchens with its aroma.” Other recent AP reports carried images and text reporting from the aftermath of an Israeli strike on Gaza's only Catholic church, and a profile of an 18-year-old aspiring doctor now trying to survive sheltered in a tent. Journalists from The Washington Post and the Guardian recently accompanied a Jordanian relief mission and took images of Gaza from the air, despite some restrictions from Israel. The Guardian's Lorenzo Tondo wrote: “Seen from the air, Gaza looks like the ruins of an ancient civilization, brought to light after centuries of darkness.” None of the organizations match the power and immediacy of Al Jazeera, however, in part because their correspondents have been in front of cameras. They've also paid the heaviest price: CPJ estimates that 11 journalists and media workers affiliated with AJ have been killed in the Gaza conflict, more than any other single organization. In a social media post written in June to be sent if he was killed, al-Sharif wrote that “I have lived through pain in all its details, tasted suffering and loss many times, yet I never once hesitated to convey the truth as it is, without distortion or falsification — so that Allah may bear witness against those who stayed silent.” In another posting on X on Aug. 10, the day that he was killed, al-Sharif wrote of the challenges covering the aftermath of one attack. He said he lost his strength and ability to express himself when he arrived at the scene. “Body parts and blood were all around us, and corpses were scattered on top of each other,” he wrote. “Tell me what words and phrases could help any journalist describe this horrific image. When I told you on air that it was an ‘indescribable scene,' I was truly helpless in the face of this horrific sight.” Salah Negm, news director at Al Jazeera English, said Monday it is very difficult to get people in to Gaza. But it is full of educated people and those with training in journalism who can help get stories out. He called on other news organizations to step up. “We get the news from several sources on the ground in Gaza — not only journalists but also doctors, hospitals, civil servants, aid workers,” Negm said. “A lot of people in Gaza talk to us.” Many of the journalists working in Gaza are facing the same struggles to find food, for themselves and their families, as the people they are covering. Noosphere's Ferguson said she's never before had to ask a reporter whether she had enough food for herself and her child. In an interview in May on “Democracy Now!,” 22-year-old journalist Abubaker Abed described the difficult decision he made to leave Gaza to pursue his education in Ireland. Not only was he suffering from malnutrition, he said, but his mother was concerned that his work as a journalist would make him and his family targets. “If I stayed, I would die,” he said. Jodie Ginsberg, CEO of the Committee to Protect Journalists, said she's concerned about the implications for journalists in future conflicts if what is happening in Gaza is allowed to continue without international condemnation that has real teeth. “They're essentially admitting in public to what amounts to a war crime,” Ginsberg said, “and they can do that because none of the other attacks on journalists have had any consequences. not in this war and not prior. It's not surprising that it can act with this level of impunity because no international government has really taken it to task.” Given all that they face, “to me, the most remarkable thing is that journalists are continuing to cover (Gaza) at all,” she said. ___ Laurie Kellman and Danica Kirk in London, Samy Magdy in Cairo and Sam Metz in Jerusalem contributed to this report. David Bauder writes about the intersection of media and entertainment for the AP. Follow him at http://x.com/dbauder and https://bsky.app/profile/dbauder.bsky.social. Before you make your next trade, you'll want to hear this. MarketBeat keeps track of Wall Street's top-rated and best performing research analysts and the stocks they recommend to their clients on a daily basis. Our team has identified the five stocks that top analysts are quietly whispering to their clients to buy now before the broader market catches on... and none of the big name stocks were on the list. They believe these five stocks are the five best companies for investors to buy now... See The Five Stocks Here Discover the top 7 AI stocks to invest in right now. This exclusive report highlights the companies leading the AI revolution and shaping the future of technology in 2025."
BC-Nikkei 225 Futures,https://www.marketbeat.com/articles/bc-nikkei-225-futures-2025-08-11/,"NEW YORK (AP) — Prices as of 5:30:00 PM Monday, August 11. Nikkei 225 (Yen) (CME) 500 yen x Nikkei 225 YEN futures price. Estimated volume: 10,925 Monday's volume: 10,925 Open Interest: 95,992 Open Interest Change: -61487 Before you make your next trade, you'll want to hear this. MarketBeat keeps track of Wall Street's top-rated and best performing research analysts and the stocks they recommend to their clients on a daily basis. Our team has identified the five stocks that top analysts are quietly whispering to their clients to buy now before the broader market catches on... and none of the big name stocks were on the list. They believe these five stocks are the five best companies for investors to buy now... See The Five Stocks Here Nuclear energy stocks are roaring. It's the hottest energy sector of the year. Cameco Corp, Paladin Energy, and BWX Technologies were all up more than 40% in 2024. The biggest market moves could still be ahead of us, and there are seven nuclear energy stocks that could rise much higher in the next several months.  To unlock these tickers, enter your email address below."
BC-Select Stock Indices,https://www.marketbeat.com/articles/bc-select-stock-indices-2025-08-11/,
IPO Market Stays Hot With These 2 Debuting Stocks,https://www.marketbeat.com/stock-ideas/ipo-market-stays-hot-with-these-2-debuting-stocks/,"It’s a hot IPO summer as new listings make their long-awaited return to public markets. After a cool first half of 2025, the demand for Initial Public Offerings has exploded in Q3, with anticipated companies like Circle Internet Group Inc. NYSE: CRCL and CoreWeave Inc. NASDAQ: CRWV surpassing even the rosiest expectations upon their debut. And it doesn’t appear that momentum is slowing as several more promising companies are unveiling their listings. A range of factors has kept the IPO market subdued recently. Not only was the macro-environment poor in the first half of 2025 due to erratic trade policies, but private companies have been staying private longer than historical norms. According to research from Morgan Stanley, companies are now staying private for nearly 11 years on average before going public, a significant increase over the seven-year average from 2014. Private companies aren’t scrutinized as closely as their publicly traded counterparts, and high rates have clogged the capital spigot over the last few years. Couple these factors with the rise of private markets, and there simply isn’t the enthusiasm for ‘going public’ as there was in the past. Only 84 IPOs were issued in the first half of 2025, down from over 100 in the same period last year. If there’s light at the end of the tunnel, it began shining earlier this summer. We’ve seen several new listings hit the market, and many have grown exponentially in the first day or week of trading. Three reasons for the turnaround include: The first wave of big IPOs this year saw companies like CoreWeave and Circle achieve impressive gains before volatility muted the fun. But July was another banner month for new issues; here are two debuting stocks to keep on your radar. The biggest IPO debut since CoreWeave, Figma Inc. NYSE: FIG, got off to an absurd start even before shares went public. After initially looking at an opening price between $25 - $28, the stock debuted at $33 and quickly rose toward $100 before hitting the exchanges. By the end of the first day, FIG shares were trading at $115, a shocking gain of more than 200% from the opening price. Figma has the financial data to back up its exciting first-week performance. The company has more than 13 million active users and earned more than $228 million in revenue in Q1 2025 (a 46% year-over-year (YOY) increase), with a net income of $44.9 million. FIG’s market cap surged over $67 billion after the first day of trading, although a 35% pullback sent shares back under $80 in the subsequent five sessions. Figma’s unique platform allows designers and professionals to collaborate on different interfaces in real-time, and with 85% of current customers outside the United States, the growth prospects remain strong despite the hefty valuation at about 40x sales. Figma’s impressive list of corporate clients includes Stripe, Duolingo, and Netflix Inc. NASDAQ: NFLX. If you don’t mind seeing Ryan Reynolds in the C-suite and have an interest in innovative AI-based advertising companies, MNTN Inc. NYSE: MNTN could be an intriguing investment. Pronounced ‘Mountain,’ the company has a platform called Performance TV, which helps clients create specific, tailored advertising plans targeting viewers based on their Connected TV watching habits and demographics. Connected TV is simply any TV with an internet connection, such as a Roku TV or Amazon Fire TV Stick. MNTN reported its first earnings release as a public company on August 5, which missed analysts’ expectations on EPS but surpassed revenue estimates by 6%. The $68.46 million in revenue represented a 25% YOY increase, and the company has a distinct first-mover advantage in this space thanks to partnerships with Peacock, ESPN, CBS, and Fox. MarketBeat is already tracking 10 analysts covering the stock, with two Hold ratings and eight Buy ratings. The consensus price target is $29.90, which suggests upside of nearly 20% from current prices. Before you consider Figma, you'll want to hear this. MarketBeat keeps track of Wall Street's top-rated and best performing research analysts and the stocks they recommend to their clients on a daily basis. MarketBeat has identified the five stocks that top analysts are quietly whispering to their clients to buy now before the broader market catches on... and Figma wasn't on the list. While Figma currently has a Hold rating among analysts, top-rated analysts believe these five stocks are better buys. View The Five Stocks Here Market downturns give many investors pause, and for good reason. Wondering how to offset this risk? Enter your email address to learn more about using beta to protect your portfolio."
"Taiwan Semiconductor Stock: Own It, Don't Trade It",https://www.marketbeat.com/originals/taiwan-semiconductor-stock-own-it-dont-trade-it/,"One of the biggest mistakes investors can make is constantly trading in and out of the wrong stocks, triggering one taxable event after another on their gains. While some smaller, more volatile stocks may lend themselves to short-term trading, others call for the opposite approach—a steady buy-and-hold strategy. Taiwan Semiconductor Manufacturing NYSE: TSM fits squarely into that second category. As a dominant force in the semiconductor industry, it holds a massive footprint in one of technology’s hottest areas. The sector is on the verge of major change as the United States moves to onshore chip manufacturing, especially with new trade tariffs targeting countries that supply much of the world’s semiconductors. With this in mind, Taiwan Semiconductor is a stock best suited for long-term accumulation—buying gradually and holding for an indefinite period. The reason goes beyond the company’s staggering $1 trillion market value. It also lies in the major investments and expansion into the United States that are set to unfold in the coming years. There has never been an invalid bull case for this company. Still, today more than ever, investors should stay alert to the underlying issues that could push this stock to new record highs. Even though it already trades at 97% of its 52-week high, chances are new ceilings will be made in the coming quarters and years, despite what volatility may come its way. The reason is that President Trump is now increasing tariffs on semiconductors, and as recently announced on a live CNBC interview, his rollout points to a high of 200% tariffs by 2027, giving companies like Taiwan Semiconductors a concrete timeline to get their manufacturing capacity within the United States. This means investors can get in early on this massive move, as onshoring its presence will also allow Taiwan Semiconductor to remain one of the leading names in semiconductor equipment and technology, most of which is used by other giants of industry like NVIDIA Co. NASDAQ: NVDA and Apple Inc. NASDAQ: AAPL. With a few years of gains nearly spelled out for investors, selling at the current highs would be futile, since they would only have to keep buying higher and higher, again stacking up more tax events for themselves unnecessarily. In fact, anyone who sells this stock today is most likely doing it for portfolio weighing reasons. For instance, institutional investors from Sanders Capital recently offloaded 7.8% of their massive $8.7 billion position in Taiwan Semiconductor. This should not be seen as a bearish sign, considering that this stock represents 11.6% of their portfolio, a recent run to 52-week highs likely bloated the stock to become too big a name in their book. This is a common practice at investment funds, where they reduce a name’s weight in a portfolio to avoid it becoming too big a constituent, thereby not necessarily indicating a change in sentiment or view toward the company. This is a more abstract question that can be answered in the same way as it is traditionally responded to by investment banks on Wall Street. Taiwan Semiconductor stock trades at a price-to-earnings (P/E) ratio of 27.6x today, but it still offers a steep discount to the rest of the computer sector’s average of 50.3x. Perhaps some investors and analysts had discounted this stock due to fears that it was so exposed to the Asian region, where most trade tariffs seem to be focused. However, changing the game plan to onshoring in the United States renders this bearish view useless. That change alone could be the catalyst to bring Taiwan Semiconductor stock to a valuation more in line with where the rest of its peers are trading today in terms of P/E multiples. More than that, the fundamental story is strong enough today to make this happen. In the latest quarterly announcement, Taiwan Semiconductor's stock reported $2.47 in earnings per share (EPS) compared to the Wall Street consensus for only $2.13, reiterating the fact that even analysts may be looking at this company through an overly conservative lens. As compliance with global tariffs and changes in demographics clear the way for future growth, further EPS beats in the future may very well start to deliver the sort of upside Taiwan Semiconductor has been missing out on compared to peers. Therefore, trading this stock would be a costly mistake for impatient investors; this is a buy-and-hold name. Before you consider Taiwan Semiconductor Manufacturing, you'll want to hear this. MarketBeat keeps track of Wall Street's top-rated and best performing research analysts and the stocks they recommend to their clients on a daily basis. MarketBeat has identified the five stocks that top analysts are quietly whispering to their clients to buy now before the broader market catches on... and Taiwan Semiconductor Manufacturing wasn't on the list. While Taiwan Semiconductor Manufacturing currently has a Buy rating among analysts, top-rated analysts believe these five stocks are better buys. View The Five Stocks Here Discover the next wave of investment opportunities with our report, 7 Stocks That Will Be Magnificent in 2025. Explore companies poised to replicate the growth, innovation, and value creation of the tech giants dominating today's markets."
"How major US stock indexes fared Monday, 8/11/2025",https://www.marketbeat.com/articles/how-major-us-stock-indexes-fared-monday-8112025-2025-08-11/,"U.S. stocks edged back from their record heights in Wall Street’s final moves before an upcoming update on inflation. The S&P 500 fell 0.3% after flirting with its all-time high earlier in the day. The Dow Jones Industrial Average dipped 0.5%, and the Nasdaq shaved 0.3% off its record. The highlight of this week for Wall Street is likely to arrive on Tuesday, when the government will report how bad inflation was across the country in July. A hot reading could discourage the Federal Reserve from delivering the cuts to interest rates that President Donald Trump has been demanding. On Monday: The S&P 500 fell 16.00 points, or 0.3%, to 6,373.45. The Dow Jones Industrial Average fell 200.52 points, or 0.5%, to 43,975.09. The Nasdaq composite fell 64.62 points, or 0.3%, to 21,385.40. The Russell 2000 index of smaller companies fell 1.91 points, or 0.1%, to 2,216.51. For the year: The S&P 500 is up 491.82 points, or 8.4%. The Dow is up 1,430.87 points, or 3.4%. The Nasdaq is up 2,074.61 points, or 10.7%. The Russell 2000 is down 13.65 points, or 0.6%. Before you make your next trade, you'll want to hear this. MarketBeat keeps track of Wall Street's top-rated and best performing research analysts and the stocks they recommend to their clients on a daily basis. Our team has identified the five stocks that top analysts are quietly whispering to their clients to buy now before the broader market catches on... and none of the big name stocks were on the list. They believe these five stocks are the five best companies for investors to buy now... See The Five Stocks Here Enter your email address and we'll send you MarketBeat's list of ten stocks that are set to soar in Fall 2025, despite the threat of tariffs and other economic uncertainty. These ten stocks are incredibly resilient and are likely to thrive in any economic environment."
