title,link,content
"Americans get more than half their calories from ultra-processed foods, CDC report says",https://www.marketbeat.com/articles/americans-get-more-than-half-their-calories-from-ultraprocessed-foods-cdc-report-says-2025-08-06/,"Most Americans get more than half their calories from ultra-processed foods, those super-tasty, energy-dense foods typically full of sugar, salt and unhealthy fats, according to a new federal report. Nutrition research has shown for years that ultra-processed foods make up a big chunk of the U.S. diet, especially for kids and teens. For the first time, however, the U.S. Centers for Disease Control and Prevention has confirmed those high levels of consumption, using dietary data collected from August 2021 to August 2023. The report comes amid growing scrutiny of such foods by Health Secretary Robert F. Kennedy Jr., who blames them for causing chronic disease. “We are poisoning ourselves and it's coming principally from these ultra-processed foods,” Kennedy told Fox News earlier this year. Overall, about 55% of total calories consumed by Americans age 1 and older came from ultra-processed foods during that period, according to the report. For adults, ultra-processed foods made up about 53% of total calories consumed, but for kids through age 18, it was nearly 62%. The top sources included burgers and sandwiches, sweet baked goods, savory snacks, pizza and sweetened drinks. Young children consumed fewer calories from ultra-processed foods than older kids, the report found. Adults 60 and older consumed fewer calories from those sources than younger adults. Low-income adults consumed more ultra-processed foods than those with higher incomes. The results were not surprising, said co-author Anne Williams, a CDC nutrition expert. What was surprising was that consumption of ultra-processed foods appeared to dip slightly over the past decade. Among adults, total calories from those sources fell from about 56% in 2013-2014 and from nearly 66% for kids in 2017-2018. Williams said she couldn't speculate about the reason for the decline or whether consumption of less processed foods increased. But Andrea Deierlein, a nutrition expert at New York University who was not involved in the research, suggested that there may be greater awareness of the potential harms of ultra-processed foods. “People are trying, at least in some populations, to decrease their intakes of these foods,” she said. Concern over ultra-processed foods' health effects has been growing for years, but finding solutions has been difficult. Many studies have linked them to obesity, diabetes and heart disease, but they haven't been able to prove that the foods directly cause those chronic health problems. One small but influential study found that even when diets were matched for calories, sugar, fat, fiber and micronutrients, people consumed more calories and gained more weight when they ate ultra-processed foods than when they ate minimally processed foods. Research published this week in the journal Nature found that participants in a clinical trial lost twice as much weight when they ate minimally processed foods — such as pasta, chicken, fruits and vegetables — than ultra-processed foods, even those matched for nutrition components and considered healthy, such as ready-to-heat frozen meals, protein bars and shakes. Part of the problem is simply defining ultra-processed foods. The new CDC report used the most common definition based on the four-tier Nova system developed by Brazilian researchers that classifies foods according to the amount of processing they undergo. Such foods tend to be “hyperpalatable, energy-dense, low in dietary fiber and contain little or no whole foods, while having high amounts of salt, sweeteners and unhealthy fats,” the CDC report said. U.S. health officials recently said there are concerns over whether current definitions “accurately capture” the range of foods that may affect health. The U.S. Food and Drug Administration and the Agriculture Department recently issued a request for information to develop a new, uniform definition of ultra-processed foods for products in the U.S. food supply. In the meantime, Americans should try to reduce ultra-processed foods in their daily diets, Deierlein said. For instance, instead of instant oatmeal that may contain added sugar, sodium, artificial colors and preservatives, use plain oats sweetened with honey or maple syrup. Read food packages and nutrition information, she suggested. “I do think that there are less-processed options available for many foods,” she said. ___ The Associated Press Health and Science Department receives support from the Howard Hughes Medical Institute’s Department of Science Education and the Robert Wood Johnson Foundation. The AP is solely responsible for all content. Before you make your next trade, you'll want to hear this. MarketBeat keeps track of Wall Street's top-rated and best performing research analysts and the stocks they recommend to their clients on a daily basis. Our team has identified the five stocks that top analysts are quietly whispering to their clients to buy now before the broader market catches on... and none of the big name stocks were on the list. They believe these five stocks are the five best companies for investors to buy now... See The Five Stocks Here Discover the next wave of investment opportunities with our report, 7 Stocks That Will Be Magnificent in 2025. Explore companies poised to replicate the growth, innovation, and value creation of the tech giants dominating today's markets."
Trump's new tariffs go into effect around the world just as the US economy starts to feel a sting from his policies,https://www.marketbeat.com/articles/trumps-new-tariffs-go-into-effect-around-the-world-just-as-the-us-economy-starts-to-feel-a-sting-from-his-policies-2025-08-06/,"WASHINGTON (AP) — Trump's new tariffs go into effect around the world just as the US economy starts to feel a sting from his policies. Before you make your next trade, you'll want to hear this. MarketBeat keeps track of Wall Street's top-rated and best performing research analysts and the stocks they recommend to their clients on a daily basis. Our team has identified the five stocks that top analysts are quietly whispering to their clients to buy now before the broader market catches on... and none of the big name stocks were on the list. They believe these five stocks are the five best companies for investors to buy now... See The Five Stocks Here Enter your email address and we'll send you MarketBeat's list of ten stocks that are set to soar in Fall 2025, despite the threat of tariffs and other economic uncertainty. These ten stocks are incredibly resilient and are likely to thrive in any economic environment."
United Airlines flights grounded nationwide because of technology problem,https://www.marketbeat.com/articles/united-airlines-flights-grounded-nationwide-because-of-technology-problem-2025-08-06/,"United Airlines flights on major routes were grounded Wednesday because of a technology issue, the airline said, and additional flight delays continued into the night. An alert on the Federal Aviation Administration website said all United flights destined for Chicago were halted at their departing airports. The agency said Denver, Newark, Houston and San Francisco airports were also impacted by halted flights. “Safety is our top priority, and we’ll work with our customers to get them to their destinations,” an emailed statement from the Chicago based-airline said. A statement Wednesday night said the underlying technology issue had been resolved and employees were working to restore normal operations. The impacted system, called Unimatic, houses flight information that is fed to other systems including those that calculate weight and balance and track flight times, according to United. The system outage, as the company described it, lasted several hours, the statement said. It wasn't related to recent concerns about airline industry cybersecurity. Transportation Secretary Sean Duffy said on social media that the issue was unrelated to the broader air traffic control system. An AP journalist had boarded a United plane at the Louis Armstrong New Orleans International Airport for a trip to Houston when flight attendants announced a “systemwide” problem had grounded flights. They then sent passengers back to the terminal. Another traveler, Johan Kotze, was at the New Orleans airport to begin a journey to the Indian Ocean island nation of Mauritius for vacation. Getting caught up in flight delays for him likely meant he would miss connecting flights along the way and would have to rebook not only the flights but a car and accommodations as well. “It's not very nice,"" he said of the experience. United Airlines apologized on social media to upset customers who were facing delays and hours sitting in planes on runways. “Hey there, we apologize for the travel disruption today,” the airline told a customer on the social platform X. “Our teams are working to resolve the outage as quickly as possible. Thank you for your patience.” The airline said it was paying customer expenses including hotels when applicable. Before you make your next trade, you'll want to hear this. MarketBeat keeps track of Wall Street's top-rated and best performing research analysts and the stocks they recommend to their clients on a daily basis. Our team has identified the five stocks that top analysts are quietly whispering to their clients to buy now before the broader market catches on... and none of the big name stocks were on the list. They believe these five stocks are the five best companies for investors to buy now... See The Five Stocks Here With the proliferation of data centers and electric vehicles, the electric grid will only get more strained. Download this report to learn how energy stocks can play a role in your portfolio as the global demand for energy continues to grow."
Ontario premier says he doesn't trust Trump and warns the US president could reopen trade pact,https://www.marketbeat.com/articles/ontario-premier-says-he-doesnt-trust-trump-and-warns-the-us-president-could-reopen-trade-pact-2025-08-06/,"TORONTO (AP) — The leader of Canada’s most populous province said Wednesday he doesn’t trust U.S. President Donald Trump and expects the president to soon reopen the free trade agreement he agreed to in his first term. Ontario Premier Doug Ford said the federal government needs to prepare for that to happen this fall. Ford made the comments after the country’s provincial premiers and Prime Minister Mark Carney met in private for the first time since Trump escalated his trade war by hitting Canada with a baseline 35% tariff last week. The new tariff, which took effect on Friday after the two countries failed to hit an Aug. 1 deadline to secure a new trade agreement, applies only to goods not covered by the U.S.-Mexico-Canada Agreement that Trump negotiated during his first term. Trump previously hailed the agreement as “the fairest, most balanced and beneficial trade agreement we have ever signed. "" Carney has said about 85% of trade with the U.S. remains tariff-free because of USMCA. Ford said Trump likely won’t wait for the scheduled review of the agreement next year. “He’s not waiting until 2026. At any given time, President Trump — not that he even follows the rules — he can pull the carpet out from underneath us,” Ford told reporters in Toronto Wednesday. “I’m going to ask the people, do you trust President Trump? I don’t.” Carney told a press conference on Tuesday that he has not talked to Trump in recent days but would speak with him “when it makes sense.” Sector-specific tariffs on Canada, like the 50% duty on steel, aluminum and copper, remain in place. Carney also suggested he may lift counter-tariffs if that helps Canada in the ongoing trade dispute. Before you make your next trade, you'll want to hear this. MarketBeat keeps track of Wall Street's top-rated and best performing research analysts and the stocks they recommend to their clients on a daily basis. Our team has identified the five stocks that top analysts are quietly whispering to their clients to buy now before the broader market catches on... and none of the big name stocks were on the list. They believe these five stocks are the five best companies for investors to buy now... See The Five Stocks Here Thinking about investing in Meta, Roblox, or Unity? Enter your email to learn what streetwise investors need to know about the metaverse and public markets before making an investment."
Britain's Royal Mail celebrates Monty Python with stamps featuring iconic sketches and characters,https://www.marketbeat.com/articles/britains-royal-mail-celebrates-monty-python-with-stamps-featuring-iconic-sketches-and-characters-2025-08-06/,"LONDON (AP) — And now for something completely different: Britain’s Royal Mail has issued stamps celebrating the absurdist comedy of Monty Python. The 10-stamp series announced on Thursday celebrates some of the troupe’s most iconic characters and catchphrases, from “Nudge, nudge” to “The Lumberjack Song.” Six stamps depict scenes from the sketch-comedy TV series “Monty Python’s Flying Circus,” including “The Spanish Inquisition,” ”The Ministry of Silly Walks,"" “Dead Parrot” and “The Nude Organist.” Another four mark the 50th anniversary of the cult classic 1975 film “Monty Python and the Holy Grail,” including one showing the limb-losing Black Knight insisting, “’Tis but a scratch.” The stamps can be pre-ordered from Thursday and go on sale Aug. 14. Made up of Michael Palin, John Cleese, Eric Idle, Terry Gilliam, Terry Jones and Graham Chapman, Monty Python brought a unique blend of satire, surrealism and silliness to British TV screens in a series that ran from 1969 to 1974. The troupe also made several feature films, including “And Now for Something Completely Different,” “Monty Python’s Life of Brian” and “Monty Python’s The Meaning of Life.” David Gold, Royal Mail’s director of external affairs, said the collection “honors a body of work that has shaped the comedic landscape for nearly six decades.” Palin said he was “very glad to share a stamp with the nude organist!” The group largely disbanded in the 1980s, and Chapman died of cancer in 1989. The five surviving Pythons reunited in 2014 for a string of live stage shows. Jones died in 2020 from a rare form of dementia. Before you consider Royal Mail, you'll want to hear this. MarketBeat keeps track of Wall Street's top-rated and best performing research analysts and the stocks they recommend to their clients on a daily basis. MarketBeat has identified the five stocks that top analysts are quietly whispering to their clients to buy now before the broader market catches on... and Royal Mail wasn't on the list. While Royal Mail currently has a Hold rating among analysts, top-rated analysts believe these five stocks are better buys. View The Five Stocks Here Explore Elon Musk’s boldest ventures yet—from AI and autonomy to space colonization—and find out how investors can ride the next wave of innovation."
How DigitalOcean's Focus Is Fueling Explosive Growth,https://www.marketbeat.com/originals/how-digitaloceans-focus-is-fueling-explosive-growth/,"In the world of cloud computing, a market famously dominated by tech titans like Amazon NASDAQ: AMZN, Microsoft NASDAQ: MSFT, and Google NASDAQ: GOOG, it’s easy to assume there is little room for smaller players. Their immense scale and sprawling service catalogs often define the conversation. However, a recent, powerful market signal suggests a different story is unfolding. DigitalOcean Holdings, Inc. NYSE: DOCN, a niche cloud provider with a fraction of the giants' resources, saw its stock price jump by nearly 29% in a single day after releasing its quarterly earnings. This dramatic move begs a critical question for investors: How is a specialized company not only competing but achieving such decisive success? The answer is found in a disciplined and focused strategy that is now firing on all cylinders. The immediate trigger for DigitalOcean’s impressive stock performance was a second-quarter 2025 financial report that confidently beat analyst expectations and signaled business health. For investors, the results were a clear indication of a company executing its plan with remarkable efficiency. For the quarter ending June 30, 2025, DigitalOcean delivered a potent combination of growth and profitability: Beyond looking in the rearview mirror, DigitalOcean’s management provided a forward-looking outlook that strengthened investor confidence. The company raised its guidance for the full 2025 fiscal year, now projecting total revenue between $888 million and $892 million and an upgraded non-GAAP EPS in the range of $2.05 to $2.10. An upward revision of this nature is one of the strongest signals management can send, suggesting they see sustained momentum and a clear path to achieving their operational goals for the rest of the year. DigitalOcean's success is the result of a deliberate strategy to dominate a specific and valuable niche: the market for individual developers, startups, and small-to-medium-sized businesses (SMBs) that value simplicity above all else. Where hyperscalers offer complexity and an overwhelming array of services, DigitalOcean provides a streamlined experience, transparent pricing, and extensive community support. The latest financial data proves this model is not just viable; it's highly profitable. The most compelling evidence lies in the company’s ability to grow with its customers. Revenue from its “Builders” clients (those spending over $500 monthly) grew by an impressive 35% year-over-year. This metric is crucial because it validates the company's land-and-expand model: customers start with small projects and, thanks to the platform's ease of use, confidently scale their operations and spending over time. This targeted approach translates directly into a healthy and efficient business, as shown by the $57 million in adjusted free cash flow generated during the quarter. Furthermore, two key customer metrics highlight the strategy's success: With its core business executing so well, DigitalOcean is applying its proven philosophy of simplification to the next significant technology shift: artificial intelligence (AI). The company is strategically positioning itself to win the equally important race of making AI accessible and useful for its core customer base. Its focus is on AI inference (the practical use of models in applications), which is widely expected to be a larger long-term market than model training. The company’s AI revenue is more than doubling year-over-year, which is a clear sign that this approach is working. This growth is being propelled by specific product initiatives designed to remove friction for developers: By focusing on the application layer, DigitalOcean is turning AI from a complex, infrastructure-heavy challenge into a simple, integrated tool, reinforcing its value proposition to developers. DigitalOcean's powerful second-quarter performance is validation of a business model built for a specific purpose. The company has demonstrated its ability to carve out a profitable, high-growth niche in a competitive market by remaining disciplined and focused on the needs of its customers. The path forward appears clear and compelling. The core business is healthy and growing, while the company's focused AI strategy provides a significant catalyst for future expansion. Reinforcing this positive outlook is the prudent financial management demonstrated by the leadership team. By proactively securing a new $800 million credit facility to refinance its future debt obligations, the company is ensuring it has a strong and stable financial foundation from which to pursue its growth ambitions. For investors seeking exposure to the cloud and AI sectors through a company with a proven strategy and a clear runway for growth, DigitalOcean presents a compelling and well-defined case. Before you consider DigitalOcean, you'll want to hear this. MarketBeat keeps track of Wall Street's top-rated and best performing research analysts and the stocks they recommend to their clients on a daily basis. MarketBeat has identified the five stocks that top analysts are quietly whispering to their clients to buy now before the broader market catches on... and DigitalOcean wasn't on the list. While DigitalOcean currently has a Hold rating among analysts, top-rated analysts believe these five stocks are better buys. View The Five Stocks Here Nuclear energy stocks are roaring. It's the hottest energy sector of the year. Cameco Corp, Paladin Energy, and BWX Technologies were all up more than 40% in 2024. The biggest market moves could still be ahead of us, and there are seven nuclear energy stocks that could rise much higher in the next several months.  To unlock these tickers, enter your email address below."
"Trump plans 100% tariff on computer chips, unless companies build in US",https://www.marketbeat.com/articles/trump-says-he-plans-to-put-a-100-tariff-on-computer-chips-likely-pushing-up-cost-of-electronics-2025-08-06/,"WASHINGTON (AP) — President Donald Trump said Wednesday that he will impose a 100% tariff on computer chips, raising the specter of higher prices for electronics, autos, household appliances and other essential products dependent on the processors powering the digital age. “We’ll be putting a tariff of approximately 100% on chips and semiconductors,” Trump said in the Oval Office while meeting with Apple CEO Tim Cook. ""But if you’re building in the United States of America, there’s no charge."" The announcement came more than three months after Trump temporarily exempted most electronics from his administration's most onerous tariffs. The Republican president said companies that make computer chips in the U.S. would be spared the import tax. During the COVID-19 pandemic, a shortage of computer chips increased the price of autos and contributed to higher inflation. Investors seemed to interpret the potential tariff exemptions as a positive for Apple and other major tech companies that have been making huge financial commitments to manufacture more chips and other components in the U.S.. Big Tech already has made collective commitments to invest about $1.5 trillion in the U.S. since Trump moved back into the White House in January. That figure includes a $600 billion promise from Apple after the iPhone maker boosted its commitment by tacking another $100 billion on to a previous commitment made in February. Now the question is whether the deal brokered between Cook and Trump will be enough to insulate the millions of iPhones made in China and India from the tariffs that the administration has already imposed and reduce the pressure on the company to raise prices on the new models expected to be unveiled next month. Wall Street certainly seems to think so. After Apple's stock price gained 5% in Wednesday regular trading sessions, the shares rose by another 3% in extended trading after Trump announced some tech companies won't be hit with the latest tariffs while Cook stood alongside him. The shares of AI chipmaker Nvidia, which also has recently made big commitments to the U.S., rose slightly in extended trading to add to the $1 trillion gain in market value the Silicon Valley company has made since the start of Trump's second administration. The stock price of computer chip pioneer Intel, which has fallen on hard times, also climbed in extended trading. Inquiries sent to chip makers Nvidia and Intel were not immediately answered. The chip industry's main trade group, the Semiconductor Industry Association, declined to comment on Trump's latest tariffs. Demand for computer chips has been climbing worldwide, with sales increasing 19.6% in the year-ended in June, according to the World Semiconductor Trade Statistics organization. Trump's tariff threats mark a significant break from existing plans to revive computer chip production in the U.S. that were drawn up during the administration of President Joe Biden. Since taking over from Biden, Trump has been deploying tariffs to incentivize more domestic production. Essentially, the president is betting that the threat of dramatically higher chip costs would force most companies to open factories domestically, despite the risk that tariffs could squeeze corporate profits and push up prices for mobile phones, TVs and refrigerators. By contrast, the bipartisan CHIPS and Science Act that Biden signed into law in 2022 provided more than $50 billion to support new computer chip plants, fund research and train workers for the industry. The mix of funding support, tax credits and other financial incentives were meant to draw in private investment, a strategy that Trump has vocally opposed. — Liedtke reported from San Ramon, California. Before you make your next trade, you'll want to hear this. MarketBeat keeps track of Wall Street's top-rated and best performing research analysts and the stocks they recommend to their clients on a daily basis. Our team has identified the five stocks that top analysts are quietly whispering to their clients to buy now before the broader market catches on... and none of the big name stocks were on the list. They believe these five stocks are the five best companies for investors to buy now... See The Five Stocks Here Wondering where to start (or end) with AI stocks? These 10 simple stocks can help investors build long-term wealth as artificial intelligence continues to grow into the future."
