title,link,content
Bolivia's election may spell the end of its long-ruling left. Here's what to know,https://www.marketbeat.com/articles/bolivias-election-may-spell-the-end-of-its-long-ruling-left-heres-what-to-know-2025-08-11/,"LA PAZ, Bolivia (AP) — For most of Renan Aliaga’s adult life, a single name dominated the politics of Bolivia: Evo Morales. Morales, a former union leader for coca farmers, founded the Andean nation's most successful political party and transformed Bolivia over three consecutive terms marked by political stability and economic growth. But when Aliaga goes to the polls on Sunday to vote for Bolivia's next president, he won’t see Morales' name on the ballot after electoral authorities excluded him. In fact, for the first time in two decades, Aliaga won’t see any big name from the governing Movement Toward Socialism, or MAS, party that Morales founded — not even President Luis Arce, Morales' protege-turned-rival, who withdrew from the race over his failure to halt an economic tailspin. Under MAS, Bolivia enjoyed years of a fixed exchange rate, low inflation and subsidized energy. Now, high inflation, a scarcity of imported goods and fuel shortages have beset the country. Arce handed the reins to a little-known minister, Eduardo Del Castillo. The main options remaining include a conservative businessman and right-wing former president — both of whom have run and lost three times before — and a young leftist Senate leader. Unsatisfied, Aliaga, a 39-year-old bus driver and former MAS voter, says he'll make a last-minute decision. “The right wing had its chance, and it was a disaster,” he said, recalling the hardship of the 1990s, when Bolivia became a poster child for free-market economics and the two right-wing front-runners — businessman Samuel Doria Medina and ex-President Jorge “Tuto” Quiroga — built their careers. “But the left wing has proven to be the same, or worse,” Aliaga said, referring to how the MAS strategy of nationalizing resources and redistributing tax receipts sputtered out with the end of the commodities boom. The main issues in this hotly contested election are Bolivia's long-standing leftist economic model, its democratic integrity and the livelihoods of millions of people undergoing the country's worst financial crisis in four decades. “This seems the end of the cycle not only for MAS, but for an entire model of government,” Bolivia political analyst Verónica Rocha said. Tensions within MAS can be traced to Morales' disputed 2019 reelection. Protests erupted and the leftist leader resigned under pressure from the military. He fled into exile and right-wing Senator Jeanine Áñez took office in what many view as a coup. Violent clashes between protesters and security forces killed at least 37 people. Morales returned to Bolivia following the 2020 election victory of his former finance minister, Arce. But their competing ambitions collided when Morales announced his intention to return to politics. Lawmakers loyal to Morales deprived Arce’s government of its majority. Judges answering to Arce ordered Morales’ arrest over his sexual relationship with a 15-year-old girl and barred his 2025 presidential candidacy on account of his past terms. “MAS torpedoed its own chances of winning this election,” said Gustavo Flores-Macías, a professor of government and public policy at Cornell University. A young vice president, Quiroga became interim leader in 2001 when then President Hugo Banzer, Bolivia’s former military dictator, resigned because of terminal cancer with a year left in his term. Ever since, Quiroga has yearned for a term of his own. He ran three times — twice against Morales in 2005 and 2014. Now 65, he’s hoping the fourth time’s the charm. Doria Medina, 66, a former minister of planning from 1991-1993 made his fortune in cement and owns Bolivia's Burger King franchise. Dubbed the “eternal candidate,” he lost to Morales in 2005, 2009 and 2014, as Bolivia’s natural gas windfall, underwritten by public investment and generous subsidies, buoyed the union leader's popularity. When commodity prices slumped and gas production plummeted, Morales’ “economic miracle” went bust. Now once-routine errands have turned into nightmares as Bolivians wait in fuel lines that wrap around city blocks, run from pharmacy to pharmacy in search of medicines and queue for subsidized bread that has shrunk to almost half its normal size. This may give the opposition its first real shot at power in two decades. Yet Bolivians interviewed across the administrative capital of La Paz expressed not only frustration with the MAS party, but also disappointment in the right-wing establishment. “If people vote for the right, it's because they're resigned to it as the only alternative,” said Bolivian author Quya Reyna. “These are recycled politicians from the 1990s era of privatization."" Doria Medina and Quiroga vow to slash fuel subsidies, dismantle inefficient state-owned companies, let foreign investors mine Bolivia’s abundant lithium reserves and reorient the nation's foreign policy toward the United States after years of its alignment with China and Russia. Graffiti sprayed across La Paz reads “100 days, dammit"" — Doria Medina's pledge to fix fuel shortages and stabilize the exchange rate within his first 100 days. Motorists waiting for hours to get gas find themselves facing billboards of Quiroga promising “No more lines!” If no candidate wins a majority of the vote, a runoff between the top two finishers will be held on Oct. 19. Voter cynicism is widespread, with many Bolivians saying that they have no faith in any of the candidates to improve their lives. Longtime MAS voters wary of austerity under a right-wing president aren't sure where to turn. Some initially pinned their hopes on 36-year-old Senate President Andrónico Rodríguez, a coca-farming union activist who could have appealed to Indigenous communities looking for the kind of representation they found under Morales. But Morales branded Rodríguez a traitor for advancing his own candidacy. The Senate leader has made few public appearances since. A rare centrist candidate, lawmaker Rodrigo Paz and his media-savvy running mate, ex-Police Captain Edman Lara, have recently energized young voters with TikTok videos from the campaign trail. With Doria Medina and Quiroga neck and neck, Paz could play kingmaker. But their Christian Democratic Party's blistering attacks on both MAS and the right-wing have left some voters without a clear sense of where they stand. “We've all been raised on politicians' broken promises,” said Irma Marín, 38, shouting to be heard over the crowd at a Paz-Lara campaign rally Sunday. “I'm not sure who to trust.” Facing an arrest warrant, Morales, 66, has been holed up for months in his tropical stronghold of Chapare. His followers staged raucous protests against his removal from the race, blocking key roads and confronting police in clashes in June that killed four officers and four civilians. Morales is urging voters to register their rage by casting null-and-void ballots. “Null votes signal that these elections are not legitimate and the next government of Bolivia won't be legitimate,” said Chris Velasco, an organizer close to Morales. “That will mean political instability, social instability.” Before you make your next trade, you'll want to hear this. MarketBeat keeps track of Wall Street's top-rated and best performing research analysts and the stocks they recommend to their clients on a daily basis. Our team has identified the five stocks that top analysts are quietly whispering to their clients to buy now before the broader market catches on... and none of the big name stocks were on the list. They believe these five stocks are the five best companies for investors to buy now... See The Five Stocks Here Just getting into the stock market? These 10 simple stocks can help beginning investors build long-term wealth without knowing options, technicals, or other advanced strategies."
Cambodian migrant workers face an uncertain future as Thai border conflict drives them home,https://www.marketbeat.com/articles/cambodian-migrant-workers-face-an-uncertain-future-as-thai-border-conflict-drives-them-home-2025-08-11/,"KAMRIENG, Cambodia (AP) — Hundreds of thousands of Cambodian migrant workers have been heading home from Thailand as the two countries work to keep a ceasefire in armed clashes along their border. Tensions between the countries have escalated due to disputes over pockets of land along their 800-kilometer (500-mile) border. A five-day clash in July left at least 43 people dead and displaced more than 260,000 in both Southeast Asian nations. A fragile ceasefire brokered by Malaysia, with backing from the U.S. and China, appears to be holding while officials try to resolve issues underlying the conflict. The retreat has left many of the workers streaming back to Cambodia wondering how to get by after they left jobs that enabled them to send money back to their families. Kri Phart, a 56-year-old poultry worker, said he began packing after reading a post by Cambodian Prime Minister Hun Manet on Facebook urging migrants to return to Cambodia. “I have no idea if the fighting will really stop and with fewer and fewer Cambodians in Thailand, I got nervous,” said Kri Phart, seated on a stoop with two big bags of belongings and a big electric fan. “I didn’t want to be the last Cambodian migrant in Thailand.” “I got scared because of the border conflict,” said Kri Phart, one of thousands of Cambodians streaming shoulder-to-shoulder through the Daung International Border Gate last week, hauling rainbow colored bags, appliances and even guitars in the 40 Celsius (104 Fahrenheit) heat. “Many of the Cambodians I knew working in Thailand ran away. Everyday more and more of us fled,” he said. The reasons driving Cambodians to flee Thailand are varied. Human rights activists reported that some migrant workers had been attacked by gangs of young Thais. Others were alarmed by unsubstantiated rumors that the Cambodian government would seize their land and revoke their citizenships if they didn’t return home by mid-August. Cambodia’s Ministry of Labor and Vocational Training estimates 1.2 million Cambodians were working in Thailand when the border disputes began to escalate in June. Estimates vary, but Sun Mesa, a ministry spokesman said at least 780,000 — about 65% — have returned to Cambodia. He said the workers could find jobs with equal pay and benefits back home. Many of those who were driven by poverty or climate change to leave for work in Thailand expressed doubts. “Now that I am back, there is going to be no income for a while and this will really put my family in a bad situation,” said Thouk Houy, 26, who left a job at a leather factory south of Bangkok that enabled her to send $70 to $100 a month back to her parents. “I'm the last of my siblings who is still single, meaning it's my responsibility to support my parents. I don’t know how I can do that now that I am back home,"" she said. Minor spats between Cambodian and Thai workers at the factory and her mother's nightly pleas for her to go home were factors behind her decision to leave, she said. Handing over her belongings to be strapped into the back of a precariously packed van, Thouk Houy said the clincher was a claim by influential former Cambodian Prime Minister Hun Sen, father of the current prime minister, Hun Manet, that Thailand was preparing to invade. “Now that I'm home, what will I do to make a living?” she said. Migrant workers fill vital roles in Thailand's farming, construction and manufacturing industries. They also send home close to $3 billion in remittances each year, according to labor ministry data. The loss of that income can be devastating for families relying on it to manage big debts, said Nathan Green, an assistant professor of geography at the National University of Singapore. “These kinds of conflicts demonstrate how precarious migrant livelihoods are in Cambodia,” Green said. An overseas advocacy group, the Khmer Movement for Democracy, has urged the government to defer loan payments and provide incentives for companies to hire returning migrants. “Without economic safeguards, families of returning migrants will not be able to repay their debts and financial institutions will be at their throats,” said Mu Sochua, the group's president. “We are talking about the poorest of the poor, who will be deprived of incomes.” Meng Yeam, who was trying to wave down a taxi while keeping an eye on his belongings, said he managed to send his family back home 20,000 baht (roughly $600) while working as a manager at a rubber factory in eastern Thailand’s Chonburi Province. More than 90% of the Cambodians working in the factory have left, the 32-year-old said. Meng Yeam said he expected his family to be okay, though it won’t be able to save as much as it did while he was working in Thailand. And he was glum about the prospects for things to return to normal. “Cambodia and Thailand need each other to do well, but for now, it seems like we just cannot get along,” Meng Yeam said. “I hope we can work in Thailand again one day, but who knows, maybe I will be retired by the time we stop fighting.” ___ Sopheng Cheang reported from Phnom Penh, Cambodia. Before you make your next trade, you'll want to hear this. MarketBeat keeps track of Wall Street's top-rated and best performing research analysts and the stocks they recommend to their clients on a daily basis. Our team has identified the five stocks that top analysts are quietly whispering to their clients to buy now before the broader market catches on... and none of the big name stocks were on the list. They believe these five stocks are the five best companies for investors to buy now... See The Five Stocks Here Unlock the timeless value of gold with our exclusive 2025 Gold Forecasting Report. Explore why gold remains the ultimate investment for safeguarding wealth against inflation, economic shifts, and global uncertainties. Whether you're planning for future generations or seeking a reliable asset in turbulent times, this report is your essential guide to making informed decisions."
South Korean President Lee will travel to Washington for Aug. 25 meeting with Trump,https://www.marketbeat.com/articles/south-korean-president-lee-will-travel-to-washington-for-aug-25-meeting-with-trump-2025-08-11/,"SEOUL, South Korea (AP) — South Korea’s new President Lee Jae Myung will travel to Washington later this month to meet with U.S. President Donald Trump, Lee’s office said Tuesday, for talks on trade and defense cooperation in the face of nuclear-armed North Korea and other threats. Their Aug. 25 summit will follow a July trade deal in which Washington agreed to cut its reciprocal tariff on South Korea to 15% from the initially proposed 25% and to apply the same reduced rate to South Korean cars, the country’s top export to the United States. South Korea also agreed to purchase $100 billion in U.S. energy and invest $350 billion in the country, and Lee and Trump may discuss how the investment package will be structured and managed. The talks are expected to cover expanding cooperation in key industries such as semiconductors, batteries and shipbuilding, Lee’s spokesperson Kang Yu-jung said. Lee, a liberal who won an early election in June to replace ousted conservative Yoon Suk Yeol, has made the economy his top priority, aiming to shield the trade-dependent nation from the shocks of Trump’s tariff hikes and his demands that allies cut reliance on Washington and shoulder more of their own defense costs. Lee's meeting with Trump comes amid concerns in Seoul that the Trump administration could shake up the decades-old alliance by demanding higher payments for the U.S. troop presence in South Korea and possibly move to reduce it as Washington shifts more focus on China. Lee and Trump will discuss strengthening the allies’ defense posture against growing North Korean threats, and also developing the partnership into a “future-oriented, comprehensive strategic alliance” to address the changing international security and economic environment, according to Kang, who didn’t elaborate on the specific issues to be addressed. Dating back to his first term, Trump has regularly called for South Korea to pay more for the 28,500 American troops stationed on its soil. Recent comments by key Trump administration officials, including Undersecretary of Defense Elbridge Colby, have also suggested a desire to restructure the alliance, which some experts say could potentially affect the size and role of U.S. forces in South Korea. Under this approach, South Korea would take a greater role in countering North Korean threats while U.S. forces focus more on China, possibly leaving Seoul to face reduced benefits but increased costs and risks, experts say. In a meeting with South Korean reporters last week, Gen. Xavier Brunson, commander of U.S. Forces Korea, stressed the need to “modernize” the alliance to address the evolving security environment, including North Korea’s expanding nuclear program, its deepening alignment with Russia, and what he called Chinese threats to a “free and open Indo-Pacific.” When asked about a potential reduction in U.S. troops in South Korea, Brunson emphasized capabilities over numbers, highlighting advanced systems like fifth-generation fighters, and also stressed strategic flexibility, citing the recent deployment of Patriot air defense systems from South Korea to the Middle East. “What’s being asked of Korea is to be stronger against DPRK — that we might have the flexibility as we modernize our alliance so that we could go do other things,” Brunson said, using the initials of North Korea’s formal name, the Democratic People’s Republic of Korea. During his first term, Trump suspended U.S. military exercises with South Korea while pursuing diplomacy with North Korean leader Kim Jong Un. They met three times in 2018 and 2019 but their diplomacy quickly collapsed over disagreements about exchanging the release of U.S.-led sanctions against the North and the North’s steps to wind down its nuclear and missile program. Kim has since suspended virtually all diplomacy with Washington and Seoul while accelerating the expansion of his weapons program. His foreign policy priority is now Russia, which he has supplied with weapons and troops to help prolong Russian President Vladimir Putin’s invasion of Ukraine. Kim’s powerful sister recently dismissed Washington and Seoul’s stated desires to restart diplomacy aimed at defusing the North’s nuclear program, indicating that Pyongyang feels no urgency to resume diplomacy with South Korea and the U.S. anytime soon. Tensions on the peninsula could rise again later this month, when South Korea and the United States proceed with their annual large-scale combined military exercises, which begin on Aug. 18. North Korea labels the allies’ joint drills as invasion rehearsals and often uses them as a pretext to dial up military demonstrations and weapons tests aimed at advancing its nuclear program. Before you make your next trade, you'll want to hear this. MarketBeat keeps track of Wall Street's top-rated and best performing research analysts and the stocks they recommend to their clients on a daily basis. Our team has identified the five stocks that top analysts are quietly whispering to their clients to buy now before the broader market catches on... and none of the big name stocks were on the list. They believe these five stocks are the five best companies for investors to buy now... See The Five Stocks Here Discover the top 7 AI stocks to invest in right now. This exclusive report highlights the companies leading the AI revolution and shaping the future of technology in 2025."
Dodgers star Shohei Ohtani and agent accused of sabotaging $240M Hawaii real estate project,https://www.marketbeat.com/articles/dodgers-star-shohei-ohtani-and-agent-accused-of-sabotaging-240m-hawaii-real-estate-project-2025-08-11/,"A Hawaii real estate investor and broker are suing Shohei Ohtani, claiming the Los Angeles Dodgers star and his agent got them fired from a $240 million luxury housing development on the Big Island’s coveted Hapuna Coast that they brought him in to endorse. According to the lawsuit filed in Hawaii Circuit Court on Friday, Ohtani’s agent, Nez Balelo, increasingly demanded concessions from developer Kevin J. Hayes Sr. and real estate broker Tomoko Matsumoto before demanding that their business partner, Kingsbarn Realty Capital, drop them from the deal. “Balelo and Otani, who were brought into the venture solely for Otani’s promotional and branding value, exploited their celebrity leverage to destabilize and ultimately dismantle Plaintiffs’ role in the project — for no reason other than their own financial self-interest,” the lawsuit claims. The suit accuses Ohtani and Balelo of tortious interference and unjust enrichment. Hayes, a developer with 40 years of experience, and Matsumoto, who was to be the listing agent for the houses averaging $17.3 million each, say that Ohtani and Balelo also tried to undermine their interests in a second, neighboring venture. A spokesman for Balelo's agency, CAA Baseball, declined comment. Attempts to reach Kingsbarn officials for comment were not immediately successful. “This case is about abuse of power,” the lawsuit says. “Defendants used threats and baseless legal claims to force a business partner to betray its contractual obligations and strip Plaintiffs of the very project they conceived and built. “Defendants must be held accountable for their actions, not shielded by fame or behind-the-scenes agents acting with impunity. Plaintiffs bring this suit to expose Defendants’ misconduct and to ensure that the rules of contract, fair dealing, and accountability apply equally to all — celebrity or not.” Ohtani, 31, arrived from Japan in 2018 as perhaps the most heralded international star in baseball history, with an ability to both pitch and hit that made him doubly valuable to his team. A five-time All-Star and three-time Most Valuable Player, he signed a record 10-year, $700-million contract with the Dodgers before last season and helped the team win the 2024 World Series. Investment materials for The Vista at Mauna Kea Resort, which remained online on Monday night, listed Hayes and Matsumoto as part of the management team, along with Kingsbarn. It called Ohtani “Japan's Babe Ruth” and the “1st Resident,” giving him top billing ahead of the iconic Mauna Kea Resort, “one of the most celebrated hotels in Hawaii,” Hapuna Beach, “rated the #1 beach in America by Conde Nast Traveler” and two golf courses – one designed by Arnold Palmer, the other by Robert Trent Jones Sr. “Ohtani will act as the celebrity spokesperson for the project and has committed to purchasing one of the 14 residences within the project,” the brochure says. “He also intends to spend significant time at The Vista in the off-season and will construct a small hitting and pitching facility for preseason training."" The suit says the developers spent 11 years working on the deal and “as part of a bold marketing strategy” signed an endorsement deal in 2023 with Ohtani, “one of the most high-profile endorsements imaginable."" “This partnership with Ohtani will elevate the demand and create buzz within the Japanese luxury vacation home market, which is a primary target audience for the project,"" the investment brochure said. “We see Shohei Ohtani’s homeownership as having a significant impact on the global exposure of the project and expect to accelerate the pace of sales, thereby helping us achieve our pricing objectives.” The suit said Balelo “quickly became a disruptive force,” threatening to pull Ohtani from the deal if concessions weren't made. “Kingsbarn began capitulating to Balelo’s every whim,” the suit said. “Over time, it became increasingly obvious that Kingsbarn was more concerned about preserving its relationship with Otani than honoring its obligations to its business partners.” Last month, in what the suit called “a coordinated ambush,” Kingsbarn fired Hayes and Matsumoto. “Kingsbarn openly admitted during the call that Balelo had demanded the terminations and that they were being done solely to placate him,” the suit said. “Plaintiffs stand to lose millions of dollars in compensation tied to projected homebuilding profit, construction management fees, and broker commissions.” ___ AP MLB: https://apnews.com/hub/mlb Before you make your next trade, you'll want to hear this. MarketBeat keeps track of Wall Street's top-rated and best performing research analysts and the stocks they recommend to their clients on a daily basis. Our team has identified the five stocks that top analysts are quietly whispering to their clients to buy now before the broader market catches on... and none of the big name stocks were on the list. They believe these five stocks are the five best companies for investors to buy now... See The Five Stocks Here Looking for the next FAANG stock before everyone has heard about it? Enter your email address to see which stocks MarketBeat analysts think might become the next trillion dollar tech company."
