title,link,content
NFL and ESPN reach nonbinding agreement for sale of NFL Network and other media assets,https://www.marketbeat.com/articles/nfl-and-espn-reach-nonbinding-agreement-for-sale-of-nfl-network-and-other-media-assets-2025-08-05/,"Ever since the NFL announced it was looking to sell NFL Network and other media assets, ESPN had been seen as one of the favorites to make a deal. Nearly five years later, a framework is finally in place. The NFL announced Tuesday night that it has entered into a nonbinding agreement with ESPN. Under the terms, ESPN will acquire NFL Network, NFL Fantasy and the rights to distribute the RedZone channel to cable and satellite operators and the league will get a 10% equity stake in ESPN. The league and ESPN still have to negotiate a final agreement and get approval from NFL owners. The agreement will also have to undergo regulatory approvals. “Sometimes great things take a long time to get to the point where it’s right. And we both feel that it is at this stage,” NFL Commissioner Roger Goodell said in a call with The Associated Press. Along with the sale of NFL Network, the NFL and ESPN will have a second nonbinding agreement where the NFL will license to ESPN certain NFL content and other intellectual property that can be used by NFL Network and other assets that have been purchased. “We have been talking about it in earnest for the last few years. But interestingly enough, we started talking about this over a decade ago but nothing really ended up happening. And we got back at it when I came back to Disney after my retirement,” Disney CEO Bob Iger said in a call with the AP. ESPN is expected to launch its direct-to-consumer service before the end of September. The service would give cord-cutters access to all ESPN programs and networks for $29.99 per month. The addition of more NFL programming increases the value. Many viewers will receive the service for free as part of their subscription to cable, satellite and most streaming services. “When I came back to Disney and assessed essentially the future of ESPN, it became clear that ESPN had to launch a bigger and more robust and digital or direct-to-consumer product, not only for the sake of ESPN’s business, but for the sports fan,” Iger said. “And obviously, when you start thinking about high-quality sports content, your eyes immediately head in the direction of the NFL because there’s really nothing more valuable and more popular than that.” NFL Network — which has nearly 50 million subscribers — would be owned and operated by ESPN and would be included in ESPN's direct-to-consumer product. The NFL RedZone channel would be distributed by ESPN to cable and satellite operators. However, the NFL will continue to own, operate and produce the channel as well as retain the rights to distribute the channel digitally. ESPN would also get rights to the RedZone brand, meaning RedZone channels for college football and basketball or other sports could be coming in the future. NFL Fantasy Football would merge with ESPN Fantasy Football, giving ESPN the official fantasy football game of the league. NFL Network will still air seven games per season. Four of ESPN's games, including some that are in overlapping windows on Monday nights, would move to NFL Network. ESPN will license three additional games that will be carried on NFL Network. The league gets a 10% equity stake in ESPN. Aidan O'Connor, a senior vice president at the Prosek Partners marketing firm, estimates the value of that would be $2.2 billion to $2.5 billion. ESPN is currently 80% owned by ABC Inc. as an indirect subsidiary of The Walt Disney Company. The other 20% is owned by Hearst. Once the deal is official and approved, the breakdown of ESPN will be 72% ABC Inc., 18% Hearst and 10% NFL. This isn't the first time the league has had an equity stake in a digital or communications business. It had that in the past with Sirius Satellite Radio and SportsLine. The NFL could also have equity in the newly formed “Paramount Skydance Corporation,” which owns CBS, due to the league's partnership with Skydance. “This is new as far as a partner now operating a business that we built, ran and grew,"" said Hans Schroeder, the NFL’s executive vice president of media distribution. ""It’ll also be a little bit new again with some of the dynamics here, but we’ll continue to balance that in a really arm’s length way where we’ll think about how we manage and work across to all our partners.” The league will continue to own and operate NFL Films, NFL+, NFL.com, the official websites of the 32 teams, the NFL Podcast Network and the NFL FAST Channel (a free ad-supported streaming channel). “The moves align with the NFL’s longstanding ambition to reach $25 billion in annual revenue by 2027 — a target first set in 2010, when league revenue stood at approximately $8.5 billion,” O’Connor said. “Financially, the move also signals to investors that ESPN is doubling down on differentiation and content stickiness by offering a scarce and premium product in a crowded marketplace. Intentionally ceding equity to the NFL transforms ESPN from a media licensee into a true platform partner — with few properties rivaling the league in terms of cultural significance, appointment viewing, audience reach, and monetization efficiency."" Viewers will likely not see any immediate impacts until next year once everything is approved. Besides ESPN, the biggest winner in this could be NFL Network, which had seen reductions in original programming the past couple years. “Total Access,” the network's flagship show since its launch in 2003, ended in May 2024 amid a series of layoffs and cost-cutting moves. “Good Morning Football” also moved from New York, where it had been since its start in 2016, to Southern California last year. NFL Network moved to a broadcast facility across the street from SoFi Stadium in Inglewood, California, in 2021. “The thing that’s exciting for us is that we have put a lot into the network. I think it’s been very effective for fans. We know it’s in good hands,” Goodell said. “They’re innovative, they recognize great production and know how to produce it. They will do a fantastic job of operating the network and taking it to another level.” ___ AP NFL: https://apnews.com/hub/nfl Before you make your next trade, you'll want to hear this. MarketBeat keeps track of Wall Street's top-rated and best performing research analysts and the stocks they recommend to their clients on a daily basis. Our team has identified the five stocks that top analysts are quietly whispering to their clients to buy now before the broader market catches on... and none of the big name stocks were on the list. They believe these five stocks are the five best companies for investors to buy now... See The Five Stocks Here MarketBeat's analysts have just released their top five short plays for August 2025. Learn which stocks have the most short interest and how to trade them. Enter your email address to see which companies made the list."
Mexican investigators suspect organized crime in killing of a top federal official,https://www.marketbeat.com/articles/mexican-investigators-suspect-organized-crime-in-killing-of-a-top-federal-official-2025-08-05/,"CIUDAD VICTORIA, Mexico (AP) — Mexican investigators on Tuesday pointed to organized crime in the killing of a top federal official in the northeastern state of Tamaulipas the previous day, saying it was likely retaliation for the authorities' recent seizures of stolen fuel there. On Monday, gunmen killed Attorney General’s Office Tamaulipas state delegate Ernesto Vásquez Reyna in broad daylight, in the middle of the busiest avenue of the border city of Reynosa. The Attorney General’s Office said in a statement that preliminary information suggested the killing was retaliation by a group it did not name. Images from the scene of the assassination showed a smoldering black SUV and Vásquez Reyna’s body on the pavement. Authorities did not offer details on the attack other than to say that two additional vehicles were involved, and that one of them was recovered. The fuel seizure in July in Reynosa was described as a “great setback” for organized crime. The statement said more than 475,000 gallons (1.8 million liters) of gasoline were seized, along with tanker trucks, pumps and containers for storing the fuel. Reynosa is controlled by a faction of the Gulf cartel known as the “Metros.” Numerous drug cartels have gotten into the business of selling stolen gasoline as another line of illegal revenue. Before you make your next trade, you'll want to hear this. MarketBeat keeps track of Wall Street's top-rated and best performing research analysts and the stocks they recommend to their clients on a daily basis. Our team has identified the five stocks that top analysts are quietly whispering to their clients to buy now before the broader market catches on... and none of the big name stocks were on the list. They believe these five stocks are the five best companies for investors to buy now... See The Five Stocks Here Nuclear energy stocks are roaring. It's the hottest energy sector of the year. Cameco Corp, Paladin Energy, and BWX Technologies were all up more than 40% in 2024. The biggest market moves could still be ahead of us, and there are seven nuclear energy stocks that could rise much higher in the next several months.  To unlock these tickers, enter your email address below."
Unusual Machines: A Speculation With Tailwinds to Lift Its Price,https://www.marketbeat.com/originals/unusual-machines-a-speculation-with-tailwinds-to-lift-its-price/,"Unusual Machines NYSEAMERICAN: UMAC has an unusual story with its once-China-based manufacturing returning to the U.S. The critical takeaway is that this leading provider of advanced drone technology, components, and accessories is now an NDAA-compliant manufacturer that can sell to U.S. government agencies and the military. That is an important factor considering the global drone industry's reliance on China and plans for government spending in 2026. The government is increasing its budget in crucial areas, including defense and modernization, which supports this company's outlook. The U.S. drone market outlook remains strong. The market, valued at around $11 billion in 2025, is projected to grow at a steady double-digit CAGR into the next decade. This will lead to nearly a 200% increase in market size, fueled by growth across various end markets, including both commercial and government sectors. The commercial market will be dominated by media, agriculture, inspection, and delivery, a focus of Unusual Machines. The outlook for Unusual Machines is more robust. With its products supported by government spending, new approvals, an expanding product line, and accelerating use-case growth, the forecast is for hyper-growth, which is likely to be low. Currently, analysts tracked by MarketBeat predict revenue will grow by at least 100% in 2026 and maintain a nearly triple-digit growth rate for the upcoming years. Profitability is also projected and is expected to be achieved by the end of this decade. The institutional and analyst trends are not robust, with the first group owning less than 5% of the stock as of early August, and the other includes only two ratings, but they are bullish. The institutions have been buying on balance since the IPO, and the analysts rate the stock unanimously as a Buy. They see this market advancing by at least 100% from the early August support levels and may also be cautious in their forecasts. The hurdle is the short-sellers. The short-sellers focus on UMAC’s fundamentals and capital needs, capping gains in 2025. The latest data shows short-interest increasing steadily from Q1 to Q3, reaching a record high of 15% in early August. Among the reasons is the company’s decision to sell more shares. Unusual Machines sold another five million shares in July, raising nearly $50 million in capital and further diluting shareholder value. Share sales before the July announcement decreased the count by 162% at the end of the first fiscal quarter. Although there is a risk of further dilution, the balance sheet remains solid. The company’s share sales should leave it with over $50 million in cash at the end of the current quarter, enough for several years at the Q1 cash burn rate, and it has no significant debt. The total liability is roughly 0.2X the Q1 quarter-ending cash, leaving the business in a flexible financial position. Unusual Machines' stock price action suggests it is set to pop when the FQ2 earnings report is released. The market shows the influence of short-sellers, but also demonstrates strong support at the $5 level and increasing support over time. The action in early August is mixed, but it supports an uptrending market and only needs a catalyst to spark another wave of buying. The forecast for Q2 is for another significant year-over-year gain, but for business to slow compared to Q1, which is unlikely given the demand trends. The likely scenario is that Unusual Machines will reveal better-than-forecasted results and provide a favorable outlook, sparking another upswing in the share price when it does.  Before you consider Unusual Machines, you'll want to hear this. MarketBeat keeps track of Wall Street's top-rated and best performing research analysts and the stocks they recommend to their clients on a daily basis. MarketBeat has identified the five stocks that top analysts are quietly whispering to their clients to buy now before the broader market catches on... and Unusual Machines wasn't on the list. While Unusual Machines currently has a Buy rating among analysts, top-rated analysts believe these five stocks are better buys. View The Five Stocks Here Discover the top 7 AI stocks to invest in right now. This exclusive report highlights the companies leading the AI revolution and shaping the future of technology in 2025."
Zebra Technologies: Riding the Automation Wave to Profits,https://www.marketbeat.com/originals/zebra-technologies-riding-the-automation-wave-to-profits/,"Zebra Technologies' NASDAQ: ZBRA stock price advanced following the Q2 earnings release to confirm a market reversal and increase the odds it will set a fresh high soon. The company is well-positioned to benefit from automation and AI, and the results reflect it. The company’s remote and data-capture products assist front-line workers, improving efficiency and accuracy to drive revenue and profits for their users. The expansion of 5G networks and the rise of AI-powered computing align with its success, enabling improved functions and aiding the increase in demand. The analysts' activity in June and July was bullish, including numerous price target increases and several upgrades that foreshadowed the Q2 strength. The company’s results affirmed the confidence, which included $1.29 billion in revenue and $3.61 in adjusted EPS, both above the analyst forecasts. The revenue is worth a 6.2% gain compared to last year and 6.3% organically, with growth present in both operating segments. The EVM or Enterprise Visibility and Mobility segment grew by 6.5%, while AIT or Asset Intelligence Tracking grew by a slightly cooler 5.8%. The margin news is better. Tariffs impacted the company’s gross margin, but far less than anticipated, and improved adjusted operating leverage compounded the effect on the bottom line. The adjusted EBITDA margin improved by 10 basis points, a slim improvement to be sure, but sufficient to leave the adjusted EPS at $3.61 or more than 25 cents better than analysts' consensus had forecast and up 13.5% compared to last year. The critical details include the cash flow and free cash flow, which are sufficient to maintain balance sheet health while the company reinvests in growth, and the guidance. Zebra Technologies' guidance is central to the stock price advance. The company improved its outlook for the year, raising the forecasts for revenue and earnings to above the consensus reported by MarketBeat. That alone is sufficient to keep the analysts happy, and the guidance may be cautious. Not only is there a recent acquisition to aid with cost-efficiency, revenue growth, and cross-selling opportunities, but others are in the works. The company announced its intention to buy Elo Touch Solutions. Elo provides touch screens, software, and services globally and is a natural fit for Zebra’s portfolio. Zebra Technologies is primarily self-funding its acquisitions and can continue doing so. At the end of Q2, the balance sheet highlights include a slight reduction in cash and an increase in debt offset by steady assets, reduced total liability, low leverage, and a nearly 1% increase in equity. The Elo Touch solution deal is worth $1.3 billion and will be paid with cash on hand and the revolving credit facility, a debt that will be quickly repaid. Other pertinent details include the company’s ability to repurchase shares while investing in growth. The buybacks aren’t robust, but they reduce the count incrementally each quarter to provide additional leverage for shareholders. The technical action in ZBRA stock is promising. The market exhibited some volatility over the preceding 18 months but appears to have a solid bottom and is in rebound mode in early August. The Q2 results and guidance update sent the market up by more than 5%, extending the rebound with a high-conviction move that set a multi-month high. Assuming the market follows through on the signal, Zebra's stock price should advance to the $400 level by year’s end and potentially move higher in early 2026. The consensus in early August assumes the stock was fairly valued ahead of the release, but the trends are leading to the high-end range and a move above $400.  Before you consider Zebra Technologies, you'll want to hear this. MarketBeat keeps track of Wall Street's top-rated and best performing research analysts and the stocks they recommend to their clients on a daily basis. MarketBeat has identified the five stocks that top analysts are quietly whispering to their clients to buy now before the broader market catches on... and Zebra Technologies wasn't on the list. While Zebra Technologies currently has a Moderate Buy rating among analysts, top-rated analysts believe these five stocks are better buys. View The Five Stocks Here Discover the next wave of investment opportunities with our report, 7 Stocks That Will Be Magnificent in 2025. Explore companies poised to replicate the growth, innovation, and value creation of the tech giants dominating today's markets."
BC-Nikkei 225 Futures,https://www.marketbeat.com/articles/bc-nikkei-225-futures-2025-08-04/,"NEW YORK (AP) — Prices as of 5:30:00 PM Tuesday, August 05. Nikkei 225 (Yen) (CME) 500 yen x Nikkei 225 YEN futures price. Estimated volume: 14,273 Monday's volume: 14,273 Open Interest: 82,976 Open Interest Change: -51616 Before you make your next trade, you'll want to hear this. MarketBeat keeps track of Wall Street's top-rated and best performing research analysts and the stocks they recommend to their clients on a daily basis. Our team has identified the five stocks that top analysts are quietly whispering to their clients to buy now before the broader market catches on... and none of the big name stocks were on the list. They believe these five stocks are the five best companies for investors to buy now... See The Five Stocks Here Enter your email address and we'll send you MarketBeat's list of seven best retirement stocks and why they should be in your portfolio."
BC-Select Stock Indices,https://www.marketbeat.com/articles/bc-select-stock-indices-2025-08-04/,
