title,link,content
Customers seeking deals gave Amazon's Prime Day and competing sales a solid start,https://www.marketbeat.com/articles/customers-seeking-deals-gave-amazons-prime-day-and-competing-sales-a-solid-start-2025-07-09/,"NEW YORK (AP) — The first day of Amazon's Prime Day event and competing retail sales that kicked off on Tuesday drove solid online spending compared to a year earlier, according to two data sources. Adobe Digital Insights, which tracks visits to e-commerce sites, reported that U.S. consumers spent $7.9 billion at online stores on Tuesday, a 9.9% increase from the comparable day last year. Retailers offered discounts in the range of 9% to 23%, on par with July 2024 sales events, Adobe said. Shoppers appeared especially eager to take advantage of deals on appliances, electronics and home improvement products, the data company said. Online sales of appliances were 135% higher than last month's daily average, according to Adobe's data. Back-to-school items also were popular. Spending increased threefold on school supplies like backpacks, lunchboxes and stationery, and was two times higher for college dorm fixtures like mattresses, mini refrigerators and microwave over, Adobe said. Amazon doubled the length of Prime Day to four days this year. Walmart also added two more days to its summer deals event, which started Tuesday as well. Retail analysts are evaluating this week's sales for clues on whether President Donald Trump's trade policy and unpredictable tariffs affect prices and consumer behavior. Adobe noted that strong deals drove many shoppers to “trade up” to higher-ticket items. Across all categories the company tracks, the share of the most expensive goods increased by 20%, compared to average levels year to date. According to consumer data company Numerator, the average Prime Day order on Tuesday cost $58.37. However, the average household cost amounted to more than $106 as of 4 p.m. Eastern time because 42% of households participating in Prime Day placed more than two orders, the company said. Numerator tracks U.S. retail prices through sales receipts, online account activity and other information from a panel of 200,000 shoppers. Physical stores in the U.S. may see spillover traffic from online sales events this week as budget-minded customers comparison shop in search of the lowest prices, according to R.J. Hottovy, head of analytical research at Placer.ai. The location data company tracks people’s movements based on cellphone usage. “We do still have a price-sensitive consumer that is actively monitoring price hikes and anything related to tariffs,” Hottovy said. Despite ongoing economic concerns, Adobe said it expected online sales to spur a record $23.8 billion in spending from July 8 to July 11, which would represent 28.4% growth year over year. Adobe’s numbers are not adjusted for inflation. However, the company said new demand, not rising prices, largely accounts for growing sales figures so far this year. Seattle-based Amazon does not disclose how much it earns during Prime Day but said it would share some results from the four-day event on Saturday Before you consider Amazon.com, you'll want to hear this. MarketBeat keeps track of Wall Street's top-rated and best performing research analysts and the stocks they recommend to their clients on a daily basis. MarketBeat has identified the five stocks that top analysts are quietly whispering to their clients to buy now before the broader market catches on... and Amazon.com wasn't on the list. While Amazon.com currently has a Moderate Buy rating among analysts, top-rated analysts believe these five stocks are better buys. View The Five Stocks Here Enter your email address and we'll send you MarketBeat's guide to investing in 5G and which 5G stocks show the most promise."
Do They Know Something? Insiders & Congress Buy UnitedHealth,https://www.marketbeat.com/originals/do-they-know-something-insiders-and-congress-buy-unitedhealth/,"UnitedHealth Group NYSE: UNH has spent a significant amount of time in the sick bay for the first half of 2025, but it’s showing signs of recovery. Let’s get the bad news out of the way first. The Eden Prairie, Minn.-based company has fallen 40% year-to-date and has plummeted 42.2% in the past three months alone, with most of that decline occurring in April and May. Over the past month, UNH shares have remained relatively flat, with a 0.1% gain. Despite a turbulent start to the year, the healthcare services giant’s recent leadership changes and insider investments signal a potential path to recovery. And investors would be wise to pay attention: when executives are buying big, it often signals the bottom is in. So what’s ailing UNH? Primarily, UnitedHealth's stock has suffered over multiple downbeat issues, including a headline-grabbing cybersecurity attack, soft earnings, federal regulatory headaches, and the resignation of CEO Andrew Witty, who helmed the firm since 2021 (and who served as CEO at GlaxoSmithKline from 2008 to 2017). It’s the last issue that resonates right now, especially given the UNH share bounce back of late. Witty was replaced by former UNH CEO Stephen J. Hemsley on May 13, who immediately offered an interesting outlook on the healthcare company’s financial fortunes. “UnitedHealth Group has tremendous opportunities to grow as we continue to help improve health care and to perform to our potential, and, in so doing, return to our long-term growth objective of 13 to 16 percent,” Helmsley stated. Almost simultaneously, company insiders and Congressional leading lights began snapping up shares of UNH stock. Georgia Congressional Representative Marjorie Taylor Greene bought between $15,000 and $50,000 shares of UNH on May 14 and purchased between $1,001 and $15,000 on May 16. And she’s not alone. Texas Republican Congressman Michael McCaul purchased up to $50,000 in UNH shares on May 16, while Democratic Representatives Mo Khanna and Gilbert Cisneros also bought UnitedHealth shares, but did so in early 2025. UNH executives are stacking company shares. On May 16, Hemsley bought $25 million worth of UNH stock, locking in 86,700 shares at an average price of $288.57 each. Additionally, company CFO John Rex and Director Kristen Gill were substantial UNH share buyers on May 16, 2025. So what do Congressional portfolio builders and UnitedHealth’s C-suite know that the investing public doesn’t know? The answer is ‘nothing out of the ordinary,’ especially from UNH executives. UnitedHealth’s leadership has stated that the company is on track for robust growth by 2026, while Hemsley is expected to reinstate UNH’s forward financial guidance, which was previously abandoned by the previous regime due to a series of adverse news reports and sluggish earnings. In an early June meeting with shareholders, Hemsley said his team was committed to winning back their trust and confidence. He also promised to review underperforming company areas, such as pharmacy services and risk management. “With our second quarter report on July 29, we will establish a prudent 2025 earnings outlook and offer initial perspectives for 2026,” Hemsley told shareholders. “Across the enterprise, our pricing decisions and benefit designs for the next year are being fully shaped—with an abundance of respect—for the trend factors we noted in May and the environment we find ourselves in today and see going forward.” Another immediate focus area will be on pricing disciplines. Hemsley acknowledged past missteps in forecasting care activity and costs, noting that these errors led to unsustainable growth. The company is now overhauling its forecasting methods to improve accuracy and financial oversight. Moreover, Hemsley said UNH needs to move past problems with financial guidance, data security issues, and a U.S. Justice Department probe into alleged fraud, and focus on an operational and financial turnaround. Analysts believe Hemsley can do the job, giving UNH stock a consensus Moderate Buy rating. Of the 25 analysts tracked by MarketBeat, 16 have issued a Buy rating for UNH, with only one giving it a Sell. The average price target is $415.57, signaling a potential upside of 35.61% from where it is currently trading. UBS analyst AJ Rice is among the recent backers of UnitedHealth, even as he cut his one-year price target of UNH shares from $400 to $385 with a Buy call on the stock. He thinks the new management team's measured approach, especially on its upcoming guidance call, will pacify shareholders and promote stability to interested investors. “We believe the company wants to offer a new 2025 outlook that it can be assured of delivering and, therefore, we expect the number to be even more conservative than normal when all is said and done,” Rice stated in a recent research note. Before you consider UnitedHealth Group, you'll want to hear this. MarketBeat keeps track of Wall Street's top-rated and best performing research analysts and the stocks they recommend to their clients on a daily basis. MarketBeat has identified the five stocks that top analysts are quietly whispering to their clients to buy now before the broader market catches on... and UnitedHealth Group wasn't on the list. While UnitedHealth Group currently has a Moderate Buy rating among analysts, top-rated analysts believe these five stocks are better buys. View The Five Stocks Here Unlock the timeless value of gold with our exclusive 2025 Gold Forecasting Report. Explore why gold remains the ultimate investment for safeguarding wealth against inflation, economic shifts, and global uncertainties. Whether you're planning for future generations or seeking a reliable asset in turbulent times, this report is your essential guide to making informed decisions."
The Czech Republic bans DeepSeek in state administration over cybersecurity concerns,https://www.marketbeat.com/articles/the-czech-republic-bans-deepseek-in-state-administration-over-cybersecurity-concerns-2025-07-09/,"PRAGUE (AP) — The Czech Republic has banned the use of any products by the Chinese AI startup DeepSeek in state administration over cybersecurity concerns, authorities said Wednesday. Czech Prime Minister Petr Fiala said the government acted after receiving a warning from the national cybersecurity watchdog, which noted a threat of unauthorized access to users data because the firm is obliged to cooperate with Chinese state authorities. The move follows similar steps made by some other countries that aimed to protect users’ data, including Italy, which in January blocked access to the chatbot, and also Australia. The Czech government in 2018 stopped using the hardware and software made by Chinese telecoms company Huawei and another Chinese telecommunications company, ZTE, after a warning they posed a security threat. DeepSeek was founded in 2023 in Hangzhou, China, and released its first AI large language model later that year. Before you make your next trade, you'll want to hear this. MarketBeat keeps track of Wall Street's top-rated and best performing research analysts and the stocks they recommend to their clients on a daily basis. Our team has identified the five stocks that top analysts are quietly whispering to their clients to buy now before the broader market catches on... and none of the big name stocks were on the list. They believe these five stocks are the five best companies for investors to buy now... See The Five Stocks Here With the proliferation of data centers and electric vehicles, the electric grid will only get more strained. Download this report to learn how energy stocks can play a role in your portfolio as the global demand for energy continues to grow."
"Trump tariffs goods from Brazil at 50%, citing 'witch hunt' trial against country's former president",https://www.marketbeat.com/articles/trump-sends-out-tariff-letters-to-6-more-countries-but-he-avoids-major-us-trade-partners-2025-07-09/,"WASHINGTON (AP) — President Donald Trump singled out Brazil for import taxes of 50% on Wednesday for its treatment of its former president, Jair Bolsonaro, showing that personal grudges rather than simple economics are a driving force in the U.S. leader's use of tariffs. Trump avoided his standard form letter with Brazil, specifically tying his tariffs to the trial of Bolsonaro, who is charged with trying to overturn his 2022 election loss. Trump has described Bolsonaro as a friend and hosted the former Brazilian president at his Mar-a-Lago resort when both were in power in 2020. “This Trial should not be taking place,” Trump wrote in the letter posted on Truth Social. “It is a Witch Hunt that should end IMMEDIATELY!” There is a sense of kinship as Trump was indicted in 2023 for his efforts to overturn the results of the 2020 U.S. presidential election. The U.S. president addressed his tariff letter to Brazilian President Luiz Inacio Lula da Silva, who bested Bolsonaro in 2022. Lula responded in a forceful statement that said Trump's tariffs would trigger the country's economic reciprocity law, which allows trade, investment and intellectual property agreements to be suspended against countries that harm Brazil's competitiveness. He noted that the U.S. has had a trade surplus of more than $410 billion with Brazil over the past 15 years. “Brazil is a sovereign country with independent institutions that will not accept being taken for granted by anyone,” Lula said. Bolsonaro testified before the country’s Supreme Court in June over the alleged plot to remain in power after his 2022 election loss. Judges will hear from 26 other defendants in the coming months, and legal analysts say a decision could come as early as September. The country’s electoral authorities have already barred Bolsonaro from running for office until 2030. The former president did not comment about Trump’s tariff decision on his social media channels, but wrote that he is being politically persecuted. In his statement, Lula defended the country's legal system, saying the “proceedings against those who planned the coup d’etat is a competence of the Brazilian judiciary and is not subject to interference or threats that harm the independence of national institutions.” Trump also objected to Brazil's Supreme Court fining of social media companies, saying the temporary blocking last year amounted to “SECRET and UNLAWFUL Censorship Orders.” Trump said he is launching an investigation as a result under Section 301 of the Trade Act of 1974, which applies to countries with trade practices that are deemed unfair to U.S. companies. Among the companies the Supreme Court fined was X, which was not mentioned specifically in Trump's letter. X is owned by Elon Musk, Trump's multibillionaire backer in the 2024 election whose time leading Trump's Department of Government Efficiency recently ended and led to a public feud over the U.S. president's deficit-increasing budget plan. Trump also owns a social media company, Truth Social. “In Brazil, freedom of speech is not mistaken by aggression or violent behavior,"" Lula said in his statement. ""To operate in our country, every company, local or foreign, must be subjected to Brazilian legislation.” Brazilian lawmakers allied with Lula blamed Bolsonaro and two of his sons, congressman Eduardo Bolsonaro and Sen. Flávio Bolsonaro, for Trump’s tariff action. Sen. Lindbergh Farias, the whip of Lula’s Workers’ Party in the Senate, said on social media that the Bolsonaros “must be very happy to harm Brazil, our economy and our jobs.” The Brazil letter was a reminder that politics and personal relations with Trump matter just as much as any economic fundamentals. And while Trump has said the high tariff rates he’s setting are based on trade imbalances, it was unclear by his Wednesday actions how the countries being targeted would help to reindustrialize America. The tariffs starting Aug. 1 would be a dramatic increase from the 10% rate that Trump levied on Brazil as part of his April 2 “Liberation Day” announcement. In addition to oil, Brazil sells orange juice, coffee, iron and steel to the U.S., among other products. The U.S. ran a $6.8 billion trade surplus with Brazil last year, according to the Census Bureau. Trump initially announced his broad tariffs by declaring an economic emergency, arguing under a 1977 law that the U.S. was at risk because of persistent trade imbalances. But that rationale becomes problematic in this particular case, as Trump is linking his tariffs to the Bolsonaro trial and the U.S. exports more to Brazil than it imports. Trump also sent letters Wednesday to the leaders of seven other nations. None of them — the Philippines, Brunei, Moldova, Algeria, Libya, Iraq and Sri Lanka — is a major industrial rival to the United States. Most economic analyses say the tariffs will worsen inflationary pressures and subtract from economic growth, but Trump has used the taxes as a way to assert the diplomatic and financial power of the U.S. on both rivals and allies. His administration is promising that the taxes on imports will lower trade imbalances, offset some of the cost of the tax cuts he signed into law on Friday and cause factory jobs to return to the United States. Trump, during a White House meeting with African leaders, talked up trade as a diplomatic tool. Trade, he said, “seems to be a foundation” for him to settle disputes between India and Pakistan, as well as Kosovo and Serbia. “You guys are going to fight, we’re not going to trade,” Trump said. “And we seem to be quite successful in doing that.” Trump said the tariff rates in his letters were based on “common sense” and trade imbalances, even though the Brazil letter indicated otherwise. Trump suggested he had not thought of penalizing the countries whose leaders were meeting with him in the Oval Office — Liberia, Senegal, Gabon, Mauritania and Guinea-Bissau — as “these are friends of mine now.” Countries are not complaining about the rates outlined in his letters, he said, even though those tariffs have been generally close to the ones announced April 2 that rattled financial markets. The S&P 500 stock index rose Wednesday. “We really haven’t had too many complaints because I’m keeping them at a very low number, very conservative as you would say,” Trump said. Officials for the European Union, a major trade partner and source of Trump's ire on trade, said Tuesday that they are not expecting to receive a letter from Trump listing tariff rates. The Republican president started the process of announcing tariff rates on Monday by hitting two major U.S. trading partners, Japan and South Korea, with import taxes of 25%. According to Trump's Wednesday letters, imports from Libya, Iraq, Algeria and Sri Lanka would be taxed at 30%, those from Moldova and Brunei at 25% and those from the Philippines at 20%. The tariffs would start Aug. 1. The Census Bureau reported that last year the U.S. ran a trade imbalance on goods of $1.4 billion with Algeria, $5.9 billion with Iraq, $900 million with Libya, $4.9 billion with the Philippines, $2.6 billion with Sri Lanka, $111 million with Brunei and $85 million with Moldova. The imbalance represents the difference between what the U.S. exported to those countries and what it imported. Taken together, the trade imbalances with those seven countries are essentially a rounding error in a U.S. economy with a gross domestic product of $30 trillion. The letters were posted on Truth Social after the expiration of a 90-day negotiating period with a baseline levy of 10%. Trump is giving countries more time to negotiate with his Aug. 1 deadline, but he has insisted there will be no extensions for the countries that receive letters. The president threatened additional tariffs on any country that attempts to retaliate. ___ Savarese reported from Rio de Janeiro. Associated Press writers David McHugh in Frankfurt, Germany, and Eileen Ng in Kuala Lumpur, Malaysia, contributed to this report. Before you make your next trade, you'll want to hear this. MarketBeat keeps track of Wall Street's top-rated and best performing research analysts and the stocks they recommend to their clients on a daily basis. Our team has identified the five stocks that top analysts are quietly whispering to their clients to buy now before the broader market catches on... and none of the big name stocks were on the list. They believe these five stocks are the five best companies for investors to buy now... See The Five Stocks Here MarketBeat's analysts have just released their top five short plays for July 2025. Learn which stocks have the most short interest and how to trade them. Enter your email address to see which companies made the list."
Mattel introduces its first Barbie with Type 1 diabetes,https://www.marketbeat.com/articles/mattel-introduces-its-first-barbie-with-type-1-diabetes-2025-07-09/,"NEW YORK (AP) — Mattel has introduced its first Barbie representing a person with Type 1 diabetes, as part of wider efforts from the toy maker to increase inclusivity among its dolls. In an announcement Tuesday, Mattel said it had partnered with Breakthrough T1D — a Type 1 diabetes research and advocacy organization formerly known as Juvenile Diabetes Research Foundation, or JDRF — to ensure that the design of the doll “truly captures the community."" That includes accessories that “accurately reflect the medical equipment"" people with Type 1 diabetes may need, the California-based company noted. “Visibility matters for everyone facing Type 1 diabetes,” Emily Mazreku, director of marketing strategy at Breakthrough T1D, said in an accompanying announcement. And as a mother who lives with Type 1 diabetes, she added, “it means everything to have Barbie helping the world see T1D and the incredible people who live with it.” The new Barbie wears continuous glucose monitor (CGM), a device that tracks blood sugar levels, on her arm — while holding a phone displaying an accompanying app. She also has an insulin pump attached to her waist. And the doll carries a blue purse that can be used to carry other essential supplies or snacks on the go. The Barbie's outfit is blue, too — with polka dots on a matching top and skirt set. Mattel says that this color and design are nods to symbols for diabetes awareness. This new doll “enables more children to see themselves reflected in Barbie,” Mattel wrote Tuesday, and is part of the company's wider Fashionistas line committed to inclusivity. The line features Barbies with various skin tones, hair colors and textures, disabilities, body types and more. Previously-introduced Fashionistas include a Ken doll with a prosthetic leg and a Barbie with hearing aids. Mattel also introduced its first doll with Down syndrome in 2023. According to the Centers for Disease Control and Prevention, 38.4 million Americans of all ages — amounting to about 11.6% of the U.S. population — were estimated to have diabetes as of 2021, the latest year with data available. About 2 million had Type 1 diabetes, including about 304,000 children and teens younger than 20. Barbie's new doll with Type 1 diabetes was also introduced at Breakthrough T1D's 2025 Children’s Congress held in Washington, D.C. this week, where the organization is advocating for continued federal research funding. This year, Breakthrough T1D has been particularly focused on the Special Diabetes Program, which is currently set to expire in September. Before you make your next trade, you'll want to hear this. MarketBeat keeps track of Wall Street's top-rated and best performing research analysts and the stocks they recommend to their clients on a daily basis. Our team has identified the five stocks that top analysts are quietly whispering to their clients to buy now before the broader market catches on... and none of the big name stocks were on the list. They believe these five stocks are the five best companies for investors to buy now... See The Five Stocks Here Enter your email address and we'll send you MarketBeat's guide to investing in 5G and which 5G stocks show the most promise."
