title,link,content
Trump opens the door for private equity and crypto as 401(k) retirement plan options,https://www.marketbeat.com/articles/trump-opens-the-door-for-private-equity-and-crypto-as-401k-retirement-plan-options-2025-08-07/,"NEW YORK (AP) — Millions of Americans saving for retirement through 401(k) accounts could have the option of putting their money in higher-risk private equity and cryptocurrency investments, according to an executive order signed Thursday by President Donald Trump that could give those financial players long-sought access to a pool of funds worth trillions. There is no immediate change in how people invest part of their work earnings. Federal agencies would need to rewrite rules and regulations to allow the expanded choices, and that would take months or more to complete. But once done, employers could offer a broader array of mutual funds and investments to workers, according to the White House. New plans could invest in alternative assets, particularly private equity, cryptocurrencies and real estate. The Republican president's order directs the Labor Department and other agencies to redefine what would be considered a qualified asset under 401(k) retirement rules. Americans' retirement plans are governed by a law known as the Employee Retirement Income Security Act of 1974, better known as ERISA. Employers are required by law to offer retirement options that are in the best interest of their employees, not Wall Street. Most retirement plans for Americans are made up of stock and bond investments, and to a much lesser extent, cash and heavily traded commodities such as gold. Trump's move rewards both the $5 trillion private equity industry, which for decades has wanted to compete for a role in retirement plans, and the cryptocurrency industry, whose executives strongly supported Trump’s 2024 campaign as they aimed for more mainstream acceptance among Americans. The price of bitcoin was up 2% on Thursday to $116,542 and has nearly doubled since Trump was elected. Under Democratic President Joe Biden, federal regulators were to treat cryptocurrency investments with “extreme care” because of the extreme volatility of crypto. It is not uncommon for bitcoin, ethereum and other big cryptocurrencies to move up or down 10% in a single day, whereas a 2% or 3% single-day move in the stock market would be considered historic. For cryptocurrency companies, which donated millions to Trump’s campaign as well as his inauguration, one goal was to get their industry qualified under ERISA. Coinbase, one of the largest crypto companies in the United States, was also a major donor toward Trump’s military parade in Washington this summer. Under Trump, the Securities and Exchange Commission dropped its lawsuit against Coinbase, where the Biden administration said crypto should be treated as a security. Crypto is particularly popular among young Americans. While volatile, bitcoin has generally moved upward since it was created by an anonymous programmer nearly 20 years ago. “It was inevitable that bitcoin would make its way into American 401(k)'s,” said Cory Klippsten, the CEO of Swan Bitcoin. “As fiduciaries realize bitcoin’s risk-adjusted upside over the long term, we’ll see growing allocations, especially from younger, tech-savvy workers who want hard money, not melting ice cubes.” Private equity firms rely heavily on high-net-worth individuals and state and private pension plans, which have extremely long investment timelines. But having access to Americans' retirement assets would open up a deep pool of cash. Blackstone CEO Steve Schwarzman has told investors going back to at least 2017 that it was a “dream” of his and the industry to be able to draw upon these retirement assets. Previous administrations, Republican and Democrat, have agreed that private equity investments, which can be riskier, more expensive and less liquid than traditional stock and bond market mutual funds, should not be included in 401(k) plans. The average historic annual return on private equity assets going back to 1990 is roughly 13%, net of fees, according to Cambridge Associates. The S&P 500 index has had an approximate annual return, including dividends, of roughly 10.6% in the same period of time. However, private equity assets tend to be locked up for years, because the companies underlying the assets have to be sold on the private market, making them highly illiquid compared to stocks, which can be sold in a day. “We look forward to working with the Trump Administration on a thoughtful framework that expands access to alternatives for retirement savers, offering Americans more diversification and investment options with appropriate investor guardrails,” said Bryan Corbett, the president and CEO of the Managed Funds Association, which is the trade group for the private equity industry. Even after the regulations are written, it will take time for major retirement plan companies, such as Fidelity, Vanguard, T. Rowe Price, and others, to develop appropriate funds for employers to use. Employers are unlikely to revise their retirement plan options quickly, so it may take several years before crypto and private equity investments become mainstream in an individual’s retirement plan. “While Vanguard has not committed to launching a product for defined contribution plans, Vanguard is dedicated to educating retirement investors to ensure a clear understanding of the opportunities and risks of investing in private assets,” the company said in a statement. ___ Before you make your next trade, you'll want to hear this. MarketBeat keeps track of Wall Street's top-rated and best performing research analysts and the stocks they recommend to their clients on a daily basis. Our team has identified the five stocks that top analysts are quietly whispering to their clients to buy now before the broader market catches on... and none of the big name stocks were on the list. They believe these five stocks are the five best companies for investors to buy now... See The Five Stocks Here Thinking about investing in Meta, Roblox, or Unity? Enter your email to learn what streetwise investors need to know about the metaverse and public markets before making an investment."
New Trump order could open up Americans’ 401(k) retirement accounts to invest in private equity and cryptocurrencies,https://www.marketbeat.com/articles/new-trump-order-could-open-up-americans-401k-retirement-accounts-to-invest-in-private-equity-and-cryptocurrencies-2025-08-07/,"NEW YORK (AP) — New Trump order could open up Americans’ 401(k) retirement accounts to invest in private equity and cryptocurrencies. Before you make your next trade, you'll want to hear this. MarketBeat keeps track of Wall Street's top-rated and best performing research analysts and the stocks they recommend to their clients on a daily basis. Our team has identified the five stocks that top analysts are quietly whispering to their clients to buy now before the broader market catches on... and none of the big name stocks were on the list. They believe these five stocks are the five best companies for investors to buy now... See The Five Stocks Here Enter your email address and we'll send you MarketBeat's list of seven stocks and why their long-term outlooks are very promising."
Trump nominates top economic adviser Stephen Miran to 4-month term at Federal Reserve,https://www.marketbeat.com/articles/trump-nominates-top-economic-adviser-stephen-miran-to-4-month-term-at-federal-reserve-2025-08-07/,"WASHINGTON (AP) — Trump nominates top economic adviser Stephen Miran to 4-month term at Federal Reserve. Before you make your next trade, you'll want to hear this. MarketBeat keeps track of Wall Street's top-rated and best performing research analysts and the stocks they recommend to their clients on a daily basis. Our team has identified the five stocks that top analysts are quietly whispering to their clients to buy now before the broader market catches on... and none of the big name stocks were on the list. They believe these five stocks are the five best companies for investors to buy now... See The Five Stocks Here Nuclear energy stocks are roaring. It's the hottest energy sector of the year. Cameco Corp, Paladin Energy, and BWX Technologies were all up more than 40% in 2024. The biggest market moves could still be ahead of us, and there are seven nuclear energy stocks that could rise much higher in the next several months.  To unlock these tickers, enter your email address below."
Constellation Energy’s Earnings Beat Signals a New Era,https://www.marketbeat.com/originals/constellation-energys-earnings-beat-signals-a-new-era/,"Constellation Energy NASDAQ: CEG delivered a solid second-quarter earnings report on Aug. 7, beating analyst estimates and reinforcing its crucial role in the digital economy. This strong performance is the latest chapter in a compelling story that has sent its stock soaring over 87% in the past year. The company's strategy is clear and potent: leverage its vast, carbon-free nuclear fleet to satisfy the immense energy appetite of the artificial intelligence (AI) and data center industries. While Constellation’s forward outlook has rarely been brighter, the stock's remarkable rally has pushed its valuation to new heights, leading investors to ask a critical question: Is the immense potential of AI already built into Constellation Energy’s share price? The AI revolution runs on electricity, and it requires massive amounts of reliable, 24/7 baseline power. As technology companies also face mounting pressure to meet sustainability goals, the demand for clean, firm energy has skyrocketed. This market dynamic has created a perfect storm for Constellation, whose nuclear fleet, the largest in the U.S., is uniquely positioned to deliver this exact product. Recent achievements provide compelling evidence of this strategy in action: While Constellation's growth prospects are exciting, its investment profile is anchored by powerful financial and policy guardrails that mitigate risk. The most significant of these is the federal nuclear Production Tax Credit (PTC). Solidified with strong bipartisan support, the PTC program provides a government-backed revenue floor for the company's nuclear fleet through 2032. This policy offers exceptional earnings stability and insulates the company’s foundational business from the volatility of commodity markets, giving investors a rare degree of confidence and visibility. This policy backstop is paired with strong financial discipline. Constellation maintains an investment-grade balance sheet with a healthy debt-to-equity ratio (D/E) of 0.79. Furthermore, management is actively signaling its confidence in future cash flows through shareholder-friendly actions. In the second quarter, the company initiated a $400 million accelerated share repurchase program and has publicly committed to a 10% dividend increase for 2025. This combination of a federal safety net and prudent capital management creates a reinforced foundation that supports the company’s ambitious growth strategy. After its meteoric rise, Constellation no longer carries the valuation of a typical utility sector company. Trading at a price-to-earnings ratio (P/E) of approximately 35x, the stock commands a significant premium over its sector peers. This high valuation is the central debate for investors today. The argument for the premium is that Constellation has transcended its traditional utility classification. The market is increasingly viewing it as a critical AI infrastructure provider, an indispensable part of the digital supply chain. Much like a data center REIT that owns the physical buildings or a semiconductor firm that makes the chips, Constellation provides the essential resource that powers the entire ecosystem. From this perspective, its valuation is being benchmarked against high-growth technology enablers, not slow-and-steady power companies. This view is gaining traction on Wall Street. While the average analyst price target of $309.29 has been eclipsed by the stock’s rapid appreciation, high-end targets now reach $390. This indicates that some analysts believe the re-rating is justified and that there is still significant upside as the company continues to execute on its AI-driven strategy. Constellation Energy has masterfully positioned itself at the intersection of the clean energy transition and the AI revolution. Its second-quarter results are powerful evidence that the company’s strategy is working. The company has a clear growth runway, powered by durable demand from the world’s largest technology firms and fortified by supportive government policy. The primary challenge for investors now is the stock's valuation, which has already baked in a tremendous amount of future success. Therefore, the focus shifts to continued, flawless execution. The upcoming closing of the Calpine acquisition and the announcement of new data center contracts will be critical milestones for validating and ultimately growing into the premium valuation the market has awarded Constellation Energy. Before you consider Constellation Energy, you'll want to hear this. MarketBeat keeps track of Wall Street's top-rated and best performing research analysts and the stocks they recommend to their clients on a daily basis. MarketBeat has identified the five stocks that top analysts are quietly whispering to their clients to buy now before the broader market catches on... and Constellation Energy wasn't on the list. While Constellation Energy currently has a Moderate Buy rating among analysts, top-rated analysts believe these five stocks are better buys. View The Five Stocks Here Looking for the next FAANG stock before everyone has heard about it? Enter your email address to see which stocks MarketBeat analysts think might become the next trillion dollar tech company."
BC-OILS,https://www.marketbeat.com/articles/bc-oils-2025-08-04/,Get investing news alerts:Sign Up
BC-Gold-Silver,https://www.marketbeat.com/articles/bc-gold-silver-2025-08-04/,Get analyst upgrade alerts:Sign Up
EPA cancels $7 billion Biden-era grant program to boost solar energy,https://www.marketbeat.com/articles/epa-cancels-7-billion-biden-era-grant-program-to-boost-solar-energy-2025-08-07/,"WASHINGTON (AP) — The Environmental Protection Agency on Thursday terminated a $7 billion grant program intended to help pay for residential solar projects for more than 900,000 lower-income U.S. households, in the latest Trump administration move hindering the nation’s shift to cleaner energy. The funding, part of the Biden-era's Solar for All program, was awarded to 60 recipients including states, tribes and regions for investments such as rooftop solar and community solar gardens. Solar, a renewable energy, is widely regarded as a way to introduce cleaner power onto the electrical grid and lower energy bills for American consumers. Under Republican President Donald Trump, officials have pursued dozens of deregulatory measures related to federal rules intended to protect clean air and water. Last week, the EPA proposed rescinding the agency’s “endangerment finding” which serves as the scientific and legal basis for regulating planet-warming greenhouse gas emissions. The administration has taken steps to bolster fossil fuels such as coal, oil and natural gas as it pursues American ""energy dominance in the global market. EPA Administrator Lee Zeldin said in a statement on social media that authority for the solar program was eliminated under the tax-and-spending law signed by Trump last month. It eliminated the Greenhouse Gas Reduction Fund, approved under the 2022 Inflation Reduction Act, that set aside $20 billion for community development projects to boost renewable energy and an additional $7 billion for the solar program. “The bottom line is this: EPA no longer has the statutory authority to administer the program or the appropriated funds to keep this boondoggle alive,″ Zeldin said. “Today, the Trump EPA is announcing that we are ending Solar for All for good, saving US taxpayers ANOTHER $7 BILLION!” Sen. Bernie Sanders, I-Vt, who introduced the Solar for All program to cut electric bills for working families, said Zeldin’s action was illegal. “Solar for All means lower utility bills, many thousands of good-paying jobs and real action to address the existential threat of climate change,″ Sanders said in a statement. ”At a time when working families are getting crushed by skyrocketing energy costs and the planet is literally burning, sabotaging this program isn’t just wrong — it’s absolutely insane. We will fight back to preserve this enormously important program.” Only $53 million of the $7 billion awarded has been spent, according to a tally by the research firm Atlas Public Policy. Several grant recipients this week said their programs were in planning phases. Stephanie Bosh, senior vice president of the Solar Energy Industries Association, said the EPA has no legal authority to terminate grants already appropriated by Congress. “These grants are delivering billions of dollars of investment to red and blue states alike,″ she said. Bosh said solar was one of the cheapest energy sources at a time of growing demand for electricity. “This administration is continuing to dig itself into a hole,” she said. The EPA has argued that the tax and policy law allows the agency to rescind the money it has already obligated. The recipients of that money disagree, saying the bulk of the money had already been disbursed and is not affected by the law. Southern Environmental Law Center litigation director Kym Meyer said if the administration wants to move forward with canceling Solar for All funds, “we will see them in court.” Grant recipients have already challenged the administration’s actions, and a judge ruled in April the EPA cannot freeze the contracts. Rhode Island Sen. Sheldon Whitehouse, the top Democrat on the Senate Environment Committee, called Zeldin’s elimination of the solar program a betrayal “that will further hike electricity costs and make our power grid less reliable.” “Trump is — yet again — putting his fossil fuel megadonors first,” he added. ___ St. John reported from Detroit. ___ The Associated Press’ climate and environmental coverage receives financial support from multiple private foundations. AP is solely responsible for all content. Find AP’s standards for working with philanthropies, a list of supporters and funded coverage areas at AP.org. Before you make your next trade, you'll want to hear this. MarketBeat keeps track of Wall Street's top-rated and best performing research analysts and the stocks they recommend to their clients on a daily basis. Our team has identified the five stocks that top analysts are quietly whispering to their clients to buy now before the broader market catches on... and none of the big name stocks were on the list. They believe these five stocks are the five best companies for investors to buy now... See The Five Stocks Here MarketBeat's analysts have just released their top five short plays for August 2025. Learn which stocks have the most short interest and how to trade them. Enter your email address to see which companies made the list."
EPA moves to terminate $7 billion in funding for rooftop solar program approved under the Biden administration,https://www.marketbeat.com/articles/epa-moves-to-terminate-7-billion-in-funding-for-rooftop-solar-program-approved-under-the-biden-administration-2025-08-07/,"WASHINGTON (AP) — EPA moves to terminate $7 billion in funding for rooftop solar program approved under the Biden administration. Before you make your next trade, you'll want to hear this. MarketBeat keeps track of Wall Street's top-rated and best performing research analysts and the stocks they recommend to their clients on a daily basis. Our team has identified the five stocks that top analysts are quietly whispering to their clients to buy now before the broader market catches on... and none of the big name stocks were on the list. They believe these five stocks are the five best companies for investors to buy now... See The Five Stocks Here Looking for the next FAANG stock before everyone has heard about it? Enter your email address to see which stocks MarketBeat analysts think might become the next trillion dollar tech company."
France’s top court strikes down pesticide clause in farming law,https://www.marketbeat.com/articles/frances-top-court-strikes-down-pesticide-clause-in-farming-law-2025-08-07/,"PARIS (AP) — France’s highest court on Thursday blocked a key part of a contentious farming law that would have brought back a banned pesticide. The court said that the measure failed to protect the environment and future generations. The rest of the law — known as the “Duplomb law,” after the senator who proposed it — was allowed to stand. The bill, passed in early July, aimed to loosen rules for farmers and fast-track projects like water storage. It was backed by the government and major farming unions, but met fierce opposition from scientists, health experts and green groups. At the heart of the outrage was acetamiprid, a pesticide banned in France since 2018 for its role in harming bees and other pollinators. Farmers, especially sugar beet growers, had pushed for its return. But the court ruled that the proposal wasn't strict enough, and ignored France’s constitutional commitment to environmental protection. The backlash was swift and widespread. A student-led petition against the law drew more than 2 million signatures — one of the biggest in French history. Opponents said that the bill was rushed through parliament with barely any debate, and warned that it put public health and biodiversity at risk. The ruling is a blow to President Emmanuel Macron’s government, which had defended the bill until the end. Critics called the decision a win for democracy and the planet. Some lawmakers have already vowed to push for a full repeal in the coming months. Acetamiprid is currently approved by the European Union until 2033, and authorized in other member countries. Before you make your next trade, you'll want to hear this. MarketBeat keeps track of Wall Street's top-rated and best performing research analysts and the stocks they recommend to their clients on a daily basis. Our team has identified the five stocks that top analysts are quietly whispering to their clients to buy now before the broader market catches on... and none of the big name stocks were on the list. They believe these five stocks are the five best companies for investors to buy now... See The Five Stocks Here Discover the top 7 AI stocks to invest in right now. This exclusive report highlights the companies leading the AI revolution and shaping the future of technology in 2025."
