title,link,content
"How major US stock indexes fared Thursday, 8/7/2025",https://www.marketbeat.com/articles/how-major-us-stock-indexes-fared-thursday-872025-2025-08-07/,"U.S. stocks drifted to a mixed finish as President Donald Trump’s tariffs on dozens of countries had only a muted effect on markets worldwide. The S&P 500 slipped 0.1% Thursday. The Dow Jones Industrial Average dipped 0.5%, and the Nasdaq composite rose 0.3%. Worries are high that Trump’s tariffs are damaging the economy, particularly after last week’s worse-than-expected report on the job market. But hopes for coming cuts to interest rates by the Federal Reserve and a torrent of stronger-than-expected profit reports from big U.S. companies are helping to offset the concerns, at least for now. Treasury yields ticked higher. On Thursday: The S&P 500 fell 5.06 points, or 0.1%, to 6,340. The Dow Jones Industrial Average fell 224.48 points, or 0.5%, to 43,968.64. The Nasdaq composite rose 73.27 points, or 0.3%, to 21,242.70. The Russell 2000 index of smaller companies fell 6.57 points, or 0.3%, to 2,214.72. For the week: The S&P 500 is up 101.99 points, or 1.6%. The Dow is up 380.06 points, or 0.9%. The Nasdaq is up 592.56 points, or 2.9%. The Russell 2000 is up 47.94 points, or 2.2%. For the year: The S&P 500 is up 458.37 points, or 7.8%. The Dow is up 1,424.42 points, or 3.3%. The Nasdaq is up 1,931.90 points, or 10%. The Russell 2000 is down 15.44 points, or 0.7%. Before you make your next trade, you'll want to hear this. MarketBeat keeps track of Wall Street's top-rated and best performing research analysts and the stocks they recommend to their clients on a daily basis. Our team has identified the five stocks that top analysts are quietly whispering to their clients to buy now before the broader market catches on... and none of the big name stocks were on the list. They believe these five stocks are the five best companies for investors to buy now... See The Five Stocks Here Learn the basics of options trading and how to use them to boost returns and manage risk with this free report from MarketBeat. Click the link below to get your free copy."
Microsoft Stock Gains as Analysts Boost Price Targets,https://www.marketbeat.com/originals/microsoft-stock-gains-as-analysts-boost-price-targets/,"Microsoft Corporation NASDAQ: MSFT delivered an earnings report that can be considered a blowout, even for a mega-cap company with high expectations. Microsoft beat on revenue and earnings and reiterated its guidance for data center spending for the remainder of the 2025 calendar year. Analysts have taken notice. The Microsoft analyst forecasts on MarketBeat show that nearly two dozen analysts have either reiterated or raised their price target for MSFT stock. Many of the new targets are above the consensus price of $609.86, which is a 15% gain from the stock’s price on August 6. August is a tricky month for investors. Apart from a few names like NVIDIA, the major technology stocks have already reported. The economy continues to give off conflicting signals, and Congress is out on recess, which generally leads to a less active market. This is a good reminder of why buying the best matters. In the tech sector, that means Microsoft. The company’s stock has been up about 2.8% since the earnings report, but that’s down from the 5% gain it had before a slight pullback this week. Earnings reports provide a snapshot of a company’s performance. However, the headline numbers are lagging indicators. In other words, they tell what’s happened in the past. What a company has to say about the current and future quarters can drive up a stock price. For a mega-cap company like Microsoft, that usually comes down to its earnings outlook. Analysts project Microsoft to post 12.3% earnings growth in the next 12 months. That compares favorably to another mega-cap hyperscaler, Meta Platforms Inc. NASDAQ: META, which analysts project to post 13.15% earnings growth. That aligns with the company’s guidance for “double-digit earnings growth on a constant currency basis.” However, it also means that analysts are slightly more bullish about earnings expectations for Microsoft, which largely explains the outlook for 15% stock price growth. Microsoft emphasized that its projected future growth will be driven by continued investment in AI and cloud infrastructure, improving operating leverage, and disciplined expense management. That aligns with Dan Ives' sentiment. The Wedbush analyst continues to be bullish on the tech sector, specifically the Magnificent Seven stocks that will lead the AI revolution. Ives and his team believe that the market is not fully appreciating the amount of spending that will be needed over the next three years. Wedbush lists Microsoft, Meta Platforms, NVIDIA, Tesla, and Palantir as its top five tech stocks for the second half of 2025. That bullish outlook comes with a price target of $625, up from $600. However, Wedbush isn’t the most bullish on MSFT stock. That would be Brent Thill from Jefferies Financial Group. The analyst raised his price target for Microsoft to $675 from $600. MSFT stock continues to be in a sustained uptrend. The 20-day simple moving average (SMA), currently around $513.61, is serving as a reliable short-term support level. Price action remains above the 20-day SMA and within the upper range of the Bollinger Bands, signaling strength and proximity to potential overbought conditions. The MACD (Moving Average Convergence Divergence) shows a slight bullish crossover, with the MACD line (10.45) above the signal line (9.94), suggesting upward momentum could continue. However, there may be limited strength behind the move.  One reason is the relative strength indicator (RSI), which, at 64, suggests that MSFT is approaching overbought territory. However, there may still be room for modest upside before a possible pullback or consolidation. Another potential short-term concern is lighter volume after the post-earnings surge. That’s not a bearish signal but could signal that momentum is slowing. Before you consider Microsoft, you'll want to hear this. MarketBeat keeps track of Wall Street's top-rated and best performing research analysts and the stocks they recommend to their clients on a daily basis. MarketBeat has identified the five stocks that top analysts are quietly whispering to their clients to buy now before the broader market catches on... and Microsoft wasn't on the list. While Microsoft currently has a Moderate Buy rating among analysts, top-rated analysts believe these five stocks are better buys. View The Five Stocks Here MarketBeat's analysts have just released their top five short plays for August 2025. Learn which stocks have the most short interest and how to trade them. Enter your email address to see which companies made the list."
Trump to nominate top economic aide Stephen Miran to Federal Reserve board,https://www.marketbeat.com/articles/trump-to-nominate-top-economic-aide-stephen-miran-to-federal-reserve-board-2025-08-07/,"WASHINGTON (AP) — President Donald Trump said Thursday he will nominate a top economic adviser to the Federal Reserve’s board of governors for four months, temporarily filling a vacancy while continuing his search for a longer-term appointment. Trump said he has named Stephen Miran, the chair of the White House’s Council of Economic Advisers, to fill a seat vacated by governor Adriana Kugler, a Biden appointee who is stepping down Friday. Miran, if approved by the Senate, will serve until January 31, 2026. The appointment is Trump’s first opportunity to exert more control over the Fed, one of the few remaining independent federal agencies. Trump has relentlessly criticized the current chair, Jerome Powell, for keeping short-term interest rates unchanged, calling him “a stubborn MORON” last week on social media. Miran has been a major defender of Trump’s income tax cuts and tariff hikes, arguing that the combination will generate enough economic growth to reduce budget deficits. He also has played down the risk of Trump’s tariffs generating higher inflation, a major source of concern for Powell. The choice of Miran may heighten concerns about political influence over the Fed, which has traditionally been insulated from day-to-day politics. Fed independence is generally seen as key to ensuring that it can take difficult steps to combat inflation, such as raising interest rates, that politicians might be unwilling to take. Federal Reserve governors vote on all the central bank’s interest-rate decisions, as well as its financial regulatory policies. Miran’s nomination, if approved, would add a near-certain vote in support of lower interest rates. Kugler had echoed Powell’s view that the Fed should keep rates unchanged and further evaluate the impact of tariffs on the economy before making any moves. Trump has said he will appoint Fed officials who will cut interest rates, which he says will reduce the borrowing costs of the federal government’s huge $36 trillion debt pile. Trump also wants lower rates to boost moribund home sales, which have been held back partly by higher mortgage costs. Yet the Fed doesn’t directly set longer-term interest rates for things like home and car purchases. At its most recent meeting last week, Fed officials kept their key rate unchanged at 4.3%, where it has stood after three rate cuts late last year. But two Fed governors — Christopher Waller and Michelle Bowman — dissented from that decision. Both were appointed by Trump in his first term. Still, even with Miran on the board, 12 Fed officials vote on interest rate policy and many remain concerned that Trump's sweeping tariffs could push inflation higher in the coming months. Miran could be renominated to a longer term on the Fed once his initial appointment is concluded, or replaced by another nominee. Powell’s term as chair ends in May 2026. Yet, Powell could remain on the board of governors until January 2028, even after he steps down as chair. That would deny, or at least delay, an opportunity for Trump to appoint an additional policymaker to the Fed’s board. As a result, one option for Trump is to appoint Powell’s eventual replacement as chair to replace Kugler once the remaining four months of her term are completed. Leading candidates for that position include Kevin Warsh, a former Fed governor from 2006 to 2011 and frequent critic of Powell’s chairmanship, and Kevin Hassett, another top Trump economic adviser. Another option for the White House next May would be to select Waller, who is already on the board, to replace Powell, and who has been widely mentioned as a candidate. Marco Casiraghi, senior economist at investment bank Evercore ISI, noted that the choice of Miran could be a positive sign for Waller, because Trump did not take the opportunity to nominate someone likely to become chair once Powell steps down. After the July jobs report was released last Friday, Miran criticized the Fed chair for not cutting benchmark interest rates, saying that Trump had been proven correct on inflation during his first term and would be again. The president has pressured Powell to cut short-term interest rates under the belief that his tariffs will not fuel higher inflationary pressures. “What we’re seeing now in real time is a repetition once again of this pattern where the president will end up having been proven right,” Miran said on MSNBC. “And the Fed will, with a lag and probably quite too late, eventually catch up to the president’s view.” Last year, Miran expressed support for some unconventional economic views in commentaries on the Fed and international economics. Last November, he proposed measures that would reduce the value of the dollar in order to boost exports, reduce imports and cut the U.S. trade deficit, a top priority for Trump. He also suggested tariffs could push U.S. trading partners, such as the European Union and Japan, to accept a cheaper dollar as part of a “Mar-a-Lago Accord,” an echo of the Plaza Accord reached in the 1980s that lowered the dollar's value. As a fellow at the conservative Manhattan Institute, Miran in March 2024 also proposed overhauling the Fed's governance, including by making it easier for a president to fire members of its board of governors. “The Fed’s current governance has facilitated groupthink that has led to significant monetary-policy errors,” Miran wrote in a paper with Dan Katz, now a top official at the Treasury Department. ___ Before you make your next trade, you'll want to hear this. MarketBeat keeps track of Wall Street's top-rated and best performing research analysts and the stocks they recommend to their clients on a daily basis. Our team has identified the five stocks that top analysts are quietly whispering to their clients to buy now before the broader market catches on... and none of the big name stocks were on the list. They believe these five stocks are the five best companies for investors to buy now... See The Five Stocks Here Looking to profit from the electric vehicle mega-trend? Enter your email address and we'll send you our list of which EV stocks show the most long-term potential."
Trump orders federal regulators to probe alleged bank discrimination against conservatives,https://www.marketbeat.com/articles/trump-orders-federal-regulators-to-probe-alleged-bank-discrimination-against-conservatives-2025-08-07/,"NEW YORK (AP) — President Donald Trump on Thursday signed an executive order mandating a probe into whether banks have discriminated against conservatives and certain industries like gun manufacturers and cryptocurrency companies, invoking the vast powers to go after entities that the Republican president alleges have discriminated against him and his allies. The executive order deals with an issue known as “debanking,” which is when banks close accounts of individuals or declines to go into business with certain industries. Trump has accused JPMorgan and Bank of America of debanking him and his companies in the past, something both banks have denied. Trump ordered federal bank regulators to make sure banks do not discriminate against individuals or companies for their political or religious beliefs. He also ordered bank regulators to probe when banks may have allegedly discriminated and refer the cases to the Department of Justice within 120 days. The move could open banks to potential civil or criminal investigations, fines or other punishments. When Trump and his party discuss debanking, they typically refer to banks closing the accounts of a person or company when they no longer want to do business with them. Banks usually say they close accounts or deny loans because the person or business is deemed too risky. The banking industry has long argued that it has a constitutional right to choose whom they go into business with, if it does not violate laws like the Equal Credit Opportunity Act. Th act, which was part of several pieces of legislation signed during the Civil Rights Movement, bans banks from discrimination based on race, ethnicity, religion, sex and other protected statuses. Another type of debanking is when government regulators tell banks to avoid doing business with industries or individuals. Democratic President Barack Obama’s Department of Justice told banks to avoid doing business with “high risk” industries, which included payday lenders and firearms manufacturers. This type of government-directed debanking is also known as reputational risk, where the historic reputation of an industry prompts banks to be more careful about banking and lending. Historic examples include entities who did business in high-risk countries, did business largely in cash or were repeatedly flagged by bank regulators. Under the executive order, bank regulators will need to remove reputational risk from their metrics on how they measure a bank's safety and soundness. Banks, who have benefited from Trumps deregulation agenda and prefer simpler rules and regulations, have tried to strike a cordial tone with the administration, showing themselves as willing brokers who got caught up in a difficult political environment. “It’s in banks’ best interest to take deposits, lend to and support as many customers as possible. Unfortunately, regulatory overreach, supervisory discretion and a maze of obscure rules have stood in the way as the (executive order) makes clear,” the major bank lobby groups said Thursday in a joint statement. Conservatives have argued that reputational risk has become an umbrella term that allows banks to discriminate. The banking industry insists it does not actively debank and does not target specific industries or individuals. The banking industry itself, knowing that reputational risk has become liability, has already been removing any mention of reputational risk from their policies and procedures, particularly since Trump returned to the White House. “Today’s Executive Order helps ensure all consumers and businesses are treated fairly, a goal the nation’s banks share with the Administration,” the banks said. For Trump, the issue of debanking is deeply personal. Trump, in a wide-ranging interview on CNBC, earlier this week alleged that two major banks — JPMorgan and Bank of America — cut him off after he left office in 2021. “They totally discriminate against ... me maybe even more, but they discriminated against many conservatives,” he said to CNBC. Both banks have denied they debanked Trump. “We don’t close accounts for political reasons, and we agree with President Trump that regulatory change is desperately needed,” said a spokeswoman for JPMorgan Chase in a statement. Former bank regulators have argued that reputational risk, when used along with other metrics, can be a good measure of how well a bank is operating. Banks who end up doing business with companies with a history of violating laws, or violating anti-money laundering rules, can be at risk for failure. Signature Bank failed in 2023 partly because of its exposure to cryptocurrency companies during a major downturn in crypto assets. Credit Suisse in 2009 paid half a billion dollars to regulators for laundering money on behalf of Iran. “Financial risk, and reputational risk, can be intertwined,” said Graham Steele, a former Treasury Department official who also served as a Democratic Congressional staffer on banking issues. The Obama administration's government-directed debanking has been a rallying cry for conservatives. It’s one reason why the cryptocurrency industry backed Trump in 2024. While the Biden administration did not explicitly force banks to debank the crypto industry, Democratic President Joe Biden’s bank regulators did express some public concern about it, a move that was read by banks as a reason to steer away from crypto. That phrasing by the Biden administration was often referred to as “Operation Choke Point 2.0” by Trump and his allies. Republicans have introduced legislation to cut down on alleged acts of debanking as well. Sen. Tim Scott of South Carolina, chair of the Senate Banking Committee, has introduced legislation that would require bank regulators to no longer consider reputational risk as a factor in how they measure a bank’s health and risk profile. “Debanking federally legal businesses and law-abiding citizens is un-American, and President Trump’s Executive Order is a critical step towards protecting Americans’ access to financial services,” Scott said in a statement. Before you make your next trade, you'll want to hear this. MarketBeat keeps track of Wall Street's top-rated and best performing research analysts and the stocks they recommend to their clients on a daily basis. Our team has identified the five stocks that top analysts are quietly whispering to their clients to buy now before the broader market catches on... and none of the big name stocks were on the list. They believe these five stocks are the five best companies for investors to buy now... See The Five Stocks Here Enter your email address and we'll send you MarketBeat's guide to investing in 5G and which 5G stocks show the most promise."
