title,link,content
"Toyota reports a 37% drop in profit, cuts its forecast due to Trump's tariffs",https://www.marketbeat.com/articles/toyota-reports-a-37-drop-in-profit-cuts-its-forecast-due-to-trumps-tariffs-2025-08-07/,"TOKYO (AP) — Toyota's profit plunged 37% in the April-June quarter, the company said Thursday, cutting its full year earnings forecasts largely because of President Donald Trump’s tariffs. The Japanese automaker said it based its report on the assumption that Trump’s tariffs on exports from Japan, including autos, would be 12.5% starting this month. As of now they stand at 15%. The world’s top automaker also makes vehicles in Mexico and Canada. Toyota’s profit in the last quarter totaled 841 billion yen, or $5.7 billion, down from 1.33 trillion yen in the same period the year before. Its quarterly sales rose 3%. The status of those exports is unclear since Mexico and Canada are beneficiaries of the U.S. Mexico Canada Agreement, renegotiated from a 1990s pact during Trump's first term in office, that eliminated most tariffs and trade barriers between the three countries. Toyota Motor Corp.’s April-June profit totaled 841 billion yen ($5.7 billion), down from 1.33 trillion yen in the same period of 2024. Quarterly sales rose 3% to 12 trillion yen ($82 billion). Toyota said the tariffs cost its quarterly operating profit 450 billion yen ($3 billion). Cost reduction efforts and the negative impact of an unfavorable exchange rate also hurt its bottom line. The company, which makes the Camry sedan and Lexus luxury models, forecast a 2.66 trillion yen ($18 billion) profit for the full fiscal year ending in March 2026, down from an earlier forecast for a 3.1 trillion yen ($21 billion) profit. Toyota earned nearly 4.8 trillion yen in the previous fiscal year. “Despite a challenging external environment, we have continued to make comprehensive investments, as well as improvements such as increased unit sales, cost reductions and expanded value chain profits,” Toyota said in a statement that outlined its efforts to minimize the impact of the tariffs. At the retail level, Toyota sold 2.4 million vehicles globally, with sales growing in Japan, North America and Europe from the previous year, when global retail totaled 2.2 million vehicles. Analysts say Toyota is likely among the worst hit by the tariffs among global companies, even compared with other Japanese automakers. ___ Yuri Kageyama is on Threads: https://www.threads.com/@yurikageyama Before you consider Toyota Motor, you'll want to hear this. MarketBeat keeps track of Wall Street's top-rated and best performing research analysts and the stocks they recommend to their clients on a daily basis. MarketBeat has identified the five stocks that top analysts are quietly whispering to their clients to buy now before the broader market catches on... and Toyota Motor wasn't on the list. While Toyota Motor currently has a Hold rating among analysts, top-rated analysts believe these five stocks are better buys. View The Five Stocks Here Explore Elon Musk’s boldest ventures yet—from AI and autonomy to space colonization—and find out how investors can ride the next wave of innovation."
Germans worry their beloved kebab may get more pricy or even scarce because of factory strike,https://www.marketbeat.com/articles/germans-worry-their-beloved-kebab-may-get-more-pricy-or-even-scarce-because-of-factory-strike-2025-08-07/,"BERLIN (AP) — Germans are in kebab angst. They worry that their most beloved street food option, the spicy, juicy kebab in a pita that can be found on every street corner across Germany, may get more expensive — or even worse, that the country may be sliding into a national kebab shortage. Even if these fears may sound exaggerated at first, they aren't unfounded. Workers at one of Germany's biggest kebab factories are locked in a bitter and ongoing fight with their employer over wages and working conditions. For weeks, workers at the Birtat Meat World SE factory in southwestern Germany have repeatedly stopped the production line by walking off their jobs in ""warning strikes,” demanding wage increases of 375 euros ($434) per month. Their current salaries vary widely, and haven't been disclosed. The Food, Beverages and Catering Union that represents them says that payment methods are nontransparent and workers are making vastly different salaries for the same kind of job, according to German news agency dpa. Workers are also trying to organize a collective contract agreement for all employees with the help of the union. Many workers are immigrants from Turkey, Romania or Bulgaria, who spend long, tough workdays in the factory, which has near freezing temperatures to keep the raw meat fresh. On Wednesday, many workers walked off their jobs again, waving flags in front of the factory's main gate, playing drums, whistling and shouting for higher salaries and unionized contracts. German media have reported that Birtat hasn't yielded to any of the demands so far. The company didn't immediately respond to requests for an interview. Birtat, which is located in Murr, 30 kilometers (nearly 20 miles) north of Stuttgart, has been making kebab skewers for more than 30 years. The company says on its website that it makes skewers of ground beef, veal, chicken or turkey kebab that can weigh up to 120 kilograms (260 pounds). The workers chop up the meat, marinate it and push chunks of the raw produce on long metal skewers. The meat is then shock-frozen and and delivered to restaurants all over the country. Birtat says it supplies thousands of kebab stands and fast food places and reaches more than 13 million consumers every month. Some restaurant owners worry that should the workers decide to go on a long-term strike, the Germans' favorite fast-food snack may indeed become more expensive or even scarce. Germans already complain that the meaty snack, which used to be a cheap staple that sold for 2.50 euros about two decades ago, has become too expensive, with most places charging at least 7 euros ($8) or more. Halil Duman was pondering the state of the kebab business as he was busy slicing off thin pieces of ground beef at Pergamon Döner, a small eatery at Berlin’s Friedrichstrasse train station where people were lining up for lunch. “It's all getting more and more difficult,"" the 68-year-old Turkish immigrant said. ""The produce is becoming more expensive and we barely make profit anymore.” “But if we raise the prices any further, people won't buy here anymore,” said Duman, who has been working at kebab stores in the German capital for more than 30 years and was selling the classic kebab sandwich for 7.50 euros (around $8.70). Germans have long fancied the kebab sandwich, which is called a döner in Germany. The word comes from the Turkish verb “donmek,” meaning to turn — the meat is grilled for hours on a spit and cut off in razor-thin slices when it's crisp and brown. First brought to Berlin by Turkish immigrants in the 1970s, the grilled meat snack, which comes wrapped in pita bread with shredded lettuce, tomatoes, onions and different dressings, is now sold everywhere in Germany, from regions stretching from the Baltic Sea to the Bavarian Alps. According to legend, it was Mahmut Aygun, a Turkish guest worker, who invented the first döner sandwich in 1971, when he sold the meat in a piece of pita bread with yogurt dressing at a stand close to a main train station next to the zoo in West Berlin. About 2.9 million people with Turkish roots live in Germany — but the döner kebab sandwich has become so ubiquitous in the country that many foreign tourists consider it typically German and don't even know about the snack's immigrant past. Nele Langfeld, a 22-year-old university student, had come to Pergamon Döner because she was craving the yummy comfort food after having just finished an exam. Waiting in line for her turn, she said that while she hadn't heard about the labor dispute at Birtat, she sure didn't like the prospect of a possible döner shortage or higher prices. “I live on a budget and that's the last thing I need,” she said. “Döner is the one affordable meal that really fills your stomach — it should stay that way.” Before you make your next trade, you'll want to hear this. MarketBeat keeps track of Wall Street's top-rated and best performing research analysts and the stocks they recommend to their clients on a daily basis. Our team has identified the five stocks that top analysts are quietly whispering to their clients to buy now before the broader market catches on... and none of the big name stocks were on the list. They believe these five stocks are the five best companies for investors to buy now... See The Five Stocks Here Discover the next wave of investment opportunities with our report, 7 Stocks That Will Be Magnificent in 2025. Explore companies poised to replicate the growth, innovation, and value creation of the tech giants dominating today's markets."
The Latest: Trump's tariffs go into effect,https://www.marketbeat.com/articles/the-latest-trumps-tariffs-go-into-effect-2025-08-07/,"The U.S. began officially levying higher taxes on imports from dozens of countries Thursday, four months after President Donald Trump first announced plans to impose tariffs on most of the world while seeking new trade agreements across the board. The White House said that starting just after midnight goods from more than 60 countries and the European Union would face tariff rates of 10% or higher. Products from the European Union, Japan and South Korea will be taxed at 15%, while imports from Taiwan, Vietnam and Bangladesh will be taxed at 20%. Trump also expects places such as the EU, Japan and South Korea to invest hundreds of billions of dollars in the U.S. The Trump White House is confident that the onset of his broad tariffs will provide clarity about the path of the world’s largest economy. Now that companies understand the direction the U.S. is headed, the administration believes they can ramp up new investments and jump-start hiring in ways that can rebalance the U.S. economy as a manufacturing power. But so far, economic data has shown a U.S. economy that began flagging after Trump’s initial rollout of tariffs in April. Here's the latest: A top body of Indian exporters said Thursday the latest U.S. tariffs will impact nearly 55% of the country’s outbound shipments to America and force exporters to lose their long-standing clients. “Absorbing this sudden cost escalation is simply not viable. Margins are already thin,” S.C. Ralhan, president of the Federation of Indian Export Organisations, said in a statement. The tariffs effectively impose a cost burden, placing Indian exporters at a competitive disadvantage with countries that have lesser import taxes, he added. In 2024, the U.S. ran a $45.8 billion trade deficit in goods with India, meaning America imported more from India than it exported, according to the U.S. Census Bureau. American consumers and businesses buy pharmaceutical drugs, precious stones, and textiles and apparel from India, among other goods. Prime Minister Narendra Modi on Thursday said India will never compromise the interests of farmers. “For us, the interests of farmers are a top priority. I know I will have to personally pay a heavy price for it, but I am ready,” Modi said at a conference in what was seen as a message to the U.S. administration, which has been seeking greater access to India’s agriculture and dairy sectors. India and the U.S. have had five rounds of negotiations on a bilateral trade agreement, but haven’t been able to clinch one so far. On Wednesday, Trump signed an executive order to place an additional 25% tariff on India for its purchases of Russian oil. The order would go into effect in 21 days and bring the combined tariffs imposed on India to 50%. Japanese entertainment and electronics company Sony said Thursday its profit surged 23% in the last quarter from the year before, as damage from U.S. President Donald Trump’s tariffs was less than it had expected. Sony raised its forecast for its profit in the full fiscal year until March 2026 to 970 billion yen ($6.6 billion), from an earlier forecast of 930 billion yen ($6.3 billion). The revised projection is still lower than what it earned in the previous fiscal year at 1 trillion yen. Sony now estimates the impact of the additional U.S. tariffs on its operating income at 70 billion yen ($476 million), much better than the initial estimate of 100 billion yen ($680 million). Before you make your next trade, you'll want to hear this. MarketBeat keeps track of Wall Street's top-rated and best performing research analysts and the stocks they recommend to their clients on a daily basis. Our team has identified the five stocks that top analysts are quietly whispering to their clients to buy now before the broader market catches on... and none of the big name stocks were on the list. They believe these five stocks are the five best companies for investors to buy now... See The Five Stocks Here Nuclear energy stocks are roaring. It's the hottest energy sector of the year. Cameco Corp, Paladin Energy, and BWX Technologies were all up more than 40% in 2024. The biggest market moves could still be ahead of us, and there are seven nuclear energy stocks that could rise much higher in the next several months.  To unlock these tickers, enter your email address below."
Asian shares mostly climb after a rally for Apple led Wall Street higher,https://www.marketbeat.com/articles/asian-shares-mostly-climb-after-a-rally-for-apple-led-wall-street-higher-2025-08-07/,"MANILA, Philippines (AP) — Asian shares mostly advanced and financial markets appeared to show scant if any reaction to higher tariffs on exports to the United States that took effect early Thursday. Japan’s benchmark Nikkei 225 added 0.6% to 41,025.76. Hong Kong’s Hang Seng climbed 0.6% to 25,057.84 and the Shanghai Composite added 0.1% to 3,637.96. China reported that its exports picked up in July, helped by a flurry of shipments by businesses taking advantage of a pause in U.S. President Donald Trump's tariff war with Beijing. South Korea’s Kospi rose 0.6% to 3,217.67 while the S&P/ASX 200 in Australia shed 0.2% to 8,828.70. India’s Sensex gave up 0.6% after Trump ordered tariffs on imports from the world's most populous nation to rise to 50%, citing its crude oil imports from Russia. Trump also declared 100% tariffs on computer chips with an exemption for U.S. investments. Apple's shares rose 5.1% on Wednesday ahead of a White House event where it announced an increase to its U.S. investments of an additional $100 billion over the next four years. Mizuho Bank, in a commentary, said the Trump’s exemption from 100% tariffs on semiconductors for those with investments in U.S. production means trade partners may be able to use investments as a bargaining chip. Taiwan's Taiex jumped 2.4% as shares in market heavyweight Taiwan Semiconductor Manufacturing Corp. surged 4.9%. TSMC is the world's largest contract maker of computer chips and it has been ramping up its investments in U.S. factory capacity, helping to alleviate the impact from higher tariffs. South Korean chipmakers also saw strong gains, with Samsung Electronics jumping 2.1% after the government said its products would also be subject to the exemption. On Wednesday, a rally for Apple led Wall Street higher, with U.S. stocks reclaiming more of their sharp losses from last week. The S&P 500 rose 0.7% to 6,345.06. The Dow Jones Industrial Average added 0.2% to 44,193.12, and the Nasdaq composite climbed 1.2% to 21,169.42. Apple alone accounted for more than a third of the S&P 500’s gain. Trading elsewhere on Wall Street was mixed following a jumble of profit reports. McDonald’s and Shopify rose following their latest updates, while Super Micro Computer tumbled after its earnings and revenue came in below analysts’ expectations. The Walt Disney Co. fell after its earnings beat forecasts but its revenue fell short Worries are still high that Trump’s tariffs may be hurting the economy, but hopes for coming cuts to interest rates by the Federal Reserve and a parade of stronger-than-expected profit reports from U.S. companies have helped steady the market. In other dealings early Thursday, benchmark U.S. crude climbed 44 cents to $64.79 a barrel. Brent crude, the international standard, added 42 cents to $67.31 a barrel. The U.S. dollar slipped to 147.33 Japanese yen from 147.36 yen. The euro cost $1.1670, up from $1.1661. __ AP Business writers Stan Choe and Matt Ott contributed. Before you consider Walt Disney, you'll want to hear this. MarketBeat keeps track of Wall Street's top-rated and best performing research analysts and the stocks they recommend to their clients on a daily basis. MarketBeat has identified the five stocks that top analysts are quietly whispering to their clients to buy now before the broader market catches on... and Walt Disney wasn't on the list. While Walt Disney currently has a Moderate Buy rating among analysts, top-rated analysts believe these five stocks are better buys. View The Five Stocks Here Learn the basics of options trading and how to use them to boost returns and manage risk with this free report from MarketBeat. Click the link below to get your free copy."
How India ended up facing steep US tariffs despite its strategic partnership,https://www.marketbeat.com/articles/how-india-ended-up-facing-steep-us-tariffs-despite-its-strategic-partnership-2025-08-07/,"NEW DELHI (AP) — U.S. President Donald Trump has vowed additional 25% tariff on India for its purchases of Russian oil, bringing the combined tariffs imposed by the United States on its ally to 50%. India has called the additional tariffs “unfortunate.” Trump's Wednesday announcement came as India and the U.S. are still negotiating a trade deal that has faced roadblocks after it was first announced when Indian Prime Minister Narendra Modi met Trump in Washington earlier this year. It also comes at a time when ties between India and the U.S. appear to have taken a hit even as Modi and Trump share a warm relationship. Here is how India, a strategic partner of the U.S. in Asia, ended up facing steep tariffs: Trump imposes tariffs on Canada, Mexico and China. He initially spares India, despite repeatedly calling the country a “tariff king,"" but threatens that high tariffs are coming. Modi meets Trump in Washington in an effort to resolve trade concerns. Trump again warns of higher U.S. tariffs on Indian goods. India and the U.S. agree to work on a trade deal and expand bilateral trade to $500 billion by 2030. They don't share details as to how the target would be achieved. Modi says he expects a deal to be completed later this year. India’s trade minister, Piyush Goyal, visits Washington and meets his counterparts to initiate negotiations for the bilateral trade agreement. U.S. Vice President JD Vance meets Modi in New Delhi and says both sides are making progress on trade talks. India and the U.S. also finalize the terms of reference for the trade negotiation, bringing them a step closer to an agreement. Trump says he stopped military hostilities between India and Pakistan by offering possible trade concessions to both. India is angered by Trump’s claims and disputes them. Trade minister Goyal leads a team of senior Indian officials to Washington for more negotiations. India’s commerce secretary says the proposed bilateral trade agreement is progressing “very well.” Trump signals a deal may be close. “We’re having some great deals. We have one coming up, maybe with India, a very big one, where we’re going to open up India,” he says. An Indian trade delegation visits Washington for another round of discussions, which end without reaching a breakthrough. Goyal says India is ready to make trade deals in “the national interest,” but not just to meet deadlines. Trump imposes 25% tariffs on Indian imports. He warns of further penalties for India because of its buying of Russian oil, and calls its economy “dead.” Trump vows an additional 25% import taxes on India to punish the country for its purchases of Russian oil, bringing combined tariffs to 50%. The tariffs are set to go into effect after 21 days. Before you make your next trade, you'll want to hear this. MarketBeat keeps track of Wall Street's top-rated and best performing research analysts and the stocks they recommend to their clients on a daily basis. Our team has identified the five stocks that top analysts are quietly whispering to their clients to buy now before the broader market catches on... and none of the big name stocks were on the list. They believe these five stocks are the five best companies for investors to buy now... See The Five Stocks Here Unlock the timeless value of gold with our exclusive 2025 Gold Forecasting Report. Explore why gold remains the ultimate investment for safeguarding wealth against inflation, economic shifts, and global uncertainties. Whether you're planning for future generations or seeking a reliable asset in turbulent times, this report is your essential guide to making informed decisions."
