title,link,content
New US tariffs cloud outlook for exporters in Asia and beyond,https://www.marketbeat.com/articles/new-us-tariffs-cloud-outlook-for-exporters-in-asia-and-beyond-2025-08-07/,"BANGKOK (AP) — President Donald Trump’s new tariff rates on U.S. imports from dozens of countries took effect Thursday, the latest chapter in the saga of Trump’s reshaping of global trade. But many questions remain. Trump has threatened tariffs of up to 200% on imports of pharmaceuticals and has ordered a 100% import tax on computer chips. Most U.S. imports of copper, steel and aluminum are subject to a 50% tariff. There’s still no agreement on what tariffs might apply to products shipped from China. India has no deal yet and faces a potential 50% tariff as Trump pressures it to stop buying oil from Russia. Recent data shows uncertainty is clouding the outlook for exporters around the world as a rush to beat the tariffs during a pause for negotiation tapers off. Companies are reporting billions of dollars in higher costs or losses due to the higher import duties. Global financial markets took Thursday's tariff adjustments in stride, with Asian shares and U.S. futures mostly higher. Here's where things stand in what has proven to be a fast-changing policy landscape. The tariffs announced on Aug. 1 apply to 66 countries, Taiwan and the Falkland Islands. They are a revised version of what Trump called "" reciprocal tariffs,"" announced on April 2: import taxes of up to 50% on goods from countries that have a trade surplus with the United States, along with 10% “baseline’’ taxes on almost everyone else. That move triggered sell-offs in financial markets and Trump backtracked to allow time for trade talks. The president has bypassed Congress, which has authority over taxes, by invoking a 1977 law to declare the trade deficit a national emergency. That's being challenged in court, but the revised tariffs still took effect. To keep their access to the huge American market, major trading partners have struck deals with Trump. The United Kingdom agreed to 10% tariffs and the European Union, South Korea and Japan accepted U.S. tariffs of 15%. Those are much higher than the low single-digit rates they paid last year, but down from the 30% Trump had ordered for the EU and the 25% he ordered for Japan. Countries in Africa and Asia are mostly facing lower rates than the ones Trump decreed in April. Thailand, Pakistan, South Korea, Vietnam, Indonesia and the Philippines cut deals with Trump, settling for rates of around 20%. Indonesia views its 19% tariff deal as a leg up against exporters in other countries that will have to pay slightly more, said Fithra Faisal Hastiadi, a spokesperson in the Indonesian president's office. “We were competing against Vietnam, India, Bangladesh, Sri Lanka and China ... and they are all subject to higher reciprocal tariffs,” Hastiadi said. “We believe we will stay competitive.” Trump has yet to announce whether he will extend an Aug. 12 deadline for reaching a trade agreement with China that would forestall earlier threats of tariffs of up to 245%. Treasury Secretary Scott Bessent said the president is deciding about another 90-day delay to allow time to work out details of an agreement setting tariffs on most products at 50%, including extra import duties related to illicit trade in fentanyl. Higher import taxes on small parcels from China have hurt smaller factories and layoffs have accelerated, leaving some 200 million workers reliant on “flexible work” — the gig economy — for their livelihoods, the government estimates. India also has no broad trade agreement with Trump. On Wednesday, Trump he signed an executive order placing an extra 25% tariff for its purchases of Russian oil, bringing combined U.S. tariffs to 50%. India's Foreign Ministry has stood firm, saying it began importing oil from Russia because traditional supplies were diverted to Europe after the outbreak of the Ukraine conflict, a “necessity compelled by the global market situation.” Struggling, impoverished Laos and war-torn Myanmar and Syria face 40-41% rates. Trump whacked Brazil with a 50% import tax largely because he’s unhappy with its treatment of former Brazilian President Jair Bolsonaro. South Africa said the steep 30% rate Trump has ordered on the exporter of precious gems and metals has put 30,000 jobs at risk and left the country scrambling to find new markets outside the United States. Even wealthy Switzerland is under the gun. Swiss officials were visiting Washington this week to try to stave off a whopping 39% tariff on U.S. imports of its chocolate, watches and other products. The rate is over 2 1/2 times the 15% rate on European Union goods exported to the United States. Goods that comply with the 2020 United States-Mexico-Canada Agreement that Trump negotiated during his first term are excluded from the tariffs. Even though U.S. neighbor and ally Canada was hit by a 35% tariff after it defied Trump, a staunch supporter of Israeli Prime Minister Benjamin Netanyahu, by saying it would recognize a Palestinian state, nearly all of its exports to the U.S. remain duty free. Canada’s central bank says 100% of energy exports and 95% of other exports are compliant with the agreement since regional rules mean Canadian and Mexico companies can claim preferential treatment. The slice of Mexican exports not covered by the USMCA is subject to a 25% tariff, down from an earlier rate of 30%, during a 90-day negotiating period that began last week. Surveys of factory managers offer monthly insights into export orders, hiring and other indicators of how businesses are faring. The latest figures in the United States and globally mostly showed conditions deteriorating. In Japan, factory output contracted in July, purchasing activity fell and hiring slowed, according to the S&P Global Manufacturing PMI. But the data were collected before Trump announced a trade deal that cut tariffs on Japanese exports to 15% from 25%. Similar surveys show a deterioration in manufacturing conditions worldwide, as a boost from “front loading” export orders to beat higher tariffs faded, S&P Global said. Similar measures for service industries have remained stronger, reflecting more domestic business activity. In Asia, that includes a rebound in tourism across the region. Corporate bottom lines are also taking a hit. Honda Motor said Wednesday that it estimates the cost from higher tariffs at about $3 billion. On top that, the U.S. economy — Trump's trump card as the world's biggest market — is starting to show pain from months of tariff threats. ___ Associated Press writer Niniek Karmini in Jakarta and Aniruddha Ghosal in Hanoi contributed. Before you make your next trade, you'll want to hear this. MarketBeat keeps track of Wall Street's top-rated and best performing research analysts and the stocks they recommend to their clients on a daily basis. Our team has identified the five stocks that top analysts are quietly whispering to their clients to buy now before the broader market catches on... and none of the big name stocks were on the list. They believe these five stocks are the five best companies for investors to buy now... See The Five Stocks Here Looking for the next FAANG stock before everyone has heard about it? Enter your email address to see which stocks MarketBeat analysts think might become the next trillion dollar tech company."
Sony raises its profit forecast after saying it expects less damage from Trump's tariffs,https://www.marketbeat.com/articles/sony-raises-its-profit-forecast-after-saying-it-expects-less-damage-from-trumps-tariffs-2025-08-07/,"TOKYO (AP) — Japanese entertainment and electronics company Sony said Thursday that its profit surged 23% in the last quarter from the year before, as damage from U.S. President Donald Trump’s tariffs was less than it had expected. The Tokyo-based manufacturer reported its April-June profit totaled 259 billion yen, or $1.8 billion, up from 210 billion yen. Quarterly sales edged up 2% to 2.6 trillion yen ($17.7 billion) as demand grew for games and network services, imaging solutions and sensors. The maker of PlayStation game machines, digital cameras, Walkman audio players and Spider-Man movies said those positive factors offset the negative impact from unfavorable exchanges rates. Sony said its network business also was drawing more subscribers to its online services. Sony raised its forecast for its profit in the full fiscal year until March 2026 to 970 billion yen ($6.6 billion), from an earlier forecast of 930 billion yen ($6.3 billion). The revised projection is still lower than what it earned in the previous fiscal year at 1 trillion yen. Sony now estimates the impact of the additional U.S. tariffs on its operating income at 70 billion yen ($476 million), much better than the initial estimate of 100 billion yen ($680 million). One of the successes among Sony's entertainment franchises was the latest “Demon Slayer” animation movie, which is part of a hit series and is doing well at the box office. ___ Yuri Kageyama is on Threads: https://www.threads.com/@yurikageyama Before you make your next trade, you'll want to hear this. MarketBeat keeps track of Wall Street's top-rated and best performing research analysts and the stocks they recommend to their clients on a daily basis. Our team has identified the five stocks that top analysts are quietly whispering to their clients to buy now before the broader market catches on... and none of the big name stocks were on the list. They believe these five stocks are the five best companies for investors to buy now... See The Five Stocks Here Market downturns give many investors pause, and for good reason. Wondering how to offset this risk? Enter your email address to learn more about using beta to protect your portfolio."
Sony raises its profit forecast after saying it expects less damage from Trump's tariffs,https://www.marketbeat.com/articles/sony-raises-its-profit-forecast-after-saying-it-expects-less-damage-from-trumps-tariffs-2025-08-07/,"TOKYO (AP) — Japanese entertainment and electronics company Sony said Thursday that its profit surged 23% in the last quarter from the year before, as damage from U.S. President Donald Trump’s tariffs was less than it had expected. The Tokyo-based manufacturer reported its April-June profit totaled 259 billion yen, or $1.8 billion, up from 210 billion yen. Quarterly sales edged up 2% to 2.6 trillion yen ($17.7 billion) as demand grew for games and network services, imaging solutions and sensors. The maker of PlayStation game machines, digital cameras, Walkman audio players and Spider-Man movies said those positive factors offset the negative impact from unfavorable exchanges rates. Sony said its network business also was drawing more subscribers to its online services. Sony raised its forecast for its profit in the full fiscal year until March 2026 to 970 billion yen ($6.6 billion), from an earlier forecast of 930 billion yen ($6.3 billion). The revised projection is still lower than what it earned in the previous fiscal year at 1 trillion yen. Sony now estimates the impact of the additional U.S. tariffs on its operating income at 70 billion yen ($476 million), much better than the initial estimate of 100 billion yen ($680 million). One of the successes among Sony's entertainment franchises was the latest “Demon Slayer” animation movie, which is part of a hit series and is doing well at the box office. ___ Yuri Kageyama is on Threads: https://www.threads.com/@yurikageyama Before you make your next trade, you'll want to hear this. MarketBeat keeps track of Wall Street's top-rated and best performing research analysts and the stocks they recommend to their clients on a daily basis. Our team has identified the five stocks that top analysts are quietly whispering to their clients to buy now before the broader market catches on... and none of the big name stocks were on the list. They believe these five stocks are the five best companies for investors to buy now... See The Five Stocks Here Looking for the next FAANG stock before everyone has heard about it? Enter your email address to see which stocks MarketBeat analysts think might become the next trillion dollar tech company."
RSI Stock Soars 22% On Q2 Blowout—Will PENN Match the Momentum?,https://www.marketbeat.com/originals/rsi-stock-soars-22-after-q2-blowoutwill-penn-match-the-momentum/,"Online casino and sports betting firm Rush Street Interactive Inc. NYSE: RSI has been one of the biggest surprises of the second-quarter earnings period. The company's impressive earnings report sent shares skyrocketing by nearly 22% in the span of just five days. With major wins for both Rush Street's online casino business and its sports betting operations, the company seems poised for continued growth going forward. Beyond the implications of a strong quarter for Rush Street in particular, however, is the suggestion that this could be the first of several online casino names to win this earnings season. Indeed, advances in AI and user experience, growing certainty surrounding regulations, the rise of data-driven personalization of casino experiences, and a customer shift toward a younger demographic may all be contributing to a noteworthy moment for online gaming companies. As major competitors like PENN Entertainment Inc. NASDAQ: PENN deliver their most recent quarterly updates, investors will get a clearer picture of whether Rush Street was an indicator of wins for the industry as a whole or a standout player on its own. Before comparing RSI to others in the space, it’s important to understand the full scope of Rush Street's recent earnings win. The company's revenue grew by 22% year-over-year (YOY), reaching record levels, while its EBITDA jumped by an impressive 88% over the same period. These gains were driven by 25% and 15% increases, respectively, in revenue from the firm's online casino and sports betting segments. Rush Street's global popularity is expanding, as the company saw a YOY surge in monthly active users (MAUs) in North America (30%) as well as Latin America (40%). While it was growing at a rapid pace, Rush Street also managed to stay debt-free and continue building its stockpile of $241 million in cash reserves. The company expects slightly more modest full-year revenue and EBITDA growth of 16% and 51%, respectively, as it raised its full-year guidance. Analysts are largely bullish on Rush Street, as eight out of 10 rated RSI a Buy, despite the fact that the recent rally sent the stock price just above the consensus price target of around $18 per share. Despite being just over half the size of Rush Street, PENN Entertainment's smaller size, the company is expanding rapidly. It has multiple growth projects in development for the next several quarters, including a land-based casino planned in Iowa valued at up to $200 million. On the digital front, PENN continues to invest in its iCasino and online sports betting offerings, particularly after its acquisition of theScore and strategic pivot away from Barstool Sportsbook. These moves aim to tighten integration across platforms and appeal to younger digital-first audiences. Its partnership with ESPN for ESPN BET has garnered attention but also heightened expectations. When PENN reports second-quarter earnings, investors will hope to see signs of continued progress on its multiple developments and, ideally, a strong improvement in top- and bottom-line performance. Despite some volatility in earnings performance in past quarters, the company’s liquidity remains strong, and it continues to execute on long-term growth plans. All told, though, analysts feel positively about PENN shares, with 11 out of 19 calling the company a Buy and setting a consensus price target suggesting about 33% in upside potential. Still, concerns persist around execution risk, brand differentiation in a crowded space, and the delayed payoff of long-term strategic bets. Rush Street’s Q2 performance shows that an online casino firm can deliver growth and profitability at scale, both domestically and internationally, with disciplined marketing and rising user value. With strong fundamentals and raised guidance, RSI is currently setting the pace in its segment. As investors await PENN’s upcoming earnings report on Aug. 7, the key question is whether it can mirror RSI’s momentum or forge a different path to growth through its hybrid land-based and digital strategy. PENN’s execution will be especially important given the competitive and evolving landscape. Notably, casino competitor DraftKings NASDAQ: DKNG reported a surprise slight earnings miss this quarter. Despite its scale and dominant sportsbook footprint, the company reported an EPS of 38 cents, slightly short of the analyst expectations of 41 cents. That miss raises the possibility that RSI’s performance isn’t just a rising tide lifting all boats, but rather a sign of company-specific outperformance. It also puts added pressure on PENN to demonstrate clear strategic gains. All told, RSI's breakout quarter could be a turning point for investor confidence in mid-tier digital gaming firms, especially if PENN can validate the trend. But if PENN underwhelms, it may reinforce the notion that Rush Street is the outlier, not the bellwether. Before you consider Rush Street Interactive, you'll want to hear this. MarketBeat keeps track of Wall Street's top-rated and best performing research analysts and the stocks they recommend to their clients on a daily basis. MarketBeat has identified the five stocks that top analysts are quietly whispering to their clients to buy now before the broader market catches on... and Rush Street Interactive wasn't on the list. While Rush Street Interactive currently has a Moderate Buy rating among analysts, top-rated analysts believe these five stocks are better buys. View The Five Stocks Here Wondering where to start (or end) with AI stocks? These 10 simple stocks can help investors build long-term wealth as artificial intelligence continues to grow into the future."
"Trump's broad tariffs go into effect, just as economic pain is surfacing",https://www.marketbeat.com/articles/trumps-broad-tariffs-go-into-effect-just-as-economic-pain-is-surfacing-2025-08-06/,"WASHINGTON (AP) — President Donald Trump was set to officially begin levying higher import taxes on dozens of countries Thursday, just as the economic fallout of his monthslong tariff threats has begun to create visible damage for the U.S. economy. The White House said that starting just after midnight that goods from more than 60 countries and the European Union would face tariff rates of 10% or higher. Products from the European Union, Japan and South Korea will be taxed at 15%, while imports from Taiwan, Vietnam and Bangladesh will be taxed at 20%. For places such as the EU, Japan and South Korea, Trump also expects them to invest hundreds of billions of dollars in the U.S. “I think the growth is going to be unprecedented,” Trump said Wednesday afternoon. He added that the U.S. was “taking in hundreds of billions of dollars in tariffs,” but he couldn't provide a specific figure for revenues because “we don’t even know what the final number is” regarding tariff rates. Despite the uncertainty, the Trump White House is confident that the onset of his broad tariffs will provide clarity about the path of the world's largest economy. Now that companies understand the direction the U.S. is headed, the administration believes they can ramp up new investments and jump-start hiring in ways that can rebalance the U.S. economy as a manufacturing power. But so far, there are signs of self-inflicted wounds to America as companies and consumers alike brace for the impact of new taxes. What the data has shown is a U.S. economy that changed in April with Trump’s initial rollout of tariffs, an event that led to market drama, a negotiating period and Trump's ultimate decision to start his universal tariffs on Thursday. After April, economic reports show that hiring began to stall, inflationary pressures crept upward and home values in key markets started to decline, said John Silvia, CEO of Dynamic Economic Strategy. “A less productive economy requires fewer workers,” Silvia said in an analysis note. “But there is more, the higher tariff prices lower workers' real wages. The economy has become less productive, and firms cannot pay the same real wages as before. Actions have consequences.” Even then, the ultimate transformations of the tariffs are unknown and could play out over months, if not years. Many economists say the risk is that the American economy is steadily eroded rather than collapsing instantly. “We all want it to be made for television where it’s this explosion — it’s not like that,” said Brad Jensen, a professor at Georgetown University. “It’s going to be fine sand in the gears and slow things down.” Trump has promoted the tariffs as a way to reduce the persistent trade deficit. But importers sought to avoid the taxes by importing more goods before the taxes went into effect. As a result, the $582.7 billion trade imbalance for the first half of the year was 38% higher than in 2024. Total construction spending has dropped 2.9% over the past year, and the factory jobs promised by Trump have so far resulted in job losses. The lead-up to Thursday fit the slapdash nature of Trump's tariffs, which have been variously rolled out, walked back, delayed, increased, imposed by letter and frantically renegotiated. The process has been so muddled that officials for key trade partners were unclear at the start of the week whether the tariffs would begin Thursday or Friday. The language of the July 31 order to delay the start of tariffs from Aug. 1 said the higher tax rates would start in seven days. On Wednesday morning, Kevin Hassett, director of the White House National Economic Council, was asked if the new tariffs began at midnight Thursday, and he said reporters should check with the U.S. Trade Representative's Office. Trump on Wednesday announced additional 25% tariffs to be imposed on India for its buying of Russian oil, bringing their total import taxes to 50%. He has said that import taxes are still coming on pharmaceutical drugs and announced 100% tariffs on computer chips, meaning the U.S. economy could remain in a place of suspended animation as it awaits the impact. The president's use of a 1977 law to declare an economic emergency to impose the tariffs is also under challenge. The impending ruling from last week's hearing before a U.S. appeals court could cause Trump to find other legal justifications if judges say he exceeded his authority. Even people who worked with Trump during his first term are skeptical that things will go smoothly for the economy, such as Paul Ryan, the former Republican House speaker, who has emerged as a Trump critic. “There’s no sort of rationale for this other than the president wanting to raise tariffs based upon his whims, his opinions,” Ryan told CNBC on Wednesday. “I think choppy waters are ahead because I think they’re going to have some legal challenges.” Still, the stock market has been solid during the recent tariff drama, with the S&P 500 index climbing more than 25% from its April low. The market's rebound and the income tax cuts in Trump's tax and spending measures signed into law on July 4 have given the White House confidence that economic growth is bound to accelerate in the coming months. As of now, Trump still foresees an economic boom while the rest of the world and American voters wait nervously. “There’s one person who can afford to be cavalier about the uncertainty that he’s creating, and that’s Donald Trump,” said Rachel West, a senior fellow at The Century Foundation who worked in the Biden White House on labor policy. “The rest of Americans are already paying the price for that uncertainty.” Before you make your next trade, you'll want to hear this. MarketBeat keeps track of Wall Street's top-rated and best performing research analysts and the stocks they recommend to their clients on a daily basis. Our team has identified the five stocks that top analysts are quietly whispering to their clients to buy now before the broader market catches on... and none of the big name stocks were on the list. They believe these five stocks are the five best companies for investors to buy now... See The Five Stocks Here Enter your email address and we'll send you MarketBeat's list of seven stocks and why their long-term outlooks are very promising."
