title,link,content
"Broken altimeter, ignored warnings: Hearings reveal what went wrong in DC crash that killed 67",https://www.marketbeat.com/articles/broken-altimeter-ignored-warnings-hearings-reveal-what-went-wrong-in-dc-crash-that-killed-67-2025-08-02/,"Over three days of sometimes contentious hearings this week, the National Transportation Safety Board interrogated Federal Aviation Administration and Army officials about a list of things that went wrong and contributed to a Black Hawk helicopter and a passenger jet colliding over Washington, D.C., killing 67 people. The biggest revelations: The helicopter's altimeter gauge was broken, and controllers warned the FAA years earlier about the dangers that helicopters presented. At one point NTSB Chairwoman Jennifer Homendy scolded the FAA for not addressing safety concerns. “Are you kidding me? Sixty-seven people are dead! How do you explain that? Our bureaucratic process?” she said. “Fix it. Do better.” Victims of the January crash included a group of elite young figure skaters, their parents and coaches and four union steamfitters from the Washington area. Here is a look at the major takeaways from the hearings about the collision, which alarmed travelers before a string of other crashes and close calls this year added to their worries about flying: The helicopter was flying at 278 feet (85 meters) — well above the 200-foot (61-meter) ceiling on that route — when it collided with the airliner. But investigators said the pilots might not have realized that because the barometric altimeter they were relying on was reading 80 to 100 feet (24 to 30 meters) lower than the altitude registered by the flight data recorder. The NTSB subsequently found similar discrepancies in the altimeters of three other helicopters from the same unit. An expert with Sikorsky, which makes the Black Hawks, said the one that crashed was an older model that lacked the air data computers that make for more accurate altitude readings in newer versions. Army Chief Warrant Officer Kylene Lewis told the board that an 80- to 100-foot (24- to 30-meter) discrepancy between the different altimeters on a helicopter would not be alarming, because at lower altitudes she would be relying more on the radar altimeter than the barometric altimeter. Plus Army pilots strive to stay within 100 feet (30 meters) of target altitude on flights, so they could still do that even with their altimeters that far off. But Rick Dressler of medevac operator Metro Aviation told the NTSB that imprecision would not fly with his helicopters. When a helicopter route like the one the Black Hawk was flying that night includes an altitude limit, Dressler said, his pilots consider that a hard ceiling. Both tried to deflect responsibility for the crash, but the testimony highlighted plenty of things that might have been done differently. The NTSB’s final report will be done next year, but there likely will not be one single cause identified for the crash. “I think it was a week of reckoning for the FAA and the U.S. Army in this accident,” aviation safety consultant and former crash investigator Jeff Guzzetti said. Army officials said the greater concern is that the FAA approved routes around Ronald Reagan International Airport with separation distances as small as 75 feet (23 meters) between helicopters and planes when planes are landing on a certain runway at Reagan. “The fact that we have less than 500-foot separation is a concern for me,” said Scott Rosengren, chief engineer in the office that manages the Army’s utility helicopters. Army Chief Warrant Officer David Van Vechten said he was surprised the air traffic controller let the helicopter proceed while the airliner was circling to land at Reagan’s secondary runway, which is used when traffic for the main runway stacks up and accounts for about 5% of flights. Van Vechten said he was never allowed to fly under a landing plane as the Black Hawk did, but only a handful of the hundreds of times he flew that route involved planes landing on that runway. Other pilots in the unit told crash investigators it was routine to be directed to fly under landing planes, and they believed that was safe if they stuck to the approved route. Frank McIntosh, the head of the FAA’s air traffic control organization, said he thinks controllers at Reagan “were really dependent upon the use of visual separation” to keep traffic moving through the busy airspace. The NTSB said controllers repeatedly said they would just “make it work.” They sometimes used “squeeze plays” to land planes with minimal separation. On the night of the crash, a controller twice asked the helicopter pilots whether they had the jet in sight, and the pilots said they did and asked for visual separation approval so they could use their own eyes to maintain distance. Testimony at the hearing raised serious questions about how well the crew could spot the plane while wearing night vision goggles and whether the pilots were even looking in the right spot. The controller acknowledged in an interview that the plane’s pilots were never warned when the helicopter was on a collision path, but controllers did not think telling the plane would have made a difference at that point. The plane was descending to land and tried to pull up at the last second after getting a warning in the cockpit, but it was too late. An FAA working group tried to get a warning added to helicopter charts back in 2022 urging pilots to use caution whenever the secondary runway was in use, but the agency refused. The working group said “helicopter operations are occurring in a proximity that has triggered safety events. These events have been trending in the wrong direction and increasing year over year.” Separately, a different group at the airport discussed moving the helicopter route, but those discussions did not go anywhere. And a manager at a regional radar facility in the area urged the FAA in writing to reduce the number of planes taking off and landing at Reagan because of safety concerns. The NTSB has also said the FAA failed to recognize a troubling history of 85 near misses around Reagan in the three years before the collision, NTSB Chairwoman Jennifer Homendy said “every sign was there that there was a safety risk and the tower was telling you that.” But after the accident, the FAA transferred managers out of the airport instead of acknowledging that they had been warned. “What you did is you transferred people out instead of taking ownership over the fact that everybody in FAA in the tower was saying there was a problem,” Homendy said. “But you guys are pointing out, ‘Welp, our bureaucratic process. Somebody should have brought it up at some other symposium.’” ___ Associated Press writer Leah Askarinam contributed. Before you make your next trade, you'll want to hear this. MarketBeat keeps track of Wall Street's top-rated and best performing research analysts and the stocks they recommend to their clients on a daily basis. Our team has identified the five stocks that top analysts are quietly whispering to their clients to buy now before the broader market catches on... and none of the big name stocks were on the list. They believe these five stocks are the five best companies for investors to buy now... See The Five Stocks Here Enter your email address and we'll send you MarketBeat's list of seven best retirement stocks and why they should be in your portfolio."
India indicates it will keep buying Russian oil despite Trump's threats,https://www.marketbeat.com/articles/india-indicates-it-will-keep-buying-russian-oil-despite-trumps-threats-2025-08-02/,"NEW DELHI (AP) — India has indicated that it would continue buying oil from Russia despite threats by U.S. President Donald Trump. The Indian foreign ministry said its relationship with Russia was “steady and time-tested,” and should not be seen through the prism of a third country. Addressing a weekly presser on Friday, spokesman Randhir Jaiswal said India’s broader stance on securing its energy needs was guided by the availability of oil in the markets and prevailing global circumstances. The comments follow an announcement by President Donald Trump that he intends to impose a 25% tariff on goods from India plus an additional import tax because of New Delhi’s purchases of Russian oil. The threat came as the U.S. president has increasingly soured on Russia for failing to agree to a ceasefire in Ukraine and has threatened new economic sanctions if progress is not made. India bought 68,000 barrels per day of crude oil from Russia in January 2022, but by June of same year oil imports rose to 1.12 million barrels per day. The daily imports peaked at 2.15 million in May 2023 and have varied since. Supplies rose as high as nearly 40% of India's imports at one point, making Moscow the largest supplier of crude to New Delhi, the Press Trust of India reported, citing data from Kpler, a data analytics company. India’s daily oil consumption is pegged around 5.5 million barrels, of which nearly 88% is met through imports. The country has historically bought most of its crude from the Middle East, but this has changed since Russia's full-scale invasion of Ukraine in February 2022. India, the world’s third-largest crude importer after China and the U.S., began buying Russian oil available at discounted rates after the West shunned it to punish Moscow. Before you make your next trade, you'll want to hear this. MarketBeat keeps track of Wall Street's top-rated and best performing research analysts and the stocks they recommend to their clients on a daily basis. Our team has identified the five stocks that top analysts are quietly whispering to their clients to buy now before the broader market catches on... and none of the big name stocks were on the list. They believe these five stocks are the five best companies for investors to buy now... See The Five Stocks Here MarketBeat's analysts have just released their top five short plays for August 2025. Learn which stocks have the most short interest and how to trade them. Enter your email address to see which companies made the list."
What to know if you're at risk of having your wages garnished over student loan debt,https://www.marketbeat.com/articles/what-to-know-if-youre-at-risk-of-having-your-wages-garnished-over-student-loan-debt-2025-08-02/,"NEW YORK (AP) — Millions of student borrowers could begin having their wages garnished as soon as this summer, according to estimates from credit bureau TransUnion. The company predicts that by August roughly 3 million borrowers could move into default, meaning they're 270 days past due on payments. At that point, loan holders are at risk of having 15% of their pay docked by the government, with the money going toward the outstanding debt. There has been no clear indication of when wage garnishment will start. After the pandemic-era pause on student loan payments ended in May, borrowers have had to reassess the state of their loans and budgets. According to TransUnion, another 2 million borrowers are on course to default in September. A Biden-administration grace period, during which late or missed payments were not counted against credit scores, ended in the fall. Since then, millions of borrowers have seen hits to their credit ratings. Here's what to know: “The most important thing borrowers can do before administrative wage garnishment restarts is to log into studentaid.gov to check whether their federal student loans are in default and take steps now to remove them from default,” said Kyra Taylor, staff attorney at the National Consumer Law Center. Taylor said it's not uncommon for borrowers to be unaware that their loans are in default. If borrowers attended college or graduate school during different periods of time, or if they have different federal loan types, they may also have multiple student loan servicers. If that's the case, you should act now to get your loans out of default and back into good standing by either entering a rehabilitation agreement, where you must make nine consecutive payments based on their income, or by consolidating your loans into a new federal Direct Loan. “Because this hasn’t happened for so long, there are many people who have no idea they’re at risk,"" said Aissa Canchola Bañez, policy director at the Student Borrower Protection Center. Wait times for student borrowers attempting to contact their loan servicers have been long, with many dropped calls, in part due to layoffs at the Education Department. Bañez recommends contacting your congressperson, using a casework tool that can guide you through submitting a constituent request. “These offices have entire teams dedicated to constituent casework for when you have an issue with a federal agency, such as the Department of Education,” she said. “So you can request assistance from your member of congress — your representative or senator.” Until past due payments are paid or the loan's default status is resolved, borrowers are at risk of having up to 15% of their wages deducted directly from their paychecks. The Department of Education has sent notices to borrowers warning that tax refunds and wages could be withheld starting this summer if borrowers don’t take steps to restart payments. The department hasn’t yet provided additional information on timing. Richelle Brooks, 37, an education administrator based in Los Angeles, said she's received warnings and notices about the resumption of collection of her loans. For several degrees, she still has $239,000 in outstanding debt, and she was informed her monthly payments on those loans will be roughly $3,000. “I can't afford it,” she said. “We just came out of the moratorium — not paying for five years. People getting these notices — they're terrified. I'm uneasy, too."" Brooks said she's an informed borrower who stays up to date on each development and who knows her options. She plans to enroll in coding classes, at least half-time, which could place her loans in deferment, so she wouldn't be required to make monthly payments, while she makes a financial plan. There's still time to take action. According to Taylor, the Department of Education must provide 30 days notice before it sends a garnishment order to your employer. During that time, you can request a hearing to object by telling the department that the garnishment would cause you financial hardship. You can also request that the department reduce the amount being garnished and submit documentation about your income and expenses. To do this, you must make your hearing request in writing, postmarked no later than 30 days after the garnishment order. Your loan holder will then arrange the hearing. If you're unsure who your loan holder is, you can contact the Education Department's Default Resolution Group. If you were laid off from your last job, you can also object to garnishment if you have not been in your current job for 12 consecutive months. You can further request a hearing and object if you submitted an application for certain kinds of statutory discharges and those have not yet been decided. Some common reasons for statutory discharge of student loans include: if the school you attended closed before you could complete your degree, if your school owes you a refund but fails to pay it, if you're experiencing total disability, or if you're experiencing bankruptcy. “If the borrower requests a hearing within 30 days after receiving the garnishment notice, the department cannot start garnishment until it issues a decision on the borrower’s objections and financial hardship request,” Taylor said. You can request a hearing after the 30 day period is up, but in those cases the department will generally not stop garnishing your wages while the hearing request is pending. ___ The Associated Press receives support from Charles Schwab Foundation for educational and explanatory reporting to improve financial literacy. The independent foundation is separate from Charles Schwab and Co. Inc. The AP is solely responsible for its journalism. Before you consider TransUnion, you'll want to hear this. MarketBeat keeps track of Wall Street's top-rated and best performing research analysts and the stocks they recommend to their clients on a daily basis. MarketBeat has identified the five stocks that top analysts are quietly whispering to their clients to buy now before the broader market catches on... and TransUnion wasn't on the list. While TransUnion currently has a Moderate Buy rating among analysts, top-rated analysts believe these five stocks are better buys. View The Five Stocks Here Enter your email address and we'll send you MarketBeat's list of seven stocks and why their long-term outlooks are very promising."
"From Laos to Brazil, Trump's tariffs leave a lot of losers. But even the winners will pay a price",https://www.marketbeat.com/articles/from-laos-to-brazil-trumps-tariffs-leave-a-lot-of-losers-but-even-the-winners-will-pay-a-price-2025-08-02/,"WASHINGTON (AP) — President Donald Trump’s tariff onslaught this week left a lot of losers – from small, poor countries like Laos and Algeria to wealthy U.S. trading partners like Canada and Switzerland. They’re now facing especially hefty taxes – tariffs – on the products they export to the United States starting Aug. 7. The closest thing to winners may be the countries that caved to Trump's demands — and avoided even more pain. But it's unclear whether anyone will be able to claim victory in the long run — even the United States, the intended beneficiary of Trump’s protectionist policies. “In many respects, everybody’s a loser here,’’ said Barry Appleton, co-director of the Center for International Law at the New York Law School. Barely six months after he returned to the White House, Trump has demolished the old global economic order. Gone is one built on agreed-upon rules. In its place is a system in which Trump himself sets the rules, using America’s enormous economic power to punish countries that won’t agree to one-sided trade deals and extracting huge concessions from the ones that do. “The biggest winner is Trump,” said Alan Wolff, a former U.S. trade official and deputy director-general at the World Trade Organization. “He bet that he could get other countries to the table on the basis of threats, and he succeeded – dramatically.’’ Everything goes back to what Trump calls “Liberation Day’’ – April 2 – when the president announced “reciprocal’’ taxes of up to 50% on imports from countries with which the United States ran trade deficits and 10% “baseline’’ taxes on almost everyone else. He invoked a 1977 law to declare the trade deficit a national emergency that justified his sweeping import taxes. That allowed him to bypass Congress, which traditionally has had authority over taxes, including tariffs — all of which is now being challenged in court. Trump retreated temporarily after his Liberation Day announcement triggered a rout in financial markets and suspended the reciprocal tariffs for 90 days to give countries a chance to negotiate. Eventually, some of them did, caving to Trump’s demands to pay what four months ago would have seemed unthinkably high tariffs for the privilege of continuing to sell into the vast American market. The United Kingdom agreed to 10% tariffs on its exports to the United States — up from 1.3% before Trump amped up his trade war with the world. The U.S. demanded concessions even though it had run a trade surplus, not a deficit, with the UK for 19 straight years. The European Union and Japan accepted U.S. tariffs of 15%. Those are much higher than the low single-digit rates they paid last year — but lower than the tariffs he was threatening (30% on the EU and 25% on Japan). Also cutting deals with Trump and agreeing to hefty tariffs were Pakistan, South Korea, Vietnam, Indonesia and the Philippines. Even countries that saw their tariffs lowered from April without reaching a deal are still paying much higher tariffs than before Trump took office. Angola's tariff, for instance, dropped to 15% from 32% in April, but in 2022 it was less than 1.5%. And while Trump administration cut Taiwan's tariff to 20% from 32% in April, the pain will still be felt. “20% from the beginning has not been our goal, we hope that in further negotiations we will get a more beneficial and more reasonable tax rate,” Taiwan’s president Lai Ching-te told reporters in Taipei Friday. Trump also agreed to reduce the tariff on the tiny southern African kingdom of Lesotho to 15% from the 50% he’d announced in April, but the damage may already have been done there. Countries that didn't knuckle under — and those that found other ways to incur Trump's wrath — got hit harder. Even some poorer countries were not spared. Laos' annual economic output comes to $2,100 per person and Algeria's $5,600 — versus America's $75,000. Nonetheless, Laos got rocked with a 40% tariff and Algeria with a 30% levy. Trump slammed Brazil with a 50% import tax largely because he didn't like the way it was treating former Brazilian President Jair Bolsonaro, who is facing trial for trying to lose his electoral defeat in 2022. Never mind that the U.S. has exported more to Brazil than it's imported every year since 2007. Trump's decision to plaster a 35% tariff on longstanding U.S. ally Canada was partly designed to threaten Ottawa for saying it would recognize a Palestinian state. Trump is a staunch supporter of Israeli Prime Minister Benjamin Netanyahu. Switzerland was clobbered with a 39% import tax — even higher than the 31% Trump originally announced on April 2. ""The Swiss probably wish that they had camped in Washington'' to make a deal, said Wolff, now senior fellow at the Peterson Institute for International Economics. ""They’re clearly not at all happy.’’ Fortunes may change if Trump's tariffs are upended in court. Five American businesses and 12 states are suing the president, arguing that his Liberation Day tariffs exceeded his authority under the 1977 law. In May, the U.S. Court of International Trade, a specialized court in New York, agreed and blocked the tariffs, although the government was allowed to continue collecting them while its appeal wend its way through the legal system, and may likely end up at the U.S. Supreme Court. In a hearing Thursday, the judges on the U.S. Court of Appeals for the Federal Circuit sounded skeptical about Trump's justifications for the tariffs. “If (the tariffs) get struck down, then maybe Brazil’s a winner and not a loser,’’ Appleton said. Trump portrays his tariffs as a tax on foreign countries. But they are actually paid by import companies in the U.S. who try to pass along the cost to their customers via higher prices. True, tariffs can hurt other countries by forcing their exporters to cut prices and sacrifice profits — or risk losing market share in the United States. But economists at Goldman Sachs estimate that overseas exporters have absorbed just one-fifth of the rising costs from tariffs, while Americans and U.S. businesses have picked up the most of the tab. Walmart, Procter & Gamble, Ford, Best Buy, Adidas, Nike, Mattel and Stanley Black & Decker, have all hiked prices due to U.S. tariffs ""This is a consumption tax, so it disproportionately affects those who have lower incomes,'' Appleton said. “Sneakers, knapsacks ... your appliances are going to go up. Your TV and electronics are going to go up. Your video game devices, consoles are going to up because none of those are made in America.’’ Trump’s trade war has pushed the average U.S. tariff from 2.5% at the start of 2025 to 18.3% now, the highest since 1934, according to the Budget Lab at Yale University. And that will impose a $2,400 cost on the average household, the lab estimates. “The U.S. consumer’s a big loser,″ Wolff said. ____ AP Economics Writer Christopher Rugaber contributed to this story. Before you make your next trade, you'll want to hear this. MarketBeat keeps track of Wall Street's top-rated and best performing research analysts and the stocks they recommend to their clients on a daily basis. Our team has identified the five stocks that top analysts are quietly whispering to their clients to buy now before the broader market catches on... and none of the big name stocks were on the list. They believe these five stocks are the five best companies for investors to buy now... See The Five Stocks Here Looking for the next FAANG stock before everyone has heard about it? Enter your email address to see which stocks MarketBeat analysts think might become the next trillion dollar tech company."
