title,link,content
"Nvidia is again Wall Street's most valuable company. How it got there, by the numbers",https://www.marketbeat.com/articles/nvidia-is-again-wall-streets-most-valuable-company-how-it-got-there-by-the-numbers-2025-07-09/,"Nvidia reached another milestone in its rise to becoming one of the world's most important companies: the first publicly traded company to reach a market value of $4 trillion. Nvidia and other companies benefiting from the boom in artificial intelligence have been a major reason the S&P 500 has recently climbed to a record. Their explosion of profits has helped to propel the market despite worries about possible pain coming for the U.S. economy from tariffs and other policies of President Donald Trump. The company’s journey to be one of the world's most prominent companies has produced some eye-popping numbers. Here’s a look. Nvidia’s total market value as of early Wednesday, tops in the S&P 500. It closed with a market value of $3.972 trillion. Nvidia took over the No. 1 spot from Microsoft ($3.742 trillion) two weeks ago. Apple is the only other company with a market value above $3 trillion ($3.154 trillion). Nvidia’s market value in July 2023 was around $1.050 trillion. The approximate gain in Nvidia’s stock price since the start of 2023. A $100,000 investment in Nvidia two and a half years ago would now be worth more than $1,100,000. The shares are up about 21% so far this year. Nvidia’s estimate for overall revenue in the May-July quarter, roughly in line with Wall Street estimates. The estimated loss in sales for the quarter due to the U.S. government’s restrictions on Nvidia's chip sales to China. Analysts’ estimate for Nvidia’s revenue for the fiscal year that ends in January 2026, according to FactSet. That would be more than 50% above its revenue for fiscal 2025 and more than three times its receipts from the year before that. By comparison, Microsoft's revenue for its fiscal year ended in June is estimated by analysts at $279 billion. The number of the latest iPhones one could buy with $4 trillion. Before you make your next trade, you'll want to hear this. MarketBeat keeps track of Wall Street's top-rated and best performing research analysts and the stocks they recommend to their clients on a daily basis. Our team has identified the five stocks that top analysts are quietly whispering to their clients to buy now before the broader market catches on... and none of the big name stocks were on the list. They believe these five stocks are the five best companies for investors to buy now... See The Five Stocks Here Market downturns give many investors pause, and for good reason. Wondering how to offset this risk? Enter your email address to learn more about using beta to protect your portfolio."
"Robinhood Stock Gets 5 Price Target Upgrades, Signaling Upside",https://www.marketbeat.com/originals/robinhood-stock-gets-5-price-target-upgrades-signaling-upside/,"Robinhood Markets NASDAQ: HOOD missed out on inclusion in the S&P 500, but the last thing the company is doing is focusing on the past. The firm just announced innovations that have Wall Street analysts swooning. Robinhood has been one of the hottest stocks in the market recently. As of the July 7 close, shares of the finance company were up 312% over the past 52 weeks. The company’s expanded product offerings and crypto trading demand have been key to its success. However, the company is far from done adding new features and growing its presence in different markets. That’s a big reason why Robinhood received five Wall Street price target upgrades in July. These aren’t just any upgrades, either. Several analysts increased their price targets massively, with one boosting its target by 100%. So, what is causing these analysts to become so much more bullish on Robinhood? Just how much upside do they see? Let’s dive in below. The increases in Robinhood’s price targets come after the company’s “To Catch a Token” event on June 30. During the event, the company unveiled new features, the most notable of which was the introduction of tokenized U.S. stocks and ETFs for Robinhood’s users in the European Union. This is big for expanding the company’s international footprint. Before this release, EU users could only trade crypto on Robinhood. The tokenization route allows Robinhood to bypass the regulatory requirements for users to buy U.S. stocks. The release greatly accelerates Robinhood’s timeline for gaining traction in the EU equity trading market and creates a new revenue stream. It starts with 200 of the most well-known U.S. stocks and ETFs, but the company plans to expand this into thousands by the end of the year. The company’s new blockchain, Robinhood Chain, makes this possible. Robinhood Chain will expand to allow investors to trade many other types of assets. This includes real estate, art, and even the stock of private companies. Robinhood announced that EU customers could access private stock tokens of OpenAI and SpaceX. Expansion into these assets is another way Robinhood can grow its customer base, attracting more assets and revenues. Notably, these tokenized offerings are not available to U.S. users. The company also announced that crypto trading is now available in 31 European countries, greatly expanding access and further broadening its market opportunities. The MarketBeat consensus price target on Robinhood is just under $73. This implies a downside of over 22% from the stock’s July 7 closing price. However, the five price targets updated by the To Catch a Token event flip the script. Their average comes in at nearly $103, which signals that shares could rise by 10%, greatly altering the outlook on the stock. Overall, the average price target among these five analysts' upgrades increased by 28%, signaling the event greatly impacted their perceptions of Robinhood. Notably, Citigroup boosted its target from $50 to $100. One risk for Robinhood is the potential that the company is moving too fast. The firm has rolled out update after update, strengthening its ability to keep and attract assets. This is an exciting strategy, but it could backfire if the company does not execute its rollouts to a tee. One of the key reasons the Robinhood platform attracts customers is the top-notch user experience it offers. Maintaining this is paramount to keeping and growing its customer base. The company seems to have also stepped into a legal gray area with its private stock tokens. Investors do not actually own shares in these companies, and OpenAI has said the company does not endorse the Robinhood product. The Bank of Lithuania is seeking clarification from Robinhood to assess the legality of the instruments. Robinhood will need to avoid legal trouble as it expands its offerings to avoid damaging the trust it has built with users. Still, Robinhood continues to demonstrate a level of innovation and product expansion within the investment industry that no other firm is matching. This positions the firm to outcompete others going forward and grow faster than its industry if it can avoid the potential pitfalls of its aggressive strategy. This can allow the stock to continue winning. Before you consider Robinhood Markets, you'll want to hear this. MarketBeat keeps track of Wall Street's top-rated and best performing research analysts and the stocks they recommend to their clients on a daily basis. MarketBeat has identified the five stocks that top analysts are quietly whispering to their clients to buy now before the broader market catches on... and Robinhood Markets wasn't on the list. While Robinhood Markets currently has a Moderate Buy rating among analysts, top-rated analysts believe these five stocks are better buys. View The Five Stocks Here Unlock the timeless value of gold with our exclusive 2025 Gold Forecasting Report. Explore why gold remains the ultimate investment for safeguarding wealth against inflation, economic shifts, and global uncertainties. Whether you're planning for future generations or seeking a reliable asset in turbulent times, this report is your essential guide to making informed decisions."
Samsung unveils its new line of foldable devices at Unpacked,https://www.marketbeat.com/articles/samsung-unveils-its-new-line-of-foldable-devices-at-unpacked-2025-07-09/,"NEW YORK (AP) — Samsung introduced several updates to its foldable devices lineup on Wednesday, with the new Galaxy Z Fold 7, Z Flip 7, and the new Z Flip 7 FE taking stage at the latest Unpacked event. The Korean electronics company unveiled the upgrades — including new versions of their watch — in New York but also announced an expanded partnership with Google to inject more artificial intelligence into its foldable lineup. Here are the biggest announcements from this summer's Unpacked event: The Galaxy Z Fold 7 is much thinner and lighter than its predecessors, coming in at 0.17 inch thick when unfolded and less than half an inch folded. It also weighs slightly less than half a pound, an impressive feat considering the company also increased the total size of the screens from the Fold 6 — now 6.5 inches for the exterior screen and 8 inches for the interior screen. The battery capacity remains the same as the previous generation. But unlike previous generations of fold devices, this one doesn't support the company's digital stylus. A 200 megapixel camera will act as the main capture and a 10 megapixel camera that extends along the frame of the phone gives users the ability to quickly capture wide shots. The Fold 7 will retail starting at $1,999. Pre-orders start today, and the device will hit shelves on July 25. The flippable cousin of the Fold has an enlarged 4.1-inch top screen and the clamshell folds down to just over half an inch. The inner display grows to 6.9 inches from the Flip 6's 6.7 inches. It gets a slightly bigger 4,300mAh battery and maintains a 50 megapixel main camera and 10 megapixel front camera. A new, cheaper version of the phone, called the Galaxy Z Flip 7 FE was also announced today. It's a slightly smaller version — keeping the Fold 6's 6.7 inch screen size — of its premium counterpart. The Galaxy Z Flip 7 will retail for $1,099.99 and the Flip 7 FE starts at $899.99. Pre-orders for both devices began Wednesday and both will be available generally on July 25. The Galaxy Watch Ultra, Watch 8 and Watch 8 Classic have all been refreshed with various updates — memory, thickness, design — but the main takeaway from today's event is that Google's Gemini AI was being preloaded onto the devices. Users can access the AI by speaking to their watch. Rick Osterloh, Google’s senior vice president of devices and services, appeared in a pre-recorded video at Unpacked to announce that the AI Mode of its search engine will be used in Samsung's circle to search function, allowing users to make quick queries by tapping or circling things on their screen. And Gemini will receive further integration with base Samsung device apps, like Calendar and Reminders. Before you make your next trade, you'll want to hear this. MarketBeat keeps track of Wall Street's top-rated and best performing research analysts and the stocks they recommend to their clients on a daily basis. Our team has identified the five stocks that top analysts are quietly whispering to their clients to buy now before the broader market catches on... and none of the big name stocks were on the list. They believe these five stocks are the five best companies for investors to buy now... See The Five Stocks Here Wondering where to start (or end) with AI stocks? These 10 simple stocks can help investors build long-term wealth as artificial intelligence continues to grow into the future."
"European Union naval force says 6 crew recovered and 19 missing from the ship Eternity C, sunk by Yemen's Houthis",https://www.marketbeat.com/articles/european-union-naval-force-says-6-crew-recovered-and-19-missing-from-the-ship-eternity-c-sunk-by-yemens-houthis-2025-07-09/,"DUBAI, United Arab Emirates (AP) — European Union naval force says 6 crew recovered and 19 missing from the ship Eternity C, sunk by Yemen's Houthis. Before you make your next trade, you'll want to hear this. MarketBeat keeps track of Wall Street's top-rated and best performing research analysts and the stocks they recommend to their clients on a daily basis. Our team has identified the five stocks that top analysts are quietly whispering to their clients to buy now before the broader market catches on... and none of the big name stocks were on the list. They believe these five stocks are the five best companies for investors to buy now... See The Five Stocks Here Enter your email address and we'll send you MarketBeat's list of ten stocks that are set to soar in Summer 2025, despite the threat of tariffs and other economic uncertainty. These ten stocks are incredibly resilient and are likely to thrive in any economic environment."
X CEO Linda Yaccarino resigns after two years at the helm of Elon Musk's social media platform,https://www.marketbeat.com/articles/x-ceo-linda-yaccarino-resigns-after-two-years-at-the-helm-of-elon-musks-social-media-platform-2025-07-09/,"X CEO Linda Yaccarino said she’s stepping down after two bumpy years running Elon Musk’s social media platform. Yaccarino posted a positive message Wednesday about her tenure at the company formerly known as Twitter and said “the best is yet to come as X enters a new chapter with” Musk’s artificial intelligence company xAI, maker of the chatbot Grok. She did not say why she is leaving. Musk responded to Yaccarino's announcement with his own 5-word statement on X: “Thank you for your contributions.” “The only thing that’s surprising about Linda Yaccarino’s resignation is that it didn’t come sooner,” said Forrester research director Mike Proulx. “It was clear from the start that she was being set up to fail by a limited scope as the company’s chief executive.” In reality, Proulx added, Musk “is and always has been at the helm of X. And that made Linda X’s CEO in title only, which is a very tough position to be in, especially for someone of Linda’s talents.” Musk hired Yaccarino, a veteran ad executive, in May 2023 after buying Twitter for $44 billion in late 2022 and cutting most of its staff. He said at the time that Yaccarino’s role would be focused mainly on running the company’s business operations, leaving him to focus on product design and new technology. Before announcing her hiring, Musk said whoever took over as the company’s CEO “ must like pain a lot.” In accepting the job, Yaccarino was taking on the challenge of getting big brands back to advertising on the social media platform after months of upheaval following Musk's takeover. She also had to work in a supporting role to Musk's outsized persona on and off of X as he loosened content moderation rules in the name of free speech and restored accounts previously banned by the social media platform. “Being the CEO of X was always going to be a tough job, and Yaccarino lasted in the role longer than many expected. Faced with a mercurial owner who never fully stepped away from the helm and continued to use the platform as his personal megaphone, Yaccarino had to try to run the business while also regularly putting out fires,"" said Emarketer analyst Jasmine Enberg. Yaccarino's future at X became unclear earlier this year after Musk merged the social media platform with his artificial intelligence company, xAI. And the advertising issues have not subsided. Since Musk's takeover, a number of companies had pulled back on ad spending — the platform’s chief source of revenue — over concerns that Musk’s thinning of content restrictions was enabling hateful and toxic speech to flourish. Most recently, an update to Grok led to a flood of antisemitic commentary from the chatbot this week that included praise of Adolf Hitler. “We are aware of recent posts made by Grok and are actively working to remove the inappropriate posts,” the Grok account posted on X early Wednesday, without being more specific. Some experts have tied Grok's behavior to Musk's deliberate efforts to mold Grok as an alternative to chatbots he considers too “woke,” such as OpenAI's ChatGPT and Google's Gemini. In late June, he invited X users to help train the chatbot on their commentary in a way that invited a flood of racist responses and conspiracy theories. “Please reply to this post with divisive facts for @Grok training,” Musk said in the June 21 post. “By this I mean things that are politically incorrect, but nonetheless factually true.” A similar instruction was later baked into Grok's “prompts” that instruct it on how to respond, which told the chatbot to “not shy away from making claims which are politically incorrect, as long as they are well substantiated.” That part of the instructions was later deleted. “To me, this has all the fingerprints of Elon’s involvement,” said Talia Ringer, a professor of computer science at the University of Illinois Urbana-Champaign. Yaccarino has not publicly commented on the latest hate speech controversy. She has, at times, ardently defended Musk's approach, including in a lawsuit against liberal advocacy group Media Matters for America over a report that claimed leading advertisers’ posts on X were appearing alongside neo-Nazi and white nationalist content. The report led some advertisers to pause their activity on X. A federal judge last year dismissed X's lawsuit against another nonprofit, the Center for Countering Digital Hate, which has documented the increase in hate speech on the site since it was acquired by Musk. X is also in an ongoing legal dispute with major advertisers — including CVS, Mars, Lego, Nestle, Shell and Tyson Foods — over what it has alleged was a “massive advertiser boycott” that deprived the company of billions of dollars in revenue and violated antitrust laws. Enberg said that, ""to a degree, Yaccarino accomplished what she was hired to do."" Emarketer expects X’s ad business to return to growth in 2025 after more than halving between 2022 and 2023 following Musk’s takeover. But, she added, ""the reasons for X’s ad recovery are complicated, and Yaccarino was unable to restore the platform’s reputation among advertisers.” Analysts have said that some advertisers may have returned to X to avoid alienating Trump supporters during the height of Musk's affiliation with the president and his base. Legal threats may have also played a part — whether from X or from the Federal Trade Commission, which is investigating Media Matters over its reporting that hateful content has increased on X since Musk took over, resulting in an advertiser exodus. Media Matters has in turn sued the FTC, claiming it seeks to punish protected speech. Before you make your next trade, you'll want to hear this. MarketBeat keeps track of Wall Street's top-rated and best performing research analysts and the stocks they recommend to their clients on a daily basis. Our team has identified the five stocks that top analysts are quietly whispering to their clients to buy now before the broader market catches on... and none of the big name stocks were on the list. They believe these five stocks are the five best companies for investors to buy now... See The Five Stocks Here Enter your email address and we'll send you MarketBeat's list of ten stocks that are set to soar in Summer 2025, despite the threat of tariffs and other economic uncertainty. These ten stocks are incredibly resilient and are likely to thrive in any economic environment."
"Yemen's Houthi rebels claim attacking and sinking the ship Eternity C in the Red Sea, their second such attack in days",https://www.marketbeat.com/articles/yemens-houthi-rebels-claim-attacking-and-sinking-the-ship-eternity-c-in-the-red-sea-their-second-such-attack-in-days-2025-07-09/,"DUBAI, United Arab Emirates (AP) — Yemen's Houthi rebels claim attacking and sinking the ship Eternity C in the Red Sea, their second such attack in days. Before you make your next trade, you'll want to hear this. MarketBeat keeps track of Wall Street's top-rated and best performing research analysts and the stocks they recommend to their clients on a daily basis. Our team has identified the five stocks that top analysts are quietly whispering to their clients to buy now before the broader market catches on... and none of the big name stocks were on the list. They believe these five stocks are the five best companies for investors to buy now... See The Five Stocks Here Need to stretch out your 401K or Roth IRA plan? Use these time-tested investing strategies to grow the monthly retirement income that your stock portfolio generates."
Linda Yaccarino steps down as head of Elon Musk's social media platform X after 2 years,https://www.marketbeat.com/articles/linda-yaccarino-steps-down-as-head-of-elon-musks-social-media-platform-x-after-2-years-2025-07-09/,"NEW YORK (AP) — Linda Yaccarino steps down as head of Elon Musk's social media platform X after 2 years. Before you make your next trade, you'll want to hear this. MarketBeat keeps track of Wall Street's top-rated and best performing research analysts and the stocks they recommend to their clients on a daily basis. Our team has identified the five stocks that top analysts are quietly whispering to their clients to buy now before the broader market catches on... and none of the big name stocks were on the list. They believe these five stocks are the five best companies for investors to buy now... See The Five Stocks Here With the proliferation of data centers and electric vehicles, the electric grid will only get more strained. Download this report to learn how energy stocks can play a role in your portfolio as the global demand for energy continues to grow."
BC-Most Active Stocks,https://www.marketbeat.com/articles/bc-most-active-stocks-2025-07-07/,
