title,link,content
Bitcoin and Dividends: A Winning Combo in These 3 ETFs,https://www.marketbeat.com/stock-ideas/bitcoin-and-dividends-a-winning-combo-in-these-3-etfs/,"With Bitcoin trading just below all-time highs, there is fresh attention on the world's first and largest cryptocurrency. Investors concerned about the future of the dollar may also be inclined to turn to crypto, though the space remains highly speculative. If the risk of investing directly in Bitcoin or another major token is too high, an alternative is a cryptocurrency-focused exchange-traded fund (ETF). The most straightforward crypto funds are spot ETFs like the Fidelity Wise Origin Bitcoin Fund NYSEARCA: FBTC. These funds invest directly in Bitcoin and are thus highly risky, although they do provide a layer of protection for investors in that investors don't have to store and transfer crypto holdings by themselves. An income-generating Bitcoin fund may be a better alternative for less risk-tolerant investors. These funds typically use crypto futures, covered calls, and other complex strategies to generate distributions that function similarly to dividend payments made by traditional stocks. Of course, tax implications in these cases may be different, so it's up to the investor to keep track of the implications. One way to generate income for investors is with call options on Bitcoin futures ETFs, and that's exactly the play that the NEOS Bitcoin High Income ETF NYSEARCA: BTCI aims for. This fund invests in exchange-traded products (ETPs) directly exposed to Bitcoin. BTCI is actively managed, meaning that the team from NEOS makes decisions about how and when to utilize call options to maximize distributions while also achieving upside potential. BTCI is one of the newer ETFs in the Bitcoin and crypto space, having only launched late in 2024. However, its track record so far is highly successful; it has returned more than 26% in 2025 alone. This is in addition to monthly distributions, which have provided the fund with a dividend yield of 22.2%. Investors should expect to pay for this fund's active management. BTCI, unsurprisingly, has a fairly high expense ratio of 0.98%. Far cheaper crypto funds are available, but many investors may find the fund's track record and history of distributions to more than make up for the comparably high cost. For a bit more diversification outside of the Bitcoin space, investors might look to the Global X Blockchain & Bitcoin Strategy ETF NASDAQ: BITS. BITS does include a focus on the Bitcoin futures market, but it also aims for exposure to stocks of companies in the blockchain technology and digital assets industries as well as other ETFs focused on blockchain. BITS has traditionally offered investors a distribution twice per year, translating to an annual dividend yield of 24.5%. Considering the fund's substantial payouts and active strategy combining cryptocurrency with traditional stocks and ETFs, the fund's expense ratio of 0.65% is relatively low. Its year-to-date (YTD) return of roughly 18% is likely quite compelling. Investors should be aware, though, that BITS has quite low assets under management (AUM) at just $35.4 million and low trading volume, which may make liquidity a concern for more active traders. The first Bitcoin-related ETF to launch in the United States was the ProShares Bitcoin ETF NYSEARCA: BITO. However, BITO does not invest directly in Bitcoin; instead, it invests in futures and swaps. As might be expected for the first-ever Bitcoin fund, BITO has substantially higher AUM and trading volume than BITS above, with about $2.8 billion in invested assets. Distributions are also a popular draw for BITO investors, as the fund makes monthly payments and has a dividend yield of 49.6%. With an expense ratio of 0.95%, BITO remains on the higher end of the expense ratio scale for Bitcoin funds, but the fund's strong history, its distributions, and recent performance likely make that a worthwhile fee for many investors. BITO has returned about 21% so far this year, far ahead of the broader market. Before you consider NEOS Bitcoin High Income ETF, you'll want to hear this. MarketBeat keeps track of Wall Street's top-rated and best performing research analysts and the stocks they recommend to their clients on a daily basis. MarketBeat has identified the five stocks that top analysts are quietly whispering to their clients to buy now before the broader market catches on... and NEOS Bitcoin High Income ETF wasn't on the list. While NEOS Bitcoin High Income ETF currently has a Hold rating among analysts, top-rated analysts believe these five stocks are better buys. View The Five Stocks Here With the proliferation of data centers and electric vehicles, the electric grid will only get more strained. Download this report to learn how energy stocks can play a role in your portfolio as the global demand for energy continues to grow."
Profits drop at Warren Buffett's Berkshire Hathaway as it writes down its Kraft Heinz investment,https://www.marketbeat.com/articles/profits-drop-at-warren-buffetts-berkshire-hathaway-as-it-writes-down-its-kraft-heinz-investment-2025-08-02/,"OMAHA, Neb. (AP) — Warren Buffett's company reported less than half as much profit in the second quarter as it took a $3.76 billion writedown on the value of its stake in Kraft Heinz, as that iconic food producer considers largely undoing the merger that Berkshire Hathaway helped bankroll. Berkshire said it earned $12.37 billion, or $8,601 per Class A share, during the quarter. That's down from $30.248 billion, or $21,122 per Class A share, a year ago, because it recorded a much smaller paper investment gain this year. Berkshire's earnings can swing wildly from quarter to quarter because it has to record the current value of its massive investment portfolio even though it doesn't sell most of the stocks. That's why Buffett has long recommended that investors pay more attention to Berkshire's operating earnings, which exclude those investment gains. Although last year Berkshire did surprise shareholders by selling off a huge chunk of its Apple stake which inflated the investment gains then. By that measure, Berkshire's operating earnings were only down slightly at $11.16 billion, or $7,759.58 per Class A share. That compares with $11.598 billion, or $8,072.16 per Class A share, a year ago. Most of Berkshire's myriad assortment of companies — major insurers like Geico, BNSF railroad, a group of utilities and a collection of manufacturing and retail businesses — generally performed well despite the uncertainty about the economy and President Donald Trump's tariffs. The four analysts surveyed by FactSet Research expected Berkshire to report earnings per Class A share of $7,508.10, so the Omaha, Nebraska-based conglomerate's results were ahead of that. Berkshire owns more than 27% of Kraft Heinz' stock and, for years, it had representatives on the company's board. Buffett has said previously that he believes the company's iconic brands will do well over time, but in hindsight, he overpaid for the investment and underestimated the challenges branded foods face from retailers and the growth of private label products. This spring, Berkshire's representatives resigned from the Kraft Heinz board shortly before the company announced it is exploring strategic options that may include spinning off a large part of its portfolio of brands. Over the years since Berkshire helped Kraft buy Heinz in 2015, the company has been hurt by changing consumer tastes and a shift toward healthier options than Kraft’s core collection of processed foods. Another writedown could be coming in the future because CFRA Research analyst Cathy Seifert pointed out that Berkshire's holding of 28% of Occidental Petroleum's stock, which is currently valued at about $5.3 billion less than the $16.5 billion that Buffett paid for it. Buffett's is still sitting on a massive pile of $344.1 billion in cash, although the company's reserves dipped slightly from the $347.7 billion cash it was holding at the end of the first quarter. Buffett told shareholders in May he just isn't finding any attractive deals for companies he understands. Buffett surprised shareholders at the annual meeting when he announced that he plans to give up the CEO title at the end of the year and hand over operations to Vice Chairman Greg Abel, but Buffett will remain Chairman. Berkshire shareholders might be disappointed that the company didn't repurchase any of its shares this quarter, even though the price has fallen more than 12% since just before Buffett announced his retirement. But investor Chris Ballard, who is managing director at Check Capital, said he wasn't surprised at the lack of buybacks because even after the recent drop, Berkshire's stock is still selling at a premium compared to the value of its businesses. Many investors are watching Berkshire's BNSF closely after rival Union Pacific announced a plan to buy Norfolk Southern earlier this week to create the nation's first transcontinental railroad. The speculation is that BNSF needs to pursue a merger with eastern rail CSX to be able to compete. But Seifert said it isn't Buffett's style to jump into a deal just because the market thinks he should. Over the decades, he has built Berkshire by finding strong companies selling for less than they are worth. CSX is trading near its 52-week high at $35.01 amid all the deal speculation. “He wants to do it because he found an undervalued franchise -- not because the market says you need to do a deal,” Seifert said. “I think one of the reasons why that cash hasn’t been deployed is that valuations run through the Berkshire M-and-A model tend to be too rich. But if there’s a logical case to be made they’ll accept it.” And BNSF appears to be doing fine right now on its own. The railroad recorded a 19% jump in its operating profit this quarter at $1.47 billion as it cut costs and delivered about 1% more shipments. Berkshire's insurance results disappointed a bit as it appeared the company might be pulling back from writing as much property insurance at a time when premiums aren't as attractive. Even in areas where it is growing, like Geico, Seifert said Berkshire lagged behind peers such as Progressive and Allstate. Berkshire normally pulls back on writing insurance when it doesn't like the premiums. “The insurance business has struggled a bit. I would say the takeaways for me is on that front, they’re doing less property and casualty insurance,” said Ballard, who's firm counts Berkshire as its largest holding. Berkshire said it's underwriting operating profit dipped to just below $2 billion in the quarter from last year's $2.26 billion. Before you make your next trade, you'll want to hear this. MarketBeat keeps track of Wall Street's top-rated and best performing research analysts and the stocks they recommend to their clients on a daily basis. Our team has identified the five stocks that top analysts are quietly whispering to their clients to buy now before the broader market catches on... and none of the big name stocks were on the list. They believe these five stocks are the five best companies for investors to buy now... See The Five Stocks Here Thinking about investing in Meta, Roblox, or Unity? Enter your email to learn what streetwise investors need to know about the metaverse and public markets before making an investment."
Is PG&E an AI Power Play? Why Options Traders Are Betting Big,https://www.marketbeat.com/originals/is-pg-and-e-an-ai-power-play-why-options-traders-are-betting-big/,"Utility stocks are typically known for their predictability, not for explosive growth. It is especially noteworthy, then, when market indicators begin flashing for one of the utility sector’s most-watched companies. For Pacific Gas & Electric NYSE: PCG, a dramatic, recent spike in bullish activity suggests some professional investors believe the company is at a major inflection point. This unusual interest warrants a deeper look into the fundamental drivers that could be fueling a powerful turnaround, one that links the future of California's power grid to the global boom in artificial intelligence (AI). A clear signal of shifting sentiment appeared on July 25, when the trading volume of bullish call options for PG&E stock soared by over 380% compared to its daily average. A call option gives an investor the right to buy a stock at a specific price in the future, making it a direct bet on a price increase. A surge of this magnitude signals a wave of new confidence. A closer look at the trading data shows significant interest in options expiring in September 2025 with ""strike prices"" of $16, $19, and $20 per share. With PG&E’s stock price currently trading in the 13-14 range, this pattern reveals that investors are positioning for a sustained rally. They are betting on a potential upside of 20% to 50% over the coming months, which raises a critical question: What fundamentals justify such optimism? The justification for this bullish sentiment is found in the company's second-quarter 2025 earnings report. The results paint a picture of a business that is successfully stabilizing its operations and finances. The company confidently reaffirmed its full-year non-GAAP core earnings per share (EPS) guidance of $1.48 to $1.52. This signals that management's plan is on track, providing the predictability investors value. This stability is built on a foundation of tangible operational achievements that reduce risk. The company is also managing its regulatory environment more proactively. It recently submitted its smallest rate increase request in a decade. While legislative debates in Sacramento remain a key watch item, earnings call that the company's $63 billion, five-year financial plan can withstand various outcomes, CEO Patti Poppe stated on the call without diluting shareholder value by issuing new stock at current prices. While a stable foundation is essential, the catalyst igniting genuine investor excitement is a powerful, new growth engine. PG&E’s earnings report revealed that demand for its new data center pipeline has swelled to an immense 10 gigawatts. This surge is a direct result of the artificial intelligence revolution centered in PG&E’s Northern California service area. The massive server farms required for AI development consume vast amounts of electricity, giving PG&E a unique growth opportunity that most other utilities lack. For investors, this new demand is the engine of future profit. Meeting this demand will require billions in new infrastructure investment. For a regulated utility, these capital investments are added to its rate base, which is the core asset portfolio on which the company earns a guaranteed profit. This growth in the rate base directly supports the company's goal of delivering at least 9% annual EPS growth through 2028. This growth story also presents a winning narrative for customers and regulators. As management explained, every gigawatt of new data center load can reduce residential bills by 1-2%, as the grid's high fixed costs are spread over more sales. Confirmed projects with major tech players like Microsoft NASDAQ: MSFT make this growth feel tangible and imminent, positioning PG&E as a key partner in the AI economy. The recent surge in bullish options trading appears to be a rational market signal indicating PG&E's fundamental transformation. The company is successfully moving beyond its recovery phase by stabilizing its operations and proactively managing its risks. More importantly, it has secured a robust, long-term growth catalyst by positioning itself as the energy backbone for the AI industry. For a company long defined by its past challenges, the narrative is compellingly shifting to one of durable, technology-driven growth. Before you consider Pacific Gas & Electric, you'll want to hear this. MarketBeat keeps track of Wall Street's top-rated and best performing research analysts and the stocks they recommend to their clients on a daily basis. MarketBeat has identified the five stocks that top analysts are quietly whispering to their clients to buy now before the broader market catches on... and Pacific Gas & Electric wasn't on the list. While Pacific Gas & Electric currently has a Moderate Buy rating among analysts, top-rated analysts believe these five stocks are better buys. View The Five Stocks Here Discover the 10 Best High-Yield Dividend Stocks for 2025 and secure reliable income in uncertain markets. Download the report now to identify top dividend payers and avoid common yield traps."
MarketBeat Week in Review – 07/28 - 08/01,https://www.marketbeat.com/originals/marketbeat-week-in-review-07-28-08-01/,"Stocks drifted lower to end the week as economic uncertainty overshadowed strong Magnificent Seven earnings. On July 31, the latest Personal Consumption Expenditures (PCE) index showed a slight uptick in the rate of inflation growth. Then on Friday, the August Jobs report came in lighter than expected. However, that number looked bullish compared with massive downward revisions to the May and June numbers. Investors are also weighing the impact of tariffs now that the August 1 deadline has come and gone. On a more bullish note, reports from several mega-cap technology companies reinforce the reality of the artificial intelligence (AI) trade. Many of these companies will spend billions of dollars over several years to build out an AI infrastructure, creating opportunities in several sectors. Next week will be quieter for economic data, but earnings season will continue to roll along. August itself is typically a quiet week for markets. But that low volume can also lead to high volatility. Count on the MarketBeat analysts to help you separate market signals from noise. Here are some of our most popular articles from this week. Articles by Sam Quirke One week after its earnings report, Tesla Inc. NASDAQ: TSLA stock has given up almost all of its post-earnings gains. However, Sam Quirke pointed out why the long-term upside continues to look bullish as Tesla’s robotics and autonomous vehicle solutions begin to emerge. Amazon.com Inc. NASDAQ: AMZN stock dropped despite a solid earnings report. It’s just one example of how investors had priced growth into the company’s results. Quirke explained the long-term bull case and how investors and traders may want to approach the stock. NVIDIA Corp. NASDAQ: NVDA would appear to be a winner as AI spending shows no signs of slowing down. Quirke pointed to two technical indicators that look bearish for NVDA stock despite continued optimism from analysts. Articles by Chris Markoch Palantir Technologies Inc. NASDAQ: PLTR reports earnings next week. Chris Markoch explained why investors will want to pay close attention to the company’s growing defense business as the company becomes the Pentagon’s go-to AI engine. Stocks that form a golden cross pattern can be opportunities for investors. Markoch highlighted three stocks that have recently made a golden cross that is supported by strong fundamentals. Apple Inc. NASDAQ: AAPL delivered a strong earnings report on July 31. However, AAPL stock is delivering muted gains. Markoch explained why investors are skeptical about the sustainability of the company’s results, and what that may mean for a stock that many believe is still priced for perfection. Articles by Ryan Hasson Bitcoin has made a resurgence in July, and this time it’s bringing other tokens with it. This week, Ryan Hasson looked at five stocks set to ride the wave of the crypto surge that investors can own without owning and storing the digital assets. Autonomous technology is the bullish cousin to artificial intelligence. This week, Hasson looked at this sector and provided investors with five autonomous technology stocks trading for less than $15. That means there’s some risk and the potential for outsized gains for patient investors. Hasson also looked at two cybersecurity stocks that are poised for a breakout. As interest in AI continues to grow, so will the threats from AI-driven cyberattacks. Hasson explained why upcoming earnings may be the catalyst that moves these stocks higher. Articles by Gabriel Osorio-Mazilli This week, Gabriel Osorio-Mazilli analyzed the surge in American Eagle Outfitters Inc. NYSE: AEO. More importantly, he looked beyond the noise and explained why the move in AEO stock may have more behind it than speculation. With so many stocks trading at or near all-time highs, it can be hard to find undervalued stocks. However, that’s exactly what Osorio-Mazilli did this week. Not only did he provide investors with the names of three undervalued stocks, but he also pointed out why each has catalysts that the market may be overlooking. Buy-and-hold investors understand the importance of compounding. This week, Osorio-Mazilli pointed these investors to three stocks with attractive outlooks for compounding for years to come. Articles by Leo Miller Investors expected a strong earnings report from Meta Platforms Inc. NASDAQ: META, and the company did not disappoint. Leo Miller summarized the tech giant's strong report and explained why investors should be willing to chase META stock higher. Earnings season is a time when investors seek out analyst upgrades. This week, Miller highlighted three AI stocks that have received bullish upgrades after reporting strong earnings. Earnings season can also be synonymous with stock buybacks. Although that hasn’t been a prominent factor so far in this cycle, Miller highlighted four stocks that have announced significant increases in Q2 buybacks. Articles by Nathan Reiff D-Wave Quantum Inc. NYSE: QBTS has been one of the best-performing stocks in the emerging quantum stock sector. This week, Nathan Reiff pointed out the catalysts that briefly allowed QBTS stock to make a new all-time high, but why investors may still want to proceed with caution. Investors have been waiting for basic materials stocks to take off. However, uncertainty in key economic indicators has weighed on these stocks. Reiff explained why three material stocks are likely to have further upside based on fundamentals and market trends. Defense stocks have been some of the most closely watched stocks for investors. Reiff pointed out why a beaten-down small-cap stock, Byrna Technologies Inc. NASDAQ: BYRN, is one to watch based on bullish analyst sentiment and a strong earnings report. Articles by Dan Schmidt History frequently rhymes, and Dan Schmidt pointed out why 2025 is starting to look a lot like 2021. In both cases, traders were looking for short squeeze candidates. This is a risky strategy, but it can be profitable. Schmidt highlighted three stocks with catalysts that could make them good short-squeeze candidates. It hasn’t been all bad news on the tariff front, Schmidt pointed out why the recent deal between the United States and Japan is bullish for automotive stocks. Schmidt highlighted three automaker stocks that investors may be overlooking. Articles by Jeffrey Neal Johnson “The quantum computing industry is reaching an inflection point.” Jeffrey Neal Johnson highlighted this issue for investors. Johnson explained the key factors driving quantum stocks higher and gave investors three stocks that are among the most promising for long-term investors. Drone stocks have been soaring, which is why Johnson made it a point to highlight Red Cat Holdings Inc. NASDAQ: RCAT. The stock has dropped recently, but a new contract is only one reason why analysts believe there’s significant upside to come. As the AI revolution progresses, investors will want to watch applications on the edge. This week, Johnson pointed out that its application of semiconductors in automotive and internet of Things (IoT) applications makes Qualcomm Inc. NASDAQ: QCOM a growth stock that may be flying under the radar. Articles by Jordan Chussler Healthcare is normally an evergreen sector for investors. However, that hasn’t been the case for several years. Jordan Chussler analyzed the headwinds impacting the healthcare sector and why that adds to the bullish case for HCA Healthcare Inc. NYSE: HCA, which recently issued bullish forward guidance. Before you consider HCA Healthcare, you'll want to hear this. MarketBeat keeps track of Wall Street's top-rated and best performing research analysts and the stocks they recommend to their clients on a daily basis. MarketBeat has identified the five stocks that top analysts are quietly whispering to their clients to buy now before the broader market catches on... and HCA Healthcare wasn't on the list. While HCA Healthcare currently has a Moderate Buy rating among analysts, top-rated analysts believe these five stocks are better buys. View The Five Stocks Here Just getting into the stock market? These 10 simple stocks can help beginning investors build long-term wealth without knowing options, technicals, or other advanced strategies."
