title,link,content
Vertical Aerospace's New Deal and Earnings De-Risk Production,https://www.marketbeat.com/originals/vertical-aerospaces-new-deal-and-earnings-de-risk-production/,"In the first week of August 2025, Vertical Aerospace NYSE: EVTL announced a long-term strategic partnership with Aciturri Aerostructures, a major global supplier with deep roots in the traditional aerospace sector. This news, delivered alongside a stable first-half 2025 financial report, signals a pivotal shift in the company’s evolution. In the competitive race to launch electric air taxis, demonstrating that an aircraft can fly is only the first significant hurdle. The next, arguably more complex challenge, is proving it can be manufactured reliably, affordably, and at scale. Vertical Aerospace is now offering a viable answer to that critical question for investors assessing the long-term potential of the eVTOL sector. The supply chain is as critical as the design for any company developing a new aircraft. Vertical’s agreement with Aciturri is a cornerstone of its manufacturing strategy, designed to mitigate risk and conserve capital. The partnership covers the production of the entire airframe structure. This includes the complex, high-lift wing, the fuselage where passengers will sit, and the pylons that hold the advanced electric propulsion units. By consolidating this massive portion of the supply chain with a single, highly experienced partner, Vertical streamlines its future production process. It reduces the immense execution risk of building a manufacturing operation from the ground up. The choice of partner is a key indicator of the company’s mature approach. Aciturri is a Tier 1 supplier, a term used in aerospace for primary, direct contractors to the original equipment manufacturer (OEM). They are not a startup; Aciturri is a major global supplier with decades of experience building critical components for the biggest names in aviation, including Airbus OTCMKTS: EADSY, Boeing NYSE: BA, and Embraer NYSE: ERJ. This deep industry credibility ensures the VX4’s airframe will be built to the world’s most stringent aerospace standards. Furthermore, Aciturri's experience isn't limited to legacy aircraft; they have also supplied airframes for other eVTOL programs, demonstrating they can bridge the gap between traditional certification requirements and novel electric aviation technology. For investors, this move aligns perfectly with Vertical's stated asset-light business model. Rather than spending hundreds of millions of dollars on its factories and tooling, Vertical is leveraging a world-class partner's expertise and existing infrastructure. This allows the company to focus its own capital and resources on its core strengths: aircraft design, proprietary battery and software integration, and navigating the complex certification process. It is a prudent capital allocation strategy that directly addresses investor concerns about the high cost of bringing a new aircraft to market. A strong manufacturing plan requires an equally strong financial foundation and focus. Vertical Aerospace's first-half 2025 report, released on August 5, demonstrates that the company is maintaining its financial discipline while advancing its crucial technical goals. This two-pronged execution is a key sign of competent management. The company reported a strong cash position of approximately $137 million. This figure, bolstered by the successful $69 million capital raise in July, provides a financial runway extending towards the middle of 2026. This runway is a critical metric for a technology company's pre-revenue, giving investors confidence that the business is funded through its next series of important milestones. More telling for investors watching the company’s spending habits, management maintained its full-year 2025 guidance for net operating cash outflow at approximately $110 million to $125 million. Holding this guidance steady, especially after signing a major new industrial partnership, signals that there have been no unexpected cost overruns and that the company’s budget is under control. This financial discipline was achieved while the core flight program continues to accelerate. The company confirmed its piloted wingborne flight test program has moved forward significantly, with multiple flights now completed by two different test pilots in open European airspace. This shows that the momentum from the historic airport-to-airport flight in July is being actively maintained. Looking ahead, Vertical remains on track to complete the year's final and most technically challenging test phase, the full transition from vertical, helicopter-like lift to efficient, wing-borne forward flight, in the second half of 2025. This parallel progress in finance and flight testing is a key indicator of a well-run organization capable of managing multiple complex workstreams simultaneously. The Aciturri partnership is the latest pillar in a rapidly maturing business strategy. It does not exist in a vacuum but complements the company's recent operational milestones and developing commercial plans. The pieces of a larger, well-thought-out puzzle are falling into place for investors. The flight test program proves the aircraft is capable, a commercial partnership with helicopter operator Bristow establishes a ""Ready-to-Fly"" model for future customers, and the Aciturri deal now provides a credible path to large-scale manufacturing. Strategic additions to its leadership further strengthen this progress. The recent appointment of Lord Andrew Parker, the former head of Britain's MI5, to the board adds significant credibility and high-level access for Vertical's strategy of pursuing high-value defense and government contracts. This avenue, centered on the developing long-range hybrid-electric variant, represents a significant potential revenue stream beyond urban air mobility. For those following Vertical Aerospace, the investment narrative has evolved. The focus is shifting from the early-stage ""Can it fly?"" question to the more mature, business-oriented question of ""How will it be built and sold?"" By methodically signing Tier 1 partners, maintaining financial discipline, and executing on its flight test plans, the company is building a more tangible and robust case for its long-term value. Before you consider Vertical Aerospace, you'll want to hear this. MarketBeat keeps track of Wall Street's top-rated and best performing research analysts and the stocks they recommend to their clients on a daily basis. MarketBeat has identified the five stocks that top analysts are quietly whispering to their clients to buy now before the broader market catches on... and Vertical Aerospace wasn't on the list. While Vertical Aerospace currently has a Moderate Buy rating among analysts, top-rated analysts believe these five stocks are better buys. View The Five Stocks Here Enter your email address and we'll send you MarketBeat's guide to investing in 5G and which 5G stocks show the most promise."
Ride the Rally: 3 Earnings Winners With More Upside Ahead,https://www.marketbeat.com/stock-ideas/ride-the-rally-3-earnings-winners-with-more-upside-ahead/,"In the height of earnings season, investors typically watch many of the biggest names across industries for an essential update on how these key businesses—and the broader market—have fared. Only following major firms when it comes to earnings reports may cause an investor to miss out on potential opportunities for gains to be found in lesser-known companies as well. Three niche names, including two small-cap companies and a mid-cap firm, stand out in the second-quarter 2025 earnings season for posting strong results that have attracted informed investors to buy in. Even after these short-term rallies, analysts see the potential for more upside in the near future, meaning it may not be too late to buy in. Modine Manufacturing Co. NYSE: MOD makes a wide variety of thermal management products used in residential and commercial applications, including chillers, heaters, air handling and condensing units, and much more. The company's recent earnings report, which actually coincides with its first quarter of fiscal 2026, brought a 13-cent earnings per share beat and revenue ahead of analyst estimates as well. While Modine's traditional heating and cooling products will likely always have a market, some of its biggest business in recent months has been in the data center area. The firm also builds a line of air conditioning units, coolers, and other thermal control products specifically for data centers. This segment of Modine's business is growing at an impressive pace; the company is aiming for $2 billion in data center revenue by fiscal 2028, while its entire climate solutions segment (including data center products, among others) stood at $1.4 billion in sales for fiscal 2025. Modine is supporting this sales growth with a recently announced $100-million investment to build out manufacturing capacity. Modine has also been executing strategic acquisitions with a high degree of success. Last quarter, its purchases of Absolute Air, L.B. White, and CDI all helped to drive climate solutions revenue growth of 11% year-over-year (YOY). These and potential future acquisitions may aid Modine in achieving its lofty full-year fiscal 2026 outlook of 10-15% YOY revenue growth, recently revised up from 2-10%. MOD shares are up 28% in the last month, with about 7% in additional upside potential projected. A maker of components and systems used in industrial air quality and water treatment applications, CECO Environmental Corp. NASDAQ: CECO also wowed in its latest earnings report. The company beat analyst predictions on both top- and bottom-line performance while boosting both EPS and revenue by 35% YOY and EBITDA by 45% over the same period. CECO's strong performance is likely due to rising demand for environmental solutions and CECO's increased capacity to meet that demand, thanks to its expansion into Saudi Arabia and ongoing growth across the Middle East and Asia. Owing to its broad array of products and services, CECO has business opportunities in a number of fast-growing spaces, including power generation, semiconductor, and natural gas infrastructure. This has driven a 40% CAGR since 2021 to the company's sales opportunity pipeline, which currently sits at $5.5 billion. Backlog is also growing rapidly, having reached $688 million in the latest quarter thanks to $274 million in new bookings. That's three-quarters higher than the same figure last year. With all of this growth, it's unsurprising that CECO management raised the company's forward guidance. The company now expects $725–775 million in revenue for the full year. CECO shares are up an impressive 50.4% in the last month, but analysts see the possibility of another 9% upside. Expro Group Holdings N.V. NYSE: XPRO provides energy services including well construction, drilling, tubular running, and more. Like the firms above, Expro also topped predictions for both EPS and revenue for the latest quarter, as revenue in particular climbed 8% YOY despite unpredictability in the energy sector more broadly. Expro's advantage lies in part in its massive reach, as the company serves clients in dozens of countries throughout the world. Thus, when demand increases in a particular area, the firm is prepared to meet it quickly—this is evidenced in the latest quarter by $595 million in new awards, including major new projects in Guyana and North Africa. The firm also distinguishes itself for its cutting-edge technology, including both remote clamp insulation and a fully remote cementing system launched in recent months, among others. The company's guidance is strong, and it expects about $1.7 billion in full-year revenue and 7% free cash flow thanks to its international business. It also plans to engage in a share buyback campaign to return about $40 million to shareholders in the coming months. XPRO shares are up nearly 17% in the last month, with more than 16% in additional upside possible. Before you consider Modine Manufacturing, you'll want to hear this. MarketBeat keeps track of Wall Street's top-rated and best performing research analysts and the stocks they recommend to their clients on a daily basis. MarketBeat has identified the five stocks that top analysts are quietly whispering to their clients to buy now before the broader market catches on... and Modine Manufacturing wasn't on the list. While Modine Manufacturing currently has a Buy rating among analysts, top-rated analysts believe these five stocks are better buys. View The Five Stocks Here Enter your email address and we'll send you MarketBeat's list of seven best retirement stocks and why they should be in your portfolio."
"How major US stock indexes fared Tuesday, 8/5/2025",https://www.marketbeat.com/articles/how-major-us-stock-indexes-fared-tuesday-852025-2025-08-05/,"U.S. stock indexes slipped following the latest discouraging signal on the U.S. economy. The S&P 500 fell 0.5% Tuesday, coming off a whipsaw stretch where it followed its worst day since May with its best since May. The Dow Jones Industrial Average fell 0.1%, and the Nasdaq composite fell 0.7%. A weaker-than-expected report on activity for U.S. services businesses added to worries that President Donald Trump’s tariffs may be hurting the economy. But hopes for coming cuts to interest rates by the Federal Reserve, along with a stream of stronger-than-expected profit reports from U.S. companies, helped keep the losses in check. On Tuesday: The S&P 500 fell 30.75 points, or 0.5%, to 6,299.19. The Dow Jones Industrial Average fell 61.90 points, or 0.1%, to 44,111.74. The Nasdaq composite fell 137.03 points, or 0.7%, to 20,916.55. The Russell 2000 index of smaller companies rose 13.37 points, or 0.6%, to 2,225.67. For the week: The S&P 500 is up 61.18 points, or 1%. The Dow is up 523.16 points, or 1.2%. The Nasdaq is up 266.42 points, or 1.3%. The Russell 2000 is up 58.89 points, or 2.7%. For the year: The S&P 500 is up 417.56 points, or 7.1%. The Dow is up 1,567.52 points, or 3.7%. The Nasdaq is up 1,605.76 points, or 8.3%. The Russell 2000 is down 4.49 points, or 0.2%. Before you make your next trade, you'll want to hear this. MarketBeat keeps track of Wall Street's top-rated and best performing research analysts and the stocks they recommend to their clients on a daily basis. Our team has identified the five stocks that top analysts are quietly whispering to their clients to buy now before the broader market catches on... and none of the big name stocks were on the list. They believe these five stocks are the five best companies for investors to buy now... See The Five Stocks Here Discover the top 7 AI stocks to invest in right now. This exclusive report highlights the companies leading the AI revolution and shaping the future of technology in 2025."
Crucial exemption allows majority of Canadian and Mexican goods to be shipped to US without tariffs,https://www.marketbeat.com/articles/crucial-exemption-allows-majority-of-canadian-and-mexican-goods-to-be-shipped-to-us-without-tariffs-2025-08-05/,"TORONTO (AP) — U.S. President Donald Trump raised the tariffs on Canadian goods to 35% last week, but a key exemption for Canada and Mexico shields the vast majority of goods from the punishing duties. Goods that comply with the 2020 United States-Mexico-Canada Agreement that Trump negotiated during his first term are excluded from the tariffs. Here's a look at Trump's tariffs on the two countries and their exemptions: Canada’s central bank says 100% of energy exports and 95% of other exports are compliant with the trade pact, known as USMCA. The Royal Bank estimated that almost 90% of Canadian exports appear to have accessed the U.S. market duty free in April. Canadian Prime Minister Mark Carney said the commitment of the U.S. to the core of USMCA, reaffirmed again last week, means the U.S. average tariff rate on Canadian goods remains one of its lowest, and over 85% of Canada-U.S. trade continues to be tariff free. “Canada is better off than any of the trading partners right now because the Americans appear to be relying as a default on USMCA,” said Flavio Volpe, president of the Automotive Parts Manufacturers’ Association. “That gives them the tough tariff headline but also allows them the access to the stuff they need from us. Because of that we’re in a relative better position.” Canadian and Mexican companies can claim preferential treatment under the USMCA based on where the products are made. “The headline news is 35% tariffs but it’s somewhat targeted,” said John Manley, Canada’s former industry minister, finance minister, foreign affairs minister and deputy prime minister. Manley said Canada is doing okay despite the economic uncertainty. “There is a lot of resilience I’d say. The Canadian economy has done relatively well, better than most of us expected, and remember that there is no tariffs on any of our energy exports,"" he said. Trump said last week he would enter into a 90-day negotiating period with Mexico, also one of America's largest trading partners. The current 25% tariff rates are staying in place, down from the 30% he had threatened earlier. But that 25% only applies to the fraction of Mexico's trade with the U.S. that isn't covered by the USMCA. Shortly after speaking with Trump on Thursday, President Claudia Sheinbaum said that within the “new commercial world order,” Mexico was still the best positioned nation because of the free trade agreement. “What’s within (USMCA) has no tariff, with the exception of what we already know: autos, steel and aluminum; and what is outside the treaty has 25%,” Sheinbaum said. But Economy Secretary Marcelo Ebrard pointed out that under the USMCA no tariffs were paid on more than 84% of Mexico's trade with the United States. Most imports from Canada and Mexico are still protected by the USMCA, but the deal is up for review next year. U.S. Commerce Secretary Howard Lutnick said last month: “I think the president is absolutely going to renegotiate USMCA."" Preserving the free trade pact will be critical for Canada and Mexico. “It would be an incredible disruption to lose it especially if you lost it to the levels of tariffs Trump is imposing, 30%, 25% or even 20%. You can absorb a single digit tariff level across the board but you can’t adjust that kind of increase,” Manley said. More than 75% of Canada's exports go to the U.S. while more than 80% of Mexico's exports go there. Manley said that depending on how the trade war plays out the risk to the USMCA is very high. “Uncertainty in business is the enemy of decision making,"" he said. Carney said in a series of recent agreements with other countries that America is, in effect, charging for access to its economy. Manley said the investment thesis for Canada is pretty straightforward as Canada is rich in natural resources, has a skilled labor force, is open to immigration and has unfettered access to the U.S. market, the largest economy in the world. “If that latter point is no longer the case, we’ve still got all the others, but we’ve got to really redevelop the investment thesis for attracting investment to Canada,” Manley said. Trump has some sector specific tariffs, known as 232 tariffs, that are having an impact. There is a 50% tariff on steel and aluminum imports and a 25% tariff on auto imports, though there is a carve-out for Canadian and Mexican made cars. “Despite our advantages, certain major Canadian industries are being severely impacted by U.S. trade actions. These strategic sectors include autos, steel, aluminum, copper, pharmaceuticals, semiconductors, and of course, softwood lumber,” Carney said on Tuesday as he announced an aid package for the lumber industry as the U.S, ratches up duties. “It is clear we cannot count or fully rely on what has been our most valued trading relationship for our prosperity,” he added. ___ Associated Press writer Fabiola Sánchez in Mexico City contributed to this report. Before you make your next trade, you'll want to hear this. MarketBeat keeps track of Wall Street's top-rated and best performing research analysts and the stocks they recommend to their clients on a daily basis. Our team has identified the five stocks that top analysts are quietly whispering to their clients to buy now before the broader market catches on... and none of the big name stocks were on the list. They believe these five stocks are the five best companies for investors to buy now... See The Five Stocks Here Looking for the next FAANG stock before everyone has heard about it? Enter your email address to see which stocks MarketBeat analysts think might become the next trillion dollar tech company."
