title,link,content
Asian shares trade mostly higher after stocks on Wall Street extend losses,https://www.marketbeat.com/articles/asian-shares-trade-mostly-higher-after-stocks-on-wall-street-extend-losses-2025-08-05/,"TOKYO (AP) — Asian shares were mostly higher in muted trading Wednesday, after discouraging signs about the U.S. economy sent Wall Street shares declining, and Investors are sifting through a slew of corporate earnings reports to assess how businesses may have been affected by U.S. President Donald Trump's tariffs. Among Japanese companies, automakers Honda Motor Co. and Toyota Motor Corp. will report fiscal first quarter results this week, as will electronics and entertainment company Sony Corp. Japan's benchmark Nikkei 225 rose 0.6% to 40,777.45. Australia's S&P/ASX 200 added 0.6% to 8,822.90. South Korea's Kospi lost 0.3% to 3,187.57. Hong Kong's Hang Seng rose 0.2% to 24,947.57, while the Shanghai Composite gained 0.3% to 3,627.54. U.S. futures were up 0.3%. On Tuesday, the S&P 500 fell 0.5% to 6,299.19, coming off a whipsaw stretch where it went from its worst day since May to its best since May. The Dow Jones Industrial Average dropped 0.1% to 44,111.74, and the Nasdaq composite fell 0.7% to 20,916.55. A weaker-than-expected report on activity for U.S. businesses in services industries like transportation and retail added to worries that Trump’s tariffs  may be hurting the economy. But conversely such indicators raise hopes the Federal Reserve may cut interest rates. That along with a stream of stronger-than-expected profit reports from U.S. companies helped to keep losses in check. The S&P 500 remains within 1.4% of its record. The pressure is on companies to report bigger profits after the U.S. stock market surged to record after record from a low point in April. The big rally fueled criticism that the broad market had become too expensive. For stock prices to look like better bargains, companies could produce bigger profits, or interest rates could fall. The latter may happen in September, when the Fed has its next policy meeting. Expectations have built sharply for a rate cut at that meeting since a report on the U.S. job market on Friday came in much weaker than economists expected. Lower interest rates would make stocks look less expensive, while also giving the overall economy a boost. The potential downside is that they could push inflation higher. Treasury yields sank sharply after Friday’s release of the jobs report, and they haven’t recovered. The yield on the 10-year Treasury eased to 4.19% from 4.22% late Monday and from 4.39% just before the release of the jobs report. That’s a significant move for the bond market. In energy trading, benchmark U.S. crude rose 41 cents to $65.57 a barrel. Brent crude, the international standard, added 42 cents to $68.06 a barrel. In currency trading, the U.S. dollar dipped to 147.34 Japanese yen from 147.61 yen. The euro cost $1.1583, up from $1.1579. ___ AP Business Writer Stan Choe contributed. Before you consider Toyota Motor, you'll want to hear this. MarketBeat keeps track of Wall Street's top-rated and best performing research analysts and the stocks they recommend to their clients on a daily basis. MarketBeat has identified the five stocks that top analysts are quietly whispering to their clients to buy now before the broader market catches on... and Toyota Motor wasn't on the list. While Toyota Motor currently has a Hold rating among analysts, top-rated analysts believe these five stocks are better buys. View The Five Stocks Here Market downturns give many investors pause, and for good reason. Wondering how to offset this risk? Enter your email address to learn more about using beta to protect your portfolio."
"As Trump cracks down on college student visas, other countries see opportunity",https://www.marketbeat.com/articles/as-trump-cracks-down-on-college-student-visas-other-countries-see-opportunity-2025-08-05/,"LONDON (AP) — In China, wait times for U.S. visa interviews are so long that some students have given up. Universities in Hong Kong are fielding transfer inquiries from foreign students in the U.S., and international applications for British undergraduate programs have surged. President Donald Trump’s administration has been pressuring U.S. colleges to reduce their dependence on international enrollment while adding new layers of scrutiny for foreign students as part of its crackdown on immigration. The U.S. government has sought to deport foreign students for participating in pro-Palestinian activism. In the spring, it abruptly revoked the legal status of thousands of international students, including some whose only brush with law enforcement was a traffic ticket. After reversing course, the government paused new appointments for student visas while rolling out a process for screening applicants’ social media accounts. The U.S. remains the first choice for many international students, but institutions elsewhere are recognizing opportunity in the upheaval, and applicants are considering destinations they might have otherwise overlooked. The impact on U.S. universities — and the nation's economy — may be significant. New international enrollment in the U.S. could drop by 30% to 40% this fall, according to an analysis of visa and enrollment data by NAFSA, an agency that promotes international education. That would deprive the U.S. economy of $7 billion in spending, according to the analysis. Many international students pay full price, so their absence would also hurt college budgets. As the second most popular destination for international students, Britain is positioned to benefit.and The country's new Labour government has vowed to cut migration, and officials have imposed time limits on post-study visas allowing graduates to stay and work. But admissions consultants say the United Kingdom is still seen as the most welcoming of the traditional “big four” English-speaking destinations in higher education — the U.S., U.K., Canada and Australia. After declining last year, the number of international applications for undergraduate study in the U.K. this fall grew by 2.2%, official figures show. A record number of applications came from China, up 10% compared with the previous year. Applications from the U.S. also reached nearly 8,000 students — an increase of 14% and a 20-year high. Acceptances of international students for graduate programs in the U.K. grew an estimated 10% from last year, driven by demand for business and management courses in particular, according to data from UniQuest, which works with many British universities on admissions. Data showing the extent of any impact will not be available until fall, said Mike Henniger, CEO of Illume Student Advisory Services, a consultancy that works with colleges in the U.S., Canada and Europe. “But the American brand has taken a massive hit, and the U.K. is the one that is benefiting,"" he said. Demand from Chinese students has risen rapidly for universities places in Hong Kong, Singapore and Malaysia, said Will Kwong, managing director of AAS Education, a consultancy in Hong Kong. Many Western universities have offshore campuses there that are more affordable than going to the U.S. or U.K. “Opting for study in Asia has been a trend since the easing of COVID-19,” Kwong said. “But obviously it’s been exacerbated by the change of administration in the U.S.” Some Asian families have told him the U.S. is no longer their clear first choice because of political turbulence and visa difficulties, many are still waiting for U.S. visa interviews and will likely miss the start of the fall term, Kwong said. Chinese college student Alisa, who is studying data science, plans to attend an exchange program this fall at the University of California, Berkeley. She hopes to pursue a master's degree in the U.S. But she is also looking into other options “just so I could still go to school if the extreme scenario occurs,” said Alisa, who spoke on condition of partial anonymity out of fear of being targeted. Hong Kong will welcome any students who are denied entry to the U.S., the city's leader John Lee has said. Last year, the Chinese territory decided to allow international students to work part-time. Hong Kong University said it has received over 500 inquiries from students in the U.S. and is processing around 200 applications for transfer. At another school, the Hong Kong University of Science and Technology, international undergraduate applications have surged by 40% from last year, said Alison Lloyd, associate provost on institutional data and research. Countries including the United Arab Emirates have invested heavily in attracting international students by partnering with universities elsewhere to host branch campuses. These arrangements could appeal to students who fear being denied access to the U.S. Dubai, which has designs on becoming a global education hub, hosts dozens of international institutions’ satellite campuses. It saw international student numbers grow by a third in 2024-2025. Lisa Johnson, principal of Dubai's private American Academy for Girls, said her mostly Emirati student body is increasingly looking away from the U.S. for college. “Every student wants and dreams to go to Harvard,” she said. “But as college options increase in the United Arab Emirates, more and more students are staying."" Kazakhstan has similar ambitions, said Daniel Palm, who has helped U.S. universities set up campuses abroad. Illinois Tech and the University of Arizona are among colleges offering degree programs in the Central Asian country, drawing students mostly from China and Russia. “All of a sudden U.S. colleges are asking how to provide diversity, provide access,"" Palm said, ""because you have students who want to come to the U.S. and can't."" ___ Associated Press writers Kanis Leung in Hong Kong; Albee Zhang in Washington, D.C.; and Gabe Levin in Dubai contributed. Before you make your next trade, you'll want to hear this. MarketBeat keeps track of Wall Street's top-rated and best performing research analysts and the stocks they recommend to their clients on a daily basis. Our team has identified the five stocks that top analysts are quietly whispering to their clients to buy now before the broader market catches on... and none of the big name stocks were on the list. They believe these five stocks are the five best companies for investors to buy now... See The Five Stocks Here Discover the next wave of investment opportunities with our report, 7 Stocks That Will Be Magnificent in 2025. Explore companies poised to replicate the growth, innovation, and value creation of the tech giants dominating today's markets."
Trump's pursuit of meeting with Chinese leader reveals the complex web of US-China relations,https://www.marketbeat.com/articles/trumps-pursuit-of-meeting-with-chinese-leader-reveals-the-complex-web-of-us-china-relations-2025-08-05/,"WASHINGTON (AP) — China, the adversary. China, the friend? These days, maybe a bit of both. From easing export controls to reportedly blocking the Taiwanese president's plans to travel through the United States, President Donald Trump is raising eyebrows in Washington that he might offer concessions that could hurt U.S. interests in his quest to meet, and reach a deal with, the Chinese leader. There is no firm plan for Trump to meet Chinese President Xi Jinping. But it's widely believed that the men must meet in person, likely in the fall, for the two governments to ink a trade deal, and some are worried that Xi is leveraging Trump's desire for more giveaways. ""The summit mismatch is real. There’s a clear gap between Trump’s eagerness for a face-to-face with Xi and Beijing’s reluctance to engage,"" said Craig Singleton, senior director of the China program at the Washington-based think tank Foundation for Defense of Democracies. There are concerns that Trump may throttle back on export controls or investment curbs to preserve summit prospects, Singleton said, warning the risk “isn't just in giving away too much” but also ""in letting Beijing set the tempo.” China-U.S. relations have pinballed often since Washington established relations with communist-led Beijing in 1979. They've hit highs and lows — the latter in the aftermath of the 1989 massacre of pro-democracy protesters in Tiananmen Square, after a 2001 incident involving a U.S. spy plane, during the COVID pandemic and right now. Both countries have struggled to understand each other, which has sometimes gotten in the way of deeper partnerships. And this time around, there's a wild card: the anything-might-happen second presidency of Trump. Efforts by a U.S. president to meet the head of the authoritarian Chinese government have often met with partisan outcries — which happened when former President Joe Biden hosted Xi in California in 2023. But Trump's case is peculiar, partly because he is willing to break with conventional political restraints to make deals and partly because his own party has grown hawkish towards China over national security. “With President Trump, everything seems to be open for negotiation, and there are few if any red lines,” said Gabriel Wildau, managing director of the global consultancy Teneo. “The hawks worry that if Trump gets into a room with Xi, he will agree to extraordinary concessions, especially if he believes that a big, beautiful deal is within reach.” While most Republican lawmakers have not voiced their concerns openly, Democrats are vocal in their opposition. ""President Trump is giving away the farm to Xi just so he can save face and reach a nonsensical trade deal with Beijing that will hurt American families economically,"" said Rep. Gregory Meeks, the top Democrat on the House Foreign Affairs Committee. On Tuesday, Kush Desai, a White House spokesman, said the Trump administration “has not wavered — and will never waver — in safeguarding our national and economic security to put America first.” “The administration continues to have productive conversations with China to address longstanding unfair trade practices,” Desai said, adding that export controls on cutting-edge technology and many tariffs remain in place. Treasury Secretary Scott Bessent, after his latest round of trade negotiations with the Chinese in July, told CNBC that the team was “very careful to keep trade and national security separate.” And Secretary of State Marco Rubio, appearing on Fox News Radio, said the U.S. remains “as committed as ever to our partners ... in places like Taiwan” but also spoke of the strategic need to keep trade ties with China steady. “In the end, we have two big, the two largest economies in the world,” Rubio said. “An all-out trade conflict between the U.S. and China, I think the U.S. would benefit from it in some ways, but the world would be hurt by it."" Taiwan is concerned that the self-governing island could be “trade-able” when Trump seeks a deal with Beijing, said Jason Hsu, a senior fellow at the Hudson Institute and a former legislator in Taiwan. “Our concern is that, will any of the trade deals lead to concession on political support for Taiwan?"" Hsu said, citing the case last month where the White House allegedly blocked a request for Taiwanese President Lai Ching-te to transit through the United States. The U.S. maintains unofficial ties with Taiwan and has always allowed such transits in the past. Experts are worried that the Trump administration is setting a bad precedent, and Democrats have seized on it to criticize Trump. Rep. Raja Krishnamoorthi, the top Democrat on the House Select Committee on China, called the move “both a sharp break from precedent and another example of the Trump administration caving to China in hopes of reaching a trade deal."" He said the policy decision “sends a dangerous signal” that Taiwan’s democracy is negotiable. Hsu said Taiwan fears that Trump could be coerced or compelled to support the one-China principle, as espoused by Beijing, that acknowledges Beijing's sovereignty claim over the island. There are also concerns that Trump might utter anything in support of “unification."" That was a request Beijing raised with the Biden administration, though it failed to get a positive response. Now, it's upon Taiwan to persuade Trump to think of the island as “an economic partner rather than something that he can trade when he negotiates with China,” Hsu said, suggesting that Taiwan step up defense commitments, increase energy procurement, open its market to U.S. companies and invest more in the U.S. But Sun Yun, director of the China program at the Stimson Center, said Trump is bound by the Taiwan Relations Act, a domestic law that obligates the U.S. to maintain an unofficial relationship with the island and provides it with sufficient hardware to deter any invasion by China. “He can dial the (U.S.-Taiwan) relationship up and down,"" Sun said, ""but he can’t remove the relationship.” In April, the White House, citing national security, announced it would restrict sales of Nvidia’s H20 computer chips to China. The ban was lifted about three months later, when the two governments had climbed down from sky-high tariffs and harsh trade restrictions. The decision upset both Republican and Democratic lawmakers. Rep. John Moolenaar, a Michigan Republican who chairs the House Select Committee on China, wrote to Commerce Secretary Howard Lutnick to stress that the U.S. cannot let the Chinese Communist Party “use American chips to train AI models that will power its military, censor its people, and undercut American innovation.” In Stockholm, Bessent pushed back at the concern that national security might be compromised. “We are very diligent,” Bessent said, adding there's an interagency process that involves the National Security Council and the Defense Department for decisions. “There's nothing that's being exchanged for anything,” Bessent said. Addressing H20 chips specifically, Bessent said they “are well down"" Nvidia's ""technology chips stack.” U.S. companies are banned from selling their most advanced chips to China. That might not be persuasive enough. Teneo's Wildau said China hawks are most worried that the H20 decision could be the beginning of a series of moves to roll back export controls from the Biden era, which were once considered “permanent and non-negotiable.” Before you make your next trade, you'll want to hear this. MarketBeat keeps track of Wall Street's top-rated and best performing research analysts and the stocks they recommend to their clients on a daily basis. Our team has identified the five stocks that top analysts are quietly whispering to their clients to buy now before the broader market catches on... and none of the big name stocks were on the list. They believe these five stocks are the five best companies for investors to buy now... See The Five Stocks Here Enter your email address and we'll send you MarketBeat's list of ten stocks that are set to soar in Summer 2025, despite the threat of tariffs and other economic uncertainty. These ten stocks are incredibly resilient and are likely to thrive in any economic environment."
