title,link,content
Musk says he plans to sue Apple for not featuring X or Grok among its top apps,https://www.marketbeat.com/articles/musk-says-he-plans-to-sue-apple-for-not-featuring-x-or-grok-among-its-top-apps-2025-08-12/,"Billionaire SpaceX, Tesla and X owner Elon Musk says he plans to sue Apple for not featuring X and its Grok artificial intelligence chatbot app in its top recommended apps in its App Store. Musk posted the comments on X late Monday, saying, “Hey @Apple App Store, why do you refuse to put either X or Grok in your ‘Must Have’ section when X is the #1 news app in the world and Grok is #5 among all apps? Are you playing politics? What gives? Inquiring minds want to know.” Grok is owned by Musk's artificial intelligence startup xAI. Musk went on to say that “Apple is behaving in a manner that makes it impossible for any AI company besides OpenAI to reach #1 in the App Store, which is an unequivocal antitrust violation. xAI will take immediate legal action.” He gave no further details. There was no immediate comment from Apple, which has faced various allegations of antitrust violations in recent years. A federal judge recently found that Apple violated a court injunction in an antitrust case filed by Fortnite maker Epic Games. Regulators of the 27-nation European Union fined Apple 500 million euros in April for breaking competition rules by preventing app makers from pointing users to cheaper options outside its App Store. Last year, the EU fined the U.S. tech giant nearly $2 billion for unfairly favoring its own music streaming service by forbidding rivals like Spotify from telling users how they could pay for cheaper subscriptions outside of iPhone apps. As of early Tuesday, the top app in Apple's App Store was TikTok, followed by Tinder, Duolingo, YouTube and Bumble. Open AI's ChatGPT was ranked 7th. Before you make your next trade, you'll want to hear this. MarketBeat keeps track of Wall Street's top-rated and best performing research analysts and the stocks they recommend to their clients on a daily basis. Our team has identified the five stocks that top analysts are quietly whispering to their clients to buy now before the broader market catches on... and none of the big name stocks were on the list. They believe these five stocks are the five best companies for investors to buy now... See The Five Stocks Here With the proliferation of data centers and electric vehicles, the electric grid will only get more strained. Download this report to learn how energy stocks can play a role in your portfolio as the global demand for energy continues to grow."
Australia's central bank cuts interest rate for third time this year to 3.6%,https://www.marketbeat.com/articles/australias-central-bank-cuts-interest-rate-for-third-time-this-year-to-36-2025-08-12/,"MELBOURNE, Australia (AP) — Australia’s central bank on Tuesday reduced its benchmark interest rate by a quarter percentage point for a third time this year to 3.6%, with inflation tamed and economic growth stalling. The Reserve Bank of Australia reduced its cash rate from 3.85%. The rate was cut from 4.1% in May. The reduction from 4.35% at its February board meeting was Australia’s first rate cut since October 2020. The new rate is the lowest since March 2023 and the cut was widely anticipated as inflation continues to fall. The bank's governor, Michele Bullock, said international trade policy developments were expected to have an adverse effect on global economic activity. ""Uncertainty in the world economy remains elevated. There is a little more clarity on the scope and scale of U.S. tariffs and policy responses in other countries, suggesting that more extreme outcomes are likely to be avoided,"" Bullock said in a statement. The bank adjusts interest rates to steer inflation toward a target band of between 2% and 3%. In May, annual inflation fell to 2.1% from 2.4% a month earlier. The trimmed mean — a gauge of underlying inflation that is the bank’s preferred measure — fell from 2.8% in April to 2.4%. Inflation has gradually declined since it peaked at 7.8% in the last quarter of 2022. The bank was widely expected to cut the rate at its last board meeting in July. But directors voted 6-to-3 to wait to see inflation data for the June quarter. That data revealed that trimmed mean inflation was 2.7% in the three months through June, down from 2.9% in the March quarter. The board's decision to cut interest rates on Tuesday was unanimous. Treasurer Jim Chalmers said curbing inflation to within the target range had given the central bank confidence to cut interest rates three times in six months. “This is very welcome relief for millions of Australians,” Chalmers told reporters. “It will put more money in the pockets of people who are under pressure.” The economic boost of a rate cut comes after growth slowed to a sluggish 0.2% in the three months through March and 1.3% for the year. The economy grew 0.6% in the preceding December quarter. The bank has attempted to gradually rein in inflation without tipping the economy into recession or causing large-scale job losses. Unemployment rose to 4.3% in June from 4.1% where it had held steady since February. The jobless rate was at 4.0% in January. Before you make your next trade, you'll want to hear this. MarketBeat keeps track of Wall Street's top-rated and best performing research analysts and the stocks they recommend to their clients on a daily basis. Our team has identified the five stocks that top analysts are quietly whispering to their clients to buy now before the broader market catches on... and none of the big name stocks were on the list. They believe these five stocks are the five best companies for investors to buy now... See The Five Stocks Here Wondering where to start (or end) with AI stocks? These 10 simple stocks can help investors build long-term wealth as artificial intelligence continues to grow into the future."
Australia’s central bank cuts interest rate for third time this year to 3.6%,https://www.marketbeat.com/articles/australias-central-bank-cuts-interest-rate-for-third-time-this-year-to-36-2025-08-11/,"MELBOURNE, Australia (AP) — Australia’s central bank cuts interest rate for third time this year to 3.6%. Before you make your next trade, you'll want to hear this. MarketBeat keeps track of Wall Street's top-rated and best performing research analysts and the stocks they recommend to their clients on a daily basis. Our team has identified the five stocks that top analysts are quietly whispering to their clients to buy now before the broader market catches on... and none of the big name stocks were on the list. They believe these five stocks are the five best companies for investors to buy now... See The Five Stocks Here With the proliferation of data centers and electric vehicles, the electric grid will only get more strained. Download this report to learn how energy stocks can play a role in your portfolio as the global demand for energy continues to grow."
Asian shares advance on relief that Trump is delaying higher China tariffs,https://www.marketbeat.com/articles/asian-shares-advance-on-relief-that-trump-is-delaying-higher-china-tariffs-2025-08-11/,"TOKYO (AP) — Asian shares mostly advanced Tuesday after President Donald Trump delayed raising tariffs on China for another 90 days. Japan's benchmark Nikkei 225 jumped 2.6% to 42,942.14, topping its past all-time record. Toyota Motor Corp.'s shares surged 3.3% and other heavyweight shares also saw big gains. Hong Kong's Hang Seng slipped nearly 0.2% to 24,865.07, while the Shanghai Composite edged up 0.3% to 3,658.62. Trump signed an executive order Monday putting on hold a possible showdown between the world’s two major economies to allow time for more talks on a broad trade agreement. Without an extension, taxes on Chinese imports might have jumped from an already high 30%. Beijing could have responded by raising retaliatory levies on U.S. exports to China but it issued a similar statement about the extension of the tariff pause. The reprieve makes room for a possible deal with Trump, but it also prolongs the uncertainty that has bedeviled companies since the president began escalating his trade war. “The extension isn’t about goodwill; it’s about keeping oxygen in the room for deals that matter,” Stephen Innes of SPI Asset Management said in a commentary. Elsewhere in Asia, Australia’s S&P/ASX 200 was little changed, rising less than 0.1% to 8,852.80. South Korea’s Kospi added 0.6% to 3,227.10. On Monday, U.S. stocks edged back from their record highs ahead of an update on U.S. inflation. The S&P 500 dipped 0.3% to 6,373.45 after flirting with its all-time high, which was set two weeks ago. The Dow Jones Industrial Average dropped 0.5% to 43,975.09, and the Nasdaq composite slipped 0.3% to 21,385.40. The highlight of this week for Wall Street will likely arrive on Tuesday, when the government will report how bad inflation was across the country in July. Economists expect it to show U.S. consumers had to pay prices for groceries, gasoline and other costs of living that were 2.8% higher than a year earlier, a slight acceleration from June’s 2.7% inflation. Inflation has remained above 2%, even if it has improved substantially from its peak above 9% three years ago. And the worry is that President Donald Trump’s tariffs  could push prices still higher. That in turn is raising fears about a potential, worst-case scenario called “stagflation” where the economy stagnates but inflation remains high. The Federal Reserve  has no good tool to fix both at once, and it would need to concentrate on either the job market or inflation first. But helping one of those areas by moving interest rates would likely hurt the other. A top Fed official, Michelle Bowman, said on Saturday  that she believes the job market is the bigger concern. She is still backing three cuts to interest rates by the Fed this year following this month’s stunning, weaker-than-expected report on the U.S. job market. Trump has also been angrily calling for cuts to interest rates to support the economy. Other Fed officials, led by Chair Jerome Powell, have been more hesitant. Powell has said he wants to wait for more data about how Trump’s tariffs are affecting inflation before the Fed makes its next move, and Tuesday’s update on the consumer price index may offer a big clue about that. The price of gold eased after Trump said he would not place tariffs on the metal. That followed a brouhaha Friday in the gold market after the U.S. Customs and Border Patrol seemed to rule that some kinds of gold bars coming from Switzerland would face a tariff. That caused a disconnect between the prices of gold trading in New York versus in London, but the market has since calmed. Gold for December delivery settled at $3,404.70 per ounce in New York, down 2.5%. Early Tuesday, it was down 0.1% at $3,399.70. In other dealings early Tuesday, benchmark U.S. crude rose 17 cents to $64.13 a barrel. Brent crude, the international standard, added 21 cents to $66.84 a barrel. In currency trading, the U.S. dollar edged up to 148.44 Japanese yen from 148.15 yen. The euro cost $1.1621, up from $1.1618. ___ AP Business Writer Stan Choe contributed. Before you consider Toyota Motor, you'll want to hear this. MarketBeat keeps track of Wall Street's top-rated and best performing research analysts and the stocks they recommend to their clients on a daily basis. MarketBeat has identified the five stocks that top analysts are quietly whispering to their clients to buy now before the broader market catches on... and Toyota Motor wasn't on the list. While Toyota Motor currently has a Hold rating among analysts, top-rated analysts believe these five stocks are better buys. View The Five Stocks Here Enter your email address and we'll send you MarketBeat's guide to investing in 5G and which 5G stocks show the most promise."
"An explosion at a plant owned by US Steel, an icon of American industry, has killed 2. What to know",https://www.marketbeat.com/articles/an-explosion-at-a-plant-owned-by-us-steel-an-icon-of-american-industry-has-killed-2-what-to-know-2025-08-11/,"An explosion at a U.S. Steel plant south of Pittsburgh killed two people and injured 10 others. The CEO has vowed to find out what caused Monday's blast while union officials say representatives will work to ensure a thorough investigation. The plant, Clairton Coke Works, is one of four major plants in Pennsylvania owned by U.S. Steel, an icon of the domestic steel industry and American industrialization for over a century. The plant is in the Mon Valley, a region of the state synonymous with steel. Here's what to know about the explosion: Allegheny County Emergency Services said a fire at the plant started around 10:50 a.m. The explosion, which was followed by several smaller blasts, sent black smoke spiraling into air. The blast could be felt in the nearby community and prompted county officials to warn residents to stay away from the scene so emergency workers could respond. One worker was rescued from the smoldering rubble hours later. Allegheny Health Network said it treated seven patients from the plant and discharged five within a few hours. The University of Pittsburgh Medical Center said it was treating three patients at UPMC Mercy, the region’s only level one trauma and burn center. The plant converts coal to coke, a key component in the steel-making process. It’s the largest coking operation in North America. Coke is made by baking coal in special ovens for hours at high temperatures, which removes impurities that could otherwise weaken steel. The process creates what’s known as coke gas — made up of a lethal mix of methane, carbon dioxide and carbon monoxide. Clairton Coke Works, which has 1,400 workers, has had explosions and fatal accidents before: 1. In September 2009, a maintenance worker was killed in an explosion 2. In July 2010, an explosion injured 14 employees and six contractors. Afterward, the Occupational Safety and Health Administration fined U.S. Steel and a subcontractor $175,000 for safety violations. U.S. Steel appealed its citations and $143,500 in fines, which were later reduced under a settlement agreement. 3. The last death at the plant was in 2014, according to online OSHA records of workplace fatalities. A worker was burned and died after falling into a trench. 4. In February, a problem with a battery at the plant led to a “buildup of combustible material” that ignited, causing an audible “boom,” officials said. Two workers received first aid treatment but were not seriously injured. After Monday's blast, the county health department initially told residents within 1 mile (1.6 kilometers) of the plant to remain indoors and close all windows and doors. The department lifted the advisory after its monitors didn’t detect levels of soot or sulfur dioxide above federal standards. In 2018, a Christmas Eve fire damaged pollution control equipment and led to repeated releases of sulfur dioxide, according to a subsequent lawsuit. The fire prompted Allegheny County to warn residents to limit outdoor activities. Residents said it was hard to breathe for weeks afterward and that the air felt acidic and smelled like rotten eggs. U.S. Steel settled the lawsuit last year with an agreement to spend $19.5 million in equipment upgrades and $5 million on local clean air efforts and programs. Dr. Deborah Gentile, the medical director of Community Partners in Asthma Care, studied asthma levels after the fire and found twice as many patients sought medical treatment. One of her colleagues found patients living near the plant had increased symptoms of asthma, including coughing, wheezing and shortness of breath. In 2019, U.S. Steel agreed to settle a lawsuit regarding air pollution from Clairton for $8.5 million. U.S. Steel has been a symbol of industrialization since it was founded in 1901 by J.P. Morgan, Andrew Carnegie and others. It's been the icon of the American steel industry that once dominated the world market until Japan, then China, became preeminent steelmakers over the past 40 years. Its steel has helped build everything from the United Nations building in New York City to the New Orleans Superdome. Japan's largest steelmaker, Nippon Steel, in June finalized a deal to acquire U.S. Steel for nearly $15 billion. The agreement took more than a year to come together after U.S. Steel shareholders approved it as the parties surmounted obstacles created by national security concerns and presidential politics in a premier battleground state. The deal includes what is known as a “golden share” provision that gives the U.S. government the power to appoint a board member and a say in company decisions that affect domestic steel production and competition with overseas producers. The combined company is the world’s fourth-largest steelmaker in an industry now dominated by China. Before you consider JPMorgan Chase & Co., you'll want to hear this. MarketBeat keeps track of Wall Street's top-rated and best performing research analysts and the stocks they recommend to their clients on a daily basis. MarketBeat has identified the five stocks that top analysts are quietly whispering to their clients to buy now before the broader market catches on... and JPMorgan Chase & Co. wasn't on the list. While JPMorgan Chase & Co. currently has a Moderate Buy rating among analysts, top-rated analysts believe these five stocks are better buys. View The Five Stocks Here Market downturns give many investors pause, and for good reason. Wondering how to offset this risk? Enter your email address to learn more about using beta to protect your portfolio."
Officials are still investigating the cause of a Pennsylvania steel plant explosion that killed 2,https://www.marketbeat.com/articles/officials-are-still-investigating-the-cause-of-a-pennsylvania-steel-plant-explosion-that-killed-2-2025-08-11/,"CLAIRTON, Pa. (AP) — An explosion rocked a steel plant outside Pittsburgh on Monday, leaving two dead and 10 others injured, including a person who was rescued from the smoldering rubble after hours of being trapped. The explosion sent black smoke spiraling into the midday sky in the Mon Valley, a region of the state synonymous with steel for more than a century. Allegheny County Emergency Services said a fire at the plant in Clairton started late Monday morning. Officials said they had not isolated the cause of the blast. The rumbling from the explosion, and several smaller blasts that followed, jolted the community about 15 miles (24 kilometers) southeast of Pittsburgh. “It felt like thunder,” Zachary Buday, a construction worker near the scene, told WTAE-TV. “Shook the scaffold, shook my chest, and shook the building."" At a news conference, Scott Buckiso, U.S. Steel’s chief manufacturing officer, did not give details about the damage or casualties, and said they were still trying to determine what happened. He said the company, now a subsidiary of Japan-based Nippon Steel Corp., is working with authorities. Allegheny Health Network said it treated seven patients from the plant and discharged five within a few hours. University of Pittsburgh Medical Center said it is treating three patients at UPMC Mercy, the region’s only level one trauma and burn center. According to the company, the plant has approximately 1,400 workers. In a statement, the United Steelworkers, which represents many of the Clairton plant’s workers, said it had representatives on the ground at the plant and would work to ensure there is a thorough investigation. David Masur, executive director of PennEnvironment, an environmental group that has sued U.S. Steel over pollution, said there needed to be “a full, independent investigation into the causes of this latest catastrophe and a re-evaluation as to whether the Clairton plant is fit to keep operating.” U.S. Steel CEO David B. Burritt said the company would investigate. It's not the first explosion at the plant. A maintenance worker was killed in a blast in September 2009. In July 2010, another explosion injured 14 employees and six contractors. According to online OSHA records of workplace fatalities, the last death at the plant was in 2014, when a worker was burned and died after falling into a trench. After the 2010 explosion, the Occupational Safety and Health Administration fined U.S. Steel and a subcontractor $175,000 for safety violations. U.S. Steel appealed its citations and fines, which were later reduced under a settlement agreement. In February, a problem with a battery at the plant led to a “buildup of combustible material” that ignited, causing an audible “boom,” officials said. Two workers received first aid treatment but were not seriously injured. The plant, a massive industrial facility along the Monongahela River, is considered the largest coking operation in North America and is one of four major U.S. Steel plants in Pennsylvania. The plant converts coal to coke, a key component in the steel-making process. To make coke, coal is baked in special ovens for hours at high temperatures to remove impurities that could otherwise weaken steel. The process creates what’s known as coke gas — made up of a lethal mix of methane, carbon dioxide and carbon monoxide. The county health department initially told residents within 1 mile (1.6 kilometers) of the plant to remain indoors and close all windows and doors, but lifted the advisory later Monday. It said its monitors didn't detect levels of soot or sulfur dioxide above federal standards. In June, U.S. Steel and Nippon Steel announced they had finalized a “historic partnership,” a deal that gives the U.S. government a say in some matters and comes a year and a half after the Japanese company first proposed its nearly $15 billion buyout of the iconic American steelmaker. The pursuit by Nippon Steel for the Pittsburgh-based company was buffeted by national security concerns and presidential politics in a premier battleground state, dragging out the transaction for more than a year after U.S. Steel shareholders approved it. ___ Levy reported from Harrisburg, Pennsylvania; Casey reported from Boston and Whittle reported from Portland, Maine. Associated Press reporters Holly Ramer in Concord, New Hampshire, Beatrice Dupuy in New York City and Audrey McAvoy in Honolulu contributed to this report. Before you consider Health Net, you'll want to hear this. MarketBeat keeps track of Wall Street's top-rated and best performing research analysts and the stocks they recommend to their clients on a daily basis. MarketBeat has identified the five stocks that top analysts are quietly whispering to their clients to buy now before the broader market catches on... and Health Net wasn't on the list. While Health Net currently has a Hold rating among analysts, top-rated analysts believe these five stocks are better buys. View The Five Stocks Here Explore Elon Musk’s boldest ventures yet—from AI and autonomy to space colonization—and find out how investors can ride the next wave of innovation."
