title,link,content
"US and China extend trade truce another 90 days, easing tension between world's largest economies",https://www.marketbeat.com/articles/us-and-china-extend-trade-truce-another-90-days-easing-tension-between-worlds-largest-economies-2025-08-11/,"WASHINGTON (AP) — President Donald Trump extended a trade truce with China for another 90 days Monday, at least delaying once again a dangerous showdown between the world’s two biggest economies. Trump posted on his Truth Social platform that he signed the executive order for the extension, and that “all other elements of the Agreement will remain the same.” Beijing at the same time also announced the extension of the tariff pause, according to the Ministry of Commerce. The previous deadline was set to expire at 12:01 a.m. Tuesday. Had that happened the U.S. could have ratcheted up taxes on Chinese imports from an already high 30%, and Beijing could have responded by raising retaliatory levies on U.S. exports to China. The pause buys time for the two countries to work out some of their differences, perhaps clearing the way for a summit later this year between Trump and Chinese President Xi Jinping, and it has been welcomed by the U.S. companies doing business with China. Sean Stein, president of the U.S.-China Business Council, said the extension is “critical” to give the two governments time to negotiate a trade agreement that U.S. businesses hope would improve their market access in China and provide the certainty needed for companies to make medium- and long-term plans. “Securing an agreement on fentanyl that leads to a reduction in U.S. tariffs and a rollback of China’s retaliatory measures is acutely needed to restart U.S. agriculture and energy exports,” Stein said. China said Tuesday it would extend relief to American companies who were placed on an export control list and an unreliable entities list. After Trump initially announced tariffs in April, China restricted exports of dual-use goods to some American companies, while banning others from trading or investing in China. The Ministry of Commerce said it would stop those restrictions for some companies, while giving others another 90-day extension. Reaching a pact with China remains unfinished business for Trump, who has already upended the global trading system by slapping double-digit taxes – tariffs – on almost every country on earth. The European Union, Japan and other trading partners agreed to lopsided trade deals with Trump, accepting once unthinkably U.S. high tariffs (15% on Japanese and EU imports, for instance) to ward off something worse. Trump’s trade policies have turned the United States from one of the most open economies in the world into a protectionist fortress. The average U.S. tariff has gone from around 2.5% at the start of the year to 18.6%, highest since 1933, according to the Budget Lab at Yale University. But China tested the limits of a U.S. trade policy built around using tariffs as a cudgel to beat concessions out of trading partners. Beijing had a cudgel of its own: cutting off or slowing access to its rare earths minerals and magnets – used in everything from electric vehicles to jet engines. In June, the two countries reached an agreement to ease tensions. The United States said it would pull back export restrictions on computer chip technology and ethane, a feedstock in petrochemical production. And China agreed to make it easier for U.S. firms to get access to rare earths. “The U.S. has realized it does not have the upper hand,’’ said Claire Reade, senior counsel at Arnold & Porter and former assistant U.S. trade representative for China affairs. In May, the U.S. and China had averted an economic catastrophe by reducing massive tariffs they'd slapped on each other’s products, which had reached as high as 145% against China and 125% against the U.S. Those triple-digit tariffs threatened to effectively end trade between the United States and China and caused a frightening sell-off in financial markets. In a May meeting in Geneva they agreed to back off and keep talking: America’s tariffs went back down to a still-high 30% and China’s to 10%. Having demonstrated their ability to hurt each other, they’ve been talking ever since. “By overestimating the ability of steep tariffs to induce economic concessions from China, the Trump administration has not only underscored the limits of unilateral U.S. leverage, but also given Beijing grounds for believing that it can indefinitely enjoy the upper hand in subsequent talks with Washington by threatening to curtail rare earth exports,'' said Ali Wyne, a specialist in U.S.-China relations at the International Crisis Group. ""The administration’s desire for a trade détente stems from the self-inflicted consequences of its earlier hubris.” It’s unclear whether Washington and Beijing can reach a grand bargain over America’s biggest grievances. Among these are lax Chinese protection of intellectual property rights and Beijing’s subsidies and other industrial policies that, the Americans say, give Chinese firms an unfair advantage in world markets and have contributed to a massive U.S. trade deficit with China of $262 billion last year. Reade doesn’t expect much beyond limited agreements such as the Chinese saying they will buy more American soybeans and promising to do more to stop the flow of chemicals used to make fentanyl and to allow the continued flow of rare-earth magnets. But the tougher issues will likely linger, and “the trade war will continue grinding ahead for years into the future,’’ said Jeff Moon, a former U.S. diplomat and trade official who now runs the China Moon Strategies consultancy. ___ Associated Press Staff Writers Josh Boak and Huizhong Wu contributed to this story. Before you make your next trade, you'll want to hear this. MarketBeat keeps track of Wall Street's top-rated and best performing research analysts and the stocks they recommend to their clients on a daily basis. Our team has identified the five stocks that top analysts are quietly whispering to their clients to buy now before the broader market catches on... and none of the big name stocks were on the list. They believe these five stocks are the five best companies for investors to buy now... See The Five Stocks Here Nuclear energy stocks are roaring. It's the hottest energy sector of the year. Cameco Corp, Paladin Energy, and BWX Technologies were all up more than 40% in 2024. The biggest market moves could still be ahead of us, and there are seven nuclear energy stocks that could rise much higher in the next several months.  To unlock these tickers, enter your email address below."
"Trump extends trade truce with China for another 90 days, delaying a showdown between the world’s two biggest economies",https://www.marketbeat.com/articles/trump-extends-trade-truce-with-china-for-another-90-days-delaying-a-showdown-between-the-worlds-two-biggest-economies-2025-08-11/,"WASHINGTON (AP) — Trump extends trade truce with China for another 90 days, delaying a showdown between the world’s two biggest economies. Before you make your next trade, you'll want to hear this. MarketBeat keeps track of Wall Street's top-rated and best performing research analysts and the stocks they recommend to their clients on a daily basis. Our team has identified the five stocks that top analysts are quietly whispering to their clients to buy now before the broader market catches on... and none of the big name stocks were on the list. They believe these five stocks are the five best companies for investors to buy now... See The Five Stocks Here Enter your email address and we'll send you MarketBeat's list of ten stocks that are set to soar in Fall 2025, despite the threat of tariffs and other economic uncertainty. These ten stocks are incredibly resilient and are likely to thrive in any economic environment."
"Inflation likely moved higher last month as tariffs bite, putting the Fed in bind",https://www.marketbeat.com/articles/inflation-likely-moved-higher-last-month-as-tariffs-bite-putting-the-fed-in-bind-2025-08-11/,"WASHINGTON (AP) — Inflation likely ticked up in July for the third straight month as tariffs lift the cost of imported goods such as furniture, appliances, and toys, which could make it harder for the Federal Reserve to cut short-term interest rates as President Donald Trump has demanded. Consumer prices are forecast to have risen 2.8% in July from a year earlier, according to a survey of economists by data provider FactSet. That annual pace would be up from 2.7% in June and a post-pandemic low of 2.3% in April. Excluding volatile food and energy costs, core inflation is expected to rise to 3%, from 2.9% in June. Both figures are well above the Fed's 2% price target. The potential increases, while modest, would put the Fed in a difficult spot: Hiring slowed sharply in the spring, after Trump announced a sweeping set of tariffs in April. The stalling out of job gains has boosted financial market expectations for an interest rate cut by the central bank. Yet Fed chair Jerome Powell has warned that worsening inflation could keep the Fed on the sidelines — a stance that has enraged Trump, who has defied traditional norms of central bank independence and demanded lower borrowing costs. Tuesday's data will also arrive at a highly-charged moment for the Labor Department's Bureau of Labor Statistics, which collects and publishes the inflation data. Trump fired Erika McEntarfer, then the head of BLS, after the Aug. 1 jobs report also showed sharply lower hiring for May and June than had previously been reported. The president posted on social media Monday that he has picked E.J. Antoni, an economist at the conservative Heritage Foundation and a frequent critic of the jobs report, to replace McEntarfer. “E.J. will ensure that the Numbers released are HONEST and ACCURATE,” Trump said on Truth Social. Adding to the BLS's turmoil is a government-wide hiring freeze that has forced it to cut back on the amount of data it collects for each inflation report, the agency has said. UBS economist Alan Detmeister estimates that BLS is now collecting about 18% fewer price quotes for the inflation report than it did a few months ago. He thinks the report will produce more volatile results, though averaged out over time, still reliable. On a monthly basis, prices are expected to rise modestly, increasing just 0.2% from June to July and core prices rising 0.3%. Gas prices likely fell in July and grocery costs are expected to barely increase, muting overall inflation. Signs of duties pushing up prices first emerged in the June inflation report released last month. Toy prices jumped 1.8% from May to June, after a 1.3% increase the previous month. Clothing prices rose 0.4% in June, while sporting goods leapt 1.8%. Meanwhile, the average tariff level has climbed from about 2% before Trump's inauguration to nearly 18%, the highest since the early 1930s, according to the Budget Lab at Yale. Most imports from the European Union and Japan now face duties of 15%, while goods from Taiwan pay 20% and Switzerland, 39%. Other trends are helping keep inflation from rising more quickly. Price increases for apartment rents, for example, are steadily cooling after sharp spikes during the pandemic era. And prices for new cars have declined slightly in recent months, even after Trump slapped 25% duties on autos and auto parts. So far, U.S. and overseas carmakers are paying the tariffs, though economists say they likely will pass them on to consumers soon. Car companies are also paying 50% import taxes on steel and aluminum and 30% on parts from China. Ford has said it paid $800 million in tariffs in the second quarter, while General Motors shouldered $1.1 billion. Stellantis, the world's fourth-largest carmaker and the maker of brands such as Chrysler, Dodge, and Jeep, has said it has paid $350 million in tariffs out of a $1.7 billion expected cost this year. Consumers are likely to absorb more costs beyond the auto industry in the coming months, as Trump has begun to finalize many tariffs. Once businesses know what they will be paying, they are more likely to pass those costs to consumers, economists say. Trump has insisted that overseas manufacturers will pay the tariffs by reducing their prices to offset the duties. Yet the pre-tariff prices of imports haven't fallen much since the levies were put in place. Economists at Goldman Sachs estimate that foreign manufacturers have absorbed just 14% of the duties through June, while 22% has been paid by consumers and 64% by U.S. companies. Based on previous patterns, however — such as Trump's 2018 duties on washing machines — the economists expect that by this fall consumers will bear 67% of the burden, while foreign exporters pay 25% and U.S. companies handle just 8%. Many large firms are still raising prices in response to the tariffs, including apparel makers Ralph Lauren and Under Armour, and eyewear company Warby Parker. Consumer products giant Procter & Gamble, maker of Crest toothpaste, Tide detergent and Charmin toilet paper, said late last month that it would lift prices on about a quarter of its products by mid-single-digit percentages. And cosmetics maker e.l.f. Beauty, which makes a majority of its products in China, said on Wednesday that it had raised prices by a dollar on its entire product assortment as of Aug. 1 because of tariff costs, the third price hike in its 21-year history. “We tend to lead and then we will see how many more kind of follow us,” CEO Tarang Amin said on an earnings call Wednesday. Matt Pavich, CEO of Revionics, a company that provides AI tools to large retailers to help them evaluate pricing decisions, says many companies are raising prices selectively to offset tariffs, rather than across the board. “Up until now we haven't seen a massive hit to consumers in retail prices,” Pavich said. “Now, they are going up, we've seen that.” ____ Associated Press Retail Writer Anne D'Innocenzio in New York contributed to this report. Before you make your next trade, you'll want to hear this. MarketBeat keeps track of Wall Street's top-rated and best performing research analysts and the stocks they recommend to their clients on a daily basis. Our team has identified the five stocks that top analysts are quietly whispering to their clients to buy now before the broader market catches on... and none of the big name stocks were on the list. They believe these five stocks are the five best companies for investors to buy now... See The Five Stocks Here Market downturns give many investors pause, and for good reason. Wondering how to offset this risk? Enter your email address to learn more about using beta to protect your portfolio."
"Trump nominates conservative economist to head agency that compiles jobs, inflation data",https://www.marketbeat.com/articles/trump-nominates-conservative-economist-to-head-agency-that-compiles-jobs-inflation-data-2025-08-11/,"WASHINGTON (AP) — President Donald Trump said Monday that he has nominated E.J. Antoni, chief economist at the conservative Heritage Foundation, to head the agency that compiles and publishes the nation's employment and inflation figures. “Our Economy is booming, and E.J. will ensure that the Numbers released are HONEST and ACCURATE,” Trump said on social media late Monday. Antoni, if approved by the Senate, would replace Erika McEntarfer, who was appointed commissioner of the Bureau of Labor Statistics by former President Joe Biden. Trump fired McEntarfer Aug. 1 after the July jobs report showed hiring slowed sharply this spring, with job gains in May and June revised much lower than initially estimated. Trump accused McEntarfer, without evidence, of rigging the jobs data for political reasons. The announcement comes one day before the BLS is scheduled to release the latest inflation data, for July. It is forecast to show that consumer prices rose for the third straight month as tariffs are pushing up the cost of many imported goods. Antoni has criticized the bureau's' collection and publication of the jobs data for years, particularly since the COVID-19 pandemic, after which the agency has frequently revised its initial jobs estimates lower. Many conservatives have argued that this potentially benefited Biden by producing a large initial monthly job gain, only to have it reduced in subsequent months. However, revisions — including downward revisions — are not unusual and occurred during the Trump administration as well. Overall hiring jumped after the pandemic and the unemployment rate stayed low even after the revisions. Antoni called for McEntarfer to be fired after the jobs report was released Aug. 1. Last Monday he wrote on X, “There are better ways to collect, process, and disseminate data — that is the task for the next BLS commissioner, and only consistent delivery of accurate data in a timely manner will rebuild the trust that has been lost over the last several years.” The BLS commissioner is the only political appointee at the agency, which is otherwise staffed by career civil servants. Most previous commissioners have been mild-mannered technocrats. Antoni, however, has been an unabashed partisan in his economic analyses posted on the Heritage website. For example, two months ago, in an analysis of the May jobs report, he wrote, “A deep dive into the report shows any weakness started long before the Trump administration, which is making undeniable progress reprivatizing the economy.” Antoni's nomination quickly attracted an unusual level of criticism. Jason Furman, a top economist in the Obama administration, wrote on X: “I don’t think I have ever publicly criticized any Presidential nominee before. But E.J. Antoni is completely unqualified to be BLS Commissioner. He is an extreme partisan and does not have any relevant expertise.” Kyle Pomeleau, a tax expert for the right-leaning Tax Foundation and the conservative American Enterprise Institute, wrote on X: “There are a lot of competent conservative economists that could do this job. E.J. is not one of them."" ___ Associated Press writer Josh Boak contributed to this report. Before you make your next trade, you'll want to hear this. MarketBeat keeps track of Wall Street's top-rated and best performing research analysts and the stocks they recommend to their clients on a daily basis. Our team has identified the five stocks that top analysts are quietly whispering to their clients to buy now before the broader market catches on... and none of the big name stocks were on the list. They believe these five stocks are the five best companies for investors to buy now... See The Five Stocks Here Unlock the timeless value of gold with our exclusive 2025 Gold Forecasting Report. Explore why gold remains the ultimate investment for safeguarding wealth against inflation, economic shifts, and global uncertainties. Whether you're planning for future generations or seeking a reliable asset in turbulent times, this report is your essential guide to making informed decisions."
"Business spat between Daryl Hall and John Oates has been resolved in arbitration, attorneys say",https://www.marketbeat.com/articles/business-spat-between-daryl-hall-and-john-oates-has-been-resolved-in-arbitration-attorneys-say-2025-08-11/,"NASHVILLE, Tenn. (AP) — Daryl Hall and John Oates have resolved their dispute over a Hall & Oates business partnership through arbitration, reaching a private ending after details of their rift went public in court documents filed in a 2023 lawsuit by Hall against Oates, according to a court filing Monday. In Monday's status report, attorneys for Hall noted the case received a final judgment in arbitration and they filed a proposed order for the judge, Nashville Chancellor Russell Perkins, to dismiss the case. In mid-July, Perkins ordered Hall's attorneys to offer an update in the case, which had last seen a public filing in December 2023. It's unclear when the arbitration process was finalized. And details were not revealed about the arbitration outcome between the duo who made music together for more than a half century, including hits in the 1970s and ’80s such as “Maneater,” “Rich Girl” “Kiss on My List” and “I Can’t Go for That (No Can Do).” Robb Harvey, an attorney for Hall, declined to comment. Representatives for Oates did not immediately respond to The Associated Press’ request for comment. In 2023 filings in the case, Hall accused Oates of blindsiding and betraying him, saying their relationship and his trust in Oates have deteriorated. Oates replied that he was “deeply hurt” that Hall was making “inflammatory, outlandish, and inaccurate statements” about him. The judge had paused the sale of Oates’ stake in Whole Oats Enterprises LLP to Primary Wave IP Investment Management LLC. Whole Oats includes valuable Hall & Oates materials such as trademarks, personal name and likeness rights, record royalty income and website and social media assets, a court declaration says. The dispute went public in November 2023, when Hall filed the lawsuit asking the judge to stop the sale by Oates so private arbitration could begin. Hall gave a scathing account of their relationship in early November 2023 during arbitration, and it was made public later in the month in the lawsuit. It alleges that Oates and his team engaged in the “ultimate partnership betrayal” by pushing to sell his share while telling Hall’s associates that he wanted to maintain his ownership. In his own declaration, Oates expressed disappointment with his longtime partner’s words, saying Hall’s accusations that Oates went behind his back and breached their agreement aren’t true. Oates declined to go into specifics, saying he’s obligated to keep details private, even if Hall didn’t. Last year, Oates told The Associated Press that he's had “no communication” with Hall and declined to discuss the legal proceedings. He did not see a Hall & Oates reunion in his future. “I personally don’t see it happening. It’s not in my plans at all. You can ask Daryl Hall what he thinks. But for me personally, no,” he says. The Times asked Hall in February if the ship had sailed on mending the pair's relationship. “That ship has gone to the bottom of the ocean,” Hall told the news outlet. “I’ve had a lot of surprises in my life, disappointments, betrayals, so I’m kind of used to it.” ___ Maria Sherman in New York contributed to this report. Before you make your next trade, you'll want to hear this. MarketBeat keeps track of Wall Street's top-rated and best performing research analysts and the stocks they recommend to their clients on a daily basis. Our team has identified the five stocks that top analysts are quietly whispering to their clients to buy now before the broader market catches on... and none of the big name stocks were on the list. They believe these five stocks are the five best companies for investors to buy now... See The Five Stocks Here Wondering what the next stocks will be that hit it big, with solid fundamentals? Enter your email address to see which stocks MarketBeat analysts could become the next blockbuster growth stocks."
