title,link,content
What US consumers can expect from new tariffs on imported goods,https://www.marketbeat.com/articles/what-us-consumers-can-expect-from-new-tariffs-on-imported-goods-2025-08-07/,"American businesses and consumers soon will have a better idea of how President Donald Trump's foreign trade agenda might affect them now that the United States has imposed higher tariffs on products from dozens of countries. It’s been nearly 100 years since the nation had an overall import tax rate as high as the one set Thursday. But the individual impact on business costs and consumer prices could vary as much as the tariffs applied to goods of nearly 70 U.S. trading partners, from complicated economies like the European Union to the small African nation of Lesotho. Exports from a majority of them are getting taxed at 15%. For a handful of countries in Asia, the rate is 19%. Products from the rest are subject to taxes of 20% to 50%. Meanwhile, a 55% tariff on Chinese-made goods is scheduled to take effect next week if a U.S.-China trade deal is not agreed on before then. Businesses in the U.S. and abroad have been dealing in various ways since February with Trump's fluctuating tariffs on specific products and countries. Many automakers appeared to have absorbed the costs for now. But recent government data indicated that retail prices for groceries, furniture and appliances started creeping up in June. Because tariffs are a tax on imports, economists have expected U.S. consumers to foot at least part of the bill eventually. The country-specific round enforced Thursday, together with the president's earlier tariffs on specific sectors such as automobiles and steel, will increase prices 1.8% in the short term, the Budget Lab at Yale estimated. That’s the equivalent of a $2,400 loss of income per U.S. household, according to the non-partisan policy research center The projections were based on an analysis of duties implemented this year through Wednesday, as well as a doubling of the levy on items made in India that Trump said would be implemented near the end of August. ""Retailers have been able to hold the line on pricing so far, but the new increased tariffs will significantly raise costs for U.S. retailers, manufacturers and consumers,” Jon Gold, vice president of supply chain and customs policy at the National Retail Federation trade group, said in an emailed statement to The Associated Press. Here’s what to know about the tariffs and where U.S. consumers are most likely to notice effects: Trump unveiled sweeping import taxes on goods coming into the U.S. from 66 countries, the European Union, Taiwan and the Falkland Islands in April. He said the “reciprocal” tariffs were meant to boost domestic manufacturing and restore fairness to global trade. The president paused the country-specific tariffs a week later but applied a 10% tax to most imports. In early July, he began notifying countries that their exports would be subject to higher tariffs on Aug. 1 unless they reached trade deals. A week ago, he pushed the start date to Thursday. In the meantime, Trump announced a 35% tariff on imports from Canada, but delayed action on Mexico while negotiations continued. However, a free trade agreement reached with Mexico and Canada during Trump's first term shields most of those countries' products from punishing duties. The president also ordered a 50% tariff on goods from Brazil. This week, he signed an executive order to take India's tariff rate from 25% to 50% for its purchases of Russian oil. The timing gives India and Russia a chance to negotiate with the Trump administration. Other duties not specific to countries remain in place, such as a 50% tariff on imported aluminum and steel announced in June. Trump also threatened 100% tariffs on computer chips that aren’t made in the U.S. The administration has said tariffs are still coming on imported pharmaceutical drugs. The U.S. Commerce Department reported on July 31 that prices rose 2.6% in June, up from an annual pace of 2.4% in May. Earlier in July, the government reported that its primary inflation measure, the Consumer Price Index, also ticked higher in June as the cost of furniture, toys and other frequently imported items increased. Shoppers should be prepared to pay more for clothes and shoes because the combined tariffs “disproportionately affect clothing and textiles,” according to the Budget Lab at Yale. It estimates that shoe prices will go up 39% temporarily and stay 19% above where they are now. For apparel, the Budget Lab put the comparable figures at 37% and 18%. Overall, Americans face an average tax of 18.6% for imported products, the highest rate since 1933, the research center said. The tariffs will almost certainly result in higher food prices, according to an analysis by the nonpartisan Tax Foundation. The U.S. simply doesn't make enough of some products, like bananas or coffee, to satisfy demand. Fish, beer and liquor are also likely to get more expensive, the foundation said. The U.S. Wine Trade Alliance and other alcohol industry trade groups sent a letter to Trump that warned a 15% tariff on European wines and spirits could result in more than 25,000 American job losses and cost the industry nearly $2 billion in lost sales. “Mr. President, we need toasts, not tariffs, as we head into the most important season for our industry,” read the letter dated Wednesday. Wine distributors and retailers avoided price increases before now by accelerating shipments from France and other EU countries earlier in the year. But with the EU's tariff rate raised to 15% on Thursday, customers may see European wines costing 30% more in September, U.S. Wine Trade Alliance President Ben Aneff said. Some automakers already raised prices to counteract tariffs. Luxury sports car maker Ferrari said last week it was waiting for more details of Trump's trade deal with the EU before scaling back a 10% surcharge it put on most vehicles in the U.S. For the most part, automakers waited for details instead of passing on tariff costs to consumers. But that could change. General Motors said on July 22 that the impact of the tariffs could get more pronounced in the third quarter of the year. GM has estimated the tariffs will cost it $4 billion to $5 billion this year. Toyota reported Thursday a 37% drop in profits in the April-June quarter, cutting its full-year earnings forecasts largely because of Trump’s tariffs. Even with so many new tariffs kicking in, the tariff situation remains fluid. Trump’s use of an emergency powers law to implement tariffs is being challenged in the courts. The case is expected to wind up before the U.S. Supreme Court. Moreover, the tariffs on goods from China haven't been finalized. Consumers may start seeing more effects when the administration ends a tax exemption for small parcels sent from other countries. Trump last week signed an order to suspend the “de minimis"" exemption that has allowed shipments valued at $800 or less to enter the U.S. duty-free. International e-commerce companies have widely used the rule to avoid paying customs charges. Trump withdrew the exemption in early April for goods shipped from China and Hong Kong tariff-free. It is now set to be eliminated for low-value packages from every country on Aug. 29. ___ AP reporter Colleen Barry in Milan contributed to this report. Before you make your next trade, you'll want to hear this. MarketBeat keeps track of Wall Street's top-rated and best performing research analysts and the stocks they recommend to their clients on a daily basis. Our team has identified the five stocks that top analysts are quietly whispering to their clients to buy now before the broader market catches on... and none of the big name stocks were on the list. They believe these five stocks are the five best companies for investors to buy now... See The Five Stocks Here Wondering what the next stocks will be that hit it big, with solid fundamentals? Enter your email address to see which stocks MarketBeat analysts could become the next blockbuster growth stocks."
"Paramount and Skydance close their $8 billion merger, kicking off reign of new entertainment giant",https://www.marketbeat.com/articles/paramount-and-skydance-close-their-8-billion-merger-kicking-off-reign-of-new-entertainment-giant-2025-08-07/,"NEW YORK (AP) — Skydance and Paramount officially closed their $8 billion merger on Thursday — kicking off the reign of a new entertainment giant after a contentious, over year-long endeavor to get the transaction over the finish line. The new company — which will trade under the “PSKY” ticker on Wall Street — brings Paramount's legacy Hollywood footprint, major TV networks like CBS and MTV, streaming services and more under the roof of a new power player: billionaire Skydance founder David Ellison. “Today marks an exciting and pivotal moment as we prepare to bring Paramount’s legacy as a Hollywood institution into the future of entertainment,"" Ellison, who is now Chairman and CEO of Paramount, a Skydance Corporation, said in a statement. He added that he aims to “honor exceptional storytelling while modernizing how we make and deliver content."" The merger's close came just two weeks after it received regulatory approval from the Trump administration. While now a done deal, the path towards that approval was far from smooth sailing. Months of scrutiny and turmoil surrounded the transaction — particularly amid President Donald Trump’s legal battle with “60 Minutes,” the crown jewel of Paramount-owned broadcast network CBS. With the specter of the Trump administration potentially blocking the hard-fought deal with Skydance, Paramount agreed to pay a $16 million settlement to the president in early July. Critics of the settlement lambasted it as a veiled bribe to appease Trump, amid rising alarm over editorial independence overall. Further outrage also emerged after CBS said it was canceling Stephen Colbert’s “Late Show” just days after the comedian sharply criticized the parent company’s settlement on air. Paramount cited financial reasons, but big names both within and outside the company have questioned those motives. When still seeking approval to buy Paramount from the Federal Communication Commission, Skydance management assured regulators that it would carefully watch for any perceived bias at CBS News and hire an ombudsman to review any complaints about fairness. In filings just last month, the company’s general counsel maintained that New Paramount will embody “a diversity of viewpoints across the political and ideological spectrum” — and also noted that it plans to take a “comprehensive review” of CBS to make “any necessary changes.” By the time the deal was approved, FCC Chairman Brendan Carr hailed the merger as an opportunity to bring more balance to “once-storied” CBS. “Americans no longer trust the legacy national news media to report fully, accurately, and fairly. It is time for a change,"" Carr said. Carr also pointed to other commitments from Skydance — including company assurances about ending diversity, equity and inclusion initiatives at Paramount. In a letter addressed to Carr days before the FCC's greenlight, Skydance wrote to “confirm the elimination” of DEI initiatives previously in place at Paramount — and maintained that Skydance “does not have DEI programs in place today and will not establish such initiatives.” Skydance pointed to the Supreme Court’s 2023 decision on affirmative action in college admissions, but such moves also arrive amid the Trump administration’s wider crackdown on DEI in the workplace — and the company cited recent federal mandates impacting employers, too, noting that Paramount announced “significant changes” to its recruiting and hiring practices in February 2025. The FCC approved the merger by a 2-1 vote on July 24. The regulator who opposed it, FCC Commissioner Anna Gomez, expressed disdain for how it all came together — pointing to “months of cowardly capitulation to this administration.” “In an unprecedented move, this once-independent FCC used its vast power to pressure Paramount to broker a private legal settlement and further erode press freedom,” Gomez, who was appointed by President Joe Biden, said in a statement. She also said the agency overstepped its authority by “undermining legitimate efforts to combat discrimination and expand opportunity.” Paramount's new leaders will be watched particularly closely for how they deal with CBS News, given the $16 million settlement with Trump following his complaint about last fall's “60 Minutes” interview with his Democratic opponent, then-Vice President Kamala Harris. And the merger could also have ripple effects across other Paramount properties, including its late night and comedy programming. When first announcing the deal in July 2024, Ellison also stressed the need to transition into a “tech hybrid” to stay competitive in today’s entertainment landscape. That included plans to “rebuild” the Paramount+ streaming service, among wider efforts to expand direct-to-consumer offerings in a world with more entertainment options and shorter attention spans. Before you consider Harris, you'll want to hear this. MarketBeat keeps track of Wall Street's top-rated and best performing research analysts and the stocks they recommend to their clients on a daily basis. MarketBeat has identified the five stocks that top analysts are quietly whispering to their clients to buy now before the broader market catches on... and Harris wasn't on the list. While Harris currently has a Hold rating among analysts, top-rated analysts believe these five stocks are better buys. View The Five Stocks Here Just getting into the stock market? These 10 simple stocks can help beginning investors build long-term wealth without knowing options, technicals, or other advanced strategies."
"OpenAI launches GPT-5, a potential barometer for whether AI hype is justified",https://www.marketbeat.com/articles/openai-releases-gpt-5-a-potential-barometer-for-whether-artificial-intelligence-hype-is-justified-2025-08-07/,"OpenAI on Thursday released the fifth generation of the artificial intelligence technology that powers ChatGPT, a product update that's being closely watched as a measure of whether generative AI is advancing rapidly or hitting a plateau. GPT-5 arrives more than two years after the March 2023 release of GPT-4, bookending a period of intense commercial investment, hype and worry over AI's capabilities. In anticipation, rival Anthropic released the latest version of its own chatbot, Claude, earlier in the week, part of a race with Google and other competitors in the U.S. and China to leapfrog each other on AI benchmarks. Meanwhile, longtime OpenAI partner Microsoft said it will incorporate GPT-5 into its own AI assistant, Copilot. Expectations are high for the newest version of OpenAI's flagship model because the San Francisco company has long positioned its technical advancements as a path toward artificial general intelligence, or AGI, a technology that is supposed to surpass humans at economically valuable work. It is also trying to raise huge amounts of money to get there, in part to pay for the costly computer chips and data centers needed to build and run the technology. OpenAI CEO Sam Altman described the new model as a “significant step along our path to AGI” but mostly focused on its usability to the 700 million people he says use ChatGPT each week. “It’s like talking to an expert — a legitimate PhD-level expert in anything, any area you need, on demand,” Altman said at a launch event livestreamed Thursday. It may take some time to see how people use the new model — now available, with usage limits, to anyone with a free ChatGPT account. The Thursday event focused heavily on ChatGPT's use in coding, an area where Anthropic is seen as a leader, and featured a guest appearance by the CEO of coding software maker Cursor, an important Anthropic customer. OpenAI's presenters also spent time talking about safety improvements to make the chatbot “less deceptive” and stop it from producing harmful responses to “cleverly worded” prompts that could bypass its guardrails. The Associated Press reported Wednesday on a study that showed ChatGPT was providing dangerous information about drugs and self-harm to researchers posing as teenagers. At a technical level, GPT-5 shows “modest but significant improvements” on the latest benchmarks, but when compared to GPT-4, it also looks very different and resets OpenAI's flagship technology in a way that could set the stage for future innovations, said John Thickstun, an assistant professor of computer science at Cornell University. “I’m not a believer that it's the end of work and that AI is just going to solve all humanity’s problems for it, but I do think there’s still a lot of headroom for them, and other people in this space, to continue to improve the technology,” he said. “Not just capitalizing on the gains that have already been made.” OpenAI started in 2015 as a nonprofit research laboratory to safely build AGI and has since incorporated a for-profit company with a valuation that has grown to $300 billion. The company has tried to change its structure since the nonprofit board ousted Altman in November 2023. He was reinstated days later. It has not yet reported making a profit but has run into hurdles escaping its nonprofit roots, including scrutiny from the attorneys general in California and Delaware, who have oversight of nonprofits, and a lawsuit by Elon Musk, an early donor to and founder of OpenAI who now runs his own AI company. Most recently, OpenAI has said it will turn its for-profit company into a public benefit corporation, which must balance the interests of shareholders and its mission. OpenAI is the world's third most valuable private company and a bellwether for the AI industry, with an “increasingly fragile moat” at the frontier of AI, according to banking giant JPMorgan Chase, which recently made a rare decision to cover the company despite it not being publicly traded. The inability of a single AI developer to have a “sustained competitive edge” could increasingly force companies to compete on lowering the prices of their AI products, the bank said in a report last month. —— The Associated Press and OpenAI have a licensing and technology agreement that allows OpenAI access to part of AP’s text archives. Before you make your next trade, you'll want to hear this. MarketBeat keeps track of Wall Street's top-rated and best performing research analysts and the stocks they recommend to their clients on a daily basis. Our team has identified the five stocks that top analysts are quietly whispering to their clients to buy now before the broader market catches on... and none of the big name stocks were on the list. They believe these five stocks are the five best companies for investors to buy now... See The Five Stocks Here Discover the top 7 AI stocks to invest in right now. This exclusive report highlights the companies leading the AI revolution and shaping the future of technology in 2025."
4 Semiconductor Stocks Earning Fresh Wall Street Upgrades,https://www.marketbeat.com/stock-ideas/4-semiconductor-stocks-earning-fresh-wall-street-upgrades/,"Over the past weeks, important players in the semiconductor industry have reported earnings, with several names putting Wall Street estimates to shame. This caused analysts to lift their price targets significantly. These updates hint that the semiconductor rally may still have legs, especially as end-market demand improves and long-term themes like AI and automation remain intact. Below, we highlight four companies whose recent earnings and revised analyst outlooks stand out. First up is semiconductor manufacturing equipment giant Lam Research NASDAQ: LRCX, which released earnings on July 30. The company posted big beats on both sales and adjusted earnings per share (EPS). However, shares still fell more than 4% afterward as worries remain around the company’s business in China. This didn’t deter Wall Street from issuing significant upgrades. MarketBeat tracked nearly ten analysts who lifted their targets on July 31 and Aug. 1. On average, these analysts increased their price targets by more than $10. Overall, the MarketBeat consensus price target on Lam is around $107, implying around 9% upside. However, the average target among those analysts who updated their forecasts is nearly $113. This figure indicates substantially more upside, suggesting shares could rise nearly 15%. TD Cowen is notably one of the stock’s biggest bulls. Their $125 target implies 27% upside potential in this chip equipment stalwart. Next is Impinj NASDAQ: PI. This company makes small chips and related devices that help track the movement of goods. This helps customers with things like inventory management and theft prevention. Impinj blew past expectations in Q2, causing shares to gain by a whopping 26% on July 31. MarketBeat also tracked several analysts who lifted their targets on the stock on July 31, doing so by an average of 30%. However, analysts seem to believe that the market has now priced in the stock’s gain. The MarketBeat consensus price target in Impinj is around $163, indicating shares are fairly valued. Still, Impinj has a key tailwind that could allow it to deliver significant upside longer-term: the European Union’s Digital Product Passport (DPP) law. The DPP legislation requires that every product sold or made in the region is trackable throughout its lifecycle. Impinj’s technology could help companies comply, especially in its number one market: textiles. The law starts applying to textiles in 2027, which could drive big-time sales for Impinj. Monolithic Power Systems NASDAQ: MPWR shined in Q2. The company delivered better-than-expected results on the top line, bottom line, and guidance. This led shares to surge more than 10% on Aug. 1. All but one analyst tracked by MarketBeat boosted their price target on the stock in August. Overall, these analysts increased their price targets by an average of $42. The average price target among those who issued updates comes in at $850, moderately higher than the stock’s $838 consensus target. The updated $850 target implies around 2.3% upside. However, opinions range widely. Wells Fargo’s $750 target suggests around 10% downside, while KeyCorp’s $950 target implies over 14% upside potential. Still, Monolithic has delivered far above the upside that Wall Street previously forecasted. On May 7, Wall Street only saw 14% upside in shares. However, since that point, the stock has provided a total return of nearly 31%. Additionally, MPWR has seen its shares rise after nine out of its last 12 earnings releases. It’s not crazy to think the company could continue to outperform Wall Street expectations. Electronic automation design software company Cadence Design Systems NASDAQ: CDNS has also seen a notable boost in sentiment. In Q2, the company beat expectations on sales, adjusted EPS, and raised its full-year guidance. This helped shares post a nearly 10% gain on July 29, and MarketBeat tracked several analysts who raised their price targets. The MarketBeat consensus target on Cadence is just $364, almost exactly equal to the stock’s closing price on Aug. 4. However, focusing on price targets updated after earnings changes the picture. The average target among those analysts is $389, implying nearly 7% upside. Although not groundbreaking, it is certainly a big improvement over the consensus forecast. Overall, these four names are clearly moving in the right direction. Their latest results showed that Wall Street underestimated them, and analysts are now scrambling to raise their price targets. While Monolithic’s track record of topping expectations stands out, the rest of the group is also showing signs of strength. Impinj has a long-term tailwind that could prove its recent rally is just the beginning. Lam’s weakness on earnings day may have been overdone. And Cadence is back on the radar after another solid beat. If these trends continue, analysts may still be playing catch-up. Before you consider Lam Research, you'll want to hear this. MarketBeat keeps track of Wall Street's top-rated and best performing research analysts and the stocks they recommend to their clients on a daily basis. MarketBeat has identified the five stocks that top analysts are quietly whispering to their clients to buy now before the broader market catches on... and Lam Research wasn't on the list. While Lam Research currently has a Moderate Buy rating among analysts, top-rated analysts believe these five stocks are better buys. View The Five Stocks Here Wondering where to start (or end) with AI stocks? These 10 simple stocks can help investors build long-term wealth as artificial intelligence continues to grow into the future."
