title,link,content
Can Celsius Stock Keep Its Momentum Going Any Longer?,https://www.marketbeat.com/originals/can-celsius-stock-keep-its-momentum-going-any-longer/,"Following a recent rally of 20.5%, shares of Celsius Holdings Inc. NASDAQ: CELH are gaining popularity again, especially as the stock reaches 90% of its 52-week high and shows enough momentum to potentially push investors toward a new peak for the year. However, there is one major speed bump standing in the way of today’s price and that higher promise. That earnings uncertainty acts as a speed bump for the company’s quarter, as Celsius stock has fallen about 5% in a week just before the upcoming release on August 7, 2025. This behavior can usually be perceived in two different ways, and the first, being the most common, is that the market is expecting some disappointing results from Celsius. The other side to this coin is that the price is now low enough to have priced in some of these bearish expectations, creating a much better risk-to-reward ratio and probability setup for those willing to buy the dip and keep riding on the company’s momentum, which has seemed unstoppable over the past year. Here are some reasons Celsius might make it out okay after earnings. Wall Street analysts rarely give their ratings and valuation targets right before a stock announces quarterly earnings, which is why investors should see the upcoming wave of upgrades in late July 2025 as a sign of confidence heading into the results. While the consensus rating for Celsius stock stands at a Moderate Buy, along with a price target of $47.8 per share, a few analysts were willing to break the mold. Filippo Falorni sees a Buy rating and a $55 per share valuation on Celsius to call for 31% upside potential from today’s prices. Falorni wasn’t alone in this, as Andrea Teixeira from JPMorgan Chase & Co. followed suit with her Overweight view and $54 per share target price, roughly in line with Citigroup’s view. Overall, it seems that the potential range to be had on Celsius hovers between $54 and $57 per share, giving investors a shot at not only double-digit upside but also new 52-week highs. If the company can deliver on this, it shouldn’t be surprising to see some institutional buyers step in as well, since most of them use a momentum strategy supported by the right fundamental story. However, while that part of the picture is still uncertain, there is some additional evidence to consider about Celsius beforehand. Over the past month, 13.8% of Celsius stock’s short interest was wiped out of the picture in a clear sign of bearish capitulation. More than that, there is still $976.6 million worth of open short positions. If the stock can deliver a decent quarter and break through to these Wall Street targets, chances are those may be closed out, too. Closing a short position indirectly adds more buying pressure to a stock since it involves buying back the stock short sellers borrowed to sell in the first place. Now, other fundamental factors are at play here that could very well push Celsius toward those new highs. First, Wall Street analysts are set on a forecast for $0.24 in earnings per share (EPS) for the third quarter of 2025, a jump of 33.3% from today’s reported 18 cents in EPS. Knowing that EPS growth is the typical driver behind a stock’s upside, this view matches perfectly with the percentage upside expected from valuation targets. Looking at the last quarterly earnings, there is one clear theme that investors should keep in mind and look for in the upcoming quarterly announcement. Celsius reported a 1.15% increase in its gross margin despite a 7% decline in revenue, and the reason why is all that matters. As the brand and company expand into more international markets, its economies of scale allow it to spread costs across different operations and thus make it more efficient. Considering the bulk of revenue contraction occurred in the United States, possibly due to spreading tariff fears in the consumer discretionary sector, this should already be factored in. Moving forward, a more confident consumer in the United States could push that revenue figure for North America higher, building on top of the 41% revenue growth seen in the international segment. With all these tailwinds in mind, backing the expected upside and EPS growth, there is one last factor to consider here. Markets are now willing to pay up to 132.6x in a price-to-earnings (P/E) ratio for Celsius stock, a long way above the rest of the industry’s 18.1x average. The market’s pricing mechanism is always willing to place a premium on those companies that can outgrow their peers and the broader S&P 500, and this time, Celsius justifies that premium. Before you consider Celsius, you'll want to hear this. MarketBeat keeps track of Wall Street's top-rated and best performing research analysts and the stocks they recommend to their clients on a daily basis. MarketBeat has identified the five stocks that top analysts are quietly whispering to their clients to buy now before the broader market catches on... and Celsius wasn't on the list. While Celsius currently has a Moderate Buy rating among analysts, top-rated analysts believe these five stocks are better buys. View The Five Stocks Here Nuclear energy stocks are roaring. It's the hottest energy sector of the year. Cameco Corp, Paladin Energy, and BWX Technologies were all up more than 40% in 2024. The biggest market moves could still be ahead of us, and there are seven nuclear energy stocks that could rise much higher in the next several months.  To unlock these tickers, enter your email address below."
BC-Nikkei 225 Futures,https://www.marketbeat.com/articles/bc-nikkei-225-futures-2025-08-04/,"NEW YORK (AP) — Prices as of 5:30:00 PM Wednesday, August 06. Nikkei 225 (Yen) (CME) 500 yen x Nikkei 225 YEN futures price. Estimated volume: 14,597 Tuesday's volume: 14,597 Open Interest: 82,751 Open Interest Change: -51616 Before you make your next trade, you'll want to hear this. MarketBeat keeps track of Wall Street's top-rated and best performing research analysts and the stocks they recommend to their clients on a daily basis. Our team has identified the five stocks that top analysts are quietly whispering to their clients to buy now before the broader market catches on... and none of the big name stocks were on the list. They believe these five stocks are the five best companies for investors to buy now... See The Five Stocks Here Thinking about investing in Meta, Roblox, or Unity? Enter your email to learn what streetwise investors need to know about the metaverse and public markets before making an investment."
BC-Select Stock Indices,https://www.marketbeat.com/articles/bc-select-stock-indices-2025-08-04/,
"Trump says he plans to put a 100% tariff on computer chips, likely increasing costs of electronics",https://www.marketbeat.com/articles/trump-says-he-plans-to-put-a-100-tariff-on-computer-chips-likely-increasing-costs-of-electronics-2025-08-06/,"WASHINGTON (AP) — Trump says he plans to put a 100% tariff on computer chips, likely increasing costs of electronics. Before you make your next trade, you'll want to hear this. MarketBeat keeps track of Wall Street's top-rated and best performing research analysts and the stocks they recommend to their clients on a daily basis. Our team has identified the five stocks that top analysts are quietly whispering to their clients to buy now before the broader market catches on... and none of the big name stocks were on the list. They believe these five stocks are the five best companies for investors to buy now... See The Five Stocks Here Discover the 10 Best High-Yield Dividend Stocks for 2025 and secure reliable income in uncertain markets. Download the report now to identify top dividend payers and avoid common yield traps."
Disney’s Iger-Led Turnaround Gains Traction,https://www.marketbeat.com/originals/disneys-iger-led-turnaround-gains-traction/,"The Walt Disney Company NYSE: DIS faces headwinds in 2025, as do most businesses, but the Q2 results reveal the enduring strength of the brand and the impact of Bob Iger’s return. While revenue headwinds persist for this entertainment company, the company continues to grow, and profitability is improving. The critical detail is that profitability improved across key operating metrics, driving a significant bottom-line outperformance despite the tepid top-line. The takeaway for investors is that this company has regained its lost leverage, is well-positioned for an economic rebound, and the capital return outlook is rapidly improving. Disney’s stock price action declined following the FQ3 release, setting it up to rally as the calendar quarter progresses. The move took the market to a critical support level that aligns with prior resistance and key moving averages, and support appears to be present. The market may consolidate at this level, but assuming no new low is set, a new high is likely to occur soon. The moving averages have formed a Golden Crossover, indicating a shift in market dynamics from a less-bullish to a more-bullish posture, which is a signal to buy.  Disney didn’t have an easy time in Q2, but its diversified business model and refocus on quality are paying off. The $23.65 billion in net revenue is up 2.1% compared to last year, with strength in Entertainment and Experiences offsetting Sports. Entertainment grew by only 1%, led by an 8% increase in Experiences and offset by a 5% decline in Sports. Within the Entertainment segment, DTC and licensing are the standouts, while in Experiences, the domestic parks led the strength. The only bad news is that the analysts had been expecting a little more. The margin news is also mixed, with one segment contracting and the others expanding. The net result is that EBIT grew by 4%, segment operating income by 8%, adjusted earnings by 16%, cash from operations by 41%, and free cash flow by 51%, with adjusted earnings outpacing the consensus by nearly 1200 basis points. The guidance echoes the clear sign of strength, which is why this stock is a buy in Q3. Given the underlying strengths, the company raised its full-year profit targets to a range above the consensus and may exceed the target. The focus on streaming and sports is a reason to bet on Disney’s long-term stock price recovery. The company is integrating Hulu and Disney+, making it a more attractive and comprehensive streaming solution, and rationalizing its ESPS networks. ESPN's focus includes acquiring the NFL’s media assets and integrating them into the streaming portfolio. Bob Iger’s impact on the business is visible in the balance sheet. Highlights include reduced cash, which is balanced by steady assets, decreased debt and total liabilities, and a 7% rise in equity. The increase in equity is especially significant considering the share buybacks, which lowered the share count by 1.2%, effectively using cash while increasing shareholder value. The buybacks and dividend payments are expected to continue steadily through the end of the year and into next year. The dividend remains reliable at less than 20% of forecasted earnings and is expected to rise in 2026. The analyst and institutions are bullish on Disney’s turnaround and capital return. The 24 analysts tracked by MarketBeat rate the stock as Moderate Buy with bullish bias, see it advancing to a multiyear high in 2025, and the institutions are buying on balance. The institutional activity provides a strong tailwind for the market, owning 66% of the stock and buying at a two-to-one pace in Q3. Before you consider Walt Disney, you'll want to hear this. MarketBeat keeps track of Wall Street's top-rated and best performing research analysts and the stocks they recommend to their clients on a daily basis. MarketBeat has identified the five stocks that top analysts are quietly whispering to their clients to buy now before the broader market catches on... and Walt Disney wasn't on the list. While Walt Disney currently has a Moderate Buy rating among analysts, top-rated analysts believe these five stocks are better buys. View The Five Stocks Here Discover the next wave of investment opportunities with our report, 7 Stocks That Will Be Magnificent in 2025. Explore companies poised to replicate the growth, innovation, and value creation of the tech giants dominating today's markets."
FDA flags problems with two Boston Scientific heart devices tied to injuries and deaths,https://www.marketbeat.com/articles/fda-flags-problems-with-two-boston-scientific-heart-devices-tied-to-injuries-and-deaths-2025-08-06/,"WASHINGTON (AP) — U.S. health regulators are warning doctors and patients about safety issues with two separate Boston Scientific heart devices recently linked to injuries and deaths. The Food and Drug Administration issued two alerts Wednesday about electrical problems tied to the company's heart-zapping defibrillator systems and a separate issue with a heart implant used to reduce stroke risk. The agency said some of the company's Endotak Reliance defibrillator wires can become calcified, leading to failures in delivering life-saving shocks to the heart, according to the FDA. Defibrillators are surgically placed in the upper chest, where they monitor irregular heartbeats and use electrical shocks to jolt the heart back to normal. As of July 24, Boston Scientific has reported 386 serious injuries and 16 deaths associated with this issue, the agency said. Ten of the deaths were judged to be due to the device failing to function properly, the company said in an email. Four were linked to attempts to surgically remove the devices from patients and two others were deemed unrelated to the implants. Boston Scientific's wires were distributed between 2002 and 2021 and are no longer available, the company noted in its letter to doctors. Some patients will need to have the devices replaced, though physicians should weigh the risks of the removal procedure. In a separate notice, the FDA said Boston Scientific recently updated instructions for implanting its Watchman device, which closes a portion of the heart's left atrium to reduce the risk of stroke. In a letter to physicians, the company noted that there is an increased risk of blockages in the bloodstream depending on the level of anesthesia for patients undergoing the initial implantation procedure. Watchman is an alternative to long-term treatment with blood thinners for patients at increased risk of stroke. As of July 30, the company has reported 120 serious injuries and 17 deaths related to the issue, the FDA said. A company investigation concluded that the safety issue “is not associated with the design or manufacture of any component of the Watchman system. Heart devices, including defibrillators and other implants, are Boston Scientific’s largest business, making up two-thirds of its $5 billion in revenue for the most recent quarter. Shares of Boston Scientific Corp. fell nearly 1.8 percent Wednesday to close at $102.95 in trading. ___ The Associated Press Health and Science Department receives support from the Howard Hughes Medical Institute’s Department of Science Education and the Robert Wood Johnson Foundation. The AP is solely responsible for all content. Before you make your next trade, you'll want to hear this. MarketBeat keeps track of Wall Street's top-rated and best performing research analysts and the stocks they recommend to their clients on a daily basis. Our team has identified the five stocks that top analysts are quietly whispering to their clients to buy now before the broader market catches on... and none of the big name stocks were on the list. They believe these five stocks are the five best companies for investors to buy now... See The Five Stocks Here Discover the top 7 AI stocks to invest in right now. This exclusive report highlights the companies leading the AI revolution and shaping the future of technology in 2025."
"Joby Deal Gives Blade New Direction, But Stock Lacks Lift",https://www.marketbeat.com/originals/joby-deal-gives-blade-new-direction-but-stock-lacks-lift/,"It’s been quite the week for Blade Air Mobility Inc. NASDAQ: BLDE. On August 4, Blade and Joby Aviation Inc. NYSE: JOBY announced the sale of Blade’s passenger mobility business to Joby for up to $125 million. That sent BLDE stock soaring 30%. Blade will become a pure-play medical logistics company and change its name to Strata Critical Medical. However, the stock has given up most of those gains after the company delivered a mixed earnings report. Although it beat on the top line, it delivered negative earnings per share of five cents, which was a penny worse than the negative four cents analysts were expecting. The earnings report is a reminder that Blade has tremendous potential and serves a critical niche among business services stocks. However, the company is not yet profitable, and it may take some time for it to realize the economic benefits from the Joby deal. Blade Air Mobility operates as two divisions: Medical and Blade Passenger. The medical division is primarily comprised of its MediMobility Organ Transport business. The company is the largest dedicated air transporter of human organs for transplant in the United States. As of this quarter’s earnings, nearly 60% of the company’s revenue and 84% of its EBITDA (earnings before interest, taxes, depreciation, and amortization) came from its medical division. In the quarter, Blade posted 18% year-over-year (YOY) revenue growth from the medical division. This contrasts with the combined 8% YOY revenue decline in its short-distance and Jets business in the passenger division. The company’s earnings report was heavily focused on the impact of the Joby deal on Blade’s business. Management was bullish on the outlook, citing an expectation for “continued attractive organic growth over the coming years.” The company also said it plans to pursue strategic acquisitions with the expected $200 million of cash on hand, pro forma for selling its passenger business. In short, investors can expect a leaner company with more predictable cash flows, focused on non-emergency medical transport (NEMT), organ transfer, and time-critical healthcare logistics. As the company’s quarterly results bear out, this is a less volatile space compared to urban air travel. The sale of Blade’s passenger business to Joby is for “up to” $125 million. That’s because the sale will be paid entirely in Joby stock. On the company’s earnings call, Blade’s management didn’t express concern over Joby’s ability to deliver. That said, a deal based on a stock-based structure opens the possibility that Joby’s share price could impact Blade's final payout. This risk is somewhat amplified because Blade's chief executive officer (CEO), Rob Wiesenthal, remarked that the deal will close in the first half of 2026. That’s not an unusual timeline for a deal involving regulatory approvals. However, it does extend the runway for stock price volatility, particularly for a pre-revenue aviation startup like Joby. What Blade might be (i.e., a profitable, asset-light medical mobility company) is enticing. The company estimates the organ logistics market to be an addressable market worth about $1 billion, of which Blade already controls about 30%. But that’s not where the company is today. It’s also not what attracted some initial investors to the company. Those investors were attracted to the opportunity in air mobility. While the resulting company may offer stability and near-term profits, the upside will likely be capped. Until its passenger business is sold, investors should expect BLDE stock to reflect cautious optimism at best. However, it's likely to be choppy as traders look for opportunities for short-term gains. Investors with a lower risk tolerance may want to wait until the deal is closer to completion before deciding on BLDE stock. However, risk-tolerant investors may want to start building a position and scale in as the final details of the deal emerge. Before you consider Blade Air Mobility, you'll want to hear this. MarketBeat keeps track of Wall Street's top-rated and best performing research analysts and the stocks they recommend to their clients on a daily basis. MarketBeat has identified the five stocks that top analysts are quietly whispering to their clients to buy now before the broader market catches on... and Blade Air Mobility wasn't on the list. While Blade Air Mobility currently has a Buy rating among analysts, top-rated analysts believe these five stocks are better buys. View The Five Stocks Here Discover the top 7 AI stocks to invest in right now. This exclusive report highlights the companies leading the AI revolution and shaping the future of technology in 2025."
Trump once hailed mRNA vaccines as a 'medical miracle.' Now RFK Jr. is halting advancement,https://www.marketbeat.com/articles/trump-once-hailed-mrna-vaccines-as-a-medical-miracle-now-rfk-jr-is-halting-advancement-2025-08-06/,"WASHINGTON (AP) — President Donald Trump hailed as a “medical miracle” the mRNA vaccines developed to combat the deadly COVID-19 pandemic in 2020. Now, his health secretary Robert F. Kennedy Jr., is effectively halting the vaccine technology’s advancement. Kennedy announced Tuesday that the federal government is canceling $500 million worth of mRNA research development contracts, putting an end to U.S.-backed hopes for the vaccine technology to prevent future pandemics, treat cancer or prevent flu infections. It's a sharp pivot from how Trump and top officials described the technology during his first term. Here's a look at what Trump and some of his closest advisers have said about mRNA vaccines that were credited with slowing the pandemic five years ago. “A COVID-19 vaccine is the thing that will get Americans back to normal everyday life,” said Redfield, in a Sept. 16, 2020, statement. Americans were still donning face masks as one of the few ways of protecting themselves from a virus that had killed nearly 200,000 in just over six months. Redfield promised that the new vaccines — developed for the first time using mRNA technology — would offer a return to normalcy. “Don’t let Joe Biden take credit for the vaccines ... because the vaccines were me, and I pushed people harder than they’ve ever been pushed before .. The vaccines are — there are those that say it’s one of the greatest things. It’s a medical miracle.” Trump said on Nov. 26, 2020, during a news conference in the White House. Weeks earlier, Trump had lost the election in a bitter race against Democrat Joe Biden. As the Republican grappled with leaving Washington and continued to plan for the rollout of the COVID-19 vaccines, he reminded reporters that he oversaw the development of the new shots. “They say it’s somewhat of a miracle and I think that’s true,” Trump said on Dec. 8, 2020, during a speech at the Eisenhower Executive Office Building. The event celebrated “Operation Warp Speed,"" the government-funded project that accelerated vaccine development with pharmaceutical companies. Trump was promoting the shots as the government prepared to offer them to frontline health workers. “It's clear that many Americans are learning these vaccines are safe and extraordinarily effective,” Azar said on Dec. 16, 2020, at a news conference. The government was shipping out mRNA vaccines to states, preparing to distributed it to the masses. Azar noted that a vast majority of Americans — between 70% to 80%, according to polls — intended to get the new COVID-19 vaccine that would be available to the public in the coming months. “It takes somewhere between five and 10 years to put a vaccine on the street. Look what we did. Now, that’s because of the great work of the scientists who had done the research on mRNA vaccines and others because of industry working on this, they just didn’t wake up one day and start working on it,” Perna said during a podcast interview that aired on May 9, 2023. Reflecting in an interview about his time overseeing “Operation Warp Speed,” Perna credited the mRNA technology with the government's ability to get shots in arms mere months after the pandemic started claiming lives in the U.S. in 2020. “Take credit because we saved tens of millions of lives. Take credit. Don’t let them take that away from you,” Trump said on Dec. 19, 2021 during a live interview with former Fox News host Bill O’Reilly. Daily COVID-19 deaths had ticked down to 1,500 compared to 3,000 from a year earlier after Americans began receiving their first doses of the mRNA vaccines. Trump revealed to O’Reilly and the audience that he had just gotten a COVID-19 booster. The crowd booed. Before you make your next trade, you'll want to hear this. MarketBeat keeps track of Wall Street's top-rated and best performing research analysts and the stocks they recommend to their clients on a daily basis. Our team has identified the five stocks that top analysts are quietly whispering to their clients to buy now before the broader market catches on... and none of the big name stocks were on the list. They believe these five stocks are the five best companies for investors to buy now... See The Five Stocks Here Discover the top 7 AI stocks to invest in right now. This exclusive report highlights the companies leading the AI revolution and shaping the future of technology in 2025."
