title,link,content
Navigating Solar Headwinds: 3 Stocks Built to Last,https://www.marketbeat.com/stock-ideas/navigating-solar-headwinds-3-stocks-built-to-last/,"The One Big Beautiful Bill (OBBB) Act is now law, and with it come several new rules and rollbacks that could weaken the clean energy industry in the U.S. While the bill's primary focus has been tax cut extensions, the legislation also eliminates many incentives for solar power, especially those in residential areas. However, while the bill remains a net negative for solar power companies, the Senate version has removed some of the more onerous provisions, and the industry may not be facing the death knell some executives feared. Today, we’ll look at which regulations did and didn’t make the OBBB Act’s final cut, and examine three stocks that can still thrive despite the new solar headwinds. Under the 2022 Inflation Reduction Act (IRA), the investment tax credit (ITC) and production tax credit (PTC) for solar systems were extended by a decade, fueling the growth of solar energy adoption in both residential and commercial areas. However, the OBBB Act marks a swift reversal of many of these policies, including the abrupt cancellation of a crucial residential credit. Here are some of the noteworthy provisions for the solar industry: The Senate version of the OBBB Act, eventually signed into law, removed some of the stricter regulations against the solar sector, including an excise tax on imported modules, the most stringent timelines for commercial projects, and the cancellation of tax credit transferability. It still doesn’t bode well for solar as a whole, but these three companies should still be able to thrive in this environment. In stocks, there’s often safety in size, and NextEra Energy Inc. NYSE: NEE is one of the largest diversified clean energy companies in the U.S. No one produces more solar or wind capacity than NextEra (33,000 megawatts of operating energy in 2023), and its substantial output and focus on large-scale projects should help it navigate a less friendly regulatory environment. NEE shares look affordable based on historical data, and even more so when using forward projections. The stock trades at 27.5 times earnings, a tick below the 10-year average P/E of 29.1. However, the 12-month forward P/E ratio stands at 20.3, and this is expected to decrease to 18.8 by the end of 2026 and 17.2 by 2027. After a negative 2023, EPS growth rebounded 26% in 2024, with smaller but still significant projections of 7.2% for 2025 and 8% for 2026. The company missed revenue expectations in its Q1 2025 earnings report, but sales still grew 9% year-over-year (YOY), and EPS numbers matched analyst expectations. The average analyst price target of $84.55 still indicates upside potential of nearly 14% as well. First Solar Inc. NASDAQ: FSLR specializes in manufacturing solar modules and operates some of the world’s largest photovoltaic power plants. Despite the sudden solar phaseouts, First Solar’s focus on producing its modules and plants in the U.S. could give it a competitive edge in this new energy environment. First Solar’s thin-film cadmium telluride modules can be manufactured with 100% domestic components, freeing the company from tariff pressure and FEOC restrictions. Despite the bill’s harsh implications, this domestic dominance is partly why Royal Bank of Canada increased its price target from $188 to $200 this week. Of the 31 analysts covering the stock, 26 now have Buy ratings with an average price target of $228.69, implying an upside from current levels. Nextracker Inc. NASDAQ: NXT sold nearly $3 billion worth of solar trackers in the last 12 months. Trackers are devices that pair with solar panels to track the sun across the sky, much like a sunflower. They optimize solar efficiency by keeping panels perfectly aligned for maximum sunlight exposure. Solar trackers are primarily used in large utility-scale projects, which offer Nextracker some protection from the phase-outs of the solar tax credit. The stock also appears attractive compared to other solar companies, thanks to its affordable valuation and strong margins. NXT trades at just 19 times earnings, and it boosted net profit margins to 17.21% in the most recent quarter. The $679 million quarterly revenue also represented a 15% YOY increase, showing the company can grow while protecting its margins. Before you consider NextEra Energy, you'll want to hear this. MarketBeat keeps track of Wall Street's top-rated and best performing research analysts and the stocks they recommend to their clients on a daily basis. MarketBeat has identified the five stocks that top analysts are quietly whispering to their clients to buy now before the broader market catches on... and NextEra Energy wasn't on the list. While NextEra Energy currently has a Moderate Buy rating among analysts, top-rated analysts believe these five stocks are better buys. View The Five Stocks Here Wondering where to start (or end) with AI stocks? These 10 simple stocks can help investors build long-term wealth as artificial intelligence continues to grow into the future."
A Georgia election with few voters: Turnout is 'miserably low' in the race for utility regulator,https://www.marketbeat.com/articles/a-georgia-election-with-few-voters-turnout-is-miserably-low-in-the-race-for-utility-regulator-2025-07-09/,"ATLANTA (AP) — Every time the door swings open this week at the county courthouse in the tiny south Georgia town of Statenville, six election workers have a moment to hope that someone is coming to vote. “Anybody that comes in pretty much has to walk by our office,"" said Renee Church, the elections supervisor in Echols County. But through noon on Wednesday, none of those passersby had voted in the runoff to choose either Peter Hubbard or Keisha Waites as the Democratic nominee for a seat on Georgia’s Public Service Commission. Welcome to a statewide election where almost nobody came. Through the first two of five days of early in-person voting, only 9,822 ballots were accepted. That's 0.13% of active voters, what Gabriel Sterling, the chief operating officer for Georgia Secretary of State Brad Raffensperger, called “miserably low turnout.” Early in-person voting runs through Friday, with the election day set for Tuesday. Anyone can vote, except for the more than 63,000 people who voted in Republican primaries on June 17 including one in which incumbent Tim Echols beat GOP challenger Lee Muns. Waites was the top vote-getter in a June 17 Democratic primary, but didn't get a majority. That meant she had to face the second-place finisher, Hubbard, in a runoff to determine the party nominee. Barring an upswell in voter numbers, fewer than 1% of Georgia's 7.4 million active voters could cast ballots. The winner will go on to face Republican incumbent Fitz Johnson in November. Despite the low turnout, Hubbard and Waites continue to push, telling voters that breaking the Republican hold on the five-member body will mean a difference in their electric bills. The commission sets rates and oversees generation plans for Georgia Power, which serves 2.3 million customers statewide. Customers have seen bills rise six times in recent years, and a typical Georgia Power residential customer now pays more than $175 a month, including taxes. “If you don’t like the direction your power bills are going, then you have a choice. You could do something about it,” Hubbard said Wednesday. A green energy advocate, Hubbard touts his experience testifying before the commission and developing alternative plans that emphasize a shift toward solar power stored in batteries, rather than building more natural gas plants. “A vote for Peter Hubbard is a vote to put a commissioner on the Public Service Commission who brings deep experience, who can hit the ground running with novel ideas to drive down power prices while inviting economic growth to our state,” he said. Waites, a former state House member and former Atlanta City Council member, emphasizes that she would give representation to Black people and Democrats on the commission. In a statement Wednesday, Waites said her previous experience in office would help her “work with utility companies, legislators, and stakeholders to secure fair rates.” “I plan to lower energy bills by advocating for increased transparency in utility rate-setting, promoting competition within the energy sector, and prioritizing clean, renewable energy sources to reduce dependence on fossil fuels,” Waites said in the statement. It’s not like the low turnout is a surprise. Only about 140,000 people cast ballots in the June 17 Democratic primary, about 2% of voters statewide. Many Republican-leaning counties had less than 1% turnout in the Democratic primary, allowing them to activate a rarely used state law to consolidate early-voting and election day polling places to one location. A total of 76 counties triggered that clause to save money, according to the secretary of state’s office. Officials in Walton County, east of Atlanta, predict they would have spent $42,000 to operate three early voting locations and 16 election day precincts. Cutting back to only one of each, Assistant Elections Director Lisa Clark said the runoff will now cost $5,600 in a county where only 21 of nearly 79,000 active voters had cast ballots through Tuesday. “When it comes to public service commissioner, people don’t even know what a public service commissioner is or what they do,"" Clark said. ""So we were not surprised. We were hopeful it would have been bigger, but we were not surprised.” Echols isn't the only one of Georgia's 159 counties without voters in the early going. Also recording no ballots in the first two days were Chattahoochee, Clay, Glascock, Miller and Telfair counties, while seven other counties recorded one vote. But Brittany Reynolds, the election supervisor in southwest Georgia's Clay County, said Wednesday that turnout will rise there. “I do know we will have at least one vote at the end of the day because I plan on voting myself,"" Reynolds said. Before you make your next trade, you'll want to hear this. MarketBeat keeps track of Wall Street's top-rated and best performing research analysts and the stocks they recommend to their clients on a daily basis. Our team has identified the five stocks that top analysts are quietly whispering to their clients to buy now before the broader market catches on... and none of the big name stocks were on the list. They believe these five stocks are the five best companies for investors to buy now... See The Five Stocks Here Discover the 10 Best High-Yield Dividend Stocks for 2025 and secure reliable income in uncertain markets. Download the report now to identify top dividend payers and avoid common yield traps."
What flood insurance does and does not cover,https://www.marketbeat.com/articles/what-flood-insurance-does-and-does-not-cover-2025-07-09/,"SEATTLE (AP) — Though natural disasters cycle across seasons and regions in the U.S., it’s often a shocking discovery for property owners how expansive and expensive flood and water damage can be when a major storm devastates their homes, businesses and communities. That’s because oftentimes insurance doesn’t cover what the policyholder thinks it does — or thinks it should. The disappointing surprise is that while the standard home insurance policy does cover fire and wind damage, even good property insurance typically doesn’t cover things like flooding and earthquakes, which usually require a special and separate policy for each. Here are the things to know about flood insurance. Most people who have flood insurance are required to have it. Although many property owners have the option of purchasing flood insurance, it is mandated for government-backed mortgages that sit in areas that the Federal Emergency Management Agency deems highest risk. Many banks require it in high-risk zones, too. But most private insurance companies don’t carry flood insurance, leaving the National Flood Insurance Program run by FEMA as the primary provider. Congress created the federal flood insurance program more than 50 years ago when many private insurers stopped offering policies in high-risk areas. FEMA’s Flood Map Service Center has an online tool to check your area. FEMA notes even a 1% chance of flooding is considered high risk because it amounts to a 1-in-4 chance of flooding over the life of a 30-year mortgage. Homeowners in high-risk areas who should have it sometimes decide not to get it. Someone who pays off their mortgage can drop their flood insurance once it’s not required. Or if they purchase a house or mobile home with cash, they may not opt for it at all. The rest of us are just rolling the dice, even though experts have long warned that flooding can happen just about anywhere because flood damage isn’t just water surging and seeping into the land — it’s also water from banks, as well as mudflow and torrential rains. Mark Friedlander, spokesman for the Insurance Information Institute, an industry group, said only about 6% of U.S. households have a flood policy — primarily in the coastal areas prone to hurricanes. That rate has remained steady in recent years despite the increasing frequency of severe flooding events, including in areas that are not formally considered by the government to be high risk. “Lack of flood coverage is the largest insurance gap across the country,” Friedlander said in an email. “Ninety percent of U.S. natural disasters involve flooding and flooding can occur just about anywhere it rains.” Even if a homeowner does have flood insurance, the coverage may not be enough to make a policyholder whole again. FEMA’s National Flood Insurance Program only covers up to $250,000 for single-family homes and $100,000 for contents. Renters can get up to $100,000 for contents, and commercial flood insurance will cover up to $500,000. There are concerns that such flooding coverage limits are not robust enough, especially at a time when climate change is making strong hurricanes even stronger and making storms in general wetter, slower and more prone to intensifying rapidly. And what typically happens to the people without flood insurance in a major storm is that they can try to recover some money from their standard home insurance but may end up in a fight to determine what damage is or isn’t wind versus rain, or even “wind-driven rain.” Don Hornstein, an insurance law expert at the University of North Carolina, said the line between wind and water is a thin but very clear line that technical experts can determine. Should there be a proverbial tie, the law favors the insurance company. “If the house was simultaneously destroyed by flood and, concurrently (by) wind, it’s not covered by private insurance,” Hornstein said. Before you make your next trade, you'll want to hear this. MarketBeat keeps track of Wall Street's top-rated and best performing research analysts and the stocks they recommend to their clients on a daily basis. Our team has identified the five stocks that top analysts are quietly whispering to their clients to buy now before the broader market catches on... and none of the big name stocks were on the list. They believe these five stocks are the five best companies for investors to buy now... See The Five Stocks Here Discover the top 7 AI stocks to invest in right now. This exclusive report highlights the companies leading the AI revolution and shaping the future of technology in 2025."
Senate confirms new FAA administrator at a time of rising concern about air safety,https://www.marketbeat.com/articles/senate-confirms-new-faa-administrator-at-a-time-of-rising-concern-about-air-safety-2025-07-09/,"WASHINGTON (AP) — The U.S. Senate on Wednesday confirmed Bryan Bedford to lead the Federal Aviation Administration, putting him in charge of the federal agency at a precarious time for the airline industry after recent accidents, including the January collision near Washington, D.C. that killed 67 people. Bedford was confirmed on a near party-line vote, 53-43. Republicans and industry leaders lauded President Donald Trump's choice of Bedford, citing his experience as CEO of regional airline Republic Airways since 1999. Sen. Ted Cruz, the chairman of the Senate Commerce Committee, called Bedford a “steady leader with executive experience.” But Democrats and flight safety advocates opposed his nomination, citing Bedford's lack of commitment to the 1,500-hour training requirement for pilots that was put in place by Congress after a 2009 plane crash in New York. Bedford declined during his confirmation hearing to commit to upholding a rule requiring 1,500 hours of training for pilots, saying only that he would not “have anything that will reduce safety.” Sen. Maria Cantwell, the top Democrat on the Commerce panel, accused Bedford of wanting “to roll back safety reforms and unravel the regulatory framework that made the United States the gold standard” in aviation safety. Congress implemented the 1,500-hour rule for pilot training and other safety precautions after the 2009 Colgan Air crash near Buffalo, New York. In that flight, the pilot had not been trained on how to recover from a stall in the aircraft. His actions caused the plane carrying 49 people to fall from the sky and crash into a house, where another man was killed. Families of the victims of the Colgan crash pushed for the stricter training requirements and remain vocal advocates for airline safety. They joined Senate Democratic leader Chuck Schumer at a press conference at the U.S. Capitol to express concern about Bedford’s nomination. Marilyn Kausner, the mother of a passenger on the 3407 flight, said she and other families requested a meeting with Transportation Secretary Sean Duffy after Bedford's confirmation hearing. Her husband, she said, was “discouraged” after hearing what Bedford had to say at his hearing. Pilot Chesley “Sully” Sullenberger, made famous for safely landing a plane in the Hudson River, also opposed Trump's pick, posting on social media that “with the nomination of Bryan Bedford to be FAA Administrator, my life’s work could be undone.” Republican Sen. Todd Young, who is also on the committee, called the 1,500-hour rule an “emotional topic” but maintained that Bedford’s approach to safety is clearly “analytical,” prioritizing what “we ascertain leads to the best safety for passengers.” “All you have to do is look at his credentials and his testimony to be persuaded that he’s the right person for the job,” Young said. Bedford has support from much of the industry. The air traffic controllers union noted his commitment to modernize the outdated system. Airlines for America, a trade association for major airlines, called Bedford a “superb choice.” And United Airlines CEO Scott Kirby said, having worked with Bedford, he had “total confidence in his ability to lead the FAA.” Before you make your next trade, you'll want to hear this. MarketBeat keeps track of Wall Street's top-rated and best performing research analysts and the stocks they recommend to their clients on a daily basis. Our team has identified the five stocks that top analysts are quietly whispering to their clients to buy now before the broader market catches on... and none of the big name stocks were on the list. They believe these five stocks are the five best companies for investors to buy now... See The Five Stocks Here Enter your email address and we'll send you MarketBeat's list of ten stocks that are set to soar in Summer 2025, despite the threat of tariffs and other economic uncertainty. These ten stocks are incredibly resilient and are likely to thrive in any economic environment."
BC-OILS,https://www.marketbeat.com/articles/bc-oils-2025-07-07/,Get analyst upgrade alerts:Sign Up
BC-Gold-Silver,https://www.marketbeat.com/articles/bc-gold-silver-2025-07-07/,Get earnings alerts:Sign Up
Autodesk Stock Ready to Rip? Q3 May Be the Turning Point,https://www.marketbeat.com/originals/autodesk-stock-ready-to-rip-q3-may-be-the-turning-point/,"Autodesk NASDAQ: ADSK can hit new highs in Q3 due to its cloud shift, AI adoption, and strong financial performance. The company persistently outperforms its consensus figures and provides favorable guidance, a recipe for positive sentiment trends that drive market action. In this case, the trends include steady analyst coverage with a relatively high number, 23, covering he stock, firming sentiment and a rising price target. The sentiment is pegged at Moderate Buy in early Q3, with revisions leading to the Strong Buy range and a significant price increase for the stock. The consensus in early July is for an 8% gain, sufficient for a new all-time high, with the most recent revisions leading to the high-end range, another 10% upside when reached. The long-term outlook for Autodesk is robust and aligns with the outlook for higher share prices. The company is forecasted to grow revenue at a slowing pace but to sustain a modest double-digit CAGR through the middle of the next decade. The top-line growth pace will be exceeded by earnings growth, and both the top- and bottom-line forecasts are likely to be light. Autodesk has outperformed its consensus more than 90% of the time and showed signs of accelerating in the latest report. Revenue grew by 15% compared to only 11% in the prior quarter and year, underpinned by client wins and penetration gains. Autodesk’s price action is at a critical resistance and potential pivot point in early Q2 2025. The market for this tech stock has moved up to retest resistance, aligning with the highs set in 2021, just below the all-time high, and may soon move above them. A move to fresh highs would signal a crucial market shift and open the door to a more sustainable rally. The market may experience turbulence at its all-time high in this scenario, but it is unlikely to correct significantly.  Autodesk had a strong Q1, setting it up for a strong year. The critical detail is that strength in all segments, product lines, and geographies reflects little to no impact from macroeconomic headwinds. The takeaway is that the consensus outlook for F2026, robust as it is, likely underestimates the company’s performance by a wide margin. As it stands, the consensus is for Q2 revenue to grow by only 14%, compared to the 15% gain in Q1; however, revisions are leading to a high-end range and may continue to boost the consensus until the results are released in late August. The balance sheet highlights at the end of Q1 didn’t reflect improvement so much as stability and strength. The cash position was up, but reduced receivables offset that. Current and total assets and liabilities were flat, leaving equity flat compared to last year. Leverage is low, with long-term net debt less than 1x equity, and cash flow allows for modest share repurchases. Repurchases reduced the count by roughly 0.5% year over year in F2025 and matched the pace in FQ1 2026, providing some leverage for shareholders. The most significant risk for investors is insider selling. Executives have been selling all year, but the headwind they present is minimal; they own only 0.15% of the stock, while institutions pose a bigger threat. Institutions, which own about 90% of the stock, bought on balance in the first half of the year but began selling in Q2. The mitigating factor is that the initial reports for Q3 show significant buying activity in the quarter’s first week, suggesting a tailwind for price action that can help lift the stock price in the back half of 2025. Before you consider Autodesk, you'll want to hear this. MarketBeat keeps track of Wall Street's top-rated and best performing research analysts and the stocks they recommend to their clients on a daily basis. MarketBeat has identified the five stocks that top analysts are quietly whispering to their clients to buy now before the broader market catches on... and Autodesk wasn't on the list. While Autodesk currently has a Moderate Buy rating among analysts, top-rated analysts believe these five stocks are better buys. View The Five Stocks Here Discover the top 7 AI stocks to invest in right now. This exclusive report highlights the companies leading the AI revolution and shaping the future of technology in 2025."
