title,link,content
"Endurance Technologies, AU Small Finance stocks among top losers on Nifty Midcap 150",https://www.moneycontrol.com/news/business/stocks/endurance-technologies-au-small-finance-stocks-among-top-losers-on-nifty-midcap-150-alpha-article-13510605.html,"Endurance Technologies, AU Small Finance, and Motilal Oswal shares were among the top losers on the Nifty Midcap 150 index at 10:00 am on Tuesday. Endurance Techn's stock declined by 2.64% to Rs 2,862.20. AU Small Financ's stock fell by 2.04% to Rs 706.85. Motilal Oswal's stock decreased by 2.03% to Rs 877.20. Max Healthcare's stock slipped by 1.3% to Rs 1,165.80, while Sundaram Fin's stock went down by 1.23% to Rs 4,394.10. Endurance Technologies Limited informed the exchange on August 26, 2025, about newspaper advertisements published in the Financial Express (English) and the Loksatta (Marathi) regarding public notice under the Investor Education and Protection Fund Authority's ""Saksham Niveshak"" campaign. The company also announced capacity addition for anti-lock braking system, disc brake systems, and brake discs on August 19, 2025. Multiple investor meets were scheduled for September 2, 2025, from 10:00 am to 4:30 pm. Endurance Technologies Financials: The consolidated quarterly financials reveal the following trends:HeadingJun 2024Sep 2024Dec 2024Mar 2025Jun 2025RevenueRs 2,825.50 CroreRs 2,912.66 CroreRs 2,859.16 CroreRs 2,963.49 CroreRs 3,318.89 CroreNet ProfitRs 203.86 CroreRs 202.98 CroreRs 184.39 CroreRs 245.13 CroreRs 226.35 CroreEPS14.4914.4313.1117.4316.09The revenue for the quarter ending in June 2025 was Rs 3,318.89 Crore, which is an increase compared to the Rs 2,825.50 Crore in June 2024. Similarly, the net profit for June 2025 was Rs 226.35 Crore, up from Rs 203.86 Crore in June 2024. The EPS also increased from 14.49 to 16.09 during the same period. Endurance Technologies Yearly Data:Heading20212022202320242025RevenueRs 6,547.02 CroreRs 7,549.14 CroreRs 8,804.05 CroreRs 10,240.87 CroreRs 11,560.81 CroreNet ProfitRs 519.57 CroreRs 460.71 CroreRs 479.58 CroreRs 680.49 CroreRs 836.35 CroreEPS36.9532.7534.0948.3859.46BVPS253.24278.68313.67353.86406.46ROE14.5811.7510.8613.6714.62Debt to Equity0.120.100.110.150.16The company’s annual revenue has shown consistent growth, increasing from Rs 6,547.02 Crore in 2021 to Rs 11,560.81 Crore in 2025. Net profit also increased significantly from Rs 519.57 Crore in 2021 to Rs 836.35 Crore in 2025. Similarly, EPS has risen from 36.95 to 59.46 over the same period. The cash flow statement indicates that the net cash flow increased from -Rs 112 Crore in 2021 to Rs 514 Crore in 2025. AU Small Finance Bank announced an investor presentation on September 1, 2025, following an earlier intimation regarding analyst/institutional investor meets. The bank also allotted 2,46,428 equity shares on August 28, 2025, pursuant to the exercise of employee stock options. AU Small Finance Bank Financials: The consolidated yearly financials are as follows:Heading20212022202320242025RevenueNANANANANANet ProfitRs 1,171 CroreRs 1,130 CroreRs 1,428 CroreRs 1,535 CroreRs 2,106 CroreEPS38.1936.0621.8622.9828.32BVPS200.99238.62164.64187.69230.57ROE18.6515.0313.0012.2112.26NIMNANANANANAMotilal Oswal Financial Services Limited announced its participation in Analysts' and Investors' Meetings/Conferences. SEBI imposed a penalty of Rs 11 Lakh on the company regarding operational/procedural activities. The company also acquired 7,54,97,341 Compulsorily Convertible Preference Shares of Zepto Private Limited. Motilal Oswal Financials: The consolidated quarterly financials are as follows:HeadingJun 2024Sep 2024Dec 2024Mar 2025Jun 2025RevenueRs 2,312.34 CroreRs 2,837.83 CroreRs 1,998.63 CroreRs 1,190.26 CroreRs 2,737.03 CroreNet ProfitRs 883.58 CroreRs 1,121.80 CroreRs 566.00 CroreRs -63.19 CroreRs 1,155.84 CroreEPS14.7818.749.43-1.0819.39Shares of Endurance Techn, AU Small Financ, and Motilal Oswal experienced declines, contributing to their position among the top losers on the Nifty Midcap 150 index."
"Phoenix Mills shares surge 4.51%, among top gainers on Nifty Midcap 150",https://www.moneycontrol.com/news/business/stocks/phoenix-mills-shares-surge-4-51-among-top-gainers-on-nifty-midcap-150-alpha-article-13510611.html,"Phoenix Mills' stock is trading as one of the top gainers on the Nifty Midcap 150 index, with a significant rise of 4.51%. At 10:00 am, the stock was priced at Rs 1,585.50. Other top gainers on the Nifty Midcap 150 include Sun TV Network, Apollo Tyres, MRF, and Godrej Prop, showcasing a positive trend in the midcap segment.Phoenix Mills: Financial OverviewHere is a summary of Phoenix Mills' financial performance based on consolidated figures:Income Statement (Quarterly)HeadingJun 2024Sep 2024Dec 2024Mar 2025Jun 2025RevenueRs 904.14 CroreRs 917.97 CroreRs 975.13 CroreRs 1,016.34 CroreRs 952.99 CroreNet ProfitRs 313.44 CroreRs 290.64 CroreRs 350.93 CroreRs 346.51 CroreRs 319.92 CroreEPS13.018.177.417.526.73The company's revenue for the quarter-ending March 2025 was Rs 1,016.34 Crore, which decreased to Rs 952.99 Crore for the quarter-ending June 2025. The net profit for the quarter-ending March 2025 was Rs 346.51 Crore, which declined to Rs 319.92 Crore for the quarter-ending June 2025.Income Statement (Yearly)Heading20212022202320242025RevenueRs 1,073.29 CroreRs 1,483.48 CroreRs 2,638.35 CroreRs 3,977.69 CroreRs 3,813.57 CroreNet ProfitRs 33.90 CroreRs 247.99 CroreRs 1,472.50 CroreRs 1,326.32 CroreRs 1,301.53 CroreEPS3.2013.3174.7661.3627.53BVPS360.96504.78620.13693.21292.24ROE1.073.6015.9311.629.42Debt to Equity0.750.600.510.490.45The annual revenue saw a decrease from Rs 3,977.69 Crore in 2024 to Rs 3,813.57 Crore in 2025. Similarly, the net profit decreased from Rs 1,326.32 Crore in 2024 to Rs 1,301.53 Crore in 2025. The company’s Debt to Equity ratio has been consistently decreasing, from 0.75 in 2021 to 0.45 in 2025.Annual Income StatementMar 2025Mar 2024Mar 2023Mar 2022Mar 2021SalesRs 3,813 CroreRs 3,977 CroreRs 2,638 CroreRs 1,483 CroreRs 1,073 CroreOther IncomeRs 150 CroreRs 132 CroreRs 116 CroreRs 74 CroreRs 92 CroreTotal IncomeRs 3,964 CroreRs 4,109 CroreRs 2,754 CroreRs 1,557 CroreRs 1,165 CroreTotal ExpenditureRs 1,966 CroreRs 2,071 CroreRs 742 CroreRs 935 CroreRs 788 CroreEBITRs 1,998 CroreRs 2,038 CroreRs 2,012 CroreRs 622 CroreRs 377 CroreInterestRs 403 CroreRs 395 CroreRs 341 CroreRs 294 CroreRs 347 CroreTaxRs 293 CroreRs 316 CroreRs 198 CroreRs 80 CroreRs -4 CroreNet ProfitRs 1,301 CroreRs 1,326 CroreRs 1,472 CroreRs 247 CroreRs 33 CroreQuarterly Income StatementJun 2025Mar 2025Dec 2024Sep 2024Jun 2024SalesRs 952 CroreRs 1,016 CroreRs 975 CroreRs 917 CroreRs 904 CroreOther IncomeRs 31 CroreRs 45 CroreRs 30 CroreRs 37 CroreRs 38 CroreTotal IncomeRs 984 CroreRs 1,061 CroreRs 1,005 CroreRs 955 CroreRs 942 CroreTotal ExpenditureRs 482 CroreRs 549 CroreRs 487 CroreRs 477 CroreRs 451 CroreEBITRs 502 CroreRs 511 CroreRs 517 CroreRs 477 CroreRs 491 CroreInterestRs 95 CroreRs 94 CroreRs 102 CroreRs 103 CroreRs 103 CroreTaxRs 87 CroreRs 71 CroreRs 64 CroreRs 83 CroreRs 74 CroreNet ProfitRs 319 CroreRs 346 CroreRs 350 CroreRs 290 CroreRs 313 CroreCash FlowMar 2025Mar 2024Mar 2023Mar 2022Mar 2021Operating ActivitiesRs 2,083 CroreRs 2,161 CroreRs 1,356 CroreRs 780 CroreRs 436 CroreInvesting ActivitiesRs -2,162 CroreRs -1,859 CroreRs -1,536 CroreRs -2,841 CroreRs -954 CroreFinancing ActivitiesRs -47 CroreRs -299 CroreRs 136 CroreRs 2,227 CroreRs 521 CroreOthersRs 0 CroreRs 0 CroreRs 8 CroreRs 0 CroreRs 0 CroreNet Cash FlowRs -125 CroreRs 3 CroreRs -35 CroreRs 166 CroreRs 3 CroreBalance SheetMar 2025Mar 2024Mar 2023Mar 2022Mar 2021Share CapitalRs 71 CroreRs 35 CroreRs 35 CroreRs 35 CroreRs 34 CroreReserves & SurplusRs 10,376 CroreRs 9,421 CroreRs 8,344 CroreRs 6,546 CroreRs 4,850 CroreCurrent LiabilitiesRs 2,368 CroreRs 2,245 CroreRs 2,578 CroreRs 2,041 CroreRs 2,064 CroreOther LiabilitiesRs 8,715 CroreRs 7,580 CroreRs 6,630 CroreRs 5,710 CroreRs 4,505 CroreTotal LiabilitiesRs 21,531 CroreRs 19,283 CroreRs 17,589 CroreRs 14,334 CroreRs 11,455 CroreFixed AssetsRs 17,017 CroreRs 14,020 CroreRs 12,641 CroreRs 9,250 CroreRs 8,175 CroreCurrent AssetsRs 2,696 CroreRs 3,387 CroreRs 3,466 CroreRs 3,817 CroreRs 2,017 CroreOther AssetsRs 1,817 CroreRs 1,875 CroreRs 1,481 CroreRs 1,266 CroreRs 1,262 CroreTotal AssetsRs 21,531 CroreRs 19,283 CroreRs 17,589 CroreRs 14,334 CroreRs 11,455 CroreContingent LiabilitiesRs 0 CroreRs 695 CroreRs 891 CroreRs 1,083 CroreRs 690 CroreKey Financial RatiosRatioMar 2025Mar 2024Mar 2023Mar 2022Mar 2021Basic EPS (Rs.)49.0226.0920.5512.68-7.48Diluted Eps (Rs.)49.0126.0820.5512.67-7.48Book Value [Excl. Reval Reserve]/Share (Rs.)574.82370.50334.05312.02299.33Dividend/Share (Rs.)0.000.000.000.000.00Face Value55555Gross Profit Margin (%)42.4238.5045.9248.9830.69Operating Margin (%)40.9237.0344.8547.8128.14Net Profit Margin (%)30.6223.6929.3629.55-9.59Return on Networth / Equity (%)8.087.256.164.06-2.27ROCE (%)9.288.6410.848.912.27Return On Assets (%)2.522.022.471.97-1.16Current Ratio (X)1.511.431.461.881.93Quick Ratio (X)0.540.430.591.181.22Debt to Equity (x)0.731.070.690.600.54Interest Coverage Ratios (X)12.027.685.945.341.16Asset Turnover Ratio (%)0.110.100.060.094.70Inventory Turnover Ratio (X)0.170.000.000.000.163 Yr CAGR Sales (%)64.2499.21-3.95-19.52-36.373 Yr CAGR Net Profit (%)67.21213.1335.7150.15-43.39P/E (x)43.4488.1650.17131.88-188.07P/B (x)3.706.403.095.364.71EV/EBITDA (x)34.2461.5731.9756.28183.06P/S (x)13.0221.0612.7225.4751.17Corporate ActionsPhoenix Mills announced several corporate actions. Key highlights include:Bonus Issues:On July 31, 2024, a bonus ratio of 1:1 was announced, with a record date of September 21, 2024, and an ex-bonus date of September 20, 2024.A prior bonus issue on September 1, 2005, had a bonus ratio of 4:1, with a record date of December 16, 2005, and an ex-bonus date of December 9, 2005.Splits:A split was announced on December 19, 2007, changing the face value from Rs 10 to Rs 2, effective February 13, 2008, with a record date of February 20, 2008.Another split occurred on September 1, 2005, reducing the face value from Rs 100 to Rs 10, with a record date of December 16, 2005, and an ex-split date of December 9, 2005.Dividends:The company announced a final dividend of Rs 5.00 per share (250%) on May 17, 2024, effective August 20, 2024.The company has also made several announcements under Regulation 30 (LODR), including updates on acquisitions and analyst/investor meets. Phoenix Mills is trading as one of the top gainers on the Nifty Midcap 150 at Rs 1,585.50, with a rise of 4.51% at 10:00 am."
Godrej Properties shares rise 2.12% in morning trade,https://www.moneycontrol.com/news/business/stocks/godrej-properties-shares-rise-2-12-in-morning-trade-alpha-article-13510613.html,"Shares of Godrej Properties gained 2.12% to trade at Rs 1,993.60 in Tuesday's session. The stock is a constituent of the Nifty Midcap 150 index. On the financial front, Godrej Properties has demonstrated substantial growth in both quarterly and annual results. The consolidated revenue for the quarter-ending June 2025 stood at Rs 434.56 Crore, while the net profit was Rs 625.59 Crore, resulting in an EPS of Rs 19.92. The company's annual performance also shows significant improvements. For the year-ending March 2025, the consolidated revenue reached Rs 4,922.84 Crore, a notable increase compared to Rs 3,035.62 Crore in March 2024. The net profit soared to Rs 1,507.83 Crore, up from Rs 719.32 Crore in the previous year, with the EPS rising to Rs 49.02 from Rs 26.09. Key financial metrics for Godrej Properties show a mix of growth and stability. The company's revenue has increased steadily over the past five years, with a substantial rise in net profit. The debt-to-equity ratio stood at 0.73 as of March 2025. The following table summarizes the key financial data for Godrej Properties:Financial YearRevenue (Rs Crore)Net Profit (Rs Crore)EPSBVPSROEDebt to Equity2021Rs 764.92 Crore-Rs 73.36 Crore-Rs 7.48Rs 299.33-2.270.542022Rs 1,824.88 CroreRs 539.28 CroreRs 12.68Rs 312.024.060.602023Rs 2,252.26 CroreRs 661.33 CroreRs 20.55Rs 334.056.160.692024Rs 3,035.62 CroreRs 719.32 CroreRs 26.09Rs 370.507.251.072025Rs 4,922.84 CroreRs 1,507.83 CroreRs 49.02Rs 574.828.080.73Godrej Properties announced several corporate actions, including analyst/investor meets and press releases. On August 25, 2025, the company informed the exchange regarding a press release. The company had a split in the past where Old FV was Rs 10 and New FV was Rs 5. The ex-split date was November 21, 2013 and record date was November 22, 2013. With the stock's last traded price at Rs 1,993.60, Godrej Properties has seen a rise of 2.12% in Tuesday's session."
Ashok Leyland shares rise 2.53% on Nifty Midcap 150,https://www.moneycontrol.com/news/business/stocks/ashok-leyland-shares-rise-2-53-on-nifty-midcap-150-alpha-article-13510615.html,"Shares of Ashok Leyland rose by 2.53% to Rs 131.27 in Tuesday's trading session. The stock is a constituent of the Nifty Midcap 150 index. Financial Performance: Consolidated Quarterly Performance: The company's consolidated quarterly revenue and net profit are as follows:HeadingJun 2024Sep 2024Dec 2024Mar 2025Jun 2025RevenueRs 10,724.49 CroreRs 11,147.58 CroreRs 11,995.21 CroreRs 14,695.55 CroreRs 11,708.54 CroreNet ProfitRs 549.53 CroreRs 755.21 CroreRs 812.09 CroreRs 1,234.38 CroreRs 652.98 CroreEPS1.732.402.593.851.04The revenue for the quarter ending June 2025 was Rs 11,708.54 Crore, an increase compared to Rs 10,724.49 Crore for the quarter ending June 2024. The net profit for the quarter ending June 2025 was Rs 652.98 Crore, compared to Rs 549.53 Crore for the quarter ending June 2024. Consolidated Yearly Performance: The company's consolidated yearly revenue, net profit, EPS, BVPS, and ROE are as follows:Heading20212022202320242025RevenueRs 19,454.10 CroreRs 26,237.15 CroreRs 41,672.60 CroreRs 45,790.64 CroreRs 48,535.14 CroreNet ProfitRs -69.10 CroreRs -292.97 CroreRs 1,350.91 CroreRs 2,679.96 CroreRs 3,351.21 CroreEPS-0.56-1.224.238.4610.58BVPS31.1029.2636.7840.2341.66ROE-2.10-4.9014.5027.5825.39Debt to Equity2.313.283.614.514.06The revenue for the year ending March 2025 was Rs 48,535.14 Crore, an increase compared to Rs 45,790.64 Crore for the year ending March 2024. The net profit for the year ending March 2025 was Rs 3,351.21 Crore, compared to Rs 2,679.96 Crore for the year ending March 2024. Cash Flow:HeadingMar 2025Mar 2024Mar 2023Mar 2022Mar 2021Operating Activities128-6,257-4,4992,844-1,065Investing Activities-5,7581,135-2,934-1,916-991Financing Activities6,9578,4317,280-3771,330Others0031018Net Cash Flow1,3273,308-122549-707Balance Sheet:HeadingMar 2025Mar 2024Mar 2023Mar 2022Mar 2021Share Capital293293293293293Reserves & Surplus11,9388,7108,2176,9687,568Current Liabilities26,55126,67922,45418,61516,223Other Liabilities42,93131,97623,76217,72217,981Total Liabilities81,71467,66054,72843,60042,066Fixed Assets8,0787,3747,2217,1027,578Current Assets34,24029,12624,24318,61415,918Other Assets39,39631,15923,26317,88318,569Total Assets81,71467,66054,72843,60042,066Contingent Liabilities476940756917864Key Ratios:RatioMar 2021Mar 2022Mar 2023Mar 2024Mar 2025Basic EPS (Rs.)-0.56-1.224.238.4610.58Diluted EPS (Rs.)-0.56-1.224.228.4510.56Book Value Share (Rs.)31.1029.2636.7840.2341.66Dividend/Share (Rs.)0.601.002.604.956.25Gross Profit Margin (%)13.3310.8712.4817.6519.70Operating Margin (%)9.037.5610.3215.6217.47Net Profit Margin (%)-0.35-1.113.245.856.90Return on Equity (%)-2.10-4.9014.5027.5825.39ROCE (%)6.807.9413.3317.4615.37Return on Assets (%)-0.39-0.822.263.673.80Current Ratio (X)0.981.001.081.091.29Quick Ratio (X)0.830.860.930.941.14Debt to Equity (x)2.313.283.614.514.06Interest Coverage Ratios (X)0.921.532.492.712.43Asset Turnover Ratio (%)46.240.700.850.750.65Inventory Turnover Ratio (X)7.796.969.457.5812.143 Yr CAGR Sales (%)-18.96-11.1037.7853.4236.013 Yr CAGR Net Profit (%)-80.51-63.3771.95522.77238.21P/E (x)-101.34-48.0616.4510.129.65P/B (x)4.244.714.785.584.90EV/EBITDA (x)19.6520.1813.8010.7111.08P/S (x)1.711.310.981.101.24Corporate Actions: Ashok Leyland has been actively involved in several corporate actions. Recent announcements include:Memorandum of Understanding/Agreements: Announcement under Regulation 30 (LODR) regarding agreements.Analyst / Investor Meet: Intimation of an Analyst/Investor Meet held on September 2, 2025, from 4:00 p.m. to 4:30 p.m. (IST).Press Release / Media Release: Ashok Leyland to invest in the Battery Ecosystem for a Sustainable India.Dividend History: The company has announced several dividends:Interim Dividend: Announced on May 13, 2025, at Rs.4.25 per share (425%), effective May 22, 2025.Interim Dividend: Announced on October 31, 2024, at Rs.2.00 per share (200%), effective November 19, 2024.Interim Dividend: Announced on March 20, 2024, at Rs.4.95 per share (495%), effective April 03, 2024.Bonus History:Bonus Issue: Announced on May 23, 2025, with a bonus ratio of 1:1 and an ex-bonus date of July 16, 2025.Bonus Issue: Announced on June 15, 2011, with a bonus ratio of 1:1 and an ex-bonus date of August 02, 2011.Stock Splits:Stock Split: Announced on February 02, 2004, with an old face value of Rs 10 and a new face value of Rs 1, with an ex-split date of June 28, 2004.Moneycontrol analysis on August 29, 2025, indicated a bullish sentiment for the stock. With the stock's last traded price at Rs 131.27, Ashok Leyland has shown a positive movement in today's session."
HUDCO shares rise 2.06%; among top gainers on Nifty Midcap 150,https://www.moneycontrol.com/news/business/stocks/hudco-shares-rise-2-06-among-top-gainers-on-nifty-midcap-150-alpha-article-13510617.html,"Shares of HUDCO gained 2.06% to trade at Rs 215.71 in today's session. The stock is among the top gainers on Nifty Midcap 150. On the financial front, Housing & Urban Development Corp's consolidated revenue for the quarter-ending June 2025 stood at Rs 2,937.31 Crore, compared to Rs 2,844.99 Crore in the quarter-ending March 2025, and Rs 2,188.35 Crore in the quarter-ending June 2024. The net profit for the quarter-ending June 2025 was Rs 630.23 Crore, down from Rs 727.74 Crore in the previous quarter, but up from Rs 557.75 Crore in the same quarter last year. The EPS for the quarter-ending June 2025 was Rs 3.15, compared to Rs 3.64 in the previous quarter and Rs 2.79 in the quarter-ending June 2024.HeadingJun 2024Sep 2024Dec 2024Mar 2025Jun 2025RevenueRs 2,188.35 CroreRs 2,517.72 CroreRs 2,760.23 CroreRs 2,844.99 CroreRs 2,937.31 CroreNet ProfitRs 557.75 CroreRs 688.62 CroreRs 735.03 CroreRs 727.74 CroreRs 630.23 CroreEPS2.793.443.673.643.15The company's consolidated annual revenue has shown consistent growth over the past few years. In 2025, the revenue was Rs 10,311.29 Crore, a significant increase from Rs 7,784.29 Crore in 2024. Similarly, the net profit has increased from Rs 2,116.74 Crore in 2024 to Rs 2,709.14 Crore in 2025. The EPS has also risen from Rs 10.57 in 2024 to Rs 13.53 in 2025.Heading20212022202320242025RevenueRs 7,234.58 CroreRs 6,954.08 CroreRs 7,049.46 CroreRs 7,784.29 CroreRs 10,311.29 CroreNet ProfitRs 1,578.58 CroreRs 1,716.60 CroreRs 1,701.62 CroreRs 2,116.74 CroreRs 2,709.14 CroreEPS7.898.578.5010.5713.53BVPS65.8872.2777.1482.9889.75ROE11.9611.8611.0112.7415.07Debt to Equity4.624.254.074.455.97HUDCO announced several corporate actions, including the cancellation of a Board Meeting scheduled for August 29, 2025, and the withdrawal of a Bond Allotment Committee Meeting, also planned for August 29, 2025. The company had previously announced on August 25, 2025, its compliance with regulations related to the issue of Non-Convertible Debt Securities. The company announced dividend of Rs 1.05 per share (10.5%) Final Dividend effective from September 8, 2025. On July 29, 2025, an interim dividend of Rs 1.15 per share (11.5%) was announced with effective date as August 14, 2025. Shares of HUDCO are trading positively today, with the stock currently priced at Rs 215.71."
Mobikwik shares jump 11% as ADIA fully exits stake via block deal,https://www.moneycontrol.com/news/business/markets/mobikwik-shares-jump-11-as-adia-fully-exits-stake-via-block-deal-13510562.html,"Shares of One Mobikwik Systems surged 11 percent to Rs 262 apiece on September 2 after key shareholder Abu Dhabi Investment Authority (ADIA) exited its stake in the payments solutions provider via block deals a day earlier. According to block deal data on the National Stock Exchange (NSE), ADIA sold 16.44 lakh equity shares of Mobikwik at an average price of Rs 238.45 per share, taking the total deal value to Rs 39.21 crore. Catch all the market action on our LIVE blog The number of shares offloaded represents 2.1 percent of Mobikwik’s outstanding equity, which matches ADIA’s stake as per the June quarter shareholding pattern. Apart from ADIA, Peak XV Partners (9.92 percent), Cisco Systems (1.54 percent), and American Express Travel Related Services Company Inc. (1.34 percent) are among the prominent public shareholders in Mobikwik. Other foreign portfolio investors include Government Pension Fund Global (3.01 percent), Societe Generale (1.2 percent), and Citigroup Global Markets (1.12 percent). On the earnings front, Mobikwik reported a consolidated loss of Rs 41.9 crore for the June quarter, as its high-margin financial services business came under pressure amid ongoing strategic overhaul efforts. The company expects recovery and EBITDA breakeven by the second half of fiscal 2026. Revenue from operations stood at Rs 271.3 crore, down 20.7 percent from Rs 342.2 crore in Q1 FY25. Sequentially, losses narrowed from Rs 56 crore in Q4 FY25, while revenue saw a marginal uptick of 1.3 percent. Over the last month, Mobikwik shares have gained 12 percent, outperforming the flat-to-positive trend in the benchmark Nifty 50 index. Disclaimer: The views and investment tips expressed by investment experts on Moneycontrol.com are their own and not those of the website or its management. Moneycontrol.com advises users to check with certified experts before taking any investment decisions."
"Sugar stocks rally up to 20% after govt allows ethanol production from sugarcane juice, molasses",https://www.moneycontrol.com/news/business/markets/sugar-stocks-rally-up-to-12-after-govt-allows-ethanol-production-from-sugarcane-juice-molasses-13510529.html,"Sugar stocks surged in morning trade on September 2 after the government decided to remove limits on ethanol production from sugarcane juice, sugar syrup, and molasses for the year 2025-26. The government had restricted production of ethanol from sugarcane juice, syrup and all types of molasses in the current marketing year amid a drop in sugarcane supplies. In the new ethanol supply year starting from November 1, sugar mills and distilleries will be allowed to produce ethanol without any quantitative restriction, the Ministry of Consumer Affairs, Food & Public Distribution said. The Department of Food and Public Distribution (DFPD) will periodically review the sugar diversion to ethanol to ensure year-round domestic availability of the sweetener, it said. This comes as sugarcane supplies are expected to jump in the new season as ample monsoon rains for two straight years have helped farmers expand area under the crop. Balrampur Chini Mills shares jumped more than 7 percent to trade at Rs 580 apiece, while Shree Renuka Sugars shares rallied over 15 percent to trade at Rs 33 apiece. Bajaj Hindusthan Sugar and Godavari Biorefineries shares gained 12 percent and 5 percent respectively. Uttam Sugar Mills shares rallied over 9 percent, while Dhampur Sugar Mills and Magadh Sugar & Energy shares were trading around 10 percent higher. Triveni Engineering shares were up 4.5 percent, while Dwarikesh Sugar and other stocks gained up to 14 percent. Smallcap stock Rajshree Sugars & Chemicals meanwhile surged 20 percent to hit the upper circuit at Rs 45.26 apiece. Earlier yesterday, the Supreme Court dismissed a plea which challenged the nationwide rollout of 20 percent Ethanol Blended Petrol (EBP-20). The petitioner had alleged that vehicles manufactured in India prior to April 2023 are not compatible with ethanol mix petrol. Vehicles as new as 2 years old are also not compatible with ethanol mixed petrol wherein the percentage of ethanol is 20 percent, despite the cars being BS-VI compliant, the person added. The plea, filed by advocate Akshay Malhotra, had sought a direction to the Ministry of Petroleum and Natural Gas to ensure availability of ethanol-free petrol at all fuel stations. A bench headed by Chief Justice of India BR Gavai, along with Justice K Vinod Chandran, dismissed the plea. Attorney General R Venkataramani, opposing the petition, said that the matter had already been thoroughly examined before the policy’s rollout. He alleged that the petitioner was merely a “front” for a larger lobby and stressed that the policy benefits sugarcane farmers while also conserving foreign exchange. “Should people outside the country decide what fuel India should use?” the AG remarked. Also read: Our LIVE blog on stock market updates"
