title,link,content
Hyundai Motor shares among top losers on Nifty Next 50 on Monday,https://www.moneycontrol.com/news/business/stocks/hyundai-motor-shares-among-top-losers-on-nifty-next-50-on-monday-alpha-article-13510134.html,"Shares of Hyundai Motor were ended lower on Monday, with the stock among the top losers on the Nifty Next 50 index. At yesterday's close, Hyundai Motor stock was priced at Rs 2,455.60, a fall of 0.2%. Financial Overview The following table presents a summary of Hyundai Motor's key financial data.ParticularsMar 2022Mar 2023Mar 2024Mar 2025SalesRs 47,378 CroreRs 60,307 CroreRs 69,829 CroreRs 69,192 CroreOther IncomeRs 587 CroreRs 1,129 CroreRs 1,473 CroreRs 870 CroreTotal IncomeRs 47,966 CroreRs 61,436 CroreRs 71,302 CroreRs 70,062 CroreTotal ExpenditureRs 44,061 CroreRs 54,948 CroreRs 62,904 CroreRs 62,344 CroreEBITRs 3,904 CroreRs 6,487 CroreRs 8,397 CroreRs 7,718 CroreInterestRs 131 CroreRs 142 CroreRs 158 CroreRs 127 CroreTaxRs 870 CroreRs 1,636 CroreRs 2,179 CroreRs 1,951 CroreNet ProfitRs 2,901 CroreRs 4,709 CroreRs 6,060 CroreRs 5,640 CroreThe annual sales for March 2025 stood at Rs 69,192 Crore, slightly lower compared to the previous year's Rs 69,829 Crore. Net profit for March 2025 was Rs 5,640 Crore, a decrease from the Rs 6,060 Crore reported in March 2024.Particulars2022202320242025RevenueRs 47,378.43 CroreRs 60,307.58 CroreRs 69,829.06 CroreRs 69,192.89 CroreNet ProfitRs 2,901.59 CroreRs 4,709.25 CroreRs 6,060.04 CroreRs 5,640.21 CroreEPSRs 3,571.00Rs 5,796.00Rs 7,458.00Rs 69.41BVPSRs 20,745.10Rs 24,681.60Rs 13,126.30Rs 200.56ROE17.2123.4856.8134.61Debt to Equity0.070.060.070.05The company's revenue for the year 2025 stood at Rs 69,192.89 Crore compared to Rs 69,829.06 Crore in 2024. The net profit for the year 2025 was Rs 5,640.21 Crore, down from Rs 6,060.04 Crore in the previous year.ParticularsJun 2024Sep 2024Dec 2024Mar 2025Jun 2025RevenueRs 17344.23 CroreRs 17260.38 CroreRs 16647.99 CroreRs 17940.28 CroreRs 16412.88 CroreNet ProfitRs 1489.65 CroreRs 1375.47 CroreRs 1160.73 CroreRs 1614.35 CroreRs 1369.23 CroreEPS18.3316.9314.2919.8716.85The revenue for the quarter-ending June 2025 was Rs 16,412.88 Crore, compared to Rs 17,940.28 Crore for the quarter-ending March 2025. The net profit for the quarter-ending June 2025 was Rs 1,369.23 Crore, a decrease from Rs 1,614.35 Crore in the previous quarter. Cash FlowParticularsMar 2022Mar 2023Mar 2024Mar 2025Operating ActivitiesRs 5,138 CroreRs 6,564 CroreRs 9,251 CroreRs 4,344 CroreInvesting ActivitiesRs -905 CroreRs -1,411 CroreRs -10,090 CroreRs -413 CroreFinancing ActivitiesRs -1,662 CroreRs -1,579 CroreRs -15,930 CroreRs -62 CroreOthersRs 0 CroreRs 28 CroreRs 0 CroreRs 4 CroreNet Cash FlowRs 2,571 CroreRs 3,602 CroreRs -16,767 CroreRs 3,872 CroreBalance SheetParticularsMar 2022Mar 2023Mar 2024Mar 2025Share CapitalRs 812 CroreRs 812 CroreRs 812 CroreRs 812 CroreReserves & SurplusRs 16,043 CroreRs 19,242 CroreRs 9,853 CroreRs 15,483 CroreCurrent LiabilitiesRs 9,192 CroreRs 12,005 CroreRs 12,997 CroreRs 11,266 CroreOther LiabilitiesRs 2,309 CroreRs 2,512 CroreRs 2,686 CroreRs 2,534 CroreTotal LiabilitiesRs 28,358 CroreRs 34,573 CroreRs 26,349 CroreRs 30,097 CroreFixed AssetsRs 7,200 CroreRs 7,487 CroreRs 8,267 CroreRs 11,823 CroreCurrent AssetsRs 20,079 CroreRs 25,361 CroreRs 16,124 CroreRs 16,032 CroreOther AssetsRs 1,077 CroreRs 1,724 CroreRs 1,957 CroreRs 2,241 CroreTotal AssetsRs 28,358 CroreRs 34,573 CroreRs 26,349 CroreRs 30,097 CroreContingent LiabilitiesRs 4,500 CroreRs 4,528 CroreRs 5,335 CroreRs 5,581 CroreKey RatiosParticularsMar 2022Mar 2023Mar 2024Mar 2025Basic EPS (Rs.)Rs 3,571.00Rs 5,796.00Rs 7,458.00Rs 69.41Diluted EPS (Rs.)Rs 3,571.00Rs 5,796.00Rs 7,458.00Rs 69.41Book Value /Share (Rs.)Rs 20,745.10Rs 24,681.60Rs 13,126.30Rs 200.56Dividend/Share (Rs.)Rs 1,838.00Rs 5,727.00Rs 16,330.00Rs 21.00Face Value10001000100010Gross Profit Margin (%)12.8114.3815.1814.19Operating Margin (%)8.2410.7512.0211.15Net Profit Margin (%)6.127.808.678.15Return on Networth (%)17.2123.4856.8134.61ROCE (%)20.3728.7462.8940.98Return On Assets (%)10.2313.6222.9918.73Current Ratio (X)2.182.111.241.42Quick Ratio (X)1.871.830.991.12Debt to Equity (x)0.070.060.070.05Interest Coverage Ratios (X)46.0460.9467.0977.23Asset Turnover Ratio (%)0.001.922.292.45Inventory Turnover Ratio (X)0.0014.1215.2320.593 Yr CAGR Sales (%)21,666.5924,457.6026,325.1920.853 Yr CAGR Net Profit (%)5,286.646,762.407,684.6339.42P/E (x)0.000.000.0024.60P/B (x)0.000.000.008.51EV/EBITDA (x)0.000.000.0013.32P/S (x)0.000.000.002.00Corporate Actions Hyundai Motor announced a final dividend of Rs 21.00 per share (210%) with an effective date of August 5, 2025. Further announcements including Voting Results along with Scrutinizer Report, Shareholder Meeting / Postal Ballot-Scrutinizer's Report, and Regulation 30 Disclosure happened on September 1, 2025. Moneycontrol's analysis indicates very bullish sentiment for Hyundai Motor stock."
Tata Consultancy Services shares gain 0.90% on Monday,https://www.moneycontrol.com/news/business/stocks/tata-consultancy-services-shares-gain-0-90-on-monday-alpha-article-13510130.html,"Tata Consultancy Services stock closed at Rs 3,112.60 in the previous session, a gain of 0.90% on the Nifty 50. The stock touched a high of Rs 3,131.10 and a low of Rs 3,090.00 during Monday's session. Tata Consultancy Services is included as one of the stocks in the benchmark Nifty 50 index. Financial Highlights: The financial performance of Tata Consultancy Services reveals the following trends based on the consolidated data: Quarterly Performance: Revenue for the quarter-ending June 2025 stood at Rs 63,437 Crore, compared to Rs 62,613 Crore in June 2024, indicating an increase. Net profit for the same period was Rs 12,819 Crore, up from Rs 12,105 Crore in the previous year. The EPS also increased to Rs 35.27 from Rs 33.28. Annual Performance: Revenue for the year-ending March 2025 reached Rs 255,324 Crore, a notable increase from Rs 240,893 Crore in March 2024. The net profit for the year also rose to Rs 48,797 Crore from Rs 46,099 Crore. Furthermore, the EPS improved to Rs 134.19 from Rs 125.88. The following table summarizes the key financial figures:ParticularsMar 2025Mar 2024Mar 2023Mar 2022Mar 2021RevenueRs 255,324 CroreRs 240,893 CroreRs 225,458 CroreRs 191,754 CroreRs 164,177 CroreNet ProfitRs 48,797 CroreRs 46,099 CroreRs 42,303 CroreRs 38,449 CroreRs 32,562 CroreEPSRs 134.19Rs 125.88Rs 115.19Rs 103.62Rs 86.71BVPSRs 261.76Rs 252.26Rs 249.20Rs 245.48Rs 235.43ROE51.2450.7346.6142.9937.52Debt to Equity0.000.000.000.000.00The company’s sales for the year-ending March 2025 stood at Rs 255,324 Crore, compared to Rs 240,893 Crore in the year-ending March 2024. Other income stood at Rs 3,962 Crore for the year-ending March 2025, compared to Rs 4,422 Crore for the year-ending March 2024. Total expenditure for the year-ending March 2025 was Rs 193,159 Crore, compared to Rs 182,540 Crore for the year-ending March 2024. The company’s net profit for the year-ending March 2025 was Rs 48,797 Crore, compared to Rs 46,099 Crore for the year-ending March 2024.ParticularsMar 2025Mar 2024Mar 2023Mar 2022Mar 2021Operating ActivitiesRs 48,908 CroreRs 44,338 CroreRs 41,965 CroreRs 39,949 CroreRs 38,802 CroreInvesting ActivitiesRs -2,318 CroreRs 6,026 CroreRs 39 CroreRs -897 CroreRs -8,129 CroreFinancing ActivitiesRs -47,438 CroreRs -48,536 CroreRs -47,878 CroreRs -33,581 CroreRs -32,634 CroreOthersRs 174 CroreRs 65 CroreRs 509 CroreRs 159 CroreRs 173 CroreNet Cash FlowRs -674 CroreRs 1,893 CroreRs -5,365 CroreRs 5,630 CroreRs -1,788 CroreBalance Sheet:ParticularsMar 2025Mar 2024Mar 2023Mar 2022Mar 2021Share CapitalRs 362 CroreRs 362 CroreRs 366 CroreRs 366 CroreRs 370 CroreReserves & SurplusRs 94,394 CroreRs 90,127 CroreRs 90,058 CroreRs 88,773 CroreRs 86,063 CroreCurrent LiabilitiesRs 53,001 CroreRs 46,104 CroreRs 43,558 CroreRs 42,351 CroreRs 34,155 CroreOther LiabilitiesRs 11,872 CroreRs 9,856 CroreRs 9,669 CroreRs 10,024 CroreRs 10,171 CroreTotal LiabilitiesRs 159,629 CroreRs 146,449 CroreRs 143,651 CroreRs 141,514 CroreRs 130,759 CroreFixed AssetsRs 22,739 CroreRs 19,336 CroreRs 19,891 CroreRs 20,716 CroreRs 20,149 CroreCurrent AssetsRs 123,012 CroreRs 112,984 CroreRs 110,270 CroreRs 108,310 CroreRs 99,280 CroreOther AssetsRs 13,878 CroreRs 14,129 CroreRs 13,490 CroreRs 12,488 CroreRs 11,330 CroreTotal AssetsRs 159,629 CroreRs 146,449 CroreRs 143,651 CroreRs 141,514 CroreRs 130,759 CroreContingent LiabilitiesRs 4,009 CroreRs 3,419 CroreRs 2,388 CroreRs 2,298 CroreRs 1,821 CroreRatio Analysis: Tata Consultancy Services' financial ratios provide insights into its performance and efficiency. The basic EPS for March 2025 is Rs 134.19, compared to Rs 125.88 for March 2024. The book value per share is Rs 261.76 for March 2025, compared to Rs 252.26 for March 2024. The debt to equity ratio remains at 0.00, indicating a debt-free status. The dividend per share is Rs 126.00. Tata Consultancy Services announced a dividend of Rs 11 on June 27, 2025, with an effective date of July 16, 2025. Prior to this, a final dividend of Rs 30 was announced on April 11, 2025, effective from June 4, 2025, and a special dividend of Rs 66 was announced on January 9, 2025, effective from January 17, 2025. Tata Consultancy Services completed one of UK's largest policy migrations for Lloyds Banking Group's Scottish Widows and Philippines Pharma Major, Unilab, Selects TCS For Cloud-Led Enterprise Modernization. Moneycontrol analysis indicates a bullish sentiment for Tata Consultancy Services as of August 26, 2025. Tata Consultancy Services stock closed at Rs 3,112.60 in the previous session, a gain of 0.90% on the Nifty 50."
Avenue Supermarts-DMart shares among top losers on Nifty Next 50 on Monday,https://www.moneycontrol.com/news/business/stocks/avenue-supermarts-dmart-shares-among-top-losers-on-nifty-next-50-on-monday-alpha-article-13510132.html,"Avenue Supermarts-DMart stock ended at Rs 4,734.90 on Monday, a marginal decline of 0.44%. The stock was among the top losers on Nifty Next 50 in yesterday's trading. Financial Highlights: Avenue Supermarts financial performance shows consistent growth in revenue and net profit over the years. Here's an overview of the company's financial data: Consolidated Yearly Figures:YearRevenue (Rs Crore)Net Profit (Rs Crore)EPSBVPSROEDebt to Equity202124,143.061,099.4316.97188.099.020.00202230,976.271,492.4023.04211.1510.910.00202342,839.562,378.3436.72248.0214.790.00202450,788.832,535.6138.99287.3413.560.00202559,358.052,707.4541.61329.2912.630.00The revenue increased by 16.87% in 2025 compared to 2024, and net profit also saw an increase of 6.78% during the same period. Consolidated Quarterly Figures:QuarterRevenue (Rs Crore)Net Profit (Rs Crore)EPSMar 202412,726.55563.148.66Sep 202414,444.50659.4410.14Dec 202415,972.55723.5411.12Mar 202514,871.86550.798.47Jun 202516,359.70772.8111.88The revenue for the quarter-ending June 2025 increased by 10.00% compared to the quarter-ending March 2025, and net profit increased by 40.31% during the same period. Key Financial Ratios:RatioMar 2021Mar 2022Mar 2023Mar 2024Mar 2025Basic EPS (Rs.)16.9723.0436.7238.9941.61Diluted Eps (Rs.)16.8522.8636.4938.9341.50Book Value [Excl. Reval Reserve]/Share (Rs.)188.09211.15248.02287.34329.29P/E (x)168.48173.7692.62116.0798.13P/B (x)15.1718.9413.7215.7612.38Debt to Equity (x)0.000.000.000.000.00Avenue Supermarts has demonstrated a strong financial performance with increasing revenues and profits. The company has also maintained a consistent debt-to-equity ratio of 0.00 over the past five years. The company has been opening new stores, with recent intimations to the BSE regarding store openings on August 13, 2025, and August 21, 2025. The proceedings of the 25th Annual General Meeting held on August 12, 2025, were also announced."
Hindustan Unilever share price falls 0.39% in previous session,https://www.moneycontrol.com/news/business/stocks/hindustan-unilever-share-price-falls-0-39-in-previous-session-alpha-article-13510164.html,"Shares of Hindustan Unilever experienced a decline of 0.39% in the previous session, with the stock's last traded price at Rs 2,649.50. The stock traded between a high of Rs 2,673.30 and a low of Rs 2,639.30 in Monday's trading. Financial Highlights The following table presents the consolidated quarterly financial performance of Hindustan Unilever:HeadingJun 2024Sep 2024Dec 2024Mar 2025Jun 2025RevenueRs 15,707.00 CroreRs 15,926.00 CroreRs 15,818.00 CroreRs 15,670.00 CroreRs 16,514.00 CroreNet ProfitRs 2,614.00 CroreRs 2,601.00 CroreRs 2,988.00 CroreRs 2,476.00 CroreRs 2,769.00 CroreEPS11.1111.0312.7010.4811.73The revenue for the quarter-ending June 2025 was Rs 16,514.00 Crore, compared to Rs 15,670.00 Crore for the quarter-ending March 2025, representing an increase of 5.38%. The net profit for the quarter-ending June 2025 was Rs 2,769.00 Crore, compared to Rs 2,476.00 Crore for the quarter-ending March 2025, representing an increase of 11.83%. The EPS for the quarter-ending June 2025 was 11.73, compared to 10.48 for the quarter-ending March 2025. The following table presents the consolidated yearly financial performance of Hindustan Unilever:Heading20212022202320242025RevenueRs 47,028.00 CroreRs 52,446.00 CroreRs 60,580.00 CroreRs 61,896.00 CroreRs 63,121.00 CroreNet ProfitRs 8,000.00 CroreRs 8,887.00 CroreRs 10,145.00 CroreRs 10,286.00 CroreRs 10,679.00 CroreEPS34.0337.7943.0743.7445.32BVPS202.95208.88214.99217.95210.22ROE16.7718.0920.1120.0621.55Debt to Equity0.000.000.000.000.00The revenue for the year-ending March 2025 was Rs 63,121.00 Crore, compared to Rs 61,896.00 Crore for the year-ending March 2024, representing an increase of 1.98%. The net profit for the year-ending March 2025 was Rs 10,679.00 Crore, compared to Rs 10,286.00 Crore for the year-ending March 2024, representing an increase of 3.82%. The EPS for the year-ending March 2025 was 45.32, compared to 43.74 for the year-ending March 2024. The following table displays the key figures from the consolidated yearly income statement:Mar 2025Mar 2024Mar 2023Mar 2022Mar 2021Sales63,12161,89660,58052,44647,028Other Income1,017811512258410Total Income64,13862,70761,09252,70447,438Total Expenditure49,32048,44347,63240,72436,715EBIT14,81814,26413,46011,98010,723Interest395334114106117Tax3,7443,6443,2012,9872,606Net Profit10,67910,28610,1458,8878,000Corporate ActionsOn August 29, 2025, the company announced the newspaper publication regarding the notice of Postal Ballot for the appointment of Ms. Priya Nair as Managing Director and Chief Executive Officer.The company intimated the Postal Ballot Notice for the appointment of Ms. Priya Nair as Managing Director and Chief Executive Officer on August 28, 2025.The schedule for an Analyst/Investor Meet was announced on August 26, 2025.The company announced a final dividend of Rs 24.00 per share (2400%) with an effective date of June 23, 2025. Other dividends include an interim dividend of Rs 19.00 per share (1900%) and a special dividend of Rs 10.00 per share (1000%), both with an effective date of November 6, 2024. The company issued bonus shares on September 30, 1991, with an existing ratio of 2:1 (existing shares: bonus shares) and the ex-bonus date was July 19, 1991. The company executed a stock split on July 5, 2000, where the face value changed from Rs 10 to Rs 1. The ex-split date was July 3, 2000. Moneycontrol analysis indicates a very bullish sentiment as of September 2, 2025."
"Titan Company shares fall on Monday, among top losers on Nifty 50",https://www.moneycontrol.com/news/business/stocks/titan-company-shares-fall-on-monday-among-top-losers-on-nifty-50-alpha-article-13510090.html,"Shares of Titan Company ended lower in Monday's session. The stock was among the top losers on Nifty 50. Titan Company closed at Rs 3,618.60 yesterday, a decline of 0.28% on the NSE. On the financial front, the consolidated revenue for the quarter-ending June 2025 stood at Rs 16,523 Crore, compared to Rs 13,266 Crore in June 2024. The net profit for the quarter ending June 2025 was Rs 1,091 Crore, up from Rs 715 Crore in the same quarter last year. The EPS stood at Rs 12.30 in June 2025, compared to Rs 8.06 in June 2024. The company's consolidated yearly revenue has shown consistent growth over the past five years. In March 2025, the revenue reached Rs 60,456 Crore, compared to Rs 51,084 Crore in March 2024, marking an increase of 18.34%. The net profit for the year ending March 2025 was Rs 3,336 Crore, slightly lower than the Rs 3,495 Crore reported in March 2024. Key financial ratios for Titan Company show a basic EPS of Rs 37.62 and diluted EPS of Rs 37.61 as of March 2025. The company reported a book value per share of Rs 130.61 and a debt-to-equity ratio of 1.56 as of the year-ending March 2025.Financial YearRevenue (Rs Crore)Net Profit (Rs Crore)EPS (Rs)Mar 2021Rs 21,644 CroreRs 979 Crore10.96Mar 2022Rs 28,799 CroreRs 2,198 Crore24.49Mar 2023Rs 40,575 CroreRs 3,273 Crore36.61Mar 2024Rs 51,084 CroreRs 3,495 Crore39.40Mar 2025Rs 60,456 CroreRs 3,336 Crore37.62Titan Company announced a final dividend of Rs 11.00 per share on May 8, 2025, with the effective date being July 8, 2025. Other corporate actions include updates from CARE Ratings Ltd. and ICRA Ltd. regarding credit ratings, and intimation of analyst/investor meetings. Moneycontrol analysis, as of September 2, 2025, suggests a very bullish sentiment for the stock. With the stock's last traded price at Rs 3,618.60, Titan Company was among the top losers on Nifty 50 in yesterday's session."
"M&M shares rise 3.6% on Monday, among top gainers on Nifty 50",https://www.moneycontrol.com/news/business/stocks/m-m-shares-rise-3-6-on-monday-among-top-gainers-on-nifty-50-alpha-article-13510086.html,"Shares of M&M were among the top gainers on the Nifty 50 in Monday's trade. At the end of yesterday's session, the stock was at Rs 3,315.40 on the NSE, a gain of 3.62% from the previous close. Financial Snapshot: The following table presents the consolidated quarterly financial performance of M&M:HeadingJun 2024Sep 2024Dec 2024Mar 2025Jun 2025RevenueRs 37,217.72 CroreRs 37,923.74 CroreRs 41,470.05 CroreRs 42,599.31 CroreRs 45,529.19 CroreNet ProfitRs 3,221.34 CroreRs 2,894.71 CroreRs 3,317.22 CroreRs 3,102.48 CroreRs 3,898.44 CroreEPS29.4428.4328.5129.5236.58The company's revenue has shown a consistent increase over the quarters, with revenue for the quarter ending June 2025 at Rs 45,529.19 Crore compared to Rs 37,217.72 Crore in June 2024. Net profit also increased, with Rs 3,898.44 Crore reported for the quarter ending June 2025, up from Rs 3,221.34 Crore in June 2024. The following table presents the consolidated yearly financial performance of M&M:Heading20212022202320242025RevenueRs 74,277.78 CroreRs 90,170.57 CroreRs 121,268.55 CroreRs 138,279.30 CroreRs 158,749.75 CroreNet ProfitRs 2,425.26 CroreRs 5,397.22 CroreRs 9,869.04 CroreRs 11,148.39 CroreRs 12,535.75 CroreEPS16.3359.2092.41101.14115.91BVPS456.20510.96602.37695.30690.13ROE4.3513.9518.2417.0216.78Debt to Equity1.431.581.571.561.57The annual financial data shows consistent growth in revenue and net profit. Revenue increased from Rs 74,277.78 Crore in 2021 to Rs 158,749.75 Crore in 2025. Net profit also rose from Rs 2,425.26 Crore in 2021 to Rs 12,535.75 Crore in 2025. The following table presents the consolidated yearly income statement of M&M:Mar 2025Mar 2024Mar 2023Mar 2022Mar 2021SalesRs 158,749 CroreRs 138,279 CroreRs 121,268 CroreRs 90,170 CroreRs 74,277 CroreOther IncomeRs 2,611 CroreRs 2,952 CroreRs 1,206 CroreRs 934 CroreRs 1,033 CroreTotal IncomeRs 161,361 CroreRs 141,231 CroreRs 122,475 CroreRs 91,105 CroreRs 75,310 CroreTotal ExpenditureRs 134,735 CroreRs 118,887 CroreRs 104,090 CroreRs 78,581 CroreRs 65,137 CroreEBITRs 26,625 CroreRs 22,344 CroreRs 18,384 CroreRs 12,524 CroreRs 10,173 CroreInterestRs 9,083 CroreRs 7,488 CroreRs 5,829 CroreRs 5,018 CroreRs 6,102 CroreTaxRs 5,006 CroreRs 3,707 CroreRs 2,685 CroreRs 2,108 CroreRs 1,645 CroreNet ProfitRs 12,535 CroreRs 11,148 CroreRs 9,869 CroreRs 5,397 CroreRs 2,425 CroreThe following table presents the consolidated quarterly income statement of M&M:Jun 2025Mar 2025Dec 2024Sep 2024Jun 2024SalesRs 45,529 CroreRs 42,599 CroreRs 41,470 CroreRs 37,923 CroreRs 37,217 CroreOther IncomeRs 916 CroreRs 701 CroreRs 411 CroreRs 659 CroreRs 408 CroreTotal IncomeRs 46,446 CroreRs 43,301 CroreRs 41,881 CroreRs 38,582 CroreRs 37,626 CroreTotal ExpenditureRs 38,848 CroreRs 36,717 CroreRs 34,734 CroreRs 32,092 CroreRs 31,222 CroreEBITRs 7,597 CroreRs 6,583 CroreRs 7,146 CroreRs 6,490 CroreRs 6,404 CroreInterestRs 2,431 CroreRs 2,396 CroreRs 2,362 CroreRs 2,217 CroreRs 2,107 CroreTaxRs 1,267 CroreRs 1,084 CroreRs 1,467 CroreRs 1,378 CroreRs 1,075 CroreNet ProfitRs 3,898 CroreRs 3,102 CroreRs 3,317 CroreRs 2,894 CroreRs 3,221 CroreThe cash flow from operating activities for the year ending March 2025 was Rs 3,175 Crore. The cash flow from investing activities was Rs -18,626 Crore, and the cash flow from financing activities was Rs 15,834 Crore. The following table summarizes M&M's cash flow:Mar 2025Mar 2024Mar 2023Mar 2022Mar 2021Operating ActivitiesRs 3,175 CroreRs -5,629 CroreRs -7,074 CroreRs 9,247 CroreRs 17,908 CroreInvesting ActivitiesRs -18,626 CroreRs -5,597 CroreRs -8,547 CroreRs -3,225 CroreRs -18,446 CroreFinancing ActivitiesRs 15,834 CroreRs 12,281 CroreRs 15,946 CroreRs -5,882 CroreRs 406 CroreOthersRs 9 CroreRs -17 CroreRs -319 CroreRs -26 CroreRs 14 CroreNet Cash FlowRs 393 CroreRs 1,036 CroreRs 5 CroreRs 112 CroreRs -117 CroreKey balance sheet figures show that total assets for March 2025 stood at Rs 277,586 Crore, compared to Rs 236,300 Crore in March 2024. Total liabilities increased from Rs 236,300 Crore in March 2024 to Rs 277,586 Crore in March 2025. The following table summarizes M&M's balance sheet:Mar 2025Mar 2024Mar 2023Mar 2022Mar 2021Share CapitalRs 558 CroreRs 557 CroreRs 556 CroreRs 556 CroreRs 555 CroreReserves & SurplusRs 76,480 CroreRs 65,334 CroreRs 55,548 CroreRs 46,343 CroreRs 40,771 CroreCurrent LiabilitiesRs 90,322 CroreRs 75,545 CroreRs 70,579 CroreRs 56,288 CroreRs 51,446 CroreOther LiabilitiesRs 110,225 CroreRs 94,863 CroreRs 79,206 CroreRs 70,925 CroreRs 73,689 CroreTotal LiabilitiesRs 277,586 CroreRs 236,300 CroreRs 205,891 CroreRs 174,112 CroreRs 166,462 CroreFixed AssetsRs 40,560 CroreRs 33,720 CroreRs 28,559 CroreRs 31,380 CroreRs 27,947 CroreCurrent AssetsRs 126,573 CroreRs 98,265 CroreRs 91,325 CroreRs 75,148 CroreRs 72,137 CroreOther AssetsRs 110,452 CroreRs 104,314 CroreRs 86,006 CroreRs 67,583 CroreRs 66,377 CroreTotal AssetsRs 277,586 CroreRs 236,300 CroreRs 205,891 CroreRs 174,112 CroreRs 166,462 CroreContingent LiabilitiesRs 23,507 CroreRs 28,897 CroreRs 10,610 CroreRs 7,015 CroreRs 8,934 CroreKey financial ratios for M&M include a basic EPS of Rs 115.91 and diluted EPS of Rs 115.06 for March 2025. The book value per share was Rs 690.13. The debt-to-equity ratio stood at 1.57. The following table presents the key ratios for M&M:Mar 2025Mar 2024Mar 2023Mar 2022Mar 2021Basic EPS (Rs.)115.91101.1492.4159.2016.33Diluted EPS (Rs.)115.06100.7091.9658.8316.15Book Value /Share (Rs.)690.13695.30602.37510.96456.20Dividend/Share (Rs.)25.3021.1016.2511.558.75Face Value55555Gross Profit Margin (%)20.5919.5717.7217.3119.80Operating Margin (%)16.7716.1514.1213.4215.25Net Profit Margin (%)7.898.068.135.980.31Return on Networth / Equity (%)16.7817.0218.2413.954.35ROCE (%)14.2113.8912.6610.279.85Return On Assets (%)4.654.764.993.771.08Current Ratio (X)1.401.301.291.341.40Quick Ratio (X)1.181.051.061.131.22Debt to Equity (x)1.571.561.571.581.43Interest Coverage Ratios (X)3.603.613.693.111.86Asset Turnover Ratio (%)0.620.630.680.4944.62Inventory Turnover Ratio (X)4.534.396.085.237.723 Yr CAGR Sales (%)32.6936.4426.84-7.21-10.193 Yr CAGR Net Profit (%)52.40114.40141.977.73-40.50P/E (x)23.0019.0012.5413.6248.70P/B (x)3.863.242.291.902.12EV/EBITDA (x)12.5511.7010.1110.439.79P/S (x)1.871.551.060.991.19Corporate Actions M&M has announced several corporate actions, including stake dilutions, analyst/investor meetings, and dividends. A final dividend of Rs 25.30 per share (506%) was announced on May 5, 2025, with an effective date of July 4, 2025. The company also announced bonus issues, including a 1:1 bonus on November 10, 2017. A rights issue was announced on September 30, 1992, with a ratio of 1:5. Additionally, a stock split was announced on January 25, 2010, with the face value changing from Rs 10 to Rs 5. Moneycontrol analysis on August 29, 2025, indicated a bearish sentiment on the stock."
