title,link,content
Lupin shares rise 2.20%; among top gainers on Nifty Midcap 150,https://www.moneycontrol.com/news/business/stocks/lupin-shares-rise-2-20-among-top-gainers-on-nifty-midcap-150-alpha-article-13515432.html,"Shares of Lupin gained 2.20% to trade at Rs 1,931.20 in Wednesday's session. The stock is among the top gainers on the Nifty Midcap 150 index, as of 11:24 am, trading up from its previous close. On August 29, 2025, Lupin Limited informed the Exchange about its ESG Rating by Crisil ESG Ratings & Analytics Ltd. The company also announced its participation in an Analyst/Investors Meet on August 27, 2025. The company has shown consistent growth in financial performance over the past few years. Here's a summary of Lupin's financial data:Lupin Consolidated Yearly DataHeading20212022202320242025RevenueRs 15,162.96 CroreRs 16,405.48 CroreRs 16,641.66 CroreRs 20,010.82 CroreRs 22,707.90 CroreNet ProfitRs 1,226.60 Crore-Rs 1,509.72 CroreRs 447.69 CroreRs 1,935.57 CroreRs 3,306.26 CroreEPS26.84-33.659.4642.0571.95BVPS305.45268.91275.67315.41376.77ROE8.81-12.573.4513.3919.07Debt to Equity0.220.320.340.190.30The consolidated yearly revenue for Lupin has increased from Rs 15,162.96 Crore in 2021 to Rs 22,707.90 Crore in 2025. The net profit has also seen a significant increase, from Rs 1,226.60 Crore in 2021 to Rs 3,306.26 Crore in 2025, with a loss of Rs -1,509.72 Crore in 2022. The EPS has increased from 26.84 in 2021 to 71.95 in 2025.Lupin Consolidated Quarterly DataHeadingJun 2024Sep 2024Dec 2024Mar 2025Jun 2025RevenueRs 5,600.33 CroreRs 5,672.73 CroreRs 5,767.71 CroreRs 5,667.13 CroreRs 6,268.34 CroreNet ProfitRs 805.54 CroreRs 859.48 CroreRs 858.86 CroreRs 782.38 CroreRs 1,221.46 CroreEPS17.5818.7018.7516.9326.70The consolidated quarterly revenue has increased from Rs 5,600.33 Crore in June 2024 to Rs 6,268.34 Crore in June 2025. The net profit has also increased from Rs 805.54 Crore in June 2024 to Rs 1,221.46 Crore in June 2025. The EPS has increased from 17.58 in June 2024 to 26.70 in June 2025.Lupin Yearly Income StatementMar 2021Mar 2022Mar 2023Mar 2024Mar 2025Sales15,16216,40516,64120,01022,707Other Income13614173120195Total Income15,29916,54716,71520,13022,903Total Expenditure13,48317,77615,72417,39718,593EBIT1,815-1,2299902,7334,309Interest140142274311294Tax448137268486708Net Profit1,226-1,5094471,9353,306Lupin Quarterly Income StatementJun 2024Sep 2024Dec 2024Mar 2025Jun 2025Sales5,6005,6725,7675,6676,268Other Income6742535679Total Income5,6685,7155,8215,7246,347Total Expenditure4,6074,5894,6834,7394,840EBIT1,0611,1251,1389841,507Interest6870668991Tax187195212113194Net Profit8058598587821,221Lupin Cash FlowMar 2021Mar 2022Mar 2023Mar 2024Mar 2025Operating Activities1,8213671,8973,6482,999Investing Activities-1,2391,292-1,286-1,712-4,171Financing Activities-1,885-1,572-337-2,1841,731Others00000Net Cash Flow-1,30387273-248559Lupin Balance SheetMar 2021Mar 2022Mar 2023Mar 2024Mar 2025Share Capital9090919191Reserves & Surplus13,52211,90012,22414,08417,112Current Liabilities8,4368,2769,2658,5018,961Other Liabilities1,5601,5531,3751,3193,039Total Liabilities23,61021,82122,95523,99729,204Fixed Assets6,9846,4037,3747,3258,003Current Assets13,98612,45712,45113,44716,798Other Assets2,6392,9593,1303,2234,402Total Assets23,61021,82122,95523,99729,204Contingent Liabilities6111,0509421,148644Lupin RatiosMar 2021Mar 2022Mar 2023Mar 2024Mar 2025Basic EPS (Rs.)26.84-33.659.4642.0571.95Diluted Eps (Rs.)26.72-33.659.4141.8771.95Book Value [Excl. Reval Reserve]/Share (Rs.)305.45268.91275.67315.41376.77Dividend/Share (Rs.)6.504.004.008.0012.00Face Value22222Gross Profit Margin (%)17.822.6111.2419.6424.12Operating Margin (%)11.97-7.495.9513.6618.97Net Profit Margin (%)8.08-9.202.699.6714.55Return on Networth / Equity (%)8.81-12.573.4513.3919.07ROCE (%)11.96-9.077.2317.6421.29Return On Assets (%)5.15-7.001.877.9711.23Current Ratio (X)1.661.511.341.581.87Quick Ratio (X)1.170.950.861.001.26Debt to Equity (x)0.220.320.340.190.30Interest Coverage Ratios (X)12.913.006.8212.6118.58Asset Turnover Ratio (%)64.220.510.510.850.85Inventory Turnover Ratio (X)3.710.780.820.884.353 Yr CAGR Sales (%)-2.035.774.0414.8817.653 Yr CAGR Net Profit (%)119.3970.845.2925.6247.99P/E (x)38.02-22.2068.5438.4528.19P/B (x)3.362.792.365.165.38EV/EBITDA (x)17.6585.6217.3719.1517.26P/S (x)3.052.071.773.684.07Lupin announced a final dividend of Rs 12 per share (600%) on May 14, 2025, with an effective date of July 25, 2025. The company had previously announced a bonus issue of 1:1 on May 17, 2006, with the ex-bonus date as August 11, 2006. Additionally, Lupin underwent a stock split on May 5, 2010, with the old face value of Rs 10 split into a new face value of Rs 2; the ex-split date was August 27, 2010. Moneycontrol analysis, as of August 28, 2025, suggests a very bearish sentiment for the stock. With the stock currently trading at Rs 1,931.20, Lupin has shown significant positive movement in today's session, making it one of the top gainers on the Nifty Midcap 150 index."
Tata Consultancy Services shares fall in Wednesday's session; over 6.8 lakh shares traded,https://www.moneycontrol.com/news/business/stocks/tata-consultancy-services-shares-fall-in-wednesday-s-session-over-6-8-lakh-shares-traded-alpha-article-13515448.html,"Shares of Tata Consultancy Services were trading at Rs 3,093.70, a 0.57% decline from the previous close, with over 6.8 lakh shares traded on the NSE at 11:20 am on Wednesday. Financial Snapshot: The following table presents the consolidated financial performance of Tata Consultancy Services.ParticularsJun 2024Sep 2024Dec 2024Mar 2025Jun 2025RevenueRs 62,613.00 CroreRs 64,259.00 CroreRs 63,973.00 CroreRs 64,479.00 CroreRs 63,437.00 CroreNet ProfitRs 12,105.00 CroreRs 11,955.00 CroreRs 12,444.00 CroreRs 12,293.00 CroreRs 12,819.00 CroreEPS33.2832.9234.2133.7935.27The revenue for the quarter ending June 2025 stood at Rs 63,437.00 Crore, slightly decreased compared to Rs 64,479.00 Crore in the quarter ending March 2025. The net profit for the quarter ending June 2025 was Rs 12,819.00 Crore, which is higher than the net profit of Rs 12,293.00 Crore for the quarter ending March 2025. The EPS increased from 33.79 in March 2025 to 35.27 in June 2025.Particulars20212022202320242025RevenueRs 164,177.00 CroreRs 191,754.00 CroreRs 225,458.00 CroreRs 240,893.00 CroreRs 255,324.00 CroreNet ProfitRs 32,562.00 CroreRs 38,449.00 CroreRs 42,303.00 CroreRs 46,099.00 CroreRs 48,797.00 CroreEPS86.71103.62115.19125.88134.19BVPS235.43245.48249.20252.26261.76ROE37.5242.9946.6150.7351.24Debt to Equity0.000.000.000.000.00The company's revenue increased from Rs 240,893.00 Crore in 2024 to Rs 255,324.00 Crore in 2025. Net profit also increased from Rs 46,099.00 Crore in 2024 to Rs 48,797.00 Crore in 2025. EPS increased from 125.88 in 2024 to 134.19 in 2025. Income Statement Yearly:Mar 2025Mar 2024Mar 2023Mar 2022Mar 2021SalesRs 255,324 CroreRs 240,893 CroreRs 225,458 CroreRs 191,754 CroreRs 164,177 CroreOther IncomeRs 3,962 CroreRs 4,422 CroreRs 3,449 CroreRs 4,018 CroreRs 3,134 CroreTotal IncomeRs 259,286 CroreRs 245,315 CroreRs 228,907 CroreRs 195,772 CroreRs 167,311 CroreTotal ExpenditureRs 193,159 CroreRs 182,540 CroreRs 171,221 CroreRs 143,301 CroreRs 122,914 CroreEBITRs 66,127 CroreRs 62,775 CroreRs 57,686 CroreRs 52,471 CroreRs 44,397 CroreInterestRs 796 CroreRs 778 CroreRs 779 CroreRs 784 CroreRs 637 CroreTaxRs 16,534 CroreRs 15,898 CroreRs 14,604 CroreRs 13,238 CroreRs 11,198 CroreNet ProfitRs 48,797 CroreRs 46,099 CroreRs 42,303 CroreRs 38,449 CroreRs 32,562 CroreThe sales have increased by 6 % in March 2025 compared to March 2024. The total expenditure has increased by 5.8 % in March 2025 compared to March 2024. Income Statement Quarterly:Jun 2025Mar 2025Dec 2024Sep 2024Jun 2024SalesRs 63,437 CroreRs 64,479 CroreRs 63,973 CroreRs 64,259 CroreRs 62,613 CroreOther IncomeRs 1,660 CroreRs 1,028 CroreRs 1,243 CroreRs 729 CroreRs 962 CroreTotal IncomeRs 65,097 CroreRs 65,507 CroreRs 65,216 CroreRs 64,988 CroreRs 63,575 CroreTotal ExpenditureRs 47,923 CroreRs 48,878 CroreRs 48,316 CroreRs 48,794 CroreRs 47,171 CroreEBITRs 17,174 CroreRs 16,629 CroreRs 16,900 CroreRs 16,194 CroreRs 16,404 CroreInterestRs 195 CroreRs 227 CroreRs 234 CroreRs 162 CroreRs 173 CroreTaxRs 4,160 CroreRs 4,109 CroreRs 4,222 CroreRs 4,077 CroreRs 4,126 CroreNet ProfitRs 12,819 CroreRs 12,293 CroreRs 12,444 CroreRs 11,955 CroreRs 12,105 CroreThe sales for June 2025 quarter stood at Rs 63,437 Crore compared to Rs 64,479 Crore for March 2025 quarter. The total expenditure stood at Rs 47,923 Crore for June 2025 quarter compared to Rs 48,878 Crore for March 2025 quarter. Cash Flow:Mar 2025Mar 2024Mar 2023Mar 2022Mar 2021Operating ActivitiesRs 48,908 CroreRs 44,338 CroreRs 41,965 CroreRs 39,949 CroreRs 38,802 CroreInvesting ActivitiesRs -2,318 CroreRs 6,026 CroreRs 39 CroreRs -897 CroreRs -8,129 CroreFinancing ActivitiesRs -47,438 CroreRs -48,536 CroreRs -47,878 CroreRs -33,581 CroreRs -32,634 CroreOthersRs 174 CroreRs 65 CroreRs 509 CroreRs 159 CroreRs 173 CroreNet Cash FlowRs -674 CroreRs 1,893 CroreRs -5,365 CroreRs 5,630 CroreRs -1,788 CroreBalance Sheet:Mar 2025Mar 2024Mar 2023Mar 2022Mar 2021Share CapitalRs 362 CroreRs 362 CroreRs 366 CroreRs 366 CroreRs 370 CroreReserves & SurplusRs 94,394 CroreRs 90,127 CroreRs 90,058 CroreRs 88,773 CroreRs 86,063 CroreCurrent LiabilitiesRs 53,001 CroreRs 46,104 CroreRs 43,558 CroreRs 42,351 CroreRs 34,155 CroreOther LiabilitiesRs 11,872 CroreRs 9,856 CroreRs 9,669 CroreRs 10,024 CroreRs 10,171 CroreTotal LiabilitiesRs 159,629 CroreRs 146,449 CroreRs 143,651 CroreRs 141,514 CroreRs 130,759 CroreFixed AssetsRs 22,739 CroreRs 19,336 CroreRs 19,891 CroreRs 20,716 CroreRs 20,149 CroreCurrent AssetsRs 123,012 CroreRs 112,984 CroreRs 110,270 CroreRs 108,310 CroreRs 99,280 CroreOther AssetsRs 13,878 CroreRs 14,129 CroreRs 13,490 CroreRs 12,488 CroreRs 11,330 CroreTotal AssetsRs 159,629 CroreRs 146,449 CroreRs 143,651 CroreRs 141,514 CroreRs 130,759 CroreContingent LiabilitiesRs 4,009 CroreRs 3,419 CroreRs 2,388 CroreRs 2,298 CroreRs 1,821 CroreKey Ratios:Mar 2025Mar 2024Mar 2023Mar 2022Mar 2021Basic EPS (Rs.)134.19125.88115.19103.6286.71Diluted Eps (Rs.)134.19125.88115.19103.6286.71Book Value [Excl. Reval Reserve]/Share (Rs.)261.76252.26249.20245.48235.43Dividend/Share (Rs.)126.0073.00115.0043.0038.00Face Value11111Gross Profit Margin (%)27.9528.5227.8129.7630.26Operating Margin (%)25.8926.4525.5827.3627.78Net Profit Margin (%)19.1119.1318.7620.0519.83Return on Networth / Equity (%)51.2450.7346.6142.9937.52ROCE (%)62.0163.5157.6352.9147.21Return On Assets (%)30.4131.3429.3327.0824.80Current Ratio (X)2.322.452.532.562.91Quick Ratio (X)2.322.452.532.562.91Debt to Equity (x)0.000.000.000.000.00Interest Coverage Ratios (X)89.6688.3380.5072.8077.99Asset Turnover Ratio (%)1.671.661.581.411.18Inventory Turnover Ratio (X)0.000.000.000.000.003 Yr CAGR Sales (%)15.3921.1319.8514.4215.483 Yr CAGR Net Profit (%)12.6618.9814.1810.3712.17P/E (x)26.8730.7927.8336.0936.65P/B (x)13.7715.5412.9815.3513.60EV/EBITDA (x)18.0820.2818.5523.6723.49P/S (x)5.115.845.207.147.16Corporate Actions: Tata Consultancy Services has announced several press releases including TCS Completes One Of UK''s Largest Policy Migrations For Lloyds Banking Group''s Scottish Widows on September 01, 2025. Additionally, the company announced Interim dividend of Rs.11.00 per share(1100%)Third Interim Dividend, with effective date as 16 Jul, 2025. The stock is a constituent of the Nifty 50 index."
Hindustan Unilever shares trade flat in today's session; over 3.4 lakh shares traded,https://www.moneycontrol.com/news/business/stocks/hindustan-unilever-shares-trade-flat-in-today-s-session-over-3-4-lakh-shares-traded-alpha-article-13515431.html,"Hindustan Unilever shares were trading flat in Wednesday's session, with the stock currently priced at Rs 2,674. This comes as over 3.4 lakh shares were traded. The stock is a constituent of the Nifty 50 index. On the NSE, 348,978 shares were traded. Regarding the company's financial performance, Hindustan Unilever has shown consistent growth in both quarterly and annual results. Consolidated revenue for the quarter-ending June 2025 stood at Rs 16,514 Crore, up from Rs 15,707 Crore in June 2024. The net profit for the same period was Rs 2,769 Crore, compared to Rs 2,614 Crore in the previous year. The EPS also increased from Rs 11.11 to Rs 11.73. The consolidated annual revenue for the year-ending March 2025 was Rs 63,121 Crore, an increase from Rs 61,896 Crore in the previous year. The net profit rose to Rs 10,679 Crore from Rs 10,286 Crore, and the EPS improved from Rs 43.74 to Rs 45.32.Financial YearRevenue (Rs Crore)Net Profit (Rs Crore)EPS (Rs)Mar 202563,12110,67945.32Mar 202461,89610,28643.74Mar 202360,58010,14543.07Mar 202252,4468,88737.79Mar 202147,0288,00034.03The annual income statement shows consistent growth. Sales increased from Rs 47,028 Crore in March 2021 to Rs 63,121 Crore in March 2025. Net profit also increased from Rs 8,000 Crore in March 2021 to Rs 10,679 Crore in March 2025.Income StatementMar 2025Mar 2024Mar 2023Mar 2022Mar 2021Sales63,12161,89660,58052,44647,028Other Income1,017811512258410Total Income64,13862,70761,09252,70447,438Total Expenditure49,32048,44347,63240,72436,715EBIT14,81814,26413,46011,98010,723Interest395334114106117Tax3,7443,6443,2012,9872,606Net Profit10,67910,28610,1458,8878,000The company’s cash flow from operating activities for the year-ending March 2025 was Rs 11,886 Crore, compared to Rs 15,469 Crore for the year-ending March 2024.Cash Flow FromMar 2025Mar 2024Mar 2023Mar 2022Mar 2021Operating Activities11,88615,4699,9919,0489,163Investing Activities6,473-5,324-1,494-1,728-1,528Financing Activities-13,101-10,034-8,953-8,015-9,309Others001000Net Cash Flow5,258111-446-695-1,674The balance sheet for March 2025 shows total liabilities of Rs 79,880 Crore and total assets of Rs 79,880 Crore. Key ratios include a debt-to-equity ratio of 0.00 and an interest coverage ratio of 40.17.Equities & LiabilitiesMar 2025Mar 2024Mar 2023Mar 2022Mar 2021Share Capital235235235235235Reserves & Surplus49,16750,98350,06948,82647,439Current Liabilities16,53712,87612,02811,28011,103Other Liabilities13,94114,40510,75510,1769,980Total Liabilities79,88078,49973,08770,51768,757Hindustan Unilever announced several corporate actions. The company announced a final dividend of Rs 24 per share (2400%) on April 24, 2025, with an effective date of June 23, 2025. Additionally, there was a bonus issue on September 30, 1991, with a bonus ratio of 1:2 and an ex-bonus date of July 19, 1991. The company also had a stock split on July 5, 2000, where the old face value of Rs 10 was split to a new face value of Rs 1. Moneycontrol analysis indicates a very bullish sentiment for Hindustan Unilever as of September 3, 2025. With the stock's last traded price at Rs 2,674.00, Hindustan Unilever witnessed trading of over 3.4 lakh shares on the NSE."
Larsen & Toubro shares gain marginally in today's session; over 4.2 lakh shares traded,https://www.moneycontrol.com/news/business/stocks/larsen-toubro-shares-gain-marginally-in-today-s-session-over-4-2-lakh-shares-traded-alpha-article-13515425.html,"Larsen & Toubro's stock was trading at Rs 3,583.00 on Wednesday, up 0.23% from the previous close. Around 11:20 am, over 4.2 lakh shares were traded on the NSE. Financial Snapshot: The following table presents Larsen & Toubro's key financial data:Financial YearRevenue (Rs Crore)Net Profit (Rs Crore)EPS (Rs)2021135,979.034,668.9682.492022156,521.2310,291.0561.712023183,340.7012,624.8774.512024221,112.9115,569.7293.962025255,734.4517,687.39109.36The revenue for Larsen & Toubro increased significantly from Rs 135,979.03 Crore in 2021 to Rs 255,734.45 Crore in 2025. Similarly, the net profit rose from Rs 4,668.96 Crore in 2021 to Rs 17,687.39 Crore in 2025. Earnings per share (EPS) also saw an increase, moving from Rs 82.49 in 2021 to Rs 109.36 in 2025.ParticularsMar 2021Mar 2022Mar 2023Mar 2024Mar 2025Share Capital1,404496281274275Reserves & Surplus75,20481,75588,57785,53397,380Current Liabilities137,408159,433162,065176,600201,970Other Liabilities97,25778,36379,42777,21779,897Total Liabilities311,273320,048330,352339,627379,524Fixed Assets36,75236,50937,90738,20738,295Current Assets194,966208,181222,204218,079245,341Other Assets79,55475,35870,24083,33995,886Total Assets311,273320,048330,352339,627379,524Contingent Liabilities21,54023,02019,62021,24628,086Quarterly Financial Highlights: The revenue for the quarter-ending June 2025 was Rs 63,678.92 Crore, compared to Rs 55,119.82 Crore in June 2024. The net profit for the quarter-ending June 2025 was Rs 4,325.57 Crore, up from Rs 3,440.11 Crore in the same quarter last year.QuarterRevenue (Rs Crore)Net Profit (Rs Crore)EPS (Rs)Jun 202455,119.823,440.1120.26Sep 202461,554.584,112.8124.69Dec 202464,667.784,001.0324.43Mar 202574,392.286,133.4439.98Jun 202563,678.924,325.5726.30Key Financial Ratios: The basic EPS stood at Rs 109.36 as of March 2025, compared to Rs 82.49 in March 2021. The debt to equity ratio was 1.33 as of March 2025.RatioMar 2021Mar 2022Mar 2023Mar 2024Mar 2025Basic EPS (Rs.)82.4961.7174.5193.96109.36Book Value /Share (Rs.)625.97678.79736.87746.01710.12Dividend/Share (Rs.)36.0022.0024.0034.0034.00Debt to Equity (x)1.731.501.331.321.33P/E (x)17.2028.6429.0540.0631.93P/B (x)2.633.013.416.014.92Corporate Actions: Larsen & Toubro announced a final dividend of Rs 34 per share (1700%) on May 8, 2025, with an effective date of June 3, 2025. The company had also announced bonus issues in the past, including a 1:2 bonus on May 29, 2017, with an ex-bonus date of July 13, 2017. Overall, Larsen & Toubro saw over 4.2 lakh shares traded and is a constituent of the Nifty 50 index."
ITC shares gain in today's session; over 52.1 lakh shares traded,https://www.moneycontrol.com/news/business/stocks/itc-shares-gain-in-today-s-session-over-52-1-lakh-shares-traded-alpha-article-13515421.html,"Shares of ITC were trading higher in Wednesday's session, with the stock currently priced at Rs 408.85 on the NSE. At 11:20 am, the stock registered a gain of 0.52% from its previous close, with over 52.1 lakh shares traded. Financial Highlights ITC's financial performance shows consistent growth in revenue and net profit. Here's an overview of the company's consolidated financial results: Quarterly Results: The quarterly results show a steady increase in revenue. The revenue for the quarter-ending June 2025 stood at Rs 21,494.79 Crore, compared to Rs 18,457.33 Crore for the quarter-ending June 2024. Net profit for the same period was Rs 5,274.65 Crore, up from Rs 5,169.37 Crore.HeadingJun 2024Sep 2024Dec 2024Mar 2025Jun 2025RevenueRs 18,457.33 CroreRs 19,990.36 CroreRs 18,790.17 CroreRs 18,765.00 CroreRs 21,494.79 CroreNet ProfitRs 5,169.37 CroreRs 5,050.28 CroreRs 5,009.08 CroreRs 19,709.47 CroreRs 5,274.65 CroreEPS4.083.993.9515.774.19Annual Results: The annual results demonstrate consistent growth in revenue. The revenue for the year-ending March 2025 was Rs 75,323.34 Crore, an increase compared to Rs 70,881.00 Crore for the year-ending March 2024. Net profit stood at Rs 19,926.05 Crore for the year-ending March 2025, slightly less than Rs 20,723.75 Crore for the year-ending March 2024.Heading20212022202320242025RevenueRs 49,272.78 CroreRs 60,668.09 CroreRs 70,936.85 CroreRs 70,881.00 CroreRs 75,323.34 CroreNet ProfitRs 13,389.80 CroreRs 15,485.65 CroreRs 19,427.68 CroreRs 20,723.75 CroreRs 19,926.05 CroreEPS10.7012.3715.5016.4227.79BVPS49.3150.9855.9559.9955.96ROE21.8024.4027.7527.4549.61Debt to Equity0.000.000.000.000.00The company has also demonstrated consistent performance in its income statement. Sales for the year-ending March 2025 stood at Rs 75,323 Crore, compared to Rs 70,881 Crore for the year-ending March 2024. The net profit increased from Rs 13,389 Crore in March 2021 to Rs 19,926 Crore in March 2025. Consolidated Yearly Income Statement:Mar 2025Mar 2024Mar 2023Mar 2022Mar 2021Sales75,32370,88170,93660,66849,272Other Income2,5292,7271,9801,8362,632Total Income77,85373,60872,91762,50451,905Total Expenditure50,99146,45047,00841,74233,915EBIT26,86127,15825,90920,76217,989Interest4545433944Tax6,8906,3886,4385,2374,555Net Profit19,92620,72319,42715,48513,389Consolidated Quarterly Income Statement:Jun 2025Mar 2025Dec 2024Sep 2024Jun 2024Sales21,49418,76518,79019,99018,457Other Income682640595610694Total Income22,17719,40519,38620,60119,152Total Expenditure15,10112,65612,84413,85412,210EBIT7,07521,4016,7456,8226,941Interest161091411Tax1,7841,6801,7261,7571,761Net Profit5,27419,7095,0095,0505,169Consolidated Balance Sheet:Mar 2025Mar 2024Mar 2023Mar 2022Mar 2021Share Capital1,2511,2481,2421,2321,230Reserves & Surplus68,77872,75067,17159,90657,409Current Liabilities14,33413,69013,73912,16310,689Other Liabilities3,7264,1363,7293,9564,488Total Liabilities88,09091,82685,88277,25973,819Fixed Assets22,14829,90128,07426,67726,530Current Assets43,89341,06539,67034,23234,991Other Assets22,04820,85918,13716,34912,297Total Assets88,09091,82685,88277,25973,819Contingent Liabilities2,1872,2923,0933,2053,527Consolidated Cash Flow:Mar 2025Mar 2024Mar 2023Mar 2022Mar 2021Operating Activities17,62717,17818,87715,77512,527Investing Activities-3951,562-5,732-2,2385,682Financing Activities-17,037-18,550-13,006-13,580-18,633Others-16800056Net Cash Flow25190139-43-366Key financial ratios for ITC as of March 2025 include a basic EPS of Rs 27.79, diluted EPS of Rs 27.75, and a book value per share of Rs 55.96. The company’s debt-to-equity ratio is 0.00.Mar 2025Mar 2024Mar 2023Mar 2022Mar 2021Basic EPS (Rs.)27.7916.4215.5012.3710.70Diluted Eps (Rs.)27.7516.3815.4612.3710.70Book Value [Excl. Reval Reserve]/Share (Rs.)55.9659.9955.9550.9849.31Dividend/Share (Rs.)14.3513.7515.5011.5010.75Face Value11111Corporate Actions ITC has announced and executed several corporate actions, including dividend payouts and bonus issues. The company announced a final dividend of Rs 7.85 per share (785%) on May 22, 2025, which was effective from May 28, 2025. Prior to that, an interim dividend of Rs 6.50 per share (650%) was announced on February 6, 2025, and was effective from February 12, 2025. The company had a stock split on September 21, 2005 where old FV was 10 and new FV was 1. Dividends Declared:Announce DateDividend TypeDividend PerEffective DateRemarksDividend Amount2025-05-22Final78528 May, 2025Rs.7.8500 per share(785%)Final Dividend7.852025-02-06Interim65012 Feb, 2025Rs.6.5000 per share(650%)Interim Dividend6.502024-05-23Final75004 Jun, 2024Rs.7.5000 per share(750%)Final Dividend7.502024-01-29Interim62508 Feb, 2024Rs.6.2500 per share(625%)Interim Dividend6.252023-05-18Final67530 May, 2023Rs.6.7500 per share(675%)Final Dividend6.75With the stock's last traded price at Rs 408.85, ITC shows a slight increase from its previous close and is actively traded on the NSE."
