title,link,content
Axis Bank Q1 earnings hurt by higher slippages from one-time technical adjustments,https://www.moneycontrol.com/news/business/earnings/axis-bank-q1-earnings-hurt-by-higher-slippages-from-one-time-technical-adjustments-13291439.html,"Axis Bank reported a 4 percent year-on-year drop in net profit, which stood at Rs 6,034 crore for the June quarter (Q1FY26). The decline was due to a one-time “technical impact”, which affected how the bank recognised slippages and upgrades. The bank explained that it applied new technical parameters for recognising certain accounts as slippages or upgrades, which led to higher reported slippages for the quarter. “This technical impact is largely limited to cash credit and overdraft accounts, and to accounts that have been given one-time settlements,” said Puneet Sharma, Chief Financial Officer at Axis Bank during the post-results conference call. “Because of this, the reported numbers for gross slippages, net slippages, credit costs, NPA ratios, ROA, and ROE are not directly comparable with the figures from previous quarters or the same period last year,” he clarified. ALSO READ: Axis Bank Q1 results: Net profit declines 4% to Rs 5,806 crore, NII marginally up The bank pointed out that without this one-time adjustment, the net profit would have been stronger. The technical impact reduced profit after tax (PAT) by Rs 614 crore, brought down return on assets (ROA) by 15 basis points, and return on equity (ROE) by 1.4 percent. Providing more details, Sharma noted that reported gross slippages for the quarter were Rs 8,200 crore, of which about Rs 2,709 crore was due to the technical impact. This technical impact accounted for 1.03 percent of gross slippages in value terms. If we exclude the technical impact, gross slippages rose by 13 basis points year-on-year and by 20 basis points compared to the previous quarter. Breaking it down further, the technical impact on gross slippages was Rs 2,165 crore from the retail segment, Rs 234 crore from the wholesale segment, and Rs 310 crore from the commercial banking group (CBG). Similarly, on the net slippages side, Rs 1,861 crore was due to the technical impact, making up 0.71 percent of net slippages for the quarter in value terms. After adjusting for the technical impact, the net slippage was Rs 4,192 crore. The reported net slippage ratio, annualised for Q1FY26, was 2.33 percent, but when adjusted for the technical impact, it was 1.62 percent. Disclaimer: The views and investment tips expressed by investment experts on Moneycontrol.com are their own and not those of the website or its management. Moneycontrol.com advises users to check with certified experts before taking any investment decisions."
"Wealth manager 360 One WAM grows net profit by 16 percent to Rs 285 crore, AUM at Rs 6.64 lakh crore",https://www.moneycontrol.com/news/business/earnings/wealth-manager-360-one-wam-grows-profit-by-16-percent-at-rs-285-crore-aum-at-rs-6-64-lakh-crore-13291235.html,"Wealth management firm 360 ONE WAM reported a consolidated net profit growth of 16.8 percent YoY at Rs 285 crore, and a revenue from operations grew by 7.3 percent on year to Rs 911.5 crore, a company filing said on July 17. Margins at 62% were higher QoQ but lower on YoY basis in a quarter marked by recovery in equity markets after initial volatility due to Trump tariffs at the start of April 2025. The Asset Under Management with 360 One was at Rs 6.64 lakh crore, with the ARR AUM rising to Rs 1.95 lakh crore, growing by 38% on year on growth across segments. ARR AUM stands for Annuitized Recurring Revenue Assets Under Management, or the portion of Asset Under Management that generates stable, recurring revenue, usually through advisory or management fees. 360 One said during Q1FY26, the wealth manager onboarded over 200 families with more than Rs 10 crore as ARR AUM, taking the client base for this space to over 4,200, accounting for 95 percent of wealth AUM. Karan Bhagat, MD & CEO, 360 One WAM said, ""This quarter marks a period of strong core momentum and strategic consolidation. While talent continues to remain our biggest bedrock, the recent inorganic initiatives, including the acquisition of B&K Securities and collaboration with UBS, have significantly strengthened our ability to deliver an integrated, full-spectrum platform by combining deep advisory, research, and execution capabilities."" Bhagat added that the foundational levers are now in place for 'sustained growth' that will lead to a 'long-term value creation' for all stakeholders. During the March quarter, 360 ONE WAM and leading global wealth manager UBS AG entered into an exclusive strategic collaboration where clients from both institutions got access to wealth management solutions. Both entities are also exploring opportunities for deep co-operation in asset management and capital markets too. Earlier this year, 360 ONE WAM had acquired Batlivala & Karani Securities in order to grow presence across broking, capital markets, merchant banking, and corporate treasury, along with wealth and alternate asset management. India is one of the fastest-growing wealth markets with 2.83 lakh HNIs with over $5 million in assets, a report by Kotak Private said in 2023, which is expected to rise by 52 percent to 4.30 lakh individuals by 2028."
"HDFC Bank Q1 Preview: NII to grow in single-digit amid slower loan growth, margins may compress",https://www.moneycontrol.com/news/business/earnings/hdfc-bank-q1-preview-nii-to-grow-in-single-digits-amid-slower-loan-growth-margins-may-compress-13290731.html,"India's largest private lender HDFC Bank is likely to see single-digit net interest income (NII) and profit growth amid soft loan growth, while margins are expected to remain under pressure due to faster repricing of loans on account of interest rate cuts, said analysts. The bank will report Q1 results on July 19, 2025. According to Moneycontrol's poll, HDFC Bank’s net interest income is likely to rise 7 percent year-on-year, reaching about Rs 31,885 crore in Q1FY26, compared to Rs 29,837 crore in the same period last year. The bank’s profit after tax (PAT) is also projected to grow modestly by 7.4 percent, to approximately Rs 17,385 crore, up from Rs 16,174 crore a year ago.  Estimates of analysts polled by Moneycontrol are shown to be in a narrow range, meaning any positive or negative surprises may elicit a sharp reaction in the stock price. Among the brokerages polled, Kotak Institutional Equities rolled out the most bullish projections while Equirus Research forecasted the slowest growth for HDFC Bank. What factors are driving the earnings? Fast deposit growth, but slower credit offtake: HDFC Bank reported that its average gross advances stood at about Rs 26 lakh crore as of June 30, 2025, showing a growth of roughly 6.7 percent over Rs 24 lakh crore in the year-ago period. Meanwhile, deposits rose more sharply, climbing 16.2 percent to Rs 27.6 lakh crore from Rs 24 lakh crore as of June 30, 2024. Margin compression: Analysts at Kotak believe that the bank’s net interest margin (NIM) is likely to drop by 31 basis points year-on-year, settling at 3.4 percent in Q1FY26 compared to 3.5 percent a year earlier. This is due to quicker loan repricing during the quarter. Higher provisions: Provisions are expected to be higher sequentially, as the bank plans to use the gains from the sale of shares in HDB Financial Services to increase floating provisions. Systematix Institutional Equities noted that HDFC Bank will book a one-time gain of Rs 9,373 crore from HDB’s IPO and may allocate around Rs 6,000 crore for additional prudential provisions. What should investors keep an eye on this quarter? Investors are likely to focus on deposit growth, loan growth, and margin trends to assess the bank’s outlook. During the April-June period, shares of HDFC Bank gained 9 percent, outperforming the benchmark Nifty 50 index, which rose 5 percent during the same time. Disclaimer: The views and investment tips expressed by investment experts on Moneycontrol.com are their own and not those of the website or its management. Moneycontrol.com advises users to check with certified experts before taking any investment decisions."
"Taking Stock: Nifty snaps two-day gains to end near 25,100; Sensex down as IT, banks drag",https://www.moneycontrol.com/news/business/markets/taking-stock-nifty-snaps-two-day-gains-to-end-near-25100-sensex-down-as-it-banks-drag-13289824.html,"Benchmark indices snapped a two-day gaining streak, erasing most of the previous two-session gains on selling in the IT and banking names, tracking weakness in June quarter earnings. Markets were under pressure in the opening hours, however, despite a mid-session recovery, the extended selling in the last hour of trade dragged the Nifty index closer to 25,100. On Friday, July 18, markets will react to the results of Axis Bank and Wipro. At close, the Sensex was down 375.24 points or 0.45 percent at 82,259.24, and the Nifty was down 100.60 points or 0.40 percent at 25,111.45. The broader indices outperformed the main indices with midcap index finishing on flat note, while smallcap index added 0.25 percent. Also Read: Axis Bank Q1 Preview: NII, profit to grow in low single-digits as loan growth slows, margins shrink The biggest Nifty losers were Tech Mahindra, IndusInd Bank, Infosys, SBI Life Insurance, Wipro, while gainers included Tata Consumer, Tata Steel, Hindalco Industries, Trent, M&M. On the sectoral front, IT, PSU Bank shed 0.5-1 percent, while metal, consumer durables, realty indices added 0.5-1 percent. Read More: Prashant Jain’s 3P Fund hikes stakes in financials, energy; pares IT on growth and valuation worries In stock-specific action, Arvind Fashions shares gained 7 percent on appointment of Amisha Jain as new MD & CEO, Le Travenues Technology (Ixigo) shares zoomed 20 percent after Q1 consolidated profit jumped 27%, PNC Infratech shares gained more than 2 percent on winning solar project from NHPC, Sona BLW shares jumped 6 percent on report of advanced talks to supply electric vehicle components to China’s BYD, Heritage Foods shares fell 3 percent after Q1 profit declined 30% on year, and Navkar Corporation shares jumped 13 percent on turning profitable in Q1FY26. More than 140 stocks on the BSE touched their 52-week highs, including Nippon Life India Asset Management, Schneider Infra, JK Lakshmi Cement, Asahi India, Global Health, HDFC AMC, MRF, RBL Bank, Ramco Cements, Nuvoco Vistas, Anand Rathi, among others. Click to View More New Listing Smartworks Coworking Spaces shares ended with 9 percent gain after making debut with nearly 7 percent premium over the IPO price. The Rs 583-crore initial public offer garnered 13.45 times subscription in the primary market between July 10-14 at a price band of Rs 387-407 per share. Outlook for July 18 Shrikant Chouhan, Head Equity Research, Kotak Securities: Today, the benchmark indices witnessed profit booking at higher levels. The Nifty ends 101 points lower, while the Sensex was down by 375 points. Among sectors, the Reality index was the top gainer, rallied 1.23 percent, whereas the IT index lost the most, shed 1.50 percent. Technically, after a muted open, the market has been consistently facing selling pressure at higher levels. The Nifty/Sensex has formed a bearish candle on daily charts and a lower top formation on intraday charts, which is largely negative. We are of the view that, as long as the market is trading below 25,200/82,500, the weak sentiment is likely to continue. On the downside, the 50-day SMA (Simple Moving Average) at 25,000/82,000 would be the immediate support level. Below 25,000/82,000, the chances of hitting 24,900-24,850/81,600-81,500 would increase. On the upside, a break above 25,200/82,500 could lead the market to retest the levels of 25,280/82,800. A successful breakout above 25,280/82,800 could push the market up to 25,350-25,425/83,000-83,300. Rupak De, Senior Technical Analyst at LKP Securities Nifty remained mostly under selling pressure throughout the day as the index failed to move beyond the crucial resistance level of 25,260, leading to long unwinding. On the hourly chart, a consolidation breakout is visible, indicating weakening bullish momentum. The current sentiment appears bearish and may drag Nifty towards the 24,920–24,900 zone in the short term. On the higher side, 25,260 is likely to remain a strong resistance. Disclaimer: The views and investment tips expressed by experts on Moneycontrol.com are their own and not those of the website or its management. Moneycontrol.com advises users to check with certified experts before taking any investment decisions."
Gainers & Losers: Top stocks that moved the most on July 17,https://www.moneycontrol.com/news/business/markets/gainers-losers-top-stocks-that-moved-the-most-on-july-17-13289676.html,"Nifty snapped its two day gaining streak and slipped below 25,150-mark. Amongst sectors, Nifty Realty was the top performer while Nifty IT was the top laggard. Emcure Pharma | CMP: Rs 1,361 | Emcure Pharmaceuticals erased gains after rising 2 percent in intra-day deals on July 17 after it signed a deal with Sanofi India to distribute and promote Sanofi’s oral anti-diabetic drugs, including Amaryl and Cetapin, across India. The collaboration aims to expand access to trusted diabetes therapies through Emcure’s strong national network. Le Travenues Tech | CMP: Rs 214 | Le Travenues Tech, the operator of online travel portal Ixigo, hit 20 percent upper circuit, recording all-time highs after the June quarter results showed strong growth, led by faster-than-expected growth in bus and flight bookings with a Gross Transaction Value (GTV) growth of 55 percent on year. Realty stocks | The Nifty Realty index extended its winning streak for the fourth consecutive day, rising over 1 percent on July 17 in an otherwise subdued market. Nearly nine out of ten index constituents were trading in the green, with Prestige Estates, Sobha, and Brigade Enterprises gaining between 1–2 percent in intraday trade. Sterlite Technologies | CMP: Rs 118 | Shares of Sterlite Technologies continued their winning streak for a second straight day, climbing as much as 7 percent to touch a fresh 52-week high of Rs 122 per share on July 17. The stock gained after the company announced a collaboration with Hygenco to set up Maharashtra's first green hydrogen production facility for optical fibre manufacturing. Tech Mahindra | CMP: Rs 1,564 | Information and technology player Tech Mahindra Ltd (TechM) shares fell by over 2 percent after the Mahindra Group company posted its earnings results for the three months ended June 30, 2025. Brokerages remained mixed on their outlook for the firm following strong deal wins during the quarter, while the revenue came in under estimates. Sona BLW | CMP: Rs 484 | Shares of Sona BLW Precision Forgings sharply surged over 8 percent on July 17 after a report said that Chinese automaker BYD is in talks with the company for the supply of EV components. The Indian company may also set up a local component manufacturing plant in China, CNBC-TV18 reported. Talks between Sona BLW and BYD have been ongoing for the past few months now, and the local component manufacturing plant in China is part of Sona BLW's long term roadmap. Angel One | CMP: Rs 2,730 | Capital markets player Angel One shares traded with gains on July 17, even after the firm reported a steep fall in net profit following regulator Securities and Exchange Board of India's crackdown on retail trading in the derivatives segment. Navkar Corporation | CMP: Rs 129 | Navkar Corporation shares rose 12 percent on July 17 after it reported healthy first-quarter results, with the company swinging back to profitability after posting losses in the same period last year. The performance was aided by higher revenue and a sharp improvement in operating margins, which boosted investor sentiment. Thermax | CMP: Rs 3,893 | Shares of Thermax rose up to 12% after brokerage firm Kotak Institutional Equities retained an 'Add' rating on the stock, saying the company is walking the talk. L&T Tech | CMP: Rs 4,419 | The stock rose over a percent on July 17 after the firm reported its quarterly earnings show for June 30, 2025, with net profit supported by a strong tax return. LTTS posted a slight 0.7 percent year-on-year rise in consolidated net profit for Q1 FY26 at Rs 316 crore, compared to Rs 314 crore in the same quarter last year. Revenue from operations grew 16 percent year-on-year to Rs 2,866 crore from Rs 2,462 crore."
Fortis Healthcare shares rise 2.06%; among top gainers on Nifty Midcap 150,https://www.moneycontrol.com/news/business/stocks/fortis-healthcare-shares-rise-2-06-among-top-gainers-on-nifty-midcap-150-alpha-article-13290341.html,"Shares of Fortis Healthcare  gained 2.06%, trading at Rs 811.55 on Thursday's session. This increase positions the stock among the top gainers on the Nifty Midcap 150. Fortis Healthcare's financial performance shows consistent growth. The consolidated revenue for the quarter-ending March 2025 stood at Rs 2,007.20 Crore, compared to Rs 1,785.88 Crore in March 2024. Net profit for the same period was Rs 183.38 Crore, while in March 2024, it was Rs 198.82 Crore. The EPS stood at Rs 2.44 in March 2025, compared to Rs 2.37 in March 2024. Here's a detailed look at Fortis Healthcare's quarterly financials:HeadingMar 2024Jun 2024Sep 2024Dec 2024Mar 2025RevenueRs 1,785.88 CroreRs 1,858.90 CroreRs 1,988.39 CroreRs 1,928.26 CroreRs 2,007.20 CroreNet ProfitRs 198.82 CroreRs 173.39 CroreRs 188.85 CroreRs 252.24 CroreRs 183.38 CroreEPS2.372.202.343.282.44The company's annual financial performance also shows positive trends. Revenue for the year-ending March 2025 increased to Rs 7,782.75 Crore from Rs 6,892.92 Crore in March 2024. Net profit rose to Rs 797.86 Crore in March 2025, compared to Rs 635.71 Crore in March 2024. The EPS increased to Rs 10.26 in March 2025, up from Rs 7.93 in March 2024. Here's an overview of Fortis Healthcare's yearly financials:Heading20212022202320242025RevenueRs 4,030.12 CroreRs 5,717.61 CroreRs 6,297.63 CroreRs 6,892.92 CroreRs 7,782.75 CroreNet Profit-103.73 CroreRs 765.80 CroreRs 611.15 CroreRs 635.71 CroreRs 797.86 CroreEPS-1.457.357.807.9310.26BVPS88.9892.83107.30113.33118.11ROE-1.798.988.127.818.68Debt to Equity0.190.160.100.110.25Fortis Healthcare announced dividend updates on July 14, 2025, regarding the final dividend. The company announced a final dividend of Rs 1.00 per share (10%) and the previous announcement was made on May 20, 2025. Also, dividend of Rs 1.00 per share was announced on May 24, 2023 with effective date of July 20, 2023. With the stock's last traded price at Rs 811.55, Fortis Healthcare is among the top gainers on the Nifty Midcap 150 in today's session."
