title,link,content
Silver's record rally past $40 has rubbed off on shares of key suppliers like Hindustan Zinc,https://www.moneycontrol.com/news/business/markets/silver-s-record-rally-past-40-has-rubbed-off-on-shares-of-key-suppliers-like-hindustan-zinc-13511373.html,"For the first time since 2011, international silver prices are above $40 per ounce, tracking renewed investor interest in precious metals, with the extended run sparking interest in shares of suppliers and clean energy companies. Last month alone, silver prices surged over 10 percent, and the continued rally has rubbed off on the shares of Indian companies engaged in related businesses such as Hindustan Zinc, Vedanta and Goldiam International, anticipating earnings boost from a surge in industrial as well as investor demand. Shares of Hindustan Zinc are higher by around 1.5 percent in trade after a 3.9 percent surge a day before, with Vedanta's shares too sharply off early lows. In the past five trading session, shares of Goldiam International, a jewellery exporter, are higher by over 11 percent. The rally in silver has followed the surge in gold prices, which topped $3,500 per ounce - a record high - on rising hopes of a rate cut by US Federal Reserve, and strong safe haven buying amid global uncertainties. So far this year, silver prices have soared more than 40 percent. Lower borrowing cost in US is expected to benefit precious metals. The recent, sharp weakness in Rupee, testing record low of 88/USD too is likely to benefit major exporters' earnings. Fund flow into silver ETFs too have strengthened recently, with Nippon’s India silver ETF crossing Rs 10,000 crore AUM mark, tracking global momentum and domestic demand projections ahead of the festive season. Globally, silver ETF holdings have grown for a seventh consecutive month in August, the longest run since 2020. One of key beneficiaries, Hindustan Zinc is the world's third largest silver producer with an output of 687 MT of silver in FY25, and a planned target to ramp up capacity to 1500 MT by 2030. The management sees silver prices staying buoyant in the coming quarters, with its precious metal portfolio contributing significantly to the overall profitability. Hindustan Zinc has also announced India’s first zinc tailings reprocessing plant at an investment of Rs 3,823 crore to recover high-value zinc and silver from discarded material."
INDUS TOWERS share price falls 2.03% in Tuesday's session,https://www.moneycontrol.com/news/business/stocks/indus-towers-share-price-falls-2-03-in-tuesday-s-session-alpha-article-13511360.html,"Shares of INDUS TOWERS declined by 2.03% to Rs 332.50 in Tuesday's session, with the stock trading on the NSE. . The stock is a constituent of the Nifty Midcap 150 index. Financial Performance: INDUS TOWERS has demonstrated steady financial performance over the past year. Here’s a look at the company’s consolidated quarterly and annual results: Consolidated Quarterly Results:HeadingJun 2024Sep 2024Dec 2024Mar 2025Jun 2025RevenueRs 7,383.00 CroreRs 7,465.30 CroreRs 7,547.40 CroreRs 7,727.10 CroreRs 8,057.60 CroreNet ProfitRs 1,925.90 CroreRs 2,223.50 CroreRs 4,003.20 CroreRs 1,779.10 CroreRs 1,736.80 CroreEPS7.158.3015.186.756.59The revenue for the quarter-ending June 2025 stood at Rs 8,057.60 Crore, marking an increase from Rs 7,383.00 Crore in June 2024. The net profit for the same period was Rs 1,736.80 Crore, slightly down from Rs 1,925.90 Crore in the previous year. Earnings per share (EPS) decreased from 7.15 in June 2024 to 6.59 in June 2025. Consolidated Yearly Results:Heading20212022202320242025RevenueRs 13,954.30 CroreRs 27,717.20 CroreRs 28,381.80 CroreRs 28,600.60 CroreRs 30,122.80 CroreNet ProfitRs 2,912.70 CroreRs 6,373.10 CroreRs 2,040.00 CroreRs 6,036.20 CroreRs 9,931.70 CroreEPS17.5223.657.5722.4037.31BVPS58.9182.1978.33100.33123.19ROE23.8028.779.6622.3230.56Debt to Equity0.440.250.220.160.07The annual revenue for the year-ending March 2025 increased to Rs 30,122.80 Crore from Rs 28,600.60 Crore in the previous year. Net profit also saw a substantial rise, increasing from Rs 6,036.20 Crore in 2024 to Rs 9,931.70 Crore in 2025. The Earnings per share (EPS) rose from 22.40 in 2024 to 37.31 in 2025. The debt to equity ratio has improved from 0.16 in March 2024 to 0.07 in March 2025. Corporate Actions Indus Towers Limited has been actively involved in several corporate actions. On September 1, 2025, the company reported the voting results and scrutinizer report pertaining to the 19th Annual General Meeting. On August 29, 2025, the company informed the exchange about the proceedings of the 19th Annual General Meeting. Furthermore, on August 28, 2025, Indus Towers announced the appointment of Mr. Vineet Jain as Chief Supply Chain Management Officer, effective September 3, 2025. The company announced an interim dividend of Rs 11.00 per share (110%) on May 5, 2022, with the effective date being May 13, 2022. Prior to this, an interim dividend of Rs 17.82 per share (178.20%) was announced on January 28, 2021, and was effective from February 8, 2021. Moneycontrol analysis, as of August 26, 2025, indicates a very bearish sentiment on the stock. With the stock's last traded price at Rs 332.50, INDUS TOWERS experienced a decline of 2.03% in today's session."
Peterhouse Investments Reduces Stake in Usha Martin to 1.90%,https://www.moneycontrol.com/news/business/stocks/peterhouse-investments-reduces-stake-in-usha-martin-to-1-90-alpha-article-13511362.html,"Peterhouse Investments India Ltd disclosed its shareholding in Usha Martin Limited on August 29, 2025, in compliance with SEBI SAST Regulations, 2011. Prior to the transaction, Peterhouse Investments held 5,966,529 equity shares, representing 1.95% of the total share/voting capital of Usha Martin. The firm executed a sale of 150,000 equity shares through the open market on the National Stock Exchange on August 28, 2025. This reduced its stake to 5,816,529 shares, now equivalent to 1.90% of the total share/voting capital. Usha Martin's equity share capital/total voting capital remains unchanged at 30,47,41,780 before and after the reported transaction. Shareholding Details of Peterhouse Investments India LtdParticularsBefore Acquisition/DisposalAcquisition/SaleAfter Acquisition/SaleShares carrying voting rights5,966,529 Equity Shares (1.95%)Sale of 150,000 Equity Shares (0.05%)5,816,529 (1.90%) The sale was conducted via open market transactions on the National Stock Exchange. Total diluted share/voting capital post-transaction remains at 30,47,41,780."
The Tata Power Company shares rise 2.01% in today's trading,https://www.moneycontrol.com/news/business/stocks/the-tata-power-company-shares-rise-2-01-on-nifty-next-50-alpha-article-13511283.html,"Shares of The Tata Power Company gained 2.01% to trade at Rs 388.20 in Tuesday's session. The stock is a constituent of the Nifty Next 50 index. On September 2, 2025, The Tata Power Company informed the exchanges that the company would be attending the Motilal Oswal Global Investor Conference in Mumbai.Financial SnapshotHere's a look at the consolidated financial performance of The Tata Power Company:Quarterly ResultsThe company's quarterly performance shows a fluctuating trend in revenue and net profit. Revenue for the quarter-ending June 2025 stood at Rs 18,035.07 Crore, an increase compared to Rs 17,293.62 Crore in June 2024. Net profit for the same period was Rs 1,132.69 Crore, up from Rs 899.22 Crore in the corresponding quarter of the previous year.HeadingJun 2024Sep 2024Dec 2024Mar 2025Jun 2025RevenueRs 17,293.62 CroreRs 15,697.67 CroreRs 15,391.06 CroreRs 17,095.88 CroreRs 18,035.07 CroreNet ProfitRs 899.22 CroreRs 858.00 CroreRs 1,001.36 CroreRs 1,223.44 CroreRs 1,132.69 CroreEPS3.042.903.223.263.31Annual ResultsThe Tata Power Company has demonstrated consistent growth in its annual financial performance. The company's revenue increased by 6.56% to Rs 65,478.24 Crore for the year-ending March 2025, compared to Rs 61,448.90 Crore for the year-ending March 2024. The net profit also saw a significant rise, reaching Rs 3,982.04 Crore in March 2025 from Rs 3,102.53 Crore in March 2024.Heading20212022202320242025RevenueRs 32,468.10 CroreRs 42,815.67 CroreRs 55,109.08 CroreRs 61,448.90 CroreRs 65,478.24 CroreNet ProfitRs 611.46 CroreRs 680.61 CroreRs 610.21 CroreRs 3,102.53 CroreRs 3,982.04 CroreEPS3.175.3610.4311.5612.42BVPS74.3281.4590.08101.25112.16ROE5.417.7511.5811.4211.07Debt to Equity1.852.121.701.531.62Income StatementThe annual income statement provides insights into The Tata Power Company's financial health and operational efficiency. Sales for the year-ending March 2025 reached Rs 65,478 Crore, compared to Rs 61,448 Crore in the previous year. The company's EBIT (Earnings Before Interest and Taxes) stood at Rs 10,228 Crore for the year-ending March 2025.Mar 2025Mar 2024Mar 2023Mar 2022Mar 2021SalesRs 65,478 CroreRs 61,448 CroreRs 55,109 CroreRs 42,815 CroreRs 32,468 CroreOther IncomeRs 1,513 CroreRs 1,823 CroreRs 1,438 CroreRs 919 CroreRs 439 CroreTotal IncomeRs 66,992 CroreRs 63,272 CroreRs 56,547 CroreRs 43,735 CroreRs 32,907 CroreTotal ExpenditureRs 56,763 CroreRs 54,084 CroreRs 49,917 CroreRs 38,816 CroreRs 27,783 CroreEBITRs 10,228 CroreRs 9,187 CroreRs 6,629 CroreRs 4,919 CroreRs 5,123 CroreInterestRs 4,702 CroreRs 4,633 CroreRs 4,371 CroreRs 3,859 CroreRs 4,010 CroreTaxRs 1,544 CroreRs 1,451 CroreRs 1,647 CroreRs 379 CroreRs 501 CroreNet ProfitRs 3,982 CroreRs 3,102 CroreRs 610 CroreRs 680 CroreRs 611 CroreCash FlowThe cash flow statement highlights the movements of cash both into and out of a company during a specific period.Mar 2025Mar 2024Mar 2023Mar 2022Mar 2021Operating ActivitiesRs 12,680 CroreRs 12,596 CroreRs 7,159 CroreRs 6,692 CroreRs 8,458 CroreInvesting ActivitiesRs -15,448 CroreRs -9,034 CroreRs -7,375 CroreRs -6,276 CroreRs 667 CroreFinancing ActivitiesRs 4,292 CroreRs -4,497 CroreRs 1,340 CroreRs -1,183 CroreRs -7,602 CroreOthersRs 12 CroreRs 7 CroreRs 118 CroreRs 26 CroreRs 325 CroreNet Cash FlowRs 1,536 CroreRs -928 CroreRs 1,243 CroreRs -740 CroreRs 1,848 CroreBalance SheetThe balance sheet provides a snapshot of a company's assets, liabilities, and equity at a specific point in time.Mar 2025Mar 2024Mar 2023Mar 2022Mar 2021Share CapitalRs 319 CroreRs 319 CroreRs 319 CroreRs 319 CroreRs 319 CroreReserves & SurplusRs 35,521 CroreRs 32,035 CroreRs 28,467 CroreRs 22,122 CroreRs 20,502 CroreCurrent LiabilitiesRs 45,521 CroreRs 41,967 CroreRs 45,328 CroreRs 39,368 CroreRs 30,969 CroreOther LiabilitiesRs 75,348 CroreRs 65,230 CroreRs 54,233 CroreRs 51,074 CroreRs 47,059 CroreTotal LiabilitiesRs 156,711 CroreRs 139,553 CroreRs 128,349 CroreRs 112,884 CroreRs 98,851 CroreFixed AssetsRs 89,401 CroreRs 77,013 CroreRs 65,264 CroreRs 60,166 CroreRs 53,694 CroreCurrent AssetsRs 37,065 CroreRs 36,764 CroreRs 39,525 CroreRs 31,442 CroreRs 25,896 CroreOther AssetsRs 30,243 CroreRs 25,776 CroreRs 23,559 CroreRs 21,275 CroreRs 19,260 CroreTotal AssetsRs 156,711 CroreRs 139,553 CroreRs 128,349 CroreRs 112,884 CroreRs 98,851 CroreContingent LiabilitiesRs 21,945 CroreRs 17,709 CroreRs 14,327 CroreRs 9,372 CroreRs 7,161 CroreKey RatiosKey financial ratios for The Tata Power Company, with data up to March 2025, include a basic EPS of Rs 12.42 and a diluted EPS of Rs 12.41. The book value per share stands at Rs 112.16, and the company has declared a dividend of Rs 2.25 per share. The company reported a debt-to-equity ratio of 1.62 and an interest coverage ratio of 3.28 as of March 2025.Mar 2025Mar 2024Mar 2023Mar 2022Mar 2021Basic EPS (Rs.)12.4211.5610.435.363.17Diluted Eps (Rs.)12.4111.5610.435.363.17Book Value /Share (Rs.)112.16101.2590.0881.4574.32Dividend/Share (Rs.)2.252.002.001.751.55Gross Profit Margin (%)23.5820.5116.5919.6922.68Operating Margin (%)17.2914.3510.3512.3914.23Net Profit Margin (%)6.085.041.100.491.74Return on Equity (%)11.0711.4211.587.755.41ROCE (%)10.189.036.877.226.80Return On Assets (%)2.532.642.591.541.14Current Ratio (X)0.810.880.870.800.84Quick Ratio (X)0.710.770.780.690.78Debt to Equity (x)1.621.531.702.121.85Interest Coverage Ratios (X)3.282.722.092.181.84Asset Turnover Ratio (%)0.440.460.460.150.09Inventory Turnover Ratio (X)1.091.300.950.000.003 Yr CAGR Sales (%)23.6737.5737.5319.709.993 Yr CAGR Net Profit (%)141.88125.25-11.22-28.46-26.40P/E (x)30.2334.1018.2444.5232.57P/B (x)3.353.892.113.401.58EV/EBITDA (x)11.2113.6611.3714.349.27P/S (x)1.832.051.101.781.02Corporate ActionsThe Tata Power Company announced a final dividend of Rs 2.25 per share (225%) on May 14, 2025, with an effective date of June 20, 2025. Earlier corporate actions include a stock split on September 26, 2011, and bonus issue on May 19, 1975. With the stock's last traded price at Rs 388.20, The Tata Power Company has shown a positive movement in today's session."
J. K. Cement share price falls 2.22% in today's trading,https://www.moneycontrol.com/news/business/stocks/j-k-cement-share-price-falls-2-22-on-nifty-midcap-150-alpha-article-13511285.html,"Shares of J. K. Cement declined 2.22% to Rs 6,910.50 in Tuesday's session. The stock is among the losers on the Nifty Midcap 150 index, trading lower at 12:19 pm. On the financial front, J. K. Cement has demonstrated consistent growth in recent years. The company's consolidated annual revenue has increased steadily, reaching Rs 11,879.15 Crore for the year-ending March 2025, compared to Rs 11,556.00 Crore for the year-ending March 2024. Net profit also saw an increase, with Rs 871.58 Crore reported for the year-ending March 2025, up from Rs 789.93 Crore in the previous year. Here's a summary of J. K. Cement's key financial data:Financial YearRevenue (Rs Crore)Net Profit (Rs Crore)EPS (Rs)BVPS (Rs)ROE (%)Debt to EquityMar 2025Rs 11,879.15Rs 871.58111.44788.0114.140.97Mar 2024Rs 11,556.00Rs 789.93102.35688.7114.730.98Mar 2023Rs 9,720.20Rs 419.0855.17600.819.091.07Mar 2022Rs 7,990.82Rs 679.4287.90555.2915.880.89Mar 2021Rs 6,606.10Rs 703.1090.99480.2818.990.84The company’s revenue for the year-ending March 2025 increased by 2.79% compared to the year-ending March 2024. The net profit for the year-ending March 2025 also increased by 10.34% compared to the year-ending March 2024. The quarterly performance shows a similar trend. The revenue for the quarter-ending June 2025 stood at Rs 3,352.53 Crore, up from Rs 2,807.57 Crore in June 2024. The net profit for the same period was Rs 324.24 Crore, compared to Rs 184.82 Crore in the previous year.QuarterRevenue (Rs Crore)Net Profit (Rs Crore)EPS (Rs)Jun 2025Rs 3,352.53Rs 324.2441.99Mar 2025Rs 3,581.18Rs 361.3946.54Dec 2024Rs 2,930.28Rs 189.2224.54Sep 2024Rs 2,560.12Rs 136.1516.28Jun 2024Rs 2,807.57Rs 184.8223.98The company's revenue for the quarter-ending June 2025 increased by 19.41% compared to the quarter-ending June 2024. The net profit for the quarter-ending June 2025 increased significantly by 75.43% compared to the quarter-ending June 2024. J. K. Cement announced a final dividend of Rs 15.00 per share with an effective date of July 8, 2025. Earlier announcements include a final dividend of Rs 15.00 per share and a special dividend of Rs 5.00 per share, both with an effective date of July 9, 2024. According to a Moneycontrol analysis as of August 26, 2025, the sentiment for J. K. Cement is neutral. With the stock's last traded price at Rs 6,910.50, J. K. Cement has seen a decline in today's session."
Godrej Consumer Products shares rise 2.04%; stock among top gainers on Nifty Next 50,https://www.moneycontrol.com/news/business/stocks/godrej-consumer-products-shares-rise-2-04-stock-among-top-gainers-on-nifty-next-50-alpha-article-13511235.html,"Shares of Godrej Consumer Products gained 2.04% in Tuesday's session, with the stock currently priced at Rs 1,282.50. The stock is among the top gainers on the Nifty Next 50 index as of 12:08 PM.Financial SnapshotHere is a look at the key financial highlights for Godrej Consumer Products:Consolidated Quarterly ResultsThe following table presents the consolidated quarterly results for Godrej Consumer Products:HeadingJun 2024Sep 2024Dec 2024Mar 2025Jun 2025RevenueRs 3,331.58 CroreRs 3,666.33 CroreRs 3,768.43 CroreRs 3,597.95 CroreRs 3,661.86 CroreNet ProfitRs 450.69 CroreRs 491.31 CroreRs 498.31 CroreRs 411.90 CroreRs 452.45 CroreEPS4.414.804.874.034.42The revenue for the quarter ending June 2025 was Rs 3,661.86 Crore, compared to Rs 3,597.95 Crore for the quarter ending March 2025. Net profit for the quarter ending June 2025 was Rs 452.45 Crore, slightly up from Rs 411.90 Crore in the previous quarter.Consolidated Yearly ResultsThe following table presents the consolidated yearly results for Godrej Consumer Products:Heading20212022202320242025RevenueRs 11,028.62 CroreRs 12,276.50 CroreRs 13,315.97 CroreRs 14,096.11 CroreRs 14,364.29 CroreNet ProfitRs 1,720.83 CroreRs 1,783.11 CroreRs 1,702.46 CroreRs -560.55 CroreRs 1,852.30 CroreEPS16.8317.4416.65-5.4818.11BVPS92.31113.01134.88123.18117.34ROE18.2315.4312.34-4.4415.43Debt to Equity0.080.140.070.250.32The company's revenue for the year ending March 2025 was Rs 14,364.29 Crore, an increase compared to Rs 14,096.11 Crore for the year ending March 2024. The net profit for the year ending March 2025 stood at Rs 1,852.30 Crore, recovering from a loss of Rs 560.55 Crore in the previous year.Consolidated Yearly Income StatementThe following table presents the consolidated yearly income statement:Mar 2025Mar 2024Mar 2023Mar 2022Mar 2021SalesRs 14,364 CroreRs 14,096 CroreRs 13,315 CroreRs 12,276 CroreRs 11,028 CroreOther IncomeRs 316 CroreRs 268 CroreRs 168 CroreRs 89 CroreRs 67 CroreTotal IncomeRs 14,680 CroreRs 14,365 CroreRs 13,484 CroreRs 12,366 CroreRs 11,095 CroreTotal ExpenditureRs 11,658 CroreRs 13,870 CroreRs 11,175 CroreRs 10,101 CroreRs 8,888 CroreEBITRs 3,022 CroreRs 494 CroreRs 2,308 CroreRs 2,265 CroreRs 2,207 CroreInterestRs 350 CroreRs 296 CroreRs 175 CroreRs 110 CroreRs 126 CroreTaxRs 819 CroreRs 758 CroreRs 430 CroreRs 371 CroreRs 359 CroreNet ProfitRs 1,852 CroreRs -560 CroreRs 1,702 CroreRs 1,783 CroreRs 1,720 CroreConsolidated Quarterly Income StatementThe following table presents the consolidated quarterly income statement:Jun 2025Mar 2025Dec 2024Sep 2024Jun 2024SalesRs 3,661 CroreRs 3,597 CroreRs 3,768 CroreRs 3,666 CroreRs 3,331 CroreOther IncomeRs 84 CroreRs 73 CroreRs 83 CroreRs 85 CroreRs 77 CroreTotal IncomeRs 3,746 CroreRs 3,671 CroreRs 3,851 CroreRs 3,752 CroreRs 3,408 CroreTotal ExpenditureRs 3,046 CroreRs 2,942 CroreRs 3,080 CroreRs 2,962 CroreRs 2,676 CroreEBITRs 700 CroreRs 728 CroreRs 771 CroreRs 789 CroreRs 731 CroreInterestRs 86 CroreRs 89 CroreRs 89 CroreRs 83 CroreRs 87 CroreTaxRs 161 CroreRs 227 CroreRs 183 CroreRs 215 CroreRs 193 CroreNet ProfitRs 452 CroreRs 411 CroreRs 498 CroreRs 491 CroreRs 450 CroreConsolidated Cash FlowThe following table presents the consolidated cash flow:Mar 2025Mar 2024Mar 2023Mar 2022Mar 2021Operating ActivitiesRs 2,576 CroreRs 2,069 CroreRs 2,150 CroreRs 1,450 CroreRs 2,029 CroreInvesting ActivitiesRs -343 CroreRs -3,363 CroreRs -1,758 CroreRs -864 CroreRs -315 CroreFinancing ActivitiesRs -2,181 CroreRs 1,406 CroreRs -794 CroreRs -379 CroreRs -1,816 CroreOthersRs 0 CroreRs -67 CroreRs 3 CroreRs 19 CroreRs 24 CroreNet Cash FlowRs 51 CroreRs 46 CroreRs -398 CroreRs 226 CroreRs -77 CroreConsolidated Balance SheetThe following table presents the consolidated balance sheet:Mar 2025Mar 2024Mar 2023Mar 2022Mar 2021Share CapitalRs 102 CroreRs 102 CroreRs 102 CroreRs 102 CroreRs 102 CroreReserves & SurplusRs 11,901 CroreRs 12,496 CroreRs 13,691 CroreRs 11,453 CroreRs 9,336 CroreCurrent LiabilitiesRs 6,933 CroreRs 5,590 CroreRs 3,291 CroreRs 3,971 CroreRs 4,135 CroreOther LiabilitiesRs 734 CroreRs 306 CroreRs 413 CroreRs 606 CroreRs 708 CroreTotal LiabilitiesRs 19,671 CroreRs 18,495 CroreRs 17,498 CroreRs 16,134 CroreRs 14,282 CroreFixed AssetsRs 5,994 CroreRs 5,497 CroreRs 4,156 CroreRs 3,958 CroreRs 3,832 CroreCurrent AssetsRs 7,337 CroreRs 5,561 CroreRs 5,805 CroreRs 5,687 CroreRs 4,472 CroreOther AssetsRs 6,339 CroreRs 7,437 CroreRs 7,535 CroreRs 6,487 CroreRs 5,978 CroreTotal AssetsRs 19,671 CroreRs 18,495 CroreRs 17,498 CroreRs 16,134 CroreRs 14,282 CroreContingent LiabilitiesRs 889 CroreRs 747 CroreRs 943 CroreRs 950 CroreRs 1,106 CroreKey Financial RatiosKey financial ratios for Godrej Consumer Products are as follows:RatioMar 2025Mar 2024Mar 2023Mar 2022Mar 2021Basic EPS (Rs.)18.11-5.4816.6517.4416.83Diluted EPS (Rs.)18.11-5.4816.6517.4416.83Book Value / Share (Rs.)117.34123.18134.88113.0192.31Dividend / Share (Rs.)20.0015.000.000.000.00Face Value11111Gross Profit Margin (%)23.1022.7819.5120.2422.26Operating Margin (%)21.4721.0817.7418.5320.41Net Profit Margin (%)12.89-3.9712.7814.5215.60Return on Networth / Equity (%)15.43-4.4412.3415.4318.23ROCE (%)24.2123.0216.6218.7022.18Return On Assets (%)9.41-3.039.7211.0512.04Current Ratio (X)1.060.991.761.431.08Quick Ratio (X)0.850.771.300.900.67Debt to Equity (x)0.320.250.070.140.08Interest Coverage Ratios (X)9.4810.8414.7922.5619.39Asset Turnover Ratio (%)0.750.780.570.600.55Inventory Turnover Ratio (X)10.684.042.472.441.993 Yr CAGR Sales (%)8.1713.0515.919.105.853 Yr CAGR Net Profit (%)1.92-42.936.69-12.722.65P/E (x)64.01-228.4358.1542.8543.35P/B (x)9.8710.167.186.617.89EV/EBITDA (x)36.7440.6638.3530.9530.38P/S (x)8.259.087.446.226.76Corporate ActionsGodrej Consumer Products has announced several corporate actions. Recent announcements include newspaper publications under Regulation 30 (LODR) on August 26, 2025, and August 21, 2025. Additionally, a notice was issued to shareholders regarding the transfer of equity shares to the Investor Education and Protection Fund (IEPF) Account on August 19, 2025. The company has also announced several interim dividends:July 31, 2025: Rs 5.00 per share (500%), effective August 13, 2025April 21, 2025: Rs 5.00 per share (500%), effective May 13, 2025January 8, 2025: Rs 5.00 per share (500%), effective February 3, 2025October 14, 2024: Rs 5.00 per share (500%), effective October 31, 2024July 22, 2024: Rs 5.00 per share (500%), effective August 16, 2024The company has also issued bonus shares. On July 30, 2018, bonus shares were issued in the ratio of 1:2, with an ex-bonus date of September 12, 2018. On May 9, 2017, bonus shares were issued in the ratio of 1:1, with an ex-bonus date of June 22, 2017. Godrej Consumer Products had a rights issue announced on November 23, 2007, with a rights ratio of 1:7. The ex-rights date was March 12, 2008. The company had a stock split on April 26, 2006, with an ex-split date of August 24, 2006. The face value changed from Rs 4 to Rs 1.Market SentimentAs per Moneycontrol analysis, the market sentiment for Godrej Consumer Products is very bullish as of September 2, 2025. With the stock currently trading at Rs 1,282.50, Godrej Consumer Products has shown a positive movement, reflecting investor confidence and a bullish market sentiment."
Buy Phoenix Mills; target of Rs 2044: Motilal Oswal,https://www.moneycontrol.com/news/business/stocks/buy-phoenix-mills-target-of-rs-2044-motilal-oswal-13511247.html,"Motilal Oswal's research report on Phoenix Mills During FY15-25, PHNX’s retail portfolio witnessed an 11% CAGR in consumption, supported by ~7% like-for-like growth in the existing malls and the opening of new malls in Lucknow, Indore, Ahmedabad, Pune, and Bengaluru. Additionally, retail rental income clocked a similar 12% CAGR during this period, mirroring the consumption growth. We anticipate this positive growth trend to continue, primarily driven by the ramp-up of new malls. As of 1QFY26, trading occupancy stood at 89%, down from 91% in Mar’25. Flat or declining consumption in certain mature assets is linked to ongoing revamps and tenant churn. In Bengaluru, approximately 10% of the leasable area is currently under fit-outs or being repurposed from hypermarkets to high-performing fashion anchors. Pune is undergoing a similar transformation, replacing outdated anchors and restaurants with newer, more relevant offerings. Management remains optimistic about the long-term performance, projecting strong growth from FY27 onward once the revamps are completed. Outlook We upgrade our rating to BUY with a revised TP of INR2,044 (earlier INR1,673), implying upside potential of 35%. For all recommendations report, click here Disclaimer: The views and investment tips expressed by investment experts/broking houses/rating agencies on moneycontrol.com are their own, and not that of the website or its management. Moneycontrol.com advises users to check with certified experts before taking any investment decisions. Phoenix Mills - 02092025 - moti"
