title,link,content
Biocon shares hit 52-week high,https://www.moneycontrol.com/news/business/stocks/biocon-shares-hit-52-week-high-13294086.html,"Shares of Biocon reached a 52-week high of Rs 406 on the NSE, clocking gains of nearly 2%. The stock's performance places it among the gainers on the Nifty Midcap 150. Financial Performance: Biocon's financial performance shows consistent growth in revenue and net profit over the past few years. Here’s an overview based on the consolidated financial results: Consolidated Revenue (Annual):March 2021: Rs 7,105.80 CroreMarch 2022: Rs 8,184.00 CroreMarch 2023: Rs 11,174.20 CroreMarch 2024: Rs 14,755.70 CroreMarch 2025: Rs 15,261.70 CroreThe company's revenue increased from Rs 14,755.70 Crore in March 2024 to Rs 15,261.70 Crore in March 2025, marking a 3.43% increase. Consolidated Net Profit (Annual):March 2021: Rs 925.40 CroreMarch 2022: Rs 978.50 CroreMarch 2023: Rs 810.00 CroreMarch 2024: Rs 1,382.00 CroreMarch 2025: Rs 1,429.40 CroreThe net profit saw an increase from Rs 1,382.00 Crore in March 2024 to Rs 1,429.40 Crore in March 2025, reflecting a growth of 3.43%. Key Financial Ratios: The company’s financial ratios provide insights into its performance and stability:Basic EPS (Rs.): Increased from Rs 6.24 in March 2021 to Rs 8.46 in March 2025.Book Value per Share (Rs.): Increased from Rs 70.09 in March 2021 to Rs 180.28 in March 2025.Debt to Equity (x): Increased from 0.47 in March 2021 to 0.82 in March 2025.Consolidated Revenue (Quarterly):QuarterRevenue (Rs. Crore)Mar 2024Rs 3,917.10Jun 2024Rs 3,432.90Sep 2024Rs 3,590.40Dec 2024Rs 3,821.40Mar 2025Rs 4,417.00The company's quarterly revenue increased from Rs 3,917.10 Crore in March 2024 to Rs 4,417.00 Crore in March 2025, marking a 12.76% increase. Consolidated Net Profit (Quarterly):QuarterNet Profit (Rs. Crore)Mar 2024Rs 225.60Jun 2024Rs 861.80Sep 2024Rs 27.10Dec 2024Rs 81.10Mar 2025Rs 459.40The net profit saw an increase from Rs 225.60 Crore in March 2024 to Rs 459.40 Crore in March 2025, reflecting a growth of 103.64%. Corporate Actions: Biocon has scheduled its 47th Annual General Meeting for the financial year 2024-25 on Friday, August 08, 2025. The company has also announced a final dividend of Rs 0.50 per share (10%) with an effective date of July 04, 2025. Other dividends were announced on May 16, 2024 (Rs 0.50 per share), May 24, 2023 (Rs 1.50 per share), and April 28, 2022 (Rs 0.50 per share). The company has a history of bonus issues, with the most recent one declared on April 25, 2019, in the ratio of 1:1. Earlier bonus issues were announced on April 27, 2017 (2:1) and April 22, 2008 (1:1). Moneycontrol analysis indicates a very bullish sentiment for the stock. With the stock currently trading at Rs 405.05, Biocon has demonstrated strong financial performance and positive investor sentiment, as reflected by its 52-week high and bullish market outlook."
Buy Axis Bank; target of Rs 1375: Prabhudas Lilladher,https://www.moneycontrol.com/news/business/stocks/buy-axis-bank-target-of-rs-1375-prabhudas-lilladher-13294073.html,"Prabhudas Lilladher's research report on Axis Bank AXSB saw a weak quarter yet again as core PAT missed PLe by 26.6% due to asset quality related technical impact of Rs6.14bn. Adjusting for the same, core PAT missed PLe by 17% owing to lower NIM and fees. Owing to more stringent recognition criteria, gross slippages were more by Rs27.1bn (one-time impact). In our view, this may also reflect the underlying stress. As bank does not intend to further change the recognition policy, upcoming quarters of FY26 and FY27 would see lower credit costs since stress is moderating in PL/CC. Outlook We raise provisions for FY26 by 8bps but reduce it for FY27E by 3bps. For FY26/27E, we cut NIM by 6bps and trim fees by avg. ~2.0%; core PAT is lower by 5.1%/2.6%. Due to 7bps reduction in core RoA for FY26 to 1.4%, we tweak multiple to 1.8x from 1.9x and cut TP to Rs1,375 from Rs1,500. Retain ‘BUY’. For all recommendations report, click here Disclaimer: The views and investment tips expressed by investment experts/broking houses/rating agencies on moneycontrol.com are their own, and not that of the website or its management. Moneycontrol.com advises users to check with certified experts before taking any investment decisions. Axis Bank - 18072025 - prabhu"
"Clean Science & Tech shares fall 8% after Q1 results, stake sale plans weigh on sentiment",https://www.moneycontrol.com/news/business/markets/clean-science-tech-shares-fall-8-after-q1-results-stake-sale-plans-weigh-on-sentiment-13293720.html,"Shares of Clean Science and Technology fell 8 percent to Rs 1,330 apiece on July 18 after the company reported its June quarter results and management shared commentary on a potential promoter stake sale. For the June quarter, Clean Science’s revenue rose 8 percent year-on-year to Rs 240 crore, while Earnings Before Interest, Tax, Depreciation and Amortisation (EBITDA) grew 5 percent over the same period to Rs 100 crore. Margins for the quarter contracted by 100 basis points to 41.7 percent compared to 42.8 percent a year ago, while net profit increased by 6 percent year-on-year. Catch all the market action on our LIVE blog Over 25 percent of the company’s revenue during the quarter came from newer product launches, and the management noted that the company also gained market share in this period. However, the company revised its EBITDA growth guidance to 15–18 percent (down from the earlier 18–20 percent) citing softness in the first quarter of FY26 and global headwinds. Management said it expects a stronger ramp-up starting Q3FY26, with revenue acceleration in the second half of FY26 driven by new product launches, improved capacity utilisation, operating leverage, and market expansion. The promoters of Clean Science, who currently hold a 74.97 percent stake in the company, are evaluating the sale of a minority stake as part of their family estate planning and management, the management shared during the earnings call. Motilal Oswal reiterated its ""neutral"" rating on the stock, with a target price of Rs 1,350 per share. The brokerage cut its FY26 and FY27 estimates by 9 percent each, citing higher tax rates, but expects a revenue, EBITDA, and PAT CAGR of 23 percent, 23 percent, and 27 percent, respectively, over FY25–27. Meanwhile, HDFC Securities maintained a ""sell"" rating with a target price of Rs 1,029 per share. The brokerage said it expects the return on equity (RoE) to remain around 20 percent and EPS to grow at an 18 percent CAGR between FY25 and FY29. HDFC Securities noted that valuations remain high at 48x and 41x FY26 and FY27 estimated EPS, respectively. It added that Q1 EBITDA was 8 percent below its estimates, while PAT was 9 percent below expectations due to lower-than-expected revenue. Disclaimer: The views and investment tips expressed by investment experts on Moneycontrol.com are their own and not those of the website or its management. Moneycontrol.com advises users to check with certified experts before taking any investment decisions."
JK Cement shares hit 52-week high,https://www.moneycontrol.com/news/business/stocks/jk-cement-shares-hit-52-week-high-alpha-article-13293964.html,"Shares of JK Cement have hit a 52-week high of Rs 6,630 on the NSE in Friday's trading session. Financial Highlights: Here's a look at the consolidated financial performance of J. K. Cement: Income Statement - Quarterly (Consolidated):Mar 2025Dec 2024Sep 2024Jun 2024Mar 2024SalesRs 3,581 CroreRs 2,930 CroreRs 2,560 CroreRs 2,807 CroreRs 3,105 CroreOther IncomeRs 45 CroreRs 44 CroreRs 37 CroreRs 44 CroreRs 45 CroreTotal IncomeRs 3,627 CroreRs 2,974 CroreRs 2,597 CroreRs 2,852 CroreRs 3,151 CroreTotal ExpenditureRs 2,978 CroreRs 2,583 CroreRs 2,320 CroreRs 2,468 CroreRs 2,689 CroreEBITRs 648 CroreRs 391 CroreRs 277 CroreRs 383 CroreRs 462 CroreInterestRs 113 CroreRs 112 CroreRs 122 CroreRs 110 CroreRs 114 CroreTaxRs 173 CroreRs 89 CroreRs 18 CroreRs 88 CroreRs 127 CroreNet ProfitRs 361 CroreRs 189 CroreRs 136 CroreRs 184 CroreRs 219 CroreThe company's revenue for the quarter ending March 2025 was Rs 3,581.18 Crore, up from Rs 3,105.77 Crore in the quarter ending March 2024. Net profit for the quarter ending March 2025 stood at Rs 361.39 Crore, compared to Rs 219.68 Crore for the quarter ending March 2024. Earnings per share (EPS) increased to Rs 46.54 for the quarter ending March 2025 from Rs 28.44 in the quarter ending March 2024. Income Statement - Yearly (Consolidated):Mar 2025Mar 2024Mar 2023Mar 2022Mar 2021SalesRs 11,879 CroreRs 11,556 CroreRs 9,720 CroreRs 7,990 CroreRs 6,606 CroreOther IncomeRs 172 CroreRs 145 CroreRs 87 CroreRs 142 CroreRs 112 CroreTotal IncomeRs 12,052 CroreRs 11,701 CroreRs 9,807 CroreRs 8,133 CroreRs 6,719 CroreTotal ExpenditureRs 10,351 CroreRs 10,074 CroreRs 8,864 CroreRs 6,850 CroreRs 5,373 CroreEBITRs 1,700 CroreRs 1,626 CroreRs 943 CroreRs 1,282 CroreRs 1,345 CroreInterestRs 459 CroreRs 453 CroreRs 312 CroreRs 269 CroreRs 252 CroreTaxRs 370 CroreRs 383 CroreRs 212 CroreRs 333 CroreRs 389 CroreNet ProfitRs 871 CroreRs 789 CroreRs 419 CroreRs 679 CroreRs 703 CroreThe annual revenue increased to Rs 11,879.15 Crore in 2025 compared to Rs 11,556.00 Crore in 2024. The net profit also increased to Rs 871.58 Crore in 2025 from Rs 789.93 Crore in the previous year. The company’s Earnings Per Share (EPS) stood at Rs 111.44 in March 2025, up from Rs 102.35 in March 2024. Balance Sheet (Consolidated):Mar 2025Mar 2024Mar 2023Mar 2022Mar 2021Share CapitalRs 77 CroreRs 77 CroreRs 77 CroreRs 77 CroreRs 77 CroreReserves & SurplusRs 6,011 CroreRs 5,289 CroreRs 4,609 CroreRs 4,247 CroreRs 3,659 CroreCurrent LiabilitiesRs 3,907 CroreRs 3,400 CroreRs 2,946 CroreRs 2,670 CroreRs 1,957 CroreOther LiabilitiesRs 6,684 CroreRs 6,034 CroreRs 5,651 CroreRs 4,407 CroreRs 4,177 CroreTotal LiabilitiesRs 16,681 CroreRs 14,802 CroreRs 13,285 CroreRs 11,402 CroreRs 9,871 CroreFixed AssetsRs 10,676 CroreRs 9,602 CroreRs 9,037 CroreRs 7,575 CroreRs 6,446 CroreCurrent AssetsRs 5,003 CroreRs 4,416 CroreRs 3,738 CroreRs 3,524 CroreRs 3,183 CroreOther AssetsRs 1,002 CroreRs 783 CroreRs 509 CroreRs 302 CroreRs 242 CroreTotal AssetsRs 16,681 CroreRs 14,802 CroreRs 13,285 CroreRs 11,402 CroreRs 9,871 CroreContingent LiabilitiesRs 1,229 CroreRs 1,227 CroreRs 739 CroreRs 1,263 CroreRs 437 CroreCash Flow (Consolidated):Mar 2025Mar 2024Mar 2023Mar 2022Mar 2021Operating ActivitiesRs 1,939 CroreRs 1,959 CroreRs 1,377 CroreRs 878 CroreRs 1,590 CroreInvesting ActivitiesRs -1,909 CroreRs -1,635 CroreRs -2,014 CroreRs -996 CroreRs -1,343 CroreFinancing ActivitiesRs 73 CroreRs -415 CroreRs 741 CroreRs 61 CroreRs -137 CroreOthersRs 19 CroreRs 9 CroreRs 50 CroreRs 12 CroreRs 0 CroreNet Cash FlowRs 122 CroreRs -82 CroreRs 154 CroreRs -43 CroreRs 108 CroreKey Financial Ratios:RatioMar 2025Mar 2024Mar 2023Mar 2022Mar 2021Basic EPS (Rs.)111.44102.3555.1787.9090.99Diluted EPS (Rs.)111.44102.3555.1787.9090.99Book Value /Share (Rs.)788.01688.71600.81555.29480.28Dividend/Share (Rs.)15.0020.0015.0015.0015.00Face Value1010101010Gross Profit Margin (%)18.5219.0714.4220.3325.00Operating Margin (%)13.4514.129.7016.0520.36Net Profit Margin (%)7.336.834.318.5010.64Return on Networth / Equity (%)14.1414.739.0915.8818.99ROCE (%)12.5114.319.1214.6916.99Return On Assets (%)5.165.343.206.027.18Current Ratio (X)1.281.301.271.321.63Quick Ratio (X)0.980.950.940.871.24Debt to Equity (x)0.970.981.070.890.84Interest Coverage Ratios (X)4.794.874.496.035.32Asset Turnover Ratio (%)0.750.820.810.7666.91Inventory Turnover Ratio (X)1.471.651.321.248.733 Yr CAGR Sales (%)21.9332.2629.4423.2716.673 Yr CAGR Net Profit (%)13.266.00-6.8960.5456.91P/E (x)44.2639.8352.9927.6631.84P/B (x)6.265.874.824.345.98EV/EBITDA (x)19.3616.2519.0513.7114.68P/S (x)3.212.732.322.353.39Corporate Actions: J. K. Cement announced a final dividend of Rs 15.00 per share (150%) on May 26, 2025, with an effective date of July 8, 2025. The company had a conference call on July 21st, 2025, regarding the financial results for the quarter ended June 30th, 2025. Moneycontrol analysis indicates a very bullish sentiment on the stock as of July 18, 2025. J. K. Cement has hit a 52wk high of Rs 6,605.00 on NSE."
Hold Clean Science and Technology; target of Rs 1425: Prabhudas Lilladher,https://www.moneycontrol.com/news/business/stocks/hold-clean-science-and-technology-target-of-rs-1425-prabhudas-lilladher-13293957.html,"Prabhudas Lilladher's research report on Clean Science and Technology Clean Science and Technology (CLEAN) reported revenue of Rs2.4bn in Q1FY26, marking an 8.4% YoY increase but a 7.9% QoQ decline. The sequential dip in topline was due to lower sales of newer products such as DCC and TBHQ. The Pharma & Agro Intermediates segment witnessed the sharpest decline, with revenue down 32% QoQ. Volume for the company’s established products remained strong, supporting a robust standalone EBITDAM of 46%, driven by lower raw material costs. HALS volume stood at 540tn. The management reiterated its guidance of 4,500tn for HALS volume in FY26, with new HALS grades priced at USD11–35/kg expected to be launched over the coming quarters. HALS is likely to break even at the EBITDA level by Q2FY26, with monthly sales expected to reach Rs100mn. The HALS subsidiary reported EBITDA loss of Rs80mn in Q1FY26. On the capex front, water trials at Performance Chemicals 1 are scheduled for Aug’25, with commercialization of the facility targeted for Sep. Performance Chemicals 2 is on track for commercialization in Q4FY26. Looking ahead, these new capacity additions are expected to be key growth drivers. Outlook However, the company’s margin profile may face some pressure, as certain new products such as HALS are expected to yield lower profitability compared to the legacy portfolio. At its current valuation of 41x FY27 EPS, we maintain ‘HOLD’ rating on CLEAN, with target price of Rs1,425 valuing it at 40x FY27 EPS. For all recommendations report, click here Disclaimer: The views and investment tips expressed by investment experts/broking houses/rating agencies on moneycontrol.com are their own, and not that of the website or its management. Moneycontrol.com advises users to check with certified experts before taking any investment decisions. Clean Science and Technology - 18072025 - prabhu"
Dalmia Bharat shares rise 2.4% in Friday's trading session,https://www.moneycontrol.com/news/business/stocks/dalmia-bharat-shares-rise-2-4-in-friday-s-trading-session-alpha-article-13293941.html,"Shares of Dalmia Bharat gained 2.40% to trade at Rs 2,242.20 in Friday's session. The stock is currently trading on the NIFTY MIDCAP 150. On July 15, 2025, Dalmia Bharat announced that an investors/analysts group conference call on the Unaudited Standalone and Consolidated Financial Results of the Company for the quarter ended June 30, 2025, is scheduled on Wednesday, July 23, 2025, at 10:00 A.M. (IST). Also, the meeting of the Board of Directors is scheduled on July 22, 2025, to consider and approve the Unaudited Standalone and Consolidated financial results of the Company for the quarter ended June 30, 2025. The company has been consistently distributing dividends. The Final dividend announced on April 23, 2025, was Rs 5.00 per share (250%). Before that, an Interim dividend was announced on October 9, 2024, of Rs 4.00 per share (200%). Here is a look at the company's financial performance over the last few years:Mar 2025Mar 2024Mar 2023Mar 2022Mar 2021RevenueRs 4,091 CroreRs 4,307 CroreRs 3,087 CroreRs 3,621 CroreRs 4,307 CroreNet ProfitRs 439 CroreRs 320 CroreRs 49 CroreRs 145 CroreRs 320 CroreEPS23.2016.802.467.5016.80The consolidated quarterly revenue for March 2025 stood at Rs 4,091 Crore, while in March 2024, it was Rs 4,307 Crore. The consolidated quarterly net profit for March 2025 was Rs 439 Crore, while in March 2024, it was Rs 320 Crore. The EPS for March 2025 was 23.20, while in March 2024, it was 16.80.Mar 2025Mar 2024Mar 2023Mar 2022Mar 2021SalesRs 13,980 CroreRs 14,691 CroreRs 13,540 CroreRs 11,286 CroreRs 10,522 CroreOther IncomeRs 253 CroreRs 315 CroreRs 138 CroreRs 155 CroreRs 182 CroreTotal IncomeRs 14,233 CroreRs 15,006 CroreRs 13,678 CroreRs 11,441 CroreRs 10,704 CroreTotal ExpenditureRs 13,017 CroreRs 13,550 CroreRs 12,673 CroreRs 10,093 CroreRs 8,993 CroreEBITRs 1,216 CroreRs 1,456 CroreRs 1,005 CroreRs 1,348 CroreRs 1,711 CroreInterestRs 399 CroreRs 386 CroreRs 234 CroreRs 202 CroreRs 303 CroreTaxRs 118 CroreRs 216 CroreRs 242 CroreRs -14 CroreRs 165 CroreNet ProfitRs 699 CroreRs 854 CroreRs 529 CroreRs 1,160 CroreRs 1,243 CroreThe consolidated yearly sales for March 2025 stood at Rs 13,980 Crore, while in March 2024, it was Rs 14,691 Crore. The consolidated yearly net profit for March 2025 was Rs 699 Crore, while in March 2024, it was Rs 854 Crore.Mar 2025Mar 2024Mar 2023Mar 2022Mar 2021Share CapitalRs 38 CroreRs 38 CroreRs 37 CroreRs 37 CroreRs 37 CroreReserves & SurplusRs 17,336 CroreRs 16,359 CroreRs 15,579 CroreRs 15,629 CroreRs 12,583 CroreCurrent LiabilitiesRs 5,223 CroreRs 4,474 CroreRs 4,460 CroreRs 4,776 CroreRs 4,956 CroreOther LiabilitiesRs 7,629 CroreRs 6,878 CroreRs 5,467 CroreRs 4,429 CroreRs 4,234 CroreTotal LiabilitiesRs 30,226 CroreRs 27,749 CroreRs 25,543 CroreRs 24,871 CroreRs 21,810 CroreThe total assets of the company as of March 2025 are Rs 30,226 Crore compared to Rs 27,749 Crore in March 2024. Key financial ratios for Dalmia Bharat include a debt-to-equity ratio of 0.30 as of March 2025. The P/E ratio is 50.02, and the P/B ratio is 1.99. With the stock currently trading at Rs 2,242.20, Dalmia Bharat has demonstrated a notable rise in today's session."
Hold Wipro; target of Rs 260: Prabhudas Lilladher,https://www.moneycontrol.com/news/business/stocks/hold-wipro-target-of-rs-260-prabhudas-lilladher-2-13293903.html,"Prabhudas Lilladher's research report on Wipro The revenue growth (-2.0% QoQ CC) was above our estimates (-2.6% QoQ), partly aided by outperformance of CAPCO (+6.0% YoY). The growth performance in Consumer and BFS (beyond CAPCO) was weak. The discretionary budgets were tight in Consumer and Manufacturing, especially in Europe, otherwise AI-led transformation and modernization of data witnessed steady recover in Q1. The exceptional large deal TCV (including 2 mega deals) is a mix of both renewals and NN. The large wins are a strategic outcome of securing the existing books while building new offerings on top. However, the nature of the deals is concentrated more on the vendor consolidation and cost optimization side, which ideally comes at a higher tenure and lower margins. The early part of the deals would require investments in right sizing the talent base and setting up stage for deployment, which ultimately leads to take a hit on the margins. We expect the ramp up of two mega deals to support growth in H2, while also considering the underlying weakness and slower conversion. We are revising our estimates to -1.5%/+3.4 YoY CC (vs -2.5%/2.9% earlier), while cutting our margin estimates by 30/40bps for FY26E/FY27E to 16.9%/17.1%. Our EPS estimates see an uptick of ~1% in FY26/FY27. Outlook The stock is currently trading at 20x/19x FY26E/FY27E and Upgrade our rating to HOLD (REDUCE earlier). For all recommendations report, click here Disclaimer: The views and investment tips expressed by investment experts/broking houses/rating agencies on moneycontrol.com are their own, and not that of the website or its management. Moneycontrol.com advises users to check with certified experts before taking any investment decisions. Wipro - 18072025 - prabhu"
"Tata Comm, Motherson SWI, Polycab among top gainers on Nifty Midcap 150",https://www.moneycontrol.com/news/business/stocks/tata-comm-motherson-swi-polycab-among-top-gainers-on-nifty-midcap-150-alpha-article-13293897.html,"At 11:00 am on Friday, a few stocks emerged as top gainers on the Nifty Midcap 150. These included Tata Communications at Rs 1,783.10 (2.97%), Motherson SWI at Rs 43.87 (2.07%), and Polycab at Rs 7,015.00 (1.87%). Other gainers were J. K. Cement at Rs 6,547.00 (1.81%) and KEI Industries at Rs 3,993.90 (1.54%). Tata Comm's consolidated financial performance shows consistent growth. The yearly revenue has increased from Rs 17,100.10 Crore in 2021 to Rs 23,108.59 Crore in 2025. Net profit has fluctuated, reaching Rs 1,583.15 Crore in 2025, while EPS stood at Rs 64.44. The debt-to-equity ratio has significantly decreased from 84.89 in 2021 to 3.60 in 2025. Motherson SWI's standalone financials indicate steady performance with sales rising from Rs 0 in 2021 to Rs 9,320 Crore in 2025. The net profit has also increased to Rs 605 Crore in 2025. However, no financial data is available for the quarterly results. Polycab's consolidated financial data reveals consistent growth in revenue from Rs 8,792.23 Crore in 2021 to Rs 22,408.31 Crore in 2025. Net profit has also increased, reaching Rs 2,045.54 Crore in 2025, with an EPS of Rs 134.34. The debt-to-equity ratio remains low at 0.01 in 2025. J. K. Cement's consolidated financials show a revenue increase from Rs 6,606.10 Crore in 2021 to Rs 11,879.15 Crore in 2025. Net profit has also grown to Rs 871.58 Crore in 2025, with an EPS of Rs 111.44. The debt-to-equity ratio is stable at 0.97 in 2025. KEI Industries' consolidated financials demonstrate growth in revenue from Rs 4,181.54 Crore in 2021 to Rs 9,735.88 Crore in 2025. Net profit has increased to Rs 696.41 Crore in 2025, with an EPS of Rs 75.65. The debt-to-equity ratio is low at 0.03 in 2025.SalesOther IncomeTotal IncomeTotal ExpenditureEBITInterestTaxNet ProfitMar 202523,10813023,23820,4402,7987294861,583Mar 202420,96828221,25119,4441,807644213949Mar 202317,83836318,20115,7052,4954322961,766Mar 202216,72433217,05614,6962,3603605221,477Mar 202117,10015617,25615,2282,0284203541,253The consolidated income statement of Tata Comm shows consistent performance over the years. Sales increased from Rs 17,100 Crore in March 2021 to Rs 23,108 Crore in March 2025.SalesOther IncomeTotal IncomeTotal ExpenditureEBITInterestTaxNet ProfitMar 20259,320119,3328,50283024199605Mar 20248,32868,3357,46287227207638Mar 20237,057227,0796,39968027165487Mar 20225,635305,6655,07558928150410Mar 202100000000The standalone income statement of Motherson SWI indicates significant growth. Sales increased from Rs 0 in March 2021 to Rs 9,320 Crore in March 2025.SalesOther IncomeTotal IncomeTotal ExpenditureEBITInterestTaxNet ProfitMar 202522,40820722,61519,7462,8691686552,045Mar 202418,03922018,26015,7922,4671085561,802Mar 202314,10713314,24112,4641,776594251,291Mar 202212,2038912,29311,1401,15335270847Mar 20218,7921198,9117,8571,05442170841Polycab's consolidated income statement showcases substantial growth. Sales increased from Rs 8,792 Crore in March 2021 to Rs 22,408 Crore in March 2025.SalesOther IncomeTotal IncomeTotal ExpenditureEBITInterestTaxNet ProfitMar 202511,87917212,05210,3511,700459370871Mar 202411,55614511,70110,0741,626453383789Mar 20239,720879,8078,864943312212419Mar 20227,9901428,1336,8501,282269333679Mar 20216,6061126,7195,3731,345252389703The consolidated income statement of J. K. Cement indicates substantial growth. Sales increased from Rs 6,606 Crore in March 2021 to Rs 11,879 Crore in March 2025.SalesOther IncomeTotal IncomeTotal ExpenditureEBITInterestTaxNet ProfitMar 20259,735719,8078,81599255240696Mar 20248,104498,1537,32882543200580Mar 20236,912276,9396,26367634164477Mar 20225,726145,7415,19354740131375Mar 20214,181204,2013,7784225792273The consolidated income statement of KEI Industries shows sales increasing from Rs 4,181 Crore in March 2021 to Rs 9,735 Crore in March 2025. Tata Comm announced on July 17, 2025, the raising of funds through the issuance of Non-convertible Debentures and the amendment of the Insider Trading Policy. Motherson Sumi Wiring India Ltd has announced a board meeting on July 28, 2025, to approve the unaudited financial results for the quarter ended June 30, 2025. Additionally, a bonus issue was announced on May 29, 2025, with an ex-bonus date of July 18, 2025, in the ratio of 1:2. Polycab released unaudited interim condensed financial statements for the quarter ended June 30, 2025, and provided a corporate presentation on the unaudited financial results. J. K. Cement issued a certificate of utilization of proceeds from commercial papers for the quarter ended June 30, 2025, and announced a conference call on July 21, 2025, regarding the financial results for the quarter. KEI Industries acquired an industrial plot in Ahmedabad for Rs 23.05 Crores for future expansion and has received disclosures under Reg. 29(1) of SEBI (SAST) Regulations, 2011 for Kotak Mahindra Mutual Fund. The stocks of Tata Comm, Motherson SWI, Polycab, J. K. Cement and KEI Industries are among the top gainers on the Nifty Midcap 150 as of 11:00 am on Friday."
