title,link,content
"Hindalco, SBI stocks among top gainers on Nifty 50",https://www.moneycontrol.com/news/business/stocks/hindalco-sbi-stocks-among-top-gainers-on-nifty-50-alpha-article-13288572.html,"At 10:00 am on Thursday, several stocks were identified as top gainers on the Nifty 50. Among them are Hindalco, SBI, TATA Cons. Prod, Apollo Hospital and UltraTechCement. Hindalco shares are trading at Rs 672.60, a gain of 0.88% in today's session. SBI shares are trading at Rs 837.55, a gain of 0.7% in today's session. TATA Cons. Prod shares are trading at Rs 1,088.00, a gain of 0.6% in today's session. Apollo Hospital shares are trading at Rs 7,394.00, a gain of 0.56% in today's session. UltraTechCement shares are trading at Rs 12,519.00, a gain of 0.53% in today's session.Hindalco FinancialsHere's a look at the consolidated financial performance of Hindalco: Quarterly Results: The company has demonstrated consistent revenue growth over the quarters. For the quarter ending March 2025, Hindalco reported revenue of Rs 64,890 Crore, which is an increase compared to previous quarters. The net profit for the same period was Rs 5,284 Crore.HeadingMar 2024Jun 2024Sep 2024Dec 2024Mar 2025RevenueRs 55,994.00 CroreRs 57,013.00 CroreRs 58,203.00 CroreRs 58,390.00 CroreRs 64,890.00 CroreNet ProfitRs 3,175.00 CroreRs 3,072.00 CroreRs 3,909.00 CroreRs 3,734.00 CroreRs 5,284.00 CroreEPS14.2913.8417.5916.8223.80Annual Results: The annual revenue for March 2025 stood at Rs 238,496 Crore, up from Rs 215,962 Crore in March 2024. The net profit also increased from Rs 10,153 Crore in 2024 to Rs 15,999 Crore in 2025.Heading20212022202320242025RevenueRs 131,985.00 CroreRs 195,059.00 CroreRs 223,202.00 CroreRs 215,962.00 CroreRs 238,496.00 CroreNet ProfitRs 5,177.00 CroreRs 14,195.00 CroreRs 10,088.00 CroreRs 10,153.00 CroreRs 15,999.00 CroreEPS15.6661.7345.4245.7172.05BVPS299.73352.24427.09478.17557.25ROE5.2317.5610.659.5612.93Debt to Equity0.980.810.620.510.50Hindalco's total income for the year ending March 2025 was Rs 241,204 crore, compared to Rs 217,458 crore for the year ending March 2024. Total expenditure increased to Rs 215,451 crore from Rs 199,590 crore in the same period. The EBIT was Rs 25,753 crore, and after accounting for interest and tax, the net profit was Rs 15,999 crore.TATA Cons. Prod FinancialsHere's a look at the consolidated financial performance of TATA Cons. Prod: Quarterly Results: The company has demonstrated consistent revenue growth over the quarters. For the quarter ending March 2025, TATA Cons. Prod reported sales of Rs 4,608 Crore and a net profit of Rs 407 Crore.HeadingMar 2024Jun 2024Sep 2024Dec 2024Mar 2025RevenueRs 3,926.94 CroreRs 4,352.07 CroreRs 4,214.45 CroreRs 4,443.56 CroreRs 4,608.22 CroreNet ProfitRs 267.71 CroreRs 314.15 CroreRs 359.34 CroreRs 305.91 CroreRs 407.07 CroreEPS2.283.053.782.823.49Annual Results: The annual sales for March 2025 stood at Rs 17,618 Crore, up from Rs 15,205 Crore in March 2024. The net profit also increased from Rs 1,300 Crore in 2024 to Rs 1,380 Crore in 2025.Heading20212022202320242025RevenueRs 11,602.03 CroreRs 12,425.37 CroreRs 13,783.16 CroreRs 15,205.85 CroreRs 17,618.30 CroreNet ProfitRs 993.79 CroreRs 1,078.95 CroreRs 1,346.52 CroreRs 1,300.99 CroreRs 1,380.31 CroreEPS9.3010.1513.0212.3213.06BVPS169.33176.56184.12183.00202.13ROE5.906.187.407.166.39Debt to Equity0.050.070.070.180.09TATA Cons. Prod's total income for the year ending March 2025 was Rs 17,811 crore, compared to Rs 15,451 crore for the year ending March 2024. Total expenditure increased to Rs 15,744 crore from Rs 13,625 crore in the same period. The EBIT was Rs 2,066 crore, and after accounting for interest and tax, the net profit was Rs 1,380 crore.Apollo Hospital FinancialsHere's a look at the consolidated financial performance of Apollo Hospital: Quarterly Results: For the quarter ending March 2025, Apollo Hospital reported sales of Rs 5,592.20 Crore and a net profit of Rs 404.00 Crore.HeadingMar 2024Jun 2024Sep 2024Dec 2024Mar 2025RevenueRs 4,943.90 CroreRs 5,085.60 CroreRs 5,589.30 CroreRs 5,526.90 CroreRs 5,592.20 CroreNet ProfitRs 249.80 CroreRs 304.00 CroreRs 390.00 CroreRs 374.10 CroreRs 404.00 CroreEPS17.6521.2326.3425.8927.10Annual Results: The annual sales for March 2025 stood at Rs 21,794.00 Crore, up from Rs 19,059.20 Crore in March 2024. The net profit also increased from Rs 917.00 Crore in 2024 to Rs 1,472.10 Crore in 2025.Heading20212022202320242025RevenueRs 10,560.00 CroreRs 14,662.60 CroreRs 16,612.50 CroreRs 19,059.20 CroreRs 21,794.00 CroreNet ProfitRs 136.00 CroreRs 1,101.10 CroreRs 887.50 CroreRs 917.00 CroreRs 1,472.10 CroreEPS10.7473.4256.9762.50100.56BVPS333.96408.74454.19509.08571.09ROE3.2618.7713.2112.9517.60Debt to Equity0.540.470.440.460.64Apollo Hospital's total income for the year ending March 2025 was Rs 21,994 crore, compared to Rs 19,165 crore for the year ending March 2024. Total expenditure increased to Rs 19,529 crore from Rs 17,353 crore in the same period. The EBIT was Rs 2,464 crore, and after accounting for interest and tax, the net profit was Rs 1,472 crore.UltraTechCement FinancialsHere's a look at the consolidated financial performance of UltraTechCement: Quarterly Results: For the quarter ending March 2025, UltraTechCement reported sales of Rs 23,063.32 Crore and a net profit of Rs 2,485.56 Crore.HeadingMar 2024Jun 2024Sep 2024Dec 2024Mar 2025RevenueRs 20,418.94 CroreRs 18,069.56 CroreRs 15,634.73 CroreRs 17,193.33 CroreRs 23,063.32 CroreNet ProfitRs 2,249.52 CroreRs 1,692.33 CroreRs 826.62 CroreRs 1,474.77 CroreRs 2,485.56 CroreEPS78.3558.8728.4550.9984.38Annual Results: The annual sales for March 2025 stood at Rs 75,955.13 Crore, up from Rs 70,908.14 Crore in March 2024. The net profit decreased from Rs 6,981.95 Crore in 2024 to Rs 6,050.21 Crore in 2025.Heading20212022202320242025RevenueRs 44,725.80 CroreRs 52,598.83 CroreRs 63,239.98 CroreRs 70,908.14 CroreRs 75,955.13 CroreNet ProfitRs 5,316.76 CroreRs 7,265.14 CroreRs 5,069.37 CroreRs 6,981.95 CroreRs 6,050.21 CroreEPS189.40254.64175.63243.05205.30BVPS1,530.591,747.051,883.692,088.172,399.42ROE12.3614.569.3211.638.54Debt to Equity0.400.200.180.170.33UltraTechCement's total income for the year ending March 2025 was Rs 76,699 crore, compared to Rs 71,525 crore for the year ending March 2024. Total expenditure increased to Rs 67,510 crore from Rs 61,156 crore in the same period. The EBIT was Rs 9,189 crore, and after accounting for interest and tax, the net profit was Rs 6,050 crore.Corporate ActionsHindalco: Hindalco announced compliances certificate under Reg 74(5) of SEBI (DP) Regulations, 2018 on July 09, 2025. The company also announced Scrunitizer's Report for Postal ballot dated June 27, 2025 and Outcome of Postal Ballot dated June 27, 2025 on June 28, 2025. The company announced a final dividend of Rs 3.50 per share (350%) on May 24, 2024, with an effective date of August 09, 2024. The company issued bonus shares on multiple occasions, including a 1:2 bonus ratio on September 02, 1996. The company had rights issues, including a 3:7 rights ratio on August 28, 2008, with a face value of Rs 1 and a premium of Rs 95. The company split its shares on August 30, 2005, changing the face value from Rs 10 to Rs 1. SBI: SBI announced Committe Meeting Update on QIP on July 16, 2025. The company also announced outcome of board meeting held on July 16, 2025 regarding Fund Raising by issue of Basel III compliant Additional Tier 1 and Tier 2 Bonds on July 16, 2025. SBI announced a final dividend of Rs 15.90 per share (1590%) on May 05, 2025, with an effective date of May 16, 2025. The company had rights issues, including a 1:5 rights ratio on January 28, 2008, with a face value of Rs 10 and a premium of Rs 1580. The company split its shares on November 20, 2014, changing the face value from Rs 10 to Rs 1. TATA Cons. Prod: TATA Cons. Prod announced Intimation of schedule of Conference Call pertaining to Financial Results and Board Meeting Intimation For Financial Results For The Quarter Ended June 30, 2025 on July 16, 2025. The company also announced Certificate under Reg 74 (5) of SEBI (DP) Regulation, 2018 on July 03, 2025. TATA Cons. Prod announced a final dividend of Rs 8.25 per share (825%) on April 23, 2025, with an effective date of May 29, 2025. The company issued bonus shares on multiple occasions, including a 1:2 bonus ratio on October 07, 1994. The company had rights issues, including a 1:26 rights ratio on July 26, 2024, with a face value of Rs 1 and a premium of Rs 817. The company split its shares on June 30, 2010, changing the face value from Rs 10 to Rs 1. Apollo Hospital: Apollo Hospital announced Certificate under Regulation 74(5) for the period ended 30th June 2025 and Announcement under Regulation 30 (LODR)-Analyst / Investor Meet - Outcome on July 08, 2025. Apollo Hospital announced an interim dividend of Rs 9.00 per share (180%) on February 10, 2025, with an effective date of February 14, 2025. The company had rights issues, including a 1:1 rights ratio on March 10, 1993, with a premium of Rs 10. The company split its shares on September 02, 2010, changing the face value from Rs 10 to Rs 5. UltraTechCement: UltraTechCement announced Certificate under Reg 74(5) of SEBI (DP) Regulations on July 15, 2025. The company also announced Intimation Regarding - Special Window - Re-Lodgement For Transfer Of Physical Shares on July 12, 2025 and Resignation of senior management personnel on July 04, 2025. UltraTechCement announced a final dividend of Rs 70.00 per share (700%) on April 29, 2024, with an effective date of July 30, 2024. Disclaimer: This analysis is purely based on the data provided , and Moneycontrol does not provide any recommendations."
Tech Mahindra shares fall 1.16%; stock among top losers on Nifty 50,https://www.moneycontrol.com/news/business/stocks/tech-mahindra-shares-fall-1-16-stock-among-top-losers-on-nifty-50-alpha-article-13288577.html,"Shares of Tech Mahindra were trading lower at Rs 1,589.30, a 1.16% decline in Thursday's session. The stock is among the top losers on the Nifty 50 index. Other stocks that were among the top losers on the Nifty 50 included SBI Life Insura, ICICI Bank, Eternal and Wipro.Tech Mahindra: Financial OverviewHere's a look at the consolidated financial performance of Tech Mahindra:Quarterly ResultsThe following table presents the quarterly revenue, net profit, and EPS for Tech Mahindra:PeriodRevenue (Rs. Crore)Net Profit (Rs. Crore)EPSJun 2024Rs 13,005.50 CroreRs 862.20 Crore9.62Sep 2024Rs 13,313.22 CroreRs 1,256.88 Crore14.12Dec 2024Rs 13,285.60 CroreRs 982.20 Crore11.10Mar 2025Rs 13,384.00 CroreRs 1,143.10 Crore13.17Jun 2025Rs 13,351.20 CroreRs 1,128.30 Crore12.87Revenue for the quarter-ending June 2025 stood at Rs 13,351.20 Crore, slightly up from Rs 13,005.50 Crore in June 2024. Net profit for the same period was Rs 1,128.30 Crore, compared to Rs 862.20 Crore in the previous year.Annual ResultsThe subsequent table outlines the yearly revenue, net profit, EPS, BVPS, ROE, and debt-to-equity ratio for Tech Mahindra:YearRevenue (Rs. Crore)Net Profit (Rs. Crore)EPSBVPSROEDebt to Equity2021Rs 37,855.10 CroreRs 4,351.80 Crore50.64288.7817.810.072022Rs 44,646.00 CroreRs 5,627.30 Crore63.32311.9920.700.062023Rs 53,290.20 CroreRs 4,886.00 Crore54.76322.6517.300.062024Rs 51,995.50 CroreRs 2,386.30 Crore26.66307.568.840.062025Rs 52,988.30 CroreRs 4,244.40 Crore48.00309.2415.530.02The annual revenue for the year-ending March 2025 was Rs 52,988.30 Crore, an increase compared to Rs 51,995.50 Crore in 2024. The net profit for the year-ending March 2025 stood at Rs 4,244.40 Crore, compared to Rs 2,386.30 Crore in the previous year. The company reported a debt-to-equity ratio of 0.02 as of the year-ending March 2025.Income StatementHere is the Income Statement of Tech MahindraMar 2025Mar 2024Mar 2023Mar 2022Mar 2021Sales52,988 Crore51,995 Crore53,290 Crore44,646 Crore37,855 CroreOther Income855 Crore916 Crore965 Crore1,112 Crore787 CroreTotal Income53,843 Crore52,912 Crore54,255 Crore45,758 Crore38,642 CroreTotal Expenditure47,877 Crore49,306 Crore47,455 Crore38,146 Crore32,516 CroreEBIT5,966 Crore3,606 Crore6,800 Crore7,611 Crore6,125 CroreInterest321 Crore392 Crore325 Crore162 Crore174 CroreTax1,400 Crore827 Crore1,588 Crore1,822 Crore1,599 CroreNet Profit4,244 Crore2,386 Crore4,886 Crore5,627 Crore4,351 CroreCorporate ActionsTech Mahindra has announced several corporate actions, including analyst/investor meetings. On July 16, 2025, the company held its 79th Annual General Meeting, where resolutions were passed with the requisite majority. Dividends:Final Dividend: Announced on April 24, 2025, of Rs 30 per share (600%), effective July 4, 2025.Interim Dividend: Announced on October 21, 2024, of Rs 15 per share (300%), effective October 31, 2024.Bonus Issues:A bonus issue was announced on January 30, 2015, with an existing ratio of 1:1, ex-bonus date on March 19, 2015.Stock Splits:A stock split was announced on January 30, 2015, with the old face value of Rs 10 and the new face value of Rs 5, ex-split date on March 19, 2015.Moneycontrol's sentiment analysis indicates a very bearish outlook for the stock as of July 17, 2025. Other stocks that were among the top losers on the Nifty 50 included SBI Life Insura, ICICI Bank, Eternal and Wipro."
Phoenix Mills shares rise 2.07% in Thursday's trading session,https://www.moneycontrol.com/news/business/stocks/phoenix-mills-shares-rise-2-07-in-thursday-s-trading-session-alpha-article-13288584.html,"Shares of Phoenix Mills gained 2.07% to trade at Rs 1,511.50 in Thursday's session. At 10:07 am, the stock showcased positive movement compared to its previous close, reflecting optimistic investor activity. Phoenix Mills is included as one of the stocks in the Nifty Midcap 150 index.Financial PerformanceHere is a summary of Phoenix Mills' key financial data:Consolidated Quarterly FinancialsThe following table presents the consolidated quarterly financial performance of Phoenix Mills:HeadingMar 2024Jun 2024Sep 2024Dec 2024Mar 2025RevenueRs 1,305.95 CroreRs 904.14 CroreRs 917.97 CroreRs 975.13 CroreRs 1,016.34 CroreNet ProfitRs 388.80 CroreRs 313.44 CroreRs 290.64 CroreRs 350.93 CroreRs 346.51 CroreEPS18.0913.018.177.417.52The revenue for the quarter-ending March 2025 stood at Rs 1,016.34 Crore, compared to Rs 1,305.95 Crore in March 2024. Net profit for the same period was Rs 346.51 Crore, slightly lower than the Rs 388.80 Crore reported in March 2024.Consolidated Yearly FinancialsThe following table presents the consolidated yearly financial performance of Phoenix Mills:Heading20212022202320242025RevenueRs 1,073.29 CroreRs 1,483.48 CroreRs 2,638.35 CroreRs 3,977.69 CroreRs 3,813.57 CroreNet ProfitRs 33.90 CroreRs 247.99 CroreRs 1,472.50 CroreRs 1,326.32 CroreRs 1,301.53 CroreEPS3.2013.3174.7661.3627.53BVPS360.96504.78620.13693.21292.24ROE1.073.6015.9311.629.42Debt to Equity0.750.600.510.490.45The annual revenue for 2025 was Rs 3,813.57 Crore, slightly down from Rs 3,977.69 Crore in 2024. Net profit also saw a minor decrease from Rs 1,326.32 Crore in 2024 to Rs 1,301.53 Crore in 2025.Consolidated Yearly Income StatementThe following table provides a detailed look at Phoenix Mills' consolidated yearly income statement:Mar 2025Mar 2024Mar 2023Mar 2022Mar 2021SalesRs 3,813 CroreRs 3,977 CroreRs 2,638 CroreRs 1,483 CroreRs 1,073 CroreOther IncomeRs 150 CroreRs 132 CroreRs 116 CroreRs 74 CroreRs 92 CroreTotal IncomeRs 3,964 CroreRs 4,109 CroreRs 2,754 CroreRs 1,557 CroreRs 1,165 CroreTotal ExpenditureRs 1,966 CroreRs 2,071 CroreRs 742 CroreRs 935 CroreRs 788 CroreEBITRs 1,998 CroreRs 2,038 CroreRs 2,012 CroreRs 622 CroreRs 377 CroreInterestRs 403 CroreRs 395 CroreRs 341 CroreRs 294 CroreRs 347 CroreTaxRs 293 CroreRs 316 CroreRs 198 CroreRs 80 CroreRs -4 CroreNet ProfitRs 1,301 CroreRs 1,326 CroreRs 1,472 CroreRs 247 CroreRs 33 CroreConsolidated Quarterly Income StatementThe following table provides a detailed look at Phoenix Mills' consolidated quarterly income statement:Mar 2025Dec 2024Sep 2024Jun 2024Mar 2024SalesRs 1,016 CroreRs 975 CroreRs 917 CroreRs 904 CroreRs 1,305 CroreOther IncomeRs 45 CroreRs 30 CroreRs 37 CroreRs 38 CroreRs 37 CroreTotal IncomeRs 1,061 CroreRs 1,005 CroreRs 955 CroreRs 942 CroreRs 1,343 CroreTotal ExpenditureRs 549 CroreRs 487 CroreRs 477 CroreRs 451 CroreRs 754 CroreEBITRs 511 CroreRs 517 CroreRs 477 CroreRs 491 CroreRs 588 CroreInterestRs 94 CroreRs 102 CroreRs 103 CroreRs 103 CroreRs 99 CroreTaxRs 71 CroreRs 64 CroreRs 83 CroreRs 74 CroreRs 99 CroreNet ProfitRs 346 CroreRs 350 CroreRs 290 CroreRs 313 CroreRs 388 CroreConsolidated Balance SheetThe following table presents the consolidated balance sheet of Phoenix Mills:Mar 2025Mar 2024Mar 2023Mar 2022Mar 2021Share CapitalRs 71 CroreRs 35 CroreRs 35 CroreRs 35 CroreRs 34 CroreReserves & SurplusRs 10,376 CroreRs 9,421 CroreRs 8,344 CroreRs 6,546 CroreRs 4,850 CroreCurrent LiabilitiesRs 2,368 CroreRs 2,245 CroreRs 2,578 CroreRs 2,041 CroreRs 2,064 CroreOther LiabilitiesRs 8,715 CroreRs 7,580 CroreRs 6,630 CroreRs 5,710 CroreRs 4,505 CroreTotal LiabilitiesRs 21,531 CroreRs 19,283 CroreRs 17,589 CroreRs 14,334 CroreRs 11,455 CroreFixed AssetsRs 17,017 CroreRs 14,020 CroreRs 12,641 CroreRs 9,250 CroreRs 8,175 CroreCurrent AssetsRs 2,696 CroreRs 3,387 CroreRs 3,466 CroreRs 3,817 CroreRs 2,017 CroreOther AssetsRs 1,817 CroreRs 1,875 CroreRs 1,481 CroreRs 1,266 CroreRs 1,262 CroreTotal AssetsRs 21,531 CroreRs 19,283 CroreRs 17,589 CroreRs 14,334 CroreRs 11,455 CroreContingent LiabilitiesRs 0 CroreRs 695 CroreRs 891 CroreRs 1,083 CroreRs 690 CroreConsolidated Cash FlowThe following table summarizes the consolidated cash flow statement of Phoenix Mills:Mar 2025Mar 2024Mar 2023Mar 2022Mar 2021Operating ActivitiesRs 2,083 CroreRs 2,161 CroreRs 1,356 CroreRs 780 CroreRs 436 CroreInvesting ActivitiesRs -2,162 CroreRs -1,859 CroreRs -1,536 CroreRs -2,841 CroreRs -954 CroreFinancing ActivitiesRs -47 CroreRs -299 CroreRs 136 CroreRs 2,227 CroreRs 521 CroreOthersRs 0 CroreRs 0 CroreRs 8 CroreRs 0 CroreRs 0 CroreNet Cash FlowRs -125 CroreRs 3 CroreRs -35 CroreRs 166 CroreRs 3 CroreFinancial RatiosKey financial ratios for Phoenix Mills are as follows:RatioMar 2021Mar 2022Mar 2023Mar 2024Mar 2025Basic EPS (Rs.)3.2013.3174.7661.3627.53Diluted EPS (Rs.)3.1913.3074.7161.3127.52Book Value / Share (Rs.)360.96504.78620.13693.21292.24Dividend/Share (Rs.)1.002.405.005.002.50P/E (x)121.9841.328.7022.6859.69P/B (x)2.752.982.775.245.61Debt to Equity (x)0.750.600.510.490.45Corporate ActionsPhoenix Mills has undertaken several corporate actions, including bonus issues and stock splits. Most recently, on July 14, 2025, the company disclosed the grant of approval for the voluntary strike-off of non-material wholly-owned subsidiaries. The company announced a bonus issue on July 31, 2024, with a bonus ratio of 1:1 and an ex-bonus date of September 20, 2024. Phoenix Mills had also announced a final dividend of Rs 5 per share (250%) on May 17, 2024, with an effective date of August 20, 2024. The stock split with old FV of 10 and new FV of 2 was announced on 2007-12-19 with exsplit date of Feb 13, 2008 and record date of Feb 20, 2008. Phoenix Mills' stock demonstrated a gain of 2.07% in today's trading session, trading at Rs 1,511.50."
Infosys shares decline 0.73%; stock among top losers on Nifty 50,https://www.moneycontrol.com/news/business/stocks/infosys-shares-decline-0-73-stock-among-top-losers-on-nifty-50-alpha-article-13288598.html,"Shares of Infosys were trading lower at Rs 1,596.20, a 0.73% decrease from the previous close, with the stock featuring among the top losers on the Nifty 50 index. At 10:10 am, the stock reflected a bearish sentiment in the market. Financial Snapshot: The following tables provide a summary of Infosys's financial performance. Quarterly Results (Consolidated):HeadingMar 2024Jun 2024Sep 2024Dec 2024Mar 2025RevenueRs 37,923.00 CroreRs 39,315.00 CroreRs 40,986.00 CroreRs 41,764.00 CroreRs 40,925.00 CroreNet ProfitRs 7,975.00 CroreRs 6,374.00 CroreRs 6,516.00 CroreRs 6,822.00 CroreRs 7,038.00 CroreEPS19.2515.3815.7116.4316.98The revenue for the quarter-ending March 2025 stood at Rs 40,925.00 Crore, while the revenue for the quarter-ending March 2024 was Rs 37,923.00 Crore. Net profit for the quarter-ending March 2025 was Rs 7,038.00 Crore, as compared to Rs 7,975.00 Crore for the quarter-ending March 2024. The EPS for the quarter-ending March 2025 was 16.98, while in March 2024, it was 19.25. Annual Results (Consolidated):Heading20212022202320242025RevenueRs 100,472.00 CroreRs 121,641.00 CroreRs 146,767.00 CroreRs 153,670.00 CroreRs 162,990.00 CroreNet ProfitRs 19,423.00 CroreRs 22,146.00 CroreRs 24,108.00 CroreRs 26,248.00 CroreRs 26,750.00 CroreEPS45.6152.5257.6363.3964.50BVPS180.75180.50183.17212.74231.11ROE25.3429.3431.9529.7727.87Debt to Equity0.000.000.000.000.00The company's revenue for the year-ending March 2025 increased to Rs 162,990.00 Crore compared to Rs 153,670.00 Crore in the year-ending March 2024. Net profit for the year-ending March 2025 stood at Rs 26,750.00 Crore, up from Rs 26,248.00 Crore in the year-ending March 2024. The EPS for the year-ending March 2025 was 64.50, compared to 63.39 in the year-ending March 2024. Key Financial Ratios:RatioMar 2021Mar 2022Mar 2023Mar 2024Mar 2025P/E (x)29.9936.3124.7823.6324.35P/B (x)7.6110.627.837.056.80EV/EBITDA (x)18.5023.1815.3014.7414.64P/S (x)5.786.584.034.043.99Return on Networth / Equity (%)25.3429.3431.9529.7727.87ROCE (%)31.7335.9638.7936.8135.85Return On Assets (%)17.8518.7519.1519.0317.93Current Ratio (X)2.542.001.812.312.27Quick Ratio (X)2.542.001.812.312.27Debt to Equity (x)0.000.000.000.000.00Interest Coverage Ratios (X)137.55168.93133.2187.52102.97Asset Turnover Ratio (%)92.691.081.201.171.14Inventory Turnover Ratio (X)0.000.000.000.000.00The P/E ratio for Infosys as of March 2025 is 24.35, and the P/B ratio is 6.80. The company's return on net worth stood at 27.87% for March 2025. The debt to equity ratio remained at 0.00 as of March 2025. Corporate Actions: Infosys announced that the first quarter results will be declared on July 23, 2025. Earlier dividends include a final dividend of Rs 22.00 per share (440%) with effective date of May 30, 2025, and an interim dividend of Rs 21.00 per share (420%) with effective date of October 29, 2024. The company has also announced bonus issues in the past, with the latest being on July 13, 2018, with a bonus ratio of 1:1. The stock split was announced on November 30, 1999, with old FV of 10 and new FV of 5, with exsplit date being January 24, 2000. With the stock currently trading at Rs 1,596.20, Infosys faces bearish sentiment as it is among the top losers on the Nifty 50 index."
Buy JSW Steel; target of Rs 1180: Motilal Oswal,https://www.moneycontrol.com/news/business/stocks/buy-jsw-steel-target-of-rs-1180-motilal-oswal-13288346.html,"Motilal Oswal's research report on JSW Steel JSTL is investing INR600b over the next three years to enhance steelmaking and downstream capacities, operational efficiency, and raw material resources. By Sep’27, Phase-I expansion will increase JSTL’s domestic crude steel capacity by 17% to 41.9mtpa. This phase includes major projects like Vijayanagar, BPSL and Dolvi. As of now, the 5mtpa JVML expansion has been completed, taking its total India capacity to 34mtpa. Further, a 7mtpa expansion is underway (2mtpa Vijayanagar + 5mpta Dolvi) and is targeted to be commissioned by Sep’27. Several debottlenecking projects are also planned (BPSL 0.5mtpa + Salem 0.2mtpa), which will altogether increase the capacity to 42mtpa by Sep’27. Additionally, Phase-II expansion (awaiting board approval) could increase the company’s total domestic capacity to 50mtpa by FY31. Outlook At CMP, JSTL trades at 7.6x FY27E EV/EBITDA. We reiterate our BUY rating on the stock with a TP of INR1,180 (premised on 8.5x EV/EBITDA on FY27 estimate). For all recommendations report, click here Disclaimer: The views and investment tips expressed by investment experts/broking houses/rating agencies on moneycontrol.com are their own, and not that of the website or its management. Moneycontrol.com advises users to check with certified experts before taking any investment decisions. JSW Steel - 17072025 - moti"
