title,link,content
OTM butterfly for slow market: Shubham Agarwal,https://www.moneycontrol.com/news/trends/expert-columns/otm-butterfly-for-slow-market-shubham-agarwal-13420465.html,"Butterfly is one of the most celebrated strategies after the margin benefits were introduced. Butterfly strategy is a strategy adopted by many option sellers. However, little credit has been given to Butterfly by Option buyers who are more interested in directional moves. Before we go into its use, let us understand what the Butterfly strategy is. Butterfly is a strategy that involves selling 2 options close to the current market price of the stock or index and buying a higher strike price option and a lower strike price option. A butterfly made with all calls is called a Call Butterfly, and with all Puts is called a Put Butterfly. The favourite of option sellers is selling both Call and Put of strike close to the current market price and buying a Higher strike Call and a Lower strike Put. This is called Iron Butterfly. For directional trades, we will restrict ourselves to Call and Put Butterfly, and we will go OTM. OTM or Out of the Money options are higher strike Call options and lower strike Put options. They are called OTM because if the stock had to expire exactly at the current price, these options would not make any money. Now, let us look at the slow-moving market to understand how OTM Butterflies can help. A slow-moving market, especially in the first half of the monthly expiry, is very difficult for a directional option trader. Especially when the premiums are too expensive due to a lot of time-related value in them. The first problem is cost. Second problem with these expensive options early in the expiry is that if it takes 2 weeks for the stock to move, the premium reduction due to passage of time is so severe that there is very little profit left for the trader despite the right call on direction. On the other hand, if we are towards the end of the expiry, the premiums are less expensive, but the loss due to the passage of time is very fast. In either case, the problem still remains of not being able to wait longer in the trade. Both are critical problems to be dealt with. Both of them can be cleared by a Call/Put Butterfly depending on the direction. Example of an OTM Call Butterfly Let us say you are bullish on a stock trading at 1000 with a target of 1040 1010 Call @ 13 1040 Call @ 5 1070 Call @ 2 Now, the choice is to buy 1010 Call at 13 and sit on it. 1040 comes after 20 days, and with 2-3 days to expiry, the Option trades around 30. Profit of 17. Or we create a Butterfly with Buy 1010, Sell 2 1040, and Buy 1070 Call. Ne Premium out is 5. Maximum profit = Diff between Buy and Sell strike (1040-1010 = 30) – Net Premium Paid (5) = 25. Here, if we go wrong, we lose 5 vs losing 13 in the Call bought. Also, the strategy on the day of expiry is profitable after 1015, whereas the 1010 Call on expiry is profitable only after 1023. Disclaimer: The views and investment tips expressed by experts on Moneycontrol.com are their own and not those of the website or its management. Moneycontrol.com advises users to check with certified experts before taking any investment decisions."
More than 40 small-cap stocks drop 10-24% amid tariff concerns,https://www.moneycontrol.com/news/business/markets/more-than-40-small-cap-stocks-drop-10-24-amid-tariff-concerns-13429906.html,"The broader indices underperformed the main indices and continued the fall in the third consecutive week, led by volatility amid better auto numbers, mixed earnings, and persistent FII selling after the US imposed additional tariffs on India. For the week, BSE Large-cap and Mid-cap indices shed 1 percent each, and the BSE Small-cap index slipped nearly 2 percent. For the week, the BSE Sensex index shed 742.12 points or 0.92 percent to finish at 79,857.79, while Nifty50 shed 202.05 points or 0.82 percent to end at 24,363.30. The Foreign Institutional Investors (FIIs) extended their selling in their sixth consecutive week, as they sold equities worth Rs 10,652.47 crore, despite remaining buyers in the final day of the week. On the other hand, Domestic Institutional Investors (DII) extended their buying in the 16th week, as they purchased equities worth Rs 33,608.66 crore. In this month on August so far, FII sold equities worth Rs 14,018.87 crore and DII bought equities worth Rs 36,795.52 crore. On the sectoral, Nifty Pharma, Realty, FMCG, Healthcare, lost 2 percent each, while PSU Bank, media, and metal rose 0.5-1.5 percent. ""Since July, the Indian equity market has remained in a phase of consolidation, reflecting weakening investor sentiment due to trade-aligned challenges. Concerns over steep US tariff rates and underwhelming quarterly earnings have dampened market confidence. Persistent selling by FIIs, particularly in pharma stocks with significant US exposure, underscores this cautious outlook. The continued depreciation of the INR has also added to investor anxiety,"" said Vinod Nair, Head of Research, Geojit Investments. ""Despite these headwinds, downside risks were partially cushioned by RBI’s reaffirmation of macroeconomic stability, its optimistic stance on domestic growth, and early signs of easing inflation. Looking ahead, market volatility is expected to persist. While risks from US trade tensions and sustained FII outflows remain, potential support from DIIs could offer some relief."" ""Upcoming inflation data from both India and the US will be critical in shaping investor expectations. Market participants are advised to closely track global trade developments and corporate earnings, with a strategic focus on domestic consumption-driven sectors that are better positioned to withstand short-term volatility,"" he added. The BSE Small-cap index slipped nearly 2 percent with PG Electroplast, Kitex Garments, Unichem Laboratories, Morepen Laboratories, Advait Energy Transitions, KR Rail Engineering, Faze Three, and Advanced Enzyme Technologies falling between 15-24 percent. However, Sarda Energy and Minerals, Timex Group India, Sanghvi Movers, Zinka Logistics Solutions, Centum Electronics, KRBL, Baazar Style Retail, Godfrey Phillips India, and Entertainment Network India gained between 12-21 percent.  Where is Nifty50 headed? Ajit Mishra – SVP, Research, Religare Broking Lingering uncertainty over the tariff situation, coupled with continued selling by FIIs, has been weighing on market sentiment. The medium-term moving average—the 100-day EMA—near the 24,600 mark, which earlier acted as support, is now serving as an immediate resistance. A close below 24,450 signals the continuation of the corrective phase, with a potential retest of the long-term moving average—the 200-day EMA—near 24,200. Traders are advised to align their positions accordingly, with greater emphasis on risk management."" Rupak De, Senior Technical Analyst at LKP Securities The Nifty moved southward as it failed to sustain above the 50 EMA on the hourly chart, indicating prevailing selling pressure. Moreover, the index closed below the crucial support level of 24,400, highlighting the strength of the bears. Sentiment was already tilted in favour of the bears, with the index forming a lower-top, lower-bottom pattern. The short-term trend remains weak, with potential downside towards 24,150–24,200. On the higher side, resistance is seen at 24,475–24,500. Nagaraj Shetti, Senior Technical Research Analyst at HDFC Securities After witnessing a sustainable bounce back from the lows on Thursday, Nifty witnessed sharp selloff on Friday. A long bear candle was formed on the daily chart that completely negated the bullish sentiment created on Thursday. A long negative candle has been formed on the weekly chart which is for the sixth consecutive week on the trot. The formation of long upper shadows in the last 4-5 weekly candles signals sell on every rise in the market. The underlying trend of Nifty continues to be weak. The next lower levels to be watched around 24200-24000 by next week. However, any pullback up to the hurdle of 24500 could be a sell on rise opportunity. Disclaimer: The views and investment tips expressed by experts on Moneycontrol.com are their own and not those of the website or its management. Moneycontrol.com advises users to check with certified experts before taking any investment decisions."
"Bulk deals: Promoter entity Indian Continent Investment sells shares worth Rs 11,227 crore in Bharti Airtel",https://www.moneycontrol.com/news/business/markets/bulk-deals-promoter-entity-indian-continent-investment-sells-shares-worth-rs-11-227-crore-in-bharti-airtel-13426030.html,"Promoter entity Indian Continent Investment has sold nearly a percent stake worth more than Rs 11,000 crore in telecom operator Bharti Airtel, via open market transactions on August 8. Indian Continent Investment offloaded the said stake through two transactions, selling 3 crore shares at Rs 1,870.4 per share and another 3 crore shares at Rs 1,871.95 per share, the bulk deals data on the exchanges showed. In total, the promoter entity sold 6 crore shares, equivalent to 0.98 percent of paid-up equity, worth Rs 11,227.05 crore in Bharti Airtel. As a result, the stock saw sharp gap-down opening and closed at Rs 1,858.6, down 3.33 percent amid high volumes. In fact, the volumes were highest in a single session since May 16. Further, the stock, technically, dropped below the lower line of Bollinger bands with bearish candle formation. Indian Continent Investment, in particular, held 2.47 percent stake in Bharti Airtel, and the total promoters shareholding was 51.25 percent as of June 2025. Meanwhile, Zinka Logistics Solutions, a technology-driven logistics company operating under the brand name BlackBuck, was also in focus. Sands Capital Private Growth II has sold 10.68 lakh shares (0.6% stake) in the company at Rs 520.47 per share, valued at Rs 55.58 crore. Sands Capital was holding 3.68 percent stake in Zinka as of June 2025. Despite this stake and the market weakness, the stock advanced 0.85 percent to finish at Rs 521.45, after a day of 7.88 percent correction. The action was also seen in EPACK Durable and Centum Electronics shares on Friday, rising 1.57 percent to Rs 395.30, and climbing 0.64 percent to Rs 2,421.3, respectively. Tata Mutual Fund has bought 15 lakh shares (1.56 percent stake) in EPACK Durable, the OEM and ODM manufacturer of living appliances, at Rs 390 per share, amounting to Rs 58.5 crore, however, Augusta Investments Zero Pte offloaded 38.5 lakh shares (4.01 percent stake) at Rs 391.02 per share, valued at Rs 150.5 crore. Augusta Investments was holding 10.13 percent stake in EPACK as of June 2025. Promoter Mallavarapu Venkata Apparao sold 6.6 lakh shares (equivalent to 4.5 percent stake) in Centum Electronics, the aerospace engineering company, at Rs 2,300.93 per share, amounting to Rs 153.2 crore. However, of which, HDFC Mutual Fund and 3P India Equity Fund acquired 3.5 percent stake worth Rs 118.45 crore. HDFC Mutual Fund bought 2.15 lakh shares at Rs 2,300 per share, while 3P India Equity Fund 1, and 3P India Equity Fund 1M purchased 3 lakh shares at same price."
"Tata Motors sees ICE margins under strain, bets on cost cuts and festive demand for recovery",https://www.moneycontrol.com/news/business/earnings/tata-motors-sees-ice-margins-under-strain-bets-on-cost-cuts-and-festive-demand-for-recovery-13426121.html,"Tata Motors expects its ICE vehicle or internal combustion engine margins to remain under pressure in the near term despite cost-cutting measures, as commodity inflation, a weak model mix and heavy industry discounting weigh on profitability. Management said ICE margins have been under stress for some time, with an additional blow from commodity inflation in the June quarter, driven mainly by higher steel prices, safeguard duty of 12 percent and forex risks. While a residual impact will spill into Q2, the company expects some improvement from current levels. Also read: The next earnings upgrade candidates could come from consumption, says Tata MF’s Rahul Singh However, margins are likely to stay subdued for the rest of the year as Tata Motors works to exit the calendar year with minimal modular stock. The company is banking on deeper cost-reduction efforts, a better model mix from curated variants of the Harrier and Safari, and possible price hikes in the second half — aided by festive demand — to lift margins by 3-4 percentage points over the next few quarters. In contrast, the EV business has been showing a steady improvement in profitability. Tata Motors said EV margins have been rising year-on-year even without battery localisation incentives, helped by significant cost cuts. The segment reached EBITDA breakeven with incentives in Q1, and management expects further margin gains as the mix improves with the Harrier.EV and other models. Tata Motors on August 8 reported a net profit of Rs 3,924 crore for the April-June quarter of the financial year 2026. This marks a 30 percent on-year drop from the Rs 5,643 crore net profit from continuing operations reported in the same period last year. The drop in net profit was in line with the Moneycontrol poll of six brokerage firms. Read more: FPIs have been sanguine about Indian markets: NSE CEO on market reaction to Trump tariffs The firm's revenue from operations meanwhile dropped 2.5 percent on-year to Rs 1.04 lakh crore in Q1 FY26, from Rs 1.07 lakh crore in Q1 FY25. Revenue however beat estimate, as brokerages polled by Moneycontrol had expected the firm's revenue to drop 8.7 percent. Shares of the company closed at Rs 634, lower by 2 percent from the last close on the NSE. Tata Motors' stock price is down nearly 15 percent since the beginning of the year. Disclaimer: The views and investment tips expressed by investment experts on Moneycontrol.com are their own and not those of the website or its management. Moneycontrol.com advises users to check with certified experts before taking any investment decisions."
Tata Motors races to secure rare earth magnet supply amid global risks,https://www.moneycontrol.com/news/business/earnings/tata-motors-races-to-secure-rare-earth-magnet-supply-amid-global-risks-13425916.html,"Tata Motors is taking no chances with its electric vehicle supply chain, as rare earth magnets—vital for EV motors—emerge as a potential global choke point. While production remains unaffected for now, the company is already working on alternatives to secure future supplies. Group CFO P.B. Balaji, speaking on the Q1 FY26 earnings call, said the company is evaluating all options: ""Redesigning, including lighter ones, including different sources, including different substitutes being put in place."" Also read: FPIs have been sanguine about Indian markets: NSE CEO on market reaction to Trump tariffs The push comes amid rising global concern over China’s dominance in rare earth supplies, which could spark shortages or price spikes in the event of geopolitical tension. Tata Motors, along with its UK-based unit Jaguar Land Rover, is preparing to respond with a multi-pronged strategy—ranging from supplier diversification to component redesign. Domestically, the company said it is covered for the next 2-3 months, and it is looking at alternatives outside of China. Balaji pointed out that past experiences have shaped this proactive stance. ""The learnings coming from the semiconductor crisis have meant that we have been off the blocks quite fast. And that has helped us cope with this quite well, both here (at Tata Motors) and in JLR. And that is what we are executing.” For now, there is no change to Tata Motors’ production or launch plans, but the company isn’t waiting for disruptions to materialise. Apart from this, Jaguar Land Rover is staring at a roadblock in China after the government cut the luxury tax threshold from 1.3 million RMB (Chinese yuan) to 900,000 RMB, pulling almost all Range Rover sales into the tax net and adding an extra 10 percent levy in a market where retail finance remains tight. Read more: China confirms PM Modi’s visit for SCO Summit in Tianjin on August 31, hopes for ‘solidarity and friendship’ The company is also grappling with higher US import tariffs. Recent trade agreements have eased the blow from an initially proposed 1,000 percent hike, but duties will still rise sharply — about 300 percent for vehicles built in the UK and 500 percent for those from Europe. These tariffs directly raise the landed cost of JLR’s cars in the US, potentially squeezing margins and limiting pricing flexibility. A planned 15 percent reduction in these rates is yet to take effect, meaning elevated costs will persist in one of its most important overseas markets. Tata Motors on August 8 reported a net profit of Rs 3,924 crore for the April-June quarter of the financial year 2026. This marks a 30 percent on-year drop from the Rs 5,643 crore net profit from continuing operations reported in the same period last year. The drop in net profit was in line with the Moneycontrol poll of six brokerage firms. The firm's revenue from operations meanwhile dropped 2.5 percent on-year to Rs 1.04 lakh crore in Q1 FY26, from Rs 1.07 lakh crore in Q1 FY25. Revenue however beat estimate, as brokerages polled by Moneycontrol had expected the firm's revenue to drop 8.7 percent. Shares of the company closed at Rs 634, lower by 2 percent from the last close on the NSE. Tata Motors' stock price is down nearly 15 percent since the beginning of the year. Disclaimer: The views and investment tips expressed by investment experts on Moneycontrol.com are their own and not those of the website or its management. Moneycontrol.com advises users to check with certified experts before taking any investment decisions."
Infosys Recognized as Top Cloud & Infrastructure Service Provider in UK & Ireland,https://www.moneycontrol.com/news/business/stocks/infosys-recognized-as-top-cloud-infrastructure-service-provider-in-uk-ireland-alpha-article-13424559.html,"Infosys (INFY) named top Cloud & Infrastructure Services provider in the UK & Ireland, according to the Whitelane Research IT Sourcing Study 2025. The report, which surveyed nearly 400 participants from leading IT spenders in the UK&I, assessing over 1,000 IT sourcing relationships and more than 1,100 cloud platform engagements, recognized Infosys as an ""Exceptional Performer"" for the second straight year. Key highlights from the report: #1 in UK&I Cloud & Infrastructure: Infosys secured an 80% client satisfaction score for expertise spanning data center maintenance, integration, managed infrastructure services, and IaaS/PaaS offerings.Exceptional Performer: Consistent high performance in cloud and infrastructure solutions for 2 consecutive years (2024 & 2025).Top 3 in General Satisfaction: Maintained strong overall satisfaction demonstrating consistent performance across a broad range of IT services.Above-Market Satisfaction: Overall satisfaction scores are 6% higher than the market average (74%) in cloud & infrastructure services, and 7% above the general satisfaction ranking.High Client Satisfaction:73% of clients reported being ""satisfied"" or ""very satisfied"", with 100% positive satisfaction in the Cloud & Infrastructure Services segment.Strong in Application Services: Recognized as a ""Strong Performer"" in application development, maintenance, and testing. Alex van den Bergh, Head of Research, Europe, Whitelane Research, stated the study highlights Infosys' unmatched capabilities in a dynamic market where enterprises prioritize robust, innovative, and value-driven IT partnerships. He added that demand for transformative cloud solutions will intensify, positioning organizations with high-impact results and client-centricity to lead. Umashankar Lakshmipathy, EVP and Head of Cloud, Infrastructure, and Security Services, EMEA, Infosys, noted the company's pride in the recognition, attributing their high satisfaction levels, including an 80% client satisfaction score, to a deep understanding of client challenges and leveraging expertise in data center, managed infrastructure, IaaS/PaaS, and Infosys Cobalt offerings. Read more on the 2025 Whitelane UK & Ireland study here. For more on Infosys' cloud and infrastructure offerings, visit www.infosys.com/cobalt Infosys (NSE, BSE, NYSE: INFY) is a global leader in next-generation digital services and consulting, enabling clients in 59 countries to navigate digital transformation. With over 320,000 employees, Infosys leverages over four decades of experience, an AI-first core, and agile digital at scale to drive continuous improvement for enterprises. Visit www.infosys.com. Certain statements in this release are forward-looking and subject to risks and uncertainties under the Private Securities Litigation Reform Act of 1995. For more information, contact: PR_Global@infosys.com"
"Taking Stock: Bears back in action; Nifty breaks 24,400 first time since May 7",https://www.moneycontrol.com/news/business/markets/taking-stock-bears-back-in-action-nifty-breaks-24-400-first-time-since-may-7-13422533.html,"Bears came back strongly on August 8 dragging Nifty below 24,400 for the first time since May 7, 2025, amid selling across the sectors and rising concern over fresh tariff from US. At close, the Sensex was down 765.47 points or 0.95 percent at 79,857.79, and the Nifty was down 232.85 points or 0.95 percent at 24,363.30. BSE Midcap index fell 1.5 percent and smallcap index shed 1 percent. For the week BSE Sensex and Nifty down nearly a percent each. Both indices were down for 6th week in a row, a longest losing streak in 5 years. Also Read - Tata Capital kicks off investor roadshows for Rs 17,000-crore IPO Biggest Nifty losers included Adani Enterprises, Bharti Airtel, Shriram Finance, IndusInd Bank, M&M, while gainers were Titan Company, NTPC, Dr Reddy's Labs, HDFC Life, Bajaj Finserv. All the sectoral indices ended in the red with metal, realty, pharma, auto, private bank, consumer durables down 1-2 percent. Also Read: SBI Q1 results: Net profit rises 12% to Rs 19,160 crore, beats estimates In stock-specific action, Schneider Electric Infrastructure shares shed 5 percent as Q1 profit down 15%, KRBL share price jumped 15 percent on strong Q1 numbers, LIC shares jump 3% after Q1 net profit jumps 5%, Ramco Cements shares shed 6 percent despite profit up 131%, Kalyan Jewellers shares plunged 10 percent despite better Q1 earnings, Cummins India shares rose 3 percent after Q1 standalone profit rises 40%, General Insurance Corporation of India share price added 4 percent after Q1 profit jumps 80%. NDSL share price extended the gains on third day with 15% gain, Biocon share price shed 6 percent as profit down 95%, Mukand shares added 11 percent on strong numbers, Subros share price down 7 percent as Q1 net profit increases 16.6%, Gujarat State Fertilizers added 7 percent as consolidated profit jumps 58%, Global Health shares hit 52-week high as Q1 consolidated profit jumps 49%, ESAF Small Finance Bank shares down 3 percent as Q1 net loss stands at Rs 81.2 crore. Nearly 120 stocks touched their 52-week highs on the BSE, including Global Health, Sai Life Sciences, JK Cement, Nuvoco Vistas, Delhivery, Star Cement, TVS Motor, among others. Click to View More Outlook for August 11 Rupak De, Senior Technical Analyst at LKP Securities The Nifty moved southward as it failed to sustain above the 50 EMA on the hourly chart, indicating prevailing selling pressure. Moreover, the index closed below the crucial support level of 24,400, highlighting the strength of the bears. Sentiment was already tilted in favour of the bears, with the index forming a lower-top, lower-bottom pattern. The short-term trend remains weak, with potential downside towards 24,150–24,200. On the higher side, resistance is seen at 24,475–24,500. Nagaraj Shetti, Senior Technical Research Analyst at HDFC Securities After witnessing a sustainable bounce back from the lows on Thursday, Nifty witnessed sharp selloff on Friday and closed the day lower by 232 points. Nifty opened on a downside gap of 52 points and started to show further weakness soon after the opening. A long bear candle was formed on the daily chart that completely negated the bullish sentiment created on Thursday. A long negative candle has been formed on the weekly chart which is for the sixth consecutive weeks on the trot. The formation of long upper shadows in the last 4-5 weekly candles signal sell on every rise in the market. The underlying trend of Nifty continues to be weak. The next lower levels to be watched around 24200-24000 by next week. However, any pullback up to the hurdle of 24500 could be a sell on rise opportunity. Disclaimer: The views and investment tips expressed by experts on Moneycontrol.com are their own and not those of the website or its management. Moneycontrol.com advises users to check with certified experts before taking any investment decisions."
