title,link,content
Coforge shares slide 6% after major client’s weak quarterly results rattle investors,https://www.moneycontrol.com/news/business/markets/coforge-shares-slide-6-after-major-client-s-weak-quarterly-results-rattle-investors-13422363.html,"Shares of Coforge slipped 6 percent to Rs 1,605 in the afternoon on August 8, sinking for the third time in four sessions and wiping over 10 percent in just four days, after key client Sabre Corp plunged 35 percent on the Nasdaq overnight following a lacklustre quarterly report. Sabre’s revenue and EBITDA for the current quarter came in below earlier projections, prompting the travel technology firm to sharply scale back its full-year outlook. Growth in Air Distribution Volumes is now expected at just 4–10 percent, compared to its previous double-digit forecast. Revenue guidance was cut to flat-to-low single-digit growth from high single digits earlier, while adjusted pro forma EBITDA guidance was lowered to $530–570 million from $630 million. Follow our LIVE blog for all the latest market updates Under a 13-year agreement, Coforge is a key partner for Sabre, tasked with bolstering product delivery and building AI-powered solutions. The midcap IT firm posted an 8 percent growth in revenue in constant currency terms for the June quarter. The performance also sharply contrasted with Persistent Systems and LTIMindtree, which reported CC growth of 3.3 percent and 0.8 percent, respectively. A key growth driver this quarter was the ramp-up of Coforge’s $1.6 billion contract with Sabre, which powered a 31 percent sequential surge in its travel, transportation, and hospitality vertical. This helped offset weakness in its BFSI segment, where banking revenue slipped 1.1 percent and insurance saw a modest 1 percent uptick in US dollar terms. The company’s rupee revenue rose 8.6 percent sequentially to Rs 3,687 crore. On the margin front, EBITDA improved by 60 basis points to 17.5 percent, while EBIT margin held steady at 13.2 percent. Coforge secured new deals worth $507 million during the quarter. While this is significantly lower than the $2.1 billion haul in the previous quarter, the earlier number included the mega Sabre deal. Importantly, the executable order book for the next 12 months now stands at $1.54 billion—up 3 percent sequentially and a robust 44 percent year-on-year. At about 1:40 am, shares of the company were trading at Rs 1,614, lower by 5.2 percent from the last close on the NSE. Coforge shares are down over 16 percent since the beginning of the year. Disclaimer: The views and investment tips expressed by investment experts on Moneycontrol.com are their own and not those of the website or its management. Moneycontrol.com advises users to check with certified experts before taking any investment decisions. "
Adani Enterpris share price falls 3.43%; stock among top losers on Nifty 50,https://www.moneycontrol.com/news/business/stocks/adani-enterpris-share-price-falls-3-43-stock-among-top-losers-on-nifty-50-alpha-article-13422669.html,"Shares of Adani Enterpris declined 3.43% to Rs 2,172.70 in Friday's session, making it among the top losers on the Nifty 50. This drop reflects a bearish sentiment, aligning with a Moneycontrol analysis conducted on August 5, 2025. Bharti Airtel and JSW Steel also featured among the top losers on the Nifty 50, with declines of 2.88% and 2.08%, respectively. Grasim and Shriram Finance were also among the significant losers. Financial Overview of Adani Enterpris The following tables provide a detailed look at the consolidated financial performance of Adani Enterpris. Income Statement (Quarterly)HeadingJun 2024Sep 2024Dec 2024Mar 2025Jun 2025RevenueRs 25,472.40 CroreRs 22,608.07 CroreRs 22,848.42 CroreRs 26,965.86 CroreRs 21,961.20 CroreNet ProfitRs 1,648.20 CroreRs 1,890.98 CroreRs -16.54 CroreRs 3,974.62 CroreRs 895.03 CroreEPS12.3014.820.0432.986.02In the quarterly results, there is fluctuation in revenue. The revenue decreased by 13.74% from Rs 25,472.40 crore in June 2024 to Rs 21,961.20 crore in June 2025. Net profit also saw a decrease, from Rs 1,648.20 crore in June 2024 to Rs 895.03 crore in June 2025. Income Statement (Yearly)Heading20212022202320242025RevenueRs 39,537.13 CroreRs 69,420.18 CroreRs 136,977.76 CroreRs 96,420.98 CroreRs 97,894.75 CroreNet ProfitRs 746.32 CroreRs 475.37 CroreRs 2,208.94 CroreRs 3,293.40 CroreRs 7,510.22 CroreEPS8.397.0621.7827.2460.55BVPS171.94196.55279.60309.43413.19ROE5.373.597.759.1814.88Debt to Equity0.891.901.201.421.60Yearly results show a fluctuating revenue trend. The revenue increased by 1.53% from Rs 96,420.98 crore in 2024 to Rs 97,894.75 crore in 2025. Net profit significantly increased from Rs 3,293.40 crore in 2024 to Rs 7,510.22 crore in 2025. Cash FlowHeadingMar 2021Mar 2022Mar 2023Mar 2024Mar 2025Operating ActivitiesRs 4,093 CroreRs 1,385 CroreRs 17,626 CroreRs 10,312 CroreRs 4,513 CroreInvesting ActivitiesRs -7,902 CroreRs -17,487 CroreRs -16,860 CroreRs -19,082 CroreRs -26,258 CroreFinancing ActivitiesRs 3,058 CroreRs 15,901 CroreRs -1,197 CroreRs 8,878 CroreRs 21,947 CroreOthersRs -708 CroreRs 446 CroreRs 1,401 CroreRs 315 CroreRs 597 CroreNet Cash FlowRs -1,458 CroreRs 246 CroreRs 970 CroreRs 424 CroreRs 799 CroreBalance SheetHeadingMar 2021Mar 2022Mar 2023Mar 2024Mar 2025Share CapitalRs 109 CroreRs 109 CroreRs 114 CroreRs 114 CroreRs 115 CroreReserves & SurplusRs 17,048 CroreRs 21,506 CroreRs 31,759 CroreRs 35,160 CroreRs 47,574 CroreCurrent LiabilitiesRs 21,483 CroreRs 43,849 CroreRs 44,803 CroreRs 44,651 CroreRs 47,383 CroreOther LiabilitiesRs 13,001 CroreRs 36,293 CroreRs 64,810 CroreRs 80,805 CroreRs 103,062 CroreTotal LiabilitiesRs 51,642 CroreRs 101,760 CroreRs 141,487 CroreRs 160,731 CroreRs 198,135 CroreFixed AssetsRs 19,511 CroreRs 53,366 CroreRs 80,019 CroreRs 100,117 CroreRs 127,689 CroreCurrent AssetsRs 19,963 CroreRs 30,945 CroreRs 37,121 CroreRs 36,860 CroreRs 40,744 CroreOther AssetsRs 12,168 CroreRs 17,448 CroreRs 24,346 CroreRs 23,753 CroreRs 29,701 CroreTotal AssetsRs 51,642 CroreRs 101,760 CroreRs 141,487 CroreRs 160,731 CroreRs 198,135 CroreContingent LiabilitiesRs 12,661 CroreRs 23,396 CroreRs 42,708 CroreRs 35,441 CroreRs 37,242 CroreFinancial RatiosRatioMar 2021Mar 2022Mar 2023Mar 2024Mar 2025Basic EPS (Rs.)8.397.0621.7827.2460.55Diluted Eps (Rs.)8.397.0621.7827.2460.55Book Value [Excl. Reval Reserve]/Share (Rs.)171.94196.55279.60309.43413.19Dividend/Share (Rs.)1.001.001.201.301.30Face Value11111Gross Profit Margin (%)8.246.807.3113.7217.08Operating Margin (%)6.885.005.5410.5712.78Net Profit Margin (%)1.880.681.613.417.65Return on Networth / Equity (%)5.373.597.759.1814.88ROCE (%)9.026.007.848.788.29Return On Assets (%)1.780.761.742.013.58Current Ratio (X)0.930.710.830.830.86Quick Ratio (X)0.850.550.670.610.64Debt to Equity (x)0.891.901.201.421.60Interest Coverage Ratios (X)1.981.872.532.912.80Asset Turnover Ratio (%)76.550.911.130.640.55Inventory Turnover Ratio (X)22.500.590.590.950.983 Yr CAGR Sales (%)4.9131.1277.6556.1618.753 Yr CAGR Net Profit (%)51.0545.8766.38110.07297.48P/E (x)122.90285.3880.37117.3738.25P/B (x)6.6110.266.2610.325.62EV/EBITDA (x)39.4655.7523.6731.1420.54P/S (x)2.873.191.463.782.74Corporate ActionsBonus Issues: The company had bonus issues on multiple occasions, including 1:1 ratios on October 30, 2009, August 1, 1999, and September 4, 1996.Rights Issues: A rights issue was announced on October 30, 2009, with a ratio of 1:16.Stock Splits: The company executed a stock split on May 5, 2004, with a face value change from Rs 10 to Rs 1.Dividends: Adani Enterprises has consistently issued final dividends, with the most recent announcement on May 2, 2025, for Rs 1.30 per share.Adani Enterpris is currently trading among the top losers in today's session with negative market sentiment."
"NTPC, Titan Company among top gainers on Nifty 50",https://www.moneycontrol.com/news/business/stocks/ntpc-titan-company-among-top-gainers-on-nifty-50-alpha-article-13422673.html,"At 1:30 pm, NTPC and Titan Company emerged as top gainers on Nifty 50. NTPC was trading at Rs 336.40, a gain of 2.02%. Titan Company was trading at Rs 3,462.00, up 1.36%. Other stocks that saw gains include HDFC Life (0.89%), Trent (0.85%), and TATA Cons. Prod (0.67%). These stocks are showing positive movement in Friday's session. NTPC Financial Highlights: Quarterly Performance: NTPC's consolidated quarterly revenue shows some fluctuation. The revenue for the quarter-ending June 2025 was Rs 47,065.36 Crore, slightly down from Rs 48,520.57 Crore in June 2024. Net profit for the same period increased to Rs 5,631.89 Crore, compared to Rs 4,772.11 Crore in the previous year. The EPS also increased to Rs 6.20 from Rs 5.65. The following table presents a summary of NTPC's quarterly financial performance:HeadingJun 2024Sep 2024Dec 2024Mar 2025Jun 2025RevenueRs 48,520.57 CroreRs 44,696.30 CroreRs 45,052.82 CroreRs 49,833.70 CroreRs 47,065.36 CroreNet ProfitRs 4,772.11 CroreRs 4,990.50 CroreRs 4,712.20 CroreRs 7,264.63 CroreRs 5,631.89 CroreEPS5.655.445.227.856.20Annual Performance: NTPC's consolidated annual revenue has shown a consistent increase over the past five years. In 2025, the revenue reached Rs 188,138.06 Crore, up from Rs 178,500.88 Crore in 2024. Net profit also increased to Rs 21,739.44 Crore in 2025 from Rs 19,696.85 Crore in 2024. The EPS increased to Rs 24.16 from Rs 21.46. The following table summarizes the annual financial performance:Heading20212022202320242025RevenueRs 111,531.15 CroreRs 132,669.28 CroreRs 176,206.93 CroreRs 178,500.88 CroreRs 188,138.06 CroreNet ProfitRs 14,285.53 CroreRs 15,940.16 CroreRs 16,341.58 CroreRs 19,696.85 CroreRs 21,739.44 CroreEPS14.8717.2017.4421.4624.16BVPS133.31143.49155.68170.29189.83ROE11.6312.3111.5012.9512.72Debt to Equity1.571.551.501.461.34Titan Company Financial Highlights: Quarterly Performance: Titan Company's consolidated quarterly revenue has also seen growth. The revenue for the quarter-ending June 2025 was Rs 16,523.00 Crore, up from Rs 13,266.00 Crore in June 2024. Net profit for the same period increased to Rs 1,091.00 Crore, compared to Rs 715.00 Crore in the previous year. The EPS also increased to Rs 12.30 from Rs 8.06. The following table presents a summary of Titan Company's quarterly financial performance:HeadingJun 2024Sep 2024Dec 2024Mar 2025Jun 2025RevenueRs 13,266.00 CroreRs 14,534.00 CroreRs 17,740.00 CroreRs 14,916.00 CroreRs 16,523.00 CroreNet ProfitRs 715.00 CroreRs 703.00 CroreRs 1,047.00 CroreRs 871.00 CroreRs 1,091.00 CroreEPS8.067.9411.809.8212.30Annual Performance: Titan Company's consolidated annual revenue has shown a consistent increase over the past five years. In 2025, the revenue reached Rs 60,456.00 Crore, up from Rs 51,084.00 Crore in 2024. However, net profit decreased slightly to Rs 3,336.00 Crore in 2025 from Rs 3,495.00 Crore in 2024. The EPS also decreased to Rs 37.62 from Rs 39.40. The following table summarizes the annual financial performance:Heading20212022202320242025RevenueRs 21,644.00 CroreRs 28,799.00 CroreRs 40,575.00 CroreRs 51,084.00 CroreRs 60,456.00 CroreNet ProfitRs 979.00 CroreRs 2,198.00 CroreRs 3,273.00 CroreRs 3,495.00 CroreRs 3,336.00 CroreEPS10.9624.4936.6139.4037.62BVPS84.29104.87133.75105.54130.61ROE12.9723.3527.4237.2128.70Debt to Equity0.580.060.631.401.56NTPC has announced several corporate actions. The company's board has provided updates, including business responsibility and sustainability reporting for the financial year 2024-25, the integrated annual report for the same period, and the notice of the 49th Annual General Meeting scheduled for August 29, 2025. Titan Company has also announced corporate actions. These include announcements under Regulation 30 (LODR), such as analyst/investor meet outcomes, changes in directorate with the re-appointment of Mr. Sandeep Singhal, and investor presentations for the first quarter earnings of FY 2025-26. NTPC and Titan Company are currently among the top gainers on the Nifty 50 as of 1:30 pm on Friday."
"Tata Consultancy Services share price trades flat; hits intraday high of Rs 3,059.80",https://www.moneycontrol.com/news/business/stocks/tata-consultancy-services-share-price-trades-flat-hits-intraday-high-of-rs-3-059-80-alpha-article-13422685.html,"Tata Consultancy Services shares were trading flat in Friday's session, with the stock currently priced at Rs 3,041.10. This comes as the stock touched a day's high of Rs 3,059.80, a 0.42 percent increase from its previous close. The scrip touched an intraday low of Rs 3,037.10, a 0.32 percent decline from the previous close at 1:30 pm. Financial Performance: Tata Consultancy Services' financial performance reveals the following trends based on consolidated figures: Quarterly Results: Revenue: The company's revenue has shown a fluctuating pattern over the last five quarters. The revenue for June 2025 stood at Rs 63,437 Crore, slightly lower than the Rs 64,479 Crore recorded in March 2025. The revenue for December 2024 was Rs 63,973 Crore, and for September 2024, it was Rs 64,259 Crore. The revenue for June 2024 was Rs 62,613 Crore. Net Profit: The net profit for June 2025 was Rs 12,819 Crore, which is higher than the net profit of Rs 12,293 Crore in March 2025. The net profit for December 2024 was Rs 12,444 Crore, and for September 2024, it was Rs 11,955 Crore. The net profit for June 2024 was Rs 12,105 Crore. EPS: The earnings per share (EPS) for June 2025 was Rs 35.27, higher than the EPS of Rs 33.79 in March 2025. The EPS for December 2024 was Rs 34.21, and for September 2024, it was Rs 32.92. The EPS for June 2024 was Rs 33.28.HeadingJun 2024Sep 2024Dec 2024Mar 2025Jun 2025RevenueRs 62,613.00 CroreRs 64,259.00 CroreRs 63,973.00 CroreRs 64,479.00 CroreRs 63,437.00 CroreNet ProfitRs 12,105.00 CroreRs 11,955.00 CroreRs 12,444.00 CroreRs 12,293.00 CroreRs 12,819.00 CroreEPSRs 33.28 CroreRs 32.92 CroreRs 34.21 CroreRs 33.79 CroreRs 35.27 CroreAnnual Results: Revenue: The company's revenue has shown consistent growth over the past five years. For the year 2025, the revenue was Rs 255,324 Crore, compared to Rs 240,893 Crore in 2024. In 2023, the revenue was Rs 225,458 Crore, and in 2022, it was Rs 191,754 Crore. The revenue for 2021 was Rs 164,177 Crore. Net Profit: The net profit has also increased steadily over the years. The net profit for 2025 was Rs 48,797 Crore, up from Rs 46,099 Crore in 2024. In 2023, the net profit was Rs 42,303 Crore, and in 2022, it was Rs 38,449 Crore. The net profit for 2021 was Rs 32,562 Crore. EPS: The earnings per share (EPS) has risen consistently. The EPS for 2025 was Rs 134.19, compared to Rs 125.88 in 2024. In 2023, the EPS was Rs 115.19, and in 2022, it was Rs 103.62. The EPS for 2021 was Rs 86.71. BVPS: The book value per share (BVPS) has also increased over the years. The BVPS for 2025 was Rs 261.76, compared to Rs 252.26 in 2024. In 2023, the BVPS was Rs 249.20, and in 2022, it was Rs 245.48. The BVPS for 2021 was Rs 235.43. ROE: The return on equity (ROE) has shown an upward trend. The ROE for 2025 was 51.24%, compared to 50.73% in 2024. In 2023, the ROE was 46.61%, and in 2022, it was 42.99%. The ROE for 2021 was 37.52%. Debt to Equity: The debt-to-equity ratio has remained at 0.00 over the past five years.Heading20212022202320242025RevenueRs 164,177.00 CroreRs 191,754.00 CroreRs 225,458.00 CroreRs 240,893.00 CroreRs 255,324.00 CroreNet ProfitRs 32,562.00 CroreRs 38,449.00 CroreRs 42,303.00 CroreRs 46,099.00 CroreRs 48,797.00 CroreEPSRs 86.71 CroreRs 103.62 CroreRs 115.19 CroreRs 125.88 CroreRs 134.19 CroreBVPSRs 235.43 CroreRs 245.48 CroreRs 249.20 CroreRs 252.26 CroreRs 261.76 CroreROE37.5242.9946.6150.7351.24Debt to Equity0.000.000.000.000.00The consolidated annual income statement shows consistent growth in sales and net profit. Sales increased from Rs 164,177 Crore in March 2021 to Rs 255,324 Crore in March 2025. Net profit also rose from Rs 32,562 Crore in March 2021 to Rs 48,797 Crore in March 2025.Mar 2025Mar 2024Mar 2023Mar 2022Mar 2021Sales255,324240,893225,458191,754164,177Other Income3,9624,4223,4494,0183,134Total Income259,286245,315228,907195,772167,311Total Expenditure193,159182,540171,221143,301122,914EBIT66,12762,77557,68652,47144,397Interest796778779784637Tax16,53415,89814,60413,23811,198Net Profit48,79746,09942,30338,44932,562The company announced several dividends. On June 27, 2025, an interim dividend of Rs 11.00 per share (1100%) was announced. Prior to that, on April 11, 2025, a final dividend of Rs 30.00 per share (3000%) was announced. A special dividend of Rs 66.00 per share (6600%) was announced on January 9, 2025. Tata Consultancy Services shares were trading flat in Friday's session, with the stock currently priced at Rs 3,041.10."
"Larsen &Toubro shares trade flat; stock touches day's high of Rs 3,662.30",https://www.moneycontrol.com/news/business/stocks/larsen-toubro-shares-trade-flat-stock-touches-day-s-high-of-rs-3-662-30-alpha-article-13422695.html,"Shares of Larsen & Toubro were trading flat in Friday's session, with the stock currently priced at Rs 3,628.80. This represents a decrease of 0.35% from the previous close. During the session, the stock touched a high of Rs 3,662.30, marking a 0.57% increase from its day's high price. The stock also touched a low of Rs 3,624.20, a -0.48% change from its day's low price. Financial Performance: The following table presents the consolidated quarterly financial performance of Larsen & Toubro:HeadingJun 2024Sep 2024Dec 2024Mar 2025Jun 2025RevenueRs 55,119.82 CroreRs 61,554.58 CroreRs 64,667.78 CroreRs 74,392.28 CroreRs 63,678.92 CroreNet ProfitRs 3,440.11 CroreRs 4,112.81 CroreRs 4,001.03 CroreRs 6,133.44 CroreRs 4,325.57 CroreEPS20.2624.6924.4339.9826.30The revenue for the quarter ending June 2025 stood at Rs 63,678.92 Crore, which is an increase compared to the previous quarter. The net profit for the same period was Rs 4,325.57 Crore, and the earnings per share (EPS) was Rs 26.30. The following table presents the consolidated yearly financial performance of Larsen & Toubro:Heading20212022202320242025RevenueRs 135,979.03 CroreRs 156,521.23 CroreRs 183,340.70 CroreRs 221,112.91 CroreRs 255,734.45 CroreNet ProfitRs 4,668.96 CroreRs 10,291.05 CroreRs 12,624.87 CroreRs 15,569.72 CroreRs 17,687.39 CroreEPS82.4961.7174.5193.96109.36BVPS625.97678.79736.87746.01710.12ROE15.2610.5211.7215.1215.39Debt to Equity1.731.501.331.321.33The annual revenue for the year 2025 was Rs 255,734.45 Crore, an increase compared to Rs 221,112.91 Crore in 2024. The net profit for the year 2025 was Rs 17,687.39 Crore, also higher than the Rs 15,569.72 Crore reported in the previous year. The earnings per share (EPS) increased from Rs 93.96 in 2024 to Rs 109.36 in 2025. The following table presents key highlights from the annual consolidated income statement:Mar 2025Mar 2024Mar 2023Mar 2022Mar 2021SalesRs 255,734 CroreRs 221,112 CroreRs 183,340 CroreRs 156,521 CroreRs 135,979 CroreOther IncomeRs 4,124 CroreRs 4,158 CroreRs 2,929 CroreRs 2,267 CroreRs 3,429 CroreTotal IncomeRs 259,859 CroreRs 225,270 CroreRs 186,269 CroreRs 158,788 CroreRs 139,408 CroreTotal ExpenditureRs 232,946 CroreRs 201,207 CroreRs 165,953 CroreRs 141,154 CroreRs 126,815 CroreEBITRs 26,913 CroreRs 24,062 CroreRs 20,316 CroreRs 17,633 CroreRs 12,593 CroreInterestRs 3,334 CroreRs 3,545 CroreRs 3,207 CroreRs 3,125 CroreRs 3,913 CroreTaxRs 5,891 CroreRs 4,947 CroreRs 4,484 CroreRs 4,216 CroreRs 4,010 CroreNet ProfitRs 17,687 CroreRs 15,569 CroreRs 12,624 CroreRs 10,291 CroreRs 4,668 CroreThe company's sales increased from Rs 221,112 Crore in March 2024 to Rs 255,734 Crore in March 2025. Net profit also rose from Rs 15,569 Crore to Rs 17,687 Crore during the same period. Cash Flow: The following table provides an overview of the company's cash flow activities:Mar 2025Mar 2024Mar 2023Mar 2022Mar 2021Operating ActivitiesRs 9,160 CroreRs 18,266 CroreRs 22,776 CroreRs 19,163 CroreRs 22,844 CroreInvesting ActivitiesRs -15,517 CroreRs 2,163 CroreRs -8,311 CroreRs -3,667 CroreRs -5,428 CroreFinancing ActivitiesRs 6,556 CroreRs -25,413 CroreRs -11,572 CroreRs -15,181 CroreRs -15,274 CroreOthersRs 28 CroreRs 15 CroreRs 263 CroreRs 82 CroreRs 0 CroreNet Cash FlowRs 228 CroreRs -4,968 CroreRs 3,156 CroreRs 396 CroreRs 2,140 CroreBalance Sheet: The following table summarizes the key components of Larsen & Toubro's balance sheet:Mar 2025Mar 2024Mar 2023Mar 2022Mar 2021Share CapitalRs 275 CroreRs 274 CroreRs 281 CroreRs 496 CroreRs 1,404 CroreReserves & SurplusRs 97,380 CroreRs 85,533 CroreRs 88,577 CroreRs 81,755 CroreRs 75,204 CroreCurrent LiabilitiesRs 201,970 CroreRs 176,600 CroreRs 162,065 CroreRs 159,433 CroreRs 137,408 CroreOther LiabilitiesRs 79,897 CroreRs 77,217 CroreRs 79,427 CroreRs 78,363 CroreRs 97,257 CroreTotal LiabilitiesRs 379,524 CroreRs 339,627 CroreRs 330,352 CroreRs 320,048 CroreRs 311,273 CroreFixed AssetsRs 38,295 CroreRs 38,207 CroreRs 37,907 CroreRs 36,509 CroreRs 36,752 CroreCurrent AssetsRs 245,341 CroreRs 218,079 CroreRs 222,204 CroreRs 208,181 CroreRs 194,966 CroreOther AssetsRs 95,886 CroreRs 83,339 CroreRs 70,240 CroreRs 75,358 CroreRs 79,554 CroreTotal AssetsRs 379,524 CroreRs 339,627 CroreRs 330,352 CroreRs 320,048 CroreRs 311,273 CroreContingent LiabilitiesRs 28,086 CroreRs 21,246 CroreRs 19,620 CroreRs 23,020 CroreRs 21,540 CroreKey Financial Ratios: Key financial ratios for Larsen & Toubro show a P/E ratio of 31.93 and a P/B ratio of 4.92 as of March 2025. The company reported a debt-to-equity ratio of 1.33 as of the year-ending March 2025.ParticularsMar 2025Mar 2024Mar 2023Mar 2022Mar 2021Basic EPS (Rs.)109.3693.9674.5161.7182.49Diluted Eps (Rs.)109.2893.8874.4561.6582.41Book Value [Excl. Reval Reserve]/Share (Rs.)710.12746.01736.87678.79625.97Dividend/Share (Rs.)34.0034.0024.0022.0036.00Face Value22222Gross Profit Margin (%)11.9412.5012.9113.0814.01Operating Margin (%)10.3310.8411.0011.2011.87Net Profit Margin (%)6.917.046.886.579.49Return on Networth / Equity (%)15.3915.1211.7210.5215.26ROCE (%)14.8914.7011.9910.919.28Return On Assets (%)3.963.843.162.703.72Current Ratio (X)1.211.231.371.311.42Quick Ratio (X)1.181.201.331.271.38Debt to Equity (x)1.331.321.331.501.73Interest Coverage Ratios (X)9.177.807.386.554.13Asset Turnover Ratio (%)0.710.660.450.4243.68Inventory Turnover Ratio (X)3.872.892.812.8123.363 Yr CAGR Sales (%)27.8227.5212.277.596.593 Yr CAGR Net Profit (%)31.1082.6111.433.17-25.62P/E (x)31.9340.0629.0528.6417.20P/B (x)4.926.013.413.012.63EV/EBITDA (x)19.7822.9217.5017.8617.20P/S (x)1.882.351.661.591.47Corporate Actions Larsen & Toubro announced a final dividend of Rs.34.00 per share (1700%) on May 08, 2025, with an effective date of June 03, 2025. The company has also announced bonus issues in the past, including a 1:2 bonus on July 13, 2017, and another 1:2 bonus on July 11, 2013. Shares of Larsen & Toubro were trading at Rs 3,628.80 in Friday's session."
