title,link,content
"PB Fintech-Policybazaar shares fall 2.57% on Wednesday, among top losers on Nifty Midcap 150",https://www.moneycontrol.com/news/business/stocks/pb-fintech-policybazaar-shares-fall-2-57-on-wednesday-among-top-losers-on-nifty-midcap-150-alpha-article-13287749.html,"Shares of PB Fintech (Policybazaar) ended down 2.57% at Rs 1,812.50 on Wednesday, making it among the top losers on the Nifty Midcap 150 in yesterday's session. The stock's performance reflected negative investor sentiment. PB Fintech's consolidated revenue for the quarter-ending March 2025 stood at Rs 1,507.87 Crore, compared to Rs 1,089.57 Crore in March 2024. The net profit for the quarter-ending March 2025 was Rs 170.88 Crore, significantly higher than the Rs 60.66 Crore reported in March 2024. The company's EPS for the quarter-ending March 2025 was Rs 3.73, up from Rs 1.35 in March 2024. The company's consolidated revenue for the year-ending March 2025 reached Rs 4,977.21 Crore, a notable increase from Rs 3,437.68 Crore in the previous year. The net profit for the year-ending March 2025 was Rs 352.90 Crore, a significant turnaround compared to the profit of Rs 66.43 Crore in March 2024. The EPS for the year-ending March 2025 was Rs 7.77, compared to Rs 1.50 in March 2024. Key financial metrics from the standalone income statement include:Mar 2025Mar 2024Mar 2023Mar 2022Mar 2021SalesRs 123 CroreRs 103 CroreRs 134 CroreRs 110 CroreRs 153 CroreOther IncomeRs 56 CroreRs 114 CroreRs 194 CroreRs 252 CroreRs 258 CroreTotal IncomeRs 179 CroreRs 217 CroreRs 328 CroreRs 362 CroreRs 411 CroreTotal ExpenditureRs 150 CroreRs 516 CroreRs 402 CroreRs 317 CroreRs 396 CroreEBITRs 28 CroreRs -299 CroreRs -73 CroreRs 44 CroreRs 15 CroreInterestRs 1 CroreRs 1 CroreRs 0 CroreRs 0 CroreRs 0 CroreTaxRs 8 CroreRs 0 CroreRs 0 CroreRs 8 CroreRs 1 CroreNet ProfitRs 19 CroreRs -299 CroreRs -74 CroreRs 36 CroreRs 13 CroreThe sales for March 2025 was Rs 123 crore compared to Rs 103 crore for March 2024. Key financial metrics from the standalone quarterly income statement include:Mar 2025Dec 2024Sep 2024Jun 2024Mar 2024SalesRs 46 CroreRs 38 CroreRs 37 CroreRs 30 CroreRs 34 CroreOther IncomeRs 63 CroreRs 65 CroreRs 67 CroreRs 62 CroreRs 63 CroreTotal IncomeRs 110 CroreRs 104 CroreRs 105 CroreRs 92 CroreRs 97 CroreTotal ExpenditureRs 131 CroreRs 86 CroreRs 98 CroreRs 80 CroreRs 104 CroreEBITRs -21 CroreRs 18 CroreRs 6 CroreRs 11 CroreRs -6 CroreInterestRs 0 CroreRs 0 CroreRs 0 CroreRs 0 CroreRs 0 CroreTaxRs -5 CroreRs 4 CroreRs 0 CroreRs 1 CroreRs 8 CroreNet ProfitRs -15 CroreRs 13 CroreRs 5 CroreRs 9 CroreRs -14 CroreThe sales for March 2025 was Rs 46 crore compared to Rs 34 crore for March 2024. Key figures from the standalone balance sheet include:Mar 2025Mar 2024Mar 2023Mar 2022Mar 2021Share CapitalRs 91 CroreRs 90 CroreRs 90 CroreRs 89 CroreRs 0 CroreReserves & SurplusRs 7,865 CroreRs 7,639 CroreRs 7,272 CroreRs 6,804 CroreRs 2,939 CroreCurrent LiabilitiesRs 99 CroreRs 72 CroreRs 16 CroreRs 18 CroreRs 43 CroreOther LiabilitiesRs 2 CroreRs 3 CroreRs 7 CroreRs 11 CroreRs 15 CroreTotal LiabilitiesRs 8,059 CroreRs 7,805 CroreRs 7,387 CroreRs 6,924 CroreRs 2,998 CroreFixed AssetsRs 2 CroreRs 5 CroreRs 8 CroreRs 11 CroreRs 15 CroreCurrent AssetsRs 2,043 CroreRs 2,869 CroreRs 2,189 CroreRs 4,677 CroreRs 1,811 CroreOther AssetsRs 6,013 CroreRs 4,930 CroreRs 5,189 CroreRs 2,235 CroreRs 1,171 CroreTotal AssetsRs 8,059 CroreRs 7,805 CroreRs 7,387 CroreRs 6,924 CroreRs 2,998 CroreContingent LiabilitiesRs 0 CroreRs 89 CroreRs 68 CroreRs 25 CroreRs 26 CroreKey standalone financial ratios for PB Fintech as of March 2025 include: Basic EPS (Rs.) of 0.30, Diluted EPS (Rs.) of 0.29, and Book Value [Excl. Reval Reserve]/Share (Rs.) of 173.27. The company's Debt to Equity ratio is 0.00. The company has scheduled a board meeting on July 31, 2025, to approve the unaudited financial results for Q1FY26 (standalone & consolidated). The company will also hold an earnings call for Q1FY 2025-26. With the stock ending lower in yesterday's session, PB Fintech faces increased volatility amid broader market movements and upcoming financial results."
"NLC India stock among top Nifty midcap gainers yesterday, shares jump 3.81%",https://www.moneycontrol.com/news/business/stocks/nlc-india-stock-among-top-nifty-midcap-gainers-yesterday-shares-jump-3-81-alpha-article-13287752.html,"Shares of NLC India were among the top gainers on the Nifty Midcap 150 index in Wednesday's trading, with the stock price increasing by 3.81% to Rs 238.40. This performance positions NLC India favorably within the Nifty Midcap 150 index in yesterday's session, reflecting positive investor sentiment. Financial Overview NLC India's financial performance shows a consolidated revenue of Rs 15,282.96 Crore for the year-ending March 2025, compared to Rs 12,999.03 Crore for the previous year. The company's net profit for the same period stood at Rs 2,713.37 Crore, significantly higher than the Rs 1,867.32 Crore reported in the previous year. Annual Financial Data The following table summarizes the key annual financial data for NLC India:HeadingMar 2021Mar 2022Mar 2023Mar 2024Mar 2025RevenueRs 9,846.09 CroreRs 11,947.94 CroreRs 16,165.24 CroreRs 12,999.03 CroreRs 15,282.96 CroreNet ProfitRs 1,345.37 CroreRs 1,115.13 CroreRs 1,425.13 CroreRs 1,867.32 CroreRs 2,713.37 CroreEPS9.708.0510.2813.4719.57BVPS115.37118.09127.11139.66135.02ROE9.317.709.2011.2114.00Debt to Equity1.791.551.471.351.20NLC India has demonstrated considerable growth in key financial metrics over the past five years. Revenue increased from Rs 9,846.09 Crore in March 2021 to Rs 15,282.96 Crore in March 2025. Net profit also saw a substantial rise, from Rs 1,345.37 Crore in March 2021 to Rs 2,713.37 Crore in March 2025. The company’s Earnings Per Share (EPS) improved from 9.70 in 2021 to 19.57 in 2025. The debt-to-equity ratio has also decreased from 1.79 in 2021 to 1.20 in 2025. Quarterly Financial Data The following table presents the consolidated quarterly financial performance of NLC India:HeadingMar 2024Jun 2024Sep 2024Dec 2024Mar 2025RevenueRs 3,540.61 CroreRs 3,376.05 CroreRs 3,657.27 CroreRs 4,411.41 CroreRs 3,836.00 CroreNet ProfitRs 113.77 CroreRs 566.64 CroreRs 982.40 CroreRs 695.95 CroreRs 468.36 CroreEPS0.824.097.715.023.38For the quarter-ending March 2025, NLC India reported revenue of Rs 3,836.00 Crore, up from Rs 3,540.61 Crore in March 2024. The net profit for the quarter-ending March 2025 was Rs 468.36 Crore, compared to Rs 113.77 Crore in the same quarter of the previous year. Corporate Actions NLC India has announced several dividends. An interim dividend of Rs 1.50 per share (15%) was announced on February 3, 2025, with an effective date of February 7, 2025. A final dividend of Rs 1.50 per share (15%) was announced on May 15, 2024, with an effective date of September 18, 2024. Another interim dividend of Rs 1.50 per share (15%) was announced on February 6, 2024, with an effective date of February 16, 2024. Moneycontrol analysis on July 11, 2025, indicated a bearish sentiment for the stock. With the stock's last traded price at Rs 238.40, NLC India has seen a positive movement, positioning it among the top gainers on the Nifty Midcap 150 index at yesterday's close."
"M&M stock rises 2.17% yesterday, among top gainers on Nifty 50",https://www.moneycontrol.com/news/business/stocks/m-m-stock-rises-2-17-yesterday-among-top-gainers-on-nifty-50-alpha-article-13287761.html,"Shares of M&M were among the stocks that led gains on the Nifty 50 in yesterday's trading, rising 2.17% to end at Rs 3,196.50. This performance positioned M&M as one of the top gainers on the benchmark index at Wednesday's close. The company's financial performance shows consistent growth. Consolidated revenue for the quarter-ending March 2025 stood at Rs 42,599.31 Crore, compared to Rs 35,451.73 Crore in March 2024. Net profit for the same quarter was Rs 3,102.48 Crore, compared to Rs 2,730.21 Crore in the corresponding period last year. The EPS for March 2025 was Rs 29.52, up from Rs 24.71 in March 2024. M&M Consolidated Quarterly Financial PerformanceHeadingMar 2024Jun 2024Sep 2024Dec 2024Mar 2025RevenueRs 35,451.73 CroreRs 37,217.72 CroreRs 37,923.74 CroreRs 41,470.05 CroreRs 42,599.31 CroreNet ProfitRs 2,730.21 CroreRs 3,221.34 CroreRs 2,894.71 CroreRs 3,317.22 CroreRs 3,102.48 CroreEPS24.7129.4428.4328.5129.52 The company's yearly financial performance also reflects strong growth. Consolidated revenue for the year-ending March 2025 was Rs 158,749.75 Crore, a notable increase from Rs 138,279.30 Crore in March 2024. The net profit for the year-ending March 2025 was Rs 12,535.75 Crore, up from Rs 11,148.39 Crore in March 2024. EPS increased from Rs 101.14 in March 2024 to Rs 115.91 in March 2025. M&M Consolidated Yearly Financial PerformanceHeading20212022202320242025RevenueRs 74,277.78 CroreRs 90,170.57 CroreRs 121,268.55 CroreRs 138,279.30 CroreRs 158,749.75 CroreNet ProfitRs 2,425.26 CroreRs 5,397.22 CroreRs 9,869.04 CroreRs 11,148.39 CroreRs 12,535.75 CroreEPS16.3359.2092.41101.14115.91 M&M's balance sheet showcases a strong financial position. Total assets have grown from Rs 236,300 Crore in March 2024 to Rs 277,586 Crore in March 2025. The company has consistently rewarded its shareholders with dividends. The dividend payout for 2025 was Rs 25.30 per share. M&M is included as one of the stocks in the benchmark NIFTY 50 index."
"Wipro shares among Nifty top gainers yesterday, end up 2.1%",https://www.moneycontrol.com/news/business/stocks/wipro-shares-among-nifty-top-gainers-yesterday-end-up-2-1-alpha-article-13287767.html,"Wipro's stock ended higher in Wednesday's trade, gaining 2.1% to Rs 262.80, making it one of the top gainers on the Nifty 50 in yesterday's session. Financial Performance: The following table presents Wipro's consolidated quarterly financial data:HeadingMar 2024Jun 2024Sep 2024Dec 2024Mar 2025RevenueRs 22,208.30 CroreRs 21,963.80 CroreRs 22,301.60 CroreRs 22,318.80 CroreRs 22,504.20 CroreNet ProfitRs 2,878.40 CroreRs 3,041.10 CroreRs 3,226.30 CroreRs 3,366.20 CroreRs 3,559.00 CroreEPS5.435.756.143.213.41The revenue for Wipro has seen a steady increase over the quarters, with revenue for the quarter-ending March 2025 at Rs 22,504.20 Crore, compared to Rs 22,208.30 Crore in March 2024. Net profit has also increased, reaching Rs 3,559.00 Crore for the quarter-ending March 2025, up from Rs 2,878.40 Crore in March 2024. The following table presents Wipro's consolidated yearly financial data:Heading20212022202320242025RevenueRs 61,934.90 CroreRs 79,312.00 CroreRs 90,487.60 CroreRs 89,760.30 CroreRs 89,088.40 CroreNet ProfitRs 10,855.00 CroreRs 12,237.70 CroreRs 11,372.20 CroreRs 11,135.40 CroreRs 13,192.60 CroreEPS19.1122.3720.7320.8912.56BVPS100.48119.40141.63142.6578.65ROE19.6618.6914.6114.8115.94Debt to Equity0.120.230.190.190.20The yearly revenue for Wipro has fluctuated over the past five years, with revenue for year-ending March 2025 at Rs 89,088.40 Crore. Net profit has increased to Rs 13,192.60 Crore for the year-ending March 2025, up from Rs 11,135.40 Crore in March 2024. The company reported a debt-to-equity ratio of 0.20 as of the year-ending March 2025. Income Statement:Mar 2025Mar 2024Mar 2023Mar 2022Mar 2021Sales89,08889,76090,48779,31261,934Other Income3,8842,6302,2652,0612,390Total Income92,97292,39192,75381,37364,325Total Expenditure74,02576,39176,97465,70549,926EBIT18,94715,99915,77915,66714,398Interest1,4771,2551,007532508Tax4,2773,6083,3992,8973,034Net Profit13,19211,13511,37212,23710,855Quarterly Income Statement:Mar 2025Dec 2024Sep 2024Jun 2024Mar 2024Sales22,50422,31822,30121,96322,208Other Income1,1881,004961729652Total Income23,69223,32223,26322,69322,861Total Expenditure18,60118,45518,62918,33818,648EBIT5,0904,8674,6344,3544,213Interest376414356328330Tax1,1541,0861,0519851,004Net Profit3,5593,3663,2263,0412,878Cash Flow:Mar 2025Mar 2024Mar 2023Mar 2022Mar 2021Operating Activities16,94217,62113,06011,07914,755Investing Activities-8,0731,168-8,406-22,449773Financing Activities-6,396-18,256-6,0884,658-12,884Others29-23237128-89Net Cash Flow2,502508-1,197-6,5822,555Balance Sheet:Mar 2025Mar 2024Mar 2023Mar 2022Mar 2021Share Capital2,0941,0451,0971,0961,095Reserves & Surplus80,26973,48876,57064,30653,805Current Liabilities28,62525,24526,77530,83223,004Other Liabilities17,19515,01112,69011,2694,827Total Liabilities128,185114,790117,133107,50582,732Fixed Assets13,34813,20615,02515,30511,378Current Assets77,77765,06666,10962,07552,318Other Assets37,05936,51735,99830,12519,034Total Assets128,185114,790117,133107,50582,732Contingent Liabilities14,05513,45313,04513,30711,606Ratios:Mar 2025Mar 2024Mar 2023Mar 2022Mar 2021Basic EPS (Rs.)12.5620.8920.7322.3719.11Diluted Eps (Rs.)12.5220.8220.6822.3119.07Book Value [Excl. Reval Reserve]/Share (Rs.)78.65142.65141.63119.40100.48Dividend/Share (Rs.)6.001.001.006.001.00Face Value22222Gross Profit Margin (%)24.5821.6221.1223.6327.70Operating Margin (%)21.2617.8217.4319.7523.24Net Profit Margin (%)14.8012.4012.5615.4217.52Return on Networth / Equity (%)15.9414.8114.6118.6919.66ROCE (%)19.0317.8617.4620.4324.10Return On Assets (%)10.249.629.6811.3713.04Current Ratio (X)2.722.582.472.012.27Quick Ratio (X)2.712.572.462.012.27Debt to Equity (x)0.200.190.190.230.12Interest Coverage Ratios (X)14.8315.4618.9735.2033.73Asset Turnover Ratio (%)0.730.770.700.730.68Inventory Turnover Ratio (X)0.000.000.000.000.003 Yr CAGR Sales (%)5.9820.3921.6615.926.623 Yr CAGR Net Profit (%)3.831.287.8916.4616.47P/E (x)20.8811.498.8113.2310.84P/B (x)3.333.372.584.964.13EV/EBITDA (x)12.7213.1610.7917.5712.64P/S (x)3.082.792.224.093.66Corporate Actions: Wipro had its 79th Annual General Meeting on July 16, 2025, where resolutions were passed with the required majority, as per the Scrutinizer's Report. Additionally, the company announced the allotment of equity shares under its ESOP/ESPS scheme on July 16, 2025. Wipro announced an interim dividend of Rs 6.00 per share on January 17, 2025, with an effective date of January 28, 2025. Wipro had a bonus issue on December 3, 2024, with a bonus ratio of 1:1. Wipro had a stock split on September 27, 1999, where the old face value of Rs 10 was split into a new face value of Rs 2. A Moneycontrol analysis as of July 10, 2025, indicates a neutral sentiment on the stock."
"GIFT Nifty indicates a positive start for Sensex, Nifty; key levels to track on July 17",https://www.moneycontrol.com/news/business/markets/gift-nifty-indicates-a-positive-start-for-sensex-nifty-key-levels-to-track-on-july-17-13287608.html,"Benchmark indices Nifty and Sensex are likely to open higher on July 17, buoyed by firm global cues after Wall Street closed in the green. Market mood got a slight lift after Donald Trump ruled out firing US Fed Chair Jerome Powell and hinted at a potential trade deal with India. However, persistent concerns over Q1 earnings and tariff-related uncertainties continue to weigh on investor sentiment. Around 7:40 am, GIFT Nifty was up 0.2 percent at 25,280. Dalal Street saw a choppy session yesterday as Nifty 50 and Sensex recovered from the day's low by the afternoon session of trade, but a lack of buying failed to keep the indices solidly above the flatline. Follow our LIVE blog for all the latest market updates On July 16, Foreign Portfolio Investors (FPIs) were net sellers to the tune of Rs 1858 crore worth of shares in Indian equities, while domestic institutional investors (DIIs) net bought Rs 1224 crore worth of shares, according to provisional NSE data. Here are the important levels to watch out for in today's session Nifty index is exhibiting early signs of a potential pullback, with persistent buying interest emerging at lower levels, signalling a tug-of-war between bulls and bears. The index has consistently closed above its previous day’s low, indicating a gradual build-up of momentum and the formation of a strong base near the psychologically significant 25,000 level, which also aligns with the 50% Fibonacci retracement, acting as a crucial support. However, the index continues to oscillate below its immediate hurdle at 25,350. Until a breakout occurs, upward moves may remain capped. ""Nifty Bank index is hinting at a resurgence in bullish sentiment, supported by consistent buying activity from lower levels, with dips being actively absorbed, highlighting underlying strength,"" Dhupesh Dhameja of SAMCO Securities said. ""Encouragingly, the index continues to sustain above its 10-day and 20-day EMAs, both of which are upward sloping, providing cushion at lower zones and reinforcing the bullish undertone. The 57,350–57,400 range has now become a key resistance pocket or supply zone. A clean breakout above 57,350 is essential to signal trend continuation on the upside,"" he added. India VIX declined further by 2.1 percent to settle at 11.24, continuing to hover well below the critical 15-mark. This prolonged low-volatility phase signals that while sellers remain active at higher levels, there is no sense of panic in the market. The muted VIX suggests a controlled consolidation rather than a fear-driven selloff, highlighting a lack of directional conviction. The Put-Call Ratio (PCR) has improved slightly to 0.80 from 0.75, reflecting an uptick in put writing. However, the relatively low PCR still underline a bearish undertone in the market. Disclaimer: The views and investment tips expressed by investment experts on Moneycontrol.com are their own and not those of the website or its management. Moneycontrol.com advises users to check with certified experts before taking any investment decisions."
Eternal-Zomato share price falls 1.54% yesterday; stock among top losers on Nifty 50,https://www.moneycontrol.com/news/business/stocks/eternal-zomato-share-price-falls-1-54-yesterday-stock-among-top-losers-on-nifty-50-alpha-article-13287769.html,"Shares of Eternal (Zomato) declined 1.54% to Rs 262.35, making it one of the top losers on the Nifty 50 in early trade. The decline reflects a bearish trend for the stock. Financial Performance: Eternal's consolidated financial performance shows consistent growth in revenue over the past few years. The company has also improved its profitability. The table below presents the key financial figures:Particulars20212022202320242025RevenueRs 1,993.79 CroreRs 4,192.40 CroreRs 7,079.40 CroreRs 12,114.00 CroreRs 20,243.00 CroreNet Profit-Rs 816.43 Crore-Rs 1,222.80 Crore-Rs 970.70 CroreRs 351.00 CroreRs 527.00 CroreEPS-1.51-1.67-1.200.410.60BVPS246,389.5821.5923.2623.5133.43ROE-10.63-7.32-4.991.711.73Debt to Equity0.000.000.000.000.00Revenue for the year ending March 2025 stood at Rs 20,243.00 Crore, a significant increase compared to Rs 12,114.00 Crore in March 2024. Net profit also saw a rise, with Rs 527.00 Crore in March 2025 compared to Rs 351.00 Crore in March 2024. The EPS increased from 0.41 to 0.60 during the same period.ParticularsMar 2021Mar 2022Mar 2023Mar 2024Mar 2025SalesRs 1,713 CroreRs 3,611 CroreRs 4,707 CroreRs 6,622 CroreRs 8,617 CroreOther IncomeRs 131 CroreRs 497 CroreRs 799 CroreRs 920 CroreRs 1,260 CroreTotal IncomeRs 1,845 CroreRs 4,108 CroreRs 5,506 CroreRs 7,542 CroreRs 9,877 CroreTotal ExpenditureRs 2,723 CroreRs 5,200 CroreRs 5,372 CroreRs 6,152 CroreRs 7,671 CroreEBIT-Rs 878 Crore-Rs 1,092 CroreRs 134 CroreRs 1,390 CroreRs 2,206 CroreInterestRs 7 CroreRs 5 CroreRs 16 CroreRs 18 CroreRs 16 CroreTaxRs 0 CroreRs 0 CroreRs 0 CroreRs 1 CroreRs 230 CroreNet Profit-Rs 886 Crore-Rs 1,098 CroreRs 116 CroreRs 1,371 CroreRs 1,960 CroreThe standalone annual income statement shows a consistent increase in sales, from Rs 1,713 Crore in March 2021 to Rs 8,617 Crore in March 2025. Net profit also improved significantly, from a loss of Rs 886 Crore in March 2021 to a profit of Rs 1,960 Crore in March 2025.ParticularsMar 2024Jun 2024Sep 2024Dec 2024Mar 2025RevenueRs 3,562.00 CroreRs 4,206.00 CroreRs 4,799.00 CroreRs 5,405.00 CroreRs 5,833.00 CroreNet ProfitRs 175.00 CroreRs 253.00 CroreRs 176.00 CroreRs 59.00 CroreRs 39.00 CroreEPS0.200.290.200.070.04The consolidated quarterly financial data reveals a rising trend in revenue from Rs 3,562.00 Crore in March 2024 to Rs 5,833.00 Crore in March 2025. However, net profit has fluctuated, ending at Rs 39.00 Crore in March 2025 compared to Rs 175.00 Crore in March 2024.ParticularsMar 2021Mar 2022Mar 2023Mar 2024Mar 2025SalesRs 1,824 CroreRs 2,048 CroreRs 2,151 CroreRs 2,226 CroreRs 2,192 CroreOther IncomeRs 269 CroreRs 279 CroreRs 269 CroreRs 311 CroreRs 401 CroreTotal IncomeRs 2,093 CroreRs 2,327 CroreRs 2,420 CroreRs 2,537 CroreRs 2,593 CroreTotal ExpenditureRs 1,693 CroreRs 1,853 CroreRs 1,919 CroreRs 1,959 CroreRs 1,940 CroreEBITRs 400 CroreRs 474 CroreRs 501 CroreRs 578 CroreRs 653 CroreInterestRs 4 CroreRs 4 CroreRs 4 CroreRs 4 CroreRs 4 CroreTaxRs 0 CroreRs 0 CroreRs 76 CroreRs 80 CroreRs 74 CroreNet ProfitRs 396 CroreRs 470 CroreRs 421 CroreRs 494 CroreRs 575 CroreThe standalone quarterly income statement highlights that sales have remained relatively stable, ranging from Rs 1,824 Crore in March 2024 to Rs 2,192 Crore in March 2025. Net profit has shown a positive trend, increasing from Rs 396 Crore to Rs 575 Crore during the same period.ParticularsMar 2021Mar 2022Mar 2023Mar 2024Mar 2025Operating Activities-Rs 316 Crore-Rs 508 CroreRs 225 CroreRs 1,379 CroreRs 1,614 CroreInvesting Activities-Rs 6,078 Crore-Rs 8,130 Crore-Rs 382 Crore-Rs 1,301 Crore-Rs 9,752 CroreFinancing ActivitiesRs 6,474 CroreRs 8,762 Crore-Rs 14 Crore-Rs 20 CroreRs 8,388 CroreOthersRs 0 CroreRs 2 CroreRs 0 CroreRs 0 CroreRs 0 CroreNet Cash FlowRs 78 CroreRs 125 Crore-Rs 171 CroreRs 58 CroreRs 250 CroreThe cash flow statement shows that net cash flow was Rs 250 Crore for the year ending March 2025, compared to Rs 58 Crore in the previous year. Operating activities have improved, while investing activities show a significant outflow.ParticularsMar 2021Mar 2022Mar 2023Mar 2024Mar 2025Share CapitalRs 0 CroreRs 764 CroreRs 836 CroreRs 868 CroreRs 907 CroreReserves & SurplusRs 7,754 CroreRs 16,002 CroreRs 19,970 CroreRs 21,907 CroreRs 33,208 CroreCurrent LiabilitiesRs 472 CroreRs 663 CroreRs 937 CroreRs 1,394 CroreRs 1,532 CroreOther LiabilitiesRs 521 CroreRs 70 CroreRs 183 CroreRs 156 CroreRs 204 CroreTotal LiabilitiesRs 8,748 CroreRs 17,500 CroreRs 21,926 CroreRs 24,325 CroreRs 35,851 CroreFixed AssetsRs 1,450 CroreRs 1,347 CroreRs 1,402 CroreRs 1,398 CroreRs 1,471 CroreCurrent AssetsRs 3,975 CroreRs 7,336 CroreRs 8,743 CroreRs 3,547 CroreRs 6,311 CroreOther AssetsRs 3,321 CroreRs 8,816 CroreRs 11,781 CroreRs 19,380 CroreRs 28,069 CroreTotal AssetsRs 8,748 CroreRs 17,500 CroreRs 21,926 CroreRs 24,325 CroreRs 35,851 CroreContingent LiabilitiesRs 92 CroreRs 97 CroreRs 0 CroreRs 432 CroreRs 0 CroreThe balance sheet shows a growth in total assets from Rs 8,748 Crore in March 2021 to Rs 35,851 Crore in March 2025. Reserves and surplus have also increased significantly, reflecting the company's improved financial position.ParticularsMar 2021Mar 2022Mar 2023Mar 2024Mar 2025Basic EPS (Rs.)-1.65-1.520.141.612.22Diluted Eps (Rs.)-1.65-1.520.131.572.15Book Value [Excl. Reval Reserve]/Share (Rs.)250,146.1021.9424.8826.2437.61Dividend/Share (Rs.)0.000.000.000.000.00Face Value11111Gross Profit Margin (%)-11.81-31.295.8222.6826.85Operating Margin (%)-19.32-34.982.8421.5725.72Net Profit Margin (%)-51.69-30.402.4820.7022.74Return on Networth / Equity (%)-11.42-6.540.566.015.74ROCE (%)-4.00-7.500.636.236.45Return On Assets (%)-10.12-6.270.535.635.46Current Ratio (X)8.4211.069.332.544.12Quick Ratio (X)8.4211.069.332.544.12Debt to Equity (x)0.000.000.000.000.00Interest Coverage Ratios (X)-41.77-205.4416.2483.44144.63Asset Turnover Ratio (%)19.590.280.240.290.29Inventory Turnover Ratio (X)0.000.000.000.000.003 Yr CAGR Sales (%)114.9376.5041.9596.5654.483 Yr CAGR Net Profit (%)235.9838.73-78.1624.3933.61P/E (x)0.00-54.14364.29113.1190.86P/B (x)0.003.752.056.955.36EV/EBITDA (x)0.00-54.37153.88105.0778.20P/S (x)0.0017.429.0523.9021.21Key financial ratios indicate a P/E ratio of 90.86 and a P/B ratio of 5.36. The company's debt-to-equity ratio stands at 0.00 as of March 2025. Corporate Actions: Eternal Limited will hold an earnings conference call on Monday, July 21, 2025, at 5 P.M. IST to discuss the unaudited financial results for the quarter ended June 30, 2025. The board meeting to consider and approve these results is also scheduled for July 21, 2025. Eternal Limited has filed with the exchange a certificate under Reg 74 of SEBI (DP) Regulations for the quarter ended June 30, 2025."
