title,link,content
"Taking Stock: Sensex, Nifty end higher amid last hour sharp recovery",https://www.moneycontrol.com/news/business/markets/taking-stock-sensex-nifty-end-higher-amid-last-hour-sharp-recovery-13414593.html,"Final hour buying helped the Indian indices to erase all the intraday losses, as the indices remained under pressure for most part of the session after US President Donald Trump imposed additional 25% tariff on India over Russian oil imports and also indicated imposing 100% tariffs on imported semiconductors. Despite positive global markets, the Indian indices opened lower and stayed in the negative territory for most part of the day with Nifty slipping below 24,350, intraday, but sharp recovery in the final hour of trade helped to close near day's high. Also Read - Brookfield’s CleanMax, KKR-backed Hero Future Energies may file draft IPO papers by next week At close, the Sensex was up 79.27 points or 0.10 percent at 80,623.26, and the Nifty was up 21.95 points or 0.09 percent at 24,596.15. BSE Midcap index up 0.3 percent and smallcap index ended on flat note. Also Read: FIIs exit Indian equities led by Singapore, US; France ramps up investments Top Nifty gainers were Hero MotoCorp, Tech Mahindra, Wipro, Eternal, JSW Steel, while losers included Adani Enterprises, Adani Ports, Trent, Tata Motors and Grasim Industries. All the sectoral indices recovered most of the intraday losses with IT, media, pharma rising 0.5-1 percent. Read More: Prashant Khemka on Trump tariff uncertainty: Negotiation tactic, India will come out fine In stock-specific action, Datamatics Global Services shares rose nearly 3 percent on better Q1 earnings, Raymond shares were down nearly 2 percent as Q1 consolidated profit declined, Fortis Healthcare share price added 3 percent as Q1 consolidated profit jumped 53%, Prince Pipes shares were down 8 percent as consolidated profit slipped 80%, Bajaj Holdings & Investment rose nearly 2 percent as profit surged 116%. BHEL shares slipped 5 percent on widening losses in the June quarter, Lumax Industries shares shed 12 percent after Q1 revenue fell 20%, Lincoln Pharmaceuticals share price rose 8 percent after Q1 net profit rose 17%, Caplin Point share price jumped 5 percent on better Q1 numbers, Indosolar shares gained 5 percent as promoter Waaree Energies to sell 12,50,000 equity shares. More than 100 stocks touched their 52-week highs on the BSE, including Fortis Healthcare, Delhivery, JSW Steel, TVS Motor, JK Cement, Sarda Energy, Godfrey Phillips, among others. Click to View More Outlook for August 8 Nagaraj Shetti, Senior Technical Research Analyst at HDFC Securities Bulls have finally made a decisive comeback in the market on Thursday that witnessed a session of roller-coaster ride of up and down moves and Nifty finally closed the day on a positive note. After opening with a downside gap of 90 points, the market slipped into further weakness in the early to mid-part of the session. The sharp recovery has emerged from the low of 24344 from 1.40pm onwards and the strong upside momentum continued till the end. The opening downside gap has been filled completely. A long bull candle was formed on the daily chart with lower shadow. Technically, this pattern shows an early sign of crucial bottom reversal pattern in the Nifty. Further follow-through upmove above the initial hurdle of 24750 could confirm the bottom reversal pattern. The crucial supports to be watched around 24350. Rupak De, Senior Technical Analyst at LKP Securities Nifty witnessed a roller-coaster session as the index oscillated between 24,350 and 24,650. Although it briefly fell below 24,400, it did not sustain at lower levels and recovered smartly in the second half, closing near 24,600. In the short term, the index may continue to recover; however, immediate resistance is seen at 24,660. A decisive move above this level could take the index towards 24,850. On the downside, support is placed at 24,400 on a closing or sustained basis. Disclaimer: The views and investment tips expressed by experts on Moneycontrol.com are their own and not those of the website or its management. Moneycontrol.com advises users to check with certified experts before taking any investment decisions."
"Larsen & Toubro shares trade flat; hits intraday high of Rs 3,649",https://www.moneycontrol.com/news/business/stocks/larsen-toubro-shares-trade-flat-hits-intraday-high-of-rs-3-649-alpha-article-13415188.html,"Shares of Larsen & Toubro were trading flat in Thursday's session, with the stock currently priced at Rs 3,636.50, a 0.22% increase from its previous close. The stock touched a day's high of Rs 3,649 and a low of Rs 3,599.20 at 3:30 pm on the NSE. Financial Overview: Larsen & Toubro's consolidated financial performance shows consistent growth. The company’s revenue for the year-ending March 2025 stood at Rs 255,734.45 Crore, an increase compared to Rs 221,112.91 Crore in the previous year. Net profit for the same period was Rs 17,687.39 Crore, up from Rs 15,569.72 Crore in the previous year. The company's EPS stood at Rs 109.36. The company’s quarterly revenue for June 2025 was Rs 63,678.92 Crore, compared to Rs 55,119.82 Crore in June 2024. The net profit for the quarter was Rs 4,325.57 Crore, up from Rs 3,440.11 Crore in the corresponding quarter of the previous year. The EPS for June 2025 was Rs 26.30, compared to Rs 20.26 in June 2024. Income Statement: Here is a summary of the consolidated annual income statement:ParticularsMar 2025Mar 2024Mar 2023Mar 2022Mar 2021SalesRs 255,734 CroreRs 221,112 CroreRs 183,340 CroreRs 156,521 CroreRs 135,979 CroreOther IncomeRs 4,124 CroreRs 4,158 CroreRs 2,929 CroreRs 2,267 CroreRs 3,429 CroreTotal IncomeRs 259,859 CroreRs 225,270 CroreRs 186,269 CroreRs 158,788 CroreRs 139,408 CroreTotal ExpenditureRs 232,946 CroreRs 201,207 CroreRs 165,953 CroreRs 141,154 CroreRs 126,815 CroreEBITRs 26,913 CroreRs 24,062 CroreRs 20,316 CroreRs 17,633 CroreRs 12,593 CroreInterestRs 3,334 CroreRs 3,545 CroreRs 3,207 CroreRs 3,125 CroreRs 3,913 CroreTaxRs 5,891 CroreRs 4,947 CroreRs 4,484 CroreRs 4,216 CroreRs 4,010 CroreNet ProfitRs 17,687 CroreRs 15,569 CroreRs 12,624 CroreRs 10,291 CroreRs 4,668 CroreThe sales for March 2025 was increased by 15.65% compared to March 2024. Quarterly Income Statement: Here is a summary of the consolidated quarterly income statement:ParticularsJun 2025Mar 2025Dec 2024Sep 2024Jun 2024SalesRs 63,678 CroreRs 74,392 CroreRs 64,667 CroreRs 61,554 CroreRs 55,119 CroreOther IncomeRs 1,356 CroreRs 1,135 CroreRs 967 CroreRs 1,101 CroreRs 920 CroreTotal IncomeRs 65,035 CroreRs 75,527 CroreRs 65,635 CroreRs 62,655 CroreRs 56,040 CroreTotal ExpenditureRs 58,394 CroreRs 66,767 CroreRs 59,459 CroreRs 56,216 CroreRs 50,502 CroreEBITRs 6,641 CroreRs 8,759 CroreRs 6,175 CroreRs 6,439 CroreRs 5,538 CroreInterestRs 781 CroreRs 745 CroreRs 842 CroreRs 884 CroreRs 861 CroreTaxRs 1,533 CroreRs 1,880 CroreRs 1,332 CroreRs 1,442 CroreRs 1,236 CroreNet ProfitRs 4,325 CroreRs 6,133 CroreRs 4,001 CroreRs 4,112 CroreRs 3,440 CroreBalance Sheet: Here is a summary of the consolidated balance sheet:ParticularsMar 2025Mar 2024Mar 2023Mar 2022Mar 2021Equities & LiabilitiesShare CapitalRs 275 CroreRs 274 CroreRs 281 CroreRs 496 CroreRs 1,404 CroreReserves & SurplusRs 97,380 CroreRs 85,533 CroreRs 88,577 CroreRs 81,755 CroreRs 75,204 CroreCurrent LiabilitiesRs 201,970 CroreRs 176,600 CroreRs 162,065 CroreRs 159,433 CroreRs 137,408 CroreOther LiabilitiesRs 79,897 CroreRs 77,217 CroreRs 79,427 CroreRs 78,363 CroreRs 97,257 CroreTotal LiabilitiesRs 379,524 CroreRs 339,627 CroreRs 330,352 CroreRs 320,048 CroreRs 311,273 CroreAssetsFixed AssetsRs 38,295 CroreRs 38,207 CroreRs 37,907 CroreRs 36,509 CroreRs 36,752 CroreCurrent AssetsRs 245,341 CroreRs 218,079 CroreRs 222,204 CroreRs 208,181 CroreRs 194,966 CroreOther AssetsRs 95,886 CroreRs 83,339 CroreRs 70,240 CroreRs 75,358 CroreRs 79,554 CroreTotal AssetsRs 379,524 CroreRs 339,627 CroreRs 330,352 CroreRs 320,048 CroreRs 311,273 CroreOther InfoContingent LiabilitiesRs 28,086 CroreRs 21,246 CroreRs 19,620 CroreRs 23,020 CroreRs 21,540 CroreCash Flow: Here is a summary of the consolidated cash flow statement:ParticularsMar 2025Mar 2024Mar 2023Mar 2022Mar 2021Operating ActivitiesRs 9,160 CroreRs 18,266 CroreRs 22,776 CroreRs 19,163 CroreRs 22,844 CroreInvesting ActivitiesRs -15,517 CroreRs 2,163 CroreRs -8,311 CroreRs -3,667 CroreRs -5,428 CroreFinancing ActivitiesRs 6,556 CroreRs -25,413 CroreRs -11,572 CroreRs -15,181 CroreRs -15,274 CroreOthersRs 28 CroreRs 15 CroreRs 263 CroreRs 82 CroreRs 0 CroreNet Cash FlowRs 228 CroreRs -4,968 CroreRs 3,156 CroreRs 396 CroreRs 2,140 CroreKey Ratios: As of March 2025, the basic EPS stood at Rs 109.36 and diluted EPS was Rs 109.28. The book value per share (excluding revaluation reserve) was Rs 710.12. The company's return on net worth/equity was 15.39%. The debt to equity ratio stood at 1.33, and the interest coverage ratio was 9.17. Corporate Actions: The company announced a final dividend of Rs 34 per share (1700%) on May 8, 2025, with an effective date of June 3, 2025. Earlier, the company had announced a final dividend of Rs 28 per share (1400%) on May 8, 2024, with an effective date of June 20, 2024. Larsen & Toubro has issued bonus shares in the past, including a 1:2 bonus on July 13, 2017, and another 1:2 bonus on July 11, 2013. Moneycontrol analysis on July 31, 2025, indicated a very bullish sentiment for the stock."
Larsen & Toubro shares trade flat in today's session,https://www.moneycontrol.com/news/business/stocks/larsen-toubro-shares-trade-flat-in-today-s-session-alpha-article-13414843.html,"Larsen & Toubro shares were trading flat in Thursday's session, with the stock currently priced at Rs 3,631.10. This comes as the stock saw a marginal rise of 0.07% from its previous close, as of 3:00 pm. Recent Financial Performance The consolidated revenue for the quarter-ending June 2025 stood at Rs 63,678.92 Crore, a rise compared to Rs 55,119.82 Crore in June 2024. The net profit for the same period was Rs 4,325.57 Crore, compared to Rs 3,440.11 Crore in the previous year. The company's EPS stood at Rs 26.30 in June 2025, up from Rs 20.26 in June 2024. The company's consolidated revenue for the year-ending March 2025 was Rs 255,734.45 Crore, an increase of 15.66% from Rs 221,112.91 Crore in March 2024. The net profit for the year-ending March 2025 was Rs 17,687.39 Crore, up from Rs 15,569.72 Crore in the previous year. The company's EPS stood at Rs 109.36 in March 2025, up from Rs 93.96 in March 2024. Annual Income Statement (Consolidated)Mar 2025Mar 2024Mar 2023Mar 2022Mar 2021SalesRs 255,734 CroreRs 221,112 CroreRs 183,340 CroreRs 156,521 CroreRs 135,979 CroreOther IncomeRs 4,124 CroreRs 4,158 CroreRs 2,929 CroreRs 2,267 CroreRs 3,429 CroreTotal IncomeRs 259,859 CroreRs 225,270 CroreRs 186,269 CroreRs 158,788 CroreRs 139,408 CroreTotal ExpenditureRs 232,946 CroreRs 201,207 CroreRs 165,953 CroreRs 141,154 CroreRs 126,815 CroreEBITRs 26,913 CroreRs 24,062 CroreRs 20,316 CroreRs 17,633 CroreRs 12,593 CroreInterestRs 3,334 CroreRs 3,545 CroreRs 3,207 CroreRs 3,125 CroreRs 3,913 CroreTaxRs 5,891 CroreRs 4,947 CroreRs 4,484 CroreRs 4,216 CroreRs 4,010 CroreNet ProfitRs 17,687 CroreRs 15,569 CroreRs 12,624 CroreRs 10,291 CroreRs 4,668 CroreQuarterly Income Statement (Consolidated)Jun 2025Mar 2025Dec 2024Sep 2024Jun 2024SalesRs 63,678 CroreRs 74,392 CroreRs 64,667 CroreRs 61,554 CroreRs 55,119 CroreOther IncomeRs 1,356 CroreRs 1,135 CroreRs 967 CroreRs 1,101 CroreRs 920 CroreTotal IncomeRs 65,035 CroreRs 75,527 CroreRs 65,635 CroreRs 62,655 CroreRs 56,040 CroreTotal ExpenditureRs 58,394 CroreRs 66,767 CroreRs 59,459 CroreRs 56,216 CroreRs 50,502 CroreEBITRs 6,641 CroreRs 8,759 CroreRs 6,175 CroreRs 6,439 CroreRs 5,538 CroreInterestRs 781 CroreRs 745 CroreRs 842 CroreRs 884 CroreRs 861 CroreTaxRs 1,533 CroreRs 1,880 CroreRs 1,332 CroreRs 1,442 CroreRs 1,236 CroreNet ProfitRs 4,325 CroreRs 6,133 CroreRs 4,001 CroreRs 4,112 CroreRs 3,440 CroreConsolidated Balance SheetMar 2025Mar 2024Mar 2023Mar 2022Mar 2021Equities & LiabilitiesShare CapitalRs 275 CroreRs 274 CroreRs 281 CroreRs 496 CroreRs 1,404 CroreReserves & SurplusRs 97,380 CroreRs 85,533 CroreRs 88,577 CroreRs 81,755 CroreRs 75,204 CroreCurrent LiabilitiesRs 201,970 CroreRs 176,600 CroreRs 162,065 CroreRs 159,433 CroreRs 137,408 CroreOther LiabilitiesRs 79,897 CroreRs 77,217 CroreRs 79,427 CroreRs 78,363 CroreRs 97,257 CroreTotal LiabilitiesRs 379,524 CroreRs 339,627 CroreRs 330,352 CroreRs 320,048 CroreRs 311,273 CroreAssetsFixed AssetsRs 38,295 CroreRs 38,207 CroreRs 37,907 CroreRs 36,509 CroreRs 36,752 CroreCurrent AssetsRs 245,341 CroreRs 218,079 CroreRs 222,204 CroreRs 208,181 CroreRs 194,966 CroreOther AssetsRs 95,886 CroreRs 83,339 CroreRs 70,240 CroreRs 75,358 CroreRs 79,554 CroreTotal AssetsRs 379,524 CroreRs 339,627 CroreRs 330,352 CroreRs 320,048 CroreRs 311,273 CroreOther InfoContingent LiabilitiesRs 28,086 CroreRs 21,246 CroreRs 19,620 CroreRs 23,020 CroreRs 21,540 CroreKey Financial RatiosMar 2025Mar 2024Mar 2023Mar 2022Mar 2021Per Share RatiosBasic EPS (Rs.)109.3693.9674.5161.7182.49Diluted EPS (Rs.)109.2893.8874.4561.6582.41Book Value /Share (Rs.)710.12746.01736.87678.79625.97Dividend/Share (Rs.)34.0034.0024.0022.0036.00Face Value22222Margin RatiosGross Profit Margin (%)11.9412.5012.9113.0814.01Operating Margin (%)10.3310.8411.0011.2011.87Net Profit Margin (%)6.917.046.886.579.49Return RatiosReturn on Networth / Equity (%)15.3915.1211.7210.5215.26ROCE (%)14.8914.7011.9910.919.28Return On Assets (%)3.963.843.162.703.72Liquidity RatiosCurrent Ratio (X)1.211.231.371.311.42Quick Ratio (X)1.181.201.331.271.38Leverage RatiosDebt to Equity (x)1.331.321.331.501.73Interest Coverage Ratios (X)9.177.807.386.554.13Turnover RatiosAsset Turnover Ratio (%)0.710.660.450.4243.68Inventory Turnover Ratio (X)3.872.892.812.8123.36Growth Ratios3 Yr CAGR Sales (%)27.8227.5212.277.596.593 Yr CAGR Net Profit (%)31.1082.6111.433.17-25.62Valuation RatiosP/E (x)31.9340.0629.0528.6417.20P/B (x)4.926.013.413.012.63EV/EBITDA (x)19.7822.9217.5017.8617.20P/S (x)1.882.351.661.591.47Larsen & Toubro announced a final dividend of Rs 34 per share with ex-date as May 08, 2025. The company had announced a bonus issue on May 29, 2017, with an existing ratio of 2:1 and an ex-bonus date of July 13, 2017. With the stock's last traded price at Rs 3,631.10, Larsen & Toubro has seen a marginal rise from its previous close."
Adani Power shares rise 2.04% in Thursday's session,https://www.moneycontrol.com/news/business/stocks/adani-power-shares-rise-2-04-in-thursday-s-session-alpha-article-13414850.html,"Shares of Adani Power gained 2.04% to trade at Rs 579.05 in Thursday's session. The stock displayed positive movement, reflecting a rise from its previous close. Adani Power is included as one of the stocks in the benchmark NIFTY NEXT 50 index. Recent Financial Performance: Adani Power's recent financial performance showcases a mix of quarterly and annual results. The following tables provide a detailed overview of the company's revenue, net profit, and other key financial metrics. Consolidated Quarterly Results: The consolidated quarterly results highlight the company's performance over the last five quarters.HeadingJun 2024Sep 2024Dec 2024Mar 2025Jun 2025RevenueRs 14,955.63 CroreRs 13,338.88 CroreRs 13,671.18 CroreRs 14,237.40 CroreRs 14,109.15 CroreNet ProfitRs 3,912.79 CroreRs 3,297.52 CroreRs 2,940.07 CroreRs 2,599.23 CroreRs 3,305.13 CroreEPS9.728.217.676.628.62In the quarter ending June 2025, Adani Power reported a revenue of Rs 14,109.15 Crore and a net profit of Rs 3,305.13 Crore. Revenue decreased by 5.66% from Rs 14,955.63 Crore in June 2024. The net profit also saw a decrease from Rs 3,912.79 Crore in June 2024. Consolidated Yearly Results: The consolidated yearly results provide an overview of Adani Power's financial performance over the past five years.Heading20212022202320242025RevenueRs 26,221.48 CroreRs 27,711.18 CroreRs 38,773.30 CroreRs 50,351.25 CroreRs 56,203.09 CroreNet ProfitRs 1,269.98 CroreRs 4,911.58 CroreRs 10,726.64 CroreRs 20,828.79 CroreRs 12,749.61 CroreEPS0.069.6324.5751.6232.32BVPS1.2914.2342.5692.26138.17ROE255.2289.4865.3558.5324.27Debt to Equity99.588.862.560.960.71Adani Power reported a revenue of Rs 56,203.09 Crore for the year ending March 2025, compared to Rs 50,351.25 Crore for the year ending March 2024, representing an increase of 11.62%. The net profit for the year ending March 2025 was Rs 12,749.61 Crore, while in 2024 net profit was Rs 20,828.79 Crore. Consolidated Yearly Income Statement:Mar 2025Mar 2024Mar 2023Mar 2022Mar 2021SalesRs 56,203 CroreRs 50,351 CroreRs 38,773 CroreRs 27,711 CroreRs 26,221 CroreOther IncomeRs 2,702 CroreRs 9,930 CroreRs 4,267 CroreRs 3,975 CroreRs 1,928 CroreTotal IncomeRs 58,905 CroreRs 60,281 CroreRs 43,040 CroreRs 31,686 CroreRs 28,149 CroreTotal ExpenditureRs 39,206 CroreRs 36,101 CroreRs 32,032 CroreRs 21,014 CroreRs 20,754 CroreEBITRs 19,699 CroreRs 24,179 CroreRs 11,008 CroreRs 10,671 CroreRs 7,395 CroreInterestRs 3,339 CroreRs 3,388 CroreRs 3,333 CroreRs 4,094 CroreRs 5,106 CroreTaxRs 3,609 CroreRs -37 CroreRs -3,051 CroreRs 1,665 CroreRs 1,018 CroreNet ProfitRs 12,749 CroreRs 20,828 CroreRs 10,726 CroreRs 4,911 CroreRs 1,269 CroreConsolidated Quarterly Income Statement:Jun 2025Mar 2025Dec 2024Sep 2024Jun 2024SalesRs 14,109 CroreRs 14,237 CroreRs 13,671 CroreRs 13,338 CroreRs 14,955 CroreOther IncomeRs 464 CroreRs 298 CroreRs 1,162 CroreRs 723 CroreRs 518 CroreTotal IncomeRs 14,573 CroreRs 14,535 CroreRs 14,833 CroreRs 14,062 CroreRs 15,473 CroreTotal ExpenditureRs 9,512 CroreRs 10,509 CroreRs 9,818 CroreRs 9,121 CroreRs 9,756 CroreEBITRs 5,061 CroreRs 4,026 CroreRs 5,015 CroreRs 4,940 CroreRs 5,717 CroreInterestRs 856 CroreRs 764 CroreRs 956 CroreRs 806 CroreRs 811 CroreTaxRs 899 CroreRs 662 CroreRs 1,118 CroreRs 836 CroreRs 992 CroreNet ProfitRs 3,305 CroreRs 2,599 CroreRs 2,940 CroreRs 3,297 CroreRs 3,912 CroreCash Flow:Mar 2025Mar 2024Mar 2023Mar 2022Mar 2021Operating ActivitiesRs 21,501 CroreRs 14,170 CroreRs 8,430 CroreRs 10,232 CroreRs 7,014 CroreInvesting ActivitiesRs -17,142 CroreRs 3,485 CroreRs 1,544 CroreRs 572 CroreRs -2,187 CroreFinancing ActivitiesRs -5,175 CroreRs -16,864 CroreRs -10,408 CroreRs -10,337 CroreRs -5,654 CroreOthersRs 0 CroreRs -4 CroreRs 0 CroreRs 202 CroreRs 0 CroreNet Cash FlowRs -816 CroreRs 787 CroreRs -433 CroreRs 669 CroreRs -828 CroreBalance Sheet:Mar 2025Mar 2024Mar 2023Mar 2022Mar 2021Equities & LiabilitiesShare CapitalRs 4,374 CroreRs 4,041 CroreRs 4,025 CroreRs 4,011 CroreRs 3,945 CroreReserves & SurplusRs 49,433 CroreRs 31,726 CroreRs 12,557 CroreRs 1,631 CroreRs -3,359 CroreCurrent LiabilitiesRs 16,440 CroreRs 15,788 CroreRs 17,744 CroreRs 17,143 CroreRs 18,456 CroreOther LiabilitiesRs 42,668 CroreRs 40,768 CroreRs 51,493 CroreRs 59,194 CroreRs 59,492 CroreTotal LiabilitiesRs 112,917 CroreRs 92,324 CroreRs 85,821 CroreRs 81,981 CroreRs 78,535 CroreAssetsFixed AssetsRs 81,197 CroreRs 63,750 CroreRs 64,140 CroreRs 63,353 CroreRs 59,100 CroreCurrent AssetsRs 26,329 CroreRs 25,586 CroreRs 19,553 CroreRs 16,228 CroreRs 17,371 CroreOther AssetsRs 5,390 CroreRs 2,987 CroreRs 2,127 CroreRs 2,399 CroreRs 2,063 CroreTotal AssetsRs 112,917 CroreRs 92,324 CroreRs 85,821 CroreRs 81,981 CroreRs 78,535 CroreOther InfoContingent LiabilitiesRs 41,266 CroreRs 18,863 CroreRs 10,353 CroreRs 3,664 CroreRs 6,095 CroreKey Financial Ratios:Mar 2025Mar 2024Mar 2023Mar 2022Mar 2021Per Share RatiosBasic EPS (Rs.)32.3251.6224.579.630.06Diluted Eps (Rs.)32.3251.6224.579.630.06Book Value /Share (Rs.)138.1792.2642.5614.231.29Dividend/Share (Rs.)0.000.000.000.000.00Face Value1010101010Margin RatiosGross Profit Margin (%)42.7155.8236.9149.7640.41Operating Margin (%)35.0548.0228.3938.5128.20Net Profit Margin (%)22.6841.3627.6617.724.84Return RatiosReturn on Networth / Equity (%)24.2758.5365.3589.48255.22ROCE (%)20.4131.5916.1716.4512.30Return On Assets (%)11.4522.5612.495.991.61Liquidity RatiosCurrent Ratio (X)1.601.621.100.950.94Quick Ratio (X)1.401.360.930.810.83Leverage RatiosDebt to Equity (x)0.710.962.568.8699.58Interest Coverage Ratios (X)7.198.304.293.371.45Turnover RatiosAsset Turnover Ratio (%)0.550.570.460.3733.38Inventory Turnover Ratio (X)0.000.000.000.0012.95Growth Ratios3 Yr CAGR Sales (%)42.4138.5721.037.7113.643 Yr CAGR Net Profit (%)61.12304.98117.15123.37-21.74Valuation RatiosP/E (x)15.7610.347.8019.221417.50P/B (x)3.695.784.5013.0065.93EV/EBITDA (x)9.588.297.988.547.63P/S (x)3.494.091.912.581.25Corporate Actions:Adani Power Limited has received a Letter of Intent for a 2400 MW Thermal Power Project, as announced on August 7, 2025.The company also announced a newspaper publication on August 5, 2025.Stock Splits:On August 1, 2025, Adani Power announced a stock split with the old face value of Rs 10 being split into a new face value of Rs 2. The ex-split date and record date are not available.Moneycontrol analysis on July 31, 2025, indicated a bullish sentiment for Adani Power. With the stock's last traded price at Rs 579.05, Adani Power has shown a positive movement in today's session."
Accumulate Bharti Airtel; target of Rs 2090: Prabhudas Lilladher,https://www.moneycontrol.com/news/business/stocks/accumulate-bharti-airtel-target-of-rs-2090-prabhudas-lilladher-13413923.html,"Prabhudas Lilladher's research report on Bharti Airtel Bharti reported consol EBITDA of Rs278bn (+41.3% YoY, +3.1% QoQ; PLe: Rs258bn, BBGe: Rs279.8bn). Adj PAT came in at Rs59.5bn (+73.3% YoY; -46.7% QoQ, PLe: Rs61bn, BBGe: Rs56.6bn). India mobile revenue stood at Rs274bn, +21.6% YoY and +2.9%QoQ with a stable EBITDA margin of 59.4%. ARPU improved marginally to Rs250 from Rs245 in previous quarter with a net subscriber addition of 1.2mn in Q1. Home services (fixed line + broadband) rev witnessed growth of 25.7% YoY and 7.6% QoQ. Digital services rev witnessed degrowth of 1.8% YoY and 0.2% QoQ. Airtel segment rev degrew 7.7% YoY and 4.9% QoQ. Africa rev grew 22.4% YoY and 7.4% QoQ. Outlook We remain optimistic on the India business and continue to maintain ‘Accumulate’ rating with a TP of Rs2,090 (earlier Rs2,148) based on 13x FY27 EV/EBITDA for India business and adding the value of its investments in Airtel Africa, Indus Towers and Bharti Hexacom. For all recommendations report, click here Disclaimer: The views and investment tips expressed by investment experts/broking houses/rating agencies on moneycontrol.com are their own, and not that of the website or its management. Moneycontrol.com advises users to check with certified experts before taking any investment decisions. Bharti Airtel - 07082025 - prabhu"
Accumulate Avalon Technologies; target of Rs 943: Prabhudas Lilladher,https://www.moneycontrol.com/news/business/stocks/accumulate-avalon-technologies-target-of-rs-943-prabhudas-lilladher-13413922.html,"Prabhudas Lilladher's research report on Avalon Technologies Avalon Technologies (AVALON IN) has reported strong revenue growth of 62.1% YoY mainly driven from Mobility/Industrial segments (grew by ~92%/85% YoY). EBITDA margin expanded by healthy ~710bps YoY to 9.2%, attributed to a favorable segment mix (Mobility/industrials contributes 26%/32% to the revenue) with increased US manufacturing (reached 20% of revenue). AVALON has upward revised its guidance from 18-20% to 23-25% growth in topline for FY26, while maintaining GM at 33-35%. We estimate FY25- 27E revenue/EBITDA/PAT CAGR of 30.5%/38.6%/47.2%, with EBITDA margin expansion of ~130bps. Outlook We maintain our ‘Accumulate’ rating with a TP of Rs 943 (earlier Rs 927) valuing at 45x FY27 earnings, with healthy performance in Q1FY26. We have revised our FY26/FY27 EPS estimates upward by 0.8%/1.8% to reflect stronger earnings in the quarter. For all recommendations report, click here Disclaimer: The views and investment tips expressed by investment experts/broking houses/rating agencies on moneycontrol.com are their own, and not that of the website or its management. Moneycontrol.com advises users to check with certified experts before taking any investment decisions. Avalon Technologies - 07082025 - prabhu"
Accumulate Divis Laboratories; target of Rs 6550: Prabhudas Lilladher,https://www.moneycontrol.com/news/business/stocks/accumulate-divis-laboratories-target-of-rs-6550-prabhudas-lilladher-13413918.html,"Prabhudas Lilladher's research report on Divis Laboratories Divi’s Laboratories (DIVI) Q1FY26 EBITDA was 4% below our estimates led by lower margins despite higher CS revenues. We expect margins to improve, led by better product mix and stable raw material prices. Mgmt. suggested that moderation of raw material prices, increasing RFP’s and commencement of some CDMO and contrast media contracts, will continue to aid revenues and margins. Our FY26E/FY27E EPS estimates stand marginally reduced by 3-4%. We expect 20% EBITDA CAGR and 12% PAT CAGR over FY25-27E. Outlook At CMP, stock is trading at 52x FY27E EPS. We Maintain our ‘Accumulate’ rating with revised TP of Rs6,550/share, valuing at 55x FY27E EPS. For all recommendations report, click here Disclaimer: The views and investment tips expressed by investment experts/broking houses/rating agencies on moneycontrol.com are their own, and not that of the website or its management. Moneycontrol.com advises users to check with certified experts before taking any investment decisions. Divis Laboratories - 07082025 - prabhu"
