title,link,content
Infosys share price falls nearly 1% in morning trade,https://www.moneycontrol.com/news/business/stocks/infosys-share-price-falls-nearly-1-in-morning-trade-2-alpha-article-13421741.html,"Shares of Infosys declined by 0.98% to Rs 1,422.80 in Friday's morning trade on the NSE, as of 11:00 am. Infosys's financial performance shows consistent growth in revenue and net profit over the years. Here's a summary of the company's consolidated financial results: Consolidated Revenue (Annual)YearRevenue (Rs Crore)2021Rs 100,472.00 Crore2022Rs 121,641.00 Crore2023Rs 146,767.00 Crore2024Rs 153,670.00 Crore2025Rs 162,990.00 CroreThe annual revenue has increased steadily, with a notable rise from Rs 100,472.00 Crore in 2021 to Rs 162,990.00 Crore in 2025. Consolidated Net Profit (Annual)YearNet Profit (Rs Crore)2021Rs 19,423.00 Crore2022Rs 22,146.00 Crore2023Rs 24,108.00 Crore2024Rs 26,248.00 Crore2025Rs 26,750.00 CroreThe net profit also shows a consistent increase, from Rs 19,423.00 Crore in 2021 to Rs 26,750.00 Crore in 2025. Consolidated EPS (Annual)YearEPS202145.61202252.52202357.63202463.39202564.50The Earnings Per Share (EPS) has grown from Rs 45.61 in 2021 to Rs 64.50 in 2025. Consolidated Revenue (Quarterly)QuarterRevenue (Rs Crore)Jun 2024Rs 39,315.00 CroreSep 2024Rs 40,986.00 CroreDec 2024Rs 41,764.00 CroreMar 2025Rs 40,925.00 CroreJun 2025Rs 42,279.00 CroreQuarterly revenue shows a growth trend with a recent increase to Rs 42,279.00 Crore in June 2025 from Rs 39,315.00 Crore in June 2024. Consolidated Net Profit (Quarterly)QuarterNet Profit (Rs Crore)Jun 2024Rs 6,374.00 CroreSep 2024Rs 6,516.00 CroreDec 2024Rs 6,822.00 CroreMar 2025Rs 7,038.00 CroreJun 2025Rs 6,924.00 CroreQuarterly net profit also reflects growth, with Rs 6,924.00 Crore in June 2025 compared to Rs 6,374.00 Crore in June 2024. Consolidated EPS (Quarterly)QuarterEPSJun 202415.38Sep 202415.71Dec 202416.43Mar 202516.98Jun 202516.70Infosys announced a final dividend of Rs 22 per share (440%) with effect from May 30, 2025. Moneycontrol's analysis indicates very bearish sentiment on the stock as of August 8, 2025."
"Hindustan Petroleum Corp shares rise 2.10%, among top midcap gainers in Friday's trading session",https://www.moneycontrol.com/news/business/stocks/hindustan-petroleum-corp-shares-rise-2-10-among-top-midcap-gainers-in-friday-s-trading-session-alpha-article-13421755.html,"Shares of Hindustan Petroleum Corporation gained 2.10% in Friday's trading session, with the stock currently priced at Rs 410.85. The stock displayed positive movement, reflecting a rise from its previous close. At 11:17 am, the stock is trading among the top gainers on the Nifty Midcap 150 index. Financial Performance: Consolidated Quarterly Performance: Hindustan Petroleum Corporation's consolidated quarterly revenue and net profit are detailed below:HeadingJun 2024Sep 2024Dec 2024Mar 2025Jun 2025RevenueRs 113,888.28 CroreRs 99,977.12 CroreRs 110,607.97 CroreRs 109,632.80 CroreRs 110,825.33 CroreNet ProfitRs 245.86 CroreRs 534.69 CroreRs 3,008.15 CroreRs 3,066.59 CroreRs 4,222.21 CroreEPS2.980.6711.9516.0619.32The revenue for the quarter-ending June 2025 stood at Rs 110,825.33 Crore, compared to Rs 109,632.80 Crore for the quarter-ending March 2025. The net profit for the quarter-ending June 2025 was Rs 4,222.21 Crore, up from Rs 3,066.59 Crore in the previous quarter. Consolidated Yearly Performance: The company's consolidated yearly financial performance is as follows:Heading20212022202320242025RevenueRs 233,248.45 CroreRs 349,913.18 CroreRs 440,709.25 CroreRs 433,856.51 CroreRs 434,106.17 CroreNet ProfitRs 10,524.23 CroreRs 5,836.18 Crore-Rs 9,471.74 CroreRs 14,206.63 CroreRs 6,855.29 CroreEPS70.5751.36-49.21112.8931.66BVPS262.19291.80227.38330.68240.32ROE28.0017.61-21.6334.1313.16Debt to Equity1.121.092.081.341.30The annual revenue for the year-ending March 2025 increased to Rs 434,106.17 Crore from Rs 433,856.51 Crore in the year-ending March 2024. Net profit for the year-ending March 2025 stood at Rs 6,855.29 Crore, compared to Rs 14,206.63 Crore in the previous year. Consolidated Yearly Income Statement:Mar 2025Mar 2024Mar 2023Mar 2022Mar 2021SalesRs 434,106 CroreRs 433,856 CroreRs 440,709 CroreRs 349,913 CroreRs 233,248 CroreOther IncomeRs 2,087 CroreRs 1,916 CroreRs 1,465 CroreRs 2,438 CroreRs 2,643 CroreTotal IncomeRs 436,194 CroreRs 435,773 CroreRs 442,175 CroreRs 352,352 CroreRs 235,892 CroreTotal ExpenditureRs 423,709 CroreRs 414,525 CroreRs 452,476 CroreRs 343,669 CroreRs 220,870 CroreEBITRs 12,484 CroreRs 21,248 Crore-Rs 10,301 CroreRs 8,682 CroreRs 15,021 CroreInterestRs 3,365 CroreRs 2,556 CroreRs 2,174 CroreRs 997 CroreRs 963 CroreTaxRs 2,264 CroreRs 4,485 CroreRs -3,003 CroreRs 1,849 CroreRs 3,534 CroreNet ProfitRs 6,855 CroreRs 14,206 Crore-Rs 9,471 CroreRs 5,836 CroreRs 10,524 CroreConsolidated Quarterly Income Statement:Jun 2025Mar 2025Dec 2024Sep 2024Jun 2024SalesRs 110,825 CroreRs 109,632 CroreRs 110,607 CroreRs 99,977 CroreRs 113,888 CroreOther IncomeRs 507 CroreRs 573 CroreRs 462 CroreRs 506 CroreRs 545 CroreTotal IncomeRs 111,332 CroreRs 110,206 CroreRs 111,070 CroreRs 100,483 CroreRs 114,433 CroreTotal ExpenditureRs 104,857 CroreRs 105,460 CroreRs 106,166 CroreRs 98,798 CroreRs 113,283 CroreEBITRs 6,475 CroreRs 4,745 CroreRs 4,903 CroreRs 1,684 CroreRs 1,150 CroreInterestRs 817 CroreRs 756 CroreRs 930 CroreRs 944 CroreRs 733 CroreTaxRs 1,435 CroreRs 922 CroreRs 965 CroreRs 205 CroreRs 171 CroreNet ProfitRs 4,222 CroreRs 3,066 CroreRs 3,008 CroreRs 534 CroreRs 245 CroreCash Flow: The cash flow data is as follows:Mar 2025Mar 2024Mar 2023Mar 2022Mar 2021Operating ActivitiesRs 14,227 CroreRs 23,851 Crore-Rs 3,466 CroreRs 15,810 CroreRs 17,829 CroreInvesting Activities-Rs 10,556 Crore-Rs 13,019 Crore-Rs 11,383 Crore-Rs 13,744 Crore-Rs 12,278 CroreFinancing Activities-Rs 4,138 Crore-Rs 16,155 CroreRs 16,025 Crore-Rs 2,066 Crore-Rs 4,709 CroreOthersRs 0 CroreRs 0 CroreRs 0 CroreRs 0 CroreRs 0 CroreNet Cash Flow-Rs 467 Crore-Rs 5,322 CroreRs 1,175 CroreRs 0 CroreRs 841 CroreBalance Sheet: The balance sheet data is as follows:Mar 2025Mar 2024Mar 2023Mar 2022Mar 2021Share CapitalRs 2,128 CroreRs 1,418 CroreRs 1,418 CroreRs 1,418 CroreRs 1,452 CroreReserves & SurplusRs 49,016 CroreRs 45,502 CroreRs 30,844 CroreRs 39,985 CroreRs 36,628 CroreCurrent LiabilitiesRs 96,277 CroreRs 86,433 CroreRs 73,865 CroreRs 71,439 CroreRs 62,380 CroreOther LiabilitiesRs 47,322 CroreRs 49,429 CroreRs 55,210 CroreRs 41,784 CroreRs 33,698 CroreTotal LiabilitiesRs 194,744 CroreRs 182,784 CroreRs 161,339 CroreRs 154,628 CroreRs 134,159 CroreFixed AssetsRs 103,841 CroreRs 99,535 CroreRs 93,689 CroreRs 86,711 CroreRs 75,926 CroreCurrent AssetsRs 57,704 CroreRs 52,851 CroreRs 43,976 CroreRs 49,749 CroreRs 44,167 CroreOther AssetsRs 33,198 CroreRs 30,397 CroreRs 23,673 CroreRs 18,166 CroreRs 14,066 CroreTotal AssetsRs 194,744 CroreRs 182,784 CroreRs 161,339 CroreRs 154,628 CroreRs 134,159 CroreContingent LiabilitiesRs 27,447 CroreRs 32,464 CroreRs 45,450 CroreRs 52,006 CroreRs 49,342 CroreFinancial Ratios: Key financial ratios for Hindustan Petroleum Corporation:RatioMar 2025Mar 2024Mar 2023Mar 2022Mar 2021Basic EPS (Rs.)31.66112.89-49.2151.3670.57Diluted EPS (Rs.)31.66112.89-49.2151.3670.57Book Value / Share (Rs.)240.32330.68227.38291.80262.19Dividend/Share (Rs.)10.5031.500.0014.0022.75Face Value1010101010Gross Profit Margin (%)4.296.18-1.303.627.99Operating Margin (%)2.874.89-2.332.486.44Net Profit Margin (%)1.573.27-2.141.664.51Return on Networth (%)13.1634.13-21.6317.6128.00ROCE (%)12.6722.05-11.7710.4320.92Return On Assets (%)3.458.76-4.324.717.94Current Ratio (X)0.600.610.600.700.71Quick Ratio (X)0.200.220.190.200.25Debt to Equity (x)1.301.342.081.091.12Interest Coverage Ratios (X)5.5410.50-2.6412.7215.59Asset Turnover Ratio (%)2.302.522.792.46173.85Inventory Turnover Ratio (X)11.973.983.792.178.113 Yr CAGR Sales (%)11.3836.3827.9812.703.083 Yr CAGR Net Profit (%)8.3816.1974.880.6533.60P/E (x)11.382.81-3.213.502.22P/B (x)1.501.441.040.920.89EV/EBITDA (x)7.664.84-17.416.544.08P/S (x)0.180.160.080.110.15Corporate Actions: Hindustan Petroleum Corporation announced a final dividend of Rs 10.50 per share (105%) with an effective date of August 14, 2025. The company had previously announced a bonus issue on May 9, 2024, with an ex-bonus date of June 21, 2024, in the ratio of 1:2. The company also made several announcements under Regulation 30 (LODR), including an investor presentation and the unaudited financial results for the quarter ended June 30, 2025. Moneycontrol analysis indicates bearish sentiment on the stock."
Tata Consultancy Services shares fall marginally; over 11.7 lakh shares traded,https://www.moneycontrol.com/news/business/stocks/tata-consultancy-services-shares-fall-marginally-over-11-7-lakh-shares-traded-alpha-article-13421769.html,"Tata Consultancy Services shares traded at Rs 3,043.10, a marginal decline of 0.13% in Friday's session. A total of 1,174,743 shares were traded on NSE as of 11.20 am. The stock is part of the Nifty 50 index.Financial SnapshotHere's a look at the key financial highlights for Tata Consultancy Services:Consolidated Quarterly Results:HeadingJun 2024Sep 2024Dec 2024Mar 2025Jun 2025RevenueRs 62,613.00 CroreRs 64,259.00 CroreRs 63,973.00 CroreRs 64,479.00 CroreRs 63,437.00 CroreNet ProfitRs 12,105.00 CroreRs 11,955.00 CroreRs 12,444.00 CroreRs 12,293.00 CroreRs 12,819.00 CroreEPS33.2832.9234.2133.7935.27The revenue for Tata Consultancy Services has shown a fluctuating pattern over the last five quarters, with a high of Rs 64,479.00 Crore in March 2025 and a recent value of Rs 63,437.00 Crore in June 2025. Net profit also varied, peaking at Rs 12,819.00 Crore in June 2025. Earnings per share (EPS) followed a similar trend, reaching Rs 35.27 in the quarter ending June 2025.Consolidated Yearly Results:Heading20212022202320242025RevenueRs 164,177.00 CroreRs 191,754.00 CroreRs 225,458.00 CroreRs 240,893.00 CroreRs 255,324.00 CroreNet ProfitRs 32,562.00 CroreRs 38,449.00 CroreRs 42,303.00 CroreRs 46,099.00 CroreRs 48,797.00 CroreEPS86.71103.62115.19125.88134.19BVPS235.43245.48249.20252.26261.76ROE37.5242.9946.6150.7351.24Debt to Equity0.000.000.000.000.00The annual financial performance of Tata Consultancy Services reveals consistent growth. Revenue increased steadily from Rs 164,177.00 Crore in 2021 to Rs 255,324.00 Crore in 2025. Net profit also rose, from Rs 32,562.00 Crore in 2021 to Rs 48,797.00 Crore in 2025. The Earnings Per Share (EPS) has grown from 86.71 in 2021 to 134.19 in 2025.Income Statement - Yearly (Consolidated):Mar 2025Mar 2024Mar 2023Mar 2022Mar 2021SalesRs 255,324 CroreRs 240,893 CroreRs 225,458 CroreRs 191,754 CroreRs 164,177 CroreOther IncomeRs 3,962 CroreRs 4,422 CroreRs 3,449 CroreRs 4,018 CroreRs 3,134 CroreTotal IncomeRs 259,286 CroreRs 245,315 CroreRs 228,907 CroreRs 195,772 CroreRs 167,311 CroreTotal ExpenditureRs 193,159 CroreRs 182,540 CroreRs 171,221 CroreRs 143,301 CroreRs 122,914 CroreEBITRs 66,127 CroreRs 62,775 CroreRs 57,686 CroreRs 52,471 CroreRs 44,397 CroreInterestRs 796 CroreRs 778 CroreRs 779 CroreRs 784 CroreRs 637 CroreTaxRs 16,534 CroreRs 15,898 CroreRs 14,604 CroreRs 13,238 CroreRs 11,198 CroreNet ProfitRs 48,797 CroreRs 46,099 CroreRs 42,303 CroreRs 38,449 CroreRs 32,562 CroreThe sales saw an increase of approximately 6 percent in 2025 compared to 2024. The total expenditure has also increased from Rs 182,540 Crore in 2024 to Rs 193,159 Crore in 2025.Income Statement - Quarterly (Consolidated):Jun 2025Mar 2025Dec 2024Sep 2024Jun 2024SalesRs 63,437 CroreRs 64,479 CroreRs 63,973 CroreRs 64,259 CroreRs 62,613 CroreOther IncomeRs 1,660 CroreRs 1,028 CroreRs 1,243 CroreRs 729 CroreRs 962 CroreTotal IncomeRs 65,097 CroreRs 65,507 CroreRs 65,216 CroreRs 64,988 CroreRs 63,575 CroreTotal ExpenditureRs 47,923 CroreRs 48,878 CroreRs 48,316 CroreRs 48,794 CroreRs 47,171 CroreEBITRs 17,174 CroreRs 16,629 CroreRs 16,900 CroreRs 16,194 CroreRs 16,404 CroreInterestRs 195 CroreRs 227 CroreRs 234 CroreRs 162 CroreRs 173 CroreTaxRs 4,160 CroreRs 4,109 CroreRs 4,222 CroreRs 4,077 CroreRs 4,126 CroreNet ProfitRs 12,819 CroreRs 12,293 CroreRs 12,444 CroreRs 11,955 CroreRs 12,105 CroreCash Flow:Mar 2025Mar 2024Mar 2023Mar 2022Mar 2021Operating ActivitiesRs 48,908 CroreRs 44,338 CroreRs 41,965 CroreRs 39,949 CroreRs 38,802 CroreInvesting ActivitiesRs -2,318 CroreRs 6,026 CroreRs 39 CroreRs -897 CroreRs -8,129 CroreFinancing ActivitiesRs -47,438 CroreRs -48,536 CroreRs -47,878 CroreRs -33,581 CroreRs -32,634 CroreOthersRs 174 CroreRs 65 CroreRs 509 CroreRs 159 CroreRs 173 CroreNet Cash FlowRs -674 CroreRs 1,893 CroreRs -5,365 CroreRs 5,630 CroreRs -1,788 CroreBalance Sheet:Mar 2025Mar 2024Mar 2023Mar 2022Mar 2021Share CapitalRs 362 CroreRs 362 CroreRs 366 CroreRs 366 CroreRs 370 CroreReserves & SurplusRs 94,394 CroreRs 90,127 CroreRs 90,058 CroreRs 88,773 CroreRs 86,063 CroreCurrent LiabilitiesRs 53,001 CroreRs 46,104 CroreRs 43,558 CroreRs 42,351 CroreRs 34,155 CroreOther LiabilitiesRs 11,872 CroreRs 9,856 CroreRs 9,669 CroreRs 10,024 CroreRs 10,171 CroreTotal LiabilitiesRs 159,629 CroreRs 146,449 CroreRs 143,651 CroreRs 141,514 CroreRs 130,759 CroreFixed AssetsRs 22,739 CroreRs 19,336 CroreRs 19,891 CroreRs 20,716 CroreRs 20,149 CroreCurrent AssetsRs 123,012 CroreRs 112,984 CroreRs 110,270 CroreRs 108,310 CroreRs 99,280 CroreOther AssetsRs 13,878 CroreRs 14,129 CroreRs 13,490 CroreRs 12,488 CroreRs 11,330 CroreTotal AssetsRs 159,629 CroreRs 146,449 CroreRs 143,651 CroreRs 141,514 CroreRs 130,759 CroreContingent LiabilitiesRs 4,009 CroreRs 3,419 CroreRs 2,388 CroreRs 2,298 CroreRs 1,821 CroreKey Financial RatiosMar 2025Mar 2024Mar 2023Mar 2022Mar 2021Basic EPS (Rs.)134.19125.88115.19103.6286.71Diluted Eps (Rs.)134.19125.88115.19103.6286.71Book Value [Excl. Reval Reserve]/Share (Rs.)261.76252.26249.20245.48235.43Dividend/Share (Rs.)126.0073.00115.0043.0038.00Face Value11111Gross Profit Margin (%)27.9528.5227.8129.7630.26Operating Margin (%)25.8926.4525.5827.3627.78Net Profit Margin (%)19.1119.1318.7620.0519.83Return on Networth / Equity (%)51.2450.7346.6142.9937.52ROCE (%)62.0163.5157.6352.9147.21Return On Assets (%)30.4131.3429.3327.0824.80Current Ratio (X)2.322.452.532.562.91Quick Ratio (X)2.322.452.532.562.91Debt to Equity (x)0.000.000.000.000.00Interest Coverage Ratios (X)89.6688.3380.5072.8077.99Asset Turnover Ratio (%)1.671.661.581.411.18Inventory Turnover Ratio (X)0.000.000.000.000.003 Yr CAGR Sales (%)15.3921.1319.8514.4215.483 Yr CAGR Net Profit (%)12.6618.9814.1810.3712.17P/E (x)26.8730.7927.8336.0936.65P/B (x)13.7715.5412.9815.3513.60EV/EBITDA (x)18.0820.2818.5523.6723.49P/S (x)5.115.845.207.147.16Corporate ActionsTata Consultancy Services (TCS) has been actively involved in several corporate actions. Recent announcements include:Partnership Extension: TCS extended its partnership with Weatherford International to enable AI-driven business transformation (August 5, 2025).Analyst/Investor Meet: Schedule of Analyst/Institutional Investor Meetings (July 31, 2025).Brand Ranking: TCS ranked among the top 20 global technology brands in the Brand Finance Tech 100 2025 list (July 17, 2025).Dividends:The company has announced several dividends:Interim Dividend: Rs.11.00 per share (1100%) Third Interim Dividend, effective date: July 16, 2025, announced on June 27, 2025.Final Dividend: Rs.30.00 per share (3000%) Final Dividend, effective date: June 04, 2025, announced on April 11, 2025.Special Dividend: Rs.66.00 per share (6600%) Special Dividend, effective date: January 17, 2025, announced on January 09, 2025.Interim Dividend: Rs.10.00 per share (1000%) Third Interim Dividend, effective date: January 17, 2025, announced on December 31, 2024.Interim Dividend: Rs.10.00 per share (1000%) Second Interim Dividend, effective date: October 18, 2024, announced on September 30, 2024.Bonus History:TCS has a history of issuing bonus shares:Bonus Ratio 1:1: Ex-Bonus Date: May 31, 2018, Record Date: June 02, 2018, Announcement Date: April 19, 2018.Bonus Ratio 1:1: Ex-Bonus Date: June 16, 2009, Record Date: June 17, 2009, Announcement Date: April 20, 2009.Bonus Ratio 1:1: Ex-Bonus Date: July 28, 2006, Record Date: July 31, 2006, Announcement Date: April 17, 2006.In conclusion, Tata Consultancy Services shares experienced a marginal decline in today's trading session, with significant trading volume. The company has demonstrated consistent financial growth and has a history of corporate actions aimed at rewarding shareholders. In conclusion, Tata Consultancy Services shares experienced a marginal decline in today's trading session, with significant trading volume."
Hindustan Unilever share price falls 0.62% in morning trade,https://www.moneycontrol.com/news/business/stocks/hindustan-unilever-share-price-falls-0-62-in-morning-trade-alpha-article-13421720.html,"Shares of Hindustan Unilever were trading down by 0.62 percent at Rs 2,501.80 on the NSE at 11:00 am on Friday. The stock is part of the Nifty 50 index and the decline reflects a change of Rs -15.70 from its previous close.Financial SnapshotHere is a summary of Hindustan Unilever's recent financial performance:Consolidated Quarterly ResultsHeadingJun 2024Sep 2024Dec 2024Mar 2025Jun 2025RevenueRs 15,707.00 CroreRs 15,926.00 CroreRs 15,818.00 CroreRs 15,670.00 CroreRs 16,514.00 CroreNet ProfitRs 2,614.00 CroreRs 2,601.00 CroreRs 2,988.00 CroreRs 2,476.00 CroreRs 2,769.00 CroreEPS11.1111.0312.7010.4811.73The revenue for the quarter ending June 2025 stood at Rs 16,514.00 Crore, increased from Rs 15,707.00 Crore in June 2024. The net profit for the same period was Rs 2,769.00 Crore, up from Rs 2,614.00 Crore in June 2024. Earnings per share (EPS) also increased to 11.73 in June 2025 from 11.11 in June 2024.Consolidated Yearly ResultsHeading20212022202320242025RevenueRs 47,028.00 CroreRs 52,446.00 CroreRs 60,580.00 CroreRs 61,896.00 CroreRs 63,121.00 CroreNet ProfitRs 8,000.00 CroreRs 8,887.00 CroreRs 10,145.00 CroreRs 10,286.00 CroreRs 10,679.00 CroreEPS34.0337.7943.0743.7445.32BVPS202.95208.88214.99217.95210.22ROE16.7718.0920.1120.0621.55Debt to Equity0.000.000.000.000.00The annual revenue for the year ending March 2025 was Rs 63,121.00 Crore, reflecting an increase from Rs 61,896.00 Crore in the year ending March 2024. The net profit also increased to Rs 10,679.00 Crore in March 2025 from Rs 10,286.00 Crore in March 2024. The Earnings Per Share (EPS) rose from 43.74 to 45.32 during the same period.Income Statement (Yearly)Mar 2025Mar 2024Mar 2023Mar 2022Mar 2021Sales63,12161,89660,58052,44647,028Other Income1,017811512258410Total Income64,13862,70761,09252,70447,438Total Expenditure49,32048,44347,63240,72436,715EBIT14,81814,26413,46011,98010,723Interest395334114106117Tax3,7443,6443,2012,9872,606Net Profit10,67910,28610,1458,8878,000Income Statement (Quarterly)Jun 2025Mar 2025Dec 2024Sep 2024Jun 2024Sales16,51415,67015,81815,92615,707Other Income201309232219257Total Income16,71515,97916,05016,14515,964Total Expenditure13,28412,53611,95712,48712,340EBIT3,4313,4434,0933,6583,624Interest1278011211093Tax535887993947917Net Profit2,7692,4762,9882,6012,614Cash FlowMar 2025Mar 2024Mar 2023Mar 2022Mar 2021Operating Activities11,88615,4699,9919,0489,163Investing Activities6,473-5,324-1,494-1,728-1,528Financing Activities-13,101-10,034-8,953-8,015-9,309Others001000Net Cash Flow5,258111-446-695-1,674Balance SheetMar 2025Mar 2024Mar 2023Mar 2022Mar 2021Share Capital235235235235235Reserves & Surplus49,16750,98350,06948,82647,439Current Liabilities16,53712,87612,02811,28011,103Other Liabilities13,94114,40510,75510,1769,980Total Liabilities79,88078,49973,08770,51768,757Fixed Assets37,87837,30336,34435,38934,791Current Assets22,05121,32416,99815,52214,217Other Assets19,95119,87219,74519,60619,749Total Assets79,88078,49973,08770,51768,757Contingent Liabilities3,4473,3143,5743,2302,985Key Financial RatiosRatioMar 2021Mar 2022Mar 2023Mar 2024Mar 2025Basic EPS (Rs.)34.0337.7943.0743.7445.32Diluted Eps (Rs.)34.0337.7943.0743.7445.32Book Value [Excl. Reval Reserve]/Share (Rs.)202.95208.88214.99217.95210.22Dividend/Share (Rs.)31.0034.0039.0042.0053.00Face Value11111Gross Profit Margin (%)25.5925.0024.2025.0025.13Operating Margin (%)23.3022.9222.3223.0322.99Net Profit Margin (%)17.0016.9516.7416.6116.91Return on Networth / Equity (%)16.7718.0920.1120.0621.55ROCE (%)19.0120.2922.1421.7222.91Return On Assets (%)11.6212.5913.8413.0913.33Current Ratio (X)1.281.381.411.661.33Quick Ratio (X)0.961.011.061.341.07Debt to Equity (x)0.000.000.000.000.00Interest Coverage Ratios (X)93.69123.73128.6146.3340.17Asset Turnover Ratio (%)68.390.740.830.820.80Inventory Turnover Ratio (X)13.144.254.734.664.613 Yr CAGR Sales (%)15.0215.5123.4014.729.713 Yr CAGR Net Profit (%)23.7421.1022.4713.399.62P/E (x)71.4554.2159.4551.7749.84P/B (x)11.989.8111.9510.4110.75EV/EBITDA (x)47.0936.4240.7233.9733.00P/S (x)12.159.189.938.618.41Corporate ActionsHindustan Unilever has announced several corporate actions, including dividend payouts and bonus issues in the past. The company announced a final dividend of Rs.24.00 per share (2400%) on April 24, 2025, with an effective date of June 23, 2025. Additional announcements include transcripts and audio-video recordings of earnings calls and analyst/investor meetings.Bonus HistoryAnnouncement DateExisting RatioOffered RatioRecord DateEx-Bonus DateBonus Ratio30 Sep, 1991211991-08-2119 Jul, 19911:222 Jun, 1987110000-00-00-1:122 Jun, 1983530000-00-00-3:522 Jun, 1979310000-00-00-1:3Stock Split HistoryAnnounce DateOld FVNew FVEx-Split DateRecord Date2000-07-0510103 Jul, 20000000-00-00According to Moneycontrol analysis, the current sentiment for Hindustan Unilever is bullish. With the stock currently trading at Rs 2,501.80, Hindustan Unilever reflects a slight downturn in today's session."
Larsen & Toubro among top gainers on Nifty 50 in Friday's session today,https://www.moneycontrol.com/news/business/stocks/larsen-toubro-among-top-gainers-on-nifty-50-in-friday-s-session-today-alpha-article-13421692.html,"Shares of Larsen & Toubro were trading at Rs 3,641.50 in Friday's session, with a marginal gain of 0.1%, which pushed the stock among the top gainers on the Nifty 50 index at 11:10 am. On the financial front, Larsen & Toubro reported consolidated revenue of Rs 63,678.92 Crore for the quarter-ending June 2025, compared to Rs 55,119.82 Crore in the quarter-ending June 2024. The company's net profit for the same period was Rs 4,325.57 Crore, up from Rs 3,440.11 Crore year-over-year. The EPS stood at Rs 26.30 in June 2025, compared to Rs 20.26 in June 2024. The company's consolidated yearly revenue increased from Rs 221,112.91 Crore in 2024 to Rs 255,734.45 Crore in 2025. The net profit rose from Rs 15,569.72 Crore in 2024 to Rs 17,687.39 Crore in 2025. The EPS also increased from Rs 93.96 in 2024 to Rs 109.36 in 2025. Key annual financial indicators:Particulars20212022202320242025RevenueRs 135,979.03 CroreRs 156,521.23 CroreRs 183,340.70 CroreRs 221,112.91 CroreRs 255,734.45 CroreNet ProfitRs 4,668.96 CroreRs 10,291.05 CroreRs 12,624.87 CroreRs 15,569.72 CroreRs 17,687.39 CroreEPSRs 82.49Rs 61.71Rs 74.51Rs 93.96Rs 109.36BVPSRs 625.97Rs 678.79Rs 736.87Rs 746.01Rs 710.12ROE15.2610.5211.7215.1215.39Debt to Equity1.731.501.331.321.33The company's Annual sales increased by 15.65 percent in March 2025 to Rs 255,734 Crore compared to Rs 221,112 Crore in March 2024. The EBIT increased by 11.84 percent in March 2025 to Rs 26,913 Crore compared to Rs 24,062 Crore in March 2024. According to corporate announcements, Larsen & Toubro clarified a news item appearing in Media/Publication on August 6, 2025. The company also announced an Analyst/Investor Meet. The exchange sought clarification from Larsen & Toubro Ltd with reference to the media report appearing on https:// www.thehindubusinessline.com dated August 03, 2025, titled ""L&T terminated Corridor-2, Corridor-4 contracts of Bengaluru suburban rail project illegally: K-RIDE"". The company announced a final dividend of Rs 34 per share(1700%) with effective date as June 03, 2025. Larsen & Toubro had announced a bonus issue on May 29, 2017, with an existing ratio of 2 and offered ratio of 1, with record date as July 14, 2017. Moneycontrol analysis reported a bullish sentiment on Larsen & Toubro as of August 1, 2025. With the stock currently trading among the top gainers on the Nifty 50, Larsen & Toubro exhibits strong market presence driven by robust financial performance and active corporate actions."
